x,y,cluster,term,genes,cluster_label
4.2530923,9.007567,Cluster 5,DPEP1,SUN1 PRAF2 TMUB2 HPCAL1 LMBR1 ALG10 TMEM214 ILVBL RER1 PIGA STEAP2 STEAP3 FASTKD2 ABCB6 NDUFB3 NCAPG NCAPH ENDOD1 GHITM GPAA1 NT5C3 ORC5 RDH11 MDN1 ELOVL5 INTS2 ALG8 TMEM120B C1GALT1 PICK1 ALG6 SLC30A5 MTOR FANCG TBL2 TMEM56 OSTC ACCN2 NCAPD2 VMP1 ZDHHC21 ATL2 UXS1 PIGQ TMEM181 SMC2 TMEM48 FLCN GJA1 HYAL2 ACADS GPR137 ,Unresolved
4.827407,7.901032,Cluster 5,TSNAX,PMF1 STRAP RGPD8 C14ORF145 RGPD5 TSN SMG7 GOLGA3 KIAA0889 C1QTNF9 KIF2A PCNT C13ORF31 MCM3 ,Unresolved
4.9073286,7.2819247,Cluster 5,FAM83D,CSNK1A1 GMNN HMMR NMD3 TRAK2 NPAS1 BACH1 CSNK1D PSMC3 BBS7 POTEB CCDC40 DYNC1I1 ,Unresolved
6.225457,8.368512,Cluster 5,ACTL6A,SS18 CCT3 FEN1 ZRANB2 SMARCC2 CCT2 TCP1 HDGFRP2 RUVBL1 CCT6B CYB5R3 CCT6A HINT1 HIST1H2BA BCL7A BCL7C DPF2 DPF3 RPRD1B RAP1BL ,Unresolved
5.2554984,9.426273,Cluster 5,L3MBTL1,SUPT16H PHF10 CBX2 ZNF281 PPHLN1 ZBTB34 C10ORF18 TP73 NSMCE4A MCM4 ANAPC5 BCOR ANAPC1 MCM2 SATB2 ZNF195 WIZ EHMT1 EHMT2 BRCA2 SALL2 MECOM ZNF644 ZNF324 SAMD11 ,Unresolved
4.7668147,8.813461,Cluster 5,CDC16,JMJD4 IQCB1 PLCH1 MGA IZUMO1 ZNF281 RSBN1 ALG13 YDJC YY1AP1 MLF1 GATAD2B C14ORF80 NCOR1 HOOK3 KIAA1731 ESPL1 HOOK1 TTLL1 ZNF318 MAGIX BCOR DUS3L EIF4E2 DDX11L8 CEP164 TRPS1 C17ORF71 IQGAP3 EIF4ENIF1 MED12 FAM83H C15ORF39 TUBB8 CDC23 FZR1 DHX35 CDC26 CDC27 ALOX5 LONP2 DISC1 SAMD1 CEP97 CSRP2BP GPR156 GTSE1 STIL C3ORF63 ANKHD1-EIF4EBP3 HAUS5 HAUS7 HAUS6 MYO9A ANO6 HAUS3 ASPM TTC8 KIF2B KIAA0586 SNX18 MYO5C MAP7D3 ANAPC4 TRIM37 ANAPC5 ERF TROAP ANAPC7 C16ORF87 ANAPC1 TRIM33 PHLDB3 ANAPC2 MKS1 ANAPC13 ANAPC16 USP54 ALMS1 ZBTB5 KRBA1 PIK3C2A SMG7 RECQL4 SALL2 HAUS8 RAVER1 ZNF408 ZNHIT6 CP110 CEP350 RICTOR ZNF644 ZNF687 BUB1 TRIM24 ,Unresolved
5.665328,7.7565823,Cluster 5,C13orf34,PIGT NXF2 EPHA7 UBE2CBP PLK1 DNAJB11 AARSD1 LYPD4 DNA2 RABGGTB WNT4 TSHR ,Unresolved
5.794925,9.920171,Cluster 5,H2AFY,NAA40 GDI2 ZCRB1 XRCC6 H2AFX HSD3B2 XPC CENPA HIST1H3A HIST1H2BA APLF MYH9 ZNF428 H2AFY2 RBM24 CDK15 HMGN2 ,Unresolved
4.6147695,7.0857677,Cluster 5,PRIM1,NLGN4Y NCAPH2 PRIM2 AKD1 KLHL20 RNF31 C6ORF141 POLA1 POLA2 LIPH OBFC1 DCAF10 RAE1 ,Unresolved
5.768618,8.533116,Cluster 5,HNRPDL,NGRN LARP1 C7ORF30 MRPL19 MRPS35 PABPC4 ERAL1 YARS2 CDKN2AIP PAIP1 SUPV3L1 ,Unresolved
5.507567,8.207942,Cluster 5,NUP153,PPP1CC NXF2 NUP50 G3BP2 TSR1 SREK1IP1 NUSAP1 PPP1CA RAN KPNA2 ,Unresolved
5.3813148,7.776953,Cluster 5,NDC80,PMF1 CCDC68 IFT81 WDYHV1 NSL1 MLF1 ZWINT PPP1CC DSN1 SPC24 CENPC1 FAM170A EXOC1 SYNC SPC25 BUB1 ,Unresolved
5.814855,9.91131,Cluster 5,HIST2H3PS2,CCNYL1 HSPA8 H2AFX CDX1 HSD3B2 WDR76 NASP CENPA COX6B1 P2RY8 HIST1H3A SGOL2 HERC3 RRP7A APLF ZNF428 MACROD1 H2AFY2 CDK15 C13ORF31 ,Unresolved
4.500396,8.732886,Cluster 5,DET1,HSPA8 FOS UBE2E2 UBE2E3 ETV1 UBE2E1 ETV5 COPS5 FOSL2 CUL4B COPS4 CUL4A DDB1 COPS6 RFWD2 COPS3 COPS2 TRIB2 STK40 TRIB1 GPS1 COPS7B COPS7A DDA1 JUNB ,Unresolved
4.8690386,7.1804543,Cluster 5,FAM170A,SPC24 CSNK1A1L CSNK1A1 USP7 VAPA VAPB DGCR14 MIER1 ZNF358 QSER1 SPC25 NDC80 ,Unresolved
4.46453,7.486051,Cluster 5,TRIM44,ZNF761 BBS2 CCDC112 TSPYL1 BBS1 FEM1B C17ORF49 MCRS1 ANKRD30B CCDC15 SPATS2 C2ORF56 ZNF91 TXLNA ZNF92 MYBBP1A TRAF7 SPATS2L TRIM17 EFHA1 RNF187 TRIM10 TRIM11 CCDC151 ZNF254 DDX24 CDCA8 CUL2 TXLNG CBARA1 C12ORF41 FGFRL1 ZMYM1 DACH1 DACH2 TAF1C TAF1D BBX TAF1A GOLGA2 TAF1B TRIM47 SRBD1 BBS9 METTL8 ACAD11 CDK5RAP3 ,Unresolved
6.080775,8.363585,Cluster 5,CCT7,KDM4B ACTR3 TLE4 FBXW4 STRADB FBXW8 TCP1 WDR77 TUBA4A CDC20 CCT6A PDCL3 RAP2C P4HA2 TTLL3 WDR83 KLHL8 PEX7 METAP2 TUBAL3 KATNB1 KLHL33 WDR24 DCAF5 WDR25 DCAF8 DCAF7 ACTR1B TAF1C WDR70 MIOS TBL1Y DNAI2 WDTC1 CCT4 CCT3 CCT2 UTP18 KATNA1 TUBG2 CDC40 HCFC2 DDB2 NEDD1 RFWD2 KLHDC8A ANGPTL7 PPP2R2C RFWD3 KLHDC8B ACTBL2 GNB5 NOL10 PDCL GNB1L DTL WDR5B HDAC3 HDAC1 TSSC1 WDR86 TUBD1 ACTR3B WDR46 RPTOR TUBA1B MLST8 DCAF10 DCAF11 ODF1 TXNDC9 DCAF12 BUB3 DCAF13 POC1A CCT5 SEC31B ,Unresolved
5.4991145,7.976328,Cluster 5,CENPC1,RRP8 NPM1 PMF1 MLF1IP FGL1 MIS12 MKI67IP NDC80 RBM4 DSN1 ACTA2 NUF2 DGCR8 H2AFY2 RPL18 RBM34 ,Unresolved
5.3175826,7.8206167,Cluster 5,KIF2B,FEM1B DAPK3 HOMER1 COMMD3 COMMD1 COMMD2 COMMD8 C4ORF46 COMMD6 SPC24 TXLNA KIF18B SIKE1 CDC16 CCDC22 ASB6 KIF2C C21ORF2 SPC25 ANAPC16 MIS12 TXLNG WDR62 BACH1 KLC1 TMEM164 SAV1 STK3 STK4 KIAA0284 DSN1 KLC4 CDC23 CDC26 CDC27 VPS8 NEK1 ANKRD52 CCDC93 POLR2J CEP170 ,Unresolved
5.296071,8.336246,Cluster 5,FARP2,CHRM3 C17ORF79 TRIM41 PRKCI PTGER3 PRMT5 PRICKLE3 C17ORF85 CCDC88A HERC2 CLNS1A C19ORF21 RIOK1 RPS27A GPR156 ,Unresolved
5.943299,8.339496,Cluster 5,WDFY2,RBM17 DAP3 ERCC6L UTP6 SMCR7L CHERP SLC7A3 MESDC2 U2SURP FIBP DSN1 RUFY1 PALLD NUP54 EFNB1 GPD2 DNTTIP1 ZBED1 KIAA0528 VAMP3 CCDC51 NUPL1 ,Unresolved
4.8555303,8.060962,Cluster 5,TRPV5,YY1 CREB1 RNF138 RPIA ATF1 STAT3 UHRF1 PUS1 NUP35 UBE3A GCLM ,Unresolved
6.4903197,8.252225,Cluster 5,ODF1,CCT4 PSMD11 CCT3 CCT2 TCP1 SPATA20 CCT6B CCT6A PSMD7 NIF3L1 FAM175B PDCL CCT7 CCT5 ,Unresolved
5.4272056,8.554702,Cluster 5,RFC5,RB1 CHTF8 RFC4 RFC2 RFC3 ATAD5 DSCC1 RFC1 RAD17 IL13RA2 CHTF18 ,Unresolved
5.482471,8.49392,Cluster 5,CDKN1B,CKS1B CCNA2 CCND3 CDK7 CDK6 CCND2 CDK5 CCND1 CDK4 CDK3 CDK2 CDK1 CKS2 ,Unresolved
7.078418,7.928275,Cluster 5,LARS,DARS TARSL2 AIMP1 KARS QARS MARS RARS IARS EPRS EEF1E1 SDCCAG8 SDCBP ,Unresolved
5.8088493,9.894326,Cluster 5,PARP2,XRCC6 H2AFX CDX1 CHD1L RPA2 WDR76 RNF146 HIST1H2BA APLF RPA4 SDC1 SDC2 SPIN2B H2AFY2 VSX2 CD44 LHX9 NAA40 CETN1 XPC POLB HIST1H3A ZNF428 MACROD1 HMGN2 ,Unresolved
5.382482,8.723483,Cluster 5,CDK2,CREBBP MAPK15 CDC20 CCNA2 RBL1 GLB1 RBL2 CCNE2 CCNE1 GORASP1 CDK3 CDK1 CKS2 POLR3H CDK5R1 KIAA0528 CDKN3 SMTNL2 PCNA CDKN1B CDKN1C GMNN CDKN1A CCNH CKS1B CUL1 SAMHD1 CCNB2 CCND3 FZR1 CCNB1 CCND2 CCND1 EP300 SKP2 ,Unresolved
4.364175,7.872939,Cluster 5,MED19,MED1 CDK19 MED4 MED9 MED13L MED28 MED27 MED6 MED7 MED8 MED29 MED24 MED23 CDK8 MED26 MED25 MED20 MED22 MED21 CCNC MED17 MED16 MED12L MED18 MED13 MED12 MED15 MED14 POLR2A MED31 MED30 MED11 MED10 ,Unresolved
4.525846,9.159686,Cluster 5,DCAF12,MOV10 CCT3 ZZEF1 XIAP MCMBP PFDN2 BIRC6 YY1AP1 TUBA3C CCT7 BIRC2 GOLIM4 ,Unresolved
8.406089,5.2843513,Cluster 6,C16orf62,HDAC11 BSG COMMD10 FAM45A COMMD3 COMMD4 CCDC22 COMMD1 COMMD2 COMMD8 VPS29 COMMD6 ,Unresolved
7.5461974,8.026064,Cluster 6,GAR1,MAK16 C17ORF79 PRDM5 ZCRB1 PRMT5 GPATCH4 WDR46 WRAP53 SHQ1 SYNCRIP TRA2A DKC1 CLNS1A RPL37A SNRNP70 GSTA1 GEMIN5 RIOK1 HIST1H1E NOP10 ,Unresolved
8.121819,6.646761,Cluster 6,MRPL48,RPL13 MRPL39 MRPS30 MKI67IP MRPL35 MRPL46 MRPL47 MRPL12 MRPL42 MRPL4 MRPL10 MRPL41 MRPL50 RPL18 ,Unresolved
9.035321,7.319037,Cluster 6,CWF19L2,SNRPN TSSC4 FGL1 MAGEE1 ELAVL2 PRPF19 PLRG1 WDR83 SYF2 NEU2 C16ORF57 SNRPF SNRPG SNRPA1 SNRPE PPIE ,Unresolved
8.057879,7.756096,Cluster 6,SNRPA1,NARG2 AQR TOE1 SNUPN SNRPN SF3A2 SF3A3 C2ORF3 BUD31 CRNKL1 CDC40 XAB2 SNW1 SYF2 CWF19L1 CWF19L2 GEMIN5 SNRPF ACIN1 SNRPG SNRPE SF3A1 KIAA0947 SNRPB PPIE SF3B5 SLC4A1AP SF3B3 SF3B4 ISY1 ELL DGCR14 PRKRIP1 PHAX HTATSF1 SNRPD3 SNRPD2 SNRNP70 SNRPD1 TGS1 HIST1H1E CCDC75 SNRPB2 CCDC12 SF3B1 ZC3H14 SF3B2 ,Unresolved
7.498013,5.711007,Cluster 6,UQCRQ,PTGES2 UQCRB SPPL2B COX7A2L COX6B1 UQCRH CST4 CST1 C20ORF70 UQCRC2 UQCRC1 COX1 IGHA2 CYTB IGHA1 ,Unresolved
8.332221,7.4815545,Cluster 6,RPP40,RBM4 MECP2 NPM1 SNRNP70 POP4 RPP30 RBM4B C18ORF21 RPP21 RPP25 VTN ,Unresolved
7.777565,7.9862413,Cluster 6,TRA2A,SNRPN UPF1 PTCD3 PTCD1 NCOA5 MRPS18C MRPS2 MRPS7 LARP7 SRRM1 MRPS6 WDR33 MRPS5 CLK3 SRRM2 CLK2 CLK1 MRPS9 THRAP3 SYF2 PPIG PABPC4 GAPDHS PABPC1 C11ORF57 SRSF8 LUC7L2 RPL26L1 DAP3 MRPS14 YTHDC1 MRPS15 MRPS10 MRPS11 CASC3 ELAVL2 PNN MRPL34 RBBP6 MTERFD1 LUC7L C10ORF2 GAR1 HIST1H2AG APOBEC3D APOBEC3F MRPS25 ZFR MRPS26 MRPS23 MRPS22 CSNK1E C17ORF85 MOV10 MKRN1 TRUB2 ISY1 MEPCE MRPS35 LARP1B MRPS33 U2AF2 MRPS31 PHAX RRP9 NGRN LARP1 SNRNP70 TRA2B ZC3H18 SNIP1 SRSF10 PAIP1 SRSF12 PABPC4L ,Unresolved
8.501982,6.188795,Cluster 6,RPP21,POP7 RPP40 POP5 POP4 RPP30 C9ORF23 POP1 PSMG3 RPP25 RPP14 RPP38 ,Unresolved
8.503194,6.3457575,Cluster 6,RG9MTD3,MRPS27 MRPS28 PTCD3 MRPS25 MRPS26 MRPS23 MRPS24 MRPS21 MRPS18C MRPS18B MRPS2 MRPS7 MRPS5 TUBA8 MRPS9 PTX3 RPL26L1 DAP3 MRPS16 MRPS14 MRPS15 MRPS34 MRPS35 MRPS10 MRPS33 MRPS11 C4ORF14 MRPS31 ,Unresolved
7.564257,5.497911,Cluster 6,NDUFS1,NDUFA8 NDUFB11 NDUFS6 METTL2A FAM19A3 NDUFS3 CCDC120 HOXC9 PML HSFY1 ,Unresolved
8.77971,7.4698114,Cluster 6,PRPF8,SNRPN TSSC4 ECD C2ORF3 DDX23 KIAA1143 C20ORF4 SNRNP40 BSG CD2BP2 SNRPF SNRPG EAPP SNRPE GPR156 ,Unresolved
8.029914,6.7922525,Cluster 6,MRPL1,RPS8 RPL13 MRPL39 MRPL28 MRPS30 CIRBP MRPL47 MRPL42 MRPL4 MRPL10 MRPL41 MRPL50 HNRNPA1 ,Unresolved
7.941547,7.932231,Cluster 6,ZRSR2,RBM17 CDK11B SNRPN ZRSR1 SF3A3 TTC33 ZCRB1 SERPINB8 CHERP JMJD6 SRPK1 SRPK2 U2SURP HAL SNRPF SNRPG SNRNP48 SSX2IP SNRPE SF3A1 RPL26L1 RPL5 SLC4A1AP PDCD7 RNPC3 SPTY2D1 RBM5 TRPM3 ZMAT5 C1QBP CCDC97 CCDC75 SF3B1 SNRNP35 SF3B2 NKTR ,Unresolved
7.3925357,5.737217,Cluster 6,CAMK2B,HAX1 CAMK2D NDUFA8 NUFIP1 LIPH RBM42 ZNF843 TKT C14ORF104 C6ORF141 ,Unresolved
7.9483128,7.542511,Cluster 6,AURKAIP1,MRPS27 PTCD3 CSNK2A1 STRBP NSUN4 MRPS24 MRPS21 MRPS18C MRPS18B MRPS2 NAP1L1 FBXO11 MRPS7 ZFP91 MRPS5 MRPL45 MRPS9 WDR83 DNLZ UBE2O MMADHC DAP3 VPRBP MRPS35 MRS2 MRPS10 MRPS33 MRPS11 C4ORF14 MRPS31 IPO7 HNRNPR MRPL40 NRD1 FNTB ,Unresolved
8.600137,6.0379205,Cluster 6,PSMB3,AKIRIN2 AKIRIN1 PSMB9 C20ORF111 PSMC6 PSMC4 PSMC5 PSMC2 PSMC3 PSMG4 PSMC1 PSMG2 PSMG3 PSMG1 PSMD11 PSMD13 PSMD12 POMP PSMD14 PSMB10 PSMD7 PSMD8 PSMD6 PSMD3 PSMD4 PSMD1 PSMD2 FAM192A FANCB PSMA6 PSMA7 PSMA4 PSMA2 PSMA3 PSME4 PSMA1 PSME2 PSME3 PSME1 RNF181 PSMA8 PSMB7 PSMB5 PSMB6 PSMB4 PSMB1 PSMB2 PSMF1 FBXO7 ,Unresolved
8.417068,5.272106,Cluster 6,COMMD3,SPACA1 COMMD10 COMMD4 COMMD1 COMMD2 COMMD7 JOSD2 COMMD8 COMMD5 COMMD6 FAM167A C16ORF62 KIF2B CTAGE5 CCDC22 TNFSF8 VPS29 CCDC151 TRIM16L FAM45A DSCR3 COMMD9 TMEM206 LAMP3 CNGA3 CCDC93 CD33 IL13RA2 ,Unresolved
7.556149,5.483526,Cluster 6,NDUFV3,PRRT2 NDUFA8 DNAJC30 NDUFB11 YIPF3 C7ORF45 TMX2 NDUFA13 NDUFS7 NDUFS6 NDUFS3 SERINC1 ,Unresolved
7.9529877,6.755375,Cluster 6,MRPS5,MRPS27 PTCD3 ZNF263 RPS8 MRPS26 CCDC59 MRPS23 MRPS18C ZFC3H1 MRPS2 MRPS9 RBM42 AURKAIP1 DAP3 RPL6 ZNF331 ZBTB48 MRPS15 MRPS34 ZC3H3 MRPS33 MRPS11 PDGFB MRPS31 HNRNPR RPF1 TRA2A RG9MTD3 E4F1 RPL18 ,Unresolved
8.015142,6.6731243,Cluster 6,MRPL49,MRPL42 MRPL4 MRPL10 MRPL41 RPS8 MRPL50 MRPL39 MRPL37 MRPS30 MRPL35 MRPL47 MRPL12 ,Unresolved
7.5189757,5.519209,Cluster 6,NDUFB9,CSGALNACT2 PRRT2 NDUFA8 NDUFB11 NDUFB5 PRPS1 KLHL22 FUT1 SPG7 NDUFS7 NDUFS6 NDUFS3 RHPN1 ENPP6 ,Unresolved
8.445454,6.279349,Cluster 6,C18orf21,POP7 C3ORF17 MECP2 RPP40 POP5 POP4 RPP30 C9ORF23 POP1 RPP25 RPP14 RPP38 ,Unresolved
8.239714,6.7594194,Cluster 6,MRPL11,MRPL42 MRPL4 MRPL10 MRPL41 RPS8 MRPL50 MRPL39 MRPL37 MRPS30 MRPL47 ,Unresolved
8.468311,7.030896,Cluster 6,LSM6,PATL1 SNRPN PRMT5 LSM2 LSM1 LSM5 WDR77 LSM4 LSM3 LSM7 CLNS1A PRPF4 PRPF3 PRPF31 TUT1 NAA38 SNRPE ZNF511 C17ORF79 MEPCE WBP4 AKAP7 SIP1 LSM10 SART3 SNRPD2 SNRPD1 RIOK1 ,Unresolved
8.895257,7.477902,Cluster 6,CDC40,SNRPN TSSC4 DHX8 KIAA1143 ILF2 RALYL ELAVL2 PNN PRPF19 WDR83 SYF2 ZC3H18 SNIP1 PFDN2 C16ORF57 SNRPF SNRPG SNRPA1 C11ORF57 SNRPE CCT7 CD44 LUC7L2 ,Unresolved
8.492547,6.185258,Cluster 6,RPP30,POP7 C3ORF17 RPP40 POP5 POP4 C9ORF23 C18ORF21 RPP21 POP1 RPP25 RPP14 RPP38 ,Unresolved
8.989068,7.4538345,Cluster 6,CLNS1A,FARP2 SNRPN RBFOX2 LSM6 ADCYAP1 DDAH2 EPB41L2 RPL15 GAR1 SNRPF RPS2 SNRPG SNRPE ,Unresolved
7.1914907,5.855358,Cluster 6,MTIF2,TUFM TSFM PDHX GTPBP5 ECSIT SUCLA2 PPA2 NDUFS7 TRMT61B LDHAL6B CLPB ARHGEF26 NDUFA10 METTL2A DIRAS3 NUDT6 MRM1 HSD17B8 TMEM70 FOXRED1 MRPL12 ATP5D MRPL21 YBEY DHRS4L2 BPNT1 RNMTL1 TRIM43 ,Unresolved
8.159326,7.0668073,Cluster 6,RNMTL1,KLHDC5 SEC24B ZNF131 RPLP0 UHRF1 C2ORF56 MRPL39 MRPL28 MTIF2 MRPS30 MRPL47 CLEC3A MRPL42 C7ORF30 MRPL4 PTER MRPL50 CPT2 NDUFS6 LUC7L PMPCB PMPCA ZNF512 ATPAF2 ,Unresolved
7.819217,7.539105,Cluster 6,MRPL43,MRPL20 SLK MRPL42 MRPL4 MRPL10 NACC1 MRPL50 C20ORF7 MRPS30 GLS MRPL47 MRPL44 ,Unresolved
8.187701,7.669968,Cluster 6,TSSC4,AQR IK SNRPN ECD BUD31 CDC5L TFIP11 CRNKL1 CDC40 PRPF6 XAB2 PRPF8 SNW1 SNRNP40 WDR83 SYF2 CWF19L1 CWF19L2 CD2BP2 SNRPF SNRPG EAPP SNRPE SNRNP200 PPIE RBM22 GCFC1 ISY1 SMEK1 IDE TULP2 C20ORF4 EFTUD2 CDH5 PPP4R2 ZNHIT2 RSRC1 DHX35 SNRPD2 GPATCH1 TPM1 GPBP1L1 CCDC12 GPR156 TXNL4A LZTS2 AP2M1 ,Unresolved
8.420856,6.467475,Cluster 6,MRPL41,GADD45GIP1 MRP63 MRPL28 MRPL48 MRPS18A MRPL27 MRPL49 MRPL24 MRPL46 MRPL47 MRPL44 MRPL22 MRPL45 MRPL10 MRPL32 MRPL51 MRPL30 PREPL MRPL50 NBR1 MRPL19 MRPL17 MRPL39 MRPL18 MRPL15 MRPS30 MRPL38 MRPL16 MRPL35 MRPL1 MRPL13 MRPL14 MRPL55 MRPL11 MRPL34 MRPL12 MRPL20 MRPL42 C7ORF30 MRPL4 MRPL3 MRPL40 MRPL9 ICT1 ,Unresolved
8.884055,7.401439,Cluster 6,SIP1,CHRM4 SNRPN STRAP GEMIN4 PRKAG2 DDX20 LSM6 COMTD1 STRN4 CLK3 ACTA2 PNKD NCKIPSD SNRNP70 SNRPD1 C19ORF75 ACTBL2 GEMIN6 GEMIN7 SNRPF SNRPG GEMIN8 ERMAP SNRPE ,Unresolved
8.963401,7.4377823,Cluster 6,TUT1,YTHDF1 SNRPN FGL1 LSM6 LSM5 SART3 PRPF4 PRPF3 PRPF31 SNRPF SNRPG SNRPE CCDC84 ,Unresolved
8.822967,7.5455756,Cluster 6,GEMIN6,P2RY12 STRAP GEMIN4 DDX20 SIP1 NCKIPSD SNRNP70 C19ORF75 RAB17 AVP SNRPF SNRPG GEMIN8 SMN2 SNRPE ,Unresolved
8.58584,6.030724,Cluster 6,EPB41L1,HAX1 ISG20 DGUOK NUFIP1 ARMC1 DDAH2 EPB41L2 C19ORF21 PRICKLE3 EIF3I C14ORF104 ,Unresolved
8.131061,6.678234,Cluster 6,MRPL22,MRPL42 MRPL4 MRPL10 MRPL41 RPS8 MRPL50 MRPL39 MRPS30 MRPL47 MRPL12 ,Unresolved
7.53107,6.7690024,Cluster 6,MRPS23,ZNF331 ZNF133 MRPS27 ZNF324B MRPS15 MRPS34 MRPS11 PPAN ZFC3H1 MRPS2 MRPS31 MRPS5 TRA2A RG9MTD3 E4F1 ,Unresolved
8.636757,5.9935074,Cluster 6,PSMG1,PSMB7 FOXR2 CA10 PSMB3 PSMB4 PSMB1 PSMB2 PSMA1 PSMG2 XAGE3 PSMB9 SPATA8 ,Unresolved
8.548244,7.616731,Cluster 6,DHX8,AQR CDX1 CHCHD10 CRNKL1 CDC40 JMJD6 SRPK1 XAB2 SNW1 SYF2 C11ORF57 C19ORF29 PPIE RPL26L1 AHCYL1 AHCYL2 ISY1 PNN HIST1H1T RPL36AL RPL18A NUDCD1 SNIP1 CCDC12 MORC2 ,Unresolved
8.375789,5.318729,Cluster 6,COMMD8,COG8 COG7 COG6 COG5 COG4 COMMD10 COMMD3 COG3 BOLA1 COG2 COMMD4 COMMD1 COG1 COMMD2 COMMD7 COMMD5 COMMD6 TFDP1 FAM167A TFDP2 C16ORF62 KIF2B CCDC22 VPS29 CCDC151 FAM45A DSCR3 COMMD9 UBB UIMC1 CCDC93 E2F6 QSER1 ATP9A ,Unresolved
7.5233164,5.728659,Cluster 6,NDUFS7,ACAD9 ACOT9 HARS2 NDUFC2 SIRT3 ECSIT NDUFS8 CPS1 NDUFS6 NDUFS4 NDUFS3 ATPAF1 NDUFB9 AARS2 NDUFB8 NDUFB7 NDUFB11 NDUFB6 NDUFB5 NDUFB3 MTIF2 TRMT2B GLS PPOX PDPR NNT IARS2 NDUFV3 ACSS1 NDUFV1 LONP1 NDUFA8 HEMK1 NDUFA7 INTS1 MCCC1 MARS2 C2ORF56 KIAA0391 BCS1L ACSF3 PDP2 LARS2 CHDH NDUFAF4 NDUFAF1 ND4 MMADHC ND5 GFM2 GFM1 IPO13 NDUFA12 NDUFA13 C20ORF7 HSPD1 ALKBH7 NARS2 POLG PDK1 PDK3 VARS2 ,Unresolved
8.897827,7.582646,Cluster 6,ZC3H8,RPS8 ZCRB1 ZC3H3 THUMPD1 RPL7 LARP7 HIST1H1T TUBA8 SYNCRIP FGF8 E4F1 H2AFY2 HIST1H1A C8ORF33 RPL26L1 ,Unresolved
8.853924,7.526894,Cluster 6,MEPCE,HEXIM2 YTHDF1 SNRPN HEXIM1 LSM6 LSM5 CLK3 CDK9 SART3 TRA2A SNRNP70 PRPF3 LUC7L PRPF31 SNRPF VPS24 SNRPG SNRPE LUC7L2 HNRNPA1 ,Unresolved
8.415423,5.310735,Cluster 6,COMMD4,COMMD10 FAM45A COMMD3 COMMD1 COMMD2 COMMD7 COMMD8 COMMD5 COMMD6 DSCR3 COMMD9 TFDP1 C16ORF62 CCDC22 CCDC93 E2F6 EXOSC2 VPS29 ,Unresolved
7.172993,6.00882,Cluster 6,POLR1A,FAM46A PIH1D1 GPN3 SNX21 UXT CDH5 TWISTNB POLR1C POLR2E LGALS13 ASB7 SKAP1 LOC554223 ,Unresolved
7.9021273,7.8247437,Cluster 6,SNRNP70,SNRPN UPF1 PTCD3 SCAF11 STRBP NCBP1 MRPS18C CDC5L MRPS7 LARP7 WDR33 CLK3 SRRM2 CLK2 FOXP1 SNRPA MRPS9 DKC1 THRAP3 KLHL8 SLTM RPL26 SNRPF POP1 PABPC1 SNRPG SNRPE SRSF8 SNRPB SNRPC DAP3 MRPS14 YTHDC1 PINX1 SRSF1 GEMIN4 MRPS10 RBMXL1 HNRNPR GTPBP1 BCLAF1 SNRPD3 SNRPD2 SNRPD1 TGS1 GAR1 SMN1 HIST1H2AG SMN2 RALY TOE1 C9ORF114 RPP40 ZCRB1 MRPS26 CCDC59 CCDC137 FTSJD1 MRPS22 SCAF1 PRRC2A PRRC2C SRPK2 MRPL45 MKRN1 MKRN2 GEMIN5 RNPS1 GEMIN6 GEMIN7 SNRPA1 GEMIN8 RBMX NOP10 C16ORF88 MEPCE MRPS35 LARP1B MRPS33 MRPL15 DDX20 MRPS31 PHAX SIP1 LARP1 SYNCRIP TRA2A TRA2B SNRPB2 ZC3H14 SRSF10 SRSF12 ,Unresolved
8.491674,6.426478,Cluster 6,MRPL39,MRP63 PTCD1 MRPL28 ARMC8 MRPS18A MRPL27 MRPL24 MRPL22 MRPL32 MRPL30 RPUSD4 MRPL38 MRPL35 YARS2 MRPL34 MRPL42 C7ORF30 MRPL40 MRPL41 ICT1 MTERFD1 PAK7 MRPL48 MRPL49 MRPL46 MRPL47 MRPL44 MRPL45 MRPL10 MRPL51 MRPL50 TRUB2 MRPL19 MRPL17 MRPL18 MRPL15 MRPS30 MRPL16 MRPL1 MRPL13 MRPL14 MRPL55 MRPL11 MRPL12 NGRN MRPL20 MRPL4 MRPL3 MRPL2 RNMTL1 ,Unresolved
7.4936924,7.8009505,Cluster 6,RBM7,ZCCHC8 SLC4A1AP SF3A3 HTATSF1 EXOSC8 EXOSC7 C1D PLOD1 PPP2R2D PPP2R2C ZC3H18 LUC7L HNRNPF SF3B1 EXOSC3 SF3B2 SKIV2L2 EXOSC1 ,Unresolved
8.055207,7.7795725,Cluster 6,PDGFB,PPAN-P2RY11 PTCD3 MRPS18C GPR98 MRPL27 GNL2 SRRM1 MRPS5 NSA2 MRPL30 MRPS9 DKC1 CEBPZ BUD13 C11ORF57 RPL26L1 ZC3H4 MYCBP2 NOC4L RPF2 DHX30 C7ORF30 RPL36AL C1QBP RPL15 RPS3 TEX10 UTP3 MRPS24 DDX54 NOC3L MRPL47 GLTSCR2 MRPL45 MRPL51 EBNA1BP2 MYBBP1A FAT1 FAT3 FAT4 FREM2 GLYR1 MDM2 RBM28 UTP23 MRPS35 MRPS33 MRPS31 NOC2L MRPL13 KRI1 KIAA0020 RPS15 BMS1 BRIX1 RRP12 RBM34 ,Unresolved
7.7177973,6.6713405,Cluster 6,LSM5,ZGPAT PATL1 LSM2 LSM1 S100B LSM6 LSM4 LSM3 LSM7 TMCO6 NHP2L1 PRPF4 PRPF3 RBM42 PRPF31 SNRNP27 SNRPF TUT1 NAA38 ZNF511 MEPCE DDX23 AKAP7 HAPLN3 SART1 SART3 RDH13 SNRPD2 POLH ,Unresolved
8.0139265,7.7709517,Cluster 6,SNRNP200,SNRPN TSSC4 ECD C2ORF3 DDX23 KIAA1143 ZBTB46 C20ORF4 CDH5 SNRNP40 PRPF19 PRPF4 PRPF3 CD2BP2 C16ORF57 SNRPF GPBP1L1 SNRPG EAPP SNRPE GPR156 ,Unresolved
8.951974,7.4988327,Cluster 6,CCDC75,RBM17 ZRSR2 SNRPN RPS8 U2AF2 SNRPF SNRPG SNRPA1 SNRPE HIST1H1T ,Unresolved
8.012254,5.5513453,Cluster 6,GALNT6,B4GALT3 C8ORF38 NDUFB8 NDUFA12 NDUFB6 EDEM1 NDUFB5 ATP2B3 ATP2B2 SLC30A1 SLC9A1 ASPHD2 SLC39A10 NDUFS6 RMND1 NDUFS4 PLXNA2 FAM20B GAS6 ,Unresolved
8.059142,7.151085,Cluster 6,HBS1L,LIN9 UHRF1 RAB39B JMJD6 EXOSC8 EXOSC7 EIF1AD STK25 LAMP3 ISOC2 MSX2 CACNG2 EXOSC3 GCHFR EXOSC1 ,Unresolved
7.952517,7.7368746,Cluster 6,DDX23,PRMT6 IK SNRPN C2ORF3 TFIP11 LSM5 PRPF6 PRPF8 SNRNP40 PRPF4 PRPF3 CD2BP2 SNRPF SNRPG EAPP SNRPE SNRNP200 GCFC1 C20ORF4 EFTUD2 SART1 RSRC1 TMEM22 BSG SNRPD2 SNRPD1 TXNL4A ,Unresolved
8.425344,5.2524114,Cluster 6,COMMD7,COMMD10 FAM45A COMMD3 COMMD4 CCDC22 COMMD1 COMMD2 COMMD8 VPS29 COMMD6 ,Unresolved
7.9254637,5.47568,Cluster 6,NDUFB11,ACAD9 NDUFA9 NDUFA7 NDUFA6 NDUFA3 NDUFA2 NDUFC2 DNAJC30 NDUFS8 NDUFS7 NDUFS6 NDUFS5 TMEM126B NDUFS4 NDUFS3 NDUFS2 NDUFAF1 NDUFS1 ND1 ND4 ND5 NDUFB9 NDUFB8 NDUFB7 NDUFA12 NDUFB6 NDUFA10 NDUFB5 NDUFB10 NDUFB4 NDUFB3 NDUFB1 NDUFV3 NDUFV2 NDUFV1 ,Unresolved
8.333505,7.36292,Cluster 6,RPP38,RBM4 NPM1 POP4 RPP30 RBM4B C18ORF21 RPP21 RPP25 TOR1AIP2 C1ORF85 ,Unresolved
8.065169,7.087525,Cluster 6,MRPS18A,RPL6 FBXW11 MRPL39 MRPL28 MRPS30 MRPL35 MRPL47 MRPL42 MRPL4 MRPL10 MRPL41 MRPL50 ZNF317 HNRNPA1 ,Unresolved
8.459008,6.430911,Cluster 6,POLR3D,GTF3C3 POLR3GL CRCP PIH1D1 GPN3 UXT POLR3A POLR3B POLR3C RBP4 POLR3E POLR1C POLR3F POLR1D POLR2E POLR3G POLR3H POLR3K POLR2L ,Unresolved
7.736797,5.479285,Cluster 6,ATP5B,CCR1 ATP6V0C P2RY12 GPR35 ATPIF1 TMEM120A HTR1E TACR1 LHFPL4 SGCZ ATP5F1 LASS2 GPR141 GPRC5B RELL1 ALG10B SLC27A3 ATPAF1 B4GALT3 CHRM4 VIPR2 TAS2R41 ATP8 VIPR1 C3AR1 ATP5L HTR2C FPR2 ATP5A1 GPR21 ATP5C1 GPAA1 ATP5J CXCR7 SLC35F1 ATP5G3 DNAJC28 ATP5O SLC6A5 ATP5D FAM134C ZFYVE27 ATP5H S1PR2 CTNNA3 SLC19A2 SLC22A12 ,Unresolved
8.937605,7.4624157,Cluster 6,XAB2,SNRPN TSSC4 DHX8 KIAA1143 RALYL ELAVL2 PNN PRPF19 PLRG1 WDR83 SYF2 ZC3H18 DVL3 C16ORF57 SNRPF SNRPG SNRPA1 C11ORF57 SNRPE CCDC94 PPIE CD44 ,Unresolved
8.341884,6.5681696,Cluster 6,MRPL4,MRP63 PTCD1 MRPL28 ARMC8 MRPS18A MRPL27 MRPL24 MRPL22 MRPL23 MRPL32 MRPL30 RPUSD3 RPUSD4 RANBP10 WDR26 FASTKD2 C17ORF39 MRPL39 MRPL38 MRPL35 YARS2 MRPL33 SAV1 MRPL34 MRPL42 C7ORF30 FAM83H MRPL43 MRPL40 MRPL41 ICT1 MTERFD1 GNPNAT1 KIAA0913 LONP1 GADD45GIP1 MARS2 MRPL48 MRPL49 MCAT MRPL46 MRPL47 MRPL44 MRPL45 MKLN1 MRPL53 MRPL10 MRPL51 FAM123B MRPL52 MRPL50 CINP TRUB2 ZMYND19 DDX28 MRPL19 HTRA2 MRPL17 MRPL18 MRPL15 MSI2 MRPS30 MRPL16 HSPD1 MAEA MRPL1 MRPL13 MRPL55 MRPL11 MRPL12 C20ORF11 NGRN MRPL20 MRPL21 RMND5A MRPL3 RMND5B MRPL2 MRPL9 SPATA5L1 RNMTL1 HNRNPA1 ,Unresolved
8.154103,6.903274,Cluster 6,RPS8,PTCD3 MRP63 RBM19 CNBP MRPL28 RPS3A MRPL27 MRPL24 CHERP MRPS7 LARP7 MRPL22 MRPS5 MRPL32 MRPL30 MRPS9 DKC1 RPL37A NAT10 RPL26 RPL28 RPL26L1 MRPS14 ZC3HAV1 HIST2H2AB MRPS11 ZC3H8 ZBTB24 GPATCH4 MRPL38 MRPL34 MECP2 MRPL40 ICT1 CCDC75 RPL14 E4F1 DGCR8 RRS1 RPL19 SF3B1 GADD45GIP1 MRPL49 MRPL47 MRPL44 MRPL45 MRPL10 MRPL51 EBNA1BP2 ZNF498 C16ORF88 RRP8 RPL30 MRPL19 MRPS35 MRPL17 IPO4 MRPL18 MRPL15 MRPS30 MKI67IP MRPS31 MRPL16 MRPL1 MRPL13 MRPL11 RPL8 KIAA0020 RBM4 SART3 MRPL3 MRPL2 RBM34 ,Unresolved
7.920634,7.077383,Cluster 6,HNRNPA1,UPF1 MRP63 PTCD1 STRBP MRPL28 MRPS18A RPS3A MRPS7 MRPL32 MRPS9 PLOD1 RBMS1 DAP3 FASTKD2 MRPL35 YARS2 HNRNPR DHX30 FAM120A C7ORF30 DUSP11 MTERFD1 RPS3 RPS15A RALY RPS27A PRMT8 ZFR DNTTIP2 MCAT SUPV3L1 MOV10 MRPL10 MRPL52 HNRNPA1L2 PRKRIR TRUB2 MEPCE MRPS35 LARP1B FARS2 MRPL1 MRPL13 NGRN LARP1 MRPL4 RPS15 MRPL3 PAIP2B PAIP2 ,Unresolved
8.240592,6.911536,Cluster 6,MRPL2,MRPL42 MRPL4 MRPL10 RPS8 MRPL50 MRPL39 MRPL28 MRPS30 MRPL35 MRPL47 ,Unresolved
8.690722,7.466242,Cluster 6,ISY1,SNRPN WSB2 FBXW11 KIAA1143 ILF2 RALYL SNRNP40 PRPF19 WDR83 SYF2 SNRPF SNRPG SNRPA1 C11ORF57 SNRPE PPIE CD44 LUC7L2 TSSC4 DHX8 ELAVL2 PNN PLRG1 TRA2A ZC3H18 SNIP1 DVL3 C16ORF57 CCDC94 ,Unresolved
8.643864,6.0070276,Cluster 6,PSMB2,PSMD11 AKIRIN2 POMP PSMB9 PSMB7 PSMA6 PSMA7 PSMA4 PSMB5 PSMA5 PSMB6 PSMB3 PSMA2 PSMB4 PSMA3 PSMB1 PSME4 PSMA1 PSME2 PSMF1 FBXO7 PSMG2 PSME1 PSMG1 ,Unresolved
7.7950687,7.220869,Cluster 6,MRPS11,PTCD3 RPS8 PUS1 STRBP MRPS18C ZFC3H1 MRPS18B MRPS2 MRPS7 MRPS5 CUL4B LETM1 CUL4A MRPS9 ETF1 TNIK DAP3 ZNF324B MRPS14 MRPS15 ZC3H4 MRPS10 MLLT4 HNRNPR DCAF5 DDA1 DBT RG9MTD3 E4F1 PCMTD1 WDTC1 RBM12 TPD52 MRPS27 MRPS28 MRPS25 RPRD1A MRPS26 MRPS23 MRPS24 MRPS21 DDX55 MCAT SUPV3L1 DRAP1 NAA15 TCEA1 NAA16 AURKAIP1 ZNF331 ZBTB48 MRPS34 MRPS35 MRPS33 C4ORF14 MRPS31 RCBTB2 EDC4 CYB5R3 TRA2A FNTB SRP54 PSMF1 ZNF169 ,Unresolved
8.3803625,5.281539,Cluster 6,BCAS4,PLDN SNAPIN SRCIN1 BLOC1S1 BLOC1S2 BLOC1S3 LOH12CR1 DTNBP1 ATG4A PKD2 MUTED ,Unresolved
8.40438,5.269717,Cluster 6,COMMD2,TRIM16L COMMD10 FAM45A COMMD3 COMMD4 COMMD1 COMMD7 COMMD8 COMMD5 COMMD6 COMMD9 C16ORF62 KIF2B CTAGE5 LAMP3 FAT3 CCDC22 CCDC93 SCN2B VPS29 CCDC151 ,Unresolved
8.913643,7.521445,Cluster 6,TOE1,SNUPN SART3 SNRPN SNRNP70 HIST1H1E SNRPF RPS2 SNRPG SNRPA1 HIST1H1A SNRPE HIST1H1T ,Unresolved
8.216185,5.460109,Cluster 6,NDUFAB1,GLDC OXSM ETFB SDHB MRPL46 LYRM2 NFS1 ACN9 LYRM4 LYRM5 LYRM7 NDUFS6 ATPAF2 ,Unresolved
8.9492855,7.4225135,Cluster 6,GEMIN5,SNRPN AKR1D1 CPNE5 SSSCA1 STRAP DDX20 COMTD1 SNRNP70 GAR1 PDDC1 SNRPF SNRPG SNRPA1 SNRPE ,Unresolved
8.618593,5.9642344,Cluster 6,PSME4,PSMB7 FDPS TAF7L PSMB3 PSMB4 PSMB1 PSMB2 PSMA1 A1BG SLX1A PSMB9 KLHL10 ,Unresolved
8.996172,7.3287644,Cluster 6,ZMAT5,ZRSR2 SNRPN ZCRB1 DENND4B PDCD7 RNPC3 GSTT1 ACTA2 CTU2 ACTBL2 PSMG4 PSME3 SNRPF PSMG3 SNRPG SNRNP48 SNRPE ,Unresolved
7.8759503,5.4447956,Cluster 6,NDUFA8,ACAD9 NDUFA9 NDUFA7 NDUFA3 NDUFA1 NDUFC2 JOSD2 ECSIT NDUFS8 NDUFS7 NDUFS6 NDUFS4 NDUFS2 NDUFAF1 NDUFS1 ND1 ND4 ND5 NDUFB9 NDUFB8 NDUFB7 NDUFA12 NDUFB6 NDUFB5 CAMK2B NDUFB3 NDUFB1 WAPAL CAMK2G NDUFV3 NDUFV2 NDUFV1 ,Unresolved
8.002077,6.6266437,Cluster 6,MRPL20,PEX19 MRPL39 MRPS30 MRPL35 MRPL47 MRPL12 MRPL42 MRPL4 MRPL10 MRPL21 MRPL43 MRPL41 RHOT2 MRPL50 CASQ2 RPL18 ,Unresolved
8.605972,5.9883986,Cluster 6,PSME1,RNF26 GPX7 PSMB9 PSMB7 DDX19B PSMB3 PSMB4 GJB4 CTRL PSMB1 PSMB2 PSMA1 CYP1A1 FBXO7 PSMG2 CDK15 ,Unresolved
8.6189165,5.9869275,Cluster 6,PSMB1,PSMB9 PSMA6 PSMA7 PSMA4 PSMA5 PSMC4 PSMA2 PSMA3 PSME4 PSMA1 PSME2 PSMG2 PSME1 PSMG1 PSMD11 POMP PSMA8 PSMB7 PSMD7 PSMB5 PSMB6 PSMB3 PSMB4 PSMB2 PSMD1 PSMF1 FBXO7 ,Unresolved
7.968749,6.6749773,Cluster 6,MRPL27,ZNF274 RPS8 RPL13 MRPL39 MRPL28 PDGFB MRPL37 MRPS30 MRPL35 MRPL47 RPL7 MRPL12 MRPL42 MRPL4 MRPL10 MRPL41 KBTBD7 MRPL50 RPL18 ,Unresolved
8.6109915,5.987311,Cluster 6,POMP,PSMB7 FOXR2 PSMB3 PSMB4 PSMB1 C16ORF70 PSMB2 PSMA1 PSMG2 PSMB9 ,Unresolved
8.457154,6.473576,Cluster 6,MRPL42,MRP63 MRPL28 MRPS18A MRPL27 MRPL24 SIRT3 MRPL22 MRPL32 MRPL30 MRPL39 MRPL38 MRPL35 MRPL33 MRPL34 C7ORF30 MRPL43 MRPL40 MRPL41 ICT1 GADD45GIP1 GATC MRPL48 MRPL49 MRPL46 MRPL47 MRPL44 MRPL45 MRPL10 MRPL51 MRPL50 MRPL19 MRPL17 MRPL18 MRPL15 MRPS30 MRPL16 MRPL1 MRPL13 MRPL55 MRPL11 MRPL12 NGRN MRPL20 MRPL4 MRPL21 MRPL3 MRPL2 MRPL9 RNMTL1 ACAA1 ,Unresolved
8.432248,7.3419075,Cluster 6,PRPF3,ZGPAT SNRPN TMOD3 LSM2 LSM6 FBXO11 LSM5 LSM4 LSM3 PRPF6 SNRNP40 NHP2L1 PRPF4 RBM42 PRPF31 SNRNP27 SNRPF TUT1 NAA38 SNRPG SNRPE SNRNP200 SNRPB CCDC84 MEPCE DDX23 AKAP7 SART1 SART3 SNRPD2 SNRPD1 TXNL4A ,Unresolved
8.120357,6.967906,Cluster 6,AKIRIN2,AKIRIN1 BUD31 RGPD8 RGPD3 UBAC1 RGPD5 TOMM34 IPO9 PSMB3 PSMB2 RNF123 PPID RAN SPG21 ,Unresolved
7.44942,5.678237,Cluster 6,RANBP6,PTGES2 CCDC59 CD70 PAM16 MUL1 EXOG ATP2B3 TYW1B GNL2 POMGNT1 C6ORF162 DNAJC19 SLC25A17 KIAA1715 PNKD ARMCX3 MAN1B1 DAAM1 EFHA1 FAM18B2 STEAP3 DHRS13 SLC27A2 GYPB RPL13 NOL9 CBARA1 MRPL35 TMEM186 FBL TNFSF13B MRPL34 TMEM206 C19ORF75 VSIG1 C3ORF33 ZFPL1 MCL1 ATP9A CA14 ,Unresolved
8.475036,7.5247526,Cluster 6,POP7,KLHDC3 RRP8 NPM1 CCDC59 POP4 RPP30 OSGEP RBM4 SART3 KBTBD7 ENSA C18ORF21 RPP21 RPP25 ,Unresolved
7.9183083,6.657929,Cluster 6,MRPS31,CDK19 MRPS27 PTCD3 RPS8 MRPS25 MRPS26 CCDC59 MRPS23 MRPS24 MRPS21 MRPS18C ZFC3H1 MRPS18B MRPS2 BHLHA15 MRPS7 MRPS5 MRPS9 RBM42 NOL12 AURKAIP1 DAP3 ZNF331 ZNF324B ZBTB48 MRPS14 MRPS15 MRPS34 MRPS35 ZC3HAV1 MRPS10 MRPS33 MRPS11 PPAN PDGFB HNRNPR ZNF707 TRA2A SNRNP70 FAM177A1 RG9MTD3 E4F1 RRS1 RPL18 ,Unresolved
7.891822,7.7882485,Cluster 6,HNRNPR,APOBEC3D PRMT8 ZFR STRBP MRPS11 MRPS31 ILF2 ELAVL2 MRPS5 SYNCRIP SNRNP70 ZNF169 AURKAIP1 HNRNPA1 ,Unresolved
8.407694,6.873726,Cluster 6,MRPS34,PTCD3 EPDR1 STRBP MRPS18C MRPS18B MRPS2 GNL2 MRPS7 MRPS6 MRPS5 ZZEF1 MRPS9 PSMG4 PSMG3 DAP3 MRPS16 MRPS14 MRPS15 MRPS10 MRPS11 RG9MTD3 FAM192A HIST1H1A MRPS27 MRPS28 MRPS25 MRPS26 MRPS23 MRPS24 MRPS21 DDX55 MRPS22 MCAT FAM92A1 SUPV3L1 PREPL PSME3 ZNF574 ZNF770 ZBTB48 MRPS35 MRPS33 C4ORF14 MRPS31 PDF HECTD3 IGF2BP1 IGF2BP3 NINL ,Unresolved
7.57753,5.514471,Cluster 6,PSMG3,FOXD4 CA10 RASL10B IGFBP6 SIRT6 C1ORF88 IL17RE A1CF PSMB9 AMACR PSMA1 RPP21 PSMG2 CCDC69 NDUFB5 MRPS34 SIX2 PPM1E C9ORF106 SPATA8 PSMB7 PSMB3 DCDC2B ZMAT5 SOST APBB3 CTSG ZNF843 RPS11 ZNF785 ,Unresolved
