x,y,cluster,term,genes,cluster_label
8.649981,9.104554,Cluster 10,RPL5,MAK16 ZRSR2 SURF2 RPL30 ZBTB48 CNBP RPS7 RBM4B IGHMBP2 GLTSCR2 FMR1NB KIAA0020 RBM4 MECP2 ZNF707 PLEKHO1 RPL37A SNIP1 RPL28 ZNF512 MAGEB10 RBM34 C16ORF88 ,Unresolved
8.561439,8.8527155,Cluster 10,DDX51,GTF3C2 RRP8 NPM1 CCDC59 NOL8 RSBN1 FGF3 RBM4 MECP2 FGF8 RPL18A PLEKHO1 CASQ2 H2AFY2 ZNF512 RPL18 NEUROG3 RBM34 ,Unresolved
8.40722,8.383533,Cluster 10,SF3B1,RBM17 ZRSR2 SNRPN PRR11 RPS8 ZCRB1 PPAN U2AF2 CCDC97 HIST1H1E E4F1 SNRPF RPS2 RRS1 SNRPG SNRPA1 SNRPE RBM7 ,Unresolved
8.018889,9.83787,Cluster 10,UTP3,CDX1 PDGFB WDR46 TUBA3C FGF3 FBL GLTSCR2 TF SYNCRIP ZNF2 RPL37A RPS2 RPL18 ,Unresolved
8.354479,9.654902,Cluster 10,ZBTB24,PRR11 ZNF324B ZBTB48 RPS8 H2AFX PPAN RPL7 RPL8 KIAA0020 RBM4 ZNF71 RPL14 E4F1 ZNF512 RPS14 ZNF169 ,Unresolved
7.68327,8.829363,Cluster 10,E2F6,L3MBTL2 TCF19 HDAC1 PCGF6 WDR5 MGA COMMD4 CARD8 COMMD1 COMMD8 COMMD6 RYBP TFDP1 TFDP2 PSMC3 MIER2 YAF2 ASB6 ,Unresolved
7.8727293,9.888511,Cluster 10,C1QBP,ZRSR2 FOXD4 NPM2 CHST8 CHCHD10 OSM BHLHA15 GLTSCR2 C1ORF63 EEF1D GNAS MAGEB4 RPL28 NEUROG3 LLGL2 LUC7L2 GTF3C2 TNFRSF13B MAGED2 NOL9 PDGFB U2AF2 FBL VTN CLEC3A JPH4 ZNF707 RPL15 LUC7L E4F1 RSPO1 RPS2 RRS1 ZNF524 PRR20E RPL18 MAGEB10 BEND7 ,Unresolved
8.512588,9.40252,Cluster 10,PAK1IP1,RBM4 PRR11 RPL30 ZNF2 RPL37A CNBP HIST1H1E PPAN DGCR8 WDR46 RPL18 RBM34 ,Unresolved
8.389427,9.331033,Cluster 10,MRPL13,RPL6 ZNF324B RPS8 RPL13 ZC3H3 MRPL39 MRPL28 PPAN PDGFB MRPL37 MRPS30 MRPL35 MRPL47 RPL7 MRPL12 MRPL42 MRPL4 MRPL10 MRPL41 MRPL50 RPL18 HNRNPA1 ,Unresolved
8.439755,9.356947,Cluster 10,NOP56,TNFRSF19 CNBP GPATCH4 FBL FMR1NB RBM4 P2RX5 ZNF2 RPL37A FAM196A RRS1 RPL18 NEUROG3 ,Unresolved
7.3382354,9.206782,Cluster 10,ZCRB1,ZRSR2 UPF1 ZRSR1 RBM19 ZBTB11 RPS3A RPSA LARP7 NSA2 DKC1 CCDC86 SNRPF RPL26L1 STAU2 PDCD7 ZC3HAV1 HIST2H2AB ZC3H8 RNPC3 CTCF RPF1 HIST1H1T PURA HIST1H1E GAR1 RPS5 RPS2 RRS1 RPS3 RPL19 SF3B1 HIST1H1A RPS27A SF3B2 SURF2 PRR11 KRR1 H2AFY GLTSCR2 SNRNP48 NOL12 GLYR1 MAK16 UTP23 YBX1 DDX21 MKI67IP YBX2 FARS2 KRI1 LARP1 FGF8 SNRNP70 ZMAT5 SNRNP35 ,Unresolved
7.827498,9.174447,Cluster 10,RPL26L1,ZRSR2 RPS8 CDX1 CNBP RPS7 RSBN1 DDX31 ILF2 RPSA BYSL NSA2 ZNF71 RPL37A ZNF317 RPL28 ZNF512 STAU1 DHX8 ZNF274 ZNF324B PRDM5 RPL13 ZC3H3 ZC3HAV1 RBM4B ZC3H8 GPATCH4 RPF1 FMR1NB HIST1H1T MECP2 NXF2 RG9MTD3 HIST1H1E RPL14 E4F1 CPNE4 DGCR8 RPS2 ZNF501 RPL18 ZNF286A NPM1 ZRANB2 PRR11 ZNF187 ZCRB1 H2AFX CCDC59 EAF1 ZBTB38 BHLHA15 SRP68 MRPL47 GLTSCR2 THAP7 PLEKHO1 NCL FGF10 H2AFY2 NOL12 C16ORF88 MAK16 CRP RPL6 RRP8 RPL30 ZNF692 ZBTB48 ZNF490 ZNF22 PPAN PDGFB MRPS30 MKI67IP RPL10A RPL9 WDR46 FGF3 RPL7 RPL8 KIAA0020 RBM4 SART3 SYNCRIP FGF8 TRA2A RPS11 MAGEB10 RPS14 ZNF169 ZNF323 RBM34 ,Unresolved
8.532699,8.654696,Cluster 10,TAF1A,MECP2 RPL30 TAF1D RPL37A EAF1 TAF1B RPL14 ZNF512 TRIM44 RBM34 ,Unresolved
8.534727,9.347211,Cluster 10,RBM19,ZBTB48 RPS8 ZCRB1 H2AFX CDX1 ZC3H3 ZC3HAV1 MKI67IP GPATCH4 FGF3 RPL7 HIST1H1T BYSL FGF8 ZNF2 HIST1H1E RRS1 H2AFY2 NOL12 HIST1H1A RPL18 RPS14 ,Unresolved
7.7837653,9.185693,Cluster 10,KIAA0020,RPS8 RPS6 CNBP RPL13A DDX31 RPS3A ILF2 GTPBP4 ZNF71 DKC1 RPL7L1 RPL37A RPL28 RPL27 RPL26L1 ZCCHC7 STAU1 PRDM5 NOP2 RPL13 RPL12 ZC3H3 ZC3HAV1 ZBTB24 GPATCH4 CTCF HIST1H1T HIST1H1E RPL15 RPL14 CPNE4 DGCR8 RRS1 HIST1H1A RPL18 NPM1 PRR11 SURF6 RPL35A PAPD5 RPL23A SRP68 FTSJ3 GLTSCR2 RSL1D1 THAP7 EBNA1BP2 MYBBP1A ZNF2 H2AFY2 NOL12 C16ORF88 RBM28 RPL5 MAK16 RRP8 RPL3 RPL4 RPL30 RPL32 PPAN PDGFB ZFP62 MKI67IP RPL10A WDR46 RRP9 RPL8 RBM4 FGF8 RPL18A BRIX1 RPL36 MAGEB10 RPL7A RPS14 RBM34 ,Unresolved
8.356294,9.5966835,Cluster 10,CCDC137,RRP8 NPM1 RPL30 CNBP GPATCH4 WDR46 GLTSCR2 HIST1H1T RPL8 SYNCRIP ZNF2 RPL37A SNRNP70 RPL14 DGCR8 NOL12 RPS14 RBM34 ,Unresolved
7.785027,9.07926,Cluster 10,CNBP,PPAN-P2RY11 RPS8 RPS6 RPL13A DDX31 RPS3A GNL2 GTPBP4 NSA2 DKC1 RPL7L1 RPL37A CENPN POP1 RPL27 ZNF512 C8ORF33 TRIM56 RPL26L1 ZNF275 STAU1 RPL11 NIP7 NOP2 RPL13 RPL12 PAK1IP1 ZC3HAV1 ZNF48 RPF1 RPF2 DHX30 LLPH RPL15 RPL14 RRS1 HIST1H1A RPL18 ABT1 ZNF184 SURF6 CCDC137 RPL35A PAPD5 FTSJ3 NLE1 GLTSCR2 EBNA1BP2 NOL12 RSL24D1 GLYR1 NOP56 ITGB3BP ZNF498 RBM28 RPL5 MAK16 RPL6 RRP8 ZNF771 DDX27 RPL3 RPL4 RPL30 WHSC1 RPLP0 MLF1IP RPL32 RPLP2 RPLP1 FCF1 DDX24 DDX21 ZFP62 RPL10A TTF1 RPL7 RPL8 KIAA0020 REPIN1 RPL18A BRIX1 RPL36 ZNF800 ZNF689 RPL7A RPS13 RBM34 ,Unresolved
7.3907304,8.381386,Cluster 10,ZNF324B,ZNF121 PTCD1 NSUN4 ZBTB11 RPS3A ACTA1 ZNF316 ZNF780A AHDC1 RPL26L1 DAP3 NUFIP1 STAU2 FASTKD2 YTHDC2 ZNF192 NOC4L MRPS11 ZBTB24 YARS2 RPF1 AATF DHX30 PRIC285 ZNF629 MTERFD1 ZNF746 SMARCAD1 DGCR8 ZNF624 ZNF107 RPS27A NOP14 UTP15 TSPYL2 ZNF460 ZNF184 MRPS23 MRPS24 DDX52 MCAT MRPL47 TOPORS MRPL45 ZNF92 TRIM39 TRIM33 RBAK ZNF498 TRUB2 LTV1 RPL3 MRPS35 TRIM71 SPIN3 YBX1 MRPL17 LENG8 LTBP4 MRPS31 MRPL13 NGRN RPS15 RGS3 ZNHIT3 DHX57 GSG2 SPIN1 RRP12 ZNF888 TRIM28 ZNF689 ZNF644 ZNF445 ZNF324 CEP78 TRIM24 ,Unresolved
7.4739866,8.81902,Cluster 10,MAK16,PPAN-P2RY11 CNBP WDR74 GTPBP4 TUBA8 NSA2 DKC1 CEBPZ RPL26L1 ZCCHC9 NVL NOP2 ZC3HAV1 HIST2H2AB GPATCH4 RPF1 RPF2 HIST1H1E GAR1 DGCR8 RPS27A NPM1 ZCRB1 SURF6 KRR1 NOC3L FTSJ3 FRMD6 EBNA1BP2 ZNF2 H2AFY2 NOL12 RSL24D1 MDM2 C16ORF88 RBM28 RPL5 RRP8 DDX27 RPL3 RPL4 RPL30 ZBTB48 RPL32 RRP1 DDX24 NOC2L KIAA0020 RPS15 BRIX1 RPL7A RBM34 ,Unresolved
8.634603,8.962397,Cluster 10,NOC2L,MAK16 RRP8 NPM1 PDGFB FGF3 MECP2 FGF8 RPL18A PLEKHO1 CPNE2 ZNF512 RPL18 SCN3B MAGEB10 RPS14 RBM34 ,Unresolved
8.402078,8.347026,Cluster 10,TAF1D,RRP8 NPM1 EAF1 MECP2 RPL18A TAF1C ZNF2 TAF1A TAF1B RPL14 TRIM44 RPS14 RBM34 ,Unresolved
7.577583,9.118959,Cluster 10,RPL30,PPAN-P2RY11 RPS8 IMP4 RPS9 NSUN4 CNBP DDX31 RPS3A REXO4 GNL2 SMARCA5 GTPBP4 NSA2 ZNF70 DKC1 RPL7L1 RPL37A RPL26 CENPN PRKRA RPL28 RPL27 ZNF512 RPL26L1 HP1BP3 STAU1 NIP7 NOP2 RPL13 RPL12 PAK1IP1 ZC3HAV1 PRDM15 GPATCH4 RPF1 RPF2 HIST1H1T DHX30 LLPH TAF1A RPL14 ZNF668 RPL18 LYAR HIST1H1C ZC3H10 ZNF189 ZNF142 ZNF184 SURF6 DDX56 CCDC137 DDX10 PAPD5 FTSJ3 NLE1 EBNA1BP2 MYBBP1A NMNAT1 GZF1 ZNF354A RSL24D1 GLYR1 ZNF498 RBM28 RPL5 MAK16 ZNF574 RRP8 ZNF771 DDX27 RPL3 RPL4 WHSC1 RPLP0 RPL32 FCF1 DDX24 DDX21 ZNF22 ZFP62 RPL10A TTF1 KIAA0020 RPL18A BRIX1 RPL36 RPL7A RPS13 RBM34 ,Unresolved
8.550304,9.328259,Cluster 10,CEBPZ,CCDC59 RSBN1 SRP68 YY1AP1 THAP7 VAPB ZNF2 RPL37A H2AFY2 ZNF512 MAK16 RRP8 ZNF692 ZBTB48 PDGFB GPATCH4 WDR46 FGF3 FMR1NB MECP2 FGF8 RPL18A HIST1H1E RPL14 RPL18 MAGEB10 RPS14 RBM34 ,Unresolved
6.6917367,9.043278,Cluster 10,ZNF169,TPD52 TRIM41 ZNF121 ZYG11A ZFR ZNF184 STRBP ZBTB10 LOC100507290 SORL1 HIC2 LRP1B ZNF92 KIAA0889 MRPS9 NAT10 ZNF316 RBAK ZNF498 RPL26L1 STAU2 MRPS35 ZNF192 MRPS33 MRPS11 ZBTB24 ZNF45 LTBP4 CENPB HNRNPR RPS15 SART3 SYNCRIP ZNF629 CLTCL1 GSG2 C10ORF2 TRIM26 RPS3 ZNF689 ZNF445 ZNF324 PATZ1 ,Unresolved
7.866629,9.910092,Cluster 10,HIST1H1C,RPL30 ZBTB48 H2AFX ZC3H3 ZC3HAV1 ZNF22 PPAN BHLHA15 HTR3A MRTO4 NXF2 RPL28 NCAPD3 ,Unresolved
8.561894,9.326675,Cluster 10,BMS1,FGF8 RPL18A ZBTB48 ZNF2 CDX1 PDGFB RRS1 H2AFY2 RPSA RPS14 ,Unresolved
8.282567,9.719725,Cluster 10,NGRN,RPL6 DDX28 ZNF324B FASTKD2 PRDM5 FBXW11 HNRPDL CDX1 STRBP ZC3H3 ZC3HAV1 MRPL39 PPAN CIRBP RPL7 GLTSCR2 MRPL42 MRPL4 RBM3 TRA2A RBM42 RBMX RBMS3 HNRNPA1 ,Unresolved
8.337608,8.455609,Cluster 10,PRKRA,STAU1 RPL18A RPL30 STRBP RASL10A DGCR8 ILF2 WDR46 RALYL ELAVL2 MAGEB10 RBM34 ,Unresolved
7.041353,8.948628,Cluster 10,DGCR8,UPF1 ZNF483 RPS8 DDX31 REXO4 GNL2 GTPBP4 NSA2 SHQ1 ZNF70 CENPH DKC1 CENPI CENPN PRKRA CENPO POP1 CENPQ RPL26L1 NVL ZCCHC7 ZNF324B STAU2 PINX1 NOP2 PAK1IP1 ZC3HAV1 HIST2H2AB CTCF SPTY2D1 ZNF7 RPF2 DHX30 HERC5 MECP2 DROSHA RPL17 ZNF668 RALY DDX18 ZNF189 SURF6 DDX56 CCDC137 DNTTIP2 DDX54 DDX10 PAPD5 NOC3L FTSJ3 SRPK1 WDR12 MOV10 CENPC1 NMNAT1 NOL10 ZNF777 GLYR1 ITGB3BP C16ORF88 RBM28 MAK16 RRP8 ZNF771 DDX27 ZBTB48 WHSC1 MLF1IP UTP23 RPLP2 MPHOSPH10 FCF1 DDX24 ZNF22 LARP1B ZFP62 MKI67IP RPL10A TTF1 KIAA0020 LARP1 REPIN1 BRIX1 ZNF800 ZNF646 ZNF689 RPL7A BEND7 PABPC4L RPS13 ,Unresolved
7.086444,9.176272,Cluster 10,RPL14,PPAN-P2RY11 RPS8 CNBP DDX31 REXO4 GNL2 SRRM1 GTPBP4 DKC1 PPIG CEBPZ RPL28 BUD13 ZNF512 C8ORF33 RPL26L1 ZCCHC7 STAU1 STAU2 VPRBP NOP2 ZNF192 ZBTB24 RPF1 RPF2 HERC5 RPL36AL TAF1C TAF1D TAF1A ZNF668 RRS1 C9ORF114 DDX56 CCDC137 DDX54 SCAF1 DDX52 NOC3L FTSJ3 MYBBP1A TRAF4 GZF1 FYTTD1 ZNF498 RBM28 RRP8 DDX27 RPL4 RPL30 WHSC1 DDX24 ZNF22 ZFP62 TTF1 KIAA0020 RBM4 RSBN1L ZNF768 ZNF526 ARGLU1 RBM34 ,Unresolved
7.238903,8.62699,Cluster 10,MKI67IP,UPF1 PPAN-P2RY11 RPS8 RBM19 DDX31 RPS3A GNL2 SRRM1 GTPBP4 ZNF70 CENPI RPL7L1 CENPN POP1 BUD13 SREK1 RPL26L1 ZCCHC9 STAU2 ZC3HAV1 NOC4L SPTY2D1 ZNF48 RPF1 ZNF7 RPF2 BBX TAF1B DGCR8 RRS1 ZCRB1 DNTTIP2 DDX54 MRPL48 SCAF1 SRP68 C17ORF85 NLE1 WDR12 TOPORS CENPC1 ZCCHC3 RBM28 ZNF574 RRP8 ZNF770 DDX24 PRR3 DDX21 LARP1B YBX2 KIAA0020 LARP1 BRIX1 RRP12 ZNF689 ARGLU1 RBM34 ,Unresolved
8.273051,9.688731,Cluster 10,GNL2,NPM1 PRR11 CDX1 CNBP RANBP6 GLTSCR2 NSA2 ZNF2 RPL37A NOL12 ZNF512 C16ORF88 RRP8 RPL30 ZBTB48 MRPS34 ZC3H3 ZC3HAV1 PPAN PDGFB MKI67IP GPATCH4 WDR46 FGF3 HIST1H1T RPL8 RBM4 MECP2 RPL18A HIST1H1E RPL14 DGCR8 HIST1H1A RPL18 RBM34 ,Unresolved
7.27191,9.137332,Cluster 10,RPS2,NGDN RPS3A CHERP SIRT1 RPSA NAP1L5 CLNS1A NAT10 PDCD2 RPL26L1 GTF3C2 ZNF277 C17ORF79 STAU2 TOR1AIP2 AATF PELP1 HERC5 PURB YBEY C1QBP HIST1H1E RPS5 RRS1 RPS3 SF3B1 HIST1H1A RPS27A TOE1 PRMT3 ZCRB1 TEX10 UTP3 H2AFX KRR1 ANGEL2 RPL23A MRPL52 NOL10 RAD18 TSR1 RPS24 ZNF498 C16ORF88 ZNF574 ZNF496 LTV1 UTP23 MPHOSPH10 FCF1 PRR3 YBX1 NOB1 YBX2 PDCD2L RPS15 RPS17 DHX57 RIOK1 RPS10 RRP12 ,Unresolved
7.067571,9.097036,Cluster 10,RPS14,CENPV ZNF121 PPAN-P2RY11 RBM19 NGDN PRPF4B CCZ1 DDX31 RPS3A REXO4 GTPBP4 NSA2 NAT10 CEBPZ CDK12 BUD13 RPL26L1 C14ORF149 ZNF430 STAU1 YTHDC2 NOC4L ZBTB24 SDAD1 SPTY2D1 DCAF5 RPF2 DHX30 RPL36AL TAF1C TAF1D PDCD11 RPL15 RRS1 PCMTD1 NKTR DDX18 C14ORF21 NOP14 KRR1 CCDC59 CCDC137 DDX54 SRPK1 MYBBP1A FRMD8 RBM42 TAF9 TSR1 PRKRIR RBM28 ZNF574 RRP8 LTV1 RPL3 RPL4 RPL32 DDX24 NOB1 RPL10A NOC2L KRI1 TTF1 KIAA0020 RBMX2 DHX57 BMS1 RRP12 RPS13 ,Unresolved
8.313159,9.719654,Cluster 10,FTSJ3,NPM1 PRR11 CNBP WDR55 GLTSCR2 ZNF71 PLEKHO1 RPL37A RPL28 NOL12 ZNF512 C16ORF88 MAK16 RRP8 STAU1 RPL30 ZBTB48 PRDM5 GPATCH4 WDR46 RPL8 KIAA0020 SART3 RPL18A HIST1H1E RPL14 CPNE4 DGCR8 RRS1 RPL18 RBM34 ,Unresolved
6.8281007,9.338309,Cluster 10,TSR1,BYSL LTV1 KPNB1 KBTBD7 ZBTB48 NUP153 PARN RPS2 RRP12 RPS14 ,Unresolved
7.8915715,9.180396,Cluster 10,DDX24,NPM1 TSPYL1 PRR11 CNBP ZNF2 RPL37A APBA2 H2AFY2 ZNF512 C16ORF88 TSPYL6 MAK16 RRP8 RPL30 ZNF692 ZBTB48 ZC3HAV1 PPAN MKI67IP GPATCH4 WDR46 RBM4 MECP2 SART3 FGF8 RPL18A RPL14 DGCR8 HIST1H1A TRIM44 RPL18 RPS14 ,Unresolved
7.2462654,8.640861,Cluster 10,ZNF2,ZNF121 PPAN-P2RY11 PTCD3 IMP4 RBM19 PRPF4B DDX31 RPS3A REXO4 GNL2 MRPS7 GTPBP4 MRPS9 DKC1 RPL37A CEBPZ CDK12 BUD13 CDK13 ZCCHC9 STAU2 PAK1IP1 ZC3HAV1 PRDM15 CTCF RPF2 AATF DHX30 HERC5 TAF1D TAF1B RPL17 RRS1 ZNF189 C9ORF114 ZNF184 UTP3 CCDC137 DNTTIP2 DDX54 DDX10 PAPD5 NOC3L MRPL52 GLYR1 NOP56 ZNF498 RBM28 MAK16 RRP8 ZNF771 RPL3 ZNF770 WHSC1 MLF1IP MPHOSPH10 MRPS35 DDX24 ZNF22 ZFP62 KIAA0020 BMS1 BRIX1 ZNF800 RPL7A RBM34 ,Unresolved
5.136359,9.940734,Cluster 10,YY1AP1,ZNF496 B3GALNT2 SS18L2 FBL HIC2 CLEC3A ZMYM4 BAG1 CDC16 CEBPZ ZNF524 ZNF579 PRR20E DCAF12 NEUROG3 ,Unresolved
7.8421264,9.183785,Cluster 10,NSA2,UPF1 PRR11 ZCRB1 CNBP GNL2 NLE1 GLTSCR2 GTPBP4 MRTO4 RPL37A CCDC86 H2AFY2 RPL26L1 MAK16 RPL30 ZBTB48 MAGEA9B ZC3HAV1 PDGFB GPATCH4 WDR46 FGF3 RPL7 RPF2 RBM4 SART3 FGF8 RPL18A E4F1 DGCR8 ZNF646 RRS1 RPL18 RPS14 C2ORF60 RBM34 ,Unresolved
7.349133,9.111887,Cluster 10,HIST1H1T,UPF1 RBM19 NGDN TPM2 RSBN1 PRPF4B RPS3A CHERP GNL2 SRRM1 GTPBP4 TUBA8 ZNF71 DKC1 NAT10 ZNF724P BUD13 SREK1 RPL26L1 ZCCHC9 ZCCHC7 DHX8 YTHDC1 ZC3HAV1 NOC4L HIST2H2AB ZC3H8 ZCCHC17 ELAVL2 PRDM10 RPF2 MECP2 PURB RPL36AL HIST1H1E CCDC75 RPS5 ZNF668 RRS1 RPS3 TOE1 C9ORF114 ZCRB1 H2AFX KRR1 DDX56 CCDC137 DDX54 DDX10 BHLHA15 SCAF1 DDX52 U2SURP MOV10 HIST1H2BA ZNF92 NOL12 C3ORF26 NPDC1 RRP8 ZNF771 DDX27 RPL30 UTP23 MPHOSPH10 DDX21 YBX2 RPL10A FARS2 WDR46 KRI1 TTF1 NKAP KIAA0020 RPS15 FGF8 DHX57 BRIX1 RPS10 RRP12 SRSF12 ,Unresolved
7.8801527,9.900208,Cluster 10,ZNF644,IL17RA APOBEC3D L3MBTL1 ZNF462 ZNF324B NCAPH2 PCGF6 SUV39H2 SUV39H1 PPAN SIRT6 FBL FAM188A F9 CDC16 MIER2 RPL28 XAGE2 RPL18 SKAP1 LZTS2 XAGE3 ZNF223 ,Unresolved
8.4664955,9.31238,Cluster 10,VBP1,PDRG1 CCDC101 C17ORF79 MST4 SUPT6H PHKB DCAF5 GSPT1 UBL7 PEX7 GNB2 PFDN1 PFDN2 PFDN4 PFDN5 PFDN6 ,Unresolved
7.214279,9.2438135,Cluster 10,RRP8,RPS8 CNBP RSBN1 ILF2 GTPBP4 ZNF71 DKC1 RPL28 POP1 C8ORF33 RPL26L1 STAU1 ZCCHC6 GPATCH4 NOL6 DHX30 C3ORF17 HERC5 TAF1C TAF1D PDCD11 TAF1B SRBD1 RPL14 ZNF668 RPL18 NOP14 PRR11 CCDC137 DDX54 DDX52 DDX50 FTSJ3 DDX51 THAP11 GLTSCR2 CENPC1 H2AFY2 NOL12 RSL24D1 GLYR1 POP7 RPL3 RPL4 RPL30 WHSC1 RPL32 PPAN ZFP62 WDR46 RPL8 KIAA0020 FGF8 BRIX1 ZNF800 RPS14 CENPV RFC1 DDX31 URB2 URB1 REXO4 GNL2 RPL37A NAT10 CENPL CEBPZ ZNF512 NVL ZC3HAV1 NOC4L ZCCHC17 SPTY2D1 ZNF48 RPF1 RPF2 HIST1H1T FXR2 FXR1 MECP2 HIST1H1E DGCR8 HIST1H1A NPM1 ZNF184 SCAF1 RRP1B EBNA1BP2 MYBBP1A NMNAT1 ZNF2 C16ORF88 RBM28 MAK16 DDX27 RPLP0 MLF1IP WDR3 DDX24 MKI67IP RPL10A NOC2L RBM4 RPL18A RRP12 ZNF689 RPL7A RBM34 ,Unresolved
7.8107467,9.178618,Cluster 10,STAU1,UPF1 PRR11 PPAN-P2RY11 CNBP DDX31 FTSJ3 FBXO11 BAAT TARBP2 DKC1 PLEKHO1 NMNAT1 RPL37A PRKRA NOL12 ZNF512 GLYR1 RPL26L1 C16ORF88 RBM28 RRP8 RPL30 STAU2 ZC3HAV1 RBM4B PPAN GPATCH4 WDR46 ELAVL4 RPL8 KIAA0020 RPL18A HIST1H1E RPL14 BRIX1 CPNE4 RRS1 HIST1H1A RALY MAGEB10 RPS14 RBM34 ,Unresolved
7.9014063,9.871093,Cluster 10,ZNF777,ERP44 ZNF398 ZBTB48 ZC3HAV1 DGCR8 WDR46 RPSA VTN RBM34 ZNF212 ,Unresolved
8.617351,8.941179,Cluster 10,SRRM1,CDX1 ZNF22 PDGFB MKI67IP HIST1H1T CLK2 RPL18A TRA2A P4HA3 ZC3H18 RPL14 C11ORF57 RBM34 ,Unresolved
8.602408,9.221012,Cluster 10,BUD13,CDX1 GPKOW PDGFB MKI67IP GPATCH4 WDR46 HIST1H1T RBM4 ZNF2 RPL37A RPL14 NOL12 ZNF512 RPL18 RPS14 ,Unresolved
7.5963693,9.335229,Cluster 10,MPHOSPH10,SART3 FGF8 ZNF2 RPL37A ZC3HAV1 DGCR8 RPS2 RRS1 FGF3 HIST1H1T ,Unresolved
8.443545,9.405569,Cluster 10,RPL4,MAK16 RRP8 NPM1 PRR11 RPL30 PRDM5 CNBP GPATCH4 GLTSCR2 RPL8 KIAA0020 SART3 RPL18A RPL37A RPL14 RPL28 RRS1 H2AFY2 ZNF512 MAGEB10 RPS14 ,Unresolved
8.340353,9.72311,Cluster 10,RBM28,NPM1 PRR11 CNBP SRP68 GLTSCR2 ZNF2 RPL37A RPL28 H2AFY2 C16ORF88 MAK16 RRP8 STAU1 RPL30 ZBTB48 PRDM5 ZC3H3 ZC3HAV1 PDGFB MKI67IP GPATCH4 WDR46 KIAA0020 RBM4 MECP2 SART3 RPL18A HIST1H1E RPL14 DGCR8 RPL18 RPS14 RBM34 ,Unresolved
8.137341,9.085014,Cluster 10,MRPS14,RPL6 MRPS27 ZNF274 RPS8 MRPS15 MRPS34 MRPS11 ZFC3H1 MRPS31 TRA2A SNRNP70 RG9MTD3 RBM42 ,Unresolved
6.6977987,9.024622,Cluster 10,ZNF692,TRMT1L IMP4 STAT2 MGA DDX54 DDX31 FBXO11 REXO4 GTPBP4 POLR1E RAD18 CEBPZ RPS26P11 POP1 KBTBD8 RPL26L1 DDX27 HIBADH WHSC1 DDX24 SPTY2D1 PWP2 RPF2 RRP7A C18ORF25 NSD1 ASTE1 RBM34 ,Unresolved
8.570235,9.275282,Cluster 10,NLE1,RPL30 CNBP IGHMBP2 MKI67IP GPATCH4 RBM4 MECP2 NSA2 THAP7 PLEKHO1 RPL15 H2AFY2 NOL12 RPL18 ,Unresolved
8.622246,9.001643,Cluster 10,NAT10,RRP8 RPS8 THUMPD1 GPATCH4 HIST1H1T MECP2 FGF8 RPL18A NOL10 RPS2 NOL12 ZNF512 RPS11 RPS14 ZNF169 ,Unresolved
8.349844,9.438381,Cluster 10,RPL10A,NPM1 CNBP HIST2H2BF GLTSCR2 RPL37A MDM2 FYTTD1 RPL26L1 C16ORF88 RRP8 ZCCHC7 RPL30 PRDM5 ZC3H3 ZC3HAV1 NOL8 RBM4B U2AF2 GPATCH4 WDR46 WDR89 HIST1H1T KIAA0020 MECP2 SART3 RPL36AL RPL18A ZNF707 HIST1H1E DGCR8 RRS1 RPL18 MAGEB10 RPS14 RBM34 ,Unresolved
7.8669147,9.2106085,Cluster 10,RRP12,RRP8 PRR11 ZNF324B TNFRSF13B CHCHD10 PDGFB MKI67IP GPATCH4 FGF3 TNFRSF1A RPL7 FMR1NB HIST1H1T BYSL SART3 FGF8 HIST1H1E TSR1 RPS2 WDR5B HIST1H1A SCN3B RPS14 ,Unresolved
8.1903715,8.355949,Cluster 10,NOP14,BYSL RRP8 ZNF324B STX7 HIST1H1E GPATCH4 ZNF414 SEC31A HIST1H1A STX12 RPS14 ,Unresolved
7.374756,9.260102,Cluster 10,RPL28,PPAN-P2RY11 RPS8 PLCH1 GPR98 RPS3A CDC42BPA PEX14 TUBA4A KLHL21 PTPRD DKC1 POLE2 RPL27 RPL26L1 ZCCHC7 PTPRK CELSR2 TRO TUBB3 ZDBF2 C1QBP RPL14 RPL19 GPRASP2 HIST1H1A RPL18 HIST1H1C HIST1H1D ZNF184 LOC100507290 KIAA0232 FTSJ3 SDCBP IFFO1 NCL FAT3 FAT4 FREM2 ZNF354A GLYR1 RBM28 RPL5 RPL6 RRP8 RPL3 RPL4 RPL30 WHSC1 RPLP0 MLF1IP KLHL15 RPL32 RPLP2 RPL8 KIAA0020 POLE AKAP11 RPL18A SIPA1L2 GSG2 BRIX1 RPL36 ZNF644 RPL7A RBM34 ,Unresolved
7.898859,9.012137,Cluster 10,RPF1,NPM1 UPF1 ZCRB1 ZNF460 RPS6 CNBP ZBTB11 WDR74 MRPS5 RPL37A H2AFY2 ZNF512 RPL26L1 MAK16 RRP8 RPL30 ZNF324B STAU2 ZC3H3 MKI67IP RPS16 SART3 RPL18A RPL14 E4F1 ZNF689 ZNF324 MAGEB10 ,Unresolved
5.1019835,9.912447,Cluster 10,MOV10,APOBEC3D RPL6 PRR11 FBXW11 ZC3H3 ZC3HAV1 PPAN ZFC3H1 ILF2 ELAVL2 GSPT2 GLTSCR2 HIST1H1T NXF2 FGF8 TRA2A HIST1H1E E4F1 DGCR8 RRS1 DCAF12 HIST1H1A LUC7L2 HNRNPA1 ,Unresolved
6.4354906,6.6197205,Cluster 10,MINA,HEXIM2 RBM18 MECP2 SURF2 RPL18A UIMC1 C9ORF9 POLL H2AFY2 RPL18 ,Unresolved
7.6654115,9.064239,Cluster 10,MAGEB10,CENPV DDX31 GTPBP4 MRTO4 RPL7L1 CEBPZ PRKRA C8ORF33 RPL26L1 STAU1 NOP2 RPL13 SDAD1 SPTY2D1 CDKN2AIP RPF1 LLPH GTPBP10 C1QBP RPL15 RPL17 HIST1H2AG LYAR MAGEA10 H2AFX DDX56 NSMCE1 RRP1B NOC3L MYBBP1A MAGEB4 FARSB RSL24D1 RPL5 RPL6 RPL3 RPL4 RPLP0 RPL32 RPLP2 RPL10A NOC2L RPL7 KIAA0020 RPL18A GOLGA2 BRIX1 MAGEC2 RPS13 ,Unresolved
7.4554825,8.593385,Cluster 10,ZBTB48,ZNF121 PPAN-P2RY11 PTCD3 RBM19 MRPS18C MRPS2 RPS3A FBXO11 GNL2 MRPS7 MRPS5 GTPBP4 NSA2 MRPS9 DKC1 CEBPZ RPL26L1 DAP3 LRP2 ZC3HAV1 MRPS10 MRPS11 ZBTB24 CTCF HIRA NOL6 RPF2 RPL36AL RRP7A NSD1 SRBD1 DGCR8 RPS3 HIST1H1A HIST1H1C TPD52 TEX10 PBRM1 MRPS24 DDX54 SCAF1 FTSJ3 TSR1 ZNF777 GZF1 APOBEC3C ZNF498 RBM28 RPL5 MAK16 LTV1 ZNF771 RPL3 UTP23 RPL32 MRPS34 MRPS35 DDX24 MRPS33 MRPS31 CENPB RPS15 DHX57 BMS1 RBM34 ,Unresolved
8.461581,9.505829,Cluster 10,DDX56,NPM1 RPL30 PPAN GPATCH4 WDR46 HIST1H1T MECP2 FGF8 RPL18A RPL37A RPL14 DGCR8 RPL18 MAGEB10 NEUROG3 RBM34 ,Unresolved
8.575566,9.300843,Cluster 10,RPLP0,RRP8 RPL30 CNBP ZC3HAV1 BHLHA15 CCNDBP1 RPL8 TUBA8 RPL37A RPL28 RRS1 H2AFY2 RNMTL1 MAGEB10 RBM34 ,Unresolved
7.3749976,8.302846,Cluster 10,BYSL,C14ORF21 NOP14 LTV1 RBM19 DHPS DDX10 NOC4L PARN NOB1 DHX36 TSR1 RRP12 C21ORF70 RPS3 SRFBP1 RPL26L1 ,Unresolved
8.623372,9.151257,Cluster 10,YTHDC2,NXF2 FGF8 ZNF550 RPL18A ZNF324B ZBTB38 WDR46 ZNF512 FGF3 RPS14 ZNF323 GLTSCR2 ,Unresolved
8.307555,9.720468,Cluster 10,GLYR1,NPM1 PRR11 ZCRB1 CDX1 CNBP RSBN1 ILF2 GLTSCR2 PLEKHO1 ZNF2 RPL37A RPL28 H2AFY2 C16ORF88 SERPINA12 ECM1 RRP8 STAU1 RPL30 KDM1B PRDM5 ZC3HAV1 PPAN PDGFB GPATCH4 WDR46 RPL8 RBM4 FGF8 RPL18A CAPNS2 FNTB HIST1H1E DGCR8 RRS1 MAGEA1 RBM34 ,Unresolved
7.1256967,8.738833,Cluster 10,PPAN,UPF1 PPAN-P2RY11 STRBP RPS3A GNL3 REXO4 GNL2 DIEXF GTPBP4 TARBP2 CSDA DKC1 RPL37A ZNF317 RPL26L1 RB1 NVL ZCCHC7 NUFIP1 STAU1 STAU2 PAK1IP1 UBR5 ZBTB24 PRDM10 DHX30 SF3B1 HIST1H1C ZNF184 KRR1 DDX56 MRPS23 DDX54 PAPD5 ZNF16 MOV10 NMNAT1 NOL10 GZF1 ZNF354A RSL24D1 GLYR1 MDM2 ZNF498 C16ORF88 ZNF574 ZNF496 RRP8 ZNF771 DDX27 RPL3 ZNF770 TCF25 MRPS35 DDX24 ZNF22 ISG20L2 ZFP62 MRPS31 YBX2 MRPL13 PPM1G RRP9 KIAA0020 NGRN LARP1 MRPL3 RRP15 BRIX1 IGF2BP3 ZNF644 RPS13 ,Unresolved
8.5452175,8.457089,Cluster 10,RIOK1,FARP2 RBFOX1 SNRPN RBFOX2 TINAGL1 CIRBP WDYHV1 LSM6 FBL LACTB FAM177A1 RPL15 GAR1 RPS2 ,Unresolved
8.525112,8.668872,Cluster 10,CHERP,RBM17 ZRSR2 FGF8 RPS8 PLOD1 WDFY2 RPS2 SNRPE JMJD6 FGFR2 HIST1H1T ,Unresolved
7.9360666,9.107153,Cluster 10,ZNF668,RRP8 PRR11 RPL30 GPATCH4 WDR46 RPL7 HIST1H1T HIST1H1E RPL14 DGCR8 NOL12 HIST1H1A ZNF512 ,Unresolved
8.342963,9.672244,Cluster 10,RPL3,NPM1 PRR11 CNBP BHLHA15 SRP68 WDR55 GLTSCR2 EBNA1BP2 PLEKHO1 ZNF2 RPL37A RPL28 H2AFY2 C16ORF88 MAK16 RRP8 RPL30 ZNF324B ZBTB48 RBM4B PPAN KIAA0020 MECP2 SART3 RPL18A CPNE4 RRS1 RPL18 MAGEB10 RPS14 RBM34 ,Unresolved
6.407916,6.764839,Cluster 10,MRPS10,DAP3 MRPS27 ZBTB48 MRPS15 MRPS34 ZC3H3 MRPS11 MRPS31 ZNF707 TRA2A SNRNP70 RG9MTD3 RPL18 AURKAIP1 ,Unresolved
7.1923194,9.158688,Cluster 10,ZNF512,ZNF121 PPAN-P2RY11 NGDN CNBP RSBN1 DDX31 RPS3A URB2 URB1 REXO4 GNL2 GTPBP4 RPL37A NAT10 ZNF724P CEBPZ BUD13 RPL26L1 ZNF431 NVL STAU1 ZCCHC6 ZNF593 ZNF273 YTHDC2 NOP2 RPL13 NOL8 HIST2H2AB ZBTB24 GPATCH4 ZCCHC17 SDAD1 RPF1 NOL6 C3ORF17 FXR1 RRP7A PDCD11 BBX TAF1A RPL14 ZNF668 RRS1 RPL18 ZNF346 PRR11 DDX54 FTSJ3 DDX51 GLTSCR2 NMNAT1 NOL12 C16ORF88 RPL5 RRP8 ZNF771 BLM RPL4 RPL30 MLF1IP WDR3 RPL32 DDX24 DDX21 LENG8 NOC2L WDR46 RPL8 RBMX2 RNMTL1 RBM34 ,Unresolved
8.520136,8.635195,Cluster 10,NSUN4,RPL30 CA10 ZNF324B RPL13 MND1 HSPD1 FGF8 KBTBD7 C7ORF45 SLC25A41 BPNT1 DENR C11ORF57 RPL18 INSL3 AURKAIP1 ,Unresolved
8.613599,9.001299,Cluster 10,MYBBP1A,RRP8 NPM1 PRR11 RPL30 CCDC59 CDX1 PDGFB SRP68 GPATCH4 FGF3 KIAA0020 MECP2 FGF8 RPL18A PLEKHO1 RPL37A RPL14 H2AFY2 TRIM44 RPL18 MAGEB10 RPS14 RBM34 C16ORF88 ,Unresolved
8.236265,9.496213,Cluster 10,MRPS18C,RPL6 MRPS27 ZBTB48 CCDC59 MRPS34 MRPS11 PDGFB MRPS31 MRPS5 GLTSCR2 ZNF707 TRA2A SNRNP70 RG9MTD3 E4F1 NOL12 RPL18 AURKAIP1 ,Unresolved
7.1009817,9.206202,Cluster 10,MECP2,CENPV ZNF483 RPS8 EIF2AK2 DDX31 URB2 URB1 GNL2 WDR36 GTPBP4 NAT10 CEBPZ RPL27 C11ORF57 RPL29 SRSF8 METAP2 RPL26L1 NVL ZNF593 NOP2 RPL13 RPL12 NOL8 TFB1M ZCCHC17 SDAD1 HIRA NOL6 RPF2 HIST1H1T FXR2 C3ORF17 RRP7A TAF1C TAF1D NSD1 PDCD11 BBX TAF1A GTPBP10 TAF1B RPL15 SRBD1 C10ORF2 DGCR8 RPL17 KPNA3 KPNA4 RPL18 TRMT1L C9ORF114 NOP16 RPP40 TEX10 DDX56 TOP3A DDX54 BAZ1A MINA RRP1B DDX51 NLE1 HIST2H2BF MYBBP1A ESF1 TRIP12 ZNF354A ITGB3BP RBAK RBM28 RPL5 RRP8 RPL3 BLM RPL32 RPLP2 FCF1 DDX24 DDX21 LENG8 MKI67 RPL10A NOC2L PWP2 RPL8 CHMP1A C18ORF21 BRIX1 RPL36 ZNF800 RPL7A ,Unresolved
8.019099,9.803979,Cluster 10,NOL8,DDX47 URB2 RPL10A URB1 DDX51 FGF3 FBL WDR89 MECP2 FGF8 GOPC ZNF512 RPL18 ,Unresolved
8.643474,9.074919,Cluster 10,ZNF121,RBM4 ZNF324B ZBTB48 ZNF2 CDX1 ZNF512 RPSA RPS14 ZNF169 ZNF286A GLTSCR2 ,Unresolved
8.260322,9.783042,Cluster 10,RPS3A,PRR11 RPS8 ZCRB1 H2AFX CNBP ZBTB38 BHLHA15 GLTSCR2 ZNF2 RPL37A RPL28 ZNF512 C16ORF88 RPL30 ZNF324B ZBTB48 ZC3HAV1 RBM4B ZNF22 PPAN U2AF2 MKI67IP GPATCH4 WDR46 HIST1H1T KIAA0020 SART3 FGF8 HIST1H1E E4F1 RPS2 RRS1 RPS14 RBM34 HNRNPA1 ,Unresolved
8.460789,8.523021,Cluster 10,THAP7,RPL18A RPL32 NOP2 TRIM26 CEBPZ ASH1L EXOC1 FBXO11 RPS27A NLE1 KIAA0020 RPL26L1 ,Unresolved
7.7615814,9.071514,Cluster 10,HIST1H1A,UPF1 RBM19 CNBP GNL2 RPSA LARP7 GTPBP4 TUBA8 ZNF70 ZNF71 RBMS1 RPS26P11 RPL28 STAU1 ZNF274 STAU2 ZFAND2B ZC3H3 ZC3HAV1 NOC4L HIST2H2AB PARN PRDM15 ZC3H8 ELAVL2 ZNF48 RPF2 DHX30 MDK RPL36AL RPS5 E4F1 CPNE4 RPS2 ZNF668 RPS3 TPPP ZNF189 TOE1 NOP14 PRR11 C9ORF114 ZCRB1 SURF6 MOV10 EBNA1BP2 NMNAT1 FGF10 NOL12 ZNF498 TRUB2 ZNF574 RRP8 ZNF331 ZNF771 ZBTB48 UTP23 MRPS34 TRIM71 DDX24 ZNF22 YBX2 FARS2 KIAA0020 LARP1 GLE1 RPS15 DHX57 PSMF1 RPS10 RRP12 RBM34 ,Unresolved
8.385931,9.452131,Cluster 10,RRS1,PTCD3 RPS8 RPS9 CNBP RPSA GTPBP4 CSDA DKC1 CDK12 SRSF5 RPL27 SREK1 RPL29 C8ORF33 DAP3 STAU1 SF3B4 RPL13 GPATCH4 DHX30 PURB PURA RPS5 RPL14 RPS2 RPL17 RPS3 SF3B1 RPL18 SURF2 ZCRB1 FTSJ3 GLTSCR2 MOV10 RPS28 MKRN1 NCL RPS20 H2AFY2 RPS25 GLYR1 APOBEC3C RPS24 RPL6 RPL31 RPL3 RPL4 RPL32 RPL35 MPHOSPH10 RPL34 TRIM71 RPL9 WDR46 RPL8 KIAA0020 RPS16 GLE1 RPS15 RPS18 RPS17 RPS19 BRIX1 RPS10 RPS12 RPS14 RPS13 RBM19 RPL13A RPS3A MRPL32 NSA2 MRPS9 RPL37A RBMS1 ZNF512 MRPS16 HIST2H2AC ZC3HAV1 NOC4L RPF2 HIST1H1T C1QBP NPM1 KRR1 RPL35A RPL23A MRPL52 ZNF2 NOP56 C16ORF88 RPLP0 RPLP2 MRPS35 RPLP1 YBX1 DDX21 U2AF2 MKI67IP MRPS31 RPL10A RBM4 RPL18A DHX57 BMS1 IGF2BP1 RPL7A RBM34 ,Unresolved
8.32288,8.36242,Cluster 10,NOC4L,RRP8 PRR11 ZNF324B PDGFB MKI67IP GPATCH4 RPL7 STX12 HIST1H1T BYSL SART3 STX7 RRS1 ZNF414 SEC31A HIST1H1A RPS14 ,Unresolved
6.7869916,9.307235,Cluster 10,UPF1,APOBEC3D PRR11 ZCRB1 H2AFX CDX1 STRBP ZFC3H1 MEMO1 ILF2 GLTSCR2 NSA2 ZNF576 RPL6 STAU1 PRDM5 ZC3H3 ZC3HAV1 PPAN MKI67IP WDR46 ELAVL2 RPF1 GSPT2 HIST1H1T NXF2 FGF8 TRA2A SNRNP70 ZC3H18 HIST1H1E E4F1 DGCR8 HIST1H1A HNRNPA1 ,Unresolved
8.466351,8.549614,Cluster 10,RSL24D1,MAK16 RRP8 PRR11 RPL30 RPL37A CNBP PPAN CPNE4 WDR46 FGF3 MAGEB10 ,Unresolved
7.2923303,8.590615,Cluster 10,NOL12,ZNF189 PPAN-P2RY11 PTCD3 ZCRB1 RBM19 CCDC137 CNBP MRPS18C DDX54 DDX10 DDX55 BHLHA15 DDX31 FTSJ3 GNL2 NLE1 GTPBP4 TUBA8 MRPS9 DKC1 NAT10 UBE2O BUD13 ZNF512 FYTTD1 RPL26L1 MAK16 RRP8 DDX27 ZCCHC7 STAU1 MRPS35 ZC3HAV1 GPATCH4 MRPS31 HIST1H1T KIAA0020 LARP1 SART3 DHX57 RPS5 ZNF668 ZNF689 HIST1H1A SRSF12 RBM34 ,Unresolved
7.8840895,9.223068,Cluster 10,HERC5,RRP8 NXF2 NOP16 KIAA1467 ZNF2 CCDC59 RPL14 DGCR8 RPS2 GPATCH4 RPL18 ,Unresolved
8.353377,9.704632,Cluster 10,RPL36,MECP2 RPL30 PRDM5 RPL37A CNBP PES1 ZC3HAV1 RPL28 GPATCH4 KIAA0020 C16ORF88 ,Unresolved
7.769173,9.222522,Cluster 10,ZNF498,RPL30 ZNF483 ZNF324B ZBTB48 RPS8 H2AFX CNBP PPAN SART3 ZSCAN20 ZNF2 RPL14 E4F1 RPS2 HIST1H1A ZSCAN1 ZNF169 RBM34 PGBD1 ,Unresolved
8.429068,9.454108,Cluster 10,ZNF771,PRR11 RPL30 ZBTB48 CNBP PPAN GPATCH4 RPL7 HIST1H1T ZNF2 E4F1 DGCR8 HIST1H1A ZNF512 RPL18 ,Unresolved
6.767887,8.958732,Cluster 10,FGF8,UPF1 PPAN-P2RY11 PTCD3 RBM19 STRBP NSUN4 IFT81 DDX31 IFT80 RPS3A AP3B1 CHERP URB1 REXO4 WDR36 GTPBP4 ANKHD1 FAM91A1 NSA2 MRPS9 IFT88 DKC1 XRN1 NAT10 TTC30A RBMS1 CEBPZ CDK12 C11ORF57 RPL26L1 DAP3 NVL YTHDC2 IFT172 NOL8 ZC3H8 SDAD1 C17ORF75 AATF HIST1H1T DHX30 MRPL40 PDCD11 CWC22 DHX36 IFT74 RPS3 DDX18 TRMT1L CDK11B DAXX ZFR ZCRB1 H2AFX KRR1 DDX56 ANKHD1-EIF4EBP3 DDX54 DDX10 DDX55 NOC3L DDX51 WDR11 SRPK1 MRPL45 VANGL2 MOV10 VANGL1 MRPL10 MYBBP1A MRPL52 GLYR1 RRP8 ANKRD17 WDR3 MPHOSPH10 MRPS35 TRIM71 DDX24 PRR3 DDX21 C4ORF14 MRPS30 NOC2L PWP2 KIAA0020 RPS16 LARP1 RPS15 C18ORF25 DHX57 IFT52 BMS1 BRIX1 RRP12 IFT57 ,Unresolved
8.503957,8.729155,Cluster 10,NAP1L1,NOP16 H2AFX RPL24 NAP1L4 HIST2H2AB MRPL35 SDAD1 VTN NAP1L5 RIC8B EPB41L5 RPL36AL HIST1H2BA FNTB FNTA RPL36A UBE2O RPL15 GNAS RPL17 RPL18 AURKAIP1 ,Unresolved
-2.3715231,5.8650603,Cluster 11,PADI3,SMARCD1 PYHIN1 MRPL38 NFKB1 OAZ3 RAB11B NFKB2 PML SGOL2 KIF3A IL31RA PADI4 FBXL4 PADI1 ,Unresolved
-1.4766511,6.3541102,Cluster 11,NEDD4L,WBP1 ARRDC1 ARRDC3 TNFRSF19 TMEM51 TNFAIP3 TMEM171 FAM189A2 LITAF TMEM92 C18ORF1 OCLN FAM189B C12ORF59 PRRG3 KIAA0247 ILDR1 ,Unresolved
-1.8002392,6.0840335,Cluster 11,DAG1,PCDHGA5 PCDHGB4 TNF HTR3C C6ORF72 PCDHB11 LGALS9C CDH5 TCTN2 FKBP9 CEACAM21 HLA-DPA1 TNFSF8 LGALS9 LGALS8 IL13RA2 PCDHAC2 ,Unresolved
-1.6557425,6.350595,Cluster 11,NDST2,CRP IGFBP1 LACRT SCGB1D1 SCGB2A2 ST8SIA4 SDF4 PTCH1 PLAUR IFNA21 SIAE ,Unresolved
