x,y,cluster,term,genes,cluster_label
-2.5090134,8.470143,Cluster 2,PTRH2,CHRM3 YIPF3 C13ORF16 SLC6A15 SLC39A12 HTR2C SIGLEC10 GPR21 TNFRSF10B HTR3A GRPR DLK1 PHYHIP CD7 CLEC5A SCGB2A2 MED21 FAM63B HMOX2 SLC18A1 TLR5 ARHGEF10 ,Unresolved
-2.9179852,9.004185,Cluster 2,DGUOK,SLC12A5 HPCAL1 DNM1 SNAP91 HPCAL4 SYN2 DCLK1 SYN1 L1CAM MAPT GNAO1 VSNL1 ARL8B STX1B STX1A CNTN1 SNAP25 NAPB STXBP1 HPCA NCAM1 NCALD ELAVL4 GNG2 DPYSL2 CALB2 DPYSL5 DPYSL3 MAP2 CAMKV HIST1H1B SNCB TMEM184A SYT1 SYP DCK ATP2B3 ANK2 ATP4A BIN1 GNAQ CDH13 DCX MAPRE3 GRIA2 RAB3A CAMK2A NTM HIST1H2BL CRMP1 PPP3R1 EPB41L1 ERC2 ATP6V1C1 DNM1L ,Unresolved
-1.2264335,8.752716,Cluster 2,AMIGO1,GABRA3 PICK1 ST8SIA3 ST8SIA4 PON2 KIAA2013 ERLIN2 ADAM33 PTPRK ADAM21 TMPRSS12 CD1B IL17RB LRRTM1 PNLDC1 NCEH1 SCNN1D GPR183 ZACN B3GNT3 MPPE1 ITM2B INSL5 ,Unresolved
0.41231433,8.914524,Cluster 2,NRG1,SREBF2 GLMN MBOAT7 LSR ZDHHC17 LEMD3 SLC25A16 LPHN1 HLA-DPB1 TMEM39B B3GNT2 INTS7 SFXN3 LGR4 CNTNAP3 PGAP1 TMEM63B TM2D3 POMT1 SLC35B2 HEATR2 CISD2 TMTC4 HS6ST1 TMEM164 GALNT11 RHOBTB3 GYLTL1B DSE SLC22A18 TUBB3 ATP7B SLC25A23 ,Unresolved
-2.2277782,9.257866,Cluster 2,PRKAR1A,STOML2 ANKRD26 PALM2-AKAP2 AKAP3 PRKACG AKAP11 VAPB PRKAR1B PRKAR2B GPR161 ZBED1 PRKACB PRKACA ,Unresolved
-1.4085546,9.0744505,Cluster 2,ACCN4,ABCA3 ALG9 OSBPL8 FBXO2 MANEAL TMPPE HLA-C EIF2AK3 LSR ALG12 HLA-B POMGNT1 TMEM231 SGPP1 TMX2 GLRB UPK3BL TMBIM6 LRP12 BSCL2 FAM69A GABRB3 ITPRIP POMT2 CISD2 ATP2A3 ADCY3 GLB1L2 TXNDC15 HSPA14 UFSP2 CNNM1 NETO2 CHST10 TMEM206 CLPTM1 TSPAN6 TMEM8A PDZD8 ,Unresolved
-2.725922,9.102989,Cluster 2,DNAJB9,EGFL8 SCARA3 FAM5C ST8SIA3 PLAUR PLXDC2 FAM136A OLFM2 P2RX5 ZACN MANSC1 CHST6 APP GRIA3 COLEC10 PROZ LYZL1 PTPRK LYZL2 TRHDE FGF3 CLEC18A SGCD TNFSF11 C17ORF101 GABRD TMED6 LRRC4C ,Unresolved
-1.2627068,9.261998,Cluster 2,GNAI3,GPSM1 RGS14 DCUN1D5 ATP2A3 RAP1GAP GNAI1 GNAI2 TMEM48 TMEM222 PCP2 RIC8A GNG11 GNG4 GNG10 GNB1 GNG5 CLTCL1 GNB2 GNAO1 GNG7 GNB4 RGS12 GNAT2 ANKRD13B ,Unresolved
-0.19363554,8.810713,Cluster 2,GPR89C,SLC4A8 B4GALT3 TMEM63A MAS1 P2RY1 APLNR GDPD5 SERINC1 TXNDC15 ST3GAL1 GABRE ,Unresolved
-1.6202496,8.622684,Cluster 2,HSPB9,FBXW5 CYFIP2 ISCA1 NCKAP1 RAP1GDS1 USP12 ZNF507 PARS2 KPTN ITFG2 ,Unresolved
-1.9154246,9.28553,Cluster 2,APBA2,NECAB3 TRIM41 FBXW11 USP33 IQSEC2 DDX24 ZNF518A TJAP1 IQSEC1 PLD1 HERC2 DMWD AAGAB APEX2 USP20 APBA1 BTRC KLRG2 ,Unresolved
-2.843683,8.902021,Cluster 2,SDR9C7,RBFOX1 AIRE DPPA4 NPPA ZIC1 HSF2 CCDC103 FCF1 PLK2 PI4KA TBC1D22B VAV1 ,Unresolved
-1.2128001,9.234554,Cluster 2,BSCL2,POM121 GABRA6 SLC35B2 TMPPE DNAJC13 HDGFRP3 UPK1A ZDHHC17 HTR3A GABRG2 TSPAN17 GLRA2 EBP CHPT1 ACCN4 TMEM25 TSPAN5 B3GNT1 CD47 SLC39A3 GABRE ,Unresolved
-2.0718892,9.172997,Cluster 2,PIGO,POTEI ATP2A3 PTH1R ATP2B2 ATP1B3 HTR3C UPK1A HTR3A GPR114 LPAR1 ,Unresolved
-2.0297108,8.966908,Cluster 2,CAMK1D,QPCTL AMY1C XYLT2 CST1 LAMP3 GNRHR CKS2 CAMK1 ZG16B C9ORF173 CAMK1G CALM3 MUC7 ,Unresolved
-1.872233,8.960723,Cluster 2,S1PR1,SRC ARL10 TTYH3 GOLPH3L ATP1A3 ATP2B3 LMBR1 ATP12A RAP2A HK3 GNG5 GNA13 GPRIN1 GNAQ POTEF HRAS CD47 CLEC2D ACP2 ,Unresolved
-2.673021,8.621012,Cluster 2,C4A,SLC15A1 PVR ATP2B2 OCLN LAMP1 TMEM89 SNX27 VSIG1 CCL5 GDPD1 FAM171B SCN2B LGALS8 ,Unresolved
-1.4944446,8.950882,Cluster 2,ANKMY2,GUCY1A3 GUCY1B3 EIF2C4 HSP90AA1 HSP90AB3P KLHL26 PTGES3 ADCY3 KIAA1310 ADCY6 SNX4 FKBP8 EIF2C3 ,Unresolved
-1.9408319,8.591056,Cluster 2,DMXL2,ANTXR1 RP2 C1QTNF2 YBEY NPY2R ROGDI GLUL WDYHV1 DEF8 TSPYL6 ,Unresolved
-2.812404,8.945015,Cluster 2,TARBP1,SLC2A12 RASL10B GMNN FAF2 LYPD3 DLK2 CD79B BSG PLA2G10 SCGB2A2 VSIG1 FAM19A3 TNFRSF17 C19ORF45 RAB6B SCN2B NEFH SCN3B RGS20 ,Unresolved
-2.8794544,8.883733,Cluster 2,LCLAT1,PRRT2 IPPK GPR21 ADAM32 ADAM21 ATP2B2 ADAM30 DLK2 FRMD3 GABRG2 SLC4A8 CHRND FAM134C ADAM2 TSPAN5 CLEC2D TSPAN2 GPR114 ,Unresolved
-2.4761333,8.546743,Cluster 2,PPP2R1A,FOXD4 ZNF331 TBCCD1 ZNF550 CDCA4 PPP2R3A PPP2CB SERTAD4 FAM122A PPP2R2D PPP2R2C ZNF517 IER2 NCAPD3 ZNF114 PRR14 ,Unresolved
-2.5282097,8.759774,Cluster 2,AZU1,ZYG11B OSBPL6 BIN3 STAT3 FBXO2 FIGNL1 ERBB2IP CBWD3 SH3GL1 DIEXF SH3GL2 ,Unresolved
-2.493549,9.081687,Cluster 2,CGN,YWHAG TJP1 ACTA2 YWHAE YWHAB YWHAQ YWHAZ PPP1R9A CCDC102B YWHAH DAB2IP ,Unresolved
-2.607663,9.074301,Cluster 2,SKA3,SKA1 PPP2R2D PPP2R2C CCDC85C CCDC85B PYCR2 NOL4 LRRCC1 C20ORF112 SKA2 ,Unresolved
-1.6441867,9.243136,Cluster 2,CWC22,EDA FAM9A DENND2D SYT1 PTGER3 FMR1NB EPB41L5 MDK FGF8 DOK4 CTDSP2 EPB41L2 C19ORF75 CAMKV GPR183 PES1 PIP4K2A VTI1B ERMAP C11ORF57 ,Unresolved
-2.503285,8.752837,Cluster 2,STX19,ZNF277 STXBP1 PRMT3 STXBP5 STXBP2 SNAP23 STXBP5L ZWINT TRIM9 SULT1A2 VAMP8 TBK1 VAMP2 VAMP3 ,Unresolved
-2.249386,8.86252,Cluster 2,KLHL28,AKAP11 NUDCD3 CUL7 KLHL26 CUL3 IPP KLHL13 KLHL24 KLHL14 FBXL17 PRKACB KLHL21 ,Unresolved
-1.0818539,8.998562,Cluster 2,MAPK9,LRRC15 SERPINB5 C5ORF24 RASL10B WNT7A ZFC3H1 TULP3 DTX3 LRRC56 MAPK8IP1 DUSP14 HOXC10 MAPK8 FAM19A3 PKP3 RHPN1 ZNF414 CCDC120 HIST1H1B ,Unresolved
-2.0095809,8.873277,Cluster 2,PPP2R5D,USP47 CELA3A GPR37 DNASE2B WNT3A FAM43A PON2 BTBD6 BMP7 RPS27 PPP2CB PPME1 YBEY CCNG2 CCNG1 PDDC1 FBXL3 BCAT1 PRR14 RAPGEF5 ,Unresolved
-1.9863049,9.330203,Cluster 2,SEPT7,SEPT10 SEPT11 SEPT12 SEPT1 SEPT2 SEPT14 SEPT5 SEPT6 SEPT3 SEPT4 MRPL12 SEPT9 SEPT8 CDC42EP4 ,Unresolved
-1.9417851,8.891931,Cluster 2,RAB32,FCGR3A RABGGTA SLC22A6 LPAR6 RAB38 GDI1 CHM CLTCL1 SLC39A12 CHML GRPR ,Unresolved
-1.736196,8.228496,Cluster 2,KIAA1524,CHRM4 VIPR2 CD274 CD83 IL1R2 NPY2R HTR2C LRRC4 FZD10 COMTD1 VASN LRFN4 ALDH3A2 EDNRB PNKD VSIG2 C19ORF75 CEACAM21 SCN2B CA14 ,Unresolved
-1.5526488,8.950082,Cluster 2,EPHA7,TMPRSS11B KIAA0090 TMEM30B HSPA5 LRRIQ1 WNT5A PICK1 RPL23 IL17RC TUBA4A IL17RB RAET1E OAF MBLAC2 PC BCAM TMX1 SMOC1 MANSC1 EPHA4 MRAP2 EPHA3 EPHA10 NID2 EFNA5 AGAP1 C13ORF34 NPTX1 IARS2 CACNG2 MICA ,Unresolved
-1.9488779,9.296186,Cluster 2,SEPT2,SEPT10 SEPT11 SEPT12 SFTA2 TPM2 SEPT1 SEPT5 SEPT6 SEPT3 SEPT4 MRPL12 SEPT9 RGS3 SEPT7 SEPT8 CDC42EP4 ,Unresolved
-0.20939049,8.436758,Cluster 2,CCNL2,YES1 IREB2 SRC CDK11A CSTF3 IRF2BP2 ZBTB43 IRF2BP1 C12ORF75 JMJD6 PTPRG GAP43 SNX1 CCNY RRAS GNAQ NF2 FYN ULBP3 GNAZ CNTN1 ,Unresolved
-2.2755475,8.788628,Cluster 2,TTC17,GABRA3 GRAMD1B PVRIG ADAM33 PTCH1 LYZL1 LYZL2 DEFA1 LMAN2L MCOLN3 PLXDC2 HTR3A PCDHB11 TNFSF13B LRRTM1 P2RX5 OS9 NAAA SCGB2A2 ZACN ENPP7 GABRE GABRD ,Unresolved
1.7015921,7.606384,Cluster 2,TMEM30B,CA12 EPHA7 SEMA4F SEMA4C ITFG1 PCDHGA11 C20ORF30 PTPRF GPRC5C LRFN1 MFAP3 SIDT2 TNFSF9 ULBP3 DSC2 ULBP2 PVRL2 DSC3 IGSF8 APP PTPRS B4GALT1 STXBP3 C3ORF52 CELSR2 CELSR3 MANEA IL27RA PRTG FAM171A2 FUT8 TMEM67 MPZL1 MAN1A2 APBB2 MAN1A1 STX4 NUS1 C1QL1 TMEM30A KIRREL JAG2 IFNGR1 LRRC8A PCDHGC4 GP1BB C1QL4 SDK2 OCLN LPHN1 CDHR1 LOC100507680 IGDCC4 FGFR1 TYRO3 FGFR4 FGFR3 FGFR2 CD276 KLHL15 GOLT1B PODXL2 PCDH10 ACVR1B TMEM143 PCDH17 FCGRT SGCE NETO2 NAALAD2 PCDHGC3 PLXNA2 PCDH7 TSPAN6 TSPAN3 KIAA0319L SCARB1 KLRG2 ,Unresolved
-1.0636325,9.349166,Cluster 2,SNX9,CPNE5 AURKA AP2B1 AP1B1 AP2A2 AP2A1 DNM1 DNM2 DNM3 FCHSD1 HNRNPK SYNJ1 DPPA4 MLYCD AP2M1 ,Unresolved
-2.9128172,8.966363,Cluster 2,ARMC1,SYT1 HSPA8 SYN2 SYN1 ATP4A MAPT DNAJC11 GNAO1 VSNL1 STX1B CNTN1 GPM6A STXBP1 RAB3A NCAM1 CAMK2A HIST1H2BL CRMP1 HSPBP1 GNG2 DPYSL2 EPB41L1 DPYSL3 MAP2 SNCB ,Unresolved
-2.8025086,8.966106,Cluster 2,FAR2,PEX19 CHRNA3 VNN2 SLC39A12 PCDHGB1 ATP2B2 B3GNT1 SCN3B GRPR SLC39A4 ,Unresolved
-1.1931721,9.330411,Cluster 2,SAMD4A,DDB2 PDP1 YWHAG GAN YWHAE YWHAB SAMD4B CSDE1 TNIP1 INPPL1 YWHAZ YWHAH ,Unresolved
-1.4871597,8.990207,Cluster 2,GJB7,GRTP1 AHNAK2 PPP2R5E EEF1A2 GNAO1 GPRIN1 EPHA2 ULBP3 ULBP2 CNTN1 C8ORF47 NRN1 AHNAK SNAP23 EFNA5 ZMPSTE24 PTPRG NRAS FAM171A2 WASF2 ARVCF PAG1 YES1 CCNYL1 RFTN1 SVIP EEPD1 DLG1 GAP43 CCNY PROCR CD109 GNAQ GNB4 INA GNAZ CSNK1G3 NCKAP1 PYGB PALM3 AP2A1 EFR3B EFR3A PALM EPB41L2 PRKAR2B MICAL1 UBTD2 HRAS FYN UBTD1 ,Unresolved
-2.330855,8.775259,Cluster 2,LZTR1,NUDT12 KBTBD4 PRPSAP2 EIF4A3 NUAK2 RIT2 RIT1 AIFM3 UBE2O NCK2 ,Unresolved
-0.751216,8.512033,Cluster 2,PIK3CB,CHRM3 DOCK5 ZDHHC1 NLGN3 PTGER3 PCBP1 PIK3R3 PIK3R2 TGFBR2 EFNB2 CDH5 C12ORF59 P4HA2 RNF19B FLRT1 IL20RA MANSC1 GRB2 HAVCR2 CACNG5 RAPGEF5 ,Unresolved
-1.2337935,9.3347025,Cluster 2,EID1,ASPM MYO1D MTPAP BDH2 UBB MYO5A CUL1 KLC2 MYO9B FBXO21 ,Unresolved
-1.0359501,9.304148,Cluster 2,C19orf21,KLHDC3 FARP2 RDX MSN AMD1 DYRK1B HSPA12A RABEPK EPB41L1 RPS6KA1 RPS6KA3 EPB41L3 RPS6KA2 OBSL1 EZR ,Unresolved
-1.9593581,8.178953,Cluster 2,DAGLB,IGSF8 IPPK PCDHGA5 SPACA1 PCDHGB4 PMEL ENTPD7 TMEM171 TPCN2 SPINT2 VSIG1 TSPAN5 APLNR VSIG4 MANSC1 PDCD1 TSPAN2 DKFZP686O24166 PCDHAC2 ,Unresolved
-2.9376862,8.9744425,Cluster 2,CDCA8,STXBP1 SYT1 CAMK2A MTHFR CRMP1 SNAP91 DCLK1 GNG2 ATP4A MYH3 MYH4 MAPT DPYSL3 VSNL1 BIRC5 TRIM44 MYH7 ,Unresolved
-1.7232406,9.18195,Cluster 2,RAB3IL1,FAM49B TMEM102 RAB3IP ATG4C RAB8A GDF5 CCDC102A PPIL4 AMOT OPTN PPFIA3 SUGP2 ,Unresolved
-1.8448546,9.096353,Cluster 2,ECM1,FAM36A RBFOX1 CFI C21ORF59 CUL1 NSG2 GMCL1 FRMD1 MMRN1 DPPA4 NPPA ZIC1 ZSCAN12 PLCZ1 FTH1 CA8 PI4KA TBC1D22B MCL1 CCDC51 GLYR1 ,Unresolved
2.8907633,4.529763,Cluster 2,KNG1,ZNF562 LEPREL2 CTSL2 CTSO PPP2R2C SNX27 GDPD1 MRC2 TCTN1 VHL ANAPC5 CAPN1 ANAPC1 ,Unresolved
-2.066205,8.903886,Cluster 2,APBB3,APP BLK APLP1 APLP2 GPS1 COPS7B COPS7A RHOBTB1 RHOBTB2 COPS5 RBM14-RBM4 COPS4 COPS6 UBB COPS3 COPS2 PSMG3 HGFAC ,Unresolved
-2.3765085,8.601596,Cluster 2,SLC34A2,SLC30A7 LINGO2 PCDH10 CACNA2D1 ENDOD1 LMTK2 ATP11C ZDHHC18 SYNGR2 KIAA1715 KRIT1 ATP6V0A1 ATP6V0A2 ,Unresolved
-2.2586503,9.195496,Cluster 2,MPRIP,CCDC101 PLK1 NECAB1 VTN FNDC4 JPH4 VAPA VAPB PSAT1 ZFP41 WDR83 CTAGE5 PSMC3 TCP10L2 BTRC PACSIN1 PACSIN2 ,Unresolved
-2.8382506,8.991701,Cluster 2,MRS2,TSPYL1 CHST8 P2RY12 TBC1D9 SYP MINPP1 INTS4L2 FEZ1 NGEF AURKAIP1 DFNA5 ZNF133 IPPK SPPL2B HTR2C NOL9 MRPL35 BZW2 VTN LPAR1 JPH4 LUC7L ZNF747 TBC1D15 SLC39A5 KCMF1 ,Unresolved
-0.9785605,9.273302,Cluster 2,PLD1,ZRANB2 TEX264 OSBPL5 SPACA1 GPR77 TNFRSF19 C1ORF186 CDH5 MIER2 UBE2O APBA2 GPR156 CACNG5 KCTD17 ,Unresolved
2.0264416,6.957337,Cluster 2,GRAMD3,EXD2 GRAMD1C GRAMD1B GRAMD1A HOMER1 TXLNG KIAA0494 GOLM1 CASC4 TXNDC15 MARCH5 TXLNA DDRGK1 BNIP1 ,Unresolved
-1.053131,9.283143,Cluster 2,RAP1GDS1,RHOA TSC22D4 IRGC RASL10A RHOF VASH1 BAIAP2 SEPT6 RHOC RAB34 ARL4C RAP2C RAB15 RBM42 DNAL1 RABL3 DIRAS1 PLEKHB1 HSPB9 DIRAS2 PRDM10 RAP1A RAP1B NKIRAS2 NT5C RAC3 UBTF RAC1 RAC2 APBB2 IL13RA1 ,Unresolved
-1.7083288,9.323258,Cluster 2,TRIP6,IGFBP1 SUN1 ZNF384 CCL21 RAB39B WTIP DEF8 LRFN4 RIPPLY2 GAPDHS LIMS1 CDKL1 FGL1 KLC1 LIMD1 EFTUD1 GATA1 PHYHIP KIF5A KLC4 KIF5C JUB SAFB2 KIF5B ANKRD55 LPXN C17ORF101 ATG7 PDLIM7 ,Unresolved
-2.3409276,8.356234,Cluster 2,SLC4A2,PTGIR GPR21 PTH1R ATP2B2 C1ORF64 LGALS9C SLC4A8 SPDEF FAM134C LGALS3 APLNR KDELR3 SLC39A8 LGALS8 XPR1 ,Unresolved
2.075537,7.1422753,Cluster 2,IL1R2,EXOC8 SLC30A5 EXOC6B OCRL TBCD ATP2B2 SCRIB KIAA0391 DNM3 GNPAT NDUFS4 EXOC5 EXOC4 EXOC7 MYADM EXOC6 EXOC1 EXOC3 EXOC2 NLRX1 TRMU AARS2 NDUFA12 ATL2 CISD2 CBWD3 SEZ6L2 LRRC1 LOC100510688 RHOBTB3 DSTYK KIAA1524 ORC4 LONP2 QSOX1 NUDT16 RSPRY1 CCDC51 ,Unresolved
-2.1480665,9.296772,Cluster 2,GPR161,RTN4 FBXW11 USP12 ATP2B2 JPH1 LMBR1 PRKACG GOLGA5 PRKAR1B PRKAR1A UBE2Q1 GNB4 PRKACB BTRC PRKACA ,Unresolved
-2.4237354,8.723327,Cluster 2,MED9,MED1 CDK19 CDK8 TCL1B SPAG9 MED21 CARM1 CCNC MED19 NRGN MED7 MED18 ,Unresolved
-2.3006938,8.90529,Cluster 2,MAPRE1,MACF1 KIF18B PPP1R13L DST PDE4DIP PRKAR2B AKAP9 TROAP MAPRE2 MAPRE3 CLASP2 GAS2L1 ,Unresolved
-2.1530545,8.854554,Cluster 2,FLRT1,PIK3R3 PIK3R2 FAM115C PCDH17 LPHN1 LPHN2 FLRT3 PIK3CB PIK3R1 PIK3CA RADIL PCDHGC3 PCDH7 LPHN3 BLZF1 ,Unresolved
-0.9902594,8.766161,Cluster 2,DUSP22,YES1 IKBIP CCNYL1 HPCAL1 C12ORF75 SVIP LARS2 SPECC1L GNAO1 GNAQ LAMTOR1 CUEDC1 ULBP3 EIF4E2 ULBP2 VAMP3 CSNK1G3 C8ORF47 NRN1 DIABLO C7ORF59 PTPRG GNA14 INPP5A RAP1A KCTD21 PALM GNA11 GNG5 GNA13 SRP54 CTNNA2 UBTD2 POTEF ARFIP2 FBXO7 HRAS PAG1 ,Unresolved
-2.1006613,9.365493,Cluster 2,SEPT1,SEPT10 SEPT11 SEPT2 SEPT5 SEPT6 SEPT3 SEPT4 SEPT9 SEPT7 SEPT8 NRD1 ASB7 MYO18A ,Unresolved
-0.9290235,8.690102,Cluster 2,SLC25A41,RALBP1 NSUN4 HPCAL1 EPN1 C12ORF75 PAWR DAB2 CTH STAMBP EPHA2 VPS28 C8ORF47 STXBP2 BTF3L4 CPNE8 FBXO46 FAM125B FAM125A CD2AP PAK1 FCHO2 BASP1 GNG5 RRAS GNG7 EPS15 CTSH RPRD1B REPS1 AZI1 PAG1 ARHGEF12 YES1 TMOD2 SPECC1 RFTN1 BOLA1 PRKCA MPP7 GAP43 SPECC1L GNAQ AIDA BMP2K GNAZ CSNK1G3 SRC STON2 AP2A1 HSPD1 CORO1A INPP5A GNG10 PCM1 NARS2 NCS1 MICAL1 GNA13 NUDT19 VPS36 PIBF1 HRAS FYN ,Unresolved
0.051537294,8.794135,Cluster 2,KLRG2,EGFL7 TOR1B TMEM30B ST8SIA3 WNT5B TMEM192 FNDC3B GLRX3 ZDHHC18 PCDHA12 F5 FAM189B TNFSF9 APBA2 MANSC1 ST6GALNAC4 CD47 UBA52 EPHA4 UBXN1 POM121 COLEC12 PTPRS ST6GALNAC3 TNKS AURKA GXYLT2 HTR2C ZDHHC6 PRSS23 LTBP1 FGFRL1 PPP3CA PPP3R1 FAM171A2 PPP3CB WNT11 PPP3CC STBD1 STK39 TIMP3 HLA-DPA1 EMILIN3 EPHB1 LRRC4B GPR114 EPHB4 ,Unresolved
-2.1604376,9.130429,Cluster 2,C10orf58,CSGALNACT2 TMEM30A RTN1 ADPGK YIPF3 MME SLC39A12 HLA-C TACR1 GDPD5 HLA-G GRPR CHRND A4GNT FAM131B TSPAN5 SLC18A1 TLR5 GPR114 ,Unresolved
2.151892,7.2864904,Cluster 2,LRPAP1,LRP2 ROCK2 LRP1 LRP4 LCOR VLDLR SORL1 LRP8 LDLR LRP1B ,Unresolved
0.23454696,9.009209,Cluster 2,USP25,LRFN4 USP28 KCTD10 GDI1 UBB APPBP2 TNFAIP1 RAD23B KCTD13 CROT BTBD9 ,Unresolved
-0.911823,9.190502,Cluster 2,SCNN1D,AMIGO1 ALG9 CLSTN3 FAM54A POMT1 TAP2 KIAA1751 DNAJC16 LRRC3 STX11 DPY19L1 ERMP1 ABHD16A LOC100507680 CANX ANGEL1 CLPTM1 LRP12 ,Unresolved
-1.3376753,9.356409,Cluster 2,RAI14,PLK1 CAV3 NECAB1 PARP16 VTN VAPA VAPB ZFP41 PSMC3 PACSIN3 BTRC PACSIN1 PACSIN2 ,Unresolved
-2.5729961,8.756479,Cluster 2,DUSP14,OR51E2 C2ORF77 ACAD8 B3GALNT1 SETDB2 PMM1 PYHIN1 SYT16 GDF5 FAM136A RAB11B FOXP2 COASY MAS1 LPCAT4 ACOX1 IL31RA PI4KA FBXL4 NSMAF SMARCD1 ST6GALNAC3 HEATR1 MRPL38 CPLX3 OAZ3 RHOBTB2 FAM105B RASGRP4 P2RY8 MAPK9 SGOL2 GPBP1 TFG KIF3A RAB11FIP4 C13ORF31 CCDC51 ,Unresolved
-1.4772713,8.240314,Cluster 2,FAM134C,YIPF4 RNF170 KTN1 ATP5F1 TSPAN17 TSPAN15 MAS1 PLSCR1 REEP5 RMND1 NDUFAF1 CD47 RTN4 CD63 DAZAP2 IPPK TTYH3 NCAM1 HTR2C GPR21 XYLT2 SLC4A2 SLC35F2 JPH1 LCLAT1 TUBA3C LASS6 ATP12A LPAR1 SLC6A5 ATP5B GNPTAB TSPAN5 TMEM208 ARL6IP5 SGK196 COX1 ATP9A ,Unresolved
-1.9803032,8.296914,Cluster 2,ATP6V0E1,PTPRF REEP5 CCDC115 VMA21 ACP2 PIGG SLC7A2 ATP6V0A1 ATP6V0A2 TMEM199 ,Unresolved
-2.6942906,8.812756,Cluster 2,ATP9A,RIC3 SLC15A1 IPPK YIPF3 SPPL2B C3AR1 SYP FPR2 SLC1A5 ATP2B2 COMMD8 RANBP6 LPAR1 FAM134C TMED2 B3GNT1 SLC22A9 SCN3B IFT57 SLC39A4 ,Unresolved
-1.791082,9.188235,Cluster 2,RCAN1,GSK3B GSK3A AMY1C CST5 PPP3CA CLEC3A PPP3R1 PPP3CB PPP3CC FAM122A CST2 C6ORF211 SRBD1 ZG16B IGHA1 ,Unresolved
-1.016841,9.074587,Cluster 2,S100A3,OR51E2 ZMAT4 TFG PYHIN1 IL31RA SEMG2 C1ORF49 FBXL4 MRPL38 RAB11FIP4 RAB11B COASY ,Unresolved
-2.4241476,8.992961,Cluster 2,DPYSL4,KLHDC3 OLFM2 DOCK5 DPYSL5 DPYSL3 LYPD4 WDFY3 DEF8 LGALS7 SKP2 ,Unresolved
-2.0653102,9.018895,Cluster 2,CBARA1,DOCK5 ARL10 SLC39A12 THUMPD3 KLHL22 GPN3 PCDHB11 RANBP6 CD79B CD79A CDH5 TUBA1B FAM131B ANGEL1 EFHA2 EFHA1 DCAF11 TBC1D22A TRIM44 ,Unresolved
-1.8598214,8.0469885,Cluster 2,ST3GAL4,CSGALNACT2 CRP MANEAL PTCH1 PLAUR LRFN3 OAF C1GALT1C1 DHFRL1 IDS FAM3C TBC1D15 AVP ,Unresolved
-1.0234782,8.946959,Cluster 2,CD27,TTYH3 C1GALT1 CD70 ATP2B3 TRAF2 FAM115C ADCY9 SCAMP1 C4ORF32 GOLGA5 TMEM67 SEMG1 MCART1 GNB2 SEMG2 CTNNA2 CRELD1 HRAS ADCK4 CD59 BIRC2 SLC19A2 ,Unresolved
-1.784366,8.39675,Cluster 2,PRKAR2B,PDE4DIP AMY1C KIAA1683 CSNK1E HAX1 PRKAR1B PRKAR1A GJB7 ZG16B ROPN1 MAPRE1 AKAP1 NUFIP1 CRYBG3 LOC100134230 AKAP9 AKAP7 PALM2-AKAP2 PRKX AKAP5 AKAP2 AKAP13 AKAP14 PRKACG AKAP11 ZNF707 CSNK1D MAP2 PRKAR2A CDK5RAP2 NAA25 ALX3 PRKACB PRKACA SPA17 SSX2 ,Unresolved
-2.0311792,9.326521,Cluster 2,SEPT3,SEPT10 SEPT11 SEPT12 SEPT1 SEPT2 SEPT14 SEPT5 HSD17B8 SEPT6 BTBD9 C14ORF104 SEPT4 MRPL12 SEPT9 SEPT7 SEPT8 CDC42EP4 PCMTD1 WDTC1 PCMTD2 CBR4 ,Unresolved
-2.6881535,8.829501,Cluster 2,PCNXL3,SLC13A2 YIPF3 TM2D2 GABRA6 SLC45A2 FAM189A2 PTH1R ATP2B2 HTR3A SLC4A8 LRRTM1 FAM189B ZNRF4 TMEM107 TRPM8 RNF185 SLC17A2 MRAP2 PCDHAC2 ,Unresolved
-1.1330473,9.332619,Cluster 2,NECAP2,TES ZYG11B RUNDC3A ANKRD28 ITSN1 AP2B1 AP1B1 AP2A2 AP2A1 NECAP1 SPATA1 AP2S1 CARM1 AP2M1 ,Unresolved
-1.7348645,8.466957,Cluster 2,WBP1,WWOX SLC30A7 NDUFB8 FBXW11 KCNIP2 WWP1 ZDHHC13 NEDD4L ZDHHC6 ATP2B4 SLC39A11 SYVN1 NDUFC2 HSPA12A ITCH LEMD3 ATP12A EXTL3 HECW2 NEDD4 MMS19 BTRC FAM8A1 ,Unresolved
-2.781326,9.025441,Cluster 2,CBLN4,C1QL1 FBXO2 ADAM11 NRXN3 GTF2F2 C1QL4 C1ORF103 NKIRAS1 NKIRAS2 DHFRL1 GNB2 TOPBP1 NDUFAF2 ,Unresolved
-2.290654,8.635449,Cluster 2,RAB2B,RAB1A FAM71F2 RAB1B RAB2A PRUNE GDI1 UBA6 FMN2 TTF2 ATP12A DDX19B LOC81691 DSTYK RAB21 TBC1D4 DMWD RAB14 RAB9A RAB18 RAB5A RAB4A RAB5B BCAS3 ,Unresolved
-2.645197,8.986053,Cluster 2,GLRA2,TMEM87A AMFR KCTD2 UBR3 LNPEP MARCH6 PKD2 TF CNNM1 NUP35 FAM3C LRP12 KCTD17 BSCL2 ,Unresolved
-2.4104776,8.405394,Cluster 2,TSPAN5,SLC38A2 FAM38A ALG8 PRAF2 KLHL2 SNX25 ATP2B3 GP1BB C10ORF58 ALG11 FTSJ2 THAP11 DNAJC19 IMMP1L SOAT1 GDPD1 C7ORF42 FAM18B2 CD47 NAT8L GHDC BSCL2 TMEM87A B4GALT1 DAGLB ZDHHC21 ZDHHC6 NAT14 ZDHHC9 WDR41 LCLAT1 TMEM186 SLC7A2 AGPAT3 TMEM48 FAM134C RDH12 EFNB1 RDH11 C20ORF108 RDH14 SC5DL ,Unresolved
-2.0950263,9.226674,Cluster 2,AP3M1,EDA TMEM63A AP3D1 DTNBP1 AP3B2 RTDR1 AP3B1 VASN C9ORF86 AP3M2 CD79B FERMT2 HLA-DMB RNF19B IDS CAMKV PIP4K2A VTI1B AP3S1 PALM2 AP3S2 EIF2C3 EPHA1 ,Unresolved
-1.5013245,8.978186,Cluster 2,PRKCI,FARP2 FGB ARHGEF16 RASSF8 KERA PRKCZ PARD6B KBTBD7 RHOJ PDGFD FYN NGEF GPR156 LLGL2 CD44 ,Unresolved
-2.1786218,8.6757145,Cluster 2,DHRS7,TMEM30A PCDHGA5 ATP2B2 MCOLN3 PLXDC2 TNFRSF1A TREML2 TSPAN17 FAM189B SPINT2 SRPRB TLR5 C21ORF63 CPNE5 PTGER3 PCDHGB4 IL20RB CHRNA9 TMPRSS3 GRPR CHRND KIAA1467 PCDHA3 SCN3B PCDHAC2 ,Unresolved
-2.659215,8.583247,Cluster 2,CNOT3,NANOS2 CNOT7 MMP7 GADD45B NCS1 CAPZA2 C2ORF29 TEX13A RIBC1 TOB1 ,Unresolved
-0.855072,9.430587,Cluster 2,PHC1,RNF2 CBX8 PHC3 CBX7 PHC2 CBX6 CBX4 SFMBT2 CSNK2A1 RING1 CBX2 BMI1 SCML1 TRPM3 SCMH1 COMMD3-BMI1 PCGF2 NPTXR ,Unresolved
1.9374639,6.8684435,Cluster 2,PCDH20,TRAPPC2 CBX6 TMEM132A RPL23 EIF2AK3 DKKL1 SIRT6 PRSS37 GTF2F1 SUPT7L PCDHGA11 PTPRD NMU MGAT4C MAP7D3 PCDHGB1 ITGA7 KDELR3 ITGA6 ATF6 TAB1 C2ORF48 CLSTN1 POP4 CHD8 ZNF518A CELSR2 LTBP1 CELSR3 AGAP1 PCDH17 TAF5L FCGR1A DCDC2B DHFRL1 TUBB3 ZNHIT6 CNTNAP3B CEACAM21 PCDH7 MAP7 B4GALNT1 MAP3K7 CCDC51 TAF9B PPIAL4G ,Unresolved
-0.8142832,8.64281,Cluster 2,SLAMF7,PTCD2 LGALS1 CTNNB1 FBXO2 HUS1 APBB1 CTNNA1 TBC1D23 NAGPA YIF1A ,Unresolved
-1.53245,9.234108,Cluster 2,SCCPDH,PEX19 PDE4DIP SAAL1 HAUS7 DDB2 ZZEF1 C12ORF49 FEZ1 DNAJB11 SCGB2A2 MED21 SQSTM1 DPAGT1 ATP6V0D1 RPN1 USP13 C3AR1 TMEM160 BZW2 CPLX2 BZW1 ACTR1B HECTD3 PPP6R2 ENSA WAPAL FAM63B RAB6B RAB4A PAIP2 ,Unresolved
-1.7967936,8.419564,Cluster 2,RBFA,EXT2 ZZEF1 CDH5 METTL15 KBTBD6 KBTBD7 HECTD3 CD70 ZNF638 TRIM69 SCN2B SIRT1 ,Unresolved
-2.2721713,9.226133,Cluster 2,MGST3,RAP1A GLMN NMT2 S100A13 GAPDHS BIRC6 HRAS HSPA12A SVIP ATP6V0A1 NMT1 ,Unresolved
-1.2382243,9.252398,Cluster 2,KLC1,SNAPIN COG6 DTNBP1 ARHGAP17 KLC2 TRAK2 TRPC4AP USF1 AZIN1 KIF5A KLC4 KLC3 RABEP2 KIF2B KIF5C TRIP6 KIF5B C19ORF46 KPTN MYCL1 CCDC83 EXOC3 ,Unresolved
-0.8305456,9.22377,Cluster 2,RUNDC3A,RALBP1 GMNN EPDR1 ITSN1 AP2B1 AP1B1 AP2A2 EPS15L1 AP2A1 RUNDC3B NECAP2 CLIP1 C10ORF118 POLR1E AP2S1 EPS15 BMP2K AAK1 REPS1 AP2M1 ,Unresolved
-1.1945208,9.369782,Cluster 2,TGOLN2,RHBDD3 INTS1 GGH INTS4 GALNT2 ALG2 HSPA12A GPN3 RUFY1 RRAGB LARS2 GPD1L PI4KA INTS5 GOPC ARF6 XPR1 RAB3A DOCK5 IPO13 RAB3B LTN1 KIAA1147 AP1M1 MDN1 ,Unresolved
-1.8805441,8.2562895,Cluster 2,USP4,SRP9 ATP6V0D1 FAM46A TCP10L TCEAL1 CABP1 BSPRY RAB30 TRMT1 C6ORF141 RIPPLY2 PSMC5 ENSA RNF19B FAM196A ELMO1 OBFC1 CXORF48 SLX1A JUNB EXOC1 LGALS7 MAP3K6 ,Unresolved
1.5921035,7.7343364,Cluster 2,CLU,TOR1A EDEM2 ATP2B2 DDX31 PTPRF SDK2 GNB2 ITGA8 OCIAD1 INTS5 TNFSF9 FAT4 PCYOX1L PCYOX1 PTPRS NLGN2 CELSR1 RPE MTMR9 TXNDC11 FBXO27 ODZ3 CBWD3 LMAN2L MANEA ARHGAP36 EXTL2 KIAA0355 DHX57 HLA-DPA1 MAN1A2 MAN1A1 ,Unresolved
-2.715032,8.573768,Cluster 2,NRAS,CD97 SLC37A3 RTN1 ABHD5 THRB TMEM185A SLC39A12 RABGGTB BZW2 SLC4A8 GPR141 TMEM206 GJB7 PLP1 PAPOLA RIN1 ,Unresolved
2.2134914,7.206853,Cluster 2,RAET1E,RYK NRN1 EPHA7 RAB3B IFNGR1 PODXL2 ALG11 GOLIM4 SDK2 IGDCC4 MFAP3 FGFR1 TNFSF9 ULBP3 DKFZP686O24166 ULBP2 ARL8B FGFR2 ,Unresolved
-2.1643374,9.285943,Cluster 2,CDC42EP4,SEPT10 SEPT11 KLHL15 FHL2 SEPT2 SEPT14 SEPT5 SEPT6 SEPT3 SEPT4 SEPT9 SEPT7 SEPT8 RTN4IP1 ,Unresolved
-1.3269999,9.270493,Cluster 2,UBE3A,NSUN2 SMARCC2 CELA2B KDELR1 COPS7B PLAUR FUZ UCHL5 FAM167A TRPV5 MAP7D2 SRPRB SERHL2 HIF1AN MAGEA1 RPH3A ,Unresolved
-2.761562,9.047701,Cluster 2,ARHGAP36,CLU TTC19 TUBA3C MAGED4B TARBP2 PJA2 PTPRD CAND2 PREPL ATG2B STOM MUCL1 APOD ,Unresolved
-2.5432205,8.362125,Cluster 2,ST7L,GABRA6 RNF170 PCDHGB4 KIR3DL2 TNFRSF10A MCOLN3 PCDHB11 IL17RB SLC4A8 CHRND FAM189B ZNRF4 KCNS3 PCDHB7 LRRN2 RNF185 SLC39A8 SLC17A2 GABRD ,Unresolved
-1.0045213,9.12074,Cluster 2,CHST12,CRP XRCC6BP1 SEL1L FBXO2 PON2 PTCH1 LYZL1 SSRP1 HTR3C DKK3 SDF4 RMND1 MPPE1 ITM2B MAD2L2 ,Unresolved
-1.8168468,9.247222,Cluster 2,ENTPD7,NDFIP1 DAGLB CHRNA3 TEX264 USP32 SPPL2B GAA GOLPH3L ATP1B4 ATP2B2 CD1E JMJD8 KIAA1161 LAPTM4B GOLPH3 SCGB1D1 NMU COL4A3BP SYT12 LOC100507680 TCTN2 PGK2 SCN3B ,Unresolved
-1.8370839,9.276497,Cluster 2,TRAK2,SNAPIN PLK1 C9ORF89 CKAP2 DTNBP1 PRKAB2 C14ORF80 NEDD1 MAP7D3 OGT GSK3B GSK3A TRIM71 FOXK1 KLC2 KLC1 TRAK1 PRKAA1 KIF5A RHOT1 KLC4 KIF5C KIF5B KIF1B FAM83D ACAD11 ,Unresolved
-2.314096,8.906457,Cluster 2,SNX24,YWHAG CSNK1A1 C1ORF111 TSSK1B SNX22 CSNK1E PACS1 MLLT3 MOBKL3 GAPVD1 FNBP1L HINT1 UGP2 CSNK1D STRN LONRF2 FGFR2 ,Unresolved
-2.8759885,8.937168,Cluster 2,MAPK8IP3,DCTN6 SPAG9 TNKS DCTN4 WDR54 C3ORF43 TNKS2 ACTR10 RCCD1 MAPK8IP1 MAPK8IP2 ,Unresolved
-1.6448221,8.461386,Cluster 2,PSG9,ZMYM1 ATP6V1E1 CCDC85C SECISBP2L ZBTB44 PSG1 PSG3 SHCBP1 APOL2 CELSR3 GLT25D2 SMAD9 ,Unresolved
-2.7917447,9.083054,Cluster 2,SEPT12,SEPT10 CCT6B SEPT11 SEPT7 SEPT8 SEPT2 PDS5B SEPT5 SEPT6 SEPT3 SEPT4 ,Unresolved
2.0728335,7.2129626,Cluster 2,PTPN14,MAGI1 YAP1 PHF20 PARD6B JPH4 STXBP4 MAGI3 RHPN1 ACAD11 PDLIM7 ,Unresolved
-1.2779317,9.197637,Cluster 2,NMT2,TGFB1 MARCKSL1 PRPS2 FBXO17 PRPS1 FAM45A MGST3 ODF3L2 FAM109B DEFB1 ZNRF1 GPRC5C AIFM3 NCS1 FAM84B ANGPTL4 ASB6 KIAA1609 ,Unresolved
-2.1852868,9.29008,Cluster 2,SEPT6,SEPT10 SEPT11 SEPT12 RAP1GDS1 SEPT1 SEPT2 SEPT14 SEPT5 SEPT3 SEPT4 MRPL12 SEPT9 SEPT7 SEPT8 CDC42EP4 TRIM32 ,Unresolved
-2.0728126,9.250838,Cluster 2,CYB5D2,KLHDC5 CARKD POLDIP3 SLC30A5 AGTRAP PTPRN ABLIM1 NPTX1 PTX3 TNFSF8 NPTX2 NPTXR SGK196 GRIPAP1 ,Unresolved
-2.624259,9.035689,Cluster 2,SETX,VIPR2 FZD10 ARHGAP1 ISLR COMTD1 MAPK8IP1 SETMAR VWA5A CD2AP PNKD PAK1 C19ORF75 APBB1 NME2P1 CDH19 NEUROG3 VPS28 ,Unresolved
-1.3461627,9.321425,Cluster 2,KIAA0748,YWHAG YWHAE YWHAB ITPR2 ITPR3 BOK YWHAZ SSFA2 YWHAH ITPR1 KCMF1 ,Unresolved
-1.138033,9.311612,Cluster 2,C1orf186,DYNLL1 NOS1AP SNX17 FIGNL1 PKN1 TMTC4 DIP2A JPH1 PLXDC2 PLD1 WDR47 SBF1 ,Unresolved
-1.4752098,8.627199,Cluster 2,OCRL,IL1R2 FAM109B FAM109A AP2A1 SNX21 TPCN2 PAK2 INPP5B C16ORF70 PCBP3 RAB6B PLEKHJ1 RAB6A ,Unresolved
-2.7189608,8.9392605,Cluster 2,ACTR1A,DCTN6 RIC8A ACTR1B C1ORF106 MIS18A DCTN2 CAPZA2 PDGFD DEFB127 KLHL2 DCTN1 C16ORF45 ,Unresolved
-1.5304196,8.46722,Cluster 2,ACVR2A,RNF11 PTGER3 LRRIQ1 HEPACAM2 TNFRSF10A C6ORF72 C18ORF1 TLR2 PCDHAC1 DAAM2 C16ORF58 HAVCR2 MRAP2 ,Unresolved
-1.4588019,8.690928,Cluster 2,FAM118B,KCNJ6 CCL22 PTH1R ICAM1 IQCF1 C1ORF85 CTDSP1 VAPB LAMP2 BSG FAS FAM174A MUC20 SCN2B EPHA4 DECR1 FKBP6 EPHA3 ,Unresolved
-1.0197577,9.322563,Cluster 2,PIP5K1A,KLHDC3 TRIM41 PRKCA RABGGTB TGFBR3 STAG2 KBTBD7 IMPDH1 GFOD1 PFDN2 KCTD17 NRP1 CAMK2D AHCYL2 NRXN3 CENPB DCAF5 ARHGAP22 RAD21 ZC3H18 PIP4K2A CCDC97 GPC3 ARIH1 PIP5K1C GPR156 ZNF323 ,Unresolved
-1.8197436,8.562466,Cluster 2,PPP3CA,NFATC4 PDHB DEFA1 NFATC1 RCAN1 SMPD3 PPP3R1 RCAN2 RASSF2 FAM122A RCAN3 TMEM200A SIK3 KLRG2 ,Unresolved
-1.4489379,8.321984,Cluster 2,ZDHHC17,NRSN2 IPPK SRPR TNFRSF19 AMIGO3 C3AR1 NRG1 FUT3 LPAR1 FAM135B PLSCR4 DHX57 C9ORF3 SPRY2 SLC39A8 FAM8A1 BSCL2 ,Unresolved
-2.608645,8.267199,Cluster 2,ATF6,PCDH20 PCDHB16 PCDHB11 HLA-E CLEC3A PCDHAC1 CDH5 OS9 ERLEC1 MGAT4C CD300E LRRN2 CLEC2D GABRD ,Unresolved
-1.3790425,8.213065,Cluster 2,STX4,RNF11 DPAGT1 TMEM30B IPPK COG5 STXBP3 TACR1 SLC7A1 STX12 SCGN GPR141 GPRC5B AAGAB ASPH STX7 STX6 STXBP6 SLC39A8 LPPR1 VAMP4 ,Unresolved
-2.5608084,8.317106,Cluster 2,TMEM63B,TPRA1 IPPK YIPF3 PTGIR PCDHGB4 MTUS2 GPR21 NRG1 ATP2B2 IL17RB SLC4A8 MUC1 PCDHA3 LGALS8 ATP6V0A2 SLC39A4 ,Unresolved
-2.5597913,8.245905,Cluster 2,ARL4C,ARF5 ARL10 DIRAS1 RAP1GDS1 DCUN1D4 DNAJC12 XRCC2 GAB1 TERF2 FBXO33 OAF RAD51L1 NKIRAS1 POLE2 RAD51L3 POLE4 RGS12 PAF1 TERF2IP ,Unresolved
-2.4731162,8.562656,Cluster 2,NME7,MZT2B CSPP1 PRICKLE3 KIAA1683 TXNDC12 GLUL TUBGCP5 TUBG2 BTRC MZT1 LPPR2 ,Unresolved
0.23944749,9.005376,Cluster 2,C19orf46,CSGALNACT2 FKRP FZD3 FZD6 NCAPH2 B3GALT6 LSR LEMD3 TMEM231 EXT1 OCLN GPRC5C NCAPD3 SERINC1 TUSC3 KEAP1 SPPL2B ZDHHC9 KLC2 KLC1 SMC2 GOLIM4 ADCY6 KIF5A SYNGR2 KLC4 KLC3 TMEM66 DSE AP1G2 KIF5C KIF5B ZFPL1 ,Unresolved
-2.7137284,9.123097,Cluster 2,C4orf32,RTN4 RTN1 VIPR2 IPPK RPN2 C3AR1 CLEC10A FPR2 FZD10 ZDHHC11 ATP1B3 SGCZ LINGO1 LPAR1 SGCD REEP5 ZACN PLP1 CD27 TSPAN2 ,Unresolved
-1.735524,9.153177,Cluster 2,RCAN2,GSK3A AMY1C HSBP1 PPP3CA CST4 CRNN PPP3R1 PPP3CB PPP3CC CST2 C6ORF211 CST1 TFG GNB3 ZG16B IGHA1 MUC7 ,Unresolved
-1.714157,9.296038,Cluster 2,APBB1,LMO2 APP APLP1 APLP2 DCAKD SYP THBS3 SYDE1 SETX HERC2 NEURL4 QTRT1 C3ORF31 SLAMF7 APBB2 ,Unresolved
-2.837163,8.922354,Cluster 2,RRP7A,STXBP1 LRRC46 ZNF692 ZBTB48 SYT1 CAMK2A CRMP1 HIST2H3PS2 WDR46 NOL6 NAP1L5 GNG2 MECP2 ATP4A RPL18A MAPT DPYSL3 ZNF512 RPL18 ,Unresolved
-2.0455317,9.243368,Cluster 2,MANEA,UGT1A10 CSGALNACT2 TRDN GGT7 AOC3 TMEM30B MME SLC39A12 CLU PLAUR TRHDE CNDP1 OLFM1 CD79B ANTXR1 SCN3B ,Unresolved
-2.2902396,8.875398,Cluster 2,PLK1,C11ORF85 SPAG9 C22ORF43 MAVS CDC20B NOS1AP LTBR ERCC4 FEZ1 ZC3HC1 FAM131B RAI14 C11ORF74 ERCC6L TMF1 MLF1IP STXBP4 SATB2 TRAK2 BICD2 ARHGAP5 PRRC1 C1ORF226 TBK1 PPP6R2 MPRIP TOPBP1 C13ORF34 PAK7 FAM53C DCAF11 CACNG3 RGS20 ,Unresolved
