x,y,cluster,term,genes
-4.8047276,7.6665006,Cluster 0,VESICLE,TMEM131 LSM14B NFE2L3 DRC5 FBXO43 ITPKA STAM2 FSTL1 CAVIN1 LURAP1 SHISA3 MVB12A ACOX3 RAB30 SAYSD1 TMEM234 MISP SMU1 RPTOR SNX2 GKN1 CFAP54 WDTC1 EPB41 SPOCK1 RNF135 CTSZ UBA6 EMC1 NSUN7 MIB1 CALB1 BZW1 PDXDC1 MRPL55 SLC6A15 SART3 ADHFE1 ZNF569 DAB2 STAP1 PCBP1 PBXIP1 SYT4 PLOD1 REX1BD VPS37D TMEM164 KRIT1 SNX6 ANKRD13B DTL GPRC5A SCCPDH AKAP9 DTX4 MUC1 CPQ PLIN1 CLIP4 HECW2 ARV1 IFI30 SNX1 UPF3A FUT4 EPN2 SNX22 MRPL50 KMT2E SAMD11 SEMA4D GTSE1 SNX3 CHPF CUL1 WASHC3 LUZP1 ZNF81 CAMLG ATP11A CDK9 LRIG1 LY96 RABEP1 XPO1 POLN SMYD4 TBC1D9 AXIN1 DIDO1 AP1M2 SLC26A2 HMOX2 REPS1 MANSC1 GPRC5B PLPP5 AUP1 PIGU ZNF638 SLC25A25 CSRNP1 EPS15 ZNF710 UPP1 WNT2 PEX14 RAB20 SMARCD1 APOA1 RABEPK SPINK4 SLC6A3 YWHAG MTPAP WDR48 PIGQ POLR3H EML2 ITSN2 ADAT1 PRKAR2A CCDC14 DIAPH2 SFTPA2 TMEM248 NIT1 VTI1B ANLN ESPN RALY TMSB4X RANBP6 AGA SIKE1 MEX3C MRAS SLX9 ARHGAP1 TP53I3 FOXK2 TBXAS1 ACOT8 MUC3B KCNK1 ARCN1 GLI1 DNAJC16 MOSPD1 RAB29 RPRD2 CD68 SCRN3 ATG2A FYN SPA17 TMED2 SEC23B TBRG1 IQCC MAPK8IP3 ZDHHC20 KIAA1328 BAG5 CTSA CTSH UBIAD1 CD82 EIF4G1 MRPL17 MTA1 CEMIP2 ST3GAL2 EIF4ENIF1 ZFYVE16 BYSL TRMT61B SLC44A2 VPS35 EEA1 AP4B1 SEC24C PHC3 DNAI1 RFFL ARHGAP15 CDPF1 BAAT NXPE3 C1QTNF12 IRAK3 ZNF37A OSBPL8 UNC80 ERV3-1 GFPT2 SLC35B3 GUSB ATP13A1 RASA2 ZCCHC17 SLF2 CLTB NUP62 ZNF148 GCNA RUFY1 SBNO1 COL4A2 POU2F1 ZNHIT3 PTAFR CD276 SYT14 SQLE SMUG1 NEURL1B ACAA1 CD63 MAD2L1BP RAB12 PPP5C SOCS6 EDC4 SLC38A2 PTK2 PITPNM2 KIAA1143 ZFP90 ZNF326 PSMD6 SLC39A3 WDR54 FAM177A1 ZNF540 EREG EIF1AD ABCD2 DZIP3 NDFIP2 L3HYPDH NUFIP2 ETFB OXR1 CCDC32 RSPH3 SLC43A1 RRAGB CSNK1G2 SAAL1 GPR17 MYL6B SIX5 FAAP24 NCLN THAP7 ZFHX3 ECI2 VPS29 GCNT3 ALDH1B1 ARFIP1 MMRN2 CLTC FAM78A PIGG PPP1R15A AGPS ADAM10 RAB11FIP2 LMNB2 TRAF3IP3 NRSN2 GRIPAP1 GPR180 MFSD8 ZFPM1 PIGP PTPRN2 RPS6KC1 PECR GRK2 KIAA1614 KIN BAG6 RFX3 TMC7 FKBP10 RGMA SYT13 LAMTOR1 CLCC1 TNRC6A TTC4 KCNF1 MITD1 EPS15L1 SNX16 RNF149 RUNX1 PATL1 GSTK1 BCS1L CLNK CSTF1 DIRAS3 HSD17B13 MYD88 SP2 CDKL3 FBXL2 ADAM19 ZPR1 PLIN3 S100A4 FAM219A MAN1C1 SLC30A2 ARMCX4 PTPRZ1 SLC35B2 PHKA1 RRAGC COL5A1 CCDC146 PTX3 SHOC1 ERGIC1 SETDB1 TAOK1 PRCC COL14A1 SOS2 GRM1 TRAPPC14 SCAMP4 VAV1 GALNT8 RFX1 TFAP2B VPS26A CITED4 TOX4 PRUNE2 EVA1A SQSTM1 ZP4 APLP2 TACSTD2 ARL14EP ITPRIP ABCD3 PMAIP1 CALCOCO1 NECAB2 YIPF4 F3 PELI3 POLDIP3 CELF2 SLC45A3 EXOC6 WDR46 TEP1 ITGAE MMP2 BTK LHFPL2 TIPRL ZC3H10 PRRC1 PHLPP2 TMT1B GIGYF1 RUVBL1 RNF26 LSM4 ALDH3A1 COL21A1 IGF2R ST3GAL3 ZDHHC17 RANBP17 NCAN RUNDC3A VPS26B CMTM4 GAL3ST1 UBE3D PLAGL1 TLCD2 WAPL CCN3 E2F3 CDH12 ATXN7L2 PPHLN1 ZNF644 LAPTM4B DACT3 ITPR1 POGK ARMC8 NIF3L1 TGFBR1 VWCE ZG16B HERC2 VPS37A COLGALT1 SDF2 ENTPD4 NCOA6 CTSS ECHDC3 VLDLR MYO5B ABHD2 ACOX1 IQGAP2 IQSEC2 ABCA1 ZNF266 RSU1 PLA2G7 NECAP1 ZNF891 TUSC2 GPNMB HID1 PTOV1 DENND4C CDC42SE2 CNIH1 MRPL34 STEAP2 LITAF HSD3B7 HSD17B11 HMCN2 PLA2G15 TMEM131L RET ZNF574 SPATC1L TGFA PRKG1 IGF1R ANKRD26 METAP1D TAGLN3 JCAD SMPD2 P4HA2 TFRC FBXO46 CEP63 IPO5 CLTA CAV2 SYTL3 P3H1 MARVELD3 PEX13 AK8 QRSL1 TP73 YBX1 TPD52L2 AP2A1 GAD1 FAF2 CALM1 INTS13 SLC7A5 HIP1R TREM2 HDAC1 TRIM44 TTC33 MAML1 GUCY1B1 PRICKLE2 ZNF213 AHNAK HECTD4 C4BPB CCDC182 VWA8 MSMP UPP2 AASS TMEM150A FTO DGKD NME6 MMP7 SCAMP2 RNF157 ATP7A INTS11 PKN2 C1QC SNRK SEMA3A TGFB3 SFMBT2 SLC12A6 TRIM33 ZFP36 CCDC190 GFRA2 TAF1A SHLD1 RBM6 SEC31A FAM220A NAA35 BLOC1S4 ALYREF NECTIN4 RAB3D RNF144A LCMT2 TMEM39A ZMYND19 OAZ1 CA4 VDAC2 CKAP2L LDHA RCN3 SLC22A23 ERGIC2 ARFGAP1 LMX1A ARHGEF25 SMARCA2 DERL3 CKAP4 NPL AGFG1 BICD1 MYOF TIPIN SHISA2 PKN3 TMEM231 CCN2 NFS1 VPS9D1 ELMO1 AACS STK11IP AURKAIP1 SLC9A7 RAB11FIP1 DMPK SLC20A1 FOXM1 CTSB GZMB HILPDA SLC30A1 TMEM129 BEND7 MAF1 FAM13A SH3BGRL MPP4 LLGL2 PLK4 PEX19 PLD5 CABLES2 PRDM10 SLC22A15 ZNF613 SLC12A4 CPSF2 SYCP2 IFNGR1 FGFR2 DAG1 PLCH1 COL25A1 IZUMO4 PALM CSTF2T CALCOCO2 PODXL CTDSPL SLC38A5 TOR1AIP2 METTL6 UBTD1 ASPSCR1 BCO2 EIF2B3 GRK4 SFRP5 RAB11FIP3 LOXL4 PSMB10 CRADD HDHD2 PAXIP1 PRIM1 TMEM184C BMAL1 TRAF7 DLC1 PCDH17 JMJD4 DOLPP1 GPC4 GRB10 CHMP2A SAE1 PIP4K2C TNPO3 AMACR CNTF ATP8B4 PICALM EDA PSME3IP1 ZNF132 TOB1 AP2A2 SEC23IP STX16 STIM2 PGBD2 MAP4K2 TRIM8 RPIA LRP2 MEF2C NOP16 ELFN2 NHERF1 PDGFRB GAPDH JAZF1 IL31RA ARHGAP9 MCM3 PPP1R21 TAF5 NCS1 RTCB CLUAP1 PODXL2 TMEM181 VWF GPC6 B3GALNT1 SIRT7 KCNQ5 PDZK1 ANKFY1 DEPP1 CHORDC1 ITM2B LIMD2 IGF2 SZT2 EIF4E SEC24B SMIM29 GPR183 YIF1A SLC35F6 CAAP1 COPB1 LLGL1 STARD3NL NUDT5 PTGR3 GYG1 IRF2BP1 CTSF JTB ZMAT2 ABHD3 FBXW11 FGD6 KLF5 PPP6R2 PHAX SLC27A4 PPIP5K2 TRIM50 KIAA1586 COL4A1 COPS2 PRICKLE4 CYSRT1 RNF6 IGFBP3 TYRP1 SNX17 FMNL3 PRRC2A COL1A1 FCSK IPO9 TRUB1 BRD10 SLC66A1 SHROOM1 TMEM165 COL8A1 HAT1 TMEM25 ANKRD2 GLIPR2 PAIP2 ANAPC1 CC2D1B DPP7 GSK3A MANBA DECR2 SEC24D USPL1 CSK EXOC2 BSDC1 SOCS4 STX7 TRIM69 LIPT2 ZNF260 PLTP AMBRA1 EPHX4 FAM89A HSD17B4 HEATR4 HIP1 PPP3CC SPTAN1 CHTOP FIGN GRHL1 PIK3R4 TRAF3IP2 APBA3 PLPP6 SAMD9 CA13 POLE2 CAPN5 CLASP1 PCOLCE ZNF614 TSPAN14 GOLGA1 AADAT YIPF6 PHOSPHO2 TMTC4 RAB14 SLC15A3 TCEA3 KCTD8 CLEC16A PDGFA NACC1 PTPN9 STN1 ANKRD29 CLOCK RBMS3 RABGGTB INSR LAMC1 SPOPL SMYD3 GTPBP2 DPY19L4 LAMTOR4 RAB11FIP5 EXOC7 TRPC1 ZFAT LBX2 PROC JAG2 ARHGAP30 EVI5 RSBN1 GULP1 PHACTR2 PHGDH ATXN1 COX16 SLC25A17 DDX6 SH3BP5L VCAN ATP23 ZNF302 MAN1B1 GPBP1 ATXN7L3 TMEM106B COG7 NUP35 CEBPZ PLEK2 VBP1 BCCIP MTHFSD TM9SF3 DNM1L GSPT1 ATF4 ZNF133 SFXN4 CHEK1 LAMTOR2 CDC42BPA GFRA3 UBL4A CDC5L AFTPH HFM1 ABHD5 GGA1 USP40 ASPN MIA3 DNASE1 STAM HEXIM1 GPR174 ACBD5 BTBD3 MTFR2 POLG2 COMT SAMD10 DRAM2 DUSP22 MSH6 ZSWIM1 RAB7A AP2B1 ZNF526 KASH5 ZDHHC13 EDC3 TRIM7 OXLD1 GLI3 PBX4 CNPY4 PLCG2 TSPAN12 GRN CNTN1 SNX8 AZIN1 RBSN MAK16 NTAQ1 SIAE SPNS1 IL13RA1 B4GAT1 NELFCD NUS1 BARD1 FAM43A PREX1 DSCAM PUSL1 USP5 ESPL1 PORCN CIC UNK KCNG1 DMTF1 TDRD5 VAMP7 HGS MRPS24 TRA2A PRR15 THOC3 LAMA5 PNPLA2 DCP2 EIF5A2 SLIT2 TPK1 TUFT1 PACRGL NAP1L3 SNX21 SRFBP1 MEF2D SLC22A14 DNMT3B GLRX2 SLC38A9 GSAP HAVCR1 TBC1D8 SLC7A6 IFIT2 JRKL ACRBP FAM98A ATP6V1B2 CLINT1 DTWD1 AP1G1 GARNL3 LSM1 CD83 CTNS NOP53 COLGALT2 GOLGA4 FAM98B STPG3 ITIH1 CDK5RAP3 GLYAT ZGLP1 SENP8 PLEKHM3 KLHL38 LOC102724560 SAFB2 CROT P4HA1 FZD9 SARNP TFG ARMH3 GNG2 IQSEC1 SLC4A1AP CGRRF1 XKR4 CDK19 AGPAT4 ABCG1 LNX2 RRAGA CPEB4 MBNL3 SEC23A RAB5C PMM1 DNAJC22 GAK ARTN HBP1 PCDHB11 DESI2 PXMP4 INPP1 PROCA1 ZMIZ1 INHBE NYAP1 URM1 UBA5 DYRK4 ARHGEF3 TMEM41B BPIFB2 GSTM2 TRIM65 IFT172 DCP1B ALPK2 PPA1 SYT2 WDR83 NSDHL ARHGEF33 PHB1 ATP6V1A AGK STK4 RFC3 CFAP157 PLD3 UBR1 ITGA7 MTA3
-4.9235754,8.183144,Cluster 0,INTRACELLULAR MEMBRANE-BOUNDED ORGANELLE,POLR2I ZCCHC8 SLC1A5 ACY1 HSPA9 GADL1 JUND PITRM1 TOMM40 BAZ2A JSRP1 CCDC86 SCRN2 CRYL1 FGF5 EWSR1 PDE8A RESF1 ECHS1 NR5A2 CREB1 CSGALNACT2 HIBADH CRYBG2 DDX17 KIF20B WRN GMEB1 DDX56 CDKL5 INTS12 LRRC14 PDXDC1 FLOT2 NCOR2 NDUFAF2 SURF2 MEPCE PRP4K TBRG4 ATG2B PWWP2B RBM26 ACD DNAJB6 SUN2 TMEM18 TMPO CDCA2 DDX1 PFDN2 CSTF2 RGN TIMMDC1 HNRNPK UCKL1 UTP6 ARFGEF1 FRMD5 ATP5ME CDC25C TNRC18 AKAP9 GSDMC KIF16B CCNL1 FBXL12 DDX50 CALHM3 SNRPA1 GARIN2 NDE1 GALNT2 RAD21 SNRNP27 SNRPC CWC27 MIPEP TJAP1 SETD5 SKAP2 URB1 SETMAR TRMT12 ZNF3 BCAP31 NCBP2 NUP153 FBXO34 POLN ETFA KLHDC3 JAKMIP2 NOP56 FOXP1 PRPF40A SERTAD4 TTC27 SLC38A10 ATP5F1B FOXO3 KIF1C MCM6 CPLANE2 H3-3B TCEANC GFM2 MRM2 BLZF1 RBM25 APBB2 NOM1 ZNF638 MTA2 FAM50A TPGS2 PHF3 WDR27 TNFAIP1 DDX5 POLR3A SERHL2 CPOX EPHA6 POGLUT2 CCDC136 CHST12 MGMT SCAF11 ANLN CHCHD3 FAM3C RALY USP24 MAVS TNKS TXNRD1 FXYD5 FRMD6 SMARCE1 SLX9 WWC1 CMC2 LMNB1 GCC1 KGD4 SCML1 NELFA RAB29 BICRA SYMPK GORASP2 HELQ RPL12 LCK TACO1 ZNF76 TCF20 TADA2B MRPL30 TAF11 MTA1 UBXN7 ZNF800 TMEM98 ZNF514 ATP5IF1 RNF169 BYSL CTDP1 DUT KTN1 ZSCAN1 ARID1A DNAI1 PBX1 GABPA GBP5 RBBP6 LPCAT1 ANKRD40 NSMAF AKAP8L B4GALT1 CWC25 TAF15 RCC1 RBM22 TARDBP CHAMP1 ZNF217 CCAR2 ZNF148 RPS6KA6 ZFTRAF1 CBLL1 HNRNPC IBTK SBNO1 NOC2L RCN1 CCDC174 BMS1 ALDH16A1 SOX6 ZNF326 PSMD6 PQBP1 ARMC10 IFI16 POLR1F ETFB LDLR SHMT2 SMCR8 PDZD2 TEFM CPSF6 SAAL1 HDAC6 ZNF280A CASP1 RPS6KA2 DPF2 HDAC9 ZFHX3 FAM9B ARFIP1 KAT6A TRIM3 DDX18 FNDC1 ZNF142 RPS6KA5 SUCLA2 GABPB2 PROX1 SEPHS1 LPCAT2 TRIM42 RSL1D1 CDC26 LCORL HSPB8 TMF1 CCDC181 ATP6V1E1 TPD52 PUF60 RAD17 ELOF1 BAG6 ZNF821 MAX RGMA HNRNPA0 GNAS CLCC1 TELO2 IMMT KCNF1 CDKN2A OCIAD2 RUNX1 SLC10A7 TBC1D23 ARMCX3 USP35 SNRPA APOOL EXOSC9 MEOX1 CSTF1 HSPA6 SP2 SART1 CDKL3 IARS2 WIPF2 SF3B2 NOP58 ANKRD1 RFXANK FKBP4 SSH3 CS FMR1NB RBFOX2 VAPA WDR3 PCNA UBA1 IRF2BPL ETV4 GATAD2A EMD SETDB1 MAPK11 MICOS10 MORC3 RRBP1 KIF4A TFAM PRCC TINAGL1 COASY SUPT5H DNAJC9 LRPAP1 CELF1 PJVK GOLGB1 SMARCB1 CCDC12 TRAP1 XRCC1 SDF4 GFOD2 EYA3 GOLGA2 RECQL ZC3H14 TARBP1 IDH3G HDHD3 ZBTB2 SCO1 BAG4 MOK HADHA HINT2 POLDIP3 SH3RF2 CREBBP RAMAC CELF2 GINM1 CMTM2 IDH3B RBBP7 PSMB2 CCNT1 SFPQ SYNJ2BP ITGAE NOL8 SYAP1 DNTTIP2 NSFL1C WDR5 KIF4B LIFR MTIF2 ZFPL1 GTPBP8 TDRD3 LUC7L3 UBR2 MDH2 METTL14 CCDC59 DCAF5 SORBS2 AMPD3 HDHD5 SETD1B COA3 CYB5R3 FADD SEC14L5 RNF208 HDAC2 BPTF GOLM1 WAPL FAM135B VPS13A METTL16 SON PPHLN1 GARIN5A CCAR1 POLR3E PTPRH ACTL6B MRPS9 WDR74 TMEM69 NPY WRNIP1 RBM5 PLPP4 ASXL2 HADH MICAL1 GOPC PDIK1L SMC5 YAF2 TKT ATF7IP RIMKLA SMAD3 BARHL2 CDC45 SCAF4 PPP2R5D MECP2 ELOVL5 STAC3 RACGAP1 LRRC71 TCF7L1 ZNF830 OGFOD2 BBS7 H3-4 MFSD9 ORC3 TSTD1 MSRA RNASE12 GORASP1 POGZ HMGN3 ACBD3 KCNQ2 NME7 GRPEL1 SMARCC2 THRAP3 RNASE3 ZNF862 XPO5 QKI FDX1 SLC35F4 JUN RAD51 WTAP ZNF574 NUP54 PPIL2 REC8 SOX9 FLYWCH1 CHADL PTBP1 DCXR KIF20A CAPN14 MRPS30 P4HA2 CEP63 COX6B1 MCM7 CTBP1 IDH3A NKTR PFKFB3 PPP4R2 THAP4 ZNF789 ALDH6A1 HTATSF1 SP3 TMOD2 GLG1 NAALAD2 ZBTB11 IRF2 KHDRBS1 BPNT1 MORF4L1 ICA1L ZNF507 ZFR2 POLR3B PGC USF3 RBM10 KAZN SPATA31F1 STC2 ZNF584 HDAC1 VEZF1 FGFR4 MAML1 FAHD1 GPALPP1 PSMD4 TM2D1 SIM2 SLITRK3 TMA16 MORC4 MAN1A2 RANBP3 MTFR1L SCAMP2 AAMDC CITED2 PTCD3 PFKM RBM38 SERTAD2 TMEM87A SRRM2 POMP TUFM RBM6 USP36 VHL ZNF837 RSBN1L GRPEL2 PCM1 VPS26C CACTIN TTC19 PHB2 DDIT3 PALB2 TBL1XR1 ZNF207 ZNF609 LMX1A ARFGAP1 ZNF655 EIF4H SRSF7 MMP1 ZSCAN21 RFC4 GTF2I BPGM KNOP1 SHISA2 WWTR1 CCN2 SYNJ2 CFAP410 RBM8A DAND5 METTL17 TNFAIP8 PELP1 PSIP1 ARHGEF10 KRR1 SFXN1 AKAP1 CTSB MRPL41 PUM1 ANAPC2 ARHGAP28 PMEPA1 SMARCC1 CHCHD2 TOX2 NCOR1 OGDH PLK4 ERCC5 NANS MKX PLD5 BRD1 CCDC137 COX17 PROSER3 NAXE TET2 YRDC PDIA3 PDS5B TRIM52 DDX41 RFC2 HSDL2 RCAN2 ZNF48 TOMM22 LYST KCTD18 SF3A1 DDX24 PCMTD1 CLPX TBL3 NUCB2 ELMOD1 MORF4L2 ZNF287 MRPL45 KCTD20 POLR3C OBSCN SPAG7 TSPAN18 USO1 RARG STIM1 NKRF HDGFL2 SUB1 CBX5 ZC3H18 CYP51A1 DCAF11 TOMM20 CARD19 INTS6 ARGLU1 CALU UHRF2 RARB VAPB ADNP OSCP1 BARX2 REXO1 BRD4 DMXL1 IFRD2 LBR LTV1 CENPQ INTS8 LRRC23 HEATR1 CUL4B IP6K1 NSMCE4A FRS3 UBE4A MCMBP SLC6A14 GPATCH4 QRICH1 WDHD1 ERAP2 TRIM8 BCL9L MEF2C PDS5A NOP16 UBTF HNRNPUL1 RAD9A GRSF1 HMGXB3 VWA5B1 MCM3 MRPS22 BRCA2 MPHOSPH10 SOAT1 MSL1 TAF5 RBM15B EXOC4 MALSU1 JPH4 XRCC6 ZMYM3 HDGF SLTM PYURF PPIG ZRANB2 ABL1 KHDC4 TGOLN2 RASGRF1 MRE11 HSP90B1 PUM3 TBX19 SMTN CEBPE TAF1 TSHZ1 KDM6B TICRR UQCRQ HIVEP3 SFXN3 GNL2 PPP4R3B ARFGAP2 MCPH1 PES1 RSL24D1 CANX RAD23B PHF20L1 IRF2BP1 KNL1 TBC1D22B PKNOX1 BOC NUP188 POLR2F RARS1 ZMAT2 FBXW11 FCER2 HNRNPDL COPS3 PHACTR3 GPRIN2 PAPOLA BAD U2AF1 SCG2 SRRT HIBCH GRK6 ACADM SYCP2L FMNL3 BRF2 TCIRG1 NPM1 PILRB BICRAL TMEM165 AKAP4 DNMT3A GPKOW SSBP1 SUPT20H PRPF4 ZNF695 TRIM28 EZHIP SUGP1 PDCD11 CELF3 UBA3 BSDC1 GLYR1 ZNF200 ALDOB CHTOP TECR PSMD7 SNW1 CRTC2 GTPBP4 SPACA9 USP22 HS6ST2 PTPDC1 BTNL8 FUS ACAD9 KHDRBS3 NIPSNAP2 EML3 POLR1G MLF2 GOLGA1 SAMD15 PPP1R8 PCK2 PDHX TBC1D12 SIK3 POLRMT TOMM6 ACTL9 CAND1 ZNF544 MIER1 ZNF687 NACC1 NDUFV3 SF3A3 CLOCK RGS3 GOLIM4 MRTFB RPS6KB1 SYNE2 ZNF470 TCOF1 TAB1 ILF2 FIP1L1 KRI1 RPUSD3 EPG5 NDUFB6 SAMM50 TBP HSPD1 CARD8 CD2 OXA1L PPM1G CPVL KLHDC9 TMEM144 ZC3H4 ADGB PPM1K LHFPL6 SF3B6 TOR1AIP1 TIMM9 DCAF4 COG7 NUP35 PTPN1 OIP5 RBM48 PARN ZNF384 SEC61B EBNA1BP2 EP300 FBXO32 PM20D1 SRRM1 DDX42 TMEM30A HNRNPR RRM2B P4HB GDNF NUP88 ADCY8 POLM RFK GTF3C6 BCLAF1 NEMP2 RRP1B TOMM70 HEXIM1 DRAM2 BLOC1S6 MSH6 SGTA FBXL4 BCORL1 KASH5 ZSCAN20 FTSJ3 WBP11 SRSF6 U2AF2 GPR132 SECISBP2L MEIS1 YLPM1 ZNF317 DHX9 SRSF11 FKBP5 INTS4 KDF1 NLRP10 NTAQ1 ODAD3 PPIL4 PUS3 ZCCHC7 NELFCD MAMDC4 POLR2A PSMA5 USF1 PI3 GPX7 GNL3 ETHE1 ESF1 MRPS2 AKAP8 CDC27 HSF4 PTPMT1 CDX2 CIC CWC22 RAI1 TP53 NOLC1 EFNB2 SIN3A MYBL2 LRRC59 GPATCH1 TTF1 HNRNPM CSE1L MCRS1 LRPPRC MCM4 PRPF19 ADPRS SLC25A31 THOC1 FBXO38 COPE ICE2 CLPP CRBN MEF2D MKI67 WDR81 HNRNPU YIPF3 NIFK SUGP2 CDHR3 TRMT44 ZBTB5 FUBP1 KHSRP GOLGA4 NOP2 IWS1 NONO SLC25A13 GOLGA8B ATRX NASP VCF2 SCAF8 FOXP3 SLC30A6 GOLM2 SARNP ODF2L P4HA1 COX5B CCDC47 NPAT RALGPS2 FBXO44 TPR CGRRF1 EPS8 PHF20 MASP2 NOL7 RFC5 RFX7 ANAPC11 API5 NUDT22 NOL10 SPATA32 ZDBF2 MUS81 LRRC41 PPP1R13B PCDHB11 ESS2 HBP1 CFAP97 TMEM94 RTN4 NR3C1 SAFB RBM33 SETD1A KIAA0586 COX20 PPP4R3A SETD7 LFNG MRPL10 FOSL2 CHD1L PAK1IP1 XRCC5 RBM12 BUB3 ALPK2 H3C7 RBM27 MTDH NUMA1 NSDHL NUP50 H2AC4 COG5 PLRG1 TRAF3IP1 STK4 TESK2 RNF2 ARHGEF40
-3.82368,8.019216,Cluster 0,INTRACELLULAR ANATOMICAL STRUCTURE,ZCCHC8 SLC1A5 ACY1 FSCN1 HSPA9 GADL1 JUND CDKN3 CCDC86 G3BP2 JSRP1 SCRN2 LRRC46 SMU1 PDE8A RESF1 EWSR1 ECHS1 LGI3 NR5A2 CREB1 ANKIB1 HIBADH RNF111 CRYBG2 DDX17 WRN GMEB1 DDX56 CDKL5 INTS12 NAP1L1 SEPTIN12 AMPH PDXDC1 NDUFAF2 HDX SURF2 ATPAF2 CCNB1 ZNF70 TBRG4 ATG2B PWWP2B RBM26 STOM ATG7 SUN2 EIF4B DDX1 TIMMDC1 PFDN2 CSTF2 RGN TMPO HNRNPK LTA4H UCKL1 BORCS6 LRCH3 UTP6 ATP5ME CDC25C RPS20 AKAP9 GSDMC MARS1 SERPINB5 CCNL1 TDRKH DDX50 CCDC40 CALHM3 PAFAH1B3 SNRPA1 GARIN2 GALNT2 MRPL50 RAD21 SNRPC SOS1 CWC27 MIPEP TJAP1 URB1 SETMAR MAPK6 NQO1 ZNF3 BCAP31 NCBP2 NUP153 FBXO34 POLN ETFA LAPTM4A NOP56 RPL35 FOXP1 PRPF40A SERTAD4 TTC27 CCT2 SLC38A10 ATP5F1B FOXO3 KIF1C MCM6 CACYBP CPLANE2 TCEANC GFM2 RBM25 BLZF1 APBB2 NOM1 ZNF638 ATXN2 MTA2 FAM50A TPGS2 PHF3 WDR27 TNFAIP1 CCDC24 DTD1 DDX5 SERHL2 WDR31 CPOX PPP2R5E CCDC136 CHST12 MGMT SCAF11 PRDX4 ANLN CHCHD3 FAM3C CAPRIN1 RALY CALB2 USP24 MAVS TNKS FXYD5 FRMD6 SMARCE1 RPL14 LMNB1 GCC1 KGD4 NELFA BICRA PDPR SYMPK GORASP2 HELQ RPL12 DCTN6 TACO1 TCF20 FHL2 MRPL30 TAF11 EIF4G1 MTA1 ZNF800 DEPDC4 ERC1 TMEM98 ATP5IF1 RNF169 BYSL DUT ZSCAN1 HSP90AB1 KTN1 ARID1A DNAI1 PBX1 GABPA GBP5 ASMTL IGF2BP2 RBBP6 LPCAT1 ANKRD40 GALK1 SRPK1 NSMAF AKAP8L CWC25 TAF15 PRKCA RCC1 TARDBP CHAMP1 OTUD3 ZNF148 ZFTRAF1 CBLL1 HNRNPC DNAJC2 VPS50 CORO1B LOC112694756 NOC2L S100A6 CCDC174 PPP1R42 BMS1 PDCL CANT1 ZNF326 UBAP1 SERBP1 EIF3D ARMC10 IFI16 POLR1F SEPTIN9 ETFB LDLR SHMT2 SLC10A3 SMCR8 TEFM SAAL1 HDAC6 LARP4 ZNF280A OPTN DPF2 HDAC9 ZFHX3 FAM9B ARFIP1 G3BP1 KAT6A BRINP1 CREB3L1 TRIM3 DDX18 FNDC1 ZC3HAV1L RPS6KA5 ZNF142 SUCLA2 EIF3G PROX1 RSL1D1 CEP89 PABPC1 TMF1 ATP6V1E1 TPD52 PUF60 RAD17 NAA20 RPS14 ZNF821 MAX PSAT1 RGMA HNRNPA0 CLCC1 IMMT OCIAD2 ARMCX3 CDC42EP4 APOOL EXOSC9 IL1R2 SP2 HAL SART1 IARS2 WIPF2 LARP4B NOP58 FKBP4 SMAD9 EIF3H GNMT HSPB1 CS FMR1NB PDCL3 VAPA CKAP5 RELA UBA1 IRF2BPL ETV4 GATAD2A EMD CD74 SETDB1 MICOS10 MORC3 RRBP1 KIF4A TFAM PRCC ID2 SUPT5H DNAJC9 CELF1 SMARCB1 GOLGB1 NLRP14 CCDC12 TRAP1 XRCC1 SDF4 EYA3 GOLGA2 RECQL ZC3H14 FRYL TARBP1 CALCOCO1 ZBTB2 CFAP119 MOK HADHA HINT2 POLDIP3 WDR93 CREBBP RAMAC GINM1 CMTM2 TIPARP RBBP7 PEG10 RPS25 CCNT1 SFPQ NOL8 CDK5RAP2 NES KCMF1 NSFL1C SYAP1 KIF4B MTIF2 ARHGEF40 GTPBP8 ZFPL1 ASCC3 LUC7L3 MDH2 ALDH3A1 METTL14 CCDC59 DCAF5 CCDC124 AMPD3 HDHD5 SNX9 EFNB1 COA3 CYB5R3 FADD GNPDA1 CDV3 KRT8 RNF208 GOLM1 WAPL FAM135B VPS13A SON RPS8 CCN4 PPHLN1 GARIN5A CCAR1 POLR3E PTPRH ACTL6B MRPS9 WRNIP1 NPY SENP2 RBM5 ASXL2 HADH CRYAB GOPC TKT ATF7IP SMAD3 BARHL2 CDC45 SCAF4 BEX3 ELOVL5 FBXL19 STRN3 RACGAP1 LRRC71 BBS7 H3-4 MFSD9 TSTD1 UBQLN2 CAMKK2 GORASP1 POGZ IL17RC ACBD3 KCNQ2 DPYSL2 NME7 GRPEL1 NCSTN SMARCC2 THRAP3 RNASE3 ZNF862 XPO5 QKI FDX1 SLC35F4 JUN RAD51 WTAP ZNF574 NUP54 SOX9 PTBP1 DCXR KIF20A CAPN14 MRPS30 IPO5 CEP63 COX6B1 PPP4R2 CTBP1 IDH3A NKTR THAP4 ALDH6A1 ST13 EGFR NAALAD2 ZBTB11 IRF2 KHDRBS1 BPNT1 MORF4L1 ICA1L YBX1 ZNF507 ZFR2 POLR3B USF3 RBM10 ADA STC2 ZNF584 HDAC1 NTPCR FGFR4 MAML1 FAHD1 AHNAK BBS4 PNPLA1 SIM2 SLITRK3 TMA16 MAGED2 MAN1A2 RPLP1 SLC9A5 SCAMP2 CITED2 MAP4 NME8 SND1 LYSMD3 RBM38 LGALS1 SERTAD2 TMEM87A SRRM2 POMP TUFM RBM6 USP36 VHL RSBN1L ANAPC4 GRPEL2 PCM1 PDLIM3 AHR VPS26C PKM DGLUCY PHB2 DDIT3 TTC19 TBL1XR1 LMX1A ZNF655 SRSF7 KIF11 MMP1 ZSCAN21 FABP2 GTF2I BPGM TACC3 VIL1 KNOP1 SHC2 WWTR1 PGM2 CFAP410 RBM8A DAND5 METTL17 TNFAIP8 PELP1 PSIP1 TTI2 ARHGEF10 KRR1 SFXN1 AKAP1 MRPL41 PUM1 CIAO2B ANAPC2 PMEPA1 SMARCC1 RGS16 CHCHD2 TOX2 NCOR1 OGDH AHSA1 FKBP3 ERCC5 KARS1 MKX NUDC PLD5 PSMF1 CCDC137 PROSER3 TET2 PDIA3 PDS5B PLEC TRIM52 DDX41 HSDL2 RCAN2 TOMM22 LYST KCTD18 SF3A1 CLPX KRT13 TBL3 OTUD5 PABPC4 CALCOCO2 NUCB2 RASEF ELMOD1 CNTN5 MRPL45 EIF2B3 POLR3C OBSCN DOCK3 SPAG7 TSPAN18 RARG HAUS6 STIM1 HDGFL2 SUB1 CBX5 ZC3H18 CYP51A1 SRPX2 DCAF11 MCOLN2 SLC26A8 TOMM20 ARGLU1 SH2D4A CALU UHRF2 RARB VAPB ADNP CAGE1 VIM YBX3 BARX2 REXO1 BRD4 CARS1 DMXL1 IFRD2 USP2 LBR LTV1 CENPQ INTS8 LRRC23 CUL4B NSMCE4A UBE4A ALPL MCMBP SLC6A14 GPATCH4 LPIN2 QRICH1 WDHD1 CLYBL DOCK5 ERAP2 MEF2C PDS5A NOP16 UBTF HNRNPUL1 RAD9A GRSF1 CDAN1 VWA5B1 MRPS22 APOA4 BRCA2 MPHOSPH10 MSL1 RPL15 SOAT1 RBM15B EXOC4 JPH4 TSC2 PTPRE SPAG9 HDGF ZMYM3 PGM1 PPIG PYURF ABL1 TGOLN2 RASGRF1 MRE11 KYAT1 AIMP1 MAP2K4 HSP90B1 SMTN EIF4E CEBPE TAF1 TSHZ1 LARP1B IL37 TICRR HIVEP3 ZC3H15 HSPA5 GNL2 PCNT PPP4R3B MCPH1 PES1 RSL24D1 CANX RAD23B YARS1 PHF20L1 KNL1 CNKSR1 BOC NUP188 HROB LSMEM1 POLR2F RARS1 FCER2 COPS3 PHACTR3 FUT8 CNN3 CCDC6 PAPOLA U2AF1 PARP14 RPL22L1 SCG2 SRRT MAPRE1 ACADM RAB3C SYCP2L CSGALNACT1 SKA1 BRF2 TCIRG1 AHNAK2 NPM1 TANC2 PILRB BICRAL SPTB PYGL AKAP4 DNMT3A GPKOW SSBP1 SUPT20H PRPF4 TERB2 ZNF695 CASP8 TRIM28 EZHIP SUGP1 CELF3 CSK UBA3 BSDC1 IRF9 BAG3 RNF19B LTN1 RPS15 RUSC1 MYO5C ALDOB CHTOP PSMD7 SNW1 CRTC2 SPACA9 USP22 HS6ST2 PTPDC1 BTNL8 FUS ACAD9 NDUFAF1 NIPSNAP2 EML3 POLR1G LRGUK SRPK2 MLF2 GOLGA1 USP47 PPP1R8 PCK2 ZNF544 SIK3 ZNF687 MIER1 NMT1 NACC1 NDUFV3 SF3A3 CLOCK GOLIM4 MRTFB RPS6KB1 ZNF470 TCOF1 TAB1 ILF2 FIP1L1 KRI1 RPUSD3 EPG5 NDUFB6 PLCG1 TBP EIF5 ERC2 HSPD1 AKAP12 PPM1G OXA1L TMEM144 ZC3H4 PPM1K LHFPL6 SF3B6 TOR1AIP1 ZDHHC18 TIMM9 COG7 NUP35 PTPN1 RBM48 PARN TMEM132C FXR1 DNM1L EBNA1BP2 EP300 FBXO32 PM20D1 SRRM1 DDX42 TMEM30A HNRNPR RRM2B P4HB POLM RFK GTF3C6 BCLAF1 RRP1B TOMM70 HEXIM1 GCN1 DRAM2 DTNBP1 MSH6 SGTA FBXL4 BCORL1 DRAP1 FTSJ3 SRSF6 U2AF2 MIS18A SECISBP2L MAP1B MEIS1 PPP6R1 NAPEPLD UPF3B GPSM2 YLPM1 ZNF317 DHX9 SRSF11 FKBP5 PPIL4 NLRP10 ZCCHC7 ODAD3 GAPVD1 PCMT1 PDSS2 PSMA5 POLR2A GPX7 GNL3 ETHE1 ESF1 AKAP8 HSF4 PTPMT1 CDX2 CIC CWC22 UNK CD2AP NOLC1 SIN3A TRIM32 LRRC59 DDHD2 GPATCH1 TTF1 HNRNPM CSE1L KIAA1671 MCRS1 LRPPRC MCM4 PPP4R4 PRPF19 ADPRS SLC25A31 THOC1 RPL10L COPE WDR81 CLPP CRBN MEF2D MKI67 YIPF3 HNRNPU IFT20 ATP2C1 NIFK TXNL1 SUGP2 CDHR3 TRMT44 ANKMY2 FUBP1 STAU2 KHSRP NOP2 NONO SLC25A13 PI4KB TSPAN33 GOLGA8B NASP CNOT3 VCF2 MAP1S LGMN SCAF8 RC3H1 FOXP3 SLC30A6 GOLM2 SARNP CCDC57 P4HA1 USP33 COX5B EIF5AL1 ADAMTS1 CCDC47 NPAT FBXO44 TMC3 TPR UBE2C EPS8 PHF20 MASP2 PLCB2 TRUB2 RFC5 ANAPC11 API5 NUDT22 NOL10 LRRC41 CSDE1 PSMD10 PPP1R13B TTC1 PCDHB11 ESS2 GNE CFAP97 HBP1 TMEM94 RTN4 SAFB RBM33 NUTF2 SETD1A KIAA0586 COX20 PPP4R3A ZNF347 JPT2 LFNG RPL30 FOSL2 CHD1L COL11A1 RBM12 BUB3 ALPK2 GSTP1 H3C7 RBM27 MTDH NUMA1 TXNDC11 NUP50 H2AC4 COG5 PRRC2C GARS1 RPS10 TESK2 CFAP157 RNF2 FTH1
-3.923048,8.224882,Cluster 0,CELLULAR ANATOMICAL ENTITY,ZCCHC8 LSM14B SLC1A5 EPB41L2 FSCN1 GADL1 HSPA9 JUND CDKN3 CCDC86 G3BP2 JSRP1 MISP LRRC46 SCRN2 PDE8A RESF1 EWSR1 SMU1 WDTC1 ECHS1 LGI3 NR5A2 CREB1 ANKIB1 HIBADH RNF111 THBS2 CRYBG2 DDX17 WRN GMEB1 DDX56 CDKL5 INTS12 CALB1 NAP1L1 AMPH BZW1 PDXDC1 NDUFAF2 SEPTIN12 SURF2 ATPAF2 CCNB1 TBRG4 ATG2B PWWP2B RBM26 STOM ATG7 EIF4B DDX1 TIMMDC1 PFDN2 RGN TMPO UTP6 HNRNPK LTA4H BORCS6 LRCH3 ATP5ME CDC25C GPRC5A AKAP9 GSDMC MARS1 SERPINB5 CCNL1 TDRKH PLIN1 DDX50 CCDC40 CALHM3 PAFAH1B3 SNX1 FUT4 GARIN2 GALNT2 MRPL50 RAD21 SNRPC SOS1 CWC27 MIPEP TJAP1 URB1 MAPK6 NQO1 ZNF3 BCAP31 NCBP2 NUP153 FBXO34 POLN ETFA LAPTM4A AXIN1 NOP56 RPL35 FOXP1 PRPF40A SERTAD4 TTC27 CCT2 SLC38A10 ATP5F1B SLC26A2 FOXO3 KIF1C MCM6 CACYBP CPLANE2 TCEANC GFM2 RBM25 BLZF1 APBB2 NOM1 ZNF638 ATXN2 MTA2 FAM50A TPGS2 PEX14 PHF3 WDR27 TNFAIP1 CCDC24 DDX5 SERHL2 WDR31 SFTPA2 CPOX PPP2R5E CCDC136 CHST12 MGMT SCAF11 TMEM43 VTI1B PRDX4 ANLN CHCHD3 FAM3C CAPRIN1 RALY CALB2 RANBP6 MAVS TNKS USP24 FXYD5 FRMD6 SMARCE1 RPL14 LMNB1 GCC1 KGD4 NELFA BICRA PDPR SYMPK FYN GORASP2 HELQ DCTN6 CTSA FHL2 MRPL30 TAF11 EIF4G1 MTA1 TCF20 ZNF800 DEPDC4 ERC1 TMEM98 EIF4ENIF1 RNF169 BYSL DUT SEC24C KTN1 ZSCAN1 ARID1A DNAI1 PBX1 TNS3 GABPA GBP5 ASMTL IGF2BP2 RBBP6 LPCAT1 ANKRD40 GALK1 SRPK1 NSMAF AKAP8L CWC25 TAF15 PRKCA RCC1 CHAMP1 OTUD3 ZNF148 ZFTRAF1 CBLL1 HNRNPC DNAJC2 VPS50 CORO1B NOC2L S100A6 CCDC174 ACAA1 CD63 NEURL1B PPP1R42 BMS1 PDCL CANT1 ZNF326 PSMD6 SERBP1 UBAP1 EIF3D ARMC10 OXR1 IFI16 POLR1F SEPTIN9 ETFB LDLR SHMT2 SLC10A3 SMCR8 TEFM SAAL1 LARP4 ZNF280A OPTN FAAP24 DPF2 HDAC9 ZFHX3 FAM9B ARFIP1 G3BP1 KAT6A TRIM3 CREB3L1 DDX18 FNDC1 AGPS RPS6KA5 ZC3HAV1L SUCLA2 CD44 PROX1 RSL1D1 CEP89 PABPC1 TPD52 PUF60 RAD17 RPS14 ZNF821 MAX PSAT1 RGMA HNRNPA0 CLCC1 IMMT MITD1 OCIAD2 ARMCX3 CDC42EP4 APOOL EXOSC9 IL1R2 SP2 HAL SART1 IARS2 WIPF2 ADAM19 LARP4B S100A4 NOP58 FKBP4 SMAD9 GNMT GUCA1ANB-GUCA1A CS PDCL3 VAPA CCDC146 CKAP5 RELA UBA1 IRF2BPL ETV4 GATAD2A EMD CD74 SETDB1 MICOS10 MORC3 RRBP1 KIF4A TFAM PRCC COL14A1 TRAPPC14 ID2 SUPT5H DNAJC9 CELF1 SMARCB1 GOLGB1 NLRP14 CCDC12 TRAP1 VPS26A XRCC1 SDF4 EYA3 GOLGA2 RECQL ZC3H14 ABCD3 FRYL CALCOCO1 ZBTB2 CFAP119 MOK HADHA HINT2 POLDIP3 WDR93 CREBBP RAMAC GINM1 CMTM2 TIPARP RBBP7 PEG10 RPS25 CCNT1 SFPQ NOL8 MSN CDK5RAP2 NES KCMF1 SYAP1 TIPRL KIF4B MTIF2 ARHGEF40 GTPBP8 ZFPL1 ASCC3 LUC7L3 GIGYF1 MDH2 ALDH3A1 CCDC59 DCAF5 CCDC124 AMPD3 SNX9 EFNB1 HPS3 FADD UBE3D GNPDA1 CDV3 KRT8 RNF208 GOLM1 WAPL FAM135B VPS13A SON RPS8 CCN4 PPHLN1 GARIN5A CCAR1 POLR3E PTPRH MRPS9 WRNIP1 NPY SENP2 RBM5 ASXL2 HADH CRYAB GOPC VPS37A TKT ATF7IP SMAD3 BARHL2 CDC45 SCAF4 ELOVL5 FBXL19 STRN3 RACGAP1 LRRC71 ZNF266 BBS7 H3-4 MFSD9 TSTD1 UBQLN2 CAMKK2 GORASP1 POGZ IL17RC ACBD3 DPYSL2 NME7 GRPEL1 NCSTN SMARCC2 THRAP3 ZNF862 XPO5 QKI FDX1 SLC35F4 JUN SCIN RAD51 WTAP ZNF574 NUP54 SOX9 METAP1D PTBP1 DCXR KIF20A CAPN14 TFRC IPO5 CEP63 COX6B1 PPP4R2 CTBP1 IDH3A CLTA NKTR THAP4 ALDH6A1 ST13 EGFR MARVELD3 NAALAD2 ZBTB11 IRF2 KHDRBS1 BPNT1 MORF4L1 ICA1L YBX1 ZNF507 ZFR2 GAD1 FAF2 USF3 RBM10 ADA TREM2 STC2 ZNF584 HDAC1 NTPCR FGFR4 MAML1 CTNNB1 FAHD1 AHNAK BBS4 PNPLA1 SIM2 SLITRK3 TMA16 MAGED2 MAN1A2 SLC9A5 SCAMP2 CITED2 MAP4 SND1 LYSMD3 RBM38 LGALS1 SERTAD2 TMEM87A SRRM2 POMP TUFM RBM6 USP36 VHL RSBN1L ANAPC4 GRPEL2 PCM1 PDLIM3 AHR VPS26C PKM DGLUCY PHB2 CKAP2L DDIT3 TTC19 LMX1A ZNF655 SRSF7 KIF11 ZSCAN21 FABP2 GTF2I BPGM DNAJC18 TACC3 KNOP1 SHC2 VIL1 PGM2 CCN2 CFAP410 RBM8A DAND5 SLC9A7 METTL17 TNFAIP8 PELP1 PSIP1 RAB11FIP1 TTI2 KRR1 SFXN1 AKAP1 PUM1 CIAO2B ANAPC2 PMEPA1 SMARCC1 RGS16 CHCHD2 TOX2 NCOR1 OGDH FKBP3 NUDC ERCC5 KARS1 RPS15 PLD5 PSMF1 CCDC137 TET2 PDIA3 PDS5B TRIM52 DDX41 HSDL2 RCAN2 PLCH1 TOMM22 SF3A1 CLPX KRT13 TBL3 PABPC4 CALCOCO2 NUCB2 RASEF ELMOD1 CNTN5 MRPL45 EIF2B3 POLR3C OBSCN DOCK3 SPAG7 TSPAN18 HDHD2 HAUS6 STIM1 HDGFL2 SUB1 CBX5 ZC3H18 CYP51A1 SRPX2 DCAF11 MCOLN2 SLC26A8 TOMM20 ARGLU1 SH2D4A CALU UHRF2 RARB VAPB ADNP CAGE1 VIM YBX3 BARX2 REXO1 BRD4 CARS1 DMXL1 IFRD2 USP2 LBR LTV1 CENPQ PICALM LRRC23 CUL4B NSMCE4A UBE4A ALPL MCMBP SLC6A14 GPATCH4 LPIN2 QRICH1 SEC23IP CLYBL STIM2 DOCK5 STX16 WDHD1 MEF2C PDS5A NOP16 UBTF HNRNPUL1 RAD9A GRSF1 CDAN1 VWA5B1 PPP1R21 MRPS22 APOA4 BRCA2 MPHOSPH10 MSL1 RPL15 SOAT1 RBM15B EXOC4 JPH4 PTPRE ZMYM3 HDGF PGM1 PPIG PYURF ABL1 TGOLN2 RASGRF1 MRE11 KYAT1 AIMP1 HSP90B1 LIMD2 SMTN EIF4E CEBPE TAF1 TSHZ1 TICRR CAAP1 HIVEP3 ZC3H15 HSPA5 GNL2 PCNT PPP4R3B MCPH1 PES1 CANX RAD23B YARS1 PHF20L1 KNL1 CNKSR1 BOC NUP188 HROB LSMEM1 POLR2F RARS1 FCER2 COPS3 PHACTR3 FUT8 CNN3 CCDC6 PAPOLA U2AF1 PARP14 RPL22L1 SCG2 SRRT MAPRE1 ACADM RAB3C SYCP2L SKA1 BRF2 AHNAK2 NPM1 TANC2 PILRB BICRAL SHROOM1 SPTB PYGL AKAP4 DNMT3A GPKOW SUPT20H TERB2 PRPF4 CASP8 ANKRD2 TRIM28 EZHIP SUGP1 CELF3 CSK BSDC1 IRF9 BAG3 LTN1 RUSC1 HSD17B4 HIP1 MYO5C CHTOP PSMD7 SNW1 CRTC2 SPACA9 HS6ST2 BTNL8 FUS ACAD9 NDUFAF1 NIPSNAP2 POLR1G LRGUK SRPK2 MLF2 GOLGA1 USP47 PPP1R8 PCK2 PDHX ZNF544 SIK3 ZNF687 MIER1 NMT1 NACC1 NDUFV3 CLOCK GOLIM4 RPS6KB1 SPOPL GTPBP2 TCOF1 ZNF470 DPY19L4 ILF2 TAB1 FIP1L1 KRI1 RPUSD3 EPG5 NDUFB6 PLCG1 TBP EIF5 ERC2 HSPD1 AKAP12 JAG2 PPM1G OXA1L SLC16A1 TMEM144 ZC3H4 PPM1K TOR1AIP1 SF3B6 ZDHHC18 TIMM9 COG7 NUP35 PTPN1 RBM48 PARN TMEM132C FXR1 DNM1L EBNA1BP2 EP300 PM20D1 SRRM1 SFXN4 DDX42 TMEM30A HNRNPR HFM1 RRM2B POLM RFK GTF3C6 BCLAF1 RRP1B TOMM70 HEXIM1 GCN1 DTNBP1 MSH6 SGTA FBXL4 SLC41A3 BCORL1 AP2B1 FTSJ3 SRSF6 U2AF2 MIS18A SECISBP2L MAP1B MEIS1 GRN NAPEPLD PPP6R1 UPF3B YLPM1 ZNF317 DHX9 FKBP5 PPIL4 NLRP10 ZCCHC7 GAPVD1 PCMT1 PDSS2 PSMA5 POLR2A GPX7 GNL3 ETHE1 ESF1 AKAP8 HSF4 PTPMT1 CDX2 CIC CWC22 UNK CD2AP KCNG1 NOLC1 SIN3A HGS TRIM32 LRRC59 DDHD2 GPATCH1 TTF1 HNRNPM CSE1L KIAA1671 LIMA1 LRPPRC MCM4 MCRS1 PPP4R4 PRPF19 ADPRS SLC25A31 THOC1 RPL10L COPE WDR81 CLPP MKI67 MEF2D YIPF3 HNRNPU IFT20 JRKL ATP2C1 FAM98A NIFK TXNL1 SUGP2 CDHR3 TRMT44 CD83 ANKMY2 FUBP1 STAU2 KHSRP FZD6 EZR NONO PI4KB TSPAN33 NASP CNOT3 ITIH1 VCF2 GLYAT LGMN SCAF8 RC3H1 SLC30A6 GOLM2 SARNP CCDC57 P4HA1 TFG COX5B TMC3 ADAMTS1 CCDC47 NPAT UBE2C TPR EPS8 PHF20 MASP2 PLCB2 TRUB2 ANAPC11 API5 NUDT22 LRRC41 CSDE1 PSMD10 PPP1R13B TTC1 PCDHB11 HBP1 GNE CFAP97 TMEM94 RTN4 SAFB RBM33 NUTF2 SETD1A KIAA0586 COX20 PPP4R3A DYRK4 JPT2 LFNG BPIFB2 CHD1L COL11A1 RBM12 ALPK2 GSTP1 H3C7 RBM27 MTDH NUMA1 TXNDC11 NUP50 H2AC4 COG5 PRRC2C GARS1 RPS10 TESK2 CFAP157 FTH1
