x,y,cluster,term,genes
5.223762,19.912085,Cluster 3,NUCLEAR LUMEN,PCGF5 MED12 LSM14B TMEM187 FBXO43 PRDM1 TEX35 PITPNM3 NPPB TULP3 ZC3H15 CCDC86 TRMT1L CRYL1 FGF5 EWSR1 MTCL2 RESF1 ACTN2 TMA7 TNNI1 FAM161A DUS3L RNF111 SRSF5 CLDND1 FAM131A DDX56 TIFA TREX1 FLOT2 SLC6A15 SURF2 RTF2 DEAF1 MDN1 USP37 FAAH2 PPCS SMC6 NACC2 DAB2 BTBD10 PCDHB5 SELENBP1 XPC PBXIP1 APBA2 RSPH4A SEPTIN7 TCERG1 A2M REG1A PFDN2 USP44 LEUTX UTP6 NFIB CC2D1A PPM1E ZNF593 CCDC171 DDX50 DDX47 DOK7 ACTA2 RPS26 NDE1 DEPDC7 NFKBIE SOS1 URB1 PPDPF TBC1D13 NIN SETMAR ZNF77 CAMLG KYAT3 LRIG1 UTP3 RPS23 NUP153 ARHGAP11A STON2 TRMT6 AXIN1 NOP56 FAU TTC27 ATP2B1 SLC38A10 FRMD8 SIGIRR SPATS2L SS18L2 TACC2 LRRC47 MRM2 NUDT16 NOM1 ATXN2 KIF5C ZNF106 OSGIN2 THBS3 TPGS2 PEX14 PHF3 TNFAIP1 CCDC24 LAMB3 TRMT5 ZNF146 SFTPA2 MKNK2 KBTBD2 DIAPH2 CCDC136 SCAF11 PWP1 TRO CCDC88C SCML2 TXNRD1 MAOB NOL6 KANSL2 LRP12 IQGAP3 SDE2 KIF3B AKTIP IPMK RAB29 SLC7A10 B3GNT5 NRIP1 INO80E KIF1B ATP13A3 DCTN6 VPS25 ZNF397 LYAR ZNF76 DCAF1 MRPL17 ZNF800 P2RX6 RPL21 RNF115 NOL11 BYSL VILL ZSCAN1 AKAP11 DCLRE1A MMP24 SLC6A17 UBXN6 NVL ANKRD40 SPC24 IFI27L2 NSMAF POLR1E TRDMT1 DGAT1 PAPSS1 RPS6KA6 VWA5A INPP5J TEX264 SBNO1 WDR12 MXI1 VPS50 NOC2L TAF13 AKR1A1 FKBP14 ATF7IP2 ACTN4 UTP15 FBXO11 BMS1 FSTL5 HMGN2 MS4A8 N4BP1 FAM32A DNAJC5 ZNF404 COA4 MARCKS DNTTIP1 IFI16 CYB5D1 FEZ2 POLR1F DDX27 SPRY3 ANKEF1 CPNE1 RBM28 MRPS31 RBM3 LARP4 TXN2 POLR1A TBC1D9B ZBTB43 CRIP2 EFCAB14 TRIM3 DDX18 PPFIA4 AGPS ATP9A RRN3 TRAF6 ACAP2 ZNF142 ZNF140 SNAPIN HINT3 NMD3 RSL1D1 SPPL2A WDR55 ARFIP2 DFFB TMEM79 SELENOF CTTNBP2NL SDAD1 RBMX2 ERMP1 PPID CDKN2A SNX16 IDI1 ZNF669 CCDC149 SLC10A7 UBXN11 USP35 TLK2 SNRPA EXOSC9 MEOX1 TBCA LARS2 PDCD7 LARP4B NOP58 USP28 ANKRD1 NAXD ZBTB16 ZNF280C NOC4L GSKIP PNKP ABCF3 PTMS FMR1NB TNFAIP8L2-SCNM1 ZNF678 PPP2R3A WDR3 CHD3 CKAP5 CERCAM LDOC1 UBE2T ETV4 RPS19BP1 MED8 TTK CCDC110 MRPL3 PHLDA2 RRP15 DNAJA2 RPL10A RPL4 GNL3L RABGAP1L SEPHS2 SNX15 MED12L MRPL23 BEGAIN SMARCB1 CCDC12 TOX4 SPTY2D1 CRIPT ZC3H14 CADPS2 IDH3G HDHD3 TRAF4 DDX10 ADIPOR1 HINT2 PPP1R14A RMP64 GINM1 ZBED5 EP400 RPL18 CCDC38 NOL8 CYP20A1 RECQL5 RPL7L1 ARMC9 DNTTIP2 RRP8 PFKL RNFT1 CAMK4 CDK12 CCDC59 SNX30 AMPD3 ADIPOR2 ILF3 PHF12 PITX1 EXOSC10 CDV3 TBX18 TLCD2 INCENP NUFIP1 SRP14 ATXN7L2 CMSS1 CLASP2 GARIN5A GPR157 BORA DDX49 MRPL53 PPP1R7 ACTL6B MRPS9 WDR74 LRWD1 TUT4 SHC1 PHF6 PLPP4 NCKAP5 DIMT1 ECHDC3 RIMKLA LRRC7 PAGE1 ZNF692 DTX3 IRAK4 STAC3 ACTN1 SMG6 RAB8A SURF6 SUZ12 LRRC71 BUD23 MOB2 HOMEZ DRGX MFSD9 AATF RRS1 SLC35F3 METAP2 SMPDL3A ZXDC SIMC1 MLLT1 RPL34 DLGAP3 DPYSL2 FAM111A KIAA2012 UBE2M NDRG4 MCM10 GTF3C1 SLC35F4 TMEM131L TRIB3 RAD51 MRPL4 REG1B HIRIP3 LSM7 FHIT APOL6 MYO10 RIOK1 DCXR MAP4K5 HELZ RPL26 CALML5 CYB5R1 KDM4A SYTL3 TMOD2 P3H1 MYBL1 GRAMD1B AK8 TMEM242 MPHOSPH8 FANCA ZNF507 RBL2 CSTB GAD1 PIGO PGC LRCH2 USF3 RPL18A ATPAF1 SENP3 SLC7A5 UBE2R2 URB2 R3HDM2 CECR2 MAPKBP1 NUB1 SEPTIN5 CDCA8 REXO4 ATP6AP2 ADPRHL1 MPND EVC EIF2S2 NUAK1 TMA16 PRSS23 PELO MAGED2 ORC4 RPF2 CASTOR1 PBDC1 GAR1 DNHD1 RPL26L1 TRIM41 KXD1 RNF157 EEIG2 SMARCA5 NOVA1 FEN1 TMEM143 RPL19 TMEM140 USP36 KLHDC4 WDR18 ALYREF ZNF837 AHDC1 AFF4 ADAR DENND5B RNMT RPL7A RASSF4 KREMEN2 ZNF207 ERGIC2 FAM98C CTU2 PON3 ZNF275 NSA2 ZNF16 EXOSC5 FKBP15 DHRS3 SRP54 EMC2 SEPTIN2 BPGM MSL3 KNOP1 DENND1C PTPN11 SYNJ2 RRP7A PRSS12 GRAMD2A LRP5 SFR1 SMARCA4 PELP1 RBBP8NL MPP3 KRR1 DNAJC21 FOXM1 AMDHD2 CTSB EFCAB7 BMPR1B MIS18BP1 MCEE KIF2B BEND7 MAF1 FAM13A PLK4 SH3TC1 RPS11 TMEM35B TMEM249 TFPT NSRP1 CCDC137 EDN1 PRDM10 VWA3B CIB2 BIRC2 VGLL3 REXO5 B3GNTL1 KLK10 MXRA8 TMEM154 TRIM52 FOXJ2 SMIM44 TNFRSF21 ZNF652 EHBP1L1 TPPP3 DDX24 ABHD10 COIL TBL3 NUDT8 MED27 ANKS6 TSPYL1 HDDC2 ARID5A SIX1 CHCHD1 FAM174C USO1 ING1 LPIN1 ELL3 GEMIN2 BNIP2 KBTBD7 LRRC40 MCOLN3 NKRF OGDHL INO80C PJA1 SMOX SUB1 MRPL40 GCLC TBCK DDX55 BMAL1 METTL5 GON7 CRAMP1 DEPDC1 MON2 CAGE1 SERPINB1 OSCP1 BARX2 SGF29 DMXL1 THSD4 ZNF519 NLK THAP12 RCOR3 HS1BP3 WDR33 NBEAL1 LRRC23 HEATR1 MLH1 IP6K1 NBAS APTX TCHHL1 TSPYL6 ACADVL DCAF10 GPATCH4 KRCC1 METTL1 STX16 SUCO AGAP2 ZNF276 BCL9L NOP16 UBTF BCL2L1 ZNF668 HMGXB3 MPHOSPH10 RSRC2 EXOC4 H1-10 HEXD NAA10 MCL1 SIRT7 RPN1 NEK1 PUM3 EFCAB13 NCOA4 CCNB2 KCNC4 SMIM29 CEP85 IL37 NOP14 GNL2 PDZD8 ARFGAP2 ABHD14B PES1 RSL24D1 SLAIN2 RPP38 AS3MT COQ5 HES6 TPCN2 NUP188 POLR2F BTN3A3 CCT5 APEX2 SGMS1 ABHD3 FBXW11 MIX23 PDRG1 ZFHX4 PHAX ATOSB PNO1 DNAL4 MRTO4 ZCCHC10 KIAA1586 SCG2 RBM18 GLCCI1 LURAP1L MAP2K5 MYL5 VGLL4 BRIX1 RNASE7 RETSAT BRF2 E2F1 NPM1 ZNF577 GTF2B DKC1 KMT5A DMAC2 RPS6KA3 TERF1 SMDT1 CERS6 AKAP4 SUPT20H TERB2 GET3 STX17 CCM2 UBLCP1 NCAPD2 ANKRD49 PDCD11 BAZ1B SIRT2 ALAS1 RPP30 NPR1 SOCS4 ANGPT4 STARD7 TRIM69 HGD PLTP BRWD1 TMX1 GRB2 ZNF239 ADORA1 PPIB GTPBP4 EIF2B5 MMP9 MED16 CA13 ABCC8 BTNL8 DDAH1 TBC1D20 EML3 METTL25B CASP6 POLR1G SRPK2 RBM34 SAMD15 ATP6V1G1 PSPC1 CTSV CFAP36 GSTM3 RBBP5 RNF125 ACTL9 ZNF687 DNAJC14 LZTS1 WASL PRMT7 CAB39 ZNF354A FOXA1 DDX52 GRWD1 JADE3 PCNX4 DCTN3 RPAIN TSPOAP1 FAM193B TCOF1 CCDC127 DDX28 CCBE1 ESRRA PNPLA3 ZNF277 KRI1 SNAPC5 RPUSD3 FAM204A ZMYM4 CCDC61 ACTL7A LBX2 RPAP2 CD2 VAX1 YBX2 PHACTR2 ATAD1 RDM1 SDR9C7 LHFPL6 DNAJC28 ZNF71 GYG2 GPBP1 CENPH COG7 NCF2 ABTB1 CCDC148 MRPL13 PARN SUPT16H VEPH1 ATXN1L RPL8 TIGD1 DDX23 EBNA1BP2 FRAS1 FBXO32 PM20D1 TCEA1 KIF18B BCAM NUSAP1 TTLL1 DCUN1D5 RPL9 SNX7 RPL5 ZZZ3 ADM RRP1B BCLAF1 KCNN4 UTP23 TSR2 EEF1B2 MBIP SPATA2 ERICH1 GFPT1 ING3 PFKFB4 ACVR1 COX10 ZSWIM1 FIGNL1 TIAM2 SRP72 POLR2G RREB1 CCDC34 FNDC9 FTSJ3 OSER1 TOP1 ATOSA BMAL2 HMGB3 EN1 SPOCD1 NPM2 DHX9 HJURP CSKMT PAIP2B PCSK7 FKBP5 INTS4 RRP12 DDA1 MAK16 C2CD4B NXF1 TOP2A CSRNP3 ZCCHC7 SH3PXD2B NTMT2 BARD1 GPX7 GNL3 DSCAM PWP2 WDCP BCAR1 PHF2 ZFAND2B CDCA7L CD2AP DMTF1 FAR2 NOLC1 TMEM37 MICALL2 SMIM20 CCDC82 TRA2A WDFY3 TTF1 RPP25L ATP6V1F SLIT2 ENSA HSPA12B CRACR2A LEO1 SMAD7 RNASEH1 CRBN CRELD1 MKI67 SNX5 SRFBP1 TLE1 ABCF2 PPM1B GOLGA3 ATP2C1 KANSL3 NIFK RBM19 UTP18 DTWD1 ZNF415 CDHR3 NGDN PRMT5 ZNF75A CDC42EP3 HEATR3 OSR1 VRK1 NOP53 KALRN NOP2 TFAP2C TSG101 EZR RIOX2 RPS3A SMIM8 ATF3 CDK5RAP3 MAP1S YEATS4 MALT1 ZNF787 LOC102724560 WDR36 ODF2L ZNF428 IQSEC1 YAP1 THYN1 AGPAT4 CIPC NOL7 ANAPC11 FBXW10B SLC25A15 CCDC106 NOL10 SPATA32 NKIRAS2 MUS81 LRRC41 SELENOH PSMD10 TANK PUS7L TAF4B IPO4 MAP3K9 IRS1 PTPN6 CFAP97 PXMP4 TSEN15 XRN2 ZDHHC7 FAM3A ZEB2 NPM3 H1-2 SETD7 MYC NSUN5 SERGEF ENOPH1 OLFM1 PGRMC1 ARPP21 RHOF NRG2 ETV6 NFATC3 SNRPB2 KDM2A ZNF320 GATA3 MTDH PTDSS2 SCAND3 RNF213 ZNF330 PRRC2C XPO6 DYNC1I2 THUMPD3
4.5831165,19.38433,Cluster 3,NON-MEMBRANE-BOUNDED ORGANELLE,PCGF5 CETN3 LSM14B MED12 TMEM131 FLNA DENND10 PRDM1 CCDC121 PCLO PITPNM3 TULP3 ZC3H15 CCDC86 AMIGO3 SMU1 TATDN3 TRMT1L CRYL1 FGF5 EWSR1 GKN1 MTCL2 ACTN2 IP6K2 RESF1 TMA7 TNNI1 DUS3L RNF111 UAP1L1 EMC1 GFM1 CLDND1 FAM131A DVL3 FAM216A HOXC8 DDX56 KIF20B NAP1L1 RAB22A SEPTIN12 TEKT2 MPRIP OTUD7B SLC6A15 SURF2 ZNF654 DEAF1 MDN1 RABIF FAAH2 PPCS FSD1L BLTP1 NACC2 BTBD10 PCDHB5 SELENBP1 APBA2 SEPTIN7 PHACTR4 NEK8 PFDN2 PGAP2 USP44 UTP6 NFIB RWDD4 DPY19L3 FRMD5 CC2D1A SMG7 ZNF593 DHX34 CCDC171 DDX50 DDX47 CCDC40 PAFAH1B3 P2RX4 GINS4 PLCD1 NDE1 NFKBIE URB1 CHPF PPDPF MYH10 TBC1D13 SETMAR LUZP1 ZNF81 MUC16 ZNF77 ARHGAP11A WBP1L AXIN1 NOP56 BEND2 TTC27 SPATS2L SS18L2 LRRC47 TOM1L2 MRM2 TEKT5 NOM1 ATXN2 PXDN ASRGL1 WDR89 ZNF106 THBS3 KIFC1 PEX14 PHF3 TPGS2 TNFAIP1 CCDC24 TRMT5 ZNF146 PRKAR2A KBTBD2 DIAPH2 TRIM46 TMEM116 CCDC136 PWP1 LAMP2 CCDC88C AGA TXNRD1 MED20 SUSD1 MAOB CLK4 TTBK2 NOL6 KANSL2 IQGAP3 SDE2 EDRF1 HARBI1 RAB29 NRIP1 INO80E DCTN6 ZNF397 LYAR DSTYK ZNF76 FHL2 DCAF1 MRPL17 IGSF10 ZNF800 DEPDC4 RNF115 SPAG1 KRT2 BICDL2 BYSL SLC44A2 CTDP1 PARS2 AKAP11 ZSCAN1 INPP4B CEP131 DCLRE1A UBXN6 NVL NUDCD2 ZBTB18 ANKRD40 SPC24 INTS6L VPS45 NSMAF POLR1E NPFFR2 DGAT1 ADAMTS20 PAPSS1 ZNF148 RPS6KA6 CEMIP VWA5A ICE1 INPP5J TEX264 AVEN GTF2F2 VPS50 TMEM115 NOC2L SQLE TAF13 TM6SF1 SCNN1D ACTN4 FSTL5 BMS1 HMGN2 DUSP6 CANT1 ZFP90 MBLAC2 RAB3IP COA4 MARCKS IFI16 CYB5D1 FEZ2 POLR1F SEPTIN9 DDC SHMT2 ANKEF1 SLC10A3 SPRY3 RBM28 ZC3H11A KRT24 LARP4 CEP128 POLR1A SLC16A3 BRINP1 KIAA0753 DDX18 TRAF6 KRT23 ATP9A RRN3 ZNF142 ACAP2 BZW2 RSL1D1 PTPN18 SPPL2A WDR55 MAPDA DFFB ADAM23 TMEM79 SELENOF CTTNBP2NL SDAD1 RBMX2 NPRL2 CDKN2A CLEC11A N4BP2 SLC10A7 USP35 CDC42EP4 EXOSC9 MEOX1 TBCA LARS2 TRAPPC8 NOP58 USP28 ANKRD1 FNDC7 ZBTB16 NOC4L EXD2 PNKP PTMS FMR1NB ZNF701 IQCB1 PPP2R3A WDR3 CKAP5 LDOC1 RBM23 UBE2T ETV4 STK32B RPS19BP1 CD74 TTK MORC3 CCDC110 MRPL3 RRP15 TMEM186 RBM39 RPL10A ID2 GNL3L SNX15 MED12L PTAR1 SMARCB1 RMDN1 CROCC SPTY2D1 DBN1 CRIPT IFT22 EYA3 ZC3H14 CADPS2 IDH3G HDHD3 PDLIM7 DDX10 PELI3 HINT2 PPP1R14A WDR93 CELF2 ZNF846 GINM1 TIPARP NOL8 F11R CDK5RAP2 NES LHFPL2 ARMC9 DNTTIP2 RPL7L1 RRP8 CENPE PFKL TMT1B GIGYF1 CAMK4 COL21A1 CLK3 CCDC59 AMOTL2 ILF3 PHF12 EFNB1 SRRM3 PITX1 EXOSC10 CDV3 KRT8 TLCD2 WAPL CNTROB DLGAP5 NUFIP1 ATXN7L2 CMSS1 CLASP2 GARIN5A PPP1R7 DDX49 MRPL53 OLA1 WDR74 ACTL6B MRPS9 ZNF16 KCNK6 RPL6 LRWD1 ENTPD1 TUT4 MFSD4B PHF6 PLPP4 TIMM17B FAIM2 HMMR ECHDC3 ZC4H2 RENBP MRPL18 RIMKLA CDC45 PAGE1 ZNF692 IRAK4 FBXL19 ACTN1 NAE1 RAB8A SMG6 SURF6 SUZ12 LRRC71 EIPR1 PRKAR2B EIF2B4 WWC3 MFSD9 SLC35F3 RRS1 SMPDL3A METAP2 ADGRB2 HID1 STUB1 NCAPG CUEDC1 IL17RC RPL34 DPYSL2 FAM111A SIMC1 KIAA2012 TWSG1 NCSTN LTO1 NDRG4 N4BP3 MCM10 SLC35F4 TMEM131L RAD51 MRPL4 CEP170 HIRIP3 FHIT APOL6 MYO10 DCXR MEGF6 MAP4K5 TNFRSF12A HELZ MCM7 RPL26 ELAC1 KDM4A SYTL3 ZNF189 ZNF557 TMOD2 MARVELD3 MYBL1 MAP3K10 GRAMD1B AK8 ATP6V1H FANCA RBL2 CSTB WDR11 ZNF507 RNF141 PGC NFE2 LRCH2 PLAT UBE2R2 URB2 USF3 MAPKBP1 NUB1 CEP57 SEPTIN5 CDCA8 REXO4 ATP6AP2 TMEM138 PRKRIP1 ADPRHL1 ERCC6L MPND PNPLA1 EIF2S2 TMA16 PRSS23 PELO MAGED2 RPF2 SPRY2 RPL26L1 GAR1 TRIM41 RNF157 NECTIN3 MAP4 NME8 PKN2 PSMB4 SMARCA5 YJU2 TMEM143 RPL19 VHL USP36 KLHDC4 ZNF837 ANAPC4 ZFP69 PCM1 ZNF619 ADAR OAZ1 MYH9 DENND5B DGLUCY RNMT TMEM200C IFT56 ERGIC2 MAP4K3 PON3 ZNF275 PLA2G6 EXOSC5 FKBP15 DHRS3 FABP2 EMC2 SEPTIN2 SRP54 BPGM ADD1 MSL3 KNOP1 SP8 TACC3 TMEFF2 PGM2 SYNJ2 CFAP410 LRP5 SFR1 SMARCA4 PELP1 TTI2 TUBGCP2 KRR1 PIAS1 DNAJC21 FOXM1 CTSB EFCAB7 MIS18BP1 MCEE BEND7 MAF1 FBXO30 NUCB1 PLK4 SH3TC1 ERCC5 FAM184A KARS1 RPS11 TFPT AKT1 CEP350 CCDC137 NSRP1 EDN1 PRDM10 VGLL3 PLEC KLK10 TRIM52 MPZL1 CEP164 DIAPH3 FOXJ2 PP2D1 LYST ZNF652 EHBP1L1 TPPP3 CLIP1 DDX24 ABHD10 KRT13 COIL TBL3 KIF3C DNAJA1 TSPYL1 ARID5A RASEF TTC39A USO1 POLR3F LPIN1 STXBP4 CRADD KBTBD7 MCOLN3 HAUS6 NKRF OBSL1 INO80C OGDHL PJA1 SUB1 MRPL40 SRPX2 MCOLN2 DDX55 METTL5 INTS6 DOLPP1 DEPDC1 MKKS VIM MON2 CAGE1 OSCP1 BARX2 DMXL1 POLR2C THSD4 VPS28 NLK ZNF519 HS1BP3 NBEAL1 LRRC23 HEATR1 MLH1 IP6K1 TCHHL1 APTX NUDT6 TSPYL6 ZNF132 GPATCH4 SUCO CLYBL AGAP2 TCTN3 NOP16 UBTF GTF2E1 NHERF1 HMGXB3 PSMB5 ZNF668 JAZF1 APOA4 MPHOSPH10 RSRC2 WDR35 EXOC4 ID3 NDRG1 PSMD12 HAS3 PTPRE MAP7D3 CNFN H1-10 PGM1 NAA10 SIRT7 NEK1 PUM3 MAPK1 IDO1 ENKD1 CEP85 IL37 AK5 NOP14 PCNT GNL2 ARFGAP2 RSL24D1 PES1 RPP38 EML4 TMEM17 COQ5 TPCN2 JTB GYS1 POLR2F CCT5 ARMCX5-GPRASP2 ABHD3 FBXW11 WASF1 ZFHX4 TBC1D31 CNN3 IGBP1 ZCCHC10 RPL22L1 SCG2 CDC42EP2 LMO7 MAPRE1 GLCCI1 LURAP1L MAP2K5 TMTC3 WWC2 MYL5 VGLL4 DNAJB9 BRIX1 CSGALNACT1 RNASE7 SKA1 RETSAT BRF2 E2F1 COL1A1 NPM1 DHDH GTF2B DKC1 KMT5A DMAC2 PCYT2 TRNAU1AP TERF1 AKAP4 ANKRD24 SUPT20H TERB2 GET3 KCTD4 TMEM25 PPP1R12B CCM2 KNSTRN UBLCP1 PDCD11 SIRT2 CISH NPR1 SLC25A48 ANGPT4 DYNC1LI1 SOCS4 STARD7 HGD BRWD1 LATS2 TMX1 ZNF239 ADORA1 GTPBP4 EIF2B5 FAM118B CA13 COLEC11 TBC1D20 EML3 POLR1G WDR37 RBM34 ACVR2B SAMD15 ATP6V1G1 USP47 ANKAR GSTM3 CFAP36 PSPC1 ACTL9 ZNF687 LZTS1 NMT1 PDGFA PRMT7 FOXA1 DDX52 CD99L2 GRWD1 TSPOAP1 DCTN3 SYNE2 FAM193B TCOF1 MYO18B PNPLA3 ESRRA KRI1 SNAPC5 RPUSD3 FAM204A RAB11FIP5 RHBDD3 RPAP2 UBE2Q1 CD2 VAX1 YBX2 CEP250 PHACTR2 ATAD1 SPIRE2 ITFG1 RDM1 SDR9C7 LHFPL6 DNAJC28 TOR1AIP1 ZDHHC18 GPBP1 CENPH ZNF71 COG7 NUP35 NCF2 SUPT16H CCDC148 MRPL13 ATXN1L PAWR RPL8 TIGD1 DDX23 EBNA1BP2 FBXO32 ATF4 PM20D1 TCEA1 KIF18B TTLL1 NUSAP1 DCUN1D5 RPL9 SNX7 RPL5 ZZZ3 CNNM4 ZYG11B RRP1B BCLAF1 KCNN4 PAN3 ACADS TSR2 EEF1B2 BLOC1S6 DTNBP1 ERICH1 SLC24A1 FIGNL1 TIAM2 SRP72 FKBP11 BCAS4 CCDC34 FTSJ3 RREB1 TOP1 TTLL9 BMAL2 GPR132 HMGB3 ZFC3H1 TSPAN12 EN1 CRTAP DHX9 RAB11A HJURP CSKMT PAIP2B FBLN1 INTS4 LAD1 DDA1 ESAM C2CD4B NXF1 LMTK2 CSRNP3 TOP2A ARL11 NTMT2 BARD1 GPX7 GNL3 DSCAM FGD4 RAB23 PWP2 USP5 BCAR1 WDCP ALPK1 CDCA7L LARP6 NOLC1 TMEM37 CEP20 TRIM32 NEDD4 CALD1 TTF1 CDK16 DZIP1L KIAA1671 LIMA1 CRACR2A LEO1 ZCCHC7 ZNF766 CRBN CRELD1 MKI67 SRFBP1 ZNF12 HNRNPU IFT20 TLE1 NIFK CCT8 RBM19 UTP18 DTWD1 ZNF415 CDHR3 ZNF75A TMEM45A CDC42EP3 ANKMY2 CYP4F2 VRK1 NOP53 KALRN NOP2 LONRF1 TFAP2C TSG101 MYSM1 RPS3A SMIM8 TSPAN33 CAMSAP2 ZNF787 GGNBP2 CCDC57 ODF2L USP33 ZNF428 LDLRAP1 TMC3 IQSEC1 YAP1 THYN1 ANKRD10 LANCL1 KIFAP3 NOL7 ANO7 FBXW10B SPATA32 AXL CCDC106 NOL10 TRPC7 MUS81 RAB15 LRRC41 PSMD10 RABL6 PUS7L TAF4B IPO4 MAP3K9 IRS1 TSEN15 CFAP97 XRN2 INPP1 FAM3A RBM33 SUSD6 H1-2 NUTF2 SCN4A ZNF347 KIF26B SETD7 MYC NSUN5 SERGEF ENOPH1 OLFM1 PGRMC1 NRG2 ETV6 COL11A1 SNRPB2 KDM2A GATA3 PRRC2C THUMPD3 FTH1
4.7981334,19.207315,Cluster 3,INTRACELLULAR NON-MEMBRANE-BOUNDED ORGANELLE,PCGF5 CETN3 LSM14B MED12 TMEM131 FLNA DENND10 PRDM1 CCDC121 PCLO PITPNM3 TULP3 ZC3H15 CCDC86 AMIGO3 SMU1 TATDN3 TRMT1L CRYL1 FGF5 EWSR1 GKN1 MTCL2 ACTN2 IP6K2 RESF1 TMA7 TNNI1 DUS3L RNF111 UAP1L1 EMC1 GFM1 CLDND1 FAM131A DVL3 FAM216A HOXC8 DDX56 KIF20B NAP1L1 RAB22A SEPTIN12 TEKT2 MPRIP OTUD7B SLC6A15 SURF2 ZNF654 DEAF1 MDN1 RABIF FAAH2 PPCS FSD1L BLTP1 NACC2 BTBD10 PCDHB5 SELENBP1 APBA2 SEPTIN7 PHACTR4 NEK8 PFDN2 PGAP2 USP44 UTP6 NFIB RWDD4 DPY19L3 FRMD5 CC2D1A SMG7 ZNF593 DHX34 CCDC171 DDX50 DDX47 CCDC40 PAFAH1B3 P2RX4 GINS4 PLCD1 NDE1 NFKBIE URB1 CHPF PPDPF MYH10 TBC1D13 SETMAR LUZP1 ZNF81 MUC16 ZNF77 ARHGAP11A WBP1L AXIN1 NOP56 BEND2 TTC27 SPATS2L SS18L2 LRRC47 TOM1L2 MRM2 TEKT5 NOM1 ATXN2 PXDN ASRGL1 WDR89 ZNF106 THBS3 KIFC1 PEX14 PHF3 TPGS2 TNFAIP1 CCDC24 TRMT5 ZNF146 PRKAR2A KBTBD2 DIAPH2 TRIM46 TMEM116 CCDC136 PWP1 LAMP2 CCDC88C AGA TXNRD1 MED20 SUSD1 MAOB CLK4 TTBK2 NOL6 KANSL2 IQGAP3 SDE2 EDRF1 HARBI1 RAB29 NRIP1 INO80E DCTN6 ZNF397 LYAR DSTYK ZNF76 FHL2 DCAF1 MRPL17 IGSF10 ZNF800 DEPDC4 RNF115 SPAG1 KRT2 BICDL2 BYSL SLC44A2 CTDP1 PARS2 AKAP11 ZSCAN1 INPP4B CEP131 DCLRE1A UBXN6 NVL NUDCD2 ZBTB18 ANKRD40 SPC24 INTS6L VPS45 NSMAF POLR1E NPFFR2 DGAT1 ADAMTS20 PAPSS1 ZNF148 RPS6KA6 CEMIP ICE1 INPP5J TEX264 AVEN GTF2F2 VPS50 TMEM115 NOC2L SQLE TAF13 TM6SF1 SCNN1D ACTN4 FSTL5 BMS1 HMGN2 DUSP6 CANT1 ZFP90 MBLAC2 RAB3IP COA4 MARCKS IFI16 CYB5D1 FEZ2 POLR1F SEPTIN9 DDC SHMT2 ANKEF1 SLC10A3 SPRY3 RBM28 ZC3H11A KRT24 LARP4 CEP128 POLR1A SLC16A3 BRINP1 KIAA0753 DDX18 TRAF6 KRT23 ATP9A RRN3 ZNF142 ACAP2 BZW2 RSL1D1 PTPN18 SPPL2A WDR55 MAPDA DFFB ADAM23 TMEM79 SELENOF CTTNBP2NL SDAD1 RBMX2 NPRL2 CDKN2A CLEC11A N4BP2 SLC10A7 USP35 CDC42EP4 EXOSC9 MEOX1 TBCA LARS2 TRAPPC8 NOP58 USP28 ANKRD1 FNDC7 ZBTB16 NOC4L EXD2 PNKP PTMS FMR1NB ZNF701 IQCB1 PPP2R3A WDR3 CKAP5 LDOC1 RBM23 UBE2T ETV4 STK32B RPS19BP1 CD74 TTK MORC3 CCDC110 MRPL3 RRP15 TMEM186 RBM39 RPL10A ID2 GNL3L SNX15 MED12L PTAR1 SMARCB1 RMDN1 CROCC SPTY2D1 DBN1 CRIPT IFT22 EYA3 ZC3H14 CADPS2 IDH3G HDHD3 PDLIM7 DDX10 PELI3 HINT2 PPP1R14A WDR93 CELF2 ZNF846 GINM1 TIPARP NOL8 F11R CDK5RAP2 NES LHFPL2 ARMC9 DNTTIP2 RPL7L1 RRP8 CENPE PFKL TMT1B GIGYF1 CAMK4 COL21A1 CLK3 CCDC59 AMOTL2 ILF3 PHF12 EFNB1 SRRM3 PITX1 EXOSC10 CDV3 KRT8 TLCD2 WAPL CNTROB DLGAP5 NUFIP1 ATXN7L2 CMSS1 CLASP2 GARIN5A PPP1R7 DDX49 MRPL53 OLA1 WDR74 ACTL6B MRPS9 ZNF16 KCNK6 RPL6 LRWD1 ENTPD1 TUT4 MFSD4B PHF6 PLPP4 TIMM17B FAIM2 HMMR ECHDC3 ZC4H2 RENBP MRPL18 RIMKLA CDC45 PAGE1 ZNF692 IRAK4 FBXL19 ACTN1 NAE1 RAB8A SMG6 SURF6 SUZ12 LRRC71 EIPR1 PRKAR2B EIF2B4 WWC3 MFSD9 SLC35F3 RRS1 SMPDL3A METAP2 ADGRB2 HID1 STUB1 NCAPG CUEDC1 IL17RC RPL34 DPYSL2 FAM111A SIMC1 KIAA2012 TWSG1 NCSTN LTO1 NDRG4 N4BP3 MCM10 SLC35F4 TMEM131L RAD51 MRPL4 CEP170 HIRIP3 FHIT APOL6 MYO10 DCXR MEGF6 MAP4K5 TNFRSF12A HELZ MCM7 RPL26 ELAC1 KDM4A SYTL3 ZNF189 ZNF557 TMOD2 MARVELD3 MYBL1 MAP3K10 GRAMD1B AK8 ATP6V1H FANCA RBL2 CSTB WDR11 ZNF507 RNF141 PGC NFE2 LRCH2 PLAT UBE2R2 URB2 USF3 MAPKBP1 NUB1 CEP57 SEPTIN5 CDCA8 REXO4 ATP6AP2 TMEM138 PRKRIP1 ADPRHL1 ERCC6L MPND PNPLA1 EIF2S2 TMA16 PRSS23 PELO MAGED2 RPF2 SPRY2 RPL26L1 GAR1 TRIM41 RNF157 NECTIN3 MAP4 NME8 PKN2 PSMB4 SMARCA5 YJU2 TMEM143 RPL19 VHL USP36 KLHDC4 ZNF837 ANAPC4 ZFP69 PCM1 ZNF619 ADAR OAZ1 MYH9 DENND5B DGLUCY RNMT TMEM200C IFT56 ERGIC2 MAP4K3 PON3 ZNF275 PLA2G6 EXOSC5 FKBP15 DHRS3 FABP2 EMC2 SEPTIN2 SRP54 BPGM ADD1 MSL3 KNOP1 SP8 TACC3 TMEFF2 PGM2 SYNJ2 CFAP410 LRP5 SFR1 SMARCA4 PELP1 TTI2 TUBGCP2 KRR1 PIAS1 DNAJC21 FOXM1 CTSB EFCAB7 MIS18BP1 MCEE BEND7 MAF1 FBXO30 NUCB1 PLK4 SH3TC1 ERCC5 FAM184A KARS1 RPS11 TFPT AKT1 CEP350 CCDC137 NSRP1 EDN1 PRDM10 VGLL3 PLEC KLK10 TRIM52 MPZL1 CEP164 DIAPH3 FOXJ2 PP2D1 LYST ZNF652 EHBP1L1 TPPP3 CLIP1 DDX24 ABHD10 KRT13 COIL TBL3 KIF3C DNAJA1 TSPYL1 ARID5A RASEF TTC39A USO1 POLR3F LPIN1 STXBP4 CRADD KBTBD7 MCOLN3 HAUS6 NKRF OBSL1 INO80C OGDHL PJA1 SUB1 MRPL40 SRPX2 MCOLN2 DDX55 METTL5 INTS6 DOLPP1 DEPDC1 MKKS VIM MON2 CAGE1 OSCP1 BARX2 DMXL1 POLR2C THSD4 VPS28 NLK ZNF519 HS1BP3 NBEAL1 LRRC23 HEATR1 MLH1 IP6K1 TCHHL1 APTX NUDT6 TSPYL6 ZNF132 KIF5B GPATCH4 SUCO CLYBL AGAP2 TCTN3 NOP16 UBTF GTF2E1 NHERF1 HMGXB3 PSMB5 ZNF668 JAZF1 APOA4 MPHOSPH10 RSRC2 WDR35 EXOC4 ID3 NDRG1 PSMD12 HAS3 PTPRE MAP7D3 CNFN H1-10 PGM1 NAA10 SIRT7 NEK1 PUM3 MAPK1 IDO1 ENKD1 CEP85 IL37 AK5 NOP14 PCNT GNL2 ARFGAP2 RSL24D1 PES1 RPP38 EML4 TMEM17 COQ5 TPCN2 JTB GYS1 POLR2F CCT5 ARMCX5-GPRASP2 ABHD3 FBXW11 WASF1 ZFHX4 TBC1D31 CNN3 IGBP1 ZCCHC10 RPL22L1 SCG2 CDC42EP2 LMO7 MAPRE1 GLCCI1 LURAP1L MAP2K5 TMTC3 WWC2 MYL5 VGLL4 DNAJB9 BRIX1 CSGALNACT1 RNASE7 SKA1 RETSAT BRF2 E2F1 COL1A1 NPM1 DHDH GTF2B DKC1 KMT5A DMAC2 PCYT2 TRNAU1AP TERF1 AKAP4 ANKRD24 SUPT20H TERB2 GET3 KCTD4 TMEM25 PPP1R12B CCM2 KNSTRN UBLCP1 PDCD11 SIRT2 CISH NPR1 SLC25A48 ANGPT4 DYNC1LI1 SOCS4 STARD7 HGD BRWD1 LATS2 TMX1 ZNF239 ADORA1 GTPBP4 EIF2B5 FAM118B CA13 COLEC11 TBC1D20 EML3 POLR1G WDR37 RBM34 ACVR2B SAMD15 ATP6V1G1 USP47 ANKAR GSTM3 CFAP36 PSPC1 ACTL9 ZNF687 LZTS1 NMT1 PDGFA PRMT7 FOXA1 DDX52 CD99L2 GRWD1 TSPOAP1 DCTN3 SYNE2 FAM193B TCOF1 MYO18B PNPLA3 ESRRA KRI1 SNAPC5 RPUSD3 FAM204A RAB11FIP5 RHBDD3 RPAP2 UBE2Q1 CD2 VAX1 YBX2 CEP250 PHACTR2 ATAD1 SPIRE2 ITFG1 RDM1 SDR9C7 LHFPL6 DNAJC28 TOR1AIP1 ZDHHC18 GPBP1 CENPH ZNF71 COG7 NUP35 NCF2 SUPT16H CCDC148 MRPL13 ATXN1L PAWR RPL8 TIGD1 DDX23 EBNA1BP2 FBXO32 ATF4 PM20D1 TCEA1 KIF18B TTLL1 NUSAP1 DCUN1D5 RPL9 SNX7 RPL5 ZZZ3 CNNM4 ZYG11B RRP1B BCLAF1 KCNN4 PAN3 ACADS TSR2 EEF1B2 BLOC1S6 DTNBP1 ERICH1 SLC24A1 FIGNL1 TIAM2 SRP72 FKBP11 BCAS4 CCDC34 FTSJ3 RREB1 TOP1 TTLL9 BMAL2 GPR132 HMGB3 ZFC3H1 TSPAN12 EN1 CRTAP DHX9 RAB11A HJURP CSKMT PAIP2B FBLN1 INTS4 LAD1 DDA1 ESAM C2CD4B NXF1 LMTK2 CSRNP3 TOP2A ARL11 NTMT2 BARD1 GPX7 GNL3 DSCAM FGD4 RAB23 PWP2 USP5 BCAR1 WDCP ALPK1 CDCA7L LARP6 NOLC1 TMEM37 CEP20 TRIM32 NEDD4 CALD1 TTF1 CDK16 DZIP1L KIAA1671 LIMA1 CRACR2A LEO1 ZCCHC7 ZNF766 CRBN CRELD1 MKI67 SRFBP1 ZNF12 HNRNPU IFT20 TLE1 NIFK CCT8 RBM19 UTP18 DTWD1 ZNF415 CDHR3 ZNF75A TMEM45A CDC42EP3 ANKMY2 CYP4F2 VRK1 NOP53 NOP2 TFAP2C LONRF1 TSG101 MYSM1 RPS3A SMIM8 TSPAN33 CAMSAP2 ZNF787 CTPS1 GGNBP2 CCDC57 ODF2L USP33 ZNF428 LDLRAP1 TMC3 IQSEC1 YAP1 THYN1 ANKRD10 LANCL1 KIFAP3 NOL7 ANO7 FBXW10B SPATA32 AXL CCDC106 NOL10 TRPC7 MUS81 RAB15 LRRC41 PSMD10 RABL6 PUS7L TAF4B IPO4 MAP3K9 IRS1 TSEN15 CFAP97 XRN2 INPP1 FAM3A RBM33 SUSD6 H1-2 NUTF2 SCN4A ZNF347 KIF26B SETD7 MYC NSUN5 SERGEF ENOPH1 OLFM1 PGRMC1 NRG2 ETV6 COL11A1 SNRPB2 KDM2A GATA3 PRRC2C THUMPD3 FTH1
5.13491,19.562754,Cluster 3,INTRACELLULAR ORGANELLE LUMEN,PCGF5 MED12 LSM14B TMEM187 FBXO43 PRDM1 TEX35 PITPNM3 NPPB TULP3 ZC3H15 CCDC86 TRMT1L CRYL1 FGF5 EWSR1 MTCL2 RESF1 ACTN2 TMA7 TNNI1 FAM161A DUS3L RNF111 SRSF5 CLDND1 FAM131A DDX56 TIFA TREX1 FLOT2 SLC6A15 SURF2 RTF2 DEAF1 MDN1 USP37 FAAH2 PPCS SMC6 NACC2 DAB2 BTBD10 PCDHB5 SELENBP1 XPC PBXIP1 APBA2 RSPH4A SEPTIN7 TCERG1 A2M REG1A PFDN2 USP44 LEUTX UTP6 NFIB CC2D1A PPM1E ZNF593 CCDC171 DDX50 DDX47 DOK7 ACTA2 RPS26 NDE1 DEPDC7 NFKBIE SOS1 URB1 PPDPF TBC1D13 NIN SETMAR ZNF77 CAMLG KYAT3 LRIG1 UTP3 RPS23 NUP153 ARHGAP11A STON2 TRMT6 AXIN1 NOP56 FAU TTC27 ATP2B1 SLC38A10 FRMD8 SIGIRR SPATS2L SS18L2 TACC2 LRRC47 MRM2 NUDT16 NOM1 ATXN2 KIF5C ZNF106 OSGIN2 THBS3 TPGS2 PEX14 PHF3 TNFAIP1 CCDC24 LAMB3 TRMT5 ZNF146 SFTPA2 MKNK2 KBTBD2 DIAPH2 CCDC136 SCAF11 PWP1 TRO CCDC88C SCML2 TXNRD1 MAOB NOL6 KANSL2 LRP12 IQGAP3 SDE2 KIF3B AKTIP IPMK RAB29 SLC7A10 B3GNT5 NRIP1 INO80E KIF1B ATP13A3 DCTN6 VPS25 ZNF397 LYAR ZNF76 DCAF1 MRPL17 ZNF800 P2RX6 RPL21 RNF115 NOL11 BYSL VILL ZSCAN1 AKAP11 DCLRE1A MMP24 SLC6A17 UBXN6 NVL ANKRD40 SPC24 IFI27L2 NSMAF POLR1E TRDMT1 DGAT1 PAPSS1 RPS6KA6 VWA5A INPP5J TEX264 SBNO1 WDR12 MXI1 VPS50 NOC2L TAF13 AKR1A1 FKBP14 ATF7IP2 ACTN4 UTP15 FBXO11 BMS1 FSTL5 HMGN2 MS4A8 N4BP1 FAM32A DNAJC5 ZNF404 COA4 MARCKS DNTTIP1 IFI16 CYB5D1 FEZ2 POLR1F DDX27 SPRY3 ANKEF1 CPNE1 RBM28 MRPS31 RBM3 LARP4 TXN2 POLR1A TBC1D9B ZBTB43 CRIP2 EFCAB14 TRIM3 DDX18 PPFIA4 AGPS ATP9A RRN3 TRAF6 ACAP2 ZNF142 ZNF140 SNAPIN HINT3 NMD3 RSL1D1 SPPL2A WDR55 ARFIP2 DFFB TMEM79 SELENOF CTTNBP2NL SDAD1 RBMX2 ERMP1 PPID CDKN2A SNX16 IDI1 ZNF669 CCDC149 SLC10A7 UBXN11 USP35 TLK2 SNRPA EXOSC9 MEOX1 TBCA LARS2 PDCD7 LARP4B NOP58 USP28 ANKRD1 NAXD ZBTB16 ZNF280C NOC4L GSKIP PNKP ABCF3 PTMS FMR1NB TNFAIP8L2-SCNM1 ZNF678 PPP2R3A WDR3 CHD3 CKAP5 CERCAM LDOC1 UBE2T ETV4 RPS19BP1 TTK CCDC110 MRPL3 PHLDA2 RRP15 DNAJA2 RPL10A RPL4 GNL3L RABGAP1L SEPHS2 SNX15 MED12L MRPL23 BEGAIN SMARCB1 CCDC12 TOX4 SPTY2D1 CRIPT ZC3H14 CADPS2 IDH3G HDHD3 TRAF4 DDX10 ADIPOR1 HINT2 PPP1R14A RMP64 GINM1 ZBED5 EP400 RPL18 CCDC38 NOL8 CYP20A1 RECQL5 RPL7L1 ARMC9 DNTTIP2 RRP8 PFKL RNFT1 CAMK4 CDK12 CCDC59 SNX30 AMPD3 ADIPOR2 ILF3 PHF12 PITX1 EXOSC10 CDV3 TBX18 TLCD2 INCENP NUFIP1 SRP14 ATXN7L2 CMSS1 CLASP2 GARIN5A GPR157 BORA DDX49 MRPL53 PPP1R7 ACTL6B MRPS9 WDR74 LRWD1 TUT4 SHC1 PHF6 PLPP4 NCKAP5 DIMT1 ECHDC3 RIMKLA LRRC7 PAGE1 ZNF692 DTX3 IRAK4 STAC3 ACTN1 SMG6 RAB8A SURF6 SUZ12 LRRC71 BUD23 MOB2 HOMEZ DRGX MFSD9 AATF RRS1 SLC35F3 METAP2 SMPDL3A ZXDC SIMC1 MLLT1 RPL34 DLGAP3 DPYSL2 FAM111A KIAA2012 UBE2M NDRG4 MCM10 GTF3C1 SLC35F4 TMEM131L TRIB3 RAD51 MRPL4 REG1B HIRIP3 LSM7 FHIT APOL6 MYO10 RIOK1 DCXR MAP4K5 HELZ RPL26 CALML5 CYB5R1 KDM4A SYTL3 TMOD2 P3H1 MYBL1 GRAMD1B AK8 TMEM242 MPHOSPH8 FANCA ZNF507 RBL2 CSTB GAD1 PIGO PGC LRCH2 USF3 RPL18A ATPAF1 SENP3 SLC7A5 UBE2R2 URB2 R3HDM2 CECR2 MAPKBP1 NUB1 SEPTIN5 CDCA8 REXO4 ATP6AP2 ADPRHL1 MPND EVC EIF2S2 NUAK1 TMA16 PRSS23 PELO MAGED2 ORC4 RPF2 CASTOR1 PBDC1 GAR1 DNHD1 RPL26L1 TRIM41 KXD1 RNF157 EEIG2 SMARCA5 NOVA1 FEN1 TMEM143 RPL19 TMEM140 USP36 KLHDC4 WDR18 ALYREF ZNF837 AHDC1 AFF4 ADAR DENND5B RNMT RPL7A RASSF4 KREMEN2 ZNF207 ERGIC2 FAM98C CTU2 PON3 ZNF275 NSA2 ZNF16 EXOSC5 FKBP15 DHRS3 SRP54 EMC2 SEPTIN2 BPGM MSL3 KNOP1 DENND1C PTPN11 SYNJ2 RRP7A PRSS12 GRAMD2A LRP5 SFR1 SMARCA4 PELP1 RBBP8NL MPP3 KRR1 DNAJC21 FOXM1 AMDHD2 CTSB EFCAB7 BMPR1B MIS18BP1 MCEE KIF2B BEND7 MAF1 FAM13A PLK4 SH3TC1 RPS11 TMEM35B TMEM249 TFPT NSRP1 CCDC137 EDN1 PRDM10 VWA3B CIB2 BIRC2 VGLL3 REXO5 B3GNTL1 KLK10 MXRA8 TMEM154 TRIM52 FOXJ2 SMIM44 TNFRSF21 ZNF652 EHBP1L1 TPPP3 DDX24 ABHD10 COIL TBL3 NUDT8 MED27 ANKS6 TSPYL1 HDDC2 ARID5A SIX1 CHCHD1 FAM174C USO1 ING1 LPIN1 ELL3 GEMIN2 BNIP2 KBTBD7 LRRC40 MCOLN3 NKRF OGDHL INO80C PJA1 SMOX SUB1 MRPL40 GCLC TBCK DDX55 BMAL1 METTL5 GON7 CRAMP1 DEPDC1 MON2 CAGE1 SERPINB1 OSCP1 BARX2 SGF29 DMXL1 THSD4 ZNF519 NLK THAP12 RCOR3 HS1BP3 WDR33 NBEAL1 LRRC23 HEATR1 MLH1 IP6K1 NBAS APTX TCHHL1 TSPYL6 ACADVL DCAF10 GPATCH4 KRCC1 METTL1 STX16 SUCO AGAP2 ZNF276 BCL9L NOP16 UBTF BCL2L1 ZNF668 HMGXB3 MPHOSPH10 RSRC2 EXOC4 H1-10 HEXD NAA10 MCL1 SIRT7 RPN1 NEK1 PUM3 EFCAB13 NCOA4 CCNB2 KCNC4 SMIM29 CEP85 IL37 NOP14 GNL2 PDZD8 ARFGAP2 ABHD14B PES1 RSL24D1 SLAIN2 RPP38 AS3MT COQ5 HES6 TPCN2 NUP188 POLR2F BTN3A3 CCT5 APEX2 SGMS1 ABHD3 FBXW11 MIX23 PDRG1 ZFHX4 PHAX ATOSB PNO1 DNAL4 MRTO4 ZCCHC10 KIAA1586 SCG2 RBM18 GLCCI1 LURAP1L MAP2K5 MYL5 VGLL4 BRIX1 RNASE7 RETSAT BRF2 E2F1 NPM1 ZNF577 GTF2B DKC1 KMT5A DMAC2 RPS6KA3 TERF1 SMDT1 CERS6 AKAP4 SUPT20H TERB2 GET3 STX17 CCM2 UBLCP1 NCAPD2 ANKRD49 PDCD11 BAZ1B SIRT2 ALAS1 RPP30 NPR1 SOCS4 ANGPT4 STARD7 TRIM69 HGD PLTP BRWD1 TMX1 GRB2 ZNF239 ADORA1 PPIB GTPBP4 EIF2B5 MMP9 MED16 CA13 ABCC8 BTNL8 DDAH1 TBC1D20 EML3 METTL25B CASP6 POLR1G SRPK2 RBM34 SAMD15 ATP6V1G1 PSPC1 CTSV CFAP36 GSTM3 RBBP5 RNF125 ACTL9 ZNF687 DNAJC14 LZTS1 WASL PRMT7 CAB39 ZNF354A FOXA1 DDX52 GRWD1 JADE3 PCNX4 DCTN3 RPAIN TSPOAP1 FAM193B TCOF1 CCDC127 DDX28 CCBE1 ESRRA PNPLA3 ZNF277 KRI1 SNAPC5 RPUSD3 FAM204A ZMYM4 CCDC61 ACTL7A LBX2 RPAP2 CD2 VAX1 YBX2 PHACTR2 ATAD1 RDM1 SDR9C7 LHFPL6 DNAJC28 ZNF71 GYG2 GPBP1 CENPH COG7 NCF2 ABTB1 CCDC148 MRPL13 PARN SUPT16H VEPH1 ATXN1L RPL8 TIGD1 DDX23 EBNA1BP2 FRAS1 FBXO32 PM20D1 TCEA1 KIF18B BCAM NUSAP1 TTLL1 DCUN1D5 RPL9 SNX7 RPL5 ZZZ3 ADM RRP1B BCLAF1 KCNN4 UTP23 TSR2 EEF1B2 MBIP SPATA2 ERICH1 GFPT1 ING3 PFKFB4 ACVR1 COX10 ZSWIM1 FIGNL1 TIAM2 SRP72 POLR2G RREB1 CCDC34 FNDC9 FTSJ3 OSER1 TOP1 ATOSA BMAL2 HMGB3 EN1 SPOCD1 NPM2 DHX9 HJURP CSKMT PAIP2B PCSK7 FKBP5 INTS4 RRP12 DDA1 MAK16 C2CD4B NXF1 TOP2A CSRNP3 ZCCHC7 SH3PXD2B NTMT2 BARD1 GPX7 GNL3 DSCAM TXNDC2 PWP2 WDCP BCAR1 PHF2 ZFAND2B CDCA7L CD2AP DMTF1 FAR2 NOLC1 TMEM37 MICALL2 SMIM20 CCDC82 TRA2A WDFY3 TTF1 RPP25L ATP6V1F SLIT2 ENSA HSPA12B CRACR2A LEO1 SMAD7 RNASEH1 CRBN CRELD1 MKI67 SNX5 SRFBP1 TLE1 ABCF2 PPM1B GOLGA3 ATP2C1 KANSL3 NIFK RBM19 UTP18 DTWD1 ZNF415 CDHR3 NGDN PRMT5 ZNF75A CDC42EP3 HEATR3 OSR1 VRK1 NOP53 KALRN NOP2 TFAP2C TSG101 EZR RIOX2 RPS3A SMIM8 ATF3 CDK5RAP3 MAP1S YEATS4 MALT1 ZNF787 LOC102724560 WDR36 ODF2L ZNF428 IQSEC1 YAP1 THYN1 AGPAT4 CIPC NOL7 ANAPC11 FBXW10B SLC25A15 CCDC106 NOL10 SPATA32 NKIRAS2 MUS81 LRRC41 SELENOH PSMD10 TANK PUS7L TAF4B IPO4 MAP3K9 IRS1 PTPN6 CFAP97 PXMP4 TSEN15 XRN2 ZDHHC7 FAM3A ZEB2 NPM3 H1-2 SETD7 MYC NSUN5 SERGEF ENOPH1 OLFM1 PGRMC1 ARPP21 RHOF NRG2 ETV6 NFATC3 SNRPB2 KDM2A ZNF320 GATA3 MTDH PTDSS2 SCAND3 RNF213 ZNF330 PRRC2C XPO6 DYNC1I2 THUMPD3
