x,y,cluster,term,genes
-3.0955513,6.1711397,Cluster 1,MEMBRANE,ADCK5 SLC1A5 KIAA1958 FLACC1 DENND10 EPB41L2 FLNA FSCN1 GADL1 CAVIN1 PIGB TEX35 TULP3 BRCA1 MISP COPZ1 NANP NDUFAF6 MBD3L1 EPB41 MRPS14 ANKIB1 THBS2 NAV3 HCFC2 BTN2A1 MIB1 TEKT2 FNIP2 SCEL INTS12 LRRC14 AMPH COX7A2L MEPCE NUP58 FSD1L KANSL1 DAB2 XPC SYT4 APBA2 SEPTIN7 ATXN10 SUN2 IL12RB2 ACLY PHACTR4 EIF4B TMEM109 TMEM266 TMPO DQX1 DIS3L GPRC5A SYNC TDRKH ALDH1A3 TNRC18 SIX2 MUC1 RAB3GAP2 DHX34 UBE2S DDX50 TMEM63B ZBTB33 ARHGAP40 FLAD1 UPF3A ZNF354C ERLIN2 FBLN7 CCDC112 ICAM1 PTPRS GTSE1 PIP5K1A LAMA4 CFLAR CNTD1 PANX1 XPO1 FGD1 NUP153 IL18BP TM2D2 ZNF783 ATP2B1 IKZF3 WBP4 IL13 NUP133 MRNIP REPS1 INA EPB41L3 STK17B KIF5C ARL3 LZTS2 RABEPK ZC3H12A SORT1 CCDC24 ARK2C TRMU PIGQ ZNF185 ITSN2 TMEM43 SIN3B TES HYCC1 NGEF TNKS ERBB2 TRDN KANSL2 LMNB1 LRP12 SDE2 GCC1 APBB1 RAB29 SHTN1 ARHGAP18 MAP4K1 ITGB8 SYMPK CLDN4 NT5E DCTN6 RNF145 EDNRB ZDHHC20 FLNC ZNF227 KIF19 ZNF397 ITGA7 RAB13 TADA2B SMG9 PLAA ERC1 SLK ATP2B3 RASSF1 BCAR3 TRPM2 AKAP11 PPP2R1B HENMT1 HMGCS1 SFSWAP ZNF599 COL16A1 SRPK1 ARHGEF1 ERV3-1 MRPL42 PRKCA STAMBPL1 WNT8A OR8S1 PCDHB4 NPFFR2 PTPN4 NIBAN1 RCC1 CLTB CCAR2 NUP62 WDR12 DNAJC2 AVEN VPS50 CORO1B PTAFR SQLE CCNYL1 IL6ST RNF166 SCNN1D ESD PPP1R42 BST2 ZFP90 UBAP1 CREB3L4 MARCKS ZNF2 LY6K RSPH3 HYLS1 SLC45A4 ETNK1 RELN GOLPH3L ABCC6 SLC43A1 ANKEF1 PDZD2 ZC3H11A ZC3HC1 SAAL1 KIAA0930 CCDC107 DNAH6 TBC1D9B PGRMC2 HOMER3 NFE2L2 POM121C SLC16A3 TWF2 MCAM ZNF518B ACIN1 ACAP2 ADAM10 CD44 BZW2 FZD1 GFOD1 KCNC2 ROBO1 TRPM4 LCORL PACSIN3 CEP89 LRRC17 PTPRN2 ADD3 KPNB1 ARID2 TPD52 KIF17 RTL4 EPGN COG3 ACTR6 KCNA6 LAMTOR1 RBMX2 PPTC7 CARNMT1 PLCB1 PDE4D TMEM97 OCIAD2 CTNND1 RNF149 N4BP2 STIP1 TRIM71 CDC42EP4 DHX37 EXOC1 FZR1 PEAK1 RCCD1 RCSD1 ADPRH DRC8 PDCD7 EPS8L2 NUP155 EPB41L5 DDX60L PRKCZ USP25 PPP1R16A PPP1R9B GUCA1ANB-GUCA1A HSPB1 SPATA2L ACHE MARCHF7 GLRX3 FAM193A WDR3 CKAP5 SLC19A1 CYB5D2 ZNF521 BACE1 ARHGEF26 EMD NUDT16L1 PAFAH1B2 PALLD RGPD1 TMEM186 CERS2 PIGN TRAPPC14 RASSF3 SCAMP4 SUPT6H ATP2B4 DNAJC6 DNAJC9 GPX4 ABCG2 TMEM237 LIG4 ANKRD45 MX1 TOX4 DBN1 EVA1A ARID5B C1QBP KLC3 CD79B PPM1F ARHGEF28 YIPF4 CYBC1 PFDN1 SVIL PKN1 GINM1 LPAR1 AHCTF1 DHDDS IQGAP1 BLVRB CATSPER2 CYP20A1 MSN NDUFB4 NSFL1C RECQL5 RNF146 RRM1 ZNF503 ANO2 ANXA5 IL33 PLCD4 UBR2 MDH2 CASC3 OGT ALDH3A1 PRC1 VPS8 CCDC59 PRDX5 CCDC124 ERBIN AMOTL2 AMPD3 CTNNBIP1 PDAP1 CEP57L1 EEF2 HPS3 KNTC1 SNX9 SRRM3 CMTM4 GNPDA1 CDIPT CDV3 INCENP FAM135B TOLLIP CMSS1 ZBTB4 PCDHAC2 S100A2 CD81 RALGAPA2 RAPSN AP3B2 MTM1 MICAL1 NCKAP5 PKD2L2 CRYAB PDCD2 LRRC7 MAP2K1 ACTN1 IQGAP2 RAB8A REXO2 LRRC71 RIOK2 CEP295 DHPS EIF2B4 CCDC77 FLCN PRR7 UBQLN2 LRRFIP1 METAP2 KRTAP25-1 HRNR SPINT1 NR2C1 DPYSL2 DENND6B CD9 HYI SLC36A4 GCA ENO3 QKI FKBP2 TRIB3 SCIN CD46 MKRN3 CEP170 KATNB1 SPATC1L FHIT MCOLN1 MYO10 AFDN ENAH ANXA1 LGALS3 SMPD2 IPO5 AKAP10 HELZ MAP4K5 NKTR HMOX1 RAB27B CALML5 TJP2 RSAD1 SP3 TNKS1BP1 EGFR BRIP1 ITGA3 ZBTB1 PHLDA1 HTRA3 STX18 AXIN2 MPHOSPH8 ZNF749 PPFIBP1 CCDC81 CSTB YBX1 OPHN1 CCDC15 ERBB3 LRCH2 CFL2 NEO1 SLC7A5 HIP1R ADA EFR3A KAZN YES1 FCHSD2 TRIM44 FILIP1L AFG1L CTNNB1 ZMYM2 ZNF213 ADPRHL1 AHNAK BBS4 NHERF2 KCNH1 HINT1 IL7R MTPN PSMC5 SLC46A1 FTO ATOX1 GSR LMCD1 UBAC1 RNF157 MAP4 MAP3K21 PTCD3 LGALS1 FEN1 TMEM222 KLHL41 RSBN1L ELMO3 FLNB PCM1 RILPL1 DOCK9 ZMYND10 ROM1 ZNF598 PKM CCDC62 HSD17B10 CKAP2L PALB2 TDO2 ARFGAP1 LRRC45 ZNF655 DFFA RNF114 BAIAP2L1 SLC2A1 DAO RASAL1 NFKBIA SNX33 FABP2 ITGB1 ITGB7 MYOF ZHX2 ADD1 STAT2 VIL1 DENND1C SERPINB3 TMX4 WWTR1 CFAP410 MCF2L2 NF2 BICD2 SLC25A2 ABCB11 DOCK2 SLC17A5 ARHGAP10 PSMD9 SLC30A1 ATIC USP4 ZNF620 DNAAF1 EFCAB7 BMPR1B YOD1 PAPPA EHMT1 SH3BGRL ARL6 ZNF706 ZSWIM8 PTPN12 RAP1GAP2 GLRX SEPTIN3 MRPS15 TIGD7 BRD1 SPHK1 TFPT SLC2A13 FUT11 TET2 KATNIP UAP1 REXO5 KLK10 DAAM1 GPATCH2 SLC35F5 DIAPH3 L1CAM FABP5 ECT2 ACOD1 LYST RGS10 EHBP1L1 HIC2 PALM CRKL TPRN NUDCD3 CLCN6 ACOT9 DCBLD2 AAK1 CCDC97 CASP4 HUNK ENTREP3 COQ8B FBN1 KIF3C RDX SLC39A10 SLC38A5 SMAGP UBTD1 ASPSCR1 BCO2 EIF2B3 OBSCN PRNP ING1 SMAP1 C5AR1 ZNF292 SMOX TBCK MRPS23 SLC26A8 COL6A2 JMJD4 SSH1 WASF2 LRRC69 TMEM245 USP2 AMACR IL16 SLC38A7 SLC46A3 LBR IFRD1 NMBR VASP ZNF407 EFHC1 SAMHD1 CUL4B PRRT3 NBAS TCHHL1 STX4 TSPYL2 SIGLEC10 WDR6 MCMBP FASN LPIN2 ITPRID2 CORO2A AFAP1L2 RPIA ARB2A PDS5A TCHP TGM2 NHERF1 CDAN1 ABCD1 GAPDH LRRFIP2 CIAO3 CCT3 S100A13 UQCC1 VWA5B1 ZNF197 RAMP1 NCS1 MADD MYO1E ATP6AP1 SLTM DUS1L TDG NEK1 GPR183 ENKD1 SLC39A14 CIP2A MARCHF10 PDZD8 TP53BP2 ARFGAP2 LLGL1 PLAU TRIP6 CHD9 MYO9A CCDC8 PHF20L1 TTLL10 VCPIP1 PNCK CTSF BOC HROB BTN3A3 LRRIQ3 ARMCX5-GPRASP2 BLTP3A RASD2 ABHD3 FYB1 S100A14 WDR53 EIF5B MRTO4 UBE2QL1 PARP14 KIAA1586 FAM210B NSUN3 RNF6 PEBP1 ARHGAP23 RIOK3 DNAJB9 FMNL3 PRPF40B AHNAK2 SLC9A1 EEF1AKMT1 ANKRA2 ARHGEF12 MMP15 OAS3 PARP6 ORC6 RANGAP1 TYW3 SIPA1L3 PYGL HAPLN3 PPP1R12B SKA3 USPL1 ENO1 TRIM69 BSDC1 DCAF16 BAG3 NGFR PLCD3 PLTP GANAB MPHOSPH9 IKZF5 RNF5 FIGN ASPM RIPK1 GTPBP4 UTRN LEMD2 APOB SLC25A21 DDAH1 KLF9 CXADR MLF2 TTC23 SAMD15 ADSS2 AADAT EHBP1 PDHX HDAC8 CNKSR3 SLC9A3 ANKRD13A ZNF646 LZTS1 NMT1 PRMT7 TMEM218 UBE2D2 DNAJB4 AKT3 PROSER2 PROS1 CD99L2 ZSCAN22 HSCB SYNE2 ABCC1 CCBE1 EPCAM ZNF277 CCDC69 RPGRIP1L NCAM1 EXOC7 SCRIB EIF5 XRN1 TASP1 CGN ERC2 AKAP12 YTHDC1 SLC16A1 HAND1 PHGDH B2M GCLM ADAM12 OLIG2 TOR1AIP1 TXNIP KIF26A NUP35 BFSP1 PAWR ZCCHC3 DDX23 LASP1 ADRM1 SNAP23 NMT2 KIF18B PPP6R3 FAIM GFRA3 SNUPN CNNM4 SIPA1L1 ZNF367 TSHZ2 USP20 ADAMTSL4 SH3D21 OLIG3 BLOC1S6 COX6B2 F13A1 CCNT2 MSH6 BCORL1 PRKCSH SLC41A3 ZSWIM1 ITSN1 MARK3 SRP72 SUGT1 CCDC34 MSTO1 TMEM192 TBC1D30 BAIAP2 ZNF717 CADPS KIAA1549 DSG2 CA9 CSKMT ODR4 PCSK7 GRAMD1A KDF1 NLRP10 DNAJB2 LMTK2 EBAG9 KAT8 GCH1 NUS1 SH3PXD2B NIBAN2 RAB23 CD4 NUBP2 BCAR1 MMACHC CD2AP SHROOM2 MFSD2A CALD1 GPATCH1 CORO2B CDK16 PPP1CB SLCO1B3 OSBPL10 TTF1 LIMA1 COBL TSC1 AMDHD1 PACRGL ATG3 SLC16A2 TEX9 CNKSR2 GLE1 FBXO38 RTN4R ASH2L DRC4 BLTP3B SDC4 SNCG BASP1 ADAM2 TMEM175 ABCC3 HSH2D LAX1 FAM169A CREB5 FZD6 LONRF1 PDIA5 EZR TSG101 HERPUD1 TBCE ARHGAP33 ZC3H12C CRLF3 ABHD18 AFAP1L1 ARMC12 FANCI NFX1 CCDC71 RC3H1 LRBA UBE2D4 AKR1C1 UBE2C TRIML2 DCUN1D2 PCBD2 GNG2 TPR SLC4A1AP PHF20 ARL6IP6 ZNF487 PLEKHO2 LNX2 CDH4 RASAL2 RFX7 HAUS7 SLC25A15 RABAC1 ATP10D CSDE1 PDLIM5 PSTPIP2 PPP1R13B CBY2 BTRC FBLN5 CFAP97 MPL PROCA1 SUCLG1 KMT2D ARHGEF11 RBM33 UBASH3B FCAR KIF26B SLC4A2 SLC5A3 SMAD1 SPART JPT2 MFAP1 DDIAS RCC2 SRPRB UBE2D1 FARS2 MINDY3 NCK1 GPRIN1 CHD1L TTC17 PAK1IP1 SHANK1 STPG1 GSTP1 CX3CL1 DKK1 NHSL3 MYO1B NUP50 TXNDC11 XPO6 RETREG3 CFAP157 CFAP299
-4.3309083,6.1409893,Cluster 1,ENDOMEMBRANE SYSTEM,ZC3H3 SLC1A5 IFNE JUND MOSPD2 FSTL1 NSUN6 SEC16A JSRP1 SCRN2 ASIC4 COPZ1 CRYL1 NANP PDE8A QSOX2 RPUSD1 SCLY TATDN3 EPB41 WDTC1 MRPS14 TEDC1 CSGALNACT2 CADM4 MGST1 NAV3 PDE4DIP IKBIP MIB1 PPP2R5C PDXDC1 MRPL55 CDS2 LTBR ZNF569 KDM6A APBA2 PRKAG2 SUN2 NCKAP5L TMEM109 SLC30A7 TMPO UCKL1 ZMYND8 QPCTL TRRAP ARFGEF1 FRMD5 ZNF875 RAB1B PNPLA8 PTPRF AKAP9 SYNC TNRC18 SIX2 SEC61A1 CPQ PRDM2 HECW2 ACCS GINS4 EPN2 ZNF354C ERLIN2 BRDT GALNT2 SEMA4D EVI2B SHOX2 TJAP1 ANKRD37 ARFRP1 PEX6 SRRM5 TMEM214 WDR77 RBFOX1 LAMA4 SCAI BCAP31 LRIG1 XPO1 NUP153 SH3D19 IL18BP SMYD4 JAKMIP2 SMPDL3B USP32 TRAPPC11 SLC38A10 GNPTG ARFGEF2 CDK13 NUP133 TOM1L2 TSPO MANSC1 DGKH INA TSPAN9 ZNF106 RAB20 CORO6 ARL3 SPINK4 FMNL2 SORT1 HOXB6 ZNF329 MPPE1 OAZ2 PDIA4 PRTFDC1 ADAT1 PRKAR2A OCEL1 DIAPH2 SFTPA2 CCNJ CHST12 VTI1B CES1 EHF PWP1 SF3B4 PRDX4 FAM3C SLC35A5 TNKS TOPBP1 FXYD5 WWC1 KCTD17 ALX1 EI24 SLC18B1 SLX9 LMNB1 SDE2 GCC1 KIF3B ARCN1 AKTIP ZDHHC9 RAB29 CD68 GORASP2 INPPL1 RPL12 STARD9 AK9 LCK HFE ING5 ZNF622 OSBP CIAO1 TAF11 MRPL17 SCPEP1 THEMIS2 SGPL1 KRT2 ATP2B3 TRPM2 KTN1 CEP131 SLC6A17 TXNDC15 VAMP4 ARHGAP15 EAPP GBP5 COL16A1 GCC2 LARP7 LPCAT1 ZNF25 ANKRD40 GALK1 FURIN B4GALT1 PIDD1 SLC35B3 RCC1 MARF1 DGAT1 STX12 ADAMTS20 CBX4 PRR11 NUP62 FKBP7 ZNF148 MANEA ERLIN1 DNAJC2 ZNF529 TMEM115 FKBP14 IL6ST RCN1 TANGO6 ESD FAM20B ZNF18 BST2 DNAJC5 PSMD6 CREB3L4 KLHL20 TMEM87B UBAP1 ZNF326 CYB5D1 FAM219B FEZ2 KCTD15 NUFIP2 SLC43A1 ZC3HC1 RRAGB SIX5 KIAA0930 ANAPC10 PGRMC2 THAP7 POM121C SLC16A3 GCNT3 MAPKAPK3 ARFIP1 KAT6A COG4 DMKN GGA2 QSOX1 CD44 FAM210A CDC6 SNAPIN ZNF140 LPCAT2 DNAJC1 ASH1L LCORL PARP10 ZDHHC3 HSPB8 ARFIP2 SGSM3 TMF1 UNC45A KPNB1 TPD52 PUF60 CALML4 EPGN MAX TMEM97 LAMTOR1 RBMX2 ZRANB3 CARNMT1 CLCC1 FRMD4A TNRC6A KCNF1 BEND3 APMAP GORAB TBC1D23 ARMCX3 DHX37 LCOR FZR1 HSPA6 ADPRH HSD17B13 KCNJ8 CDKL3 KLK6 SART1 TNNT1 OSBPL11 FAM219A NUP155 PEX5 RINT1 SELENOS PPP1R9B GSKIP FAM174A ZMPSTE24 SLMAP VAPA CCDC146 WDR3 SLC19A1 APEH CYB5D2 ZNF521 ZNF629 EMD CD74 TAF7 MED8 CCDC110 RRBP1 CERS2 GLB1 KLF7 IER3IP1 H1-0 SCAMP4 TERF2 LRPAP1 ZNF124 BEGAIN ANKRD45 ARAP1 GOLGB1 MX1 PRUNE2 SNCB CWF19L1 SDF4 GOLGA2 LRRC8C MCM3AP YIPF4 TET1 ZCCHC4 XPA MOK IFT74 PKN1 CST3 MYCBP2 POLR1D AHCTF1 PSMB3 ZBED5 CERT1 RNPEP CCDC170 RECQL5 NDUFB4 SYAP1 LIFR APP LRRC27 ZFPL1 ANXA5 IL33 ASB7 ASCC3 CRAT RUVBL1 CASC3 WDR41 IGF2R OSBPL9 AMPD3 CGNL1 UBN2 EEF2 HPS3 RANBP17 CYB5R3 FADD CMTM4 MANF CBX1 CDIPT PLAGL1 SEC14L5 MICAL2 TBX18 GOLM1 E2F3 FAM135B PPHLN1 CMSS1 CCAR1 SEMA3C ZBTB4 SLC6A9 NPY SMIM7 SAMD12 FAM199X AJUBA FANCL IL17RD AP3B2 RAB6A RHBDD2 NCKAP5 GOPC NTAN1 DTNB RNF214 HOOK3 CEP70 MFSD10 DTX3 AP3B1 ARL2 ELOVL5 STAC3 PDGFRL ZNF527 POTEJ PRKAR2B SREBF1 EIF2B4 CCDC77 NETO2 POTEI SLC35F3 DNM2 GORASP1 HID1 KRTAP25-1 STK39 FAM234B CRACD ACBD3 KCNQ2 DENND4C MXRA7 HYI SLC36A4 ATP6V0A1 MESD FDFT1 TRIB3 CEP170 DERL2 GPR156 PTGES2 ANKRD26 TRIT1 CLEC2D MAML2 ANXA1 P4HA2 FABP3 IPO5 PPM1M RAB27B HMOX1 VWA5B2 NR4A1 SLC16A14 SP3 CYB5R2 TNKS1BP1 TRAPPC9 BRIP1 ITGA3 GLG1 ZBTB1 SPTBN1 AK8 AXIN2 ZNF749 TP73 KRT7 YBX1 GLYATL1 PISD RIN1 DNAH14 SLC35E1 NEO1 KAZN COMTD1 SPATA31F1 R3HDM2 STC2 TTC33 POTEE UFL1 SCYL3 PRICKLE2 GPALPP1 ZMYM2 ZNF213 CCDC182 DERL1 STX10 MPZL3 KDM3B RXYLT1 MAN1A2 UBAC1 SCAMP2 RNF157 ATP7A INTS11 PFKM PDIA6 FBXW4 MKRN1 TGFB3 TMEM87A SHLD1 FLNB FBXL8 PCM1 MAN2A1 ZMYND19 RPRD1A HSD17B10 CKAP2L PALB2 RCN3 SCD PSMB6 LMX1A ARFGAP1 IGFBP7 DAO PCNX2 MMP1 NAPRT ITGB1 PLEKHH3 ZSCAN21 TIPIN EYS STX5 TMX4 CCN2 SYNJ2 BICD2 SCN3B RTN3 BROX ARHGAP10 MFSD13A CDC123 BMPR1B TRMT10B STX3 RAP1GAP2 NUCB1 B4GALT3 STX8 USP8 MRPS15 MFAP3 ARMCX6 TFPT PROSER3 EDN1 FUT11 AMIGO2 SLC2A13 CRYZ TET2 RIMBP2 PDIA3 REXO5 TMEM154 SLC35C1 RFC2 RCAN2 GDAP2 POLK LRIG2 ECT2 RGS10 ACSL4 COL25A1 JAM3 PCMTD1 RIN2 GFRA1 DCBLD2 KIF3C ZBTB41 SLC39A10 ALKBH5 FBN1 NUCB2 ZNF287 TOR1AIP2 NOMO1 SPTLC1 NXN MAB21L4 FAM174C GPR108 BCO2 KCTD20 STARD13 TP53I11 PRNP USO1 SLITRK5 CHST11 SMAP1 BNIP2 MINAR1 TMEM184B STIM1 ARL2BP NKRF SUN3 TCP1 ZNF292 TFAP2A CYP51A1 BTBD8 TMEM104 MRPS23 DLC1 AIG1 MAN1A1 CARD19 SYNGR2 CALU VAPB TMED10 WDR44 USP7 VPS28 LBR ZNF407 CTNND2 NBAS TCHHL1 HDAC5 FASN CPA2 RPN2 LRRC28 METRN ANGPTL8 MAP4K2 YIPF2 FUT10 ABCA7 SSR1 GOLPH3 ITIH2 USP53 GAPDH ABCD1 PTDSS1 ARHGAP9 SOAT1 TMCO1 DEPDC1B LACTB2 MYO18A STT3B RAMP1 TMEM53 CISD2 JPH4 INF2 JAG1 VRK2 UBXN4 OGFRL1 PODXL2 ADCY6 TMEM181 GPC6 TBC1D22A TGOLN2 COPA RASGRF1 RPN1 NEK1 SUMO1 PDZK1 INTS14 HSP90B1 ARSA ITM2B CCNB2 GPR183 RETREG3 CEP85 SERINC5 CD47 TMEM201 YIF1A DDOST DVL2 SLC39A14 PDZD8 COPB1 ARFGAP2 CCDC186 CANX PTGR3 DNAJB12 CNKSR1 TBC1D22B PNCK LOC107987479 VPS54 BLTP3A KLF5 FUT8 MRTO4 SDCBP KIAA1586 BEND6 GALNT6 GPSM1 NAA25 NSUN3 GLCCI1 RNF6 TENT4A ERI2 RIOK3 ZNF75D DNAJB9 FMNL3 GRAMD2B ITFG2 RANGAP1 TMEM165 SIPA1L3 SPTB PRKCD MAP2K3 CUL5 TMEM25 ZC3HAV1 ESCO2 COL18A1 BHLHE40 TRIM68 DPP7 ANKRD49 CYREN LRRC63 MED13L CSK TRIM69 BSDC1 SERPINH1 FAM89A GANAB GLYR1 TMX1 AP1AR RASGEF1A ZNF32 TECR RNF5 ZNF496 GRHL1 TBC1D19 TRAF3IP2 GTPBP4 LEMD2 APOB ABCC8 CLPTM1L PLCB3 GOLGA1 SAMD15 MEST DNAJC3 CCNI RNF125 ARPC2 OTUD6B CNKSR3 TMEM205 EVA1C AKT3 CEP83 PROS1 CD99L2 GOLIM4 DHCR7 CDC25A LAMC1 RPS6KB1 SMYD3 SYNE2 COG6 ZSCAN22 EPCAM CCDC69 TOR1A EXOC7 RIPOR1 RNF121 XRN1 CGN EVI5 HAND1 PHACTR2 CPVL POLR3GL B2M DENND4B OLIG2 SH3BP5L TOR1AIP1 DNAJC28 PPP1R15B COG7 NUP35 PTPN1 FNDC3A AAAS SEC62 SEC61B THAP2 NMT2 CDC42BPA MYRF AFTPH P4HB SNUPN ARHGAP22 ASPH ADCY8 RFK ZNF367 TSHZ2 RBM20 ASTE1 BET1L DRAM2 OLIG3 MSH6 FAM8A1 ING3 CEP112 JHY PRKCSH SERTAD1 ZNF526 KASH5 PRPF38A MARK3 TIAM2 SPRY4 TMEM192 CCDC34 MSTO1 ZDHHC13 BPNT2 MPDU1 KIAA1549 FNDC3B WWOX ATP2A1 C1QA CCDC68 CSKMT PCSK7 SYVN1 KDF1 DNAJB11 NLRP10 BAZ1A DNAJB2 SPNS1 IRX1 TLR5 EBAG9 KAT8 GCH1 APAF1 CCDC25 IL13RA1 PTPRA TBC1D5 ARL6IP5 USF1 MBD1 FANCD2 CWC22 PUM2 FAR2 PLEKHA3 VAMP7 TCTN2 LRRC59 CYB5B GPATCH1 THOC3 OSBPL10 MDGA1 FAM20C SLC16A2 CRACR2A CNKSR2 COPE YIPF3 PPM1D RER1 SDC4 SNCG GOLGA3 ATP2C1 TMEM175 WWP1 LAX1 ZBTB5 FAM169A DYM GOLGA4 PDIA5 GPR107 GGCT SLC30A5 PI4KB GOLGA8B ZC3H12C ABHD18 CDK5RAP3 CCDC71 RC3H1 SLC35A2 SLC30A6 GOLM2 LRBA P4HA1 ADAT2 DEPDC5 CCDC47 GNG2 TPR EPHA3 EPS8 ARL6IP6 PHF20 ZNF487 ABCG1 MASP2 MPZ RFX7 MOGAT2 RRAGA CPEB4 ATP8B2 RABAC1 CD99 CSDE1 PDLIM5 SIK2 GAK ARTN TSPAN3 CYP2S1 IL18 PROCA1 RTN4 HDAC3 WDR45B ARHGEF11 ZDHHC7 MDFIC NYAP1 PREB STX6 GBA2 KLF17 GRK5 MPLKIP CCDC91 RCC2 MINDY3 PGRMC1 TIMP1 SREK1IP1 STPG1 POTEF TRIP11 MTDH SCAND3 NSDHL NUP50 DKK1 SCO2 COG5 ADI1 CAV1 EBPL
9.631894,20.308952,Cluster 2,SUPRAMOLECULAR FIBER,TAX1BP3 HAVCR2 SH3BP2 ARHGAP39 FLNA CCDC121 PMS2 AMIGO3 SMU1 TATDN3 CLNS1A CDC7 GKN1 ACTN2 CFAP54 NDUFAF6 CENPB EMC1 GFM1 FAM216A TEKT2 HOXC8 NAP1L1 LRRC14 SEPTIN12 MPRIP OTUD7B TAGLN2 ZNF654 RABIF FSD1L KANSL1 EIF4A2 SEPTIN7 TCERG1 NEK8 PGAP2 USP44 DPY19L3 AIDA CCDC40 DENND2B P2RX4 PLCD1 FAM91A1 PDLIM4 CWC27 PPDPF IFT43 MYH10 WASHC3 LUZP1 ZNF81 MUC16 WBP1L PSMA3 MRPS10 TEKT5 ASRGL1 DST YWHAG ZNF185 WDR47 TMEM116 RNF25 TARS1 TOPBP1 AGA TCTN1 SUSD1 KCTD17 CLK4 TTBK2 KANSL2 SCLT1 GPR137 DDX59 ONECUT2 TNNI3 ZNF397 GPATCH11 KIF19 FHL2 DEPDC4 SPAG1 BICDL2 ZNF768 CTDP1 PHC3 CEP131 NUDCD2 ZBTB18 OCRL VPS45 BCO1 CEP120 CWC25 NPFFR2 ADAMTS20 ZNF148 ICE1 AVEN GTF2F2 TMEM115 ABCB4 SQLE SPRYD3 SCNN1D ACTN4 N4BP1 DUSP6 POU6F1 DRC9 ALKBH2 SLC29A4 POLR1F SEPTIN9 CCDC117 DDC SHMT2 TBC1D9B SLC16A3 GSN BRINP1 ERP29 BZW2 STRN ZNF83 ACACA MAPDA ADAM23 RGMA NPRL2 CARNMT1 TRIM71 NEGR1 MFSD6 CDC42EP4 EXOC1 TBCA KLK6 ZNF44 ZNF268 TRAPPC8 TNKS2 FNDC7 SSH3 IQCB1 MARCHF7 SDHAF3 STK32B PALLD TMEM186 ZBTB49 RBM39 C1RL H1-0 ID2 PTAR1 CROCC TOX4 DBN1 IFT22 SYNPO FRYL KLC3 PSTK ARHGEF28 PDLIM7 CFAP119 SVIL DDX10 WDR93 MAPK3 CELF2 ZNF846 PSMB3 LRIF1 TIPARP F11R CYP20A1 LRCH1 LHFPL2 NT5C3B CENPE TMT1B GIGYF1 GANC PRC1 SHLD2 FRMD1 KNTC1 EFNB1 SRRM3 ANAPC7 WAPL STAG2 KCNK6 RPL6 ENTPD1 FANCL ERAL1 NTAN1 TIMM17B HMMR SHCBP1 ZC4H2 MRPL18 TMOD3 LSM6 IRAK4 STRN3 TACC1 ACTN1 NAE1 CRY1 EIF2B4 WWC3 RAPGEFL1 MSRA PARVA NCAPG IL17RC RELL1 MRPL34 ZNF174 DHX57 KATNB1 DCXR MEGF6 MAP7 LRRC34 TNFRSF12A HELZ MCM7 SCAF1 MAP3K10 EMC3 AXIN2 ATP6V1H WDR11 RNF141 ERBB3 NFE2 PLAT DHRSX ACSF2 FCHSD2 CEP57 SCYL3 SEPTIN5 SLC38A6 TMEM138 PRKRIP1 PDE12 RARA NUAK1 SYTL5 ORC4 CKAP2 EXD3 SPRY2 MAP4 NME8 CNN2 CRACDL RFNG TAF1A FLNB DOCK9 MYH9 DENND5B DGLUCY TMEM200C ZBED1 DFFA MAD1L1 FABP2 CCDC167 SEPTIN2 TMEFF2 RORA NFATC2 PTPN11 SYNJ2 ELMO1 PRSS12 IGFN1 CHMP5 PIAS1 PSMD9 YOD1 KIF2B ARL6 FBXO30 GIT2 NUCB1 STX8 PSMD1 KARS1 SEPTIN3 AKT1 NAA60 TIGD6 GPATCH3 KLHL23 KLK10 MPZL1 GPATCH2 DIAPH3 RAI14 UBE2K CGREF1 PGM3 DNAJA1 B4GALNT4 PODXL RASEF BCO2 SRPX2 INTS6 NCOA5 DLK1 ZBTB8A IFRD2 POLR2C VPS28 SLC46A3 CENPQ NUDT6 BUD31 SIGLEC10 LPIN2 CDC42 TCTN3 IFT46 TMTC2 LRRFIP2 UQCC1 TAF5 WDR35 NDRG1 ANKRD23 ID3 PSMD12 ATP6AP1 HAS3 MAP7D3 CNFN PGM1 PCIF1 ZNF74 SEPTIN10 ALG2 IGF2 SMTN SZT2 ENOX2 MAPK1 IDO1 CDC42EP1 EML4 TMEM17 JTB APBB3 GYS1 S100A14 CNN3 IGBP1 RPL22L1 GPX8 CDC42EP2 LMO7 WWC2 MAP2K5 TMTC3 CSGALNACT1 SKA1 ARAP2 DHDH TRUB1 TRNAU1AP ANKRD24 TMEM25 PPP1R12B SSBP4 KNSTRN GLIPR2 DECR2 CISH SLC25A48 FAM53A SPTAN1 PIK3R4 APOB COLEC11 ACVR2B LZTS1 NMT1 VSTM2L MRRF ZSCAN22 ESRRA CCDC69 RHBDD3 TAS2R42 SLC16A1 MTMR4 ZC3H4 RETREG2 TOR1AIP1 KIF18A ZDHHC18 BFSP1 PAWR ZCCHC3 ALKBH8 CNNM4 LYSMD4 PRKCI SIPA1L1 ZNF263 RPUSD2 DTNBP1 F13A1 SLC24A1 AFAP1 PRAMEF12 TTLL9 TSPAN12 CRTAP ARL13B PAIP2B LAD1 ESAM NOTCH3 CAMTA2 NIBAN2 FGD4 LARP6 TIMELESS RFLNB MICALL2 CALD1 CDK16 OFD1 DZIP1L KIAA1671 LIMA1 MCRS1 ZFP62 ACVR1C AMDHD1 ENSA RTN4R HNRNPU IFT20 TLE1 ZNF415 TMEM45A CYP4F2 MYSM1 TSPAN33 ARHGAP33 PRMT9 CTPS1 CCDC57 CRYBG1 LDLRAP1 XKR4 ANKRD10 LANCL1 KIFAP3 ANO7 SP4 TRPC7 XIRP1 PDLIM5 PPP1R12A PACS1 ZC2HC1A NPM3 NUTF2 DGCR8 STX6 KIF26B SNAP25 ZNF347 MARCKSL1 COL11A1 SHANK1 ZSCAN12 DYNC1I2 FMO3 FTH1
10.343273,20.538927,Cluster 2,ACTIN FILAMENT,TAX1BP3 HAVCR2 RGMA SH3BP2 MYH9 FLNA CARNMT1 CCDC121 APOB ZBED1 AMIGO3 DFFA TATDN3 TRIM71 MAD1L1 NEGR1 MFSD6 NDUFAF6 ACTN2 CDC42EP4 FABP2 CCDC167 SEPTIN2 CENPB NFATC2 PTPN11 FAM216A NMT1 TEKT2 VSTM2L ZNF268 LRRC14 PRSS12 MPRIP FNDC7 TAGLN2 SSH3 ZSCAN22 FSD1L PSMD9 KANSL1 MARCHF7 YOD1 CCDC69 TAS2R42 SEPTIN7 PALLD TCERG1 STX8 PSMD1 SEPTIN3 TMEM186 H1-0 NAA60 TIGD6 ZC3H4 CROCC GPATCH3 KLHL23 TOX4 DBN1 GPATCH2 BFSP1 DENND2B P2RX4 SYNPO KLC3 PSTK PAWR PDLIM7 RAI14 PDLIM4 UBE2K ZCCHC3 CFAP119 SVIL DDX10 MYH10 WASHC3 WDR93 LUZP1 MUC16 PODXL ZNF846 PSMB3 LRIF1 CNNM4 BCO2 LYSMD4 SIPA1L1 CYP20A1 LRCH1 LHFPL2 NT5C3B F13A1 MRPS10 TEKT5 GANC AFAP1 PRAMEF12 SHLD2 FRMD1 INTS6 NCOA5 KNTC1 ZBTB8A YWHAG CRTAP ZNF185 ANAPC7 IFRD2 WDR47 STAG2 VPS28 PAIP2B SLC46A3 LAD1 CENPQ RNF25 NOTCH3 TARS1 KCNK6 TOPBP1 SIGLEC10 TCTN1 CAMTA2 KCTD17 NIBAN2 CLK4 FGD4 LPIN2 KANSL2 ERAL1 RFLNB GPR137 IFT46 NTAN1 DDX59 MICALL2 TMTC2 ONECUT2 TNNI3 TMOD3 CALD1 LSM6 LRRFIP2 UQCC1 LIMA1 MCRS1 TAF5 STRN3 ZFP62 ACTN1 AMDHD1 ANKRD23 GPATCH11 KIF19 WDR35 FHL2 MAP7D3 PGM1 EIF2B4 RTN4R WWC3 ZNF74 HNRNPU MSRA SEPTIN10 TLE1 BICDL2 PARVA ZNF768 NCAPG CTDP1 PHC3 ALG2 SMTN MRPL34 SZT2 ENOX2 ZNF174 CDC42EP1 BCO1 CWC25 ARHGAP33 NPFFR2 TMEM17 JTB APBB3 HELZ ICE1 CTPS1 AVEN ABCB4 SPRYD3 MAP3K10 CNN3 SCNN1D ACTN4 ATP6V1H GPX8 ANO7 LMO7 POU6F1 TRPC7 XIRP1 DRC9 ERBB3 NFE2 PDLIM5 PLAT DHRSX CSGALNACT1 SEPTIN9 PPP1R12A DDC FCHSD2 ARAP2 SEPTIN5 DHDH TRUB1 ZC2HC1A NPM3 PRKRIP1 TRNAU1AP TBC1D9B STX6 SNAP25 PDE12 SLC16A3 RARA GSN MARCKSL1 PPP1R12B SSBP4 ORC4 EXD3 SHANK1 BZW2 STRN SLC25A48 CNN2 FAM53A ACACA FMO3 FLNB
10.002227,20.713335,Cluster 2,SUPRAMOLECULAR POLYMER,TAX1BP3 HAVCR2 SH3BP2 ARHGAP39 FLNA CCDC121 PMS2 AMIGO3 SMU1 TATDN3 CLNS1A CDC7 GKN1 ACTN2 CFAP54 NDUFAF6 CENPB EMC1 GFM1 FAM216A TEKT2 HOXC8 NAP1L1 LRRC14 SEPTIN12 MPRIP OTUD7B TAGLN2 ZNF654 RABIF FSD1L KANSL1 EIF4A2 SEPTIN7 TCERG1 NEK8 PGAP2 USP44 DPY19L3 AIDA CCDC40 DENND2B P2RX4 PLCD1 FAM91A1 PDLIM4 CWC27 PPDPF IFT43 MYH10 WASHC3 LUZP1 ZNF81 MUC16 WBP1L PSMA3 MRPS10 TEKT5 ASRGL1 DST YWHAG ZNF185 WDR47 TMEM116 RNF25 TARS1 TOPBP1 AGA TCTN1 SUSD1 KCTD17 CLK4 TTBK2 KANSL2 SCLT1 GPR137 DDX59 ONECUT2 TNNI3 ZNF397 GPATCH11 KIF19 FHL2 DEPDC4 SPAG1 BICDL2 ZNF768 CTDP1 PHC3 CEP131 NUDCD2 ZBTB18 OCRL VPS45 BCO1 CEP120 CWC25 NPFFR2 ADAMTS20 ZNF148 ICE1 AVEN GTF2F2 TMEM115 ABCB4 SQLE SPRYD3 SCNN1D ACTN4 N4BP1 DUSP6 POU6F1 DRC9 ALKBH2 SLC29A4 POLR1F SEPTIN9 CCDC117 DDC SHMT2 TBC1D9B SLC16A3 GSN BRINP1 ERP29 BZW2 STRN ZNF83 ACACA MAPDA ADAM23 RGMA NPRL2 CARNMT1 TRIM71 NEGR1 MFSD6 CDC42EP4 EXOC1 TBCA KLK6 ZNF44 ZNF268 TRAPPC8 TNKS2 FNDC7 SSH3 IQCB1 MARCHF7 SDHAF3 STK32B PALLD TMEM186 ZBTB49 RBM39 C1RL H1-0 ID2 PTAR1 CROCC TOX4 DBN1 IFT22 SYNPO FRYL KLC3 PSTK ARHGEF28 PDLIM7 CFAP119 SVIL DDX10 WDR93 MAPK3 CELF2 ZNF846 PSMB3 LRIF1 TIPARP F11R CYP20A1 LRCH1 LHFPL2 NT5C3B CENPE TMT1B GIGYF1 GANC PRC1 SHLD2 FRMD1 KNTC1 EFNB1 SRRM3 ANAPC7 WAPL STAG2 KCNK6 RPL6 ENTPD1 FANCL ERAL1 NTAN1 TIMM17B HMMR SHCBP1 ZC4H2 MRPL18 TMOD3 LSM6 IRAK4 STRN3 TACC1 ACTN1 NAE1 CRY1 EIF2B4 WWC3 RAPGEFL1 MSRA PARVA NCAPG IL17RC RELL1 MRPL34 ZNF174 DHX57 KATNB1 DCXR MEGF6 MAP7 LRRC34 TNFRSF12A HELZ MCM7 SCAF1 MAP3K10 EMC3 AXIN2 ATP6V1H WDR11 RNF141 ERBB3 NFE2 PLAT DHRSX ACSF2 FCHSD2 CEP57 SCYL3 SEPTIN5 SLC38A6 TMEM138 PRKRIP1 PDE12 RARA NUAK1 SYTL5 ORC4 CKAP2 EXD3 SPRY2 MAP4 NME8 CNN2 CRACDL RFNG TAF1A FLNB DOCK9 MYH9 DENND5B DGLUCY TMEM200C ZBED1 DFFA MAD1L1 FABP2 CCDC167 SEPTIN2 TMEFF2 RORA NFATC2 PTPN11 SYNJ2 ELMO1 PRSS12 IGFN1 CHMP5 PIAS1 PSMD9 YOD1 KIF2B ARL6 FBXO30 GIT2 NUCB1 STX8 PSMD1 KARS1 SEPTIN3 AKT1 NAA60 TIGD6 GPATCH3 KLHL23 KLK10 MPZL1 GPATCH2 DIAPH3 RAI14 UBE2K CGREF1 PGM3 DNAJA1 B4GALNT4 PODXL RASEF BCO2 SRPX2 INTS6 NCOA5 DLK1 ZBTB8A IFRD2 POLR2C VPS28 SLC46A3 CENPQ NUDT6 BUD31 SIGLEC10 LPIN2 CDC42 TCTN3 IFT46 TMTC2 LRRFIP2 UQCC1 TAF5 WDR35 NDRG1 ANKRD23 ID3 PSMD12 ATP6AP1 HAS3 MAP7D3 CNFN PGM1 PCIF1 ZNF74 SEPTIN10 ALG2 IGF2 SMTN SZT2 ENOX2 MAPK1 IDO1 CDC42EP1 EML4 TMEM17 JTB APBB3 GYS1 S100A14 CNN3 IGBP1 RPL22L1 GPX8 CDC42EP2 LMO7 WWC2 MAP2K5 TMTC3 CSGALNACT1 SKA1 ARAP2 DHDH TRUB1 TRNAU1AP ANKRD24 TMEM25 PPP1R12B SSBP4 KNSTRN GLIPR2 DECR2 CISH SLC25A48 FAM53A SPTAN1 PIK3R4 APOB COLEC11 ACVR2B LZTS1 NMT1 VSTM2L MRRF ZSCAN22 ESRRA CCDC69 RHBDD3 TAS2R42 SLC16A1 MTMR4 ZC3H4 RETREG2 TOR1AIP1 KIF18A ZDHHC18 BFSP1 PAWR ZCCHC3 ALKBH8 CNNM4 LYSMD4 PRKCI SIPA1L1 ZNF263 RPUSD2 DTNBP1 F13A1 SLC24A1 AFAP1 PRAMEF12 TTLL9 TSPAN12 CRTAP ARL13B PAIP2B LAD1 ESAM NOTCH3 CAMTA2 NIBAN2 FGD4 LARP6 TIMELESS RFLNB MICALL2 CALD1 CDK16 OFD1 DZIP1L KIAA1671 LIMA1 MCRS1 ZFP62 ACVR1C AMDHD1 ENSA RTN4R HNRNPU IFT20 TLE1 ZNF415 TMEM45A CYP4F2 MYSM1 TSPAN33 ARHGAP33 PRMT9 CTPS1 CCDC57 CRYBG1 LDLRAP1 XKR4 ANKRD10 LANCL1 KIFAP3 ANO7 SP4 TRPC7 XIRP1 PDLIM5 PPP1R12A PACS1 ZC2HC1A NPM3 NUTF2 DGCR8 STX6 KIF26B SNAP25 ZNF347 MARCKSL1 COL11A1 SHANK1 ZSCAN12 DYNC1I2 FMO3 FTH1
9.367279,20.695463,Cluster 2,MICROTUBULE,DOCK9 PIK3R4 ARHGAP39 DENND5B DGLUCY NPRL2 PMS2 TMEM200C COLEC11 SMU1 CLNS1A ACVR2B CDC7 GKN1 CFAP54 CDC42EP4 EXOC1 TBCA TMEFF2 RORA KLK6 EMC1 GFM1 SYNJ2 LZTS1 TEKT2 ELMO1 HOXC8 ZNF44 NAP1L1 TNKS2 SEPTIN12 TRAPPC8 IGFN1 OTUD7B MRRF CHMP5 ZNF654 RABIF PIAS1 IQCB1 ESRRA SDHAF3 EIF4A2 KIF2B RHBDD3 ARL6 STK32B SEPTIN7 FBXO30 GIT2 NUCB1 TMEM186 KARS1 NEK8 PGAP2 RBM39 SLC16A1 USP44 AKT1 C1RL ID2 DPY19L3 AIDA MTMR4 PTAR1 RETREG2 TOR1AIP1 KIF18A KLK10 ZDHHC18 MPZL1 DIAPH3 CCDC40 IFT22 FRYL PLCD1 FAM91A1 ARHGEF28 ALKBH8 CGREF1 CWC27 PGM3 PPDPF DNAJA1 IFT43 ZNF81 MAPK3 B4GALNT4 CELF2 RASEF TIPARP WBP1L PRKCI ZNF263 F11R PSMA3 RPUSD2 CENPE DTNBP1 TMT1B SLC24A1 GIGYF1 SRPX2 PRC1 ASRGL1 TTLL9 DST DLK1 EFNB1 SRRM3 TSPAN12 WAPL ARL13B POLR2C TMEM116 ESAM RPL6 NUDT6 AGA BUD31 ENTPD1 SUSD1 FANCL SPTAN1 TTBK2 CDC42 KANSL2 LARP6 SCLT1 TCTN3 TIMELESS TIMM17B HMMR SHCBP1 ZC4H2 MRPL18 CDK16 OFD1 DZIP1L KIAA1671 IRAK4 TACC1 ACVR1C CRY1 ENSA ID3 NAE1 NDRG1 ZNF397 PSMD12 ATP6AP1 HAS3 CNFN DEPDC4 PCIF1 RAPGEFL1 SPAG1 IFT20 SEPTIN10 ZNF415 IL17RC CEP131 RELL1 IGF2 TMEM45A MAPK1 NUDCD2 CYP4F2 IDO1 DHX57 ZBTB18 OCRL VPS45 MYSM1 CEP120 KATNB1 TSPAN33 DCXR ADAMTS20 EML4 MEGF6 MAP7 ZNF148 PRMT9 LRRC34 TNFRSF12A GYS1 MCM7 SCAF1 ZBTB49 CCDC57 GTF2F2 TMEM115 CRYBG1 LDLRAP1 S100A14 SQLE IGBP1 XKR4 EMC3 AXIN2 ANKRD10 LANCL1 KIFAP3 RPL22L1 N4BP1 DUSP6 CDC42EP2 SP4 WDR11 WWC2 MAP2K5 TMTC3 RNF141 ALKBH2 SLC29A4 POLR1F SKA1 ACSF2 CCDC117 SHMT2 CEP57 PACS1 SCYL3 SLC38A6 TMEM138 NUTF2 DGCR8 ZNF347 KIF26B ANKRD24 SLC16A3 TMEM25 NUAK1 BRINP1 ERP29 KNSTRN CKAP2 GLIPR2 SYTL5 SPRY2 COL11A1 ZSCAN12 DECR2 MAP4 CISH NME8 ZNF83 CRACDL RFNG TAF1A DYNC1I2 MAPDA ADAM23 FTH1
9.6165285,20.957582,Cluster 2,CONTRACTILE RING,TMEM117 ARHGAP39 PARP8 ZNF567 CDC7 NEK2 TMEFF2 RORA KLK6 CCDC66 EMC1 DVL3 AZIN2 MTCL1 IGFN1 RFXANK MRRF CHMP5 SCN3B RABIF KRR1 IQCB1 ESRRA LBX2 RSBN1 SLC16A1 COASY TMEM237 AIDA JADE1 CFAP53 ZNF302 DNAJC28 FRYL KMT2E LYRM1 GDPD3 XPA FAN1 B4GALNT4 CELF2 ZBED5 IQGAP1 PRKCI RAB11FIP3 METTL9 IL32 RBM20 TRIM45 PSMA3 PPL NPTN DTNBP1 TIRAP FIGNL1 ETS1 CTTNBP2 SRP14 PROM1 PAH SNRNP25 NOL9 RPL6 GNL3 PLEKHA4 RNF220 CDC42 DNAJC8 LARP6 SIN3A VLDLR DZIP1L MAPK8IP3 THOC1 FBXO38 CNFN PPP1R13L PCIF1 LACC1 UFSP2 NINL CEP131 ZBTB18 BCL3 THAP11 MEGF6 LRRC34 SCAF1 PGAP6 HMCN1 TDP2 KCTD1 CCSAP N4BP1 SP4 RBM18 KIAA1143 CYSRT1 CAMKV ERI2 SLC29A4 PTGFRN ADAMTS19 DESI2 CDCA8 ITFG2 BIRC5 QSOX1 MED9 CISH LINS1 LPIN3 ZNF83 CRACDL IST1
