x,y,cluster,term,genes
-3.6369312,4.8304367,Cluster 0,Clathrin-Sculpted Gamma-Aminobutyric Acid Transport Vesicle Membrane (GO:0061202),GAD1 GAD2 HSPA8 RAB3A SLC32A1 SYT1 VAMP2
-3.7538574,3.1323283,Cluster 0,Cytolytic Granule (GO:0044194),GNLY GZMB LAMP1 NKG7 RNF19B STXBP2 ZNF395
-3.7002354,3.0886555,Cluster 0,Primary Lysosome (GO:0005766),AZU1 DEFA4 GNS HEXA HEXB MPO OLFM4 SNAP23 STX3 STX7 STXBP2
-3.7415526,3.4862628,Cluster 0,FNIP-folliculin RagC/D GAP (GO:1990877),FNIP2 LAMTOR1 LAMTOR2 LAMTOR3 LAMTOR4 LAMTOR5 RRAGA RRAGC SLC38A9
-4.058566,3.1091533,Cluster 0,G Protein-Coupled Receptor Dimeric Complex (GO:0038037),GABBR1 GABBR2 GPR156 GRM1 RAMP2 RAMP3
-3.3447874,3.8188677,Cluster 0,GABA-A Receptor Complex (GO:1902711),GABRA2 GABRA3 GABRA4 GABRA5 GABRA6 GABRB1 GABRB2 GABRB3 GABRD GABRE GABRG1 GABRG2 GABRG3 GABRP GABRQ GABRR1 GABRR2 GABRR3
-4.02573,3.91871,Cluster 0,Cytoplasmic Side of Endosome Membrane (GO:0010009),LITAF LITAFD MICALL1 RAB21 RAB5A SNX5
-3.9945664,3.8415513,Cluster 0,Cytoplasmic Side of Lysosomal Membrane (GO:0098574),BLOC1S2 BORCS5 BORCS6 BORCS7 BORCS8 CDIP1 EEF1A1 EEF1A2 KXD1 LITAF LITAFD SNAPIN
-1.590874,2.7352662,Cluster 0,Cytoplasmic Vesicle Lumen (GO:0060205),ACTR1B ADM AGL AHSG ALAD ALDOC ALOX5 AMPD3 APAF1 APOA1 APRT ARHGAP45 ARHGAP9 ARPC5 ATG7 BACE1 BIN2 C1ORF35 C1QTNF1 C3 CAB39 CAND1 CCT8 CDA COMMD9 COTL1 CRISPLD2 CSNK2B CSTB CTSH CYFIP1 DBH DBNL DDX3X DEFA5 DERA DYNLT1 EEF1A1 EEF2 EPX FCN1 FGR GCG GDI2 GHDC GHRL GLYAT GMFG GNPDA1 GSN GSTP1 GYG1 GZMB HMGB1 HOOK3 HSP90AA1 HSP90AB1 HSPA6 HSPA8 HUWE1 IDH1 IMPDH1 IMPDH2 INS LOC112694756 MAPK14 MVP NFKB1 NME2 OSTF1 PAFAH1B2 PCSK1 PDXK PFKL PGAM4 PGM2 PIKFYVE PKM POMC PPIA PPIE PPY PRDX4 PSMA2 PSMA5 PSMB1 PSMB7 PSMC2 PSMC3 PSMD11 PSMD12 PSMD13 PSMD14 PSMD2 PSMD3 PSMD6 PSMD7 PYCARD PYGL ROCK1 S100A11 S100A12 S100A8 S100A9 S100P SCG3 SERPINA3 SERPINB1 SERPINI1 SRP14 TF UCMA VCL VCP XRCC5 XRCC6 ZNF395
-3.5781474,4.664446,Cluster 0,Dense Core Granule (GO:0031045),BAIAP3 CHGA CRHBP ECRG4 KIF1A MYRIP NPY PDYN SLC6A5 SLC6A9 SPX SYT1 SYT13 SYT2 SYT4 SYT5 SYT8 SYT9
-1.6151929,2.7715926,Cluster 0,Ficolin-1-Rich Granule Lumen (GO:1904813),ACLY ACTR10 ACTR1B ACTR2 AGL ALAD ALDOC ALOX5 AMPD3 ANKRD44 APAF1 APEH ARPC5 ASAH1 ATG7 BIN2 C1ORF35 CAB39 CALML5 CAND1 CANT1 CAPN1 CCT8 CDA CDK13 COMMD3 COMMD9 COTL1 CRISPLD2 CSNK2B CST3 CSTB CTSB CTSD CTSH CTSS CTSZ DBNL DDX3X DERA DYNLT1 EEF1A1 EEF2 FCN1 FGL2 FTH1 GLB1 GLYAT GMFG GNPDA1 GNS GSDMD GSN GSTP1 GUSB GYG1 HBB HMGB1 HOOK3 HSP90AA1 HSP90AB1 HSPA1A HSPA1B HSPA6 HSPA8 HUWE1 IDH1 ILF2 IMPDH1 IMPDH2 JUP KCMF1 KPNB1 KRT1 LOC112694756 LRG1 LTA4H MAPK1 MAPK14 MMP9 MNDA MVP NME2 OSTF1 PAFAH1B2 PDAP1 PFKL PGAM4 PGM1 PGM2 PIKFYVE PKM PLEKHO2 PLPPR3 PPIA PPIE PPY PRDX4 PSMA2 PSMA5 PSMB1 PSMB7 PSMC2 PSMC3 PSMD11 PSMD12 PSMD13 PSMD14 PSMD2 PSMD3 PSMD6 PSMD7 PYGL QPCT S100A9 SERPINA1 SRP14 TIMP2 TNFAIP6 VCL VCP XRCC6 YPEL5
-3.8087428,3.2830365,Cluster 0,Endocytic Vesicle Lumen (GO:0071682),APOB APOE CALR CSF3 CTSL DLC1 GNLY HBA1 HBB HGS HPX HSP90AA1 HSP90B1 HSPH1 HYOU1 LTF MPO PGLYRP1 SAA2 SCGB3A2 SPARC
-4.1238174,3.511297,Cluster 0,Nuclear Envelope Lumen (GO:0005641),APP CCAR1 PLAAT1 SORL1 TUBB
-3.5457325,4.350801,Cluster 0,Neuronal Dense Core Vesicle (GO:0098992),KIF1A NPY PDYN SYT4 VPS13A
-3.3486004,4.1619773,Cluster 0,Neuromuscular Junction (GO:0031594),CAV3 CDK5 CDK5R1 CHRNA1 CHRNB1 CHRND CHRNE CORIN CXADR DLG1 DNAJA3 F2R FCHSD1 FCHSD2 ITGB1 LLGL1 MPP2 MPP3 MUSK NLGN1 NRXN1 PDZRN3 RAPSN SERPINE2 SLC5A7 SLC8A3 SNTA1 SPOCK1 SYNC SYNGR1 SYNGR2 SYNGR3 SYNGR4 TBC1D24 TRIP4 UNC13A UNC13B UNC13C
-3.6298442,4.602865,Cluster 0,Exocytic Vesicle (GO:0070382),APP DPYSL3 IGF1 NKD2 PICALM RAB10 RAB27A RAB27B RAB6A SYT1 SYT10 SYT12 SYT13 SYT15 SYT15B SYT17 SYT2 SYT3 SYT4 SYT5 SYT6 SYT8 SYT9 SYTL1 SYTL2 SYTL3 SYTL4 SYTL5 UNC13D
-3.447214,3.4632342,Cluster 0,Lytic Vacuole (GO:0000323),ABCA5 ABCB9 ACD ACE ACP2 ACP4 ADA ADRB2 AGA AKR1B10 ANKRD27 ANKRD44 AP3M1 AP5M1 AP5S1 APP ARL8B ARSA ARSG ARSK ASAH1 ATP13A2 ATP6AP2 BACE1 BBC3 BCL10 C9ORF72 CALCRL CD164 CD1D CD34 CD68 CD74 CHID1 CHMP2B CLN3 CLN5 CLTA CLTC CPQ CST7 CTNS CTSA CTSB CTSC CTSD CTSF CTSG CTSH CTSK CTSL CTSO CTSS CTSV CTSW CTSZ CXCR4 DEPDC5 DRAM1 DRAM2 DTX3L EGFL7 ELAPOR1 EPDR1 EPG5 FLCN FUCA1 FUCA2 FYCO1 GAA GALC GBA1 GFAP GGA3 GLB1 GLMP GRIN2B GRN HCK HEXA HEXB HGS HLA-DOB HLA-DRA HPS1 HPS4 HPSE HYAL2 HYAL3 IDS IFI30 IRGQ ITM2C KCNE1 KCNE2 KCNQ1 KICS2 KLHL22 LAMP1 LAMP2 LAMTOR1 LAMTOR4 LAMTOR5 LAPTM4B LAPTM5 LARS1 LDLR LGMN LRP2 LRRK2 MAN2B1 MAN2B2 MAPKAP1 MARCHF1 MARCHF3 MARCHF8 MCOLN1 MFHAS1 MFSD1 MFSD12 MLC1 MPO MTOR MYO5A NAAA NAGLU NAPSA NAT8 NEU2 NEU3 NEU4 NPC1 NPC2 OCIAD1 OCIAD2 PCSK9 PCYOX1 PDE1C PIP4K2A PLA2G15 PLAAT1 PLAAT3 PLEKHF1 PLEKHM1 PPT1 PPT2 PRICKLE1 PRSS16 RAB12 RAB14 RAB27A RAB38 RAB7A RAB7B RAB9A RAB9B RAMP2 RAMP3 RB1CC1 RFFL RICTOR RNASET2 RNF152 RNF167 RPS6KC1 RPTOR RRAGA RRAGB RRAGC RRAGD SCARB1 SCGB1D1 SFTPA2 SFTPD SGSH SIDT1 SIDT2 SLC11A1 SLC11A2 SLC17A5 SLC2A13 SLC38A9 SMPD1 SNCA SNX1 SNX14 SNX2 SNX6 SORT1 SPAM1 SRC STS STX7 SYT12 SYT7 TIAL1 TINAG TINAGL1 TLR7 TLR9 TMEM106B TMEM175 TMEM192 TMEM25 TMEM59 TMEM9 TMEM97 TOM1L1 TPCN1 TPCN2 TRPM2 TRPV3 TSC2 TYR UBE2Z UNC13D UNC93B1 USP4 USP5 USP6 UVRAG VAMP4 VMA21 VOPP1 VPS11 VPS13C VPS16 VPS18 VPS26A VPS33A VPS33B VPS35 VPS41 VPS4A WDR45B ZFYVE26
-3.379922,3.3515284,Cluster 0,Lysosomal Lumen (GO:0043202),ACD AGRN ANKRD44 APOB ARSA ASAH1 ATP13A2 BCAN BGN CBLIF CD74 CHID1 CSF3 CSPG4 CSPG5 CTSA CTSB CTSD CTSF CTSK CTSL CTSS CTSV CUBN DCN EGFL7 FMOD FUCA1 GAA GALC GALNS GBA1 GC GLB1 GM2A GNS GPC1 GPC2 GPC3 GPC4 GPC5 GPC6 GUSB GYG1 HEXA HEXB HPSE HSP90AA1 HSPA8 HSPG2 IDS IDUA IFI30 KERA LAMP2 LGMN LUM MAN2B1 MAN2B2 MANBA NAAA NAGLU NAT8 NCAN NEU4 NPC2 OGN OMD PLD3 PPT1 PPT2 PRELP SCARB2 SCGB1D1 SDC1 SDC2 SDC3 SDC4 SERPINB13 SFTPA2 SGSH SMPD1 SPAM1 TCN2 TXNDC5 VCAN
-3.5087562,4.7380495,Cluster 0,Exocytic Vesicle Membrane (GO:0099501),ATP6V1G1 ATP6V1G2 ATP6V1G3 BORCS5 CLCN3 CLTA CLTB DTNBP1 DYSF FER1L5 GABRA2 ICA1 KIF1B MCTP1 MCTP2 MYOF OTOF PHAF1 PTPRN2 PTPRS RAB26 RAB3A RAB3B RAB5A RPH3A SEMA4C SLC17A6 SLC17A7 SLC17A8 SLC18A1 SLC18A2 SLC18B1 SLC32A1 SLC35D3 SLC35F1 SLC35G2 SLC5A7 STX10 STX12 STX6 SV2A SV2B SV2C SYN1 SYN2 SYN3 SYNDIG1 SYNGR1 SYNGR2 SYNGR3 SYNGR4 SYNPR SYP SYPL1 SYPL2 SYT1 SYT13 SYT2 SYT4 SYT5 SYT8 TMEM163 UNC13A UNC13B UNC13C VAMP1 VAMP2
-4.24455,4.139015,Cluster 0,Insulin-Responsive Compartment (GO:0032593),MYO5A RAB10 RAB13 RAB4A RAB4B SLC2A4
-0.6183867,2.883414,Cluster 0,Ficolin-1-Rich Granule Membrane (GO:0101003),ADGRE3 AP2A2 ARL8A ATAD3B ATP6AP2 ATP6V0A1 ATP6V0C CD300A CD55 CD58 CD93 CLEC4C CLEC4D COPB1 CR1 DIAPH1 DOK3 DSG1 DSPP DYNC1LI1 DYNLL1 ENPP4 FCAR FCER1G FPR1 FPR2 GAA ITGAX ITGB2 LAMP1 LAMP2 LAMTOR1 LGALS3 LILRA3 LILRB2 MGAM NBEAL2 NCKAP1L NFASC PKP1 PRCP PTPRN2 RCAN1 RHOA RNASE1 SERPINB10 SERPINB12 SERPINB6 SIGLEC14 SIGLEC5 SIRPA SLC11A1 SLC2A3 STBD1 TBC1D10C TCIRG1 TMEM179B TRPM2 UBR4 VPS35L
-3.9287288,3.4323726,Cluster 0,Endosome Lumen (GO:0031904),AP4E1 AP4M1 AP4S1 APOB APP B2M CD63 CSH1 CTSB CTSK CTSL CTSS GH1 GH2 IL12A IL12B INS JAK2 LGMN LNPEP PDLIM4 PRL PRLR RAB32 RAB38
-3.6554985,4.811682,Cluster 0,Clathrin-Sculpted Gamma-Aminobutyric Acid Transport Vesicle (GO:0061200),GAD1 GAD2 HSPA8 RAB3A SLC32A1 SYT1 VAMP2
-1.5144485,2.7400873,Cluster 0,Ficolin-1-Rich Granule (GO:0101002),ACLY ACTR10 ACTR1B ACTR2 ADAM8 ADGRE3 AGL ALAD ALDOC ALOX5 AMPD3 ANKRD44 AP2A2 APAF1 APEH ARL8A ARPC5 ASAH1 ATAD3B ATG7 ATP6AP2 ATP6V0A1 ATP6V0C BIN2 C1ORF35 CAB39 CALML5 CAND1 CANT1 CAPN1 CCT8 CD300A CD55 CD58 CD93 CDA CDK13 CLEC4C CLEC4D COMMD3 COMMD9 COPB1 COTL1 CR1 CRISPLD2 CSNK2B CST3 CSTB CTSB CTSD CTSH CTSS CTSZ DBNL DDX3X DERA DIAPH1 DOK3 DSG1 DSPP DYNC1LI1 DYNLL1 DYNLT1 EEF1A1 EEF2 ENPP4 FCAR FCER1G FCN1 FGL2 FPR1 FPR2 FTH1 GAA GLB1 GLYAT GMFG GNPDA1 GNS GSDMD GSN GSTP1 GUSB GYG1 HBB HMGB1 HOOK3 HSP90AA1 HSP90AB1 HSPA1A HSPA1B HSPA6 HSPA8 HUWE1 IDH1 ILF2 IMPDH1 IMPDH2 ITGAX ITGB2 JUP KCMF1 KPNB1 KRT1 LAMP1 LAMP2 LAMTOR1 LGALS3 LILRA3 LILRB2 LOC112694756 LRG1 LTA4H MAPK1 MAPK14 MGAM MMP9 MNDA MVP NBEAL2 NCKAP1L NFASC NME2 OSTF1 PAFAH1B2 PDAP1 PFKL PGAM4 PGM1 PGM2 PIKFYVE PKM PKP1 PLEKHO2 PLPPR3 PPIA PPIE PPY PRCP PRDX4 PSMA2 PSMA5 PSMB1 PSMB7 PSMC2 PSMC3 PSMD11 PSMD12 PSMD13 PSMD14 PSMD2 PSMD3 PSMD6 PSMD7 PTPRN2 PYGL QPCT RCAN1 RHOA RNASE1 S100A9 SERPINA1 SERPINB10 SERPINB12 SERPINB6 SIGLEC14 SIGLEC5 SIRPA SLC11A1 SLC2A3 SRP14 STBD1 TBC1D10C TCIRG1 TIMP2 TMEM179B TNFAIP6 TRPM2 UBR4 VCL VCP VPS35L XRCC6 YPEL5
-1.7060889,2.7347922,Cluster 0,Specific Granule Lumen (GO:0035580),AIFM2 AOC1 ARMC8 B2M BPI CANT1 CEP290 CFP CHAMP1 CHI3L1 CHIT1 CNN2 CRACR2A CRISP3 CTSD CTSZ CXCL1 CYFIP1 DEFA4 DLC1 DNASE1L1 DOCK2 EGFL7 ELANE ERP44 FOLR3 FRK GGH GHDC GSDMD HPSE ILF2 JUP KPNB1 LCN2 LRG1 LRRC7 LTF LYZ MMP8 NFKB1 NIT2 OLFM4 ORM1 ORM2 OSCAR PDXK PGLYRP1 PTPN6 PTX3 QPCT QSOX1 RAB27A RETN SLPI SPTAN1 TCN1 TIMP2 TINAGL1 TOLLIP VCL
-0.57352257,2.9470587,Cluster 0,Tertiary Granule Membrane (GO:0070821),ADAM8 ANO6 ATP11A ATP6AP2 ATP6V0C ATP8B4 CD177 CD300A CD33 CD47 CD53 CD59 CD93 CEACAM1 CEACAM8 CHRNB4 CLEC12A CLEC4C CLEC4D CLEC5A COPB1 CYBA CYBB CYSTM1 DYNLL1 FCAR FCER1G FPR2 FRMPD3 GAA GPR84 HGSNAT ITGAM ITGAX ITGB2 KCNAB2 LAIR1 LAMTOR2 LAMTOR3 LILRA3 LILRB2 MCEMP1 MGAM NBEAL2 NRAS OLR1 PLAU PRKCSH PTAFR PTPRB RAB14 RAP2B RAP2C SERPINB6 SIGLEC14 SIGLEC5 SIRPA SLC11A1 SLC2A3 SNAP23 SNAP25 STBD1 STOM SVIP TARM1 TMC6 TMEM63A TRPM2 TSPAN14 UBR4 VAMP1 VAMP8
-1.7124462,2.6094613,Cluster 0,Tertiary Granule Lumen (GO:1904724),ALDOC ARMC8 ASAH1 B2M CANT1 CDA CFP CHAMP1 CHIT1 CNN2 CRISP3 CST3 CSTB CTSD CTSH CTSS CXCL1 CYFIP1 DBNL DLC1 FLG2 FOLR3 FTH1 GGH GOLGA7 GSDMD HBB IDH1 ILF2 LOC112694756 LRG1 LTA4H LTF LYZ MMP8 MMP9 NIT2 OLFM4 ORM1 OSCAR PGLYRP1 PGM1 PPBP PRSS3 PTPN6 PTX3 QPCT QSOX1 SPTAN1 TCN1 TIMP2 TMT1A TNFAIP6 YPEL5
-0.43229145,2.7674422,Cluster 0,Tertiary Granule (GO:0070820),ADAM8 ADGRE3 AIFM2 ALDOC ANO6 AP2A2 ARL8A ARMC8 ASAH1 ATAD3B ATP11A ATP6AP2 ATP6V0A1 ATP6V0C ATP8B4 B2M CANT1 CD177 CD300A CD33 CD47 CD53 CD55 CD58 CD59 CD93 CDA CEACAM1 CEACAM8 CFP CHAMP1 CHIT1 CHRNB4 CLEC12A CLEC4C CLEC4D CLEC5A CNN2 COPB1 CR1 CRISP3 CST3 CSTB CTSD CTSH CTSS CXCL1 CYBA CYBB CYFIP1 CYSTM1 DBNL DIAPH1 DLC1 DOK3 DSG1 DSPP DYNC1LI1 DYNLL1 ENPP4 FCAR FCER1G FLG2 FOLR3 FPR1 FPR2 FRMPD3 FTH1 GAA GGH GOLGA7 GPR84 GSDMD HBB HGSNAT IDH1 ILF2 ITGAM ITGAX ITGB2 KCNAB2 LAIR1 LAMP1 LAMP2 LAMTOR1 LAMTOR2 LAMTOR3 LGALS3 LILRA3 LILRB2 LOC112694756 LRG1 LTA4H LTF LYZ MCEMP1 MGAM MMP8 MMP9 NBEAL2 NCKAP1L NFASC NIT2 NRAS OLFM4 OLR1 ORM1 OSCAR PGLYRP1 PGM1 PKP1 PLAU PPBP PRCP PRKCSH PRSS3 PTAFR PTPN6 PTPRB PTPRN2 PTX3 QPCT QSOX1 RAB14 RAP2B RAP2C RCAN1 RHOA RNASE1 SERPINB10 SERPINB12 SERPINB6 SIGLEC14 SIGLEC5 SIRPA SLC11A1 SLC2A3 SNAP23 SNAP25 SPTAN1 STBD1 STOM STX7 STXBP2 STXBP3 SVIP TARM1 TBC1D10C TCIRG1 TCN1 TIMP2 TMC6 TMEM179B TMEM63A TMT1A TNFAIP6 TRPM2 TSPAN14 UBR4 VAMP1 VAMP8 VPS35L YPEL5
-3.5151997,4.7706227,Cluster 0,Synaptic Vesicle Membrane (GO:0030672),ATP6V1G1 ATP6V1G2 ATP6V1G3 BORCS5 CLCN3 CLTA CLTB DOC2A DTNBP1 DYSF FER1L5 GABRA2 ICA1 KIF1B MCTP1 MCTP2 MYOF OTOF PHAF1 PTPRN2 PTPRS RAB26 RAB3A RAB3B RAB5A RPH3A SEMA4C SLC17A6 SLC17A7 SLC17A8 SLC18A1 SLC18A2 SLC18B1 SLC32A1 SLC35D3 SLC35F1 SLC35G2 SLC5A7 STX10 STX12 STX6 SV2A SV2B SV2C SYN1 SYN2 SYN3 SYNDIG1 SYNGR1 SYNGR2 SYNGR3 SYNGR4 SYNPR SYP SYPL1 SYPL2 SYT1 SYT13 SYT2 SYT4 SYT5 SYT8 TMEM163 UNC13A UNC13B UNC13C VAMP1 VAMP2
-3.7755349,4.0124745,Cluster 0,BLOC-1 Complex (GO:0031083),BLOC1S1 BLOC1S2 BLOC1S3 BLOC1S4 BLOC1S5 BLOC1S6 DTNBP1 KXD1 PI4K2A SNAP25 SNAP47 SNAPIN STX12 WASHC4
-3.9235845,3.3469455,Cluster 0,Chromaffin Granule (GO:0042583),CHGA CTSL CYB561 SLC17A9 SRI
-0.571802,2.9870985,Cluster 0,Specific Granule Membrane (GO:0035579),ADAM8 ADGRG3 AGPAT2 ALDH3B1 ANO6 AP1M1 ATP11A ATP6V1D ATP8A1 ATP8B4 C3AR1 CD177 CD33 CD36 CD47 CD53 CD59 CD93 CEACAM1 CEACAM21 CEACAM8 CHRNB4 CKAP4 CLEC12A CLEC4D CLEC5A CMTM6 CYBA CYBB DEGS1 DGAT1 DNAJC5 FCAR FPR2 GPR84 HGSNAT HMOX2 HVCN1 ITGAL ITGAM ITGAV ITGB2 KCNAB2 LAIR1 LAMTOR1 LAMTOR2 LAMTOR3 LILRA3 MCEMP1 MLEC MMP28 MOSPD2 MS4A3 OLR1 ORMDL3 P2RX1 PGAP1 PGRMC1 PLAU PLAUR PRKCSH PTPRB PTPRJ RAB37 RAB44 RAP1A RAP2B SCAMP1 SLC15A4 SLC27A2 SLC2A3 SLC2A5 SLC44A2 SLCO4C1 SNAP23 SNAP25 STK10 STOM TARM1 TMBIM1 TMC6 TMEM30A TMEM63A TNFRSF1B TOM1 TRPM2 TSPAN14 UBR4 VAMP1 VAMP8
-3.98376,3.8218088,Cluster 0,AP-3 Adaptor Complex (GO:0030123),AP3B2 AP3D1 AP3M1 AP3M2 AP3S1 AP3S2 VPS33A VPS41
-3.4294481,3.2954879,Cluster 0,Azurophil Granule (GO:0042582),ACLY ACP3 ACTR10 ACTR2 ADA2 AGA ANKRD44 ANXA11 ANXA2 ARHGAP45 ARL8A ARSA ATP11B ATP6V0C ATP8A1 AZU1 B4GALT1 BPI BST2 C3 C3AR1 C6ORF120 CAP1 CCT2 CCT8 CD63 CD68 CEACAM6 CEACAM8 CKAP4 CMTM6 CPNE1 CPNE3 CPPED1 CREG1 CTSA CTSC CTSG CYB5R3 DDOST DEFA1 DEFA3 DEFA4 DNAJC13 DNAJC3 DNAJC5 DPP7 DSN1 DYNC1H1 ELANE FABP5 FAF2 FPR1 FRK FTL FUCA1 FUCA2 GAA GALNS GCA GDI2 GGH GLB1 GLIPR1 GM2A GNS GRN GUSB HEBP2 HEXA HEXB HFE HRNR IMPDH1 IRAG2 IST1 ITM2C LAMP1 LAMP2 LAMTOR1 LPCAT1 LYZ MAGT1 MAN2B1 MANBA MAPK1 MGST1 MNDA MPO NAPRT NAT8 NCSTN NDUFC2 NFAM1 NHLRC3 NPC2 OLFM4 ORM2 PA2G4 PADI2 PIGR PLAC8 PRCP PRDX5 PRKCD PRSS2 PRSS57 PRTN3 PSEN1 PSMD1 PTGES2 PYCARD PYGB RAB37 RAB3D RAB44 RAB5C RAP1B RETN RNASE2 RNASE3 RNASET2 S100A7 SDCBP SERPINA3 SERPINB3 SFTPA2 SLCO4C1 SNAP23 SNAP29 STK11IP STOM STX3 STX7 STXBP2 SURF4 SYNGR1 TINAGL1 TMEM179B TMEM30A TOLLIP TOM1 TRAPPC1 TTR TUBB TUBB4B TXNDC5 UNC13D VAMP1 VAMP7 VAMP8 VAPA VAT1 VCP VNN1
-3.3987203,3.2825892,Cluster 0,Azurophil Granule Lumen (GO:0035578),ACTR10 ACTR2 ADA2 AGA ANKRD44 ANXA2 ARHGAP45 ARSA AZU1 BPI C3 C6ORF120 CAP1 CCT2 CCT8 CPPED1 CREG1 CTSA CTSC CTSG CYB5R3 DEFA1 DEFA3 DNAJC3 DPP7 DSN1 DYNC1H1 ELANE FABP5 FAF2 FRK FTL FUCA1 FUCA2 GALNS GCA GDI2 GGH GLB1 GM2A GNS GRN GUSB HEBP2 HEXB HRNR IMPDH1 IST1 LYZ MAN2B1 MAPK1 MNDA MPO NAPRT NAT8 NHLRC3 NPC2 ORM2 PA2G4 PADI2 PLAC8 PRDX5 PRKCD PRSS2 PRSS57 PRTN3 PSMD1 PTGES2 PYCARD PYGB RETN RNASE2 RNASE3 RNASET2 S100A7 SDCBP SERPINA3 SERPINB3 STK11IP TINAGL1 TOLLIP TRAPPC1 TTR TUBB TUBB4B TXNDC5 UNC13D VAT1 VCP
-3.542384,3.265565,Cluster 0,Azurophil Granule Membrane (GO:0035577),ACP3 ARL8A ATP11B ATP6V0C ATP8A1 AZU1 B4GALT1 BST2 C3AR1 CD63 CD68 CEACAM6 CEACAM8 CKAP4 CMTM6 CPNE1 CPNE3 DDOST DNAJC13 DNAJC5 FPR1 GAA GLIPR1 HFE IRAG2 ITM2C LAMP1 LAMP2 LAMTOR1 LPCAT1 MAGT1 MANBA MGST1 NCSTN NDUFC2 NFAM1 PIGR PRCP PSEN1 RAB37 RAB3D RAB44 RAB5C RAP1B SFTPA2 SLCO4C1 SNAP29 STOM SURF4 SYNGR1 TMEM179B TMEM30A TOM1 VAMP1 VAMP7 VAMP8 VAPA VNN1
-3.3942928,3.2456937,Cluster 0,Vacuolar Lumen (GO:0005775),ACD ACLY ACTR10 ACTR2 ADA2 AGA AGRN ANKRD44 ANXA2 APOB ARHGAP45 ARSA ASAH1 ATP13A2 AZU1 BCAN BGN BPI C3 C6ORF120 CAP1 CBLIF CCT2 CCT8 CD74 CHID1 CPPED1 CREG1 CSF3 CSPG4 CSPG5 CTSA CTSC CTSD CTSF CTSG CTSK CTSL CTSS CTSV CUBN CYB5R3 DCN DEFA1 DEFA3 DNAJC3 DPP7 DSN1 DYNC1H1 EGFL7 ELANE FABP5 FAF2 FMOD FRK FTL FUCA1 FUCA2 GAA GALC GALNS GBA1 GC GCA GDI2 GGH GLB1 GM2A GNS GPC1 GPC2 GPC3 GPC4 GPC5 GPC6 GRN GUSB GYG1 GZMB HEBP2 HEXA HEXB HPSE HRNR HSP90AA1 HSPA8 HSPG2 IDS IDUA IFI30 IMPDH1 IST1 KERA LAMP2 LGMN LUM LYZ MAN2B1 MAN2B2 MANBA MAPK1 MNDA MPO NAAA NAGLU NAPRT NAT8 NCAN NEU4 NHLRC3 NPC2 OGN OMD ORM2 PA2G4 PADI2 PLAC8 PLD3 PPT1 PPT2 PRDX5 PRELP PRKCD PRSS2 PRSS57 PRTN3 PSMD1 PTGES2 PYCARD PYGB RETN RNASE2 RNASE3 RNASET2 S100A7 SCARB2 SCGB1D1 SDC1 SDC2 SDC3 SDC4 SDCBP SERPINA3 SERPINB13 SERPINB3 SFTPA2 SGSH SMPD1 SPAM1 STK11IP TCN2 TINAGL1 TOLLIP TRAPPC1 TTR TUBB TUBB4B TXNDC5 UNC13D VAT1 VCAN VCP ZNF395
-4.310879,4.033284,Cluster 0,Vesicle Membrane (GO:0012506),ACP3 ANXA1 ANXA10 ANXA11 ANXA13 ANXA2 ANXA3 ANXA4 ANXA5 ANXA6 ANXA7 ANXA8L1 ANXA9 AP1B1 AP1G1 AP1M1 AP1M2 AP1S1 AP1S2 AP1S3 APPBP2 APPL1 AQP5 AQP6 ARRB1 ASPSCR1 BAIAP2L2 C2CD5 CLCN3 DGKQ DYSF EEF1AKMT4-ECE2 ENTPD7 FMN2 GAD1 GBP1 GIPC1 GPER1 IYD LAMP5 MFSD10 MREG MYO5B NSG2 PIKFYVE RAB10 RAB11A RAB11FIP2 RAB21 RAB4A RALA RIPOR1 SGSM1 SH3BP5 SLC12A2 SLC26A6 SLC28A2 SLC2A4 SLC30A1 SLC39A13 SLC4A11 SLC6A4 SNX9 SPIRE1 SPIRE2 STING1 STK26 SYNJ1 TMEM184A TMEM67 TOR1A TRARG1 TRIM72 TRPM2 VAMP5 VOPP1 ZNRF2
-3.5907607,4.6228423,Cluster 0,Secretory Vesicle (GO:0099503),BAIAP3 BICD1 DPYSL3 DYNLT1 IGF1 NKD2 RAB10 RAB27A RAB27B RAB3D SLC30A2 SYT1 SYT10 SYT12 SYT13 SYT15 SYT15B SYT17 SYT2 SYT3 SYT4 SYT5 SYT6 SYT8 SYT9 SYTL1 SYTL2 SYTL3 SYTL4 SYTL5 UNC13D
-0.6020703,2.9742856,Cluster 0,Secretory Granule Membrane (GO:0030667),ABCA3 ABCC4 ACP3 ACRBP ADAM10 ADAM8 ADGRE3 ADGRE5 ADGRG3 AGPAT2 ALDH3B1 ANO6 ANPEP ANXA7 AP1M1 AP2A2 APLP2 ARL8A ATAD3B ATP11A ATP11B ATP6AP2 ATP6V0A1 ATP6V0C ATP6V1D ATP8A1 ATP8B4 AZU1 B4GALT1 BST2 C3AR1 C5AR1 CA4 CCDC136 CD109 CD177 CD300A CD33 CD36 CD44 CD47 CD53 CD55 CD58 CD59 CD63 CD68 CD9 CD93 CEACAM1 CEACAM21 CEACAM6 CEACAM8 CHRNB4 CKAP4 CLEC12A CLEC4C CLEC4D CLEC5A CMTM6 COPB1 CPNE1 CPNE3 CR1 CUZD1 CXCR1 CXCR2 CYB561 CYB5R1 CYBA CYBB CYSTM1 DBH DDOST DEGS1 DGAT1 DIAPH1 DMBT1 DNAJC13 DNAJC5 DOK3 DSG1 DSPP DYNC1LI1 DYNLL1 ENPP4 EXOC3 FABP5 FCAR FCER1G FCGR2A FPR1 FPR2 FRMPD3 GAA GLIPR1 GP2 GPR84 HFE HGSNAT HLA-B HLA-C HMOX2 HVCN1 HYAL3 ICA1 IGF2R IQGAP1 IQGAP2 IRAG2 ITGA2B ITGAL ITGAM ITGAV ITGAX ITGB2 ITGB3 ITM2C ITPR1 ITPR2 ITPR3 IZUMO1 KCNAB2 LAIR1 LAMP1 LAMP2 LAMTOR1 LAMTOR2 LAMTOR3 LGALS3 LHFPL2 LILRA3 LILRA6 LILRB2 LOC124905743 LPCAT1 LY6G6F MAGT1 MANBA MCEMP1 MGAM MGST1 MLEC MMP12 MMP28 MOSPD2 MOXD1 MS4A3 MYCBP2 NBEAL2 NCKAP1L NCSTN NDUFA2 NDUFC2 NFAM1 NFASC NRAS OLR1 ORMDL3 P2RX1 PCDH7 PCSK4 PECAM1 PGAP1 PGRMC1 PHACTR2 PIGR PKP1 PLAU PLAUR PRCP PRKCSH PSEN1 PTAFR PTPRB PTPRC PTPRJ PTPRN2 RAB10 RAB14 RAB18 RAB24 RAB26 RAB27B RAB31 RAB37 RAB3A RAB3D RAB44 RAB4B RAB5B RAB5C RAB6A RAB7A RAB9B RAP1A RAP1B RAP2B RAP2C RCAN1 RHOA RHOF RHOG RNASE1 SCAMP1 SCG3 SELENOP SELL SERPINA5 SERPINB10 SERPINB12 SERPINB6 SFTPA2 SIGLEC14 SIGLEC5 SIGLEC9 SIRPA SIRPB1 SLC11A1 SLC15A4 SLC17A9 SLC18A1 SLC18A2 SLC18B1 SLC27A2 SLC2A3 SLC2A5 SLC30A2 SLC30A5 SLC30A8 SLC44A2 SLCO4C1 SNAP23 SNAP25 SNAP29 SNCA SPACA1 SPACA3 SPARC SRI STBD1 STING1 STK10 STOM SURF4 SVIP SYNGR1 SYT4 SYTL4 TARM1 TBC1D10C TCIRG1 TEKT3 TLR2 TMBIM1 TMC6 TMED10 TMED2 TMED7-TICAM2 TMEM179B TMEM184A TMEM30A TMEM63A TMEM95 TMX3 TNFRSF1B TOM1 TRPM2 TSPAN14 TYROBP UBR4 VAMP1 VAMP2 VAMP7 VAMP8 VAPA VNN1 VPS13B VPS35L
-1.6721224,2.800337,Cluster 0,Secretory Granule Lumen (GO:0034774),A2M ACAA1 ACLY ACTN1 ACTN2 ACTN4 ACTR10 ACTR1B ACTR2 ADA2 ADM AGA AGL AHSG AIFM2 ALAD ALDOC ALOX5 AMPD3 ANKRD44 ANXA2 AOC1 APAF1 APOA1 APOH APOOL APP APRT ARHGAP45 ARHGAP9 ARMC8 ARPC5 ARSA ATG7 AZU1 B2M BIN2 BPI C1ORF35 C1QTNF1 C3 C6ORF120 CAB39 CAND1 CANT1 CAP1 CCT2 CCT8 CDA CDC37L1 CEP290 CFP CHAMP1 CHI3L1 CHIT1 CLEC3B CLU CNN2 COMMD9 COTL1 CPPED1 CRACR2A CREG1 CRISP3 CRISPLD2 CSNK2B CSTB CTSA CTSC CTSD CTSG CTSH CTSW CTSZ CXCL1 CYB5R3 CYFIP1 CYRIB DBH DBNL DDX3X DEFA1 DEFA3 DEFA4 DEFA5 DERA DLC1 DNAJC3 DNASE1L1 DOCK2 DPP7 DSN1 DYNC1H1 DYNLT1 ECM1 EEF1A1 EEF2 EGF EGFL7 ELANE EPX ERP44 F13A1 F5 F8 FABP5 FAF2 FAM3C FBF1 FCN1 FERMT3 FGA FGB FGG FGR FN1 FOLR3 FRK FTL FUCA1 FUCA2 GALNS GAS6 GCA GCG GDI2 GGH GHDC GHRL GLB1 GLYAT GM2A GMFG GNPDA1 GNS GRN GSDMD GSN GSTP1 GTPBP2 GUSB GYG1 HEBP2 HEXB HMGB1 HOOK3 HPSE HRNR HSP90AA1 HSP90AB1 HSPA6 HSPA8 HUWE1 IDH1 IGF1 IGF2 ILF2 IMPDH1 IMPDH2 INS ISLR IST1 ITIH3 ITIH4 JUP KNG1 KPNB1 LCN2 LEFTY2 LGALS3BP LOC112694756 LRG1 LRRC7 LTF LYZ MAGED2 MAN2B1 MAPK1 MAPK14 MMP8 MMRN1 MNDA MPO MVP NAPRT NAT8 NFKB1 NHLRC2 NHLRC3 NIT2 NME2 NPC2 OLA1 OLFM4 ORM1 ORM2 OSCAR OSTF1 PA2G4 PADI2 PAFAH1B2 PCSK1 PCYOX1L PDGFA PDGFB PDXK PF4 PFKL PGAM4 PGLYRP1 PGM2 PIKFYVE PKM PLAC8 PLG POMC PPBP PPIA PPIE PPY PRDX4 PRDX5 PRKCD PROS1 PRSS2 PRSS57 PRTN3 PSMA2 PSMA5 PSMB1 PSMB7 PSMC2 PSMC3 PSMD1 PSMD11 PSMD12 PSMD13 PSMD14 PSMD2 PSMD3 PSMD6 PSMD7 PTGES2 PTPN6 PTX3 PYCARD PYGB PYGL QPCT QSOX1 RAB27A RARRES2 RETN RNASE2 RNASE3 RNASET2 ROCK1 S100A11 S100A12 S100A7 S100A8 S100A9 S100P SCCPDH SCG3 SDCBP SELENOP SERPINA1 SERPINA3 SERPINA4 SERPINB1 SERPINB3 SERPINE1 SERPINF2 SERPING1 SGPP2 SLC48A1 SLPI SOS1 SPARC SPTAN1 SRGN SRP14 STK11IP TCN1 TEX264 TF TGFB1 TGFB2 TGFB3 THBS1 TIMP1 TIMP2 TIMP3 TINAGL1 TMSB4X TOLLIP TOR4A TRAPPC1 TTR TUBB TUBB4B TXNDC5 UCMA UNC13D VAT1 VCL VCP VEGFA VEGFB VEGFC VEGFD VTI1B VWF XRCC5 XRCC6
-0.53300834,2.894367,Cluster 0,Specific Granule (GO:0042581),ADAM10 ADAM8 ADGRG3 AGPAT2 AIFM2 ALDH3B1 ANO6 ANXA11 ANXA3 AOC1 AP1M1 ARMC8 ATP11A ATP6V1D ATP8A1 ATP8B4 B2M BPI C3AR1 CANT1 CD177 CD33 CD36 CD47 CD53 CD59 CD93 CEACAM1 CEACAM21 CEACAM8 CEP290 CFP CHAMP1 CHI3L1 CHIT1 CHRNB4 CKAP4 CLCN3 CLEC12A CLEC4D CLEC5A CMTM6 CNN2 CRACR2A CRISP3 CTSD CTSZ CXCL1 CYBA CYBB CYFIP1 DEFA4 DEGS1 DGAT1 DLC1 DNAJC5 DNASE1L1 DOCK2 EGFL7 ELANE ERP44 FCAR FOLR3 FPR2 FRK GGH GHDC GPR84 GSDMD HGSNAT HMOX2 HPSE HVCN1 ILF2 ITGAL ITGAM ITGAV ITGB2 JUP KCNAB2 KPNB1 LAIR1 LAMTOR1 LAMTOR2 LAMTOR3 LCN2 LILRA3 LRG1 LRRC7 LTF LYZ MCEMP1 MLEC MMP28 MMP8 MOSPD2 MS4A3 NFKB1 NIT2 OLFM4 OLR1 ORM1 ORM2 ORMDL3 OSCAR P2RX1 PDXK PGAP1 PGLYRP1 PGRMC1 PLAU PLAUR PRKCSH PTPN6 PTPRB PTPRJ PTX3 QPCT QSOX1 RAB27A RAB37 RAB44 RAP1A RAP2B RETN SCAMP1 SLC15A4 SLC27A2 SLC2A3 SLC2A5 SLC44A2 SLCO4C1 SLPI SNAP23 SNAP25 SPTAN1 STK10 STOM STX3 STX4 STXBP2 STXBP3 TARM1 TCN1 TIMP2 TINAGL1 TMBIM1 TMC6 TMEM30A TMEM63A TNFRSF1B TOLLIP TOM1 TRPM2 TSPAN14 UBR4 VAMP1 VAMP8 VCL
-4.284773,2.0835168,Cluster 1,Alpha-Beta T Cell Receptor Complex (GO:0042105),CD3D CD3E NCOR2 TARP THRB TRA
-5.013647,3.1991901,Cluster 1,Acetylcholine-Gated Channel Complex (GO:0005892),CHRNA1 CHRNA2 CHRNA3 CHRNA4 CHRNA5 CHRNA6 CHRNA9 CHRNB1 CHRNB2 CHRNB3 CHRNB4 CHRND CHRNE CHRNG STXBP5
-4.784415,2.958433,Cluster 1,Chloride Channel Complex (GO:0034707),BEST1 BEST2 CLCN7 GLRA3 GLRB OSTM1
-4.362281,3.015633,Cluster 1,Dystroglycan Complex (GO:0016011),SGCA SGCB SGCD SGCE SGCG SGCZ
-6.247987,2.476982,Cluster 1,Calcium Channel Complex (GO:0034704),ASPH ATP2A1 CACHD1 CACNA1A CACNA1B CACNA1C CACNA1D CACNA1E CACNA1F CACNA1G CACNA1H CACNA1S CACNA2D1 CACNA2D2 CACNA2D3 CACNA2D4 CACNB1 CACNB2 CACNB3 CACNB4 CACNG3 CACNG6 CACNG7 CACNG8 CALM1 CALM2 CALM3 CASQ2 ENTHD1 FKBP1B MCU MCUB MICU1 MICU2 MICU3 ORAI1 PDE4B PDE4D PKD1 PKD1L1 PKD2L1 PRKCA PTPRA RYR1 RYR2 RYR3 SESTD1 SMDT1 STAC3 TRPC4 TRPC5
-6.147404,2.5503187,Cluster 1,Cation Channel Complex (GO:0034703),AKAP9 ASPH ATP2A1 CALM1 CALM2 CALM3 CASQ2 CHRFAM7A CHRNA4 CHRNB2 CNGA1 CNGA2 CNGA3 CNGA4 CNGB1 CNGB3 FKBP1B HTR3A HTR3B HTR3C HTR3D HTR3E KCNA5 KCNA6 KCNAB1 KCNK1 KCNK4 MCU MCUB MICU1 MICU2 ORAI1 PDE4D PKD1 PKD1L1 PKD1L3 PKD2L1 PRKCA PRKD2 PTPRA RYR1 RYR2 RYR3 SCNN1A SCNN1B SCNN1D SCNN1G SESTD1 TRPC1 TRPC3 TRPC4 TRPC5 TRPC6 TRPC7 TRPM4 UNC80
-6.074913,1.976315,Cluster 1,Cortical Endoplasmic Reticulum (GO:0032541),ASPH C2CD2L EMD OSBPL8 STIM1 STIMATE TMEM201
-4.7946687,2.5230486,Cluster 1,Death-Inducing Signaling Complex (GO:0031264),CASP3 CASP8 CFLAR FADD FAF1 FASN RIPK1 TRADD
-5.140022,2.9619634,Cluster 1,9+0 Non-Motile Cilium (GO:0097731),C1ORF115 CFAP96 DYNLL2 IFTAP PEX6 PHYH TULP3 USH1G
-5.7020354,1.5379571,Cluster 1,Nuclear Outer Membrane (GO:0005640),DHCR7 EMD ENO1 GHRHR GUCY2D GUCY2F ITPR3 ITPRIP KASH5 LTC4S PSEN1 PTGS2 RETSAT SMPD4 SYNE3 SYNE4 TMEM53 UGT2B28 ZNF547
-5.5909653,3.3106253,Cluster 1,Monoatomic Ion Channel Complex (GO:0034702),BEST1 BEST2 CHRFAM7A CHRNA1 CHRNA2 CHRNA3 CHRNA4 CHRNA5 CHRNA6 CHRNA9 CHRNB1 CHRNB2 CHRNB3 CHRNB4 CHRND CHRNE CHRNG CLCN7 GPRIN1 GRID2 GRIN3A GRIN3B KCNQ1 LRRC8A LRRC8B LRRC8C LRRC8D LRRC8E OSTM1 PKD1 PKD1L3 PRKD2 SHISA9 STXBP5 TRPC1 TRPC3 TRPC4 TRPC5 TRPC6 TRPC7 UNC80
-5.9911766,2.690101,Cluster 1,Voltage-Gated Calcium Channel Complex (GO:0005891),CACHD1 CACNA1A CACNA1B CACNA1C CACNA1D CACNA1E CACNA1F CACNA1G CACNA1H CACNA1S CACNA2D1 CACNA2D2 CACNA2D3 CACNA2D4 CACNB1 CACNB2 CACNB3 CACNB4 CACNG3 CACNG6 CACNG7 CACNG8 CATSPER1 CATSPER2 CATSPER3 CATSPER4 CATSPERB CATSPERD CATSPERE CATSPERG CATSPERZ EFCAB9 ENTHD1 HSPA2 PDE4B PDE4D STAC3 TMEM249 TMEM262
-6.564573,2.44465,Cluster 1,Uniplex Complex (GO:1990246),MCUB MICU1 MICU2 MICU3 SMDT1
-4.3753915,2.203482,Cluster 1,Transcription Factor TFIIIC Complex (GO:0000127),GTF3C2 GTF3C3 GTF3C4 GTF3C5 GTF3C6
-6.1367207,1.9074221,Cluster 1,Smooth Endoplasmic Reticulum (GO:0005790),AQP8 CASQ1 ERP29 FTCD GBA2 HSD3B1 HSD3B2 HYOU1 MYO1D PSEN1 RPL15 RYR1 RYR2 RYR3 SLMAP STX17 SYVN1 TH TTYH1
-4.4430714,2.6581736,Cluster 1,Serine Palmitoyltransferase Complex (GO:0017059),ORMDL2 ORMDL3 SPTLC1 SPTLC2 SPTLC3 SPTSSA SPTSSB
-5.1992407,3.1846807,Cluster 1,Septin Ring (GO:0005940),SEPTIN10 SEPTIN11 SEPTIN12 SEPTIN14 SEPTIN2 SEPTIN3 SEPTIN4 SEPTIN5 SEPTIN6 SEPTIN7 SEPTIN8 SEPTIN9
-5.15332,3.1121314,Cluster 1,Septin Cytoskeleton (GO:0032156),SEPTIN10 SEPTIN11 SEPTIN12 SEPTIN14 SEPTIN2 SEPTIN3 SEPTIN4 SEPTIN5 SEPTIN6 SEPTIN7 SEPTIN8 SEPTIN9
-6.279505,2.0038195,Cluster 1,Sarcoplasmic Reticulum Membrane (GO:0033017),ASPH ATP2A1 ATP2A2 CASQ1 CASQ2 CHERP DHRS7C DMPK FKBP1A FKBP1B FKBP1C ITPR2 JPH1 JPH2 JPH3 JPH4 KLHL41 MRLN NOS1AP PLN RYR1 RYR2 RYR3 SLC30A7 SLN STIM1 STRIT1 TMEM109 TMEM38A TMEM38B TRDN
-6.3122144,2.0075517,Cluster 1,Sarcoplasmic Reticulum (GO:0016529),ANK3 ASPH ATP2A1 ATP2A2 ATP2A3 CASQ1 CASQ2 CCDC78 CHERP CLEC18B CMYA5 DHRS7C DMPK FKBP1A FKBP1B FKBP1C FSD2 GSTM2 HAX1 HRC ITPR1 ITPR2 ITPR3 JPH1 JPH2 JSRP1 KLHL41 MRLN NANOS1 NOS1AP PLN RTN2 RYR1 RYR2 RYR3 S100A1 SLC30A7 SLN SRI STIM1 STRIT1 SYNE2 THBS1 THBS4 TMEM109 TMEM38A TMEM38B TRDN
-4.305942,3.0392559,Cluster 1,Sarcoglycan Complex (GO:0016012),SGCB SGCD SGCE SGCG SGCZ
-5.1787415,2.6929197,Cluster 1,Protein Serine/Threonine Phosphatase Complex (GO:0008287),IER5 NKD1 PPP2CA PPP2CB PPP2R1A PPP2R1B PPP2R2A PPP2R2B PPP2R2C PPP2R2D PPP2R3A PPP2R3B PPP2R5A PPP2R5B PPP2R5C PPP2R5D PPP2R5E PPP3CA PPP3CB PPP3CC PPP3R1 PPP3R2 PPP4C PPP4R1 PPP4R2 PPP4R3A PPP4R3B PPP4R3C PPP4R4 PTPRA
-5.118181,2.6728234,Cluster 1,Protein Phosphatase Type 2A Complex (GO:0000159),NKD1 PPP2CA PPP2CB PPP2R1A PPP2R1B PPP2R2A PPP2R2B PPP2R2C PPP2R2D PPP2R3A PPP2R3B PPP2R5A PPP2R5B PPP2R5C PPP2R5D PPP2R5E PTPRA
-4.709783,2.6639073,Cluster 1,Protein Phosphatase 4 Complex (GO:0030289),PPP4R1 PPP4R2 PPP4R3A PPP4R3B PPP4R3C
-6.198795,1.7899446,Cluster 1,Platelet Dense Tubular Network Membrane (GO:0031095),ATP2A2 ATP2A3 DMTN EHD1 IRAG1 ITPR1 ITPR2 ITPR3
-6.183268,1.8237661,Cluster 1,Platelet Dense Tubular Network (GO:0031094),ATP2A2 ATP2A3 DMTN EHD1 F2R IRAG1 ITPR1 ITPR2 ITPR3 SERPINA5
