x,y,cluster,term,genes
0.69239473,0.037344385,Cluster 2,lysosomal membrane (GO:0005765),STARD3 SLC12A4 EGF ATP6V1E1 AP1S1 ANKFY1 AP1B1 MYO7A CTNS LNPEP MFSD12 ZFYVE26 GDAP2 RRAGB ZFYVE16 RRAGA OSTM1 TMEM79 WDR81 PI4K2B TECPR1 PI4K2A
-0.7641412,-1.0204803,Cluster 2,secretory vesicle (GO:0099503),RAB3D UNC13D DOC2B DOC2A SYTL2 RAB27A SYTL1 IGF1 SYTL5 NKD2 SYTL4 SYTL3 RAB10 DPYSL3 SYT10 DYNLT1
-0.89538044,-0.28609478,Cluster 2,primary lysosome (GO:0005766),HEXA STXBP2 SNAP23 HEXB STX7 DEFA4 ANXA11 MPO AZU1 STX3
0.97616947,-0.40938917,Cluster 2,recycling endosome (GO:0055037),ATG9A USP6 STX8 ATP11C ATP11B ATP11A SCAMP2 SCAMP1 SLC9A6 SLC9A7 RAB35 SLC9A9 GPR161 ABCG1 TUBGCP4 ULK1 OPTN RAN
-1.3712507,-0.88795424,Cluster 2,cytoplasmic vesicle lumen (GO:0060205),GSN AGL DEFA5 GCG HUWE1 MAPK14 EEF1A1 PPIA CRISPLD2 PSMC2 PSMC3 SCG3 S100A9 PPIE CDA GHDC S100A8 FCN1
-1.0625124,-0.58235973,Cluster 2,NLRP3 inflammasome complex (GO:0072559),PYCARD GSDMD DHX33 CASP12 CASP4 CASP5 NLRP3 CARD18 CARD8 CASP1
-1.1463499,-0.95706403,Cluster 2,tertiary granule membrane (GO:0070821),HGSNAT CHRNB4 CD300A SIGLEC14 NBEAL2 LILRB2 MCEMP1 ATP11A TMC6 CLEC4C RAP2B CLEC4D CEACAM1 RAP2C CEACAM8 PTPRB SIGLEC5 ADAM8
0.5389222,-0.71414083,Cluster 2,intrinsic component of the cytoplasmic side of the plasma membrane (GO:0031235),RASA4B RASAL1 RASAL2 RASAL3 SPTB DAB2IP RASA1 SPTA1 SYNGAP1 RASA4 NPHS2 MIEN1 RASA2 RASA3 NF1
0.053917386,0.07107396,Cluster 2,endosome lumen (GO:0031904),CTSB PRLR AP4B1 LNPEP GH1 GH2 LGMN
0.33016637,0.27271786,Cluster 2,endolysosome (GO:0036019),CTSB AP2B1 CLTC CLEC16A CLTA PCSK9 AP2A2 AP2A1 CTSS CTSL CTSK LGMN TLR9 AP2S1 TLR8 TLR7 HRG LDLR TLR3 AP2M1
0.33845785,-0.66206247,Cluster 2,clathrin coat of trans-Golgi network vesicle (GO:0030130),AFTPH AP1G2 AP1S1 SYNRG NCALD LDLRAP1 AP2A1 SLC18A3
-0.77733546,-1.0895981,Cluster 2,exocytic vesicle (GO:0070382),UNC13D DOC2B DOC2A SYTL2 RAB27A SYTL1 IGF1 SYTL5 NKD2 SYTL4 SYTL3 PICALM RAB10 DPYSL3 SYT10 RAB6A
-1.2631276,-0.93923223,Cluster 2,ficolin-1-rich granule (GO:0101002),PTPRN2 GSN KRT1 CD300A AGL NBEAL2 PDAP1 HUWE1 ILF2 ATAD3B MAPK14 DYNC1LI1 CLEC4C EEF1A1 CLEC4D PPIA DOK3 CRISPLD2 PSMC2 PSMC3 HSPA1A ARL8A ADAM8 CDK13 DSC1 YPEL5 PKP1 PPIE CDA HSPA1B FCN1
-0.68709373,-0.5032891,Cluster 2,early endosome (GO:0005769),ANKFY1 LNPEP DKK1 RUFY1 ZFYVE16 CD4 WDR81 CD207 RIN3 EPHA4 VPS28 EPHA3
-1.017254,-0.49990878,Cluster 2,membrane raft (GO:0045121),CAVIN1 CAVIN2 ARID3A ARID3C MALL CD4 FAS TEK MYADM PI4K2A
-0.91188085,-0.9777166,Cluster 2,endocytic patch (GO:0061645),HIP1 WIPF1 WIPF2 WIPF3 HIP1R WAS WASL
-1.2516358,-0.6798248,Cluster 2,azurophil granule (GO:0042582),UNC13D IST1 GCA DEFA3 DEFA4 DEFA1 ATP11B PRSS57 GALNS RAB37 TOLLIP S100A7 ARL8A GLA NHLRC3 CD68 FRK
0.08226143,-0.19345473,Cluster 2,extrinsic component of endosome membrane (GO:0031313),SNX5 USP8 ANXA1 WDR91 WDR81 SNX16 SNX10
-0.86527884,-1.0015008,Cluster 2,autophagosome membrane (GO:0000421),GABARAP GABARAPL3 GABARAPL2 SH3GLB1 GABARAPL1 STX17 WIPI1 MAP1LC3B2 MAP1LC3A MAP1LC3C MAP1LC3B ATG16L2 ATG16L1 WDR81 PRKD1 ULK1 TECPR1 VMP1
0.9111736,-0.48255962,Cluster 2,autophagosome (GO:0005776),ATG9A SH3GLB1 ATP13A2 HSPA8 NCOA4 ATG9B WIPI1 MAP1LC3B2 WIPI2 ATG14 ATG12 ATG16L2 ATG16L1 WDR81 TBC1D25 ULK1 WDFY3 PIK3C3 SQSTM1 TECPR1
-1.2044832,-0.92269206,Cluster 2,tertiary granule (GO:0070820),PTPRN2 CHRNB4 CD300A NBEAL2 ARMC8 MCEMP1 ILF2 ATP11A ATAD3B FLG2 OSCAR DYNC1LI1 CLEC4C CLEC4D DOK3 OLFM4 ARL8A ADAM8 DSC1 PTPN6 YPEL5 PKP1 CDA
-0.25383613,-0.5870693,Cluster 2,integral component of endoplasmic reticulum membrane (GO:0030176),G6PC CD74 DOLPP1 AMFR TAP1 ERN1 DPM3 STIM1 SELENOS DNAJB12 PREB DHCR7 RETREG1
-0.057434026,-0.08842994,Cluster 2,trans-Golgi network membrane (GO:0032588),CD74 AP1S1 GOLPH3L AP1B1 SCAMP2 MARCH1 RAB31 TMEM79 HLA-DRA HLA-DQB1 HLA-DQB2
0.9705464,-0.41945252,Cluster 2,pre-autophagosomal structure (GO:0000407),ATG9A BECN1 BECN2 PLEKHF1 PLEKHF2 TRAPPC8 ATG9B WIPI1 WIPI2 ZFYVE1 STX12 ATG13 C6ORF106 NBR1 ATG101 ATG2B ULK3 ATG2A ULK2 ULK1 PIK3C3 ATG7 VMP1
-1.249737,-0.8604175,Cluster 2,secondary lysosome (GO:0005767),NCF2 NCF4 NCOA4 LRRK2 MAP1LC3A CRHBP LAMP2 FTH1 NCF1 ADAM8 PIK3C3 SQSTM1 FTL
-0.3015757,-0.39254764,Cluster 2,integral component of nuclear inner membrane (GO:0005639),ANKLE1 MAJIN LEMD3 LEMD2 P2RX7 P2RX6 P2RX5 P2RX4 P2RX3 P2RX2 P2RX1 LBR
0.75601506,-0.22639447,Cluster 2,late endosome (GO:0005770),ATG9A UVRAG STARD3 ANKRD27 STX8 CTNS SLC9A9 WDR81 STEAP3
-0.8768194,-0.5952259,Cluster 2,early phagosome (GO:0032009),SNX3 UNC93B1 SYK SYT11 TLR9 TLR7 SYT7
-1.2247732,-0.7702992,Cluster 2,azurophil granule membrane (GO:0035577),CMTM6 NFAM1 NDUFC2 AZU1 ATP11B BST2 RAB37 CEACAM8 CEACAM6 DNAJC5 ARL8A CD68
-1.2654874,-0.8002694,Cluster 2,specific granule (GO:0042581),CHRNB4 AOC1 DEFA4 ARMC8 MCEMP1 ILF2 ATP11A SCAMP1 OSCAR CLEC4D OLFM4 RAB37 TOLLIP SLPI ADAM8 DEGS1 PTPN6 GHDC FRK
-0.11983976,-0.63165396,Cluster 2,post-mRNA release spliceosomal complex (GO:0071014),XAB2 GCFC2 SNW1 ISY1 SYF2 DHX15 LIME1 TFIP11 CRNKL1
1.1570145,-0.43368894,Cluster 2,flotillin complex (GO:0016600),CDH1 FLOT2 LRP4 FLOT1 SLC6A3 CBL CORO1C
0.10443721,0.3119573,Cluster 2,vacuolar proton-transporting V-type ATPase complex (GO:0016471),ATP6V0C SPAAR ATP6V0B ATP6V0D1 CCDC115 TCIRG1 TMEM199 ATP6V0A4 ATP6V0D2 ATP6V1F ATP6V1C1 ATP6V1H ATP6V1B1 ATP6V0A1 ATP6V1C2 ATP6V0A2
-0.85109454,-0.49172246,Cluster 2,AIM2 inflammasome complex (GO:0097169),PYCARD AIM2 CASP12 CASP4 CASP5 CARD18 CASP1
-1.2689782,-0.8437764,Cluster 2,specific granule membrane (GO:0035579),HGSNAT CHRNB4 CMTM6 MCEMP1 ATP11A TMC6 SCAMP1 TNFRSF1B TMBIM1 CEACAM3 RAP2B BST1 CLEC4D CEACAM1 RAB37 CEACAM8 PTPRB DNAJC5 ADAM8 MS4A3 DEGS1
0.8258309,0.229177,Cluster 2,mitochondrial outer membrane (GO:0005741),STARD7 AGK BAD AOC1 ACSL1 RSAD2 SPATA16 PINK1 SPATA18 RAB32 CYP24A1 IFI27 BAX ULK1 RAF1
-0.45959073,-0.5078936,Cluster 2,MHC protein complex (GO:0042611),CD74 HLA-DRB5 HLA-C HLA-A HLA-B HLA-E HLA-DMB HLA-DRA HLA-DPA1 HLA-DQB1 HLA-DPB1 HLA-DOB HLA-DMA HLA-DRB3 HLA-DOA HLA-DQA1 HLA-DQB2 HLA-DRB1
0.1866301,0.21059886,Cluster 2,lysosomal lumen (GO:0043202),CTSB CTSA FUCA1 LUM CD74 HSP90AA1 ATP13A2 HSPA8 KERA GALNS VCAN NPC2 OGN NAAA MAN2B2 CSPG5 GLA MAN2B1 CSPG4 AGRN
-0.47451097,-0.3867229,Cluster 2,CD40 receptor complex (GO:0035631),IKBKB CD40 TRAF5 DIABLO CHUK TRAF6 HTRA2 TRAF3 BIRC2 TANK RNF31
-0.5013343,-0.5209046,Cluster 2,MHC class II protein complex (GO:0042613),CD74 HLA-DRB5 HLA-DMB HLA-DRA HLA-DPA1 HLA-DQB1 HLA-DPB1 HLA-DOB HLA-DMA HLA-DRB3 HLA-DOA HLA-DQA1 HLA-DQB2 HLA-DRB1
0.9463703,-0.5899293,Cluster 2,PML body (GO:0016605),MLIP CASP8AP2 UBE2I CBX5 ZBTB16 HIPK2 SIRT1 KLHL20 CHFR PML SENP2 CDK9 SKI ELF4 ARTN KAT6A TRIM16 WDFY3 SQSTM1 MRE11 LRCH4 ATR RNF222 TP53
0.87438476,-0.184575,Cluster 2,clathrin-coated vesicle (GO:0030136),UNC13D EGF WNT5A OCRL SCAMP1 MALL CD4 RAB35 HIP1R STEAP2
0.4086206,-0.0206582,Cluster 2,lysosome (GO:0005764),STARD3 UNC13D EGF LUM AP1S1 ANKFY1 LNPEP ZFYVE26 GDAP2 GALNS ZFYVE16 OSTM1 TMEM79 WDR81 GLA PI4K2B PI4K2A
1.2101936,-0.82314706,Cluster 2,aggresome (GO:0016235),STRADB SFMBT2 EDEM1 CCZ1B ZBTB14 PICK1 CCZ1 URB2 EEF2 ZDHHC17 RANGAP1 FGR KLF8 SLFN11 SERGEF XRN2 TDP2 HSPA1A TRIM37 PRKCQ SQSTM1 HSPA1B
0.16797218,-0.72013956,Cluster 2,AP-1 adaptor complex (GO:0030121),AFTPH AP1G2 AP1S1 SYNRG LDLRAP1 SLC18A3
-0.8048459,-0.16602354,Cluster 2,autolysosome (GO:0044754),MAP1LC3A LAMP2 NCOA4 LRRK2 FTH1 PIK3C3 SQSTM1 FTL
1.1968937,-0.52599496,Cluster 2,vacuole (GO:0005773),ATG9A UVRAG CD74 ATP13A2 GGH HSPA8 ATG9B WIPI2 ATG14 ATG12 ATG16L1 TBC1D25 ULK1 GLB1L WDFY3 SQSTM1
0.9002531,-0.4442511,Cluster 2,lytic vacuole (GO:0000323),UVRAG UNC13D ANKRD27 CD164 USP6 USP5 USP4 CTNS TSC2 RRAGB RRAGA RRAGD RRAGC RAB38 SIDT2 GLA
-0.09193191,0.20427948,Cluster 2,proton-transporting V-type ATPase complex (GO:0033176),ATP6V1D ATP6V0D1 CCDC115 TCIRG1 ATP6V0A4 ATP6V0D2 ATP6V1F ATP6V1B1 ATP6V0A1 ATP6V0A2 TMEM199
-0.21622996,-0.7357194,Cluster 2,T cell receptor complex (GO:0042101),CARD11 STOML2 SYK BCL10 CD3G CD3E CD3D ZAP70 CD4 CEACAM1 ALCAM CD6 CD8B CD8A TRAT1 CD247
-1.0088778,-0.37068632,Cluster 2,tertiary granule lumen (GO:1904724),GSDMD MMP8 GGH ARMC8 MMP9 ILF2 LYZ FLG2 OSCAR OLFM4 ALDOC PTPN6 ALDOA YPEL5 CDA
-0.7508529,-0.20168474,Cluster 2,phagocytic vesicle membrane (GO:0030670),ATP6V0C ATP6V0E1 ATP6V0B ATP6V0E2 ANXA3 SLC11A1 HLA-C CYBB TAP1 HLA-A CYBA HLA-B HLA-G TAPBP HLA-E ATG12 HLA-F VAMP8 PIK3C3 ATP6V0D2 CALR SEC22B VAMP3
-0.19331327,0.14730735,Cluster 2,azurophil granule lumen (GO:0035578),CTSA FUCA1 UNC13D ACTR2 ANXA2 PTGES2 IST1 GCA GGH FUCA2 TUBB DEFA3 PA2G4 DEFA1 AZU1 PRSS57 LYZ ADA2 GALNS DNAJC3 NPC2 TOLLIP S100A7 GLA NHLRC3 MAN2B1 ACTR10 FRK
8.8321705,-1.0818759,Cluster 3,"DNA-directed RNA polymerase II, core complex (GO:0005665)",POLR2J2 POLR2J3 URI1 CHD6 POLR2A POLR2B POLR2C POLR2D POLR2E POLR2F POLR2G POLR2H POLR2I PPARGC1A POLR2J POLR2K POLR2L
9.755124,-1.851723,Cluster 3,ribosome (GO:0005840),RPS9 RPL24 EIF2AK2 RPL23 RPS7 EIF2AK4 RPL13A LARP4B NEMF MRPS7 RPL26 RPL27
8.630897,-1.1467825,Cluster 3,DNA-directed RNA polymerase III complex (GO:0005666),POLR3GL CRCP POLR3A POLR3B POLR3C POLR3D POLR3E POLR1C POLR3F POLR1D POLR2E POLR3G POLR2F POLR3H POLR2H POLR3K POLR2K POLR2L
9.096664,-1.7640619,Cluster 3,U1 snRNP (GO:0005685),SNRPN RBPMS PRPF40B PRPF40A SNRPA PRPF39 SNRPD3 SNRPD2 SNRNP70 SNRPD1 LUC7L SNRPGP15 SNRPF SNRPB2 NAA38 SNRPG SNRPE SNRPB LUC7L3 LUC7L2 SNRPC
9.644996,-1.7660123,Cluster 3,cytosolic large ribosomal subunit (GO:0022625),RPL22 COA1 RPL21 RPL36A-HNRNPH2 RPL24 RPL23 RPL13A RPL17-C18ORF32 MRTO4 RPL7L1 RPL37A RPL26 RPL28 RPL22L1 RPL27 RPL29 RPL13AP3 NHP2 RPL26L1
8.409175,-1.127367,Cluster 3,mitochondrial intermembrane space (GO:0005758),COA4 PNPT1 PRELID2 PRELID1 AGK TIMM29 HSD3B1 UQCC2 HSD3B2 SIRT5 NME4 TIMM23 HAX1 PINK1 ARL2BP CYCS NDUFS1
8.153569,-1.3458494,Cluster 3,cytosolic proteasome complex (GO:0031597),PSMC6 PSMC4 PSMC5 PSMC2 PSMC3 PSMD1 PSMC1 PSMD2 UBQLN4
9.685813,-1.8102893,Cluster 3,small ribosomal subunit (GO:0015935),RPS8 IMP3 RPS9 RPS6 MCTS1 RPS7 MRPS18C HBA1 MRPS18A RPS3A RPSA LARP4 MRPS6 MRPS5 MRPS9 RPS26P11
8.052314,-1.0618495,Cluster 3,mitochondrion (GO:0005739),STARD4 STARD5 ENDOG CASP8AP2 NIPSNAP3A NIPSNAP3B STARD6 BAD NGDN CKMT1A GDAP1 HSPE1 MTHFD2 SCO2 XPNPEP3 ETHE1 SCO1 UQCRC2 TMEM126B BAX TMEM126A UQCRC1 CIAPIN1 FSIP2 LETMD1
8.901221,-1.9129496,Cluster 3,spliceosomal tri-snRNP complex (GO:0097526),SNRPN LSM2 LSM6 LSM5 LSM4 LSM3 PRPF6 PRPF18 PRPF8 LSM8 LSM7 PRPF4 PRPF3 SNRPGP15 PRPF31 PPIH NAA38 SNRPG SNRPE SNRNP200 SNRPB
9.035347,-1.8277189,Cluster 3,small nuclear ribonucleoprotein complex (GO:0030532),SNRPN SF3B3 SF3A2 ARFGEF1 GEMIN4 LSM6 LSM11 LSM10 SNRPD3 SNRPD2 PRPF4 SNRPD1 TGS1 SNRPF SNRPG SNRPA1 SLU7 SNRPE SNRPB
8.847879,-0.9038576,Cluster 3,integral component of mitochondrial inner membrane (GO:0031305),COA3 AGK COA1 APOOL UQCC3 PET100 IMMT TIMM23 TMEM177 SLC25A19 COQ2 SMDT1 TMEM11 SCO2 DNAJC11 SCO1 L2HGDH MCU
9.256036,-1.5797242,Cluster 3,U6 snRNP (GO:0005688),LSM8 LSM7 DDX39B LSM2 LSM6 LSM5 LSM4 LSM3
8.927439,-1.8804643,Cluster 3,U4/U6 x U5 tri-snRNP complex (GO:0046540),SNRPN LSM2 LSM6 LSM5 LSM3 PRPF6 PRPF18 PRPF8 LSM8 PRPF4 PRPF3 PRPF31 PPIH NAA38 SNRPE SNRNP200 SNRPB
8.144628,-1.2786903,Cluster 3,mitochondrial inner membrane (GO:0005743),RSAD2 CKMT1A MRPS18C MRPS18B MRPS18A GCAT AFG3L2 YME1L1 UQCRC2 TMEM126B UQCRC1 LETMD1
8.3541565,-1.801368,Cluster 3,box C/D snoRNP complex (GO:0031428),NOP58 FBLL1 SNU13 FBL RRP9 NOP56
9.224336,-1.4582351,Cluster 3,U7 snRNP (GO:0005683),LSM11 LSM10 SNRPD3 SNRPF SNRPG SNRPE SNRPB
8.6824255,-1.0666124,Cluster 3,ribonuclease P complex (GO:0030677),POP7 TRMT10C POP5 POP4 RPP30 RPP21 POP1 KIAA0391 RPP25 RPP14 HSD17B10
7.535308,-1.3994056,Cluster 3,pre-snoRNP complex (GO:0070761),NOP58 NUFIP1 ZNHIT6 PIH1D1 TAF9 NOP56
9.230372,-1.3449966,Cluster 3,"mitochondrial proton-transporting ATP synthase complex, coupling factor F(o) (GO:0000276)",ATP5L2 ATP5H ATP5L ATP5G3 ATP5F1 ATP5G2 ATP5G1
9.095863,-1.8101496,Cluster 3,U2-type spliceosomal complex (GO:0005684),PPIL1 SNRPN CDC5L CWC15 PRPF40B PRPF40A CRNKL1 SRRM2 PRPF18 PRPF19 SYF2 SNRPF NAA38 SNRPG SNRPE SNRPB PPIE LUC7L3 RBM22 LUC7L2 SNRPC
8.712842,-0.9954803,Cluster 3,multimeric ribonuclease P complex (GO:0030681),POP7 RPP40 POP5 POP4 RPP30 RPP21 POP1 RPP25 RPP14 RPP38
8.373133,-1.2100372,Cluster 3,mitochondrial envelope (GO:0005740),COA4 PNPT1 PRELID2 PRELID1 AGK TIMM29 HSD3B1 UQCC2 HSD3B2 SIRT5 NME4 SDHD TIMM23 CIDEA HAX1 PINK1 ARL2BP BAX PPIF CYCS NDUFS1
7.868717,-1.0445782,Cluster 3,integral component of peroxisomal membrane (GO:0005779),FIS1 SLC27A2 PEX11A PEX11B PEX3 PEX12 PEX2 PEX13 PEX16 SLC25A17 PXMP2 FAR1 FAR2 ABCD1
7.986819,-1.0630107,Cluster 3,"DNA-directed RNA polymerase II, holoenzyme (GO:0016591)",POLR2J2 MED4 POLR2J3 EDF1 GTF2F1 PEX2 GTF2F2 MED6 MED8 SUPT3H TAF6L KAT2A CDK7 GTF2H2C TP53
9.140844,-1.0855062,Cluster 3,mitochondrial respiratory chain complex I (GO:0005747),NDUFC2 NDUFC1 NDUFS8 NDUFS7 NDUFS6 NDUFS5 NDUFS4 NDUFS3 NDUFS2 NDUFS1
7.7340355,-1.1897941,Cluster 3,signal recognition particle (GO:0048500),SRP19 SRP9 SRP72 SRP54 DERL2 DERL3 SRP68 SRP14 DERL1
8.400918,-1.903207,Cluster 3,U2-type catalytic step 2 spliceosome (GO:0071007),AQR PPIL1 BUD31 CDC5L CWC15 CRNKL1 CDC40 SRRM2 XAB2 PRPF8 SNW1 SNRNP40 PRPF19 SYF2 SNRPF SNRPA1 SNRPE SNRPB PPIE RBM22
8.860137,-1.9128098,Cluster 3,spliceosomal snRNP complex (GO:0097525),SNRPN PRPF40B PRPF40A PHF5A SNRPA PRPF18 DDX39B TEP1 CD2BP2 SNRPF PPIH NAA38 SNRPG SNRPE SNRPB LUC7L3 LUC7L2 SNRPC
7.7235756,-1.1965549,Cluster 3,"signal recognition particle, endoplasmic reticulum targeting (GO:0005786)",SRP19 SRP9 SRP72 SRP54 SRP68 SRP14 
9.180041,-1.1110651,Cluster 3,mitochondrial respiratory chain complex III (GO:0005750),MT-CO1 UQCRB UQCC3 UQCR10 BCS1L UQCRH UQCRHL UQCRQ UQCRC2 UQCRFS1 UQCRC1 PMPCB CYC1 MT-CYB
9.1027,-1.578551,Cluster 3,precatalytic spliceosome (GO:0071011),PRPF38B PRPF38A LSM2 CWC15 CRNKL1 LSM3 PHF5A LSM8 SMU1 SNRNP40 TEP1 SNRPGP15 PRPF31 SNRPG SNRPE NSRP1
8.442178,-1.917651,Cluster 3,spliceosomal complex (GO:0005681),SNRPN GPKOW CWC15 CRNKL1 WBP11 DHX40 PHF5A HNRNPM SNRPA DDX39A DDX39B WDR83 TEP1 SNRPF HNRNPC PPIH SNRPG SNRNP25 SNRPE SNRPB IVNS1ABP SNRPC
9.684655,-1.7926619,Cluster 3,large ribosomal subunit (GO:0015934),RPL22 COA1 RPL21 RPL36A-HNRNPH2 RPL24 RPL23 RPL13A RPL17-C18ORF32 MRTO4 RPL7L1 RPL37A RPL26 RPL28 RPL22L1 RPL27 RPL29 RPL13AP3 NHP2 RPL26L1
8.874683,-0.873025,Cluster 3,mitochondrial large ribosomal subunit (GO:0005762),NSUN3 NSUN4 MRPL28 MRPL27 MRPL24 MRPL22 MRPL23 MRPL32 MRPL30
8.72196,-1.0182036,Cluster 3,mitochondrial small ribosomal subunit (GO:0005763),MRPS27 MRPS28 MRPS26 MRPS24 MRPS21 MRPS18C MRPS22 MRPS18B MRPS2 MRPS18A MRPS7 MRPS6 MRPS5 MRPS9
8.0966625,-1.285321,Cluster 3,nuclear proteasome complex (GO:0031595),PSMC6 PSMD12 PSMC4 PSMC5 PSMC2 PSMC3 PSMC1 UBQLN4
7.282873,-1.1278131,Cluster 3,Cdc73/Paf1 complex (GO:0016593),SETD5 WDR61 CTR9 LEO1 RTF1 PEX2 CDC73 PAF1
9.699361,-1.8174335,Cluster 3,cytosolic small ribosomal subunit (GO:0022627),RPS8 RPS9 RPS6 MCTS1 RPS7 MRPS18C HBA1 MRPS18A RPS3A RPSA LARP4 MRPS5 MRPS9 RPS26P11
7.695902,-1.0956329,Cluster 3,core mediator complex (GO:0070847),MED14 MED4 MED31 MED10 MED17 MED6 MED8 MED18
8.526474,-1.9623843,Cluster 3,U5 snRNP (GO:0005682),SNRPN MAPKBP1 DDX23 WDR62 PRPF6 NWD1 PRPF18 PRPF8 DCAF4 SNRNP40 SNRPD3 SNRPD2 TEP1 SNRPD1 CD2BP2 SNRPGP15 NAA38 SNRPG TXNL4B SNRPE SNRNP200 TXNL4A SNRPB
8.643552,-0.9776261,Cluster 3,mitochondrial inner membrane presequence translocase complex (GO:0005744),PAM16 TIMM23 DNAJC15 TIMM10 TIMM21 DNAJC19 TIMM50 GRPEL2 GRPEL1 TIMM23B TIMM17B TIMM17A SLC25A6
9.029511,-0.90872216,Cluster 3,integral component of mitochondrial membrane (GO:0032592),COA3 AGK COA1 UQCC3 MUL1 TOMM20L TIMM23 GDAP1 TMEM177 PINK1 COQ2 SMDT1 SCO2 SCO1 TOMM7 MCU
9.229658,-1.3864905,Cluster 3,MICOS complex (GO:0061617),APOO CHCHD6 CHCHD3 APOOL DNAJC11 IMMT
9.349287,-1.2809511,Cluster 3,mitochondrial proton-transporting ATP synthase complex (GO:0005753),ATPIF1 ATP5L ATP5A1 USMG5 ATP5C1 ATP5J ATP5I ATP5G3 ATP5F1 ATP5G2 ATP5O ATP5G1 MT-ATP8 ATP5J2 ATP5D MT-ATP6 ATP5B ATP5L2 ATP5H C14ORF2 ATP5E PPIF
8.09705,-1.1833445,Cluster 3,mitochondrial matrix (GO:0005759),MECR ACOT9 PDHX PHYKPL ADHFE1 HSPE1 ETNPPL PC MTHFD2 SCO2 PPA2 KARS LACTB2 MTHFD2L FDX1 ETHE1 FDX2 ACOT2 TFAM SUCLG2 DNA2 SUCLG1
9.553209,-1.6250232,Cluster 3,polysomal ribosome (GO:0042788),RPL41 RPL24 LARP4B NR0B1 RPS26 RPS29 RPS28 RPS21 RPS23
9.34451,-1.2625798,Cluster 3,mitochondrial respiratory chain complex IV (GO:0005751),COX8A COX5A COX7C COX8C MT-CO1 MT-CO2 COX4I2 NDUFA4 COX6A2 COX5B COX6A1 C15ORF48 NDUFA4L2 UQCRC2 UQCRFS1 COX4I1 MT-CO3
8.559849,-1.582154,Cluster 3,DNA-directed RNA polymerase I complex (GO:0005736),IPPK ZNRD1 POLR1A POLR1B TWISTNB POLR1C POLR1D POLR2E POLR1E POLR2F POLR2H POLR2K POLR2L
9.08471,-1.3793373,Cluster 3,U12-type spliceosomal complex (GO:0005689),ZRSR2 ZCRB1 PHF5A LSM7 SNRPGP15 SNRPF SNRPG RBM41 SNRNP48 SNRNP25 SNRPE SNRPB
9.722828,-1.867507,Cluster 3,cytosolic part (GO:0044445),RPS8 RPL22 RPL21 RPS9 RPL36A-HNRNPH2 RPS6 RPL24 MCTS1 RPL23 RPS7 MRPS18C MRPS18A RPSA LARP4 RPL17-C18ORF32 MRTO4 CCT6B CCT6A PSMC6 PSMC4 PSMC5 RPL7L1 PSMC2 PSMC3 RPL26 PSMC1 RPL28 RPL22L1 RPL27 RPL29 RPL13AP3 NHP2 RPL26L1
9.732893,-1.8762974,Cluster 3,cytosolic ribosome (GO:0022626),RPS8 RPL22 RPL21 RPS9 RPL36A-HNRNPH2 RPS6 RPL24 MCTS1 RPL23 RPS7 MRPS18C MRPS18A RPSA LARP4 RPL17-C18ORF32 MRTO4 RPL7L1 RPL26 RPL28 RPL22L1 RPL27 RPL29 RPL13AP3 NHP2 RPL26L1
8.935776,-0.97659427,Cluster 3,intrinsic component of mitochondrial inner membrane (GO:0031304),COA3 AGK COA1 UQCC3 PET100 TIMM23 TMEM177 SLC25A19 COQ2 SMDT1 TMEM11 SCO2 SCO1 L2HGDH MCU
9.014513,-0.9188343,Cluster 3,DNA-directed RNA polymerase complex (GO:0000428),POLR2J2 POLR2J3 POLRMT ZNRD1 POLR2C TWISTNB POLR1C POLR1D POLR2E POLR2F POLR3H POLR2G POLR2I POLR3K POLR2J POLR2L
9.009736,-1.8826907,Cluster 3,methylosome (GO:0034709),PRMT5 PRMT1 WDR77 SNRPD3 CLNS1A SNRPD2 SNRPD1 SNRPF SNRPG ERH SNRPE SNRPB
9.116484,-1.9277567,Cluster 3,U2 snRNP (GO:0005686),SF3B5 SF3B6 SNRPN SF3A2 HTATSF1 PHF5A RBMX2 SNRPD3 SNRPD2 SNRPD1 CCDC97 SNRPGP15 SNRPB2 NAA38 SNRPG SNRPA1 SF3B1 SNRPE SF3A1 SF3B2 SNRPB
8.699491,-1.031494,Cluster 3,nucleolar ribonuclease P complex (GO:0005655),POP7 RPP40 RPP30 RPP21 POP1 RPP38
8.698738,-1.3891302,Cluster 3,small nucleolar ribonucleoprotein complex (GO:0005732),NOP58 MPHOSPH10 LSM6 FBLL1 SNU13 FBL RRP9 SNRNP40 NAF1 NOP10 NHP2 NOP56
9.068209,-1.7291685,Cluster 3,U4 snRNP (GO:0005687),SNRPN DDX39B SNRPD3 SNRPD2 SNRPD1 SNRPGP15 PRPF31 SNRPF NAA38 SNRPG SNRPE SNRPB
7.832675,-1.1472044,Cluster 3,nuclear exosome (RNase complex) (GO:0000176),DIS3 EXOSC8 EXOSC7 EXOSC6 EXOSC5 C1D EXOSC9 EXOSC4 EXOSC3 EXOSC2 MPHOSPH6 EXOSC1
3.557494,-0.6413578,Cluster 4,nuclear inner membrane (GO:0005637),SMAD3 TMEM120B CBX3 SMAD1 ATP1B4 ATP11B SIRT1 LEMD3 LEMD2 SUN5 TERB1 TERB2 DPY19L1 DPY19L2 DPY19L3 DPY19L4 IFI27 MATR3
4.0151896,1.1677604,Cluster 4,Rad51B-Rad51C-Rad51D-XRCC2 complex (GO:0033063),RAD51C RAD51B RAD51 RAD51D XRCC3 DMC1 XRCC2
2.569235,0.935836,Cluster 4,AP-3 adaptor complex (GO:0030123),VPS41 VPS33B AP3S1 VPS33A AP3D1 AP3S2
5.1408267,0.8389034,Cluster 4,Golgi cisterna membrane (GO:0032580),GOLGA8T GOLGA8S GOLGA8K GOLGA8N NSG2 GOLGA8M GOLGA8O GOLGA2P5 GOLGA8R GOLGA8Q GOLGA6B GOLGA6A GOLGA6D GOLGA8F TMEM115 GOLGA8DP GOLGA6C GOLGA8H GOLGA8J GOLGA8B GOLGA8A
4.44359,1.2748083,Cluster 4,lateral element (GO:0000800),FAM9A RAD51 FAM9C BLM FAM9B SYCP3 SYCP2 MEI4 BRCA1 BRCA2
3.3707705,1.1369878,Cluster 4,centrosome (GO:0005813),PCGF5 TRIP4 IFT81 IFT80 ZFYVE26 DYNC1LI1 ZFYVE19 DYNC1LI2 HSPA1A POLR3H CEP85 RABL6 CEP89 HSPA1B
4.2357097,0.70673645,Cluster 4,centriolar satellite (GO:0034451),CCDC113 CCDC13 CCDC14 MBD1 CEP131 OFD1 SPAG5 MSS51 PAX2 KRT18 ZMYND10 EXOC7 SSX2IP ALDOB
3.9852633,1.0806383,Cluster 4,Cul5-RING ubiquitin ligase complex (GO:0031466),CUL5 ELOB RNF7 ARIH2 ASB4 RBX1
3.7864432,1.1147832,Cluster 4,acetylcholine-gated channel complex (GO:0005892),CHRNB3 CHRNA2 CHRNA1 CHRNB2 CHRNA4 CHRNA3 CHRNB4 CHRNA6 CHRNA5 STXBP5 CHRNA7 CHRNA9 CHRND CHRNE CHRNG CHRFAM7A CHRNB1
5.1488366,0.82746476,Cluster 4,Golgi cisterna (GO:0031985),GOLGA8T GOLGA8S YIPF1 YIPF2 YIPF6 GOLPH3L GOLGA8K GOLGA8N GOLGA8M RAB30 GOLGA8O GOLGA2P5 GOLGA8R GOLGA8Q RAB34 GOLGA8F GOLGA8H GOLGA8J GOLT1A GOLGA8B GOLGA8A
3.8739414,0.1494543,Cluster 4,endoribonuclease complex (GO:1902555),DHX9 POP4 DICER1 TSEN2 TSEN54 TARBP2 ZFP36 AGO4 CLP1 AGO2 AGO3 AGO1 PRKRA
5.184596,0.8458562,Cluster 4,integral component of cytoplasmic side of endoplasmic reticulum membrane (GO:0071458),SPPL2C SPPL2B HM13 SPPL2A PKD2 SPPL3
3.957115,0.9602612,Cluster 4,microtubule cytoskeleton (GO:0015630),TEX35 UPF3B EML1 EML2 SYTL4 EML3 EML4 EML5 EML6 TEK CEP85 CDK16
4.0707445,0.5588144,Cluster 4,microtubule organizing center part (GO:0044450),STARD9 SPICE1 NIN IFT88 CCP110 HSPA1A CEP83 CEP85 CNTROB MPHOSPH9 FAM92A CCDC151 CEP89 RAN HSPA1B
3.4270334,1.3602954,Cluster 4,cytoplasmic dynein complex (GO:0005868),DYNC2H1 DYNLL1 DYNLT3 DCTN4 DYNLL2 WDR34 TOPORS DYNC1LI1 SNX4 DYNC1LI2 NUDCD3 TPR WDR60 TCTEX1D2 DYNC2LI1 DYNLRB1 DYNLRB2 DYNLT1 DYNC1I2 DYNC1H1 DYNC1I1
4.7602615,0.78526664,Cluster 4,axonemal microtubule (GO:0005879),ARFGEF2 ARL6 CEP162 CFAP206 SAXO1 SAXO2
3.864034,0.16622815,Cluster 4,RISC complex (GO:0016442),DDX6 AGO4 AGO2 AGO3 DICER1 AGO1 EIF4E LIMD1 DCP2
4.3951616,1.4711742,Cluster 4,P granule (GO:0043186),TDRKH PIWIL2 PIWIL4 DDX4 TDRD9 TDRD5 CARHSP1 TDRD1 HENMT1 ASZ1 MOV10L1 SNRPGP15 MAEL SNRPG PIWIL1 EXD1
3.8555505,0.12856251,Cluster 4,RISC-loading complex (GO:0070578),ZFP36 DHX9 AGO4 AGO2 AGO3 DICER1 AGO1 PRKRA TARBP2
3.8265994,0.21217948,Cluster 4,RNAi effector complex (GO:0031332),DDX6 AGO4 AGO2 AGO3 DICER1 AGO1 EIF4E LIMD1 DCP2
4.3690066,1.3694332,Cluster 4,pi-body (GO:0071546),TDRKH PIWIL2 TDRD1 DDX4 ASZ1 MOV10L1 TDRD5
3.2188396,1.451227,Cluster 4,Cul3-RING ubiquitin ligase complex (GO:0031463),KLHL26 BTBD18 KLHL28 KLHL29 KLHL2 KLHL22 KLHL23 KLHL3 KLHL4 KLHL24 KLHL5 KLHL25 KLHL20 KBTBD12 RBX1 KLHL21 KBTBD11 KLHL1 KBTBD6 KBTBD7 KLHL7 KLHL8 KBTBD2 KLHL9 KBTBD3 SPOPL KBTBD8
4.852862,0.8098471,Cluster 4,endoplasmic reticulum exit site (GO:0070971),CFAP73 OTOR MIA SEC16B SEC16A PDCD6IP CTAGE1 CTAGE6 CTAGE5 CTAGE4 CTAGE9 MPPE1 CTAGE8 PREB CTAGE15
3.154017,1.6003087,Cluster 4,filopodium tip (GO:0032433),NLGN1 FMR1 MYO3A ABI1 ABI2 MYO10 MORN4 MYO5A CIB1 VIL1
3.8424444,0.056436937,Cluster 4,pericentriolar material (GO:0000242),MBD1 TNKS RABL2B TUBE1 TNKS2 LCK NEDD1 NIN HOOK3 WDR60 CDK5RAP2 NEK1 CEP152 BBS9 CEP85 BBS4
4.272009,1.4422239,Cluster 4,synaptonemal structure (GO:0099086),UBE2I MLH1 SYCP3 SYCP2 SYCP1 TEX11 P3H4 MLH3 CCNB1IP1 RNF212 RNF212B STAG3 MSH4 MSH5 FKBP6
4.365297,1.4015483,Cluster 4,germ plasm (GO:0060293),PIWIL2 PIWIL4 DDX4 TDRD9 CARHSP1 TDRD1 HENMT1 MOV10L1 SNRPGP15 MAEL SNRPG PIWIL1 EXD1
5.0598717,0.8947426,Cluster 4,meiotic cohesin complex (GO:0030893),REC8 STAG3 RAD21L1 SMC1B SMC1A SMC3
5.137903,0.78426343,Cluster 4,cis-Golgi network (GO:0005801),GOLGA8T GOLGA8S GBF1 B3GAT3 SLC35C2 GOLGA8K GOLGA8N GOLGA8M RAB30 GOLGA8O COPZ2 GOLGA2P5 AZIN2 GOLGA8R GOLGA8Q GOLGA6B IFT20 GOLGA6A BCL9 TRAPPC6B GOLGA6D GOLGA8F TRAPPC6A GOLGA8DP GOLGA6C HOOK3 GOLGA8H GOLGA8J ANGEL1 MPPE1 GOLGA8B RETREG1 GOLGA8A
3.4502866,1.2604074,Cluster 4,shelterin complex (GO:0070187),ACD TINF2 TERF1 TERF2 TERF2IP POT1
3.3894541,1.092683,Cluster 4,microtubule organizing center (GO:0005815),PCGF5 TRIP4 IFT81 UPF3B IFT80 ZFYVE26 SYTL4 DYNC1LI1 ZFYVE19 DYNC1LI2 TEK HSPA1A POLR3H CEP85 RABL6 CEP89 HSPA1B
3.9670603,1.2309308,Cluster 4,synaptonemal complex (GO:0000795),FAM9A UBE2I FAM9C MLH1 FAM9B TEX11 TEX12 P3H4 MLH3 CCNB1IP1 RAD51 STAG3 MSH4 MSH5 C14ORF39 FKBP6
5.0183372,0.73570716,Cluster 4,Golgi cis cisterna (GO:0000137),GOLGA8T GOLGA8S GOLGA8K GOLGA8N NSG2 GOLGA8M GOLGA8O GOLGA2P5 GOLGA8R GOLGA8Q TMEM59 GOLGA6B GOLGA6A GOLGA6D GOLGA8F GOLGA8DP GOLGA6C GOLGA8H GOLGA8J LLGL1 GOLT1A GOLGA8B GOLGA8A
5.070714,0.8270745,Cluster 4,RNA polymerase II transcription factor complex (GO:0090575),TLE4 TLE3 MED4 TLE1 FOXH1 POU2AF1 GTF2F1 HIPK2 HNRNPAB GTF2F2 MED6 MED8 TP53
4.1822968,0.6799919,Cluster 4,axonemal dynein complex (GO:0005858),DNAH5 DNAH2 DNAH3 DNAH8 DNAH17 CCDC114 DNAH7 DNHD1 WDR78 NME8 DYNLRB1 DNAL1 DYNLRB2 DNAI1 DNAH1 DNAI2
2.7917705,1.4100341,Cluster 4,messenger ribonucleoprotein complex (GO:1990124),CPEB2 CPEB1 FMR1 PKP3 CPEB4 CPEB3 PKP1
2.9007044,1.9906989,Cluster 4,spectrin-associated cytoskeleton (GO:0014731),SPTA1 EPB41 DMTN ANK3 RHBG ANK1 SPTB SPTBN1
4.3524513,0.7723158,Cluster 4,centriole (GO:0005814),HSPA6 STARD9 OFD1 SPICE1 SIRT2 WDR34 AHI1 NIN IFT88 CENPJ CCP110 HSPA1A CEP83 CEP162 CEP41 SAXO1 CNTROB SAXO2 MPHOSPH9 SDCCAG8 FAM92A CCDC151 CEP89 RAN HSPA1B
4.06119,1.0808996,Cluster 4,CatSper complex (GO:0036128),CATSPER2 CATSPERB CATSPER1 CATSPER4 CATSPERD CATSPER3 CATSPERE CATSPERG HSPA2 CATSPERZ
4.568383,0.7769887,Cluster 4,manchette (GO:0002177),LRGUK RIMBP3 IQCG CCDC181 PPP1R42 RIMBP3C RIMBP3B
3.9126618,1.05211,Cluster 4,Cul2-RING ubiquitin ligase complex (GO:0031462),ZER1 ZYG11B ZYG11A GLMN CUL2 RNF7 COMMD1 RBX1 ELOB ARIH1 ZSWIM8 ZSWIM5 ASB4 ZSWIM6 ZSWIM4
3.993083,1.1331058,Cluster 4,Gemini of coiled bodies (GO:0097504),NPAT GEMIN2 HABP4 GEMIN6 GEMIN7 SMN1 ZPR1
4.1848164,0.7195377,Cluster 4,outer dynein arm (GO:0036157),DNAH5 DNAH8 NME8 CCDC114 DYNLRB1 DNAL1 DYNLRB2 DNAI1 DNAI2
3.9229455,1.1661178,Cluster 4,BLOC-1 complex (GO:0031083),SNAP25 SNAP47 BCAS4 SNAPIN DTNBP1 BLOC1S5-TXNDC5 STX12 BLOC1S5 BLOC1S6 BLOC1S1 BLOC1S2 BLOC1S3 BLOC1S4 KXD1 PI4K2A
3.6519442,0.6736915,Cluster 4,MutLalpha complex (GO:0032389),PMS2P11 WRN MLH1 PMS2P5 PMS2P3 PMS2P2 PMS2P1 PMS2 PMS1
4.2351537,1.3875211,Cluster 4,chromatoid body (GO:0033391),PIWIL2 DDX25 TDRD7 TDRD6 TDRD5 CLOCK PIWIL1 ARNTL
2.6408489,1.0889868,Cluster 4,elongin complex (GO:0070449),ELOA3B ELOA2 ELOA ELOB ELOA3 ELOC EPOP ELOA3D
