x,y,cluster,term,genes
2.0475125,-0.1771774,Cluster 0,GID4,MKLN1 RMND5A ARMC8 MAEA YPEL5 RANBP10 
2.0432885,-0.37699166,Cluster 0,PPP6R2,PPP6C ANKRD28 PPP6R1 PPP6R3 ANKRD44 
1.743658,0.70296717,Cluster 0,RPRD1B,CTDP1 RPRD1A RPRD2 POLR2G RPAP2 
0.9474326,0.8009258,Cluster 0,TUBG1,MZT2B NEDD1 MZT2A NME7 TUBGCP2 TUBGCP3 TUBGCP6 TUBGCP4 TUBGCP5 MZT1 
2.5535421,-0.17882188,Cluster 0,MED27,MED13 CDK19 MED23 MED14 MED25 MED17 MED12L MED29 
2.0784392,-0.22715841,Cluster 0,RANBP9,MKLN1 GID4 WDR26 RMND5A GID8 ARMC8 MAEA YPEL5 RANBP10 
1.9275576,0.5918045,Cluster 0,CDK19,MED23 MED14 MED17 MED12L MED29 
2.3590133,1.1498742,Cluster 0,SGF29,TAF5L ZZZ3 TADA2A DR1 DTNB C1ORF122 KIF2C SUPT20H RAB11FIP5 SUPT7L MBIP SUPT3H 
2.281222,-0.40816647,Cluster 0,USP7,ZNF609 BCL6 TRIM27 ETV6 ACTL8 DHX40 
2.4703572,-0.6880438,Cluster 0,AFF4,AFF1 CCNT2 CCNT1 MLLT1 ELL2 ELL3 
1.2201599,0.74811304,Cluster 0,ETFA,QDPR LYRM5 MPST C8ORF82 BPNT1 LDHAL6A SOD2 
1.2508352,-0.2637743,Cluster 0,PSMB5,B4GALT4 AKIRIN2 PSMB3 PSME4 PSME2 UBFD1 FBXO7 PSMG2 PSME1 TTF2 PRSS3 PSMB9 
1.6478173,0.76315653,Cluster 0,MAGEA1,ANKRD17 MAGEB3 FBXL18 MAGEB4 HSPBAP1 ANKHD1 MAGEB6 
1.4448248,0.86747617,Cluster 0,ZKSCAN4,ZNF397 ZSCAN30 ZBED9 ZNF174 SCAND1 ZKSCAN3 ZNF24 
1.5893954,0.25969645,Cluster 0,STX5,VAMP8 GOSR1 STX8 GOSR2 STX7 STX6 VTI1A STX10 SEC22B 
1.9013519,-0.82519704,Cluster 0,TPRN,PPP1CC PPP1R18 NEXN MYO5A CALML3 PPP1CA 
0.9392436,0.80953294,Cluster 0,NEDD1,MZT2A TUBGCP2 TUBGCP3 TUBGCP6 TUBGCP4 TUBGCP5 MZT1 
2.294736,0.8704482,Cluster 0,ING1,SAP130 BRMS1 SIN3A BRMS1L SUDS3 ARID4A SAP30 
1.5786812,0.07848107,Cluster 0,PRKAR2B,AKAP13 AKAP1 AKAP14 AKAP7 PRKX AKAP2 
1.9626405,-0.4988043,Cluster 0,AP1S2,AFTPH HEATR5B AP1G2 SYNRG AP1AR AP1M2 
1.6238168,-0.5722823,Cluster 0,ARPC2,ARPC1A ACTR3 ACTR2 ARPC3 ARPC1B 
0.99224263,0.82091826,Cluster 0,MZT2B,NEDD1 MZT2A NME7 TUBGCP2 TUBGCP3 TUBGCP6 TUBGCP4 TUBGCP5 MZT1 
1.7663035,0.71997017,Cluster 0,SMC6,NSMCE4A SLF2 NSMCE3 NSMCE2 NSMCE1 SMC5 
1.5766559,0.8324182,Cluster 0,CSPP1,KIAA1328 GAN CCDC138 CCDC14 FGFR1OP 
1.2576308,-0.36875716,Cluster 0,PSMB4,CDK18 AKIRIN2 CEP120 PSMB9 PSMA8 PSMB10 PSMA7 PSMB3 PSME4 PSME2 PSMF1 FBXO7 PSMG2 PSME1 
1.2665098,0.8435941,Cluster 0,TRAPPC1,TRAPPC2L TRAPPC8 TRAPPC5 TRAPPC11 TRAPPC2B TRAPPC12 
1.2122061,0.42735928,Cluster 0,ZNF24,ZBED9 ZNF174 ZSCAN32 SCAND1 ZNF446 PGBD1 
1.5080659,0.049100578,Cluster 0,EIF4E,EIF4ENIF1 TPPP3 ARPC2 EIF4EBP1 ANGEL1 ARPC5 EIF4G3 
2.1632254,0.8087464,Cluster 0,CCNH,CDK7 ERCC5 ERCC2 MNAT1 GTF2H5 
1.1675452,-0.08926891,Cluster 0,CUL3,KBTBD6 BTBD1 KCTD20 KLHL13 RBX1 KLHL42 
1.2226251,0.7593894,Cluster 0,GTF2H1,ERCC3 GTF2H2 GTF2H3 GTF2H4 GTF2H5 
1.5957487,0.83952177,Cluster 0,USP46,RAD51AP1 PHLPP1 WDR48 PHLPP2 DMWD WDR20 
1.380725,0.018143265,Cluster 0,GDPD1,ORM2 ORM1 HBB HP APOA2 CP CFB 
1.7182884,-0.46899673,Cluster 0,GDI1,RAB12 RAB35 RAB4A RAB8B RAB6A 
1.267278,-0.2917009,Cluster 0,PSMA3,PSMB3 PSMB1 PSME4 PSME2 FBXO7 PSMG2 PSME1 PSMB9 PSMB10 
2.5675309,-0.12340967,Cluster 0,MED20,MED13 CDK19 MED23 MED14 MED25 MED17 MED27 MED12L MED29 
1.2271191,-0.31033424,Cluster 0,PSMA6,PSMB3 PSME4 PSME2 FBXO7 PSMG2 PSMB9 PSMB10 
0.8997814,0.8541028,Cluster 0,TUBGCP3,MZT2A NME7 TUBGCP2 TUBGCP6 TUBGCP4 MZT1 
1.6128393,0.16003649,Cluster 0,ICE2,BPIFA1 ICE1 MUC5AC MPO CTSG 
1.0278673,0.80219185,Cluster 0,TUBGCP6,MZT2A NME7 TUBGCP2 TUBGCP4 MZT1 
2.455602,-0.14719936,Cluster 0,WDR5,RBBP5 ASH2L BOD1 BOD1L1 ATN1 FAM199X KANSL1 KDM6A 
1.4047987,0.3375815,Cluster 0,VPS16,VPS41 TGFBRAP1 VPS33A VPS11 VPS18 
1.1624279,0.86801225,Cluster 0,JADE2,ING5 ING4 MEAF6 AARSD1 KAT7 
1.8769412,-0.5705539,Cluster 0,JUN,ATF2 FOSL2 ATF3 FOS ATF7 CREB5 
1.3515359,0.9365137,Cluster 0,TRAPPC2L,TRAPPC8 TRAPPC5 TRAPPC11 TRAPPC2B TRAPPC12 
1.5431849,-0.46566185,Cluster 0,ARPC5,ARPC1A ACTR2 TPPP3 ARPC3 ARPC2 ARPC1B ARPC5L 
0.8764168,0.7784688,Cluster 0,TUBGCP5,MZT2A NME7 TUBGCP2 TUBGCP3 TUBGCP6 TUBGCP4 MZT1 
1.7594641,0.6830074,Cluster 0,NEDD4L,WWOX HECW2 NEDD4 WWP1 WWP2 ITCH 
2.1916494,0.012758235,Cluster 0,MAGEA10,NCOA2 POU2F1 CRTC3 MAGEA9 ERI1 NRIP1 FAM216A FOXJ2 PHF8 MAGEA4 
2.0330746,-0.1966486,Cluster 0,GID8,MKLN1 GID4 RMND5A ARMC8 MAEA YPEL5 RANBP10 
1.2286472,-0.3170847,Cluster 0,PSMB2,PSMB8 PSMB3 PSME4 PSME2 FBXO7 PSMG2 PSMB9 PSMB10 
1.7064214,-0.5283976,Cluster 0,VPS35,SNX2 TBC1D5 SNX1 VPS26B VPS29 
1.7630239,0.52955335,Cluster 0,GFOD1,CARD10 GFOD2 RALGAPA1 RALGAPA2 FBXO9 
1.5803273,-0.52741134,Cluster 0,ARPC5L,ARPC1A ACTR2 ARPC3 ARPC2 ARPC1B 
1.0878426,0.74217635,Cluster 0,FASTKD2,TRUB2 MRPL4 WBSCR16 PTCD1 MTERF3 
2.355013,-0.63872075,Cluster 0,GRAP2,USP8 GAREM1 GAB2 GAB1 PTPN23 AKAP10 
1.7571337,-0.36337954,Cluster 0,STX7,BET1 STX16 STXBP5 VTI1B STX6 PTTG1IP STX10 NAPG VAMP4 
1.6944805,0.6238118,Cluster 0,KAT2A,ZZZ3 TADA2A KAT2B TADA3 YEATS2 SGF29 CSRP2BP MBIP 
1.9311574,-0.80864894,Cluster 0,VPS28,TSG101 UBAP1 MVB12A VPS37B VPS37C VPS37A 
2.3058863,0.8926454,Cluster 0,FAM60A,BRMS1 SIN3A BRMS1L SUDS3 ARID4A ING1 SAP30 
2.42384,-0.028870374,Cluster 0,RMND5A,MKLN1 ZCCHC14 ZMYND19 PAPD7 ARMC8 HBP1 MAEA YPEL5 WARS2 ZCCHC2 RANBP10 
1.2698178,0.500269,Cluster 0,COG2,COG8 COG7 COG6 COG4 COG3 COG1 
1.1594768,0.55788296,Cluster 0,ZSCAN30,ZNF397 ZBED9 ZNF174 ZSCAN32 SCAND1 
1.2260771,0.86398315,Cluster 0,ZRSR2,PDCD7 ZMAT5 CCDC97 RNPC3 SNRNP48 SNRNP35 
1.7272794,0.2646417,Cluster 0,SNAP29,SKA1 STXBP5 NAPA STX7 TRPM7 
1.7403203,0.7574042,Cluster 0,ZKSCAN3,ZSCAN30 ZBED9 ZNF174 ZSCAN32 SCAND1 ZNF24 PGBD1 
1.3817302,0.8578,Cluster 0,CSNK2A2,CSNK2B GPATCH2 FBRSL1 GPATCH2L VSX1 NKAP 
1.3178878,1.2956614,Cluster 0,BBOX1,RTFDC1 TBK1 CASP2 TANK AZI2 
2.2971933,-0.8512667,Cluster 0,PIK3R2,PIK3CB PIK3R1 PIK3CA WDR6 PIK3R3 
1.665934,0.098604344,Cluster 0,VAMP8,STX8 STX7 VTI1B STX6 VTI1A SNAP29 
2.3182502,0.88009256,Cluster 0,ARID4A,SAP130 SIN3A BRMS1L SUDS3 ARID4B SAP30 
1.3723109,0.44928792,Cluster 0,PPP1R7,PPP1CC PPP1R2 PPP1R11 PPP1CA PPP1CB 
1.8830234,0.13223112,Cluster 0,PPP1CA,CSRNP1 CSRNP2 PPP1R37 C2ORF74 PPP1R11 C20ORF27 YLPM1 PPP1CB PPP1CC TANC2 ZFYVE16 PPP1R3D KIF1BP PHACTR4 
1.3442171,-0.07952891,Cluster 0,IDH1,PKM IDH3G IDH2 HAAO HPD 
1.9458693,-0.83387494,Cluster 0,CERCAM,ARSA NAGLU FUT11 MAN2B1 SGSH 
1.7701159,0.74162245,Cluster 0,TADA3,TAF5L ZZZ3 TADA2A KAT2B YEATS2 SGF29 SUPT20H CSRP2BP SUPT7L MBIP SUPT3H 
1.5195432,0.17645124,Cluster 0,UBE2V1,FAHD1 QDPR HSD17B14 SORD DYNLRB2 UBE2N 
2.4592125,-0.022633506,Cluster 0,CNOT1,CNOT6L BTG3 FHL2 CNOT11 CNOT10 TOB2 TOB1 CNOT6 CNOT7 CNOT8 CNOT2 CNOT3 RQCD1 TNKS1BP1 
2.2370644,0.7241099,Cluster 0,CARNMT1,MKRN2 SARM1 LENG9 DTL TAB2 MAP3K7 NR3C2 RNF113A CNTLN 
2.2671728,0.82618237,Cluster 0,BRMS1,SAP130 SIN3A BRMS1L SUDS3 ARID4A ARID4B SAP30 
1.5456662,0.2628533,Cluster 0,IFT57,IFT20 IFT88 IFT22 TRAF3IP1 IFT172 HSBP1 IFT80 CLUAP1 
1.3884635,0.9075312,Cluster 0,ZSCAN20,ZNF397 ZNF232 ZBED9 ZNF197 ZNF263 ZNF394 ZNF174 ZNF24 ZSCAN30 ZSCAN21 ZSCAN23 ZSCAN22 SCAND1 ZKSCAN4 ZKSCAN3 ZNF449 ZSCAN29 ZSCAN18 ZNF215 ZNF202 ZNF213 PGBD1 
1.3288773,0.8569023,Cluster 0,ZNF397,ZBED9 ZNF197 ZNF174 ZNF26 ZNF444 
2.1128852,-0.18086864,Cluster 0,WDR26,MKLN1 GID4 RMND5A ZMYND19 GID8 ARMC8 MAEA YPEL5 RANBP10 
4.078978,-0.16450535,Cluster 0,INTS9,INTS12 INTS4 INTS6 INTS5 CPSF3L 
1.8106341,-0.6365226,Cluster 0,VTI1A,GOSR2 STX7 VTI1B STX6 STX10 
2.433679,-0.49326313,Cluster 0,CDK9,HEXIM2 AFF1 CCNT2 CCNT1 MLLT1 MLLT3 AFF4 AFF3 
1.9182649,-0.17115445,Cluster 0,RING1,RNF2 RYBP PCGF5 CBX4 YAF2 
1.1985539,0.35674122,Cluster 0,POMK,BRIP1 PKDCC TMEM120A S1PR2 SLC35F2 
1.6335094,1.5046085,Cluster 0,TAF6L,TAF5L TADA1 SUPT20H SUPT7L SUPT3H 
1.6425581,0.15745544,Cluster 0,SMU1,IK DDX5 DDX17 DDX43 DENR 
2.2135177,-0.096001595,Cluster 0,CTBP1,ZEB1 ZBTB18 TRPS1 RREB1 HIC2 
1.3104042,0.37745267,Cluster 0,COG4,ZW10 COG8 COG7 COG6 XPO7 COG3 COG1 
1.3383548,0.5069389,Cluster 0,COG5,COG8 COG7 COG6 COG4 COG3 COG2 COG1 
1.7820733,-0.47334403,Cluster 0,STX8,GOSR1 STX7 VTI1B STX6 VTI1A STX10 VAMP4 
2.3129675,-0.23097236,Cluster 0,PCGF1,RYBP KDM2B BCL6 YAF2 BCOR BCORL1 ACTL8 
1.3372425,0.43623036,Cluster 0,TSC22D4,TSC22D2 WNK2 WNK3 TSC22D3 TTL NRBP1 
2.4835944,-0.30631772,Cluster 0,MED13,CDK19 MED23 MED14 MED25 MED17 MED12L MED29 
1.7042714,0.74418217,Cluster 0,SIN3B,GATAD1 MORF4L1 PHF12 EMSY KDM5A 
1.8714104,-0.6000146,Cluster 0,TNFSF13B,FAM118A PDSS1 MAP3K15 MAP3K5 MAP3K6 FAM160B1 
1.862459,-0.6728758,Cluster 0,STX12,GOSR1 STX6 VTI1A STX10 OPTN TBC1D17 
2.858859,-0.50730646,Cluster 0,CNOT10,CNOT6L CNOT6 CNOT7 CNOT8 CNOT2 CNOT3 RQCD1 CNOT11 TNKS1BP1 
1.1610448,0.76850015,Cluster 0,TRAPPC3,TRAPPC2L TRAPPC4 TRAPPC1 TRAPPC8 TRAPPC5 TRAPPC11 TRAPPC12 
2.666159,0.08292146,Cluster 0,MED6,MED13 CDK19 MED23 MED14 MED25 MED20 MED17 MED27 MED12L MED29 
1.2461172,-0.30235395,Cluster 0,PSMA5,PSMB8 PSMB3 PSMB1 PSME4 FBXO7 PSMB10 
1.4240328,-0.034238577,Cluster 0,RETSAT,EPHX1 CYP51A1 PDE3B THEM6 SLC27A3 
1.8998569,0.5852553,Cluster 0,CSTF2,PCF11 CSTF3 PAPOLB PAPOLA CSTF2T 
9.713035,1.6770564,Cluster 1,ZBTB11,UPF1 DDX31 GNL3 REXO4 GNL2 LARP7 GTPBP4 NSA2 BOP1 LIN28B DKC1 RPL26 CCDC86 PABPC4 POP1 ZNF512 RPL26L1 HP1BP3 NIP7 ZC3HAV1 ZC3H8 ZBTB24 RPF2 DHX30 LLPH PURA RPL15 GAR1 RPS5 RPL17 RRS1 SF3B2 NOP16 SURF6 KRR1 CCDC137 FTSJ3 GLTSCR2 MOV10 RSL1D1 EBNA1BP2 MYBBP1A GZF1 ZCCHC3 GLYR1 RPS24 RBM28 RRP8 ZNF771 DDX27 ZNF770 WHSC1 DDX24 DDX21 ZNF22 PPAN KRI1 TTF1 LARP1 C7ORF50 NKRF RRP15 BRIX1 RRP12 RPS13 RBM34 
8.999592,1.4827055,Cluster 1,SURF6,UPF1 IMP3 DDX31 GNL3 REXO4 LARP7 GTPBP4 MRTO4 NSA2 DKC1 RPL26 PABPC4 RPL26L1 STAU2 NIP7 ZC3HAV1 RPF2 DHX30 HERC5 LLPH RPL36A PES1 RPS5 RPL17 RRS1 SF3B2 LYAR MYEF2 NOP16 MRPS26 DDX56 CCDC137 PAPD5 MRPS22 RRP1B NOC3L FTSJ3 GLTSCR2 MOV10 EBNA1BP2 MYBBP1A GZF1 RPS24 FYTTD1 RBM28 RRP8 ZNF771 DDX27 ZNF770 WHSC1 MPHOSPH10 DDX24 DDX21 RRP9 LARP1 DHX57 BMS1 BRIX1 
9.675054,1.943605,Cluster 1,ZNF668,RPL13A KNOP1 DDX31 GNL3 REXO4 GNL2 GTPBP4 NSA2 BOP1 DKC1 RPL7L1 CCDC86 POP1 ZNF512 HP1BP3 NVL STAU1 PAK1IP1 ZC3HAV1 ZBTB24 RPF2 DHX30 LLPH PES1 RPL15 RPL17 RRS1 MYEF2 NOP16 SURF6 DDX56 CCDC137 PAPD5 NOC3L DDX50 FTSJ3 GLTSCR2 RSL1D1 EBNA1BP2 MYBBP1A NOL12 GZF1 GLYR1 FYTTD1 RBM28 RRP8 ZNF771 DDX27 WHSC1 DDX24 PPAN KRI1 TTF1 C7ORF50 NKRF RRP15 BRIX1 NIFK RPS13 RBM34 
8.472232,1.3806863,Cluster 1,HERC5,RBM28 ZNF771 DDX27 NOP16 STAU2 IMP3 CCDC137 DDX24 DDX21 FTSJ3 GNL3 GTPBP4 MRTO4 DHX30 LARP1 MYBBP1A RPL36A RPL26 RPS5 LYAR NOP56 
8.055904,1.7058266,Cluster 1,ENSG00000108270,TBL3 ESF1 NOL10 NOC2L WDR36 
8.357814,1.240531,Cluster 1,LLPH,MYEF2 UPF1 NOP16 IMP3 DDX56 CCDC137 PAPD5 MRPS22 FTSJ3 GNL3 REXO4 GLTSCR2 GTPBP4 NSA2 EBNA1BP2 MYBBP1A DKC1 RPL7L1 RPL26 GZF1 ZCCHC3 FYTTD1 RBM28 ZNF771 DDX27 STAU2 MPHOSPH10 DDX24 ZC3HAV1 DDX21 RRP9 RPF2 DHX30 LARP1 HERC5 RPL36A PES1 RPS5 RRS1 
8.496036,2.4832618,Cluster 1,54865,ZCCHC9 STAU2 MPHOSPH10 PAPD5 LARP7 RPF2 DHX30 DKC1 PES1 RPS5 ZCCHC3 LYAR MMTAG2 
9.279041,1.4851643,Cluster 1,KRR1,UPF1 RBM19 GNL3 REXO4 GNL2 LARP7 GTPBP4 MRTO4 NSA2 LIN28B DKC1 RPL26 CCDC86 PABPC4 POP1 ZNF512 RPL26L1 HP1BP3 ZCCHC9 ZC3HAV1 NOC4L PRDM15 ZC3H8 DHX30 SRP72 PURA PES1 RPL15 RPS5 RPL17 RRS1 SF3B2 DDX18 ABT1 ZCRB1 SURF6 DDX56 CCDC137 FTSJ3 GLTSCR2 MOV10 RSL1D1 EBNA1BP2 MYBBP1A TSR1 GZF1 ZCCHC3 GLYR1 NOP56 RPS24 RBM28 LTV1 ZNF771 DDX27 DDX24 DDX21 ZNF22 PPAN KRI1 LARP1 NKRF BRIX1 RRP12 NIFK RPS13 RBM34 
8.336604,1.7734458,Cluster 1,GZF1,RBM28 ZNF771 IMP3 PAPD5 LARP7 RPF2 DHX30 MYBBP1A DKC1 PES1 RPS5 ZCCHC3 LYAR FYTTD1 
8.55113,2.4200706,Cluster 1,MYBBP1A,ZCCHC9 STAU2 IMP4 MPHOSPH10 PAPD5 MINA LARP7 RPF2 DHX30 RPS17 DKC1 PES1 RPS5 LYAR NOP56 FYTTD1 
9.658615,1.7332556,Cluster 1,PURA,UPF1 IMP3 DDX31 GNL3 REXO4 LARP7 GTPBP4 NSA2 LIN28B DKC1 RPL26 PABPC4 RPL26L1 ZCCHC9 STAU2 NIP7 YTHDC2 ZC3HAV1 RPF2 DHX30 LLPH RPS5 RPL17 SF3B2 LYAR NOP16 MRPS26 SURF6 CCDC137 PAPD5 MRPS22 FTSJ3 GLTSCR2 MOV10 EBNA1BP2 MYBBP1A GZF1 ZCCHC3 RPS24 FYTTD1 RBM28 ZNF574 RRP8 ZNF771 DDX27 WHSC1 MPHOSPH10 DDX24 DDX21 LARP1 DHX57 BMS1 BRIX1 IGF2BP3 RPS13 
9.963262,1.7838566,Cluster 1,PAK1IP1,UPF1 IMP3 IMP4 RBM19 RPL13A KNOP1 DDX31 GNL3 REXO4 GNL2 LARP7 GTPBP4 MRTO4 NSA2 BOP1 LIN28B DKC1 RPL7L1 RPL26 CCDC86 POP1 ZNF512 RPL26L1 HP1BP3 NVL STAU1 STAU2 NIP7 NOP2 ZC3HAV1 RPF2 AATF DHX30 HERC5 SRP72 LLPH PURA PES1 RPL15 RPL17 RRS1 DDX18 MYEF2 ABT1 NOP16 SURF6 DDX56 CCDC137 DDX54 PAPD5 RRP1B NOC3L DDX50 FTSJ3 GLTSCR2 MOV10 RSL1D1 EBNA1BP2 MYBBP1A NOL12 GZF1 RSL24D1 GLYR1 NOP56 RPS24 FYTTD1 RBM28 RRP8 ZNF771 DDX27 WHSC1 MPHOSPH10 DDX24 DDX21 ZNF22 PPAN KRI1 TTF1 RRP9 LARP1 C7ORF50 NKRF DHX57 RRP15 BRIX1 RRP12 NIFK RPS13 RBM34 
8.224872,1.7303066,Cluster 1,RRP1B,RBM28 DDX27 NOP16 DDX24 DDX21 FTSJ3 GNL3 GTPBP4 DHX30 EBNA1BP2 MYBBP1A RPL7L1 LYAR 
9.863612,1.8640609,Cluster 1,DDX50,KNOP1 DDX31 GNL3 REXO4 GNL2 SRRM1 SMARCA5 GTPBP4 MRTO4 LIN28B XRN2 RPL26 CCDC86 POP1 ZNF512 HP1BP3 NVL STAU1 STAU2 NIP7 ZC3HAV1 RPF2 DHX30 SRP72 PURA PES1 RPL15 RPS5 RPL17 RRS1 LYAR DDX18 ABT1 NOP16 SURF6 CCDC137 PAPD5 MRPS22 SRP68 RRP1B NOC3L FTSJ3 GLTSCR2 RSL1D1 EBNA1BP2 MYBBP1A TSR1 NOL12 GLYR1 RPS24 RBM28 RRP8 DDX27 WHSC1 DDX24 DDX21 PPAN KRI1 TTF1 LARP1 NKRF RRP15 BRIX1 RRP12 IGF2BP3 NIFK RPS13 RBM34 
8.982957,1.3360404,Cluster 1,UTP23,DDX18 TOE1 ZCRB1 KRR1 CCDC137 SRP68 CHERP FTSJ3 GNL3 GNL2 GLTSCR2 GTPBP4 TSR1 POP1 GZF1 GLYR1 RPS24 HP1BP3 LTV1 DDX27 PRDM15 KRI1 AATF DHX30 RPS17 SRP72 RPL15 RPS5 RRP12 RRS1 LYAR RPS13 
9.894647,1.9510845,Cluster 1,CTCF,ZBTB11 KNOP1 DDX31 GNL3 REXO4 GNL2 LARP7 GTPBP4 LIN28B XRN2 DKC1 RPL26 POP1 ZNF512 RPL26L1 HP1BP3 STAU1 NIP7 NOP2 ZC3HAV1 RPF2 DHX30 PURA RPL15 GAR1 RRS1 LYAR NOP16 SURF6 CCDC137 PAPD5 NOC3L FTSJ3 GLTSCR2 RSL1D1 EBNA1BP2 MYBBP1A H1F0 NOL12 GZF1 GLYR1 RPS24 RBM28 ZNF771 DDX27 WHSC1 DDX24 DDX21 ZNF22 PPAN KRI1 TTF1 RRP9 LARP1 C7ORF50 NKRF BRIX1 RPS13 RBM34 
8.6975355,1.763573,Cluster 1,NOC3L,MYEF2 NOP16 IMP3 DDX56 CCDC137 PAPD5 RRP1B FTSJ3 GNL3 REXO4 WDR12 GLTSCR2 GTPBP4 MRTO4 NSA2 EBNA1BP2 MYBBP1A DKC1 RPL7L1 RPL26 GZF1 FYTTD1 RPL26L1 RBM28 RRP8 DDX27 STAU2 NIP7 DDX24 ZC3HAV1 DDX21 RRP9 RPF2 DHX30 LLPH RPL36A PES1 RPL17 RRS1 LYAR 
9.976356,1.9438995,Cluster 1,STAU1,UPF1 IMP3 IMP4 KNOP1 DDX31 GNL3 REXO4 GNL2 LARP7 SRRM1 GTPBP4 NSA2 LIN28B XRN2 DKC1 RPL7L1 RPL26 CCDC86 CEBPZ POP1 ZNF512 RPL26L1 HP1BP3 NVL STAU2 NIP7 YTHDC2 ZC3HAV1 ZC3H8 RPF2 DHX30 HERC5 SRP72 LLPH ZNF629 PURA PES1 RPL15 GAR1 RPL17 RRS1 LYAR DDX18 MYEF2 ABT1 NOP16 MRPS26 SURF6 DDX56 CCDC137 PAPD5 RRP1B NOC3L FTSJ3 GLTSCR2 MOV10 RSL1D1 EBNA1BP2 MYBBP1A NOL12 GZF1 GLYR1 RPS24 FYTTD1 RBM28 RRP8 ZNF771 DDX27 WHSC1 MPHOSPH10 DDX24 DDX21 ZNF22 PPAN KRI1 TTF1 LARP1 C7ORF50 NKRF BRIX1 RRP12 NIFK RPS13 RBM34 
8.904392,1.4143088,Cluster 1,LIN28B,UPF1 IMP3 DDX31 GNL3 REXO4 LARP7 GTPBP4 MRTO4 NSA2 DKC1 RPL26 PABPC4 RPL26L1 STAU2 ZC3HAV1 RPF2 DHX30 LLPH RPS5 RPL17 RRS1 SF3B2 LYAR NOP16 MRPS26 SURF6 CCDC137 PAPD5 FTSJ3 GLTSCR2 MOV10 EBNA1BP2 MYBBP1A GZF1 ZCCHC3 RPS24 RBM28 ZNF574 RRP8 ZNF771 DDX27 WHSC1 MPHOSPH10 DDX24 DDX21 RRP9 LARP1 BMS1 BRIX1 IGF2BP3 MMTAG2 RPS13 
9.955852,1.9426141,Cluster 1,NOP2,IMP3 IMP4 ZBTB11 KNOP1 LARP7 SRRM1 GTPBP4 MRTO4 BOP1 LIN28B XRN2 DKC1 RPL7L1 RPL26 CCDC86 POP1 RPL26L1 STAU1 STAU2 NIP7 SDAD1 DHX30 HERC5 SRP72 PURA PES1 RPL15 RPL17 NOP16 SURF6 DDX56 CCDC137 DDX54 DDX50 FTSJ3 GLTSCR2 MOV10 NOL12 RSL24D1 GLYR1 RPS24 RRP8 ZNF771 WHSC1 MPHOSPH10 ZNF22 PPAN TTF1 RRP9 LARP1 C7ORF50 BRIX1 UPF1 DDX31 GNL3 REXO4 GNL2 WDR36 NSA2 PABPC4 CEBPZ ZNF512 HP1BP3 NVL YTHDC2 ZC3HAV1 NOC4L ZC3H8 RPF2 LLPH RPL36A GAR1 RRS1 LYAR DDX18 MYEF2 MRPS26 KRR1 PAPD5 MRPS22 SRP68 RRP1B NOC3L RSL1D1 EBNA1BP2 MYBBP1A GZF1 NOP56 FYTTD1 RBM28 DDX27 DDX24 DDX21 NOC2L KRI1 NKRF DHX57 RRP15 RRP12 IGF2BP3 NIFK RBM34 
8.701238,1.3736402,Cluster 1,YTHDC2,NOP16 RRP1B DDX31 FTSJ3 GNL3 GTPBP4 MRTO4 EBNA1BP2 MYBBP1A RPL26 TSR1 NOP56 RPS24 RPL26L1 RBM28 DDX27 STAU2 DDX24 DDX21 NOC4L DHX30 LARP1 RPL36A PES1 RPS5 RPL17 LYAR 
8.396756,2.143684,Cluster 1,NOP16,RBM28 ZNF771 DDX27 STAU2 IMP3 IMP4 MPHOSPH10 DDX21 PAPD5 MRPS22 RPF2 DHX30 EBNA1BP2 MYBBP1A DKC1 PES1 RPS5 TSR1 LYAR NOP56 
8.486973,2.5496638,Cluster 1,CCDC59,STAU1 STAU2 LLPH CCDC137 DDX24 KNOP1 NOL12 FTSJ3 
8.383474,2.2168863,Cluster 1,RBM28,STAU2 IMP4 MPHOSPH10 PAPD5 MINA LARP7 RPF2 DHX30 EBNA1BP2 MYBBP1A DKC1 PES1 RPS5 LYAR NOP56 FYTTD1 
8.454105,1.9949728,Cluster 1,ZNF771,RBM28 STAU2 IMP3 PAPD5 LARP7 RPF2 DHX30 EBNA1BP2 MYBBP1A DKC1 PES1 RPS5 ZCCHC3 LYAR FYTTD1 
8.612603,1.7227063,Cluster 1,FTSJ3,UPF1 NOP16 IMP3 IMP4 PAPD5 GNL3 REXO4 LARP7 WDR12 GLTSCR2 NSA2 EBNA1BP2 MYBBP1A DKC1 RPL7L1 TSR1 GZF1 ZCCHC3 NOP56 FYTTD1 RPL26L1 RBM28 ZNF771 DDX27 STAU2 MPHOSPH10 DDX24 DDX21 RRP9 RPF2 DHX30 DHX57 RPL36A PES1 RPS5 RRS1 LYAR MMTAG2 
8.784015,1.5699246,Cluster 1,NIP7,MYEF2 NOP16 DDX56 CCDC137 PAPD5 MINA RRP1B FTSJ3 GNL3 REXO4 WDR12 GLTSCR2 GTPBP4 MOV10 MRTO4 NSA2 EBNA1BP2 MYBBP1A DKC1 RPL7L1 RPL26 NOP56 RPL26L1 RBM28 RRP8 ZNF771 DDX27 STAU2 DDX24 ZC3HAV1 DDX21 SDAD1 RRP9 RPF2 DHX30 LARP1 HERC5 LLPH DHX57 RPL36A PES1 RPS5 RRS1 LYAR 
9.789384,1.7548168,Cluster 1,ZNF512,UPF1 IMP3 DDX31 GNL3 REXO4 GTPBP4 MRTO4 NSA2 BOP1 LIN28B XRN2 DKC1 RPL7L1 RPL26 RPL26L1 STAU2 NIP7 YTHDC2 ZC3HAV1 RPF2 DHX30 HERC5 LLPH PURA RPL36A PES1 RPL15 GAR1 RPS5 RPL17 RRS1 LYAR MYEF2 NOP16 MRPS26 SURF6 DDX56 CCDC137 PAPD5 MRPS22 RRP1B NOC3L FTSJ3 GLTSCR2 MOV10 EBNA1BP2 MYBBP1A NOL12 GZF1 GLYR1 RPS24 FYTTD1 RBM28 RRP8 ZNF771 DDX27 ZNF770 WHSC1 MPHOSPH10 DDX24 DDX21 TTF1 RRP9 LARP1 DHX57 BRIX1 IGF2BP3 RPS13 
8.957166,2.2587078,Cluster 1,ZNF629,RBM28 ZNF771 NOP16 SURF6 CCDC137 DDX24 ZC3HAV1 DDX21 ZC3H8 RRP1B FTSJ3 GNL3 LARP7 DHX30 MYBBP1A DHX57 BMS1 RPL15 RPS5 ZNF512 RPS13 
8.598872,1.36144,Cluster 1,MOV10,UPF1 IMP3 DDX56 CCDC137 PAPD5 MRPS22 FTSJ3 GNL3 REXO4 LARP7 GLTSCR2 GTPBP4 NSA2 EBNA1BP2 MYBBP1A DKC1 RPL26 GZF1 ZCCHC3 FYTTD1 RBM28 ZNF771 DDX27 STAU2 MPHOSPH10 DDX24 ZC3HAV1 DDX21 RRP9 RPF2 DHX30 LARP1 LLPH RPS5 RRS1 IGF2BP3 LYAR 
9.727882,1.8774208,Cluster 1,GLYR1,IMP3 IMP4 DDX31 GNL3 REXO4 SMARCA5 GTPBP4 MRTO4 NSA2 LIN28B DKC1 RPL7L1 RPL26 RPL26L1 STAU2 NIP7 YTHDC2 ZC3HAV1 RPF2 DHX30 HERC5 LLPH PURA RPL36A PES1 RPL15 RPS5 RPL17 RRS1 SF3B2 LYAR MYEF2 NOP16 SURF6 DDX56 CCDC137 DDX10 PAPD5 MINA NOC3L FTSJ3 GLTSCR2 MOV10 EBNA1BP2 MYBBP1A TSR1 NOL12 GZF1 NOP56 RPS24 FYTTD1 RBM28 ZNF574 RRP8 ZNF771 DDX27 ZNF770 WHSC1 MPHOSPH10 DDX24 DDX21 LARP1 DHX57 BRIX1 IGF2BP3 RPS13 
9.882775,1.9451728,Cluster 1,ZNF22,UPF1 IMP3 DDX31 GNL3 REXO4 LARP7 GTPBP4 NSA2 LIN28B DKC1 RPL26 POP1 ZNF512 RPL26L1 STAU2 NIP7 ZC3HAV1 ZC3H8 RPF2 DHX30 HERC5 SRP72 LLPH PURA RPL15 GAR1 RPL17 RRS1 SF3B2 LYAR NOP16 SURF6 CCDC137 PAPD5 NOC3L FTSJ3 GLTSCR2 MOV10 RSL1D1 EBNA1BP2 MYBBP1A NOL12 GZF1 GLYR1 RPS24 FYTTD1 RBM28 RRP8 ZNF771 DDX27 WHSC1 MPHOSPH10 DDX24 DDX21 KRI1 RRP9 LARP1 C7ORF50 ZNF808 NKRF BRIX1 NIFK RPS13 RBM34 
9.974582,1.8710566,Cluster 1,GNL2,UPF1 IMP3 IMP4 RBM19 DDX31 GNL3 REXO4 LARP7 GTPBP4 MRTO4 NSA2 BOP1 LIN28B XRN2 DKC1 RPL7L1 RPL26 CCDC86 PABPC4 POP1 ZNF512 RPL26L1 ZCCHC9 STAU2 DDX47 NIP7 YTHDC2 ZC3HAV1 ZC3H8 RPF2 DHX30 HERC5 SRP72 LLPH ZNF629 PURA RPL36A PES1 RPL15 GAR1 RPS5 RPL17 RRS1 LYAR DDX18 NOP16 MRPS26 SURF6 DDX56 CCDC137 PAPD5 MRPS22 RRP1B NOC3L FTSJ3 GLTSCR2 MOV10 RSL1D1 EBNA1BP2 MYBBP1A TSR1 NOL12 GZF1 ZCCHC3 GLYR1 NOP56 RPS24 FYTTD1 RBM28 RRP8 ZNF771 DDX27 ZNF770 WHSC1 MPHOSPH10 DDX24 DDX21 ZNF22 KRI1 TTF1 RRP9 LARP1 C7ORF50 RPS17 NKRF DHX57 BMS1 BRIX1 IGF2BP3 NIFK RPS13 RBM34 
8.342781,1.3604438,Cluster 1,RRP8,MYEF2 NOP16 IMP3 IMP4 DDX56 CCDC137 PAPD5 FTSJ3 GNL3 REXO4 LARP7 GLTSCR2 GTPBP4 MOV10 NSA2 EBNA1BP2 MYBBP1A DKC1 RPL7L1 GZF1 RBM28 ZNF771 DDX27 STAU2 DDX24 ZC3HAV1 DDX21 RPF2 DHX30 LLPH PES1 RRS1 
8.250275,1.924824,Cluster 1,UTP14A,DDX18 DDX27 NOP2 MPHOSPH10 DDX56 NOC2L FTSJ3 WDR36 RPF2 GTPBP4 PUM3 MRTO4 DKC1 PES1 RRP15 RRS1 NOP56 
9.030332,2.1712,Cluster 1,CEBPZ,DDX18 NOP16 IMP3 IMP4 SURF6 DDX56 CCDC137 DDX10 RRP1B NOC3L DDX31 GNL3 REXO4 GNL2 GTPBP4 MRTO4 RSL1D1 EBNA1BP2 MYBBP1A NOL10 POP1 ZNF512 RPS24 RBM28 DDX27 NVL NIP7 DDX24 DDX21 PPAN NOC2L KRI1 TTF1 RPF2 DHX30 LARP1 RPL15 RRP12 LYAR RPS13 RBM34 
8.516479,1.5540614,Cluster 1,WHSC1,MYEF2 IMP3 DDX56 CCDC137 PAPD5 NOC3L DDX31 FTSJ3 GNL3 REXO4 GLTSCR2 GTPBP4 NSA2 EBNA1BP2 MYBBP1A DKC1 RPL7L1 RPL26 GZF1 FYTTD1 RBM28 RRP8 ZNF771 DDX27 STAU2 NIP7 DDX24 ZC3HAV1 RPF2 DHX30 LLPH PES1 RRS1 LYAR 
9.1637125,1.5661422,Cluster 1,ZNF768,NOP16 MRPS26 SURF6 DDX54 RRP1B FTSJ3 GNL2 GLTSCR2 GTPBP4 NSA2 EBNA1BP2 MYBBP1A DKC1 RPL26 POP1 ZNF512 RBM28 DDX27 STAU1 NOP2 ZC3HAV1 DDX21 PPAN ZC3H8 KRI1 DHX30 DHX57 ZNF629 PURA BMS1 RPL15 RRP15 RPS5 BRIX1 RPL17 LYAR RPS13 RBM34 
8.826587,1.6000217,Cluster 1,BOP1,PAPD5 NOC3L DDX31 FTSJ3 GNL3 REXO4 LARP7 WDR12 GLTSCR2 GTPBP4 MRTO4 EBNA1BP2 MYBBP1A DKC1 RPL7L1 NOL12 RPS24 RBM28 RRP8 DDX27 WHSC1 DDX24 ZC3HAV1 RPF2 PES1 RPL15 RRS1 
8.474477,2.4354024,Cluster 1,DDX10,DHX30 ZNF771 NOP16 IMP3 DDX21 GZF1 GNL3 LARP7 NOP56 
8.245012,1.6266754,Cluster 1,NOC2L,DDX18 NIP7 MPHOSPH10 DDX56 CCDC137 DDX24 DDX10 DDX21 DDX31 FTSJ3 SDAD1 WDR36 RPF2 GTPBP4 MRTO4 DHX30 NSA2 EBNA1BP2 MYBBP1A DKC1 PES1 RRS1 GLYR1 NOP56 
9.808554,1.6863781,Cluster 1,NVL,UPF1 IMP3 IMP4 DDX31 GNL3 REXO4 GNL2 GTPBP4 MRTO4 NSA2 LIN28B DKC1 RPL7L1 RPL26 CCDC86 POP1 ZNF512 STAU2 NIP7 YTHDC2 ZC3HAV1 RPF2 DHX30 HERC5 SRP72 LLPH RPL36A PES1 RPL15 RPS5 RPL17 RRS1 LYAR DDX18 MYEF2 NOP16 SURF6 DDX56 CCDC137 PAPD5 NOC3L FTSJ3 GLTSCR2 MOV10 RSL1D1 EBNA1BP2 MYBBP1A NOL12 GZF1 GLYR1 NOP56 RPS24 FYTTD1 RBM28 RRP8 DDX27 WHSC1 DDX24 DDX21 ZNF22 PPAN TTF1 RRP9 LARP1 C7ORF50 NKRF DHX57 BRIX1 IGF2BP3 NIFK RPS13 RBM34 
8.853722,1.5405191,Cluster 1,DDX31,UPF1 IMP3 GNL3 REXO4 LARP7 GTPBP4 MRTO4 NSA2 DKC1 RPL7L1 RPL26 RPL26L1 STAU2 NIP7 ZC3HAV1 RPF2 DHX30 HERC5 LLPH RPL36A PES1 RPS5 RPL17 RRS1 LYAR MYEF2 C9ORF114 NOP16 DDX56 CCDC137 PAPD5 RRP1B NOC3L FTSJ3 GLTSCR2 MOV10 EBNA1BP2 MYBBP1A NMNAT1 TSR1 GZF1 NOP56 FYTTD1 RBM28 RRP8 ZNF771 DDX27 MPHOSPH10 DDX24 DDX21 RRP9 LARP1 IGF2BP3 
9.873271,1.8038421,Cluster 1,PPAN,UPF1 IMP3 IMP4 RBM19 DDX31 GNL3 REXO4 GNL2 LARP7 GTPBP4 MRTO4 NSA2 BOP1 LIN28B XRN2 DKC1 RPL7L1 RPL26 CCDC86 PABPC4 POP1 ZNF512 RPL26L1 STAU2 NIP7 ZC3HAV1 ZC3H8 SPTY2D1 RPF2 DHX30 HERC5 SRP72 LLPH PURA PES1 RPL15 GAR1 RPS5 RPL17 RRS1 SF3B2 LYAR DDX18 NOP16 MRPS26 SURF6 DDX56 CCDC137 PAPD5 MRPS22 RRP1B NOC3L FTSJ3 GLTSCR2 MOV10 RSL1D1 EBNA1BP2 MYBBP1A TSR1 NOL12 GZF1 ZCCHC3 GLYR1 NOP56 RPS24 FYTTD1 RBM28 RRP8 ZNF771 DDX27 WHSC1 MPHOSPH10 DDX24 DDX21 ZNF22 KRI1 TTF1 RRP9 LARP1 C7ORF50 NKRF DHX57 BMS1 BRIX1 RRP12 NIFK RPS13 RBM34 
8.851904,1.5074333,Cluster 1,RPS24,UPF1 IMP3 IMP4 DDX31 GNL3 REXO4 LARP7 GTPBP4 MRTO4 NSA2 DKC1 RPL7L1 RPL26 PABPC4 RPL26L1 STAU2 DDX47 NIP7 RPF2 DHX30 LLPH RPL36A PES1 RPS5 RPL17 RRS1 ZNF622 LYAR NOP16 CCDC137 MINA RRP1B NOC3L FTSJ3 GLTSCR2 EBNA1BP2 MYBBP1A TSR1 GZF1 ZCCHC3 NOP56 RBM28 RRP8 ZNF771 DDX27 ZNF770 MPHOSPH10 DDX24 DDX21 RRP9 LARP1 RPS17 DHX57 IGF2BP3 
9.011303,1.4217253,Cluster 1,GAR1,NOP16 IMP3 SURF6 DDX56 CCDC137 DDX31 FTSJ3 REXO4 LARP7 GLTSCR2 GTPBP4 MOV10 NSA2 EBNA1BP2 LIN28B MYBBP1A DKC1 HADHA RPL26 PABPC4 TSR1 NOL12 GZF1 NOP10 GLYR1 NHP2 RPS24 RPL26L1 RBM28 RRP8 ZNF771 DDX27 WHSC1 NIP7 DDX24 ZC3HAV1 DDX21 DHX30 LARP1 LLPH PURA PES1 RPL15 BRIX1 RPL17 RRS1 RPS13 
9.451543,1.611314,Cluster 1,XRN2,MYEF2 NOP16 SURF6 CCDC137 SEPT2 PAPD5 MRPS22 NOC3L DDX31 FTSJ3 REXO4 GLTSCR2 GTPBP4 MOV10 EBNA1BP2 LIN28B MYBBP1A DKC1 PXDN RPL26 PABPC4 GLYR1 RPL26L1 RBM28 ZNF771 DDX27 STAU2 NIP7 DDX24 ZC3HAV1 DDX21 CDKN2AIP DHX30 LARP1 PURA RPL15 GAR1 BRIX1 RPL17 IGF2BP3 RPS13 
9.46957,1.6452386,Cluster 1,NIFK,UPF1 IMP3 RBM19 DDX31 GNL3 REXO4 LARP7 GTPBP4 MRTO4 NSA2 BOP1 LIN28B DKC1 RPL7L1 RPL26 POP1 ZNF512 RPL26L1 ZCCHC9 NIP7 ZC3HAV1 RPF2 DHX30 LLPH PURA PES1 RPL15 RPS5 RPL17 RRS1 DDX18 NOP16 SURF6 DDX56 CCDC137 PAPD5 NOC3L FTSJ3 GLTSCR2 MOV10 RSL1D1 EBNA1BP2 MYBBP1A NOL12 GZF1 ZCCHC3 GLYR1 NOP56 RPS24 FYTTD1 RBM28 RRP8 ZNF771 DDX27 WHSC1 DDX24 DDX21 NOC2L TTF1 RRP9 C7ORF50 NKRF BRIX1 RPS13 RBM34 
8.4696665,2.3419,Cluster 1,DDX21,RBM28 ZCCHC9 ZNF771 STAU2 IMP3 IMP4 MPHOSPH10 PAPD5 MINA LARP7 RPF2 DHX30 EBNA1BP2 MYBBP1A DKC1 PES1 RPS5 TSR1 GZF1 LYAR NOP56 
8.269184,1.384751,Cluster 1,RPL36A,RBM28 DDX27 NOP16 STAU2 DDX24 DDX21 GNL3 REXO4 DHX30 EBNA1BP2 MYBBP1A PES1 RPS5 LYAR RPL26L1 
9.621025,1.9962443,Cluster 1,ZC3H8,NOP16 MRPS26 SURF6 CCDC137 DDX10 FTSJ3 GNL3 LARP7 GLTSCR2 GTPBP4 MOV10 NSA2 LIN28B MYBBP1A RPL26 PABPC4 TSR1 NOL12 GZF1 ZNF512 RPS24 RBM28 ZCCHC9 ZNF771 DDX24 DDX21 DHX30 LLPH DHX57 PURA BMS1 RPL15 GAR1 RPS5 BRIX1 SF3B2 LYAR RPS13 
8.991074,1.3908982,Cluster 1,AATF,DDX18 IMP3 IMP4 SURF6 KRR1 CCDC137 FTSJ3 GNL3 REXO4 GNL2 GLTSCR2 GTPBP4 RSL1D1 NSA2 MYBBP1A POP1 GZF1 ZNF512 ZCCHC3 GLYR1 RPS24 RBM28 HP1BP3 ZNF771 DDX27 DDX24 DDX21 PPAN KRI1 DHX30 LARP1 SRP72 PURA RPL15 RPS5 BRIX1 RRP12 RPS13 
9.373164,1.4882673,Cluster 1,ABT1,RRP8 DDX27 WHSC1 MPHOSPH10 CCDC137 DDX24 PAPD5 DDX31 FTSJ3 GNL2 GLTSCR2 DHX30 SRP72 LIN28B XRN2 NKRF POP1 ZNF512 LYAR GLYR1 RPS13 
8.269989,1.4788777,Cluster 1,RRP9,RBM28 ZNF771 DDX27 IMP3 DDX21 GNL3 REXO4 LARP7 RPF2 DHX30 EBNA1BP2 MYBBP1A DKC1 PES1 RPS5 RRS1 RPL26L1 
9.125159,2.2021568,Cluster 1,RSL24D1,UPF1 NOP16 SURF6 CCDC137 PAPD5 NOC3L DDX31 FTSJ3 REXO4 GNL2 GTPBP4 MRTO4 RSL1D1 EBNA1BP2 LIN28B DKC1 ZNF512 GLYR1 RPS24 DDX27 NVL NIP7 MPHOSPH10 DDX24 DDX21 PPAN RPF2 LLPH RPL15 RRS1 NIFK RBM34 
8.128952,1.9859748,Cluster 1,DDX55,DDX18 DDX56 DDX24 NOP56 GTPBP4 
8.334374,1.9371874,Cluster 1,REXO4,RBM28 ZNF771 DDX27 NOP16 STAU2 IMP3 DDX21 PAPD5 GNL3 RPF2 GLTSCR2 DHX30 EBNA1BP2 MYBBP1A DKC1 PES1 RRS1 GZF1 LYAR FYTTD1 RPL26L1 
8.243395,1.4167049,Cluster 1,C8orf33,RBM28 C7ORF50 EBNA1BP2 WHSC1 RPL26 PAPD5 PPAN FTSJ3 NOP56 GTPBP4 FYTTD1 
8.341083,1.9393128,Cluster 1,GLTSCR2,RBM28 ZNF771 DDX27 NOP16 STAU2 IMP3 IMP4 MPHOSPH10 DDX21 PAPD5 MRPS22 DHX30 EBNA1BP2 MYBBP1A DKC1 PES1 RPS5 RRS1 GZF1 LYAR 
8.436389,2.0698164,Cluster 1,GNL3,UTP18 NOP16 IMP3 IMP4 PAPD5 MINA LARP7 GLTSCR2 EBNA1BP2 MYBBP1A DKC1 TSR1 GZF1 NOP56 RBM28 ZCCHC9 ZNF771 DDX27 STAU2 DDX47 MPHOSPH10 DDX21 RPF2 DHX30 RPS17 PES1 RPS5 RRS1 LYAR 
8.549458,1.3304578,Cluster 1,CCDC137,UPF1 NOP16 IMP3 IMP4 DDX56 DDX10 PAPD5 RRP1B FTSJ3 GNL3 REXO4 LARP7 GLTSCR2 GTPBP4 MRTO4 NSA2 EBNA1BP2 MYBBP1A DKC1 RPL7L1 RPL26 TSR1 GZF1 ZCCHC3 NOP56 RPL26L1 RBM28 ZCCHC9 ZNF574 ZNF771 DDX27 STAU2 MPHOSPH10 DDX24 ZC3HAV1 DDX21 RRP9 RPF2 DHX30 LARP1 DHX57 PES1 RPS5 RRS1 LYAR 
