x,y,cluster,term,genes
16.479307,0.39505818,Cluster 4,RPS14,TUFM SND1 NSUN2 RPS8 RPL22 RPL21 RPS9 RPS7 RPS3A MTHFD1 RPL26 FAU HNRNPC RPL27 RPL11 DDX47 RPL10 RPL13 HNRNPU RRBP1 FBL RPL36AL MTHFD1L PES1 RPS5 RPL14 RPS3 RPS15A ZNF622 RPS27A HIST1H1B RPL35A RPL23A RPS27 EBNA1BP2 RPL27A HADHA TSR1 RPS20 UBA52 SLC25A6 SLC25A5 RPS25 RPL6 RPL3 RPL30 RPLP2 RPL34 YBX1 ATP5C1 SRP14 RPL10A RPL7 RPS4X RPS15 RPS17 G3BP1 G3BP2 RPL37 
15.874775,0.042305823,Cluster 4,NOL6,NPM1 RPS7 RPS3A GNL3 MYBBP1A PABPC4 TSR1 RPS25 RBM28 RPL6 RPL3 RPL30 RPLP0 RPL10 DDX24 HNRNPU RRBP1 RPL7 FBL RRP9 LARP1 RPS4X DHX57 RPS5 RPS14 
15.86897,-0.30811498,Cluster 4,SRPK2,RPS4X RPS9 RPLP2 GRWD1 YBX1 RPL23A RPS3A 
16.460478,0.937509,Cluster 4,RPS6,TUFM SND1 RPS8 RPL22 RPL21 RPS9 RPL24 RPL23 RPS7 RPSA EEF1A1 MTHFD1 RPL26 FAU RPL27 RPL26L1 RPL11 RPL10 RPL13 RPL12 HNRNPU NOLC1 RRBP1 NOL6 FBL RPL36AL PES1 RPL15 RPS5 RPL14 RPS3 RPL18 MYH7B NACA2 MINA EEF2 EIF2S1 RPL3L PUM3 RPS27 RPS26 RPS29 RPL27A NCL RPS20 RPS23 RPS25 RPL6 RPL31 RPL3 RPL4 RPL30 RPL35 RPL34 SRP14 RPL9 RPL7 RPL8 RPS15 RPS18 RPS17 RPS19 G3BP1 RPL37 RPL36 RPL39 RPS12 RPS11 RPS14 RPS13 EIF5B NSUN2 BTF3 NAP1L4 RPL13A NAP1L1 RPS3A RPL37A NAT10 PABPC1 DDX47 RPF2 HIST1H1E RPS15A ZNF622 RPS27A NOP58 NPM1 NPM3 RPL35A RPL23A EBNA1BP2 TSR1 SLC25A5 EIF3B RPLP0 HSP90AB1 RPLP2 YBX1 YBX3 RPL10A RPS4X RPL18A RRP15 IGF2BP1 RACK1 RPL7A RBM34 
16.405716,0.5646774,Cluster 4,RPLP0,TUFM SND1 BTF3 RPS8 RPL22 RPL21 RPS9 RPS7 NAP1L1 RPS3A EEF1A1 MTHFD1 EEF1G RPL26 FAU HNRNPC RPL27 RPL11 RPL10 RPL13 RPL12 HNRNPU ATP5A1 NOLC1 FBL RPF2 MTHFD1L PES1 RPS5 RPL14 RPS3 RPS15A RPS27A HIST1H1B RPL35A RPL23A MINA SRPK2 RPS27 EBNA1BP2 RPL27A TSR1 RPS20 SLC25A5 RPS25 RPL6 RPL3 RPL30 HSP90AB1 RPLP2 RPL34 YBX1 SRP14 RPL10A RPL7 RPS4X RPS15 G3BP1 IGF2BP1 RPL39 RPS14 
16.664185,0.8324535,Cluster 4,RPL32,SND1 RPS8 RPL22 RPL21 RPS9 RPS6 RPL24 EIF1AX RPL23 EEF1A1 SERBP1 RPL26 FAU RPL27 RPL26L1 MPG RPL11 RPL10 RPL13 RPL12 HNRNPU ATP5A1 RRBP1 RPL36AL MTHFD1L PES1 RPL15 RPS5 RPL14 RPS3 RPL18 TTC37 MINA EIF2S1 RPL3L RPS27 RPS26 RPS29 RPL27A NCL RPS20 RPS23 RPS25 RPL6 RPL31 PWP1 RPL3 RPL4 RPL30 RPL35 RPL34 RPL9 RPL7 RPL8 RPS16 RPS15 RPS18 RPS19 G3BP1 RPL36 RPL39 RPS10 RPS12 RPS11 RPS14 RPS13 NAP1L4 RPL13A NAP1L1 RPS3A RPL37A NAT10 EEF1G PABPC1 SLC25A3 DDX47 RPF2 TRMT112 HIST1H1E RPS15A ZNF622 NPM1 NPM3 RPL35A RPL23A EBNA1BP2 TSR1 UBA52 SLC25A6 SLC25A5 RPLP0 YBX1 YBX3 RPL10A RPS4X RPL18A RRP15 IGF2BP1 IGF2BP3 RACK1 RPL7A RBM34 
16.151875,0.15061857,Cluster 4,BYSL,RPS15 NPM1 RPS8 DHPS NOC4L PARN TSR1 RPS3A RPS3 ZNF622 FBL RPS13 
15.908207,-0.14937805,Cluster 4,NOP10,RPS8 RPL11 RPLP0 RPL13 YBX1 RPS3A RPF2 RPS4X HADHA PES1 EEF1G RPS5 RPL14 RPS3 RPS15A RPS25 
16.30823,0.98458177,Cluster 4,RPS16,SSB TUFM SND1 SUPT16H RPS8 RPL22 DIMT1 RPL21 RPS9 RPS6 RPL24 EIF1AX RPL23 RPS7 RPSA EEF1A1 MTHFD1 RPL26 FAU RPL22L1 RPL27 RPL26L1 RPL11 RPL10 RPL13 RPL12 HNRNPU ATP5A1 NOLC1 RRBP1 FBL RPL36AL PES1 RPL15 RPS5 RPL14 RPS3 RPL18 EEF2 EIF2S1 RPL3L RPS27 RPS26 RPL27A NCL RPS20 RPS23 NOP10 RPS25 RPL6 RPL31 RPL3 RPL4 RPL30 RPL35 RPL34 ATP5C1 SRP14 RPL9 RPL7 RPL8 RPS15 RPS18 RPS17 RPS19 G3BP1 G3BP2 RPL36 RPL39 RPS12 RPS11 RPS14 RPS13 NSUN2 BTF3 NAP1L1 RPS3A RPL37A NAT10 EEF1G PABPC1 CALR SLC25A4 DDX47 HIST1H1E RPS15A HIST1H1A ZNF622 RPS27A HIST1H1B HIST1H1C HIST1H1D NOP58 NPM1 RPL35A RPL23A EBNA1BP2 HADHA CANX TSR1 SLC25A6 SLC25A5 EIF3B RPLP0 HSP90AB1 RPLP2 YBX1 RPL10A RPS4X RPL18A RRP15 IGF2BP1 RACK1 RPL7A 
16.558079,0.03613055,Cluster 4,EEF1B2,TUFM BTF3 RPS8 RPL22 RPL21 RPS9 RPS6 RPL23 RPS7 RPL13A RPS3A EEF1A2 EEF1A1 EEF1D MTHFD1 EEF1G RPL27 NHP2 RPL11 RPL10 RPL13 RPL12 HNRNPU ATP5A1 RPS27L PES1 RPL14 RPS3 RPS15A RPL18 RPL23A NACA2 EEF2 RPS26 RPL27A HADHA RPS20 RPS23 NOP10 EIF3B RPS25 RPL6 RPL31 RPL3 RPL4 RPL30 VARS RPLP0 HSP90AB1 RPL32 RPL35 RPLP2 RPLP1 YBX1 RPL10A RPL9 RPL7 RPL8 RPS16 RPS4X RPS15 RPS18 RPL18A RPS19 RRP15 IGF2BP1 RPL36 RACK1 RPS11 RPL7A RPS14 RPS13 
16.068003,-0.28100803,Cluster 4,TTC37,SND1 MPG RPS18 NPM3 RPL11 DDX47 RPL24 RPS5 SKIV2L ZNF622 RPL7 RPS25 
16.566109,0.35137302,Cluster 4,RPL10A,TUFM SND1 RPS8 RPL22 RPL21 RPS9 RPS7 MINA NAP1L1 RPS3A RPS27 EBNA1BP2 RPL27A RPL26 FAU TSR1 HNRNPC RPS20 RPL27 SLC25A6 RPS25 RPL26L1 RPL6 RPL3 RPL30 RPL11 HSP90AB1 RPL10 RPLP2 RPL13 RPL34 HNRNPU YBX1 ATP5C1 RPL7 RPF2 RPS4X RPS15 G3BP1 PES1 RPL37 RPS5 RPL14 RPS3 RPS15A RPS27A 
16.249588,-0.10836798,Cluster 4,RPL14,TUFM SND1 RPS8 RPL21 RPS9 MINA RPS3A RPL3L RPS27 EBNA1BP2 RPL27A FAU RPS20 RPL3 RPL30 RPL11 HSP90AB1 RPLP2 G3BP1 MTHFD1L PES1 RPS5 RPL39 RPS3 RPS15A 
16.265133,1.0178678,Cluster 4,RPL19,SSB TUFM SND1 SUPT16H RPS8 RPL22 RPL21 RPS9 RPS6 RPL24 EIF1AX RPL23 RPS7 RPSA EEF1A1 SERBP1 MTHFD1 RPL26 FAU HNRNPC RPL27 RPL26L1 MPG RPL11 RPL10 RPL13 RPL12 HNRNPU NOLC1 RRBP1 FBL RPL36AL PES1 RPL15 RPS5 RPL14 RPS3 RPL18 TTC37 MINA EEF2 EIF2S1 SRPK1 RPL3L RPS27 RPS26 RPS29 H1F0 RPL27A NCL RPS21 RPS20 RPS23 NOP10 RPS25 RPL6 RPL31 PWP1 RPL3 RPL4 RPL30 RPL32 RPL35 RPL34 SRP14 RPL9 RPL7 RPL8 RPS16 EEF1B2 RPS15 RPS18 RPS17 RPS19 G3BP1 G3BP2 RPL37 RPL36 RPL39 RPS10 RPS12 RPS11 RPS14 RPS13 NSUN2 BTF3 NAP1L4 RPL13A PA2G4 NAP1L1 RPS3A RPL37A NAT10 EEF1G PABPC1 CALR DDX47 RPF2 RPS15A ZNF622 RPS27A NOP58 NPM1 NPM3 RPL35A RPL23A EBNA1BP2 TSR1 SLC25A5 EIF3B RPLP0 HSP90AB1 RPLP2 RPLP1 YBX1 RPL10A RPS4X RPL18A RRP15 IGF2BP1 RACK1 RPL7A RBM34 
16.227201,-0.3747726,Cluster 4,RPS20,TUFM RPL3 RPL11 RPL21 RPS9 RPL3L RPS27 RPL27A G3BP1 PES1 FAU RPS5 RPS3 RPS15A 
16.106964,0.20011185,Cluster 4,RPS3,TUFM RPL3 DDX47 RPL21 RPS9 ATP5C1 RPF2 RPS17 RPL27A G3BP1 PES1 FAU RPS5 HNRNPC RPS15A 
16.147171,0.23469768,Cluster 4,RPS15A,RPL3 DDX47 RPL21 RPS9 RPL27A G3BP1 PES1 FAU RPS5 MINA RPF2 
15.690747,1.0027947,Cluster 4,RRP15,SUPT16H RPS8 RPS9 RPL23 RPS7 GTPBP4 MRTO4 BOP1 XRN2 DKC1 RPL26 CCDC86 POP1 RPL26L1 STAU1 STAU2 NIP7 RPL13 NOLC1 ZBTB24 SDAD1 DHX30 PURA PES1 RPL15 RPL14 RPL17 SURF6 CCDC137 DDX54 FTSJ3 GLTSCR2 MOV10 NOL12 NOP10 RPS25 GLYR1 RPS24 RPL6 RRP8 ZNF771 RPL31 RPL3 RPL4 RPL30 WHSC1 ZNF22 PPAN RPL9 TTF1 RPL7 RPL8 LARP1 C7ORF50 RPS19 BRIX1 RPL36 DDX31 RPS3A GNL3 REXO4 GNL2 WDR36 NSA2 RPL37A ZNF512 HP1BP3 NVL ZC3HAV1 RPF2 LLPH GAR1 RRS1 RPS15A LYAR DDX18 NOP58 MRPS26 KRR1 PAPD5 MRPS22 RPL23A NOC3L RSL1D1 EBNA1BP2 MYBBP1A GZF1 NOP56 FYTTD1 RBM28 DDX27 RPLP0 RPLP2 DDX24 YBX1 DDX21 RPL10A NOC2L KRI1 RPS4X RPL18A NKRF DHX57 RRP12 NIFK RBM34 
16.940985,-0.10298697,Cluster 4,ENSG00000215472,SSB TUFM BTF3 RPS8 RPL22 RPL21 RPS9 RPL24 RPL23 RPS7 NAP1L1 RPS3A RPSA EEF1A1 RPL37A MTHFD1 EEF1G RPL26 FAU HNRNPC PABPC1 RPL27 RPL26L1 SLC25A3 RPL11 RPL10 RPL13 RPL12 HNRNPU NOLC1 ATP5O MTHFD1L RPL15 RPS5 RPL14 RPS3 RPS15A RPL18 RPS27A MYH7B NOP58 RPL35A RPL23A EEF2 EIF2S1 SRPK1 RPS27 EBNA1BP2 RPL27A GRWD1 CANX RPS20 UBA52 RPS23 SLC25A6 NOP10 SLC25A5 RPS25 RPL6 RPL31 RPL3 RPL30 RPLP0 HSP90AB1 RPL35 RPLP2 RPL34 YBX1 ATP5C1 SRP14 RPL10A RPL9 RPL7 RPS4X RPS15 RPS19 G3BP1 RPL37 RPL36 RPL39 RACK1 RPS12 RPS11 RPL7A RPS14 RPS13 
16.201067,-0.27834824,Cluster 4,ZNF622,SND1 RPL3 NPM3 RPS8 RPL11 DDX47 RPL10 RPL13 RTCB RPS27 MRTO4 RPS4X RPS15 RPL27A G3BP1 RPS5 RPL14 RRS1 RPS20 RPS3 RPS15A RPS25 
16.080364,-0.063353136,Cluster 4,EIF2S1,SND1 RPS8 RPS9 RPL24 RPS3A HADHA EEF1G CANX RPS20 RPL27 RPS23 EIF3B RPS25 RPL3 RPL11 RPLP0 RPL10 RPL35 RPL13 RPL12 HNRNPU YBX1 RPL10A RPL7 FBL TRMT112 RPS4X RPS19 G3BP1 RPL15 RPS5 RPL14 RPL36 RPS3 RPS15A ZNF622 RPS14 RPS13 
15.86356,0.92721546,Cluster 4,RPL26,RPS8 IMP3 RPL21 RPS9 NAP1L1 RPS3A GNL3 REXO4 GTPBP4 NSA2 DKC1 FAU RPL27 RPL26L1 STAU2 RPL13 ZC3HAV1 NOLC1 RPF2 DHX30 RPL36AL RPL36A PES1 RPL14 RRS1 RPS3 LYAR NOP16 PAPD5 MRPS22 RRP1B FTSJ3 GLTSCR2 EBNA1BP2 MYBBP1A GZF1 RPS25 FYTTD1 RBM28 RPL6 ZNF771 DDX27 RPL3 RPL30 RPLP2 RPL34 DDX24 YBX1 DDX21 RPL7 RRP9 LARP1 RPS4X RPS15 DHX57 RPL39 IGF2BP3 
16.472498,-0.37769374,Cluster 4,EIF3B,RPL3 RPL30 NPM3 RPS8 RPLP0 HSP90AB1 RPL21 RPL10 RPLP2 RPL13 RPS3A MTHFD1 RPS15A EIF3D RPS13 
15.910748,0.05428785,Cluster 4,NACA2,RPL6 BTF3 RPLP0 RPL21 PTGES3 RPLP2 RPL12 RPL23 YBX1 DLST RPL23A RPSA RCN1 RPS19 G3BP2 EEF1G CALU RPL39 RPS3 RPS15A 
15.864038,-0.2040275,Cluster 4,TSR1,RPS27 DHX30 RPL3 RPS17 MYBBP1A RPL11 DDX47 RPS9 RPS5 RPS3 RPS15A LYAR 
16.556393,0.8861596,Cluster 4,RPS2,TUFM SND1 RPS8 RPL22 DIMT1 RPL21 RPS9 RPS6 RPL24 RPL23 RPS7 RPSA BYSL EEF1A1 SERBP1 MTHFD1 RPL26 FAU HNRNPC RPL27 MPG RPL11 RPL10 RPL13 RPL12 HNRNPU ATP5A1 RRBP1 NOL6 RPL36AL MTHFD1L RPL15 RPS5 RPL14 RPS3 RPL19 RPL18 MYH7B TTC37 MINA EEF2 EIF2S1 SRPK1 RPL3L RPS27 RPS26 RPS29 RPL27A NCL RPS21 RPS20 RPS23 NOP10 RPS25 RPL6 RPL31 PWP1 RPL3 RPL4 RPL30 MEPCE RPL32 RPL35 RPL34 ATP5C1 SRP14 RPL9 RPL7 RPL8 RPS16 EEF1B2 RPS15 RPS18 RPS17 RPS19 G3BP1 G3BP2 RPL36 RPL39 RPS10 RPL38 RPS12 RPS11 RPS14 RPS13 NSUN2 BTF3 RPL13A PA2G4 NAP1L1 RPS3A RPL37A NAT10 EEF1G PABPC1 CALR DDX47 RPS15A ZNF622 RPS27A HIST1H1B HIST1H1D NOP58 NPM1 RPL35A RPL23A EBNA1BP2 CANX TSR1 UBA52 SLC25A5 EIF3B RPLP0 RPLP2 RPL10L RPLP1 YBX1 RPL10A RPS4X RPL18A IGF2BP1 RACK1 RPL7A 
16.421286,0.36637008,Cluster 4,RPS12,TUFM SND1 RPS8 RPL22 RPL21 RPS9 RPS7 RPS3A RPSA FAU RPL27 RPL11 RPL10 RPL13 RPL12 HNRNPU RPL15 RPS5 RPL14 RPS3 RPS15A ZNF622 RPS27A NOP58 NPM1 RPL35A RPL23A MINA EEF2 RPS27 RPL27A TSR1 RPS20 RPS23 RPS25 RPL6 RPL3 RPL30 RPLP0 HSP90AB1 RPL35 YBX1 RPL10A RPL7 RPS4X RPS15 RPS17 G3BP1 G3BP2 IGF2BP1 RPL7A RPS14 RPS13 
16.310154,-0.46967337,Cluster 4,NSUN2,SND1 MPG RPL3 RPL30 RPS8 RPL11 DDX47 RPS9 RPL10 RPL13 RPL23A RPS3A RPL7 FBL RPS4X RPL27A G3BP1 RPS5 RPL14 RPS20 RPS3 RPL27 RPS15A 
16.552107,-0.07724015,Cluster 4,RPS7,SND1 RPS8 RPL21 RPS9 RPS3A RPS27 EBNA1BP2 RPL27A MTHFD1 FAU TSR1 RPS20 RPS25 RPL3 RPL30 RPL11 RPL10 RPLP2 RPL13 HNRNPU RPF2 RPS4X RPS15 G3BP1 PES1 RPS5 RPL14 RPL39 RPS3 RPS15A RPS27A 
15.698408,1.0000048,Cluster 4,RBM34,EIF5B SSB UPF1 RPS8 IMP3 RPL21 RPS9 DDX31 RPS3A GNL3 REXO4 GTPBP4 MRTO4 NSA2 LIN28B XRN2 DKC1 RPL7L1 RPL26 POP1 RPL27 ZNF512 RPL26L1 STAU2 NIP7 YTHDC2 RPL13 ZC3HAV1 RPF2 DHX30 LLPH PURA RPL36A PES1 RPL15 GAR1 RPL17 RRS1 RPL18 LYAR NOP58 MYEF2 NOP16 MRPS26 SURF6 DDX56 CCDC137 RPL35A PAPD5 MRPS22 RPL23A RRP1B NOC3L FTSJ3 GLTSCR2 MOV10 EBNA1BP2 MYBBP1A NOL12 GZF1 GLYR1 NOP56 RPS24 FYTTD1 RBM28 RPL6 RRP8 ZNF771 DDX27 RPL3 RPL30 WHSC1 RPLP2 DDX24 YBX1 DDX21 RPL10A KRI1 TTF1 RPL7 RRP9 LARP1 NKRF BRIX1 RPL36 IGF2BP3 
16.727203,-0.2810836,Cluster 4,RPLP2,TUFM RPL3 RPL30 RPS8 RPL11 HSP90AB1 RPL21 RPS9 RPS27 RPL27A G3BP1 RPS5 RPL39 HNRNPC RPS20 RPS3 RPS15A 
16.523222,0.849606,Cluster 4,RPL18A,SSB TUFM SND1 RPS8 RPL22 RPL21 RPS9 RPL24 RPL23 RPS7 RPSA EEF1A1 MTHFD1 RPL26 FAU RPL27 NHP2 RPL26L1 MPG RPL11 RPL10 RPL13 RPL12 HNRNPU ATP5A1 NOLC1 RRBP1 FBL PES1 RPL15 RPS5 RPL14 RPS3 RPL18 MYH7B MINA EEF2 EIF2S1 SRPK1 RPL3L RPS27 RPL27A RPS20 RPS23 NOP10 RPS25 RPL6 RPL31 RPL3 RPL30 RPL35 SRP14 RPL9 RPL7 RPS15 RPS17 RPS19 G3BP1 RPL36 RPL39 RPS12 RPS11 RPS14 RPS13 NSUN2 BTF3 NAP1L1 RPS3A RPL37A EEF1G PABPC1 DDX47 RPF2 RPS15A ZNF622 RPS27A NOP58 NPM1 NPM3 RPL35A RPL23A EBNA1BP2 HADHA UBA52 SLC25A5 EIF3B RPLP0 HSP90AB1 RPLP2 YBX1 RPL10A RPS4X IGF2BP1 IGF2BP3 RACK1 RPL7A RBM34 
16.623775,0.40372145,Cluster 4,RPS10,SSB TUFM SND1 NSUN2 BTF3 RPS8 RPL22 RPL21 RPS9 RPS6 RPL24 EIF1AX RPL23 RPS7 RPL13A RPS3A RPSA RPL37A NAT10 MTHFD1 RPL26 FAU HNRNPC PABPC1 RPL27 RPL11 DDX47 RPL10 RPL13 RPL12 HNRNPU PES1 RPL15 RPS5 RPL14 RPS3 RPS15A ZNF622 RPL18 RPS27A NPM1 RPL35A RPL23A RPS26 RPS29 RPL27A CANX TSR1 RPS20 RPS23 EIF3B RPS25 RPL6 RPL31 RPL3 RPL4 RPL30 RPLP0 RPL35 RPLP2 YBX1 RPL10A RPL9 RPL7 RPL8 RPS16 RPS4X RPS15 RPS18 RPS17 RPL18A RPS19 RRP15 RPL36 RPL39 RACK1 RPS12 RPS11 RPL7A RPS14 RPS13 
16.430328,-0.48366377,Cluster 4,NAP1L1,UTP15 RPS8 RPL22 RPL21 RPS9 RPS7 RPS3A RPL27A RPL27 RPL6 RPL3 RPL30 RPL10 RPLP2 RPL13 HNRNPU YBX1 NOLC1 RPL7 RPS15 RPL36AL PES1 RPL14 RPL39 RPS15A 
16.359009,-0.35757187,Cluster 4,EEF2,TUFM NSUN2 RPS8 RPL22 RPL21 RPS9 RPS7 RPL23A RPS3A EEF1A1 RPL27A RPL27 RPS25 RPL6 RPL3 RPL30 RPL11 RPLP0 RPL10 RPL13 RPL12 HNRNPU YBX1 RPL10A RPL7 RPS4X RPS15 RPL14 RPS3 RPS15A RPS14 
15.848054,-0.3126215,Cluster 4,NOLC1,RPL3 EBNA1BP2 RPL30 RPS8 RPS9 RPL27A PES1 RPS15A 
16.55277,-0.012080317,Cluster 4,RPS25,EIF5B TUFM SND1 RPS8 RPL21 RPS9 RPS3A RPL3L RPS27 EBNA1BP2 RPL27A FAU TSR1 RPS20 RPL3 RPL30 RPL11 DDX47 HSP90AB1 RPL10 RPLP2 RPF2 G3BP1 PES1 RPS5 RPL14 RPL39 RPS3 RPS15A RPS27A 
16.091448,-0.04367852,Cluster 4,EEF1A1,TUFM RPS8 RPL22 RPL21 RPS9 RPS7 KTN1 RPL23A NAP1L1 RPS3A EEF1D RPL27A MTHFD1 EEF1G RPL27 RPS25 LRRC59 RPL6 RPL3 RPL30 RPL11 RPL10 RPLP2 RPL13 HNRNPU YBX1 RPL10A RPL7 RPS4X RPL14 IGF2BP1 RPS15A RPS14 
16.690739,-0.22415666,Cluster 4,HIST1H1C,RPL6 RPS4X NPM1 RPL30 RPLP0 RPL22L1 RPS15A SLC25A6 RPS25 
16.742212,-0.21945722,Cluster 4,RPSA,SSB NSUN2 BTF3 RPS8 RPL22 RPL21 RPS9 RPS7 RPL35A RPL23A RPS3A RPS27 POR RPL27A EEF1G CANX RPL26 RPS21 TSR1 RPS20 RPL27 RPL6 RPL3 RPL30 RPL11 RPLP0 RPL10 RPLP2 RPL12 RPL34 HNRNPU YBX1 ATP5A1 RPL10A ATP5O RPL7 FBL RPS4X RPS15 RPS17 RPS5 RPL14 RPL39 RPS3 RPS15A RPS27A RPS14 
16.532179,0.7301241,Cluster 4,RPL9,SSB TUFM SND1 NSUN2 BTF3 RPS8 RPL22 RPL21 RPS9 RPL24 RPS7 NAP1L1 RPS3A RPSA EEF1A1 FAU HNRNPC PABPC1 RPL27 NHP2 RPL11 RPL10 RPL13 RPL12 HNRNPU FBL RPL15 RPS5 RPL14 RPS3 RPS15A ZNF622 RPL18 RPS27A NOP58 NPM1 RPL35A RPL23A NACA2 EEF2 SRPK1 RPL3L RPS27 EBNA1BP2 RPL27A RPS20 RPS23 SLC25A5 EIF3B RPS25 RPL6 RPL3 RPL30 RPLP0 HSP90AB1 RPL35 RPLP2 RPL34 YBX1 SRP14 RPL10A RPL7 RPS4X G3BP1 G3BP2 IGF2BP1 RPL36 RPL39 RPS12 RPL7A RPS14 RPS13 RBM34 
16.551493,-0.06354493,Cluster 4,RPL30,TUFM RPL3 RPL11 RPL21 RPS9 ATP5C1 MINA RPL3L RPS27 RPL27A G3BP1 PES1 FAU RPS5 HNRNPC RPS20 RPS3 RPS15A 
16.596382,0.7473996,Cluster 4,RPL37A,TUFM RPS8 RPL22 RPL21 RPS9 RPL24 RPL23 RPS7 NAP1L1 RPS3A RPSA EEF1A1 MTHFD1 EEF1G RPL26 FAU PABPC1 RPL27 RPL11 RPL10 RPL13 RPL12 HNRNPU ATP5A1 FBL RPF2 PES1 HIST1H1E RPL15 RPS5 RPL14 RPS3 RPS15A RPL18 RPS27A HIST1H1B HIST1H1D MYH7B NOP58 NPM1 RPL23A EEF2 EIF2S1 SRPK1 RPL3L EBNA1BP2 RPL27A HADHA RPS20 RPS23 SLC25A6 SLC25A5 RPS25 RPL6 RPL31 RPL3 RPL30 RPLP0 HSP90AB1 RPL35 RPLP2 RPL34 YBX1 SRP14 RPL10A RPL9 RPL7 RPS4X RPS15 RPS19 G3BP1 RPL37 IGF2BP1 RPL36 RPL39 RACK1 RPS12 RPS11 RPL7A RPS14 RPS13 RBM34 
15.737958,1.019374,Cluster 4,PWP1,RPS8 IMP3 IMP4 RPS9 RPL23 KNOP1 GTPBP4 MRTO4 LIN28B XRN2 DKC1 RPL7L1 RPL26 CCDC86 POP1 RPL26L1 STAU1 RPL11 NIP7 RPL13 RPL12 DHX30 SRP72 PES1 RPL15 RPL14 RPL18 NOP16 SURF6 DDX56 CCDC137 DDX50 FTSJ3 GLTSCR2 NOL12 RPS23 RSL24D1 GLYR1 RPL6 RRP8 RPL31 RPL3 RPL4 RPL30 WHSC1 MPHOSPH10 ZNF22 PPAN RPL9 TTF1 RPL7 RRP9 RPL8 RPS16 RPS15 RPS18 C7ORF50 BRIX1 RPL36 RPL13A DDX31 RPS3A GNL3 REXO4 GNL2 RPL37A CEBPZ ZNF512 HP1BP3 NVL NOP2 PAK1IP1 ZC3HAV1 RPF2 LLPH RRS1 RPS15A LYAR DDX18 NOP58 MYEF2 DDX10 PAPD5 RPL23A SRP68 NOC3L WDR12 RSL1D1 EBNA1BP2 MYBBP1A NMNAT1 HADHA GZF1 NOP56 FYTTD1 RBM28 DDX27 RPLP0 RPLP2 DDX24 DDX21 RPL10A RPL18A NKRF RRP15 NIFK RBM34 
16.414461,0.48236206,Cluster 4,RPL6,TUFM SND1 RPS8 RPL22 RPL21 RPS9 RPS7 RPS3A MTHFD1 FAU HNRNPC RPL27 RPL26L1 RPL11 RPL10 RPL13 HNRNPU NOLC1 ATP5O RPF2 RPL36AL MTHFD1L PES1 RPS5 RPL14 RPS3 RPS15A RPS27A MINA RPL3L RPS27 EBNA1BP2 RPL27A TSR1 RPS20 RPS25 RPL3 RPL30 USP10 HSP90AB1 RPLP2 RPL34 YBX1 RPS4X RPS15 G3BP1 RPL37 RPL39 IGF2BP3 
16.147934,0.22937758,Cluster 4,RPL11,TUFM RPL3 DDX47 RPL21 RPS9 MINA RPF2 RPL27A G3BP1 PES1 FAU RPS5 RPS3 RPS15A 
16.343199,0.5749464,Cluster 4,RPS19,SSB SND1 NSUN2 BTF3 RPS8 RPL22 DIMT1 RPL21 RPS9 RPL24 RPS7 RPS3A RPSA MTHFD1 EEF1G RPL26 HNRNPC RPL27 MPG RPL11 DDX47 RPL10 RPL13 RPL12 HNRNPU RRBP1 NOL6 FBL RPF2 MTHFD1L PES1 RPL15 RPS5 RPL14 RPS3 RPS15A ZNF622 RPL18 RPS27A MYH7B NPM1 NPM3 RPL35A RPL23A MINA SRPK1 RPS27 EBNA1BP2 RPL27A HADHA RPS21 TSR1 RPS20 UBA52 RPS23 SLC25A6 SLC25A5 EIF3B RPS25 RPL6 RPL3 RPL30 RPLP0 RPL35 RPLP2 YBX1 RPL10A RPL9 RPL7 RPS4X RPS15 RPS17 G3BP1 G3BP2 RPL36 RPL39 RPS12 RPL7A RPS14 RPS13 
15.716577,0.87502253,Cluster 4,NAT10,SSB NOP58 NPM1 NOP16 RPS8 RPS9 CCDC137 RPL23A RPS3A FTSJ3 GNL3 GNL2 RPSA SRPK1 RSL1D1 MYBBP1A TSR1 POP1 RPS24 HP1BP3 RPL6 RPL3 RPL10 RPL13 DDX24 HNRNPU YBX1 DDX21 PPAN ZC3H8 RPL10A RPL7 DHX30 LARP1 RPS15 RPS19 DHX57 RPS5 BRIX1 RPL17 RRP12 RPS3 RPS15A RPL7A LYAR RPS13 
16.771141,-0.18959607,Cluster 4,BTF3,RPS8 RPL21 RPS9 RPL23A RPS3A CANX RPS20 RPS25 RPL6 RPL30 HSP90AB1 RPL10 RPLP2 RPL13 RPL12 RPL34 HNRNPU YBX1 DLST ATP5A1 RPL10A ATP5O RPL7 G3BP1 G3BP2 RPS5 RPL14 RPL39 RPS3 RPS15A RPS27A 
16.192944,0.35991573,Cluster 4,RPS3A,TUFM SND1 RPS8 RPL21 RPS9 MINA RPS27 EBNA1BP2 RPL27A FAU TSR1 HNRNPC RPS20 RPL3 RPL30 RPL11 HSP90AB1 RPLP2 ATP5C1 RPF2 G3BP1 PES1 RPS5 RPL39 RPS3 RPS15A 
16.116001,0.072168455,Cluster 4,NPM1,SND1 NSUN2 RPS8 RPL22 RPL21 RPS9 LARP4B NAP1L1 RPS3A RPSA RPP25L RPL27 MPG RPL11 DDX47 RPL10 RPL13 RPL12 HNRNPU RRBP1 FBL EMG1 PDCD11 RPS5 RPL14 RPS3 RPS15A ZNF622 HIST1H1B NPM3 TEX10 H2AFV RPL35A RPL23A SCAF1 RPL3L RPS27 RPL27A RPS21 TSR1 RPS20 RPS25 HIST1H2BD RPL6 RPL3 RPL30 RPLP0 USP10 MUS81 RPL10A RPL7 RPS4X RPS15 RPS17 MTPAP G3BP1 RPL37 RPS14 
16.42734,0.69237256,Cluster 4,RPL36,TUFM SND1 NSUN2 RPS8 RPL22 RPL21 RPS9 RPS7 NAP1L1 RPS3A RPSA EEF1A1 MTHFD1 RPL26 FAU HNRNPC PABPC1 RPL27 RPL26L1 RPL11 RPL10 RPL13 RPL12 HNRNPU NOLC1 RRBP1 NOL6 FBL RPF2 RPL36AL PES1 RPL15 RPS5 RPL14 RPS3 RPS15A RPS27A NOP58 NPM1 RPL35A RPL23A MINA EEF2 RPL3L EBNA1BP2 RPL27A RPS20 UBA52 RPS23 SLC25A6 SLC25A5 EIF3B RPS25 RPL6 RPL3 RPL30 RPLP0 HSP90AB1 RPL35 RPLP2 RPL34 SRP14 RPL10A RPL7 RPS4X RPS15 G3BP1 RPL37 IGF2BP1 RPL39 RPS12 RPL7A RPS14 RPS13 
15.766771,1.0080864,Cluster 4,PUM3,RPS8 RPL21 RPS9 ZBTB11 KNOP1 GTPBP4 MRTO4 BOP1 LIN28B XRN2 DKC1 RPL7L1 RPL26 CCDC86 RPL28 POP1 RPL27 RPL26L1 STAU1 STAU2 RPL11 NIP7 RPL13 DHX30 HERC5 PURA PES1 RPL15 RPL14 RPL17 ZNF668 RPS3 RPL19 RPL18 NOP16 SURF6 DDX56 CCDC137 DDX54 DDX50 FTSJ3 GLTSCR2 MOV10 NOL12 RPS23 RSL24D1 GLYR1 RPS24 RPL6 RRP8 ZNF771 RPL31 PWP1 RPL3 RPL4 RPL30 WHSC1 RPL32 ZNF22 PPAN RPL9 TTF1 RPL7 RRP9 RPL8 RPS16 LARP1 RPS15 RPS18 C7ORF50 RPS19 BRIX1 RPL36 RPS10 RPL13A DDX31 RPS3A GNL3 REXO4 GNL2 WDR36 NSA2 CEBPZ ZNF512 HP1BP3 NVL NOP2 PAK1IP1 ZC3HAV1 CTCF RPF1 RPF2 LLPH GAR1 RRS1 RPS15A DDX18 NOP58 MYEF2 KRR1 DDX10 PAPD5 RPL23A NOC3L RSL1D1 EBNA1BP2 MYBBP1A ESF1 NOP56 RBM28 DDX27 RPLP0 RPLP2 RPLP1 DDX24 DDX21 RPL10A NOC2L KRI1 RPS4X RPL18A NKRF RRP15 RRP12 NIFK RBM34 
15.823286,0.76819456,Cluster 4,NHP2,NOP58 RPLP0 HADHA PES1 YBX1 ATP5A1 RPS20 RPS3 NOP10 FBL RPF2 
16.403048,0.9469345,Cluster 4,RPL8,SSB TUFM RPS8 RPL22 RPL21 RPS9 RPL24 RPL23 RPS7 RPSA MTHFD1 RPL26 FAU RPL22L1 RPL27 RPL26L1 RPL11 RPL10 RPL13 RPL12 HNRNPU ATP5A1 NOLC1 RRBP1 NOL6 FBL RPL36AL PES1 RPL15 RPS5 RPL14 RPS3 RPL18 MINA SRPK1 RPL3L RPS27 RPS29 RPL27A RPS20 RPS23 RPS25 RPL6 RPL31 RPL3 RPL4 RPL30 RPL35 RPL34 ATP5C1 RPL9 RPL7 RPS15 RPS19 G3BP1 RPL37 RPL36 RPL39 RPS12 RPS11 RPS14 RPS13 NSUN2 NAP1L1 RPS3A RPL37A NAT10 EEF1G CALR SLC25A4 SLC25A3 ATP5O RPF2 RPS15A ZNF622 RPS27A HIST1H1B HIST1H1C NPM1 RPL35A RPL23A EBNA1BP2 CANX TSR1 SLC25A6 SLC25A5 RPLP0 HSP90AB1 RPLP2 YBX1 RPL10A RPS4X RPL18A IGF2BP1 IGF2BP3 RACK1 RPL7A RBM34 
16.351524,0.646756,Cluster 4,RPL7A,TUFM SND1 NSUN2 RPS8 RPL22 RPL21 RPS9 RPS7 NAP1L1 RPS3A RPSA EEF1A1 MTHFD1 EEF1G FAU RPL27 MPG RPL11 DDX47 RPL10 RPL13 RPL12 HNRNPU NOLC1 RRBP1 RPL36AL HIST1H1E RPS5 RPL14 RPS3 RPS15A ZNF622 RPS27A HIST1H1B NPM1 NPM3 RPL35A RPL23A MINA EEF2 SRPK2 RPL3L RPS27 RPL27A GRWD1 CANX TSR1 RPS20 SLC25A6 SLC25A5 RPS25 RPL6 RPL3 RPL30 RPLP0 HSP90AB1 RPL35 RPLP2 RPL34 YBX1 ATP5C1 SRP14 RPL10A RPL7 RPS4X RPS15 RPS17 G3BP1 RPL37 IGF2BP1 RPL39 RPS14 RPS13 
16.174217,0.25267053,Cluster 4,RPS9,RPL3 DDX47 RPL21 RPL27A G3BP1 MTHFD1L PES1 FAU RPS5 MINA RPF2 
15.750735,0.809035,Cluster 4,USP10,RPS27 RFC4 RPS9 G3BP1 G3BP2 RPS5 TSR1 RPS3 
16.88916,0.013107566,Cluster 4,RPLP1,RPS8 RPL21 RPS6 RPL24 RPL23 RPS7 NAP1L4 NAP1L1 RPS3A RPSA EEF1A1 RPL37A EEF1G FAU PABPC1 RPL27 RPL29 RPL11 RPL10 RPL13 RPL12 HNRNPU ATP5A1 FBL RPF2 PES1 RPL15 RPS5 RPL14 RPS3 RPS15A RPL18 RPS27A MYH7B NOP58 RPL23A NACA2 EEF2 EIF2S1 SRPK1 SRPK2 RPS26 EBNA1BP2 RPL27A HADHA NCL RPS20 RPS23 SLC25A6 NOP10 SLC25A5 EIF3B RPS25 RPL6 RPL31 PWP1 RPL3 RPL4 RPL30 RPLP0 RPL32 RPLP2 RPL34 YBX1 RPL10A RPL9 RPL7 RPS16 RPS4X RPS18 RPL18A RPS19 RRP15 RPL36 RPL39 RPS10 RPL7A RPS14 RPS13 
16.399082,0.45208433,Cluster 4,RPL7,TUFM SND1 RPS8 RPL22 RPL21 RPS9 RPS7 RPS3A MTHFD1 FAU RPL27 RPL26L1 RPL11 DDX47 RPL10 RPL13 HNRNPU NOLC1 RRBP1 RPF2 RPL36AL PES1 RPS5 RPL14 RPS3 RPS15A ZNF622 RPS27A NPM3 MINA RPL3L RPS27 EBNA1BP2 RPL27A TSR1 RPS20 RPS25 RPL6 RPL3 RPL30 RPLP2 RPL34 YBX1 RPS4X RPS15 RPS17 G3BP1 RPL37 RPL39 IGF2BP3 
16.604057,0.64681745,Cluster 4,RPL35,SSB TUFM RPS8 RPL22 RPL21 RPS9 RPS7 NAP1L1 RPS3A RPSA EEF1A1 MTHFD1 EEF1G RPL26 FAU HNRNPC RPL27 RPL26L1 RPL11 RPL10 RPL13 RPL12 HNRNPU NOLC1 RRBP1 ATP5O RPL36AL MTHFD1L RPS5 RPL14 RPS3 RPS15A RPS27A NPM1 RPL35A RPL23A EEF2 RPS27 EBNA1BP2 RPL27A TSR1 RPS20 UBA52 SLC25A6 SLC25A5 RPS25 RPL6 RPL3 RPL30 RPLP0 HSP90AB1 RPLP2 RPL34 YBX1 SRP14 RPL10A RPL7 RPS4X RPS15 RPS17 G3BP1 RPL37 RPL39 RPS14 
16.621454,0.45329422,Cluster 4,RPL24,TUFM SND1 NSUN2 BTF3 RPS8 RPL22 RPL21 RPS9 RPS7 NAP1L1 RPS3A RPSA EEF1A1 MTHFD1 RPL26 FAU RPL27 MPG RPL11 DDX47 RPL10 RPL13 RPL12 HNRNPU ATP5A1 RRBP1 NOL6 RPF2 RPL36AL PES1 RPL15 RPS5 RPL14 RPS3 RPS15A ZNF622 RPL18 RPS27A HIST1H1B NPM1 NPM3 RPL35A RPL23A EEF2 RPL3L RPS27 EBNA1BP2 RPL27A TSR1 RPS20 UBA52 RPS23 SLC25A6 NOP10 SLC25A5 RPS25 RPL6 RPL3 RPL30 RPLP0 RPL35 RPLP2 RPL34 YBX1 SRP14 RPL10A RPL7 RPS4X RPS15 G3BP1 RPL37 RPL36 RPL39 RPS12 RPL7A RPS14 RPS13 
16.002077,0.80845475,Cluster 4,H1F0,RBM28 RPL6 RPL3 RPS8 RPL32 DDX21 ZBTB11 ZNF22 RPS3A FTSJ3 RPL7 RPS16 RSL1D1 LLPH RPL37A HIST1H1E BRIX1 GZF1 RPS15A ZNF512 RPS11 GLYR1 
15.97929,0.76130456,Cluster 4,EBNA1BP2,RPL3 RPL30 STAU2 RPL11 RPL21 RPS9 RPLP2 MPHOSPH10 PAPD5 LARP7 RPF2 DHX30 MYBBP1A DKC1 RPL27A PES1 RPS15A LYAR NOP56 FYTTD1 
16.409304,0.52570444,Cluster 4,RPL23A,TUFM SND1 RPS8 RPL22 RPL21 RPS9 RPS7 NAP1L1 RPS3A MTHFD1 RPL26 FAU RPL27 RPL26L1 RPL11 DDX47 RPL10 RPL13 HNRNPU RRBP1 RPF2 RPL36AL PES1 RPS5 RPL14 RPS3 RPS15A ZNF622 RPS27A NPM3 MINA RPL3L RPS27 EBNA1BP2 RPL27A HADHA CANX TSR1 RPS20 SLC25A6 RPS25 RPL6 RPL3 RPL30 HSP90AB1 RPLP2 RPL34 YBX1 RPL10A RPL7 RPS4X RPS15 G3BP1 RPL37 RPL39 IGF2BP3 
15.818055,0.9413378,Cluster 4,RPS13,TUFM SND1 RPS8 RPL22 IMP3 RPL21 RPS9 RPS7 RPSA LARP7 SMARCA5 MRTO4 EEF1A1 RPL7L1 MTHFD1 FAU RPL22L1 RPL27 ZCCHC9 STAU2 RPL11 NIP7 RPL10 RPL13 RPL12 HNRNPU NOLC1 RRBP1 NOL6 FBL DHX30 HERC5 RPL36AL RPS5 RPL14 RPL17 RPS3 NOP16 SURF6 CCDC137 MINA EEF2 FTSJ3 GLTSCR2 RPS27 MOV10 RPL27A RPS21 RPS20 RPS25 RPS24 RPL6 RRP8 ZNF771 RPL3 ZNF770 RPL30 WHSC1 RPL35 RPL34 SRP14 RPL7 RRP9 LARP1 RPS15 RPS17 G3BP1 RPL37 BRIX1 RPL39 RPS14 NSUN2 BTF3 NAP1L1 DDX31 RPS3A GNL3 REXO4 NSA2 EEF1G PABPC4 DDX47 YTHDC2 ZC3HAV1 LLPH RPL36A HIST1H1E RRS1 RPS15A ZNF622 RPS27A HIST1H1B LYAR HIST1H1C NOP58 NPM1 NPM3 DDX10 RPL35A PAPD5 RPL23A RRP1B NOC3L MYBBP1A TSR1 GZF1 SLC25A5 RBM28 ZNF574 DDX27 RPLP0 HSP90AB1 RPLP2 DDX24 YBX1 DDX21 RPL10A RPS4X DHX57 BMS1 IGF2BP1 
15.927705,0.08616712,Cluster 4,GRWD1,EIF5 RPL11 HADHA NOLC1 RPS5 RPS3 RPL10A ZNF622 RPL7 FBL 
15.746161,0.96780676,Cluster 4,RPL15,SSB TUFM RPS8 IMP3 IMP4 RPL21 RPS9 RPS7 RPSA LARP7 GTPBP4 MRTO4 LIN28B DKC1 RPL7L1 RPL26 FAU RPL27 RPL26L1 STAU2 RPL11 NIP7 RPL13 RPL12 NOLC1 DHX30 HERC5 PURA PES1 RPL14 RPL17 RPS3 NOP16 SURF6 DDX56 CCDC137 EEF2 FTSJ3 GLTSCR2 RPL3L RPS27 MOV10 RPL27A RPS20 NOL12 RPS25 RPS24 RPL6 RRP8 ZNF771 RPL3 ZNF770 RPL30 WHSC1 RPL35 MPHOSPH10 RPL34 RPL7 RRP9 LARP1 RPS15 G3BP1 BRIX1 RPL39 RPS14 NSUN2 DDX31 RPS3A GNL3 REXO4 NSA2 EEF1G PABPC4 YTHDC2 ZC3HAV1 RPF2 LLPH RPL36A RRS1 RPS15A RPS27A LYAR MYEF2 MRPS26 RPL35A PAPD5 MRPS22 RPL23A RRP1B NOC3L EBNA1BP2 MYBBP1A GZF1 SLC25A6 SLC25A5 NOP56 RBM28 DDX27 RPLP0 RPLP2 DDX24 YBX1 DDX21 RPL10A RPS4X DHX57 IGF2BP1 IGF2BP3 
16.178526,0.29150292,Cluster 4,RPS8,TUFM SND1 RPL21 RPS9 MINA RPL3L RPS27 EBNA1BP2 RPL27A FAU TSR1 HNRNPC RPS20 RPL3 RPL30 RPL11 HSP90AB1 RPF2 RPL36AL RPS17 G3BP1 G3BP2 PES1 RPS5 RPL39 RPS3 RPS15A 
16.603945,0.27789393,Cluster 4,RPL27,TUFM NPM3 RPS8 RPL22 RPL21 RPS9 RPS7 RPS3A RPL3L RPS27 EBNA1BP2 RPL27A MTHFD1 FAU HNRNPC RPS20 RPS25 RPL26L1 RPL3 RPL30 RPL11 HSP90AB1 RPL10 RPLP2 RPL13 RPL34 HNRNPU NOLC1 RPF2 RPS4X RPS15 G3BP1 G3BP2 PES1 RPL37 RPS5 RPL14 RPL39 RPS3 RPS15A RPS27A 
15.998855,0.06734448,Cluster 4,NOP58,RPS9 RPS7 RPL35A RPS3A SRPK2 EBNA1BP2 GRWD1 EEF1G RPL27 NOP10 RPL3 RPL30 RPL11 RPLP0 DDX47 RPL10 RPLP2 RPL12 YBX1 ATP5A1 NOLC1 RPL7 NOL6 FBL RPF2 RPS4X PES1 RPL14 RPS15A RPS14 
16.668358,0.048623305,Cluster 4,RPS4X,EIF5B TUFM SND1 RPS8 RPL21 RPS9 MINA RPS3A RPS27 EBNA1BP2 RPL27A FAU TSR1 HNRNPC RPS20 RPS25 RPL3 RPL30 RPL11 RPL10 RPLP2 RPL13 HNRNPU RPF2 RPL36AL G3BP1 PES1 RPL37 RPS5 RPL14 RPL39 RPS3 RPS15A RPS27A 
16.27133,0.25367895,Cluster 4,FBL,RPL3 RPL30 RPS8 RPL11 DDX47 HSP90AB1 RPL21 RPL10 RPLP2 RPS7 HNRNPU YBX1 NOLC1 RPS3A DDX51 RPS27 RPS4X RPS5 RPL14 RPL39 TSR1 RPL27 RPS15A SRFBP1 
16.502544,0.8366376,Cluster 4,RPL4,TUFM SND1 NSUN2 BTF3 RPS8 RPL22 RPL21 RPS9 RPL24 RPL23 RPS7 NAP1L4 NAP1L1 RPS3A RPSA EEF1A1 RPL37A NAT10 MTHFD1 EEF1G RPL26 FAU HNRNPC PABPC1 RPL27 CALR RPL29 RPL26L1 RPL11 RPL10 RPL13 RPL12 HNRNPU ATP5A1 NOLC1 RRBP1 RPF2 RPL36AL MTHFD1L PES1 RPL15 RPS5 RPL14 RPS3 RPS15A ZNF622 RPL18 RPS27A NPM1 RPL35A RPL23A MINA EEF2 EIF2S1 RPL3L RPS27 EBNA1BP2 RPL27A TSR1 RPS20 UBA52 RPS23 SLC25A6 SLC25A5 EIF3B RPS25 RPL6 RPL31 RPL3 RPL30 RPLP0 HSP90AB1 RPL35 RPLP2 RPL34 YBX1 SRP14 RPL10A RPL9 RPL7 RPS4X RPS15 RPL18A RPS19 G3BP1 G3BP2 IGF2BP1 RPL36 RPL39 RACK1 RPS12 RPS11 RPL7A RPS14 RPS13 RBM34 
