x,y,cluster,term,genes
5.229789,0.73411137,Cluster 7,SAFB,HNRNPM DDX5 PRPF19 EIF2S2 MCM2 
5.096634,1.6178666,Cluster 7,EFTUD2,RBM39 AQR SF3A3 DDX17 THOC2 PRPF40A EIF2S2 WBP11 SRRM2 U2SURP PRPF6 PRPF8 PRPF19 CD2BP2 PRPF31 SRSF4 ACIN1 SRSF6 SRSF7 SF3A1 DDX23 PSIP1 CDC73 SART1 SNRPD1 SF3B2 SRSF11 
5.4223475,1.2250746,Cluster 7,SNRPA1,SNRPN SF3A2 SF3A3 DDX17 CDC5L PRPF40A EIF2S2 PRPF6 PHF5A GPATCH11 KPNB1 PRPF8 SNW1 PRPF19 PRPF31 SNRPF SF3A1 RBM25 SF3B5 SF3B6 SLC4A1AP SF3B3 SRRT DDX23 HTATSF1 EFTUD2 SART1 SNRPD2 SNRPD1 DHX15 SNRPB2 SF3B2 SMNDC1 
5.4054675,0.4980004,Cluster 7,BUD31,AQR SF3A2 ISY1 LSM2 CDC5L NTPCR LSM6 XAB2 SNW1 PRPF19 DDX39B DHX35 CCDC12 PPIE SMNDC1 
5.1541576,1.7049565,Cluster 7,SNRPD2,IK SF3A2 SF3A3 DDX17 THOC2 SSRP1 PRPF40A EIF2S2 WBP11 U2SURP PRPF6 HNRNPM KPNB1 PRPF8 SMU1 PRPF19 MSH6 CD2BP2 PRPF31 SNRPF CDK12 SRSF5 SNRPE SF3A1 RAN DDX3X TCERG1 USP39 DDX5 DHX9 SRRT DDX23 PSIP1 CHD4 CDC73 EFTUD2 U2AF1L5 SART1 SNRPD1 DHX15 SNRPB2 SF3B2 SRSF11 
4.878346,0.035668746,Cluster 7,ZNF574,SET DHX30 IMP3 ZKSCAN8 RPS5 GZF1 GLTSCR2 
5.362175,0.93482983,Cluster 7,SNRNP40,AQR RANBP2 CDC5L WBP11 PRPF6 XAB2 NUDT21 PRPF8 SNW1 PRPF19 PRPF3 CD2BP2 PRPF31 CDK12 SNRNP200 SNRPB USP39 DDX23 PQBP1 SNU13 EFTUD2 SART1 PLRG1 SNRPD1 SNRPB2 TXNL4A SMNDC1 BCAS2 
5.3529816,0.9086536,Cluster 7,SF3B2,SF3A2 SF3A3 DDX17 ZCRB1 CCDC137 PRPF40A CHERP FTSJ3 GNL3 LARP7 SMARCA5 U2SURP MOV10 PRPF8 MYBBP1A PRPF19 PRPF31 GZF1 SF3A1 ZCCHC3 SF3B5 RRP8 ZNF771 DDX23 DDX21 CDC73 LARP1 RPS5 SNRPB2 MMTAG2 
5.557444,0.68393016,Cluster 7,SRP68,DDX18 NOP16 IMP4 CCDC137 CHERP FTSJ3 GNL3 GTPBP4 RSL1D1 MYBBP1A RPL7L1 TSR1 GZF1 GLYR1 NOP56 RPS24 STAU1 DDX24 PRDM15 YBX3 KRI1 DHX30 SRP72 PES1 RPS5 RPL17 RRP12 SF3B2 LYAR 
4.7407436,-0.10029571,Cluster 7,RCC1,SMPD4 RANBP3 NXF1 GLE1 NTMT1 UBE2I TMEM214 SUMO1 RGPD5 DLGAP5 RANGAP1 
5.319245,0.83083755,Cluster 7,RBM22,AQR PRPF8 SNW1 ISY1 PRPF19 CCDC12 PPIE CMPK1 
5.4257507,0.8136883,Cluster 7,PABPC4,ZNF771 UPF1 STAU2 ZCRB1 DDX21 FTSJ3 LARP7 GTPBP4 MOV10 DHX30 LARP1 MYBBP1A DKC1 RPS5 IGF2BP3 GZF1 SF3B2 ZCCHC3 
5.1771173,1.3989269,Cluster 7,PSIP1,SF3A3 PRPF19 PRPF40A SF3A1 SF3B2 SRSF11 
2.6595883,3.7100155,Cluster 8,CDK1,CDKN1B CDKN1C CKS1B PKMYT1 SKP2 
3.035638,3.152397,Cluster 8,STAG1,RAD21 STAG2 CDCA5 SMC1B WAPL SMC3 
2.2871025,4.020399,Cluster 8,HAUS7,HAUS8 HAUS5 HAUS4 HAUS6 HAUS1 HAUS3 HAUS2 
3.584719,3.254039,Cluster 8,RGPD8,NUP205 NUP107 CDCA2 NDC1 NUP153 NUP210 NUP160 RANGAP1 AAAS SMPD4 NXF1 GLE1 NUP50 TMEM214 NUP98 SUMO1 NUP43 NUP85 NUP35 TMEM209 NUPL2 
2.4042401,3.9908292,Cluster 8,HAUS1,HAUS5 HAUS4 HAUS6 HAUS3 HAUS2 
2.9347343,3.3107667,Cluster 8,LIN37,LIN9 MYBL1 LIN52 MYBL2 LIN54 
2.5262818,3.6009479,Cluster 8,CDC26,ANAPC13 ANAPC15 CFAP97 FZR1 CDC16 CDC27 ANAPC5 ANAPC1 CDC20 
3.4710135,3.3648214,Cluster 8,NUP155,NUP205 RANBP2 NUP107 NUP214 NDC1 NUP210 RGPD8 NUP160 AAAS NXF1 GLE1 NUP93 TMEM214 SUMO1 NUP43 NUP85 NUP35 TMEM209 NUP88 
3.653758,3.1271083,Cluster 8,TMEM214,GLE1 UBE2I SUMO1 NUP35 NUP210 NUP133 
2.4297018,4.2931123,Cluster 8,SPC25,SPC24 PMF1 NUF2 CASC5 ZWINT 
2.4787896,4.1236033,Cluster 8,RFC3,PCNA RFC4 RFC5 RPL10 RFC1 
3.0102816,2.971425,Cluster 8,GEMIN4,XPO4 DYM SAAL1 THADA GEMIN8 TNPO2 
3.552279,3.266251,Cluster 8,RANBP2,CPSF6 SF3A3 NDC1 THOC2 CDC5L NUP153 NUP210 RANGAP1 KPNB1 NUP50 PRPF8 PRPF19 NUP98 NUP35 NUP37 RAN NUP205 NUP107 DDX5 SRRT RGPD8 NUP160 EFTUD2 AAAS NXF1 GLE1 SUMO1 SNRPD2 NUP43 NUP85 SNRPD1 TMEM209 
3.4830153,3.1623983,Cluster 8,NUP50,RNGTT KLHL7 KIFC1 NUP153 WDHD1 KPNA2 RANGAP1 
3.7326078,3.1041014,Cluster 8,NUP43,GLE1 TMEM214 SUMO1 NUP35 NUP153 NUP210 NUP133 
3.1372266,3.1238241,Cluster 8,DYNLL1,ZMYM4 HMMR TLK2 GLCCI1 FAM83D 
3.4518251,3.0165281,Cluster 8,PDS5B,STAG1 RAD21 PRPF19 CDCA5 CDC5L EIF2S2 SMC1A WAPL SMC3 
2.4104512,4.2456837,Cluster 8,CENPI,CENPU CENPH CENPK CENPM CENPN CENPO CENPP CENPQ ITGB3BP CENPT 
3.473475,3.375675,Cluster 8,NUP205,SMPD4 GLE1 NUP107 TMEM214 SUMO1 NUP43 NUP35 NUP153 NUP210 NUP133 NUP88 NUP160 
3.51827,3.2820878,Cluster 8,NUP85,NUP205 NUP107 NDC1 NUP153 NUP210 NUP133 NUP160 AAAS SMPD4 NXF1 GLE1 TMEM214 NUP98 SUMO1 NUP43 NUP35 TMEM209 NUP37 
3.6212373,3.2317843,Cluster 8,TMEM209,NUP205 NUP107 UBE2I NDC1 NUP153 NUP210 NUP160 NXF1 GLE1 TMEM214 SUMO1 NUP43 NUP35 RCC1 
2.348132,4.3253474,Cluster 8,NSL1,SPC24 PMF1 NUF2 CASC5 ZWINT SPC25 NDC80 
2.8133888,3.355028,Cluster 8,ANAPC15,ANAPC13 CFAP97 FZR1 GNPTAB CDC16 CDC27 FBXO5 ANAPC5 SORBS3 ANAPC1 CDC20 
2.365759,4.1798067,Cluster 8,CENPK,CENPU CENPH CENPM CENPN CENPO ITGB3BP CENPT 
2.412667,4.241631,Cluster 8,CENPQ,CENPU CENPK CENPM CENPN CENPO ITGB3BP CENPT 
2.5275445,4.049595,Cluster 8,CCNA2,CDT1 CDKN1B CDKN1C CCNB1 GMNN CCNE2 CCNE1 CDK3 CKS1B CDK2 CDK1 SKP2 
3.6653178,3.200971,Cluster 8,NDC1,NUP205 NUP107 UBE2I NUP153 NUP210 NUP160 NXF1 GLE1 TMEM214 SUMO1 NUP43 NUP35 RCC1 
2.4692278,3.6374528,Cluster 8,ANAPC10,ANAPC15 FZR1 CDC26 CDC16 CDC27 GNPTG FBXO5 ANAPC5 ANAPC1 
3.2318497,3.2066123,Cluster 8,BUB3,BUB1B KCTD20 BTBD10 BUB1 CDC20 
2.4983444,4.144802,Cluster 8,RFC2,RFC4 RFC5 RFC3 RPL10 RFC1 
3.5575411,3.2555087,Cluster 8,NXF1,GLE1 NUP205 NUP107 UBE2I TMEM214 SUMO1 NUP43 NUP35 NUP153 NUP210 NUP160 NUP37 
3.5051305,3.2953537,Cluster 8,NUP93,NUP205 RANBP2 NUP107 NUP214 NDC1 NUP153 NUP210 RGPD8 NUP160 AAAS NXF1 GLE1 TMEM214 SUMO1 NUP43 NUP85 NUP35 NUP88 
2.4572825,4.193171,Cluster 8,CENPH,CENPU CENPN CENPO ITGB3BP CENPT 
3.837798,2.6564927,Cluster 8,SAAL1,EIF2B4 EIF2B3 XPO4 TNPO2 TNPO3 
3.473026,3.3229575,Cluster 8,SEH1L,NUP205 RANBP2 NUP107 NDC1 NUP153 NUP210 NUP133 NUP155 RGPD8 NUP160 AAAS NXF1 GLE1 NUP93 TMEM214 NUP98 SUMO1 NUP43 NUP85 NUP35 TMEM209 NUP37 
3.1347594,3.1055343,Cluster 8,SMC1A,STAG1 RAD21 STAG2 CDCA5 CDC5L WAPL SMC3 
2.4159367,4.2751765,Cluster 8,CENPP,CENPU CENPH CENPK CENPN CENPO CENPQ ITGB3BP CENPT 
3.6189625,3.223942,Cluster 8,NUP160,SMPD4 GLE1 NUP107 TMEM214 SUMO1 NUP43 NUP35 NUP153 NUP210 NUP133 
2.338276,3.718676,Cluster 8,ANAPC7,ANAPC13 ANAPC15 FZR1 CDC26 CDC16 CDC27 ANAPC5 ANAPC1 ANAPC10 
2.5256722,4.088105,Cluster 8,SKP2,CDKN1C GMNN CDK3 CKS1B CDK2 
3.6518445,3.1233165,Cluster 8,NUP188,SMPD4 NUP205 NUP93 TMEM214 NUP43 NUP85 NUP214 NUP35 NUP210 NUP155 NUP160 AAAS 
3.4219186,3.3435888,Cluster 8,NUP37,GLE1 NUP107 TMEM214 SUMO1 NUP43 NUP153 NUP133 NUP160 
3.5700026,2.869731,Cluster 8,ZBTB2,ZNF639 CDK2AP1 RBBP7 CHD4 ELP6 
3.552776,3.30011,Cluster 8,NUP107,GLE1 TMEM214 SUMO1 NUP43 NUP35 NUP153 NUP210 NUP133 
2.409184,4.255189,Cluster 8,DSN1,SPC24 PMF1 NUF2 CASC5 MIS12 NSL1 ZWINT SPC25 NDC80 
2.447817,4.23598,Cluster 8,MIS12,SPC24 PMF1 NUF2 CASC5 NSL1 ZWINT SPC25 NDC80 
3.4009273,3.273243,Cluster 8,NUP98,GLE1 NUP205 NUP107 NUP43 NUP35 NUP153 NUP160 NUP37 
2.6399717,3.2670956,Cluster 8,MAGIX,TJP1 CDC23 ANAPC16 CDC26 CDC16 CDC27 ANAPC5 ANAPC2 
2.4087586,3.7852843,Cluster 8,ANAPC4,ANAPC13 ANAPC15 ANAPC16 ANAPC10 CDC23 FZR1 PENK CDC26 CDC16 CDC27 NEK2 ANAPC5 ANAPC7 ANAPC1 ANAPC2 
3.0535367,3.149658,Cluster 8,STAG2,RAD21 CDCA5 SMC1B WAPL SMC3 
2.4641907,3.90835,Cluster 8,ANAPC2,ANAPC13 ANAPC15 CFAP97 ANAPC16 ANAPC10 CDC20 CDC23 FZR1 GNPTAB CDC26 CDC16 CDC27 GNPTG FBXO5 ANAPC5 ANAPC7 ANAPC1 
3.6234465,3.2205062,Cluster 8,AAAS,NUP205 NUP107 UBE2I NDC1 NUP153 NUP210 NUP133 NUP160 SMPD4 NXF1 GLE1 TMEM214 NUP98 SUMO1 NUP43 NUP35 RCC1 TMEM209 NUP37 
2.417156,4.241652,Cluster 8,CDK2,RBL1 CDKN1C GMNN CCNE2 CKS1B 
2.4463134,3.8350089,Cluster 8,CDC23,ANAPC13 ANAPC15 CFAP97 ANAPC10 CDC20 FZR1 GNPTAB CDC26 CDC16 CDC27 GNPTG FBXO5 ANAPC5 ANAPC7 ANAPC1 
2.3861103,4.384742,Cluster 8,NDC80,SPC24 PMF1 NUF2 CASC5 ZWINT SPC25 
3.7632124,2.9850385,Cluster 8,MCM5,MCM4 MCMBP MCM6 MCM7 DNMT1 MCM2 MCM3 
2.3944695,4.1995554,Cluster 8,GINS4,GINS2 GINS3 GINS1 TIMELESS TIPIN WDHD1 
2.3714,3.7440588,Cluster 8,ANAPC16,ANAPC13 CDC23 ANAPC15 FZR1 CDC26 CDC16 CDC27 ANAPC5 ANAPC7 ANAPC1 ANAPC10 CDC20 
17.621704,-1.5282526,Cluster 9,UBA52,RPS8 RPLP2 RPL13 RPL34 RPS7 RPS3A RPL7 FBL RPS27 RPS4X RPS15 RPL27A PES1 RPL26 RPL37 RPS5 RPS20 RPS3 RPS15A RPS27A RPS25 RPL26L1 
17.56812,-1.4255967,Cluster 9,SND1,ATP6V1D RPL3 RPL30 RPL11 DDX47 RPL21 RPS9 RPL27A RPS5 RPS3 RPS15A 
17.07135,-0.42257777,Cluster 9,RPS15,RPS8 RPL21 RPS9 RPS3A RPS27 EBNA1BP2 RPL27A FAU RPS21 TSR1 RPS25 RPL26L1 SLC25A4 RPL3 RPL30 RPL11 DDX47 RPL10 RPL13 HNRNPU NOLC1 RPF2 RPL36AL RPS17 G3BP1 PES1 RPL37 RPS5 RPL14 RPL39 IGF2BP3 RPS3 RPS15A RPS27A 
16.970196,-0.88629603,Cluster 9,HSP90AA1,BTF3 RPS8 RPL21 RPS9 RPS6 RPL23 RPL23A HSPA4 RPS3A RPL27A RPL37A HADHA RPS20 RPL27 RPS23 RPL6 RPL31 RPL3 RPL4 RPL30 RPLP0 HSP90AB1 RPL10 RPL35 RPLP2 RPL13 RPL10L RPL12 YBX1 ATP5A1 RPL9 FBL RPL8 RPS16 EEF1B2 RPS18 RPL18A RPL14 RPL36 RPS3 RPL19 RPS15A RPS12 RPS11 RPL7A RPS13 
17.138878,-0.5715503,Cluster 9,RPL10,SND1 RFC4 RFC5 RPS8 NO66 RPL21 RPS9 RPS3A RPS27 RPL27A FAU TSR1 RPS20 RPL3 RPL30 RPL11 DDX47 USP10 HSP90AB1 RPLP2 ATP5C1 RPL36AL RPS17 G3BP1 RPS5 RPL14 RPL39 RPS3 RPS15A 
17.576778,-1.4966118,Cluster 9,HIST1H1B,RPS8 RPL11 RPL22 RPL21 RPS9 RPL10 RPL13 HNRNPU RPL23A RPS3A RPL10A RPS4X RPL27A RPS3 RPS15A RPS25 
16.611526,-0.82408565,Cluster 9,SRP14,SRP9 RPL6 RPL3 RPL30 RPS8 RPL11 RPL21 RPS9 RPL10 RPLP2 RPL13 RPS7 HNRNPU YBX1 NAP1L1 RPS3A RPL10A RPL7 RPL27A RPL14 RPL27 RPS15A 
16.84031,-0.8371389,Cluster 9,EEF1G,MKKS RPS8 RPL21 RPS9 RPS7 RPL23A RPS3A EEF1A2 EEF1D RPL27A MTHFD1 RPL26 RPL27 RPL6 RPL3 RPL30 RPL10 NCKAP1 RPL13 YBX1 ATP5A1 NOLC1 RPL10A RPL7 RPS15 RPL36AL RPS15A RPS27A 
16.631672,-0.62595946,Cluster 9,CALR,TUFM RPS8 RPL21 RPS9 RPL23 NACA2 RPS3A CANX P4HB CALU HNRNPC RPL27 INHA RPL6 RPL31 RPL3 RPL35 RPLP2 YBX1 ENO3 RPL7 RPL18A RPL15 RPS15A RPL18 
17.019999,-0.6485312,Cluster 9,SERBP1,TTC37 NPM1 NPM3 RPS8 RPL21 RPS9 RPS6 RPL24 EIF1AX RPL23 RPS3A RPL27A DHX29 RPS20 RPL27 RPS23 RPS25 CCDC124 RPL6 MPG RPL3 RPL4 RPL30 RPLP0 DDX47 RPL10 RPL35 RPL13 RTCB HNRNPU RPL10A RPL9 RPS16 RPS4X RPS18 RPL18A RPS19 G3BP1 RPL14 RPL36 RPS3 RACK1 RPS15A ZNF622 RPL18 RPL7A RPS14 RPS13 
17.211506,-1.0160768,Cluster 9,MEPCE,NPM1 RPS8 RPS6 RPL24 RPL23A RPS3A RPS27 TSR1 RPS25 RPL6 RPL11 RPL32 RPL10 RPL35 HNRNPU RPL7 RPL8 RPS4X RPS18 RPS17 RPS19 RPS5 IGF2BP1 RPL36 RPS10 RPS3 RPL7A RPS14 RPS13 
17.161179,-1.0203428,Cluster 9,RPL22,TUFM SND1 RPS8 RPL21 RPS9 RPS7 RPS3A RPS27 RPL27A FAU RPS20 RPS25 RPL3 RPL30 RPL11 RPL10 RPLP2 RPL13 RPL34 HNRNPU NOLC1 ATP5C1 RRBP1 RPS4X RPS15 RPL36AL G3BP1 RPS5 RPL14 RPL39 RPS3 RPS15A RPS27A 
17.39808,-1.1837286,Cluster 9,RPL28,NPM1 RPL21 RPS6 RPL23 RPL23A RPS3A RPS29 EBNA1BP2 FAU RPS23 NOP10 RPS25 PWP1 RPLP0 RPL32 RPL35 RPLP2 RPL13 RPL34 RPLP1 HNRNPU NOLC1 RPL7 RPL8 RPS16 RPS15 RPS19 PES1 RPL15 RPL37 RRP15 RPL14 RPL36 RPL38 RPL19 RPS15A RPS11 RPL18 RPS27A RPS14 
16.721079,-0.5901986,Cluster 9,ATP5A1,TUFM RPL21 RPS3A ATP5F1 HADHA UQCRC2 FAU SLC25A6 RPS25 SLC25A4 RPL3 ACADVL HSP90AB1 RPLP2 RPL13 YBX1 ATP5L DLST ATP5C1 ATP2A2 RPL10A ATP5O ATP5E RPL14 RPS3 
17.22909,-0.75569975,Cluster 9,MPG,SND1 RPL11 DDX47 RPL23A RPL7 KBTBD4 RPS27 EMG1 RPS5 RPL14 TSR1 ZNF622 RPS25 
16.474823,-0.65105134,Cluster 9,RRBP1,RPL3 RPL30 RPS8 RPL11 USP10 RPS9 RPL10 RPL13 RPS3A RPS4X RPS17 RPS5 RPL14 RPS20 RPS3 RPS15A RPS25 
17.68169,-1.5794781,Cluster 9,RPL34,RPL3 RPL30 RPS8 RPL21 RPS9 RPL13 RPS3A RPS27 RPS15 RPL36AL EBNA1BP2 RPL27A RPL37 FAU RPL14 RPS21 RPL39 RPS20 RPS3 RPS15A RPS27A RPS25 RPL26L1 
17.615845,-1.5303599,Cluster 9,MTHFD1,RPL3 RPL30 RPS8 RPL21 RPS9 RPL10 RPL13 RPS3A RPS4X RPL27A RPL14 RPS20 RPS3 RPS15A 
17.084932,-0.49013394,Cluster 9,RPL13,TUFM SND1 RPS8 RPL21 RPS9 RPS3A RPL3L RPS27 EBNA1BP2 RPL27A FAU RPS20 RPS25 RPL3 RPL30 RPL11 DDX47 HSP90AB1 RPL10 HNRNPU ATP5C1 ATP5O RPF2 RPL36AL G3BP1 G3BP2 PES1 RPL37 RPS5 RPL14 RPL39 RPS3 RPS15A RPS27A 
17.354755,-1.1729889,Cluster 9,RPL35A,RPS8 RPL22 RPL21 RPS9 RPL23A RPS3A RPS27 EBNA1BP2 RPL27A RPL26 RPS20 RPL27 UBA52 SLC25A5 RPS25 RPL6 RPL3 RPL30 RPL11 RPL10 RPLP2 RPL13 RPL34 YBX1 NOLC1 RPL10A RPL7 RPF2 RPS4X RPS15 RPL36AL RPL37 RPS5 RPL14 RPS3 RPS15A 
17.582249,-1.4497337,Cluster 9,RPL37,RPL36AL RPL3 RPL21 RPL27A FAU RPL39 RPS3 RPS15A 
17.08345,-0.46915907,Cluster 9,RPL12,SSB TUFM NSUN2 RPS8 RPL22 RPL21 RPS9 RPS7 RPL35A RPL23A NAP1L1 RPS3A RPS27 EEF1A1 EBNA1BP2 RPL27A FAU RPS20 RPL27 SLC25A5 RPS25 RPL26L1 RPL6 RPL3 RPL30 RPL11 HSP90AB1 RPL10 RPLP2 RPL13 RPL34 HNRNPU YBX1 SRP14 RPL10A RPL7 RPS4X G3BP1 PES1 RPS5 RPL14 RPL39 RPS3 RPS15A RPS27A RPS14 
17.67478,-1.5431746,Cluster 9,HSP90AB1,RPL3 RPL30 RPL11 RPL21 RPS9 RPL27A RPS20 RPS3 RPS15A 
17.570164,-1.5509771,Cluster 9,CCDC124,LARP1 RPS19 RPL10 RPL13 YBX3 EIF1B RPS12 EIF2D RPL7A RPS14 RPS13 
17.149012,-0.996463,Cluster 9,SRPK1,NOP58 RPS8 RPL22 RPL21 RPS9 RPS7 RPL35A RPL23A SRPK2 EBNA1BP2 RPL27A RPL11 RPLP0 RPL10 RPLP2 RPL13 YBX1 NOLC1 RPL7 RPS4X RPS15 G3BP2 RPL15 RPS5 RPS3 RPS15A RPL7A RPS14 RPS13 
17.455858,-1.3097712,Cluster 9,EIF1AX,BTF3 NPM3 RPL21 RPL24 RPL23 NAP1L4 RPL23A NAP1L1 RPS3A RPS26 RPL27A FAU DHX29 EIF3E RPS25 RPL6 RPL31 MPG RPL11 DDX47 RPL13 RPL10A RPL9 EMG1 RPS4X RPS18 RPS19 G3BP1 RPS3 RACK1 RPS15A RPL18 RPS13 
17.222862,-1.1002551,Cluster 9,SLC25A5,TUFM RPS8 RPL22 RPL21 RPS9 RPS7 RPL23A RPS3A RPL27A CANX RPL27 SLC25A6 RPS25 RPL6 SLC25A4 RPL3 RPL30 RPL11 RPL10 RPLP2 RPL13 YBX1 ATP5A1 ATP5C1 RPL10A ATP5O RPL7 RPS4X RPS15 RPL14 RPL39 RPS3 RPS15A RPS27A 
17.27104,-1.1180872,Cluster 9,NAP1L4,NPM1 UTP15 NPM3 RPS8 RPL22 RPL21 RPS9 RPL24 RPL23 RPL23A NAP1L1 RPL27A RPL37A RPL26 RPL27 RPS23 RPL6 RPL31 RPL3 RPL30 RPLP0 RPL10 RPL35 RPLP2 RPL13 YBX1 SRP14 RPL10A RPS15 RPL18A RPL14 RPL36 RPL39 RPS15A RPL18 RPL7A HIST1H1C RPS13 
17.124031,-1.0669193,Cluster 9,SSB,NSUN2 RPL3 RPS8 RPS9 RPLP2 RPS7 RPL23A RPS3A RPL10A RPL7 RPS3 RPS15A RPS27A 
17.325117,-1.005254,Cluster 9,PA2G4,NSUN2 RPS8 RPL22 RPL21 RPS9 RPS6 RPL24 EIF1AX RPL23 RPL13A RPS3A RPSA RPL37A RPL27 MPG RPL11 RPL10 RPL13 RPL12 TRMT112 RPL15 RPS5 RPL14 RPS3 RPS15A ZNF622 RPL35A RPL23A EIF2S1 RPS27 RPS26 RPL27A RPS23 RPS25 RPL6 RPL31 RPL3 RPL4 RPL30 RPLP0 RPL32 RPL35 RPL10A RPL9 RPL7 RPL8 RPS16 RPS4X RPS15 RPS18 RPL18A G3BP1 RPL36 IGF2BP3 RACK1 RPS12 RPS11 RPL7A RPS14 RPS13 
17.529701,-1.2787056,Cluster 9,HIST1H1D,NPM1 RPL36AL RPS15A RPS23 RPS13 
17.09367,-0.4719332,Cluster 9,RPL31,SSB TUFM BTF3 RPS8 RPL22 RPL21 RPS9 RPL24 RPL23 RPS7 NAP1L1 RPS3A RPSA EEF1A1 RPL26 FAU PABPC1 RPL22L1 RPL27 NHP2 RPL26L1 SLC25A4 RPL11 RPL10 RPL13 RPL12 HNRNPU ATP5A1 FBL RPF2 PES1 RPL15 RPS5 RPL14 RPS3 RPS15A RPL18 RPS27A NOP58 RPL35A RPL23A EEF2 RPS27 EBNA1BP2 RPL27A TSR1 RPS20 RPS23 SLC25A6 NOP10 SLC25A5 RPS25 RPL6 RPL3 RPL30 RPLP0 HSP90AB1 RPL35 RPLP2 RPL34 YBX1 SRP14 RPL10A RPL9 RPL7 RPS4X RPS15 RPS19 RPL36 RACK1 RPS12 RPS11 RPL7A RPS14 RPS13 
17.629131,-1.5309355,Cluster 9,TUFM,RPL3 RPL21 RPS9 RPL27A RPS15A 
17.008268,-0.55513227,Cluster 9,RACK1,SND1 RPS8 RPL22 RPL21 RPS9 RPL24 RPL23 RPS7 WIPI1 LARP4B RPS3A RPSA LARP4 EEF1A1 FAU RPL27 MPG RPL11 RPL10 RPL13 RPL12 RPL15 RPS5 RPL14 RPS3 RPS15A RPL18 RPS27A RPL23A EEF2 EIF2S1 RPL27A RPS20 RPS23 EIF3B RPS25 RPL6 RPL3 RPL30 RPLP0 RPL35 SRP14 RPL10A RPL9 RPL7 RPS4X G3BP1 G3BP2 RPL36 RPS12 RPL7A RPS14 RPS13 
17.442461,-1.225726,Cluster 9,RPS27,RPL36AL RPL3 RPL11 DDX47 RPL21 RPS9 RPL27A RPS5 ATP5C1 MINA RPS3 
17.23167,-1.1344832,Cluster 9,RPS27L,NPM1 RPS8 RPL21 RPS6 RPL24 RPL23 RPL35A RPL23A RPS3A RPL27A EEF1G RPS21 RPS20 RPL27 RPS23 RPS25 RPL6 RPL31 RPL3 RPL4 RPL30 RPL11 RPLP0 RPLP2 RPL13 RPL9 RPL8 RPS4X RPS15 RPS19 RPL14 RPS3 RPS15A RPS11 RPL18 RPL7A 
17.353739,-1.0195065,Cluster 9,RPS26,BTF3 RPS8 RPL22 RPL21 RPS9 EIF1AY RPL24 RPL23 RPS7 RPS3A RPSA RPL37A RPL26 FAU RPL27 RPL26L1 RPL11 RPL10 RPL13 RPL12 RPL36AL RPL15 RPS5 RPL14 RPS3 RPS15A HIST1H1A RPL18 RPS27A RPL23A EEF2 SRPK1 RPL3L RPS29 EBNA1BP2 RPL27A GRWD1 RPS20 RPS23 SLC25A6 SLC25A5 RPS25 RPL6 RPL31 RPL3 RPL4 RPL30 RPLP0 RPL35 RPLP2 RPL34 ATP5C1 RPL10A RPL9 RPL7 RPL8 RPS4X RPL18A RPS19 RPL37 RPL36 RPL39 RPS12 RPS11 RPL7A RPS14 RPS13 
17.440403,-1.2558881,Cluster 9,YBX3,NOP58 BTF3 RPS8 RPL21 RPL23 RPL35A RPL23A RPS3A SRPK1 RPS20 RPL27 RPL6 RPL31 RPL3 RPLP0 RPLP2 RPL13 RPL12 ZC3H8 RPL9 FBL RPS15 RPL18A RPS19 RPL14 RPS3 RPS15A RPS12 RPS14 RPS13 
17.103378,-1.0523719,Cluster 9,MYH7B,BTF3 RPL30 RPS8 RPLP0 TPM4 RPLP2 CKB RPL23A RPS3A RPS20 RPS3 
16.63307,-0.68922675,Cluster 9,ENSG00000184779,RPLP0 EEF1G HIST1H1E FAU RPL23A RPS15A RPS23 HIST1H1D 
17.570509,-1.4649407,Cluster 9,RPL39,RPL3 RPL30 RPL11 RPL21 RPS9 RPL27A G3BP1 FAU RPS5 RPS20 RPS15A RPL3L 
17.664366,-1.5727242,Cluster 9,RPL3L,RPL11 RPL21 RPS9 RPL27A FAU 
16.839346,-0.9499561,Cluster 9,HADHA,RPS8 RPL11 RPL10 RPLP2 RPS7 ATP5C1 RPS3A RPL10A RPL7 PES1 RPS5 RPL14 RPS3 RPS25 
17.049437,-0.5971559,Cluster 9,SLC25A3,SLC25A4 RPL22 HSP90AB1 RPS9 RPL35 RPL13 ATP5A1 ATP5C1 RPL10A RPL36AL RPL27A RPS5 RPL36 RPL22L1 RPS3 RPS23 SLC25A6 SLC25A5 RPL7A HIST1H1C 
17.43383,-1.3439633,Cluster 9,SUPT16H,RPS4X RPS15 RPL3 RPL18A RPL11 RPL21 RPL27A RPL35 RPL13 PES1 RPL14 RPL7 
17.590322,-1.5181137,Cluster 9,SLC25A6,RPL3 RPL30 RPL11 RPL22 RPL21 RPS9 RPL10 RPLP2 RPL13 RPS4X RPS15 RPL27A RPL14 RPS3 RPS25 
17.332851,-0.9465946,Cluster 9,RPL29,RPS4X NPM1 RPL10 RPL9 RPS25 
17.627327,-1.5193739,Cluster 9,RPS27A,RPL3 RPL30 RPS8 RPL11 RPL21 RPS9 RPL10 RPLP2 RPS3A RPL36AL RPL27A RPL37 FAU RPS5 RPL14 RPL39 RPS20 RPS3 RPS15A 
17.341114,-1.0123143,Cluster 9,RPL10L,RPS8 RPL21 RPS9 RPL24 RPL23 RPS7 RPS3A RPSA RPL37A MTHFD1 RPL11 RPL13 RPL12 RPL15 RPL14 RPS3 RPL19 RPL18 NOP58 RPL23A SRPK1 RPS26 EBNA1BP2 RPL27A RPS23 SLC25A6 SLC25A5 RPL6 RPL31 RPL3 RPL4 RPL30 RPLP0 HSP90AB1 RPL32 RPL35 RPLP2 RPLP1 RPL10A RPL9 RPL7 RPL8 RPS16 EEF1B2 RPS4X RPS15 RPS18 RPL18A RPS19 RPL36 RPS10 RACK1 RPL7A RPS14 RPS13 
17.282038,-1.0575653,Cluster 9,RPS29,NPM1 RPL22 RPS9 RPL24 RPL23A RPSA EIF2S1 RPS27 RPL26 SLC25A5 RPL26L1 RPL6 RPL3 RPL30 RPL11 DDX47 RPL10 RPL35 RPL13 RPL34 HNRNPU ATP5A1 RRBP1 RPL10A RPL9 FBL RPS4X RPS15 RPL18A RPS19 RPL15 RPL37 RPL39 RPS3 ZNF622 RPS11 RPL7A RPS13 
16.917791,-0.6791647,Cluster 9,YBX1,TUFM RPS8 RPL22 RPL21 RPS9 RPS7 RPS3A RPL27A FAU HNRNPC RPS20 RPL27 RPS25 RPL26L1 RPL3 RPL30 RPL11 HSP90AB1 RPL10 RPLP2 RPL13 RPL34 HNRNPU ATP5O RPS15 G3BP1 PES1 RPS5 RPL14 RPL39 RPS3 RPS15A 
17.134596,-0.48985663,Cluster 9,RPS11,EIF5B SSB TUFM BTF3 RPS8 RPL22 DIMT1 RPL21 RPS9 RPL24 RPL23 RPS7 RPS3A RPSA EEF1A1 MTHFD1 EEF1G RPL26 FAU RPL27 RPL11 RPL10 RPL13 RPL12 HNRNPU ATP5A1 RRBP1 RPL36AL PES1 RPL15 RPS5 RPL14 RPS3 RPS15A RPL18 RPS27A HIST1H1C NPM1 RPL35A RPL23A EIF2S1 RPS27 RPL27A RPS20 UBA52 RPS23 SLC25A5 RPS25 RPL6 RPL3 RPL30 RPLP0 HSP90AB1 RPL35 RPLP2 RPL34 YBX1 SRP14 RPL10A RPL9 RPL7 RPS4X RPS15 RPS19 RPL37 RPL36 RPL39 RACK1 RPS12 RPL7A RPS14 RPS13 
16.98527,-0.99503404,Cluster 9,IGF2BP1,RPL6 RPL3 RPL30 RPS8 RPL21 RPS9 RPL10 RPL13 HNRNPU RPL23A RPS3A RPL10A RPL7 EBNA1BP2 RPL27A RPL26 RPL14 RPL39 HNRNPC RPL27 
17.328857,-0.9941073,Cluster 9,RPL38,RPS8 RPL22 RPL21 RPS9 RPS6 RPL24 EIF1AX RPL23 RPS7 RPL13A PA2G4 RPS3A RPSA RPL37A RPL26 FAU RPL27 RPL11 RPL10 RPL13 RPL12 RPL36AL PES1 RPL15 RPS5 RPL14 RPS3 RPL19 RPS15A RPL18 RPS27A HIST1H1C NPM1 RPL23A SRPK1 RPS27 RPS26 RPS29 RPL27A RPS20 RPS23 RPS25 RPL6 RPL31 RPL3 RPL4 RPL30 RPLP0 RPL32 RPL35 RPLP2 RPL10L RPL34 RPLP1 RPL10A RPL9 RPL7 RPL8 RPS16 RPS4X RPS18 RPL18A RPS19 G3BP1 RPL36 RPS10 RACK1 RPS12 RPS11 RPL7A RPS14 RPS13 
1.6542115,-2.5366044,Cluster 10,PLXNA3,GALNT13 CNTNAP3 CHST10 ENTPD6 CACNA2D2 PLXNA1 
1.42644,-3.649491,Cluster 10,SYN1,NAPB PPP3R1 HPCA MAPT STX1B 
1.5109879,-4.253859,Cluster 10,SYP,SYT1 SNAP91 DCLK1 SYN1 L1CAM ATP4A MAPT VSNL1 CDH13 AMPH STX1B STX1A NAPB GRIA2 STXBP1 GPM6B HPCA CAMK2A CRMP1 NCALD GNG2 CALB2 DPYSL3 CAMKV RAB6B SNCB 
1.4538453,-3.4711192,Cluster 10,PRKAR2A,CDK5RAP2 AKAP9 PRKACB AKAP5 PRKACA CEP68 
1.3882393,-4.009094,Cluster 10,NUFIP1,SNAP25 GRIA2 ZNHIT3 NDRG4 HPCA CADM2 PDE2A TRIM2 NCALD HPCAL4 SNCB 
1.6521324,-1.5963703,Cluster 10,GNAI1,GNG11 GNG4 GNB1 GNAT3 RGS14 RGS12 GNAI3 
1.4650036,-1.6418315,Cluster 10,PPP2R1B,PPP2R5C PPP2R5E PPP2R1A PPP2R5D PPP2CA 
1.3832177,-3.8934424,Cluster 10,CAMK2A,DPYSL2 HPCA MAPT DPYSL3 CAMK2B VSNL1 CDH13 NCALD SNAP91 STX1B SYN1 SNCB 
1.5454193,-4.244758,Cluster 10,GPM6B,SYT1 SNAP91 DCLK1 SYN1 L1CAM ATP4A MAPT GNAO1 VSNL1 CDH13 AMPH STX1B CNTN1 GRIA2 STXBP1 RAB3A HPCA CAMK2A CAMK2B HIST1H2BL CRMP1 NCALD GNG2 DPYSL2 CALB2 EPB41L1 DPYSL5 DPYSL3 CAMKV SNCB 
1.4743854,-4.204991,Cluster 10,CRMP1,CAMK2A CAMK2B NCALD SNAP91 DCLK1 SYN1 GNG2 DPYSL2 MAPT DPYSL3 GNAO1 VSNL1 STX1B SNCB 
1.37087,-3.7175243,Cluster 10,SNAP91,NAPB HPCA MAPT DPYSL3 VSNL1 STX1B SYN1 SNCB 
1.5222238,-1.7884561,Cluster 10,DCTN1,DCTN6 ACTR1B DCTN3 DCTN2 DCTN5 DCTN4 ACTR10 ACTR1A 
1.5436058,-1.8474917,Cluster 10,ACTR1A,ACTR1B DCTN3 DCTN2 DCTN5 DCTN4 
1.3943746,-3.7944255,Cluster 10,VSNL1,DPYSL2 HPCA MAPT STX1B SYN1 SNCB 
1.472571,-2.414137,Cluster 10,ABI1,SYAP1 CYFIP2 CYFIP1 KIAA1522 NCKAP1 NHS WASF1 WASF2 BAIAP2 
1.8259772,-2.298451,Cluster 10,SEPT11,SEPT9 ANLN CDC42EP4 SEPT2 SEPT5 SEPT6 
1.5555077,-4.2353816,Cluster 10,STXBP1,CAMK2A CRMP1 NCALD SNAP91 SYN1 GNG2 DPYSL2 MAPT DPYSL3 VSNL1 ILKAP STX1B SNCB 
1.4707738,-1.8744333,Cluster 10,ATP6V1C2,ATP6V1G1 ATP6V1A ATP6V1G2 MAGEA2 ATP6V1F ATP6V1E2 ATP6V1B2 
1.5852253,-4.281792,Cluster 10,ATP4A,STXBP1 SYT1 CAMK2A HIST1H2BL CRMP1 NCALD SNAP91 DCLK1 SYN1 GNG2 DPYSL2 DPYSL5 MAPT DPYSL3 VSNL1 STX1B SNCB 
1.7991401,-1.8681446,Cluster 10,ACTL6A,SS18L1 SMARCD3 BCL7B ACTL6B SMARCE1 ARID1A SMARCA2 BRD7 SMARCA4 
1.5586171,-4.3030562,Cluster 10,SYT1,STXBP1 CAMK2A CAMK2B HIST1H2BL CRMP1 NCALD SNAP91 DCLK1 SYN1 GNG2 DPYSL2 DPYSL5 MAPT DPYSL3 GNAO1 VSNL1 STX1B SNCB 
1.4686149,-1.7007252,Cluster 10,GNAI2,RIC8A GNG4 GNB1 GNB4 GNAI3 
1.5744791,-2.93572,Cluster 10,SEPT6,ANLN CDC42EP4 SEPT2 SEPT14 SEPT5 
1.3927318,-4.1277575,Cluster 10,GRIA2,NAPB HPCA CAMK2A NCALD ANK2 SNAP91 DCLK1 SYN1 L1CAM MAPT DPYSL3 DPYSL4 VSNL1 CDH13 RAB6B STX1B DNM1L SNCB 
1.5423558,-4.290092,Cluster 10,GNG2,GRIA2 HPCA CAMK2A CAMK2B NCALD SNAP91 DCLK1 SYN1 L1CAM DPYSL2 CALB2 MAPT DPYSL3 GNAO1 VSNL1 CDH13 AMPH STX1B SNCB 
1.379644,-3.9378161,Cluster 10,STX1A,NAPB GRIA2 HPCA NCALD SNAP91 SYN1 L1CAM CALB2 CDH13 RAB6B AMPH STX1B SNCB 
1.4281569,-4.066509,Cluster 10,DCLK1,HPCA MAPT DPYSL3 CAMK2A VSNL1 CDH13 SNAP91 L1CAM 
1.5595888,-1.8119533,Cluster 10,ACTR10,DCTN6 ACTR1B DCTN3 DCTN2 DCTN5 DCTN4 ACTR1A 
1.6221546,-2.73103,Cluster 10,SEPT10,SEPT9 SEPT11 SEPT7 SEPT8 CDC42EP4 SEPT2 SEPT5 SEPT6 
1.529696,-1.8099666,Cluster 10,DCTN6,ACTR1B DCTN3 DCTN2 DCTN5 DCTN4 ACTR1A 
1.4971046,-4.2670355,Cluster 10,CAMKV,SYT1 SNAP91 SYN2 SYN1 L1CAM ATP4A MAPT VSNL1 CDH13 AMPH STX1B STX1A CNTN1 NAPB GRIA2 STXBP1 RAB3A HPCA CAMK2A HIST1H2BL CRMP1 NCALD GNG2 PPP3R1 CALB2 EPB41L1 DPYSL3 MAP2 RAB6B SNCB 
1.4626819,-3.2769735,Cluster 10,DAB2,SPECC1 MYO5A STON2 COBL SORBS2 PIK3C2A MYO1E FCHO2 BASP1 MYO6 SLC25A41 EPS15 BMP2K AP2M1 
0.7926899,0.056196585,Cluster 10,LSM4,CRELD2 SLU7 SPTB LSM5 SPTBN2 
1.5632519,-1.8233291,Cluster 10,DYNC1LI1,DYNC1LI2 DYNLT1 SUGP1 EIF2A DYNC1H1 
1.3225684,-1.3679215,Cluster 10,PPP2R5D,PPP2R2D PPFIA1 PPP2R5E PPP2R1A PPP2R5A PPP2CA 
1.5796672,-2.9146004,Cluster 10,SEPT4,SEPT9 SEPT10 SEPT11 SEPT7 SEPT8 SEPT1 SEPT2 SEPT5 SEPT6 SEPT3 
1.3833401,-3.7139182,Cluster 10,CNTN1,DPYSL3 VSNL1 HIST1H2BL NCALD STX1B SYN1 SNCB 
1.3472778,-3.7966924,Cluster 10,DPYSL3,DPYSL2 HPCA MAPT VSNL1 STX1B SYN1 SNCB 
1.4203724,-3.6582766,Cluster 10,SNCB,NAPB PPP3R1 HPCA MAPT STX1B SYN1 
1.4749079,-4.2237782,Cluster 10,CALB2,NAPB GRIA2 HPCA CAMK2A NCALD ANK2 SNAP91 DCLK1 SYN1 L1CAM MAPT DPYSL3 DPYSL4 VSNL1 CDH13 RAB6B AMPH STX1B DNM1L SNCB 
1.3758445,-4.0353646,Cluster 10,EPB41L1,GNG2 RAB3A MAPT DPYSL3 CAMK2A VSNL1 HIST1H2BL NCALD STX1B SYN1 SNCB 
1.3857521,-3.74505,Cluster 10,RAB6B,NAPB HPCA CDH13 NCALD SNAP91 STX1B SYN1 L1CAM SNCB 
1.5022848,-4.230927,Cluster 10,RAB3A,GRIA2 HPCA SYT1 CAMK2A HIST1H2BL CRMP1 NCALD VWA5B2 SYTL4 SYN1 L1CAM GNG2 CALB2 MAPT RAB14 VSNL1 CDH13 AMPH STX1B SNCB 
1.3703018,-3.841375,Cluster 10,L1CAM,NAPB HPCA CAMK2A NCALD ANK2 SNAP91 SYN1 MAPT DPYSL3 VSNL1 CDH13 STX1B DNM1L SNCB 
1.5945866,-4.2254214,Cluster 10,DPYSL5,GNG2 DPYSL2 MAPT DPYSL3 CAMK2A VSNL1 CRMP1 
1.4763007,-4.193921,Cluster 10,AMPH,NAPB GRIA2 HPCA CAMK2A NCALD ANK2 SNAP91 DCLK1 SYN1 L1CAM MAPT DPYSL3 DPYSL4 VSNL1 CDH13 RAB6B STX1B DNM1L SNCB 
1.5839494,-4.27949,Cluster 10,HIST1H2BL,GRIA2 HPCA CAMK2A CRMP1 NCALD SYN1 L1CAM GNG2 CALB2 MAPT DPYSL3 VSNL1 CDH13 AMPH STX1B SNCB 
1.3812487,-3.7069933,Cluster 10,NCALD,NAPB PPP3R1 HPCA MAPT DPYSL3 VSNL1 CDH13 SNAP91 STX1B SYN1 SNCB 
1.6457388,-2.590153,Cluster 10,SEPT7,SEPT9 SEPT11 SEPT8 CDC42EP4 SEPT2 SEPT5 SEPT6 
1.4237254,-3.615182,Cluster 10,YWHAQ,YWHAG YWHAE YWHAB SFN YWHAH 
1.599262,-2.7719524,Cluster 10,SEPT3,SEPT9 SEPT10 SEPT11 SEPT7 SEPT8 SEPT2 SEPT14 SEPT5 SEPT6 
1.6869544,-2.522699,Cluster 10,SEPT8,SEPT9 SEPT11 CDC42EP4 SEPT2 SEPT5 SEPT6 
1.3789731,-3.8976219,Cluster 10,CDH13,NAPB HPCA MAPT DPYSL3 VSNL1 ANK2 SNAP91 STX1B DNM1L SYN1 SNCB 
4.8408504,3.6160893,Cluster 11,SREK1,DDX46 PRPF4B RNPS1 SRSF4 SRSF6 SRSF7 SRSF11 LUC7L3 U2AF1L5 
4.6141486,2.5778902,Cluster 11,ACLY,HNRNPK HNRNPA2B1 HNRNPH1 HNRNPF HNRNPA3 
4.21428,2.6859527,Cluster 11,TCERG1,RUVBL1 IK SMU1 SF3A3 DDX5 DDX17 SNRPD1 MCTS1 SF3A1 SF3B2 
5.215979,3.4648535,Cluster 11,SRSF7,RBM39 PRPF8 DDX46 PRPF4B SRSF4 ACIN1 SRSF5 PRPF40A SRSF6 CDC73 SRSF11 
4.7646008,2.8999844,Cluster 11,IPO7,SRSF1 PSIP1 U2AF2 PRPF40A SRRM2 KPNB1 BCLAF1 SNRPD2 TRA2B ZC3H18 RNPS1 SRSF6 SRSF7 RBM25 
4.597678,2.8009708,Cluster 11,HNRNPA3,SYNCRIP HNRNPK HNRNPA2B1 HNRNPH1 HNRNPH2 HNRNPH3 ZNF326 HNRNPR SAFB 
5.1290283,3.3973954,Cluster 11,SRRM2,RBM39 PRPF8 DDX46 PPIG SRSF4 ACIN1 SRSF5 PRPF40A SRSF6 SRSF7 SRSF11 
4.714131,2.2968009,Cluster 11,PPWD1,HNRNPA2B1 HNRNPA1L2 EIF4H HNRNPA3 HNRNPR 
5.0947423,3.3309398,Cluster 11,SRSF1,RBM39 THOC2 PPHLN1 PRPF40A WBP11 SRRM2 CLK2 PTMA PRPF8 THRAP3 MKRN1 PPIG SRSF3 RNPS1 SRSF4 ACIN1 SRSF5 SRSF6 SRSF7 SRSF8 LUC7L3 DDX46 SRSF2 CDC73 PNN EFTUD2 U2AF1L5 KIAA1429 SNRNP70 TRA2B LUC7L ZC3H14 SRSF11 
4.73195,2.3622882,Cluster 11,RBMX,RBM12B TAF15 NCOA5 YLPM1 ZNF326 HNRNPR APOBEC3B 
4.373003,2.9342322,Cluster 11,CDC73,PRPF8 SF3A3 DDX5 IWS1 PRPF40A SRSF11 
5.2158694,3.564677,Cluster 11,LUC7L3,RBM39 DDX46 PPIG LUC7L PRPF4B ACIN1 SRSF5 SRSF6 SRSF7 SRSF11 SRRM2 
5.1667333,3.4874089,Cluster 11,RNPS1,RBM39 ZRANB2 DDX46 PNN GPATCH8 SRRM2 U2AF1L5 THRAP3 SNRNP70 TRA2B PPIG SAP18 LUC7L SRSF4 ACIN1 SRSF6 SRSF7 SRSF11 
