x,y,cluster,term,genes
6.296328,3.3875325,Cluster 7,Arachidonic Acid,PLA2G2E PLA2G2F PLA2G4E PLA2G4F PLA2G2D CYP4F2 PLA2G2A PLA2G4C CYP4F3 PLA2G4D PLA2G4A PLA2G4B CYP4F8 ALOX15B CYP2C9 CYP2U1 CYP2C8 PLA2G10 JMJD7-PLA2G4B CYP2E1 PLA2G1B ALOX15 PLA2G3 PLA2G5 ALOX12B PLA2G6 CYP2C19 PTGS1 PTGS2 PLB1 CYP2B6 ALOX5 CYP2J2 
6.510362,3.179434,Cluster 7,Phosphatidylethanolamine,PLA2G2E PLA2G2F PLA2G4E PLA2G4F PLA2G2D PLA2G2A PLA2G4C PLA2G4D PLA2G4A MBOAT2 PLA2G4B PISD MBOAT1 PIGF LPCAT4 PLA2G10 LPCAT3 JMJD7-PLA2G4B PIGN PIGG PEMT PLA2G1B PIGO PLA2G3 PLA2G5 PLA2G6 PLD2 PLD1 PLD4 PLB1 PLD3 PTDSS2 
6.5700603,3.1071684,Cluster 7,1-Radyl-2-acyl-sn-glycero-3-phosphocholine,PLA2G2E PLA2G2F PLA2G4E PLA2G1B PLA2G4F PLA2G2D PLA2G2A PLA2G4C PLA2G4D PLA2G4A LPCAT2 PLA2G3 LPCAT1 PLA2G4B PLA2G5 PLA2G6 PLB1 CHPT1 PLA2G10 JMJD7-PLA2G4B 
6.46236,3.22374,Cluster 7,1-Organyl-2-lyso-sn-glycero-3-phosphocholine,PLA2G2E PLA2G2F PLA2G4E PLA2G1B PLA2G4F PLA2G2D PLA2G2A PLA2G4C PLA2G4D PLA2G4A LPCAT2 PLA2G3 LPCAT1 PLA2G4B PLA2G5 PLA2G6 PLA2G7 PLB1 LPCAT4 PLA2G10 PAFAH1B1 
6.5225286,3.1656067,Cluster 7,alpha-Linolenic Acid,PLA2G2E PLA2G2F PLA2G4E PLA2G1B PLA2G4F PLA2G2D PLA2G2A PLA2G4C PLA2G4D PLA2G4A PLA2G3 PLA2G4B PLA2G5 PLA2G6 PLB1 PLA2G10 JMJD7-PLA2G4B 
6.421056,3.2142735,Cluster 7,1-Acyl-sn-glycero-3-phosphoethanolamine,PLA2G2E LYPLA1 PLA2G2F PLA2G4E PLA2G1B PLA2G4F PLA2G2D PLA2G2A PLA2G4C PLA2G4D PLA2G4A PLA2G3 MBOAT2 PLA2G4B PLA2G5 PLA2G6 PLB1 MBOAT1 LPCAT4 PLA2G10 LPCAT3 
6.3221593,3.366958,Cluster 7,Linoleic Acid,PLA2G2E PLA2G2F PLA2G4E PLA2G1B PLA2G4F PLA2G2D PLA2G2A PLA2G4C PLA2G4D PLA2G4A PLA2G3 PLA2G4B PLA2G5 PLA2G6 CYP3A4 CYP2C19 PLB1 CYP2C9 CYP2C8 PLA2G10 JMJD7-PLA2G4B CYP1A2 CYP2E1 CYP2J2 
2.7382119,5.726875,Cluster 8,Paraxanthine,CYP2A7 CYP2A6 NAT2 XDH NAT1 
2.7189317,5.735219,Cluster 8,4-(N-Nitrosomethylamino)-1-(3-pyridyl)-1-butanone,CBR3 CBR1 CYP2A7 CYP2A6 CYP2A13 CYP2D6 CYP1A1 CYP3A4 CYP2E1 HSD11B1 
2.6653552,5.8170133,Cluster 8,Aflatoxin B1,CYP2A7 CYP2A6 CYP2A13 CYP3A4 CYP3A5 
2.823593,5.2948294,Cluster 8,NADP+,CYP3A7-CYP3A51P MECR G6PD SRD5A3 GSR SRD5A2 ALDH4A1 CYP2C9 CYP2C8 MTHFD1 CYP1A2 FAR1 CYP1A1 FAR2 DHCR7 ALDH1L1 AKR1D1 HSD17B6 HSD17B7 HSD17B1 CYP2D6 HSD17B3 CYP1B1 FDFT1 IDH1 IDH2 MTHFR KMO PGD DHFR QDPR ALDH3A2 ALDH7A1 CYP2A7 CYP2A6 CYP2S1 FASN ALDH3A1 BLVRB BLVRA CYP2C19 TM7SF2 CYP2B6 SRD5A1 CYP2J2 TXNRD2 TXNRD1 PYCR1 PYCR2 AKR1A1 CYP7B1 DHCR24 GRHPR GLUD1 BST1 ALDH6A1 DPYD TECR AKR1B10 GMPR CYP3A4 CYP3A5 CYP3A7 NNT KDSR RDH13 SPR RDH12 RDH11 RDH10 ME1 LBR NADK HSD11B1 CBR3 CBR1 NOS3 AKR1C2 AKR1C1 FMO1 AKR1C4 AKR1C3 FMO3 DHRS3 DHRS4 ALDH9A1 CYP2E1 GMPR2 AKR1B1 RDH8 HMGCR HSD17B12 NSDHL ALDH1B1 ALDH2 CYP2A13 NOS1 NOS2 CYP2F1 
2.8092532,5.2413015,Cluster 8,Dehydroepiandrosterone,STS SULT2B1 CYP3A7-CYP3A51P HSD3B1 HSD3B2 CYP1A2 CYP1A1 CYP3A4 CYP7A1 CYP2E1 CYP3A5 CYP3A7 
2.710345,5.738734,Cluster 8,Naphthalene,CYP2A7 CYP2A6 CYP2B6 CYP2S1 CYP1A2 CYP3A4 CYP2E1 CYP2F1 
2.9593117,5.678022,Cluster 8,12(13)-EpOME,CYP2C9 CYP2C8 CYP3A4 CYP2E1 CYP2C19 CYP2J2 
2.9167054,5.628806,Cluster 8,Chloroacetaldehyde,ALDH3A2 CYP2B6 ALDH2 CYP3A4 CYP3A5 
3.1231196,5.4985394,Cluster 8,9(10)-EpOME,CYP2C9 CYP2C8 CYP3A4 CYP2E1 CYP2C19 CYP2J2 
4.7565513,5.75354,Cluster 9,"3,4-Dihydroxyphenylglycol",ADH4 ADH1C ADH1B COMT ADH6 ADH7 
4.7479105,5.803661,Cluster 9,"3,4-Dihydroxymandelaldehyde",ADH4 MAOB ADH1C MAOA ALDH3A1 ADH1B ADH6 ADH7 
4.304161,5.392907,Cluster 9,11-cis-Retinol,RDH11 RDH10 RDH5 LRAT RPE65 
4.45816,5.537326,Cluster 9,Retinol,RETSAT DGAT1 ADH1C ADH1B RDH8 HSD17B6 DHRS3 DHRS4 ADH6 ADH7 ADH4 DHRS9 RDH13 RDH12 RDH11 RDH10 PNPLA4 RDH16 LRAT SDR16C5 
4.7117887,5.855548,Cluster 9,Chloral Hydrate,ADH4 ADH1C ALDH3A1 ADH1B ADH6 ADH7 
4.304242,5.4614,Cluster 9,9-cis-Retinal,RDH12 ALDH1A3 RDH11 ALDH1A2 AOX1 RDH5 DHRS4 
4.497377,5.606903,Cluster 9,Retinal,ADH1C ADH1B RDH8 HSD17B6 DHRS3 DHRS4 ADH6 ADH7 ADH4 DHRS9 RDH13 ALDH1A1 RDH12 ALDH1A3 RDH11 RDH10 ALDH1A2 AOX1 RDH16 SDR16C5 
4.6931715,5.812796,Cluster 9,Ethanol,ADH4 ADH1C ADH1B AKR1A1 ADH6 ADH7 
4.762628,5.980037,Cluster 9,Acetaldehyde,ADH1C ADH1B AKR1A1 ADH6 ADH7 PTS ADH4 DERA ALDH3A2 ALDH7A1 ALDH1B1 ALDH2 ALDH3A1 ALDH9A1 
4.687691,4.7818065,Cluster 10,Deoxyuridine,TYMP TK1 NT5C1B-RDH14 UPP2 TK2 UPP1 
4.4194603,4.4316583,Cluster 10,CMP,ST6GALNAC3 ENTPD8 CRLS1 UCKL1 PGS1 UCK2 UCK1 CHPT1 ENPP1 CMPK2 CEPT1 NT5C1B-RDH14 ST6GALNAC4 CMPK1 
4.2818885,4.2705035,Cluster 10,IMP,ATIC CANT1 ENTPD5 GMPR2 GMPR ENTPD8 ITPA AMPD2 AMPD3 HPRT1 NT5C1B-RDH14 NUDT16 
4.6080036,4.7197165,Cluster 10,dTMP,ENPP1 ENTPD8 TK1 NT5C1B-RDH14 TK2 TYMS 
4.3451877,4.3246503,Cluster 10,GMP,GUK1 ENTPD5 LIG1 GMPR2 ENPP1 GMPR ENTPD8 GMPS HPRT1 NT5C1B-RDH14 
4.529465,4.583886,Cluster 10,Uridine,UCK2 UCK1 NT5C1B-RDH14 UPP2 UCKL1 UPP1 
4.4799676,4.543944,Cluster 10,UMP,DPAGT1 UCK2 UCK1 ENTPD5 ENPP1 ENTPD8 CMPK2 NT5C1B-RDH14 UCKL1 CMPK1 
4.693489,4.698062,Cluster 10,dUMP,DTYMK TK1 NT5C1B-RDH14 TK2 TYMS 
2.3303955,4.9939394,Cluster 11,11-Deoxycorticosterone,SRD5A3 SRD5A2 HSD3B1 CYP11B2 CYP21A2 HSD3B2 SRD5A1 
2.380374,5.039358,Cluster 11,"5alpha-Pregnane-3,20-dione",SRD5A3 SRD5A2 AKR1C2 AKR1C3 SRD5A1 
2.3398678,4.906125,Cluster 11,Progesterone,CYP17A1 SRD5A3 AKR1D1 SRD5A2 HSD3B1 CYP11B2 CYP21A2 HSD3B2 CYP11B1 SRD5A1 
2.4603062,5.017859,Cluster 11,17alpha-Hydroxyprogesterone,CYP17A1 HSD3B1 CYP11B2 CYP21A2 HSD3B2 CYP11B1 
2.6523895,5.063602,Cluster 11,Pregnenolone,CYP17A1 STS SULT2B1 HSD3B1 CYP21A2 HSD3B2 CYP7B1 
2.4781406,4.908186,Cluster 11,Cortisol,HSD11B2 HSD3B1 CYP11B2 CYP21A2 HSD3B2 CYP11B1 HSD11B1 
2.326551,4.945214,Cluster 11,Androstenedione,CYP17A1 SRD5A3 AKR1D1 SRD5A2 HSD3B1 CYP11B2 HSD3B2 HSD17B3 CYP11B1 HSD17B6 SRD5A1 CYP19A1 
4.619565,4.3861604,Cluster 12,Formic Acid,CYP51A1 GCH1 AFMID MTHFD1L MTHFD1 ASPA CYP19A1 
4.86644,4.3537135,Cluster 12,"5,10-Methenyltetrahydrofolate",MTHFD2 MTHFD1 ST20-MTHFS MTHFS GART FTCD 
4.864441,4.3355365,Cluster 12,N10-Formyl-THF,MTFMT ATIC MTHFD2 MTHFD1L MTHFD1 GART 
4.7673154,4.48378,Cluster 12,Glycine,GLDC ALAS2 ALAS1 SHMT2 GSS AMT SHMT1 GLYAT GNMT BAAT GCAT DAO GCSH GATM ANPEP PIPOX SARDH DLD AGXT2 GART 
4.8132815,4.470566,Cluster 12,6R-Tetrahydrofolic Acid,MTFMT GLDC DMGDH GGH SHMT2 AMT SHMT1 MTR DHFR FTCD GCSH ATIC FPGS SARDH MTHFD1L MTHFD1 METTL6 DLD GART 
4.514942,5.229826,Cluster 13,Dihydroceramide,CERS5 ASAH2 CERS6 DEGS2 DEGS1 ASAH1 CERS1 CERS2 CERS3 
4.4018807,5.11945,Cluster 13,Sphinganine,CERS5 ASAH2 CERS6 KDSR SPHK2 SPHK1 ASAH1 CERS1 SGPP2 CERS2 SGPP1 CERS3 
4.461339,5.1952963,Cluster 13,Sphingosine,ACER2 CERS5 ASAH2 CERS6 SPHK2 SPHK1 ASAH1 CERS1 SGPP2 CERS2 SGPP1 CERS3 
4.4649687,5.078262,Cluster 13,N-Acylsphingosine,CERS5 ASAH2 CERS6 SGMS2 CERK SGMS1 GBA2 ASAH1 SGPP2 SGPP1 SMPD4 ACER2 SMPD3 GALC UGCG UGT8 SMPD2 SMPD1 DEGS2 ENPP7 DEGS1 CERS1 CERS2 CERS3 
