x,y,cluster,term,genes,cluster_label
6.898602,9.135842,Cluster 0,SARS-BatSRBD 36Hour GSE47960,PTPRN2 HOMER3 ENTPD6 PCGF3 CD3EAP MFSD10 CHFR PML LARP6 LOC100507022 RRAGA ZNF839 ORAI3 CEP89 OPTN PI4K2A STX16 ITIH4 USP6NL HERC2P2 KDELR2 COL12A1 NTN1 BAIAP2L1 ACTB C4B RAB11FIP1 LSM12 MICALL2 CHST11 PIP4K2A E2F4 CHST15 CCNL2 HES4 CCNL1 RFFL ABCA2 APOBEC3D ZBTB7A PRKCI PHC2 SLC34A2 TNFSF13 TOP3B MANF MYO5B NR0B1 HLA-E ERVH-4 FERMT1 EHD2 VANGL1 FAM220A EIF5 HOXB2 TSPYL5 LPGAT1 LOC202025 MAGED1 ZNF251 CTBP2 MAPKBP1 PIEZO1 MUS81 NEDD4L TSKU C3 PTDSS2 ZC3H12A RASSF4 RUSC2 MICAL2 GOLGA2 CCRN4L IER2 JUNB ARGLU1 AKIRIN2 JUN SEC13 DUSP4 LEPRE1 NSUN5 DUSP1 MYOF HEG1 VEGFC TMC6 TRMT1 DUSP7 SUMF2 INF2 CLDN15 BHLHE40 FJX1 TLR6 CC2D1B SLC44A4 FLII STRAP TMEM185A ABHD2 ADM LITAF ADRB2 DPH2 NKIRAS2 MED10 MPZL1 TIMP4 RRS1 C11ORF24 RAB6A MPP3 EGLN3 FOS AEN CIT MYO9B TMEM61 GCFC2 TJP1 COL4A1 B3GNT7 UBE2V1 ENGASE DBN1 FOXA2 ZNF692 TRAF3IP2 PYGL SRA1 NUDT4 FAM127A SCAMP5 NDST1 FAM182A NCS1 GPNMB MPRIP MGAT5 FADS2 CD55 HS3ST1 UBE2H TOR1B TLE1 TMEM178B ZBTB17 HCG4 PUS1 OCRL ARID3B TAP1 UCKL1 THNSL2 ATP11A YIF1A NRBP2 FOXP1 TANC2 RAB34 UBE2Z MAPKAPK2 PKP2 ADAM8 FAM8A1 ST7-AS1 ITPRIP PPP1R15A PLOD3 CDH3 NSD1 NACC2 CAPN2 PMPCA DENND5A SLC16A3 PHLDA2 MAP3K5 TBC1D16 HLA-DOA SMAD3 C17ORF89 CHPF2 ATP8B2 RBPMS DDX55 CTPS1 MESDC1 DIAPH1 TRNP1 DDAH1 MAFG CDC42EP2 BMP2K PHPT1 CCDC130 EIF4G3 RNF166 MDM2 LRRC59 KIAA1191 COL17A1 TUBGCP2 ROGDI SLC2A1 FBXO27 GSTT2 SIRPA CHMP1A PDZD8 KDM4A SLC37A1 NSUN5P2 SUN1 ATP13A1 LAMB3 NFKBIZ PYCR2 WIPI1 URB2 PTPN14 BAIAP2 DNM2 NFKBIA SGK223 PEX6 NF2 MAGIX CDR2L CUEDC1 KDM5B YWHAG LOC390705 PYCRL CELF1 ILK TNFAIP6 USP35 POMT2 LAMC1 CHD7 PTPN21 CXCL2 TNFAIP2 AGPAT3 SYNGR2 MDK MARVELD2 DENND3 LOC100287015 BDKRB1 UBE2Q1 ME3 AMICA1 RHBDF2 PLEKHG2 CPT1B LRRC8A AMT MAPK1IP1L KCNK15 SYT17 TBC1D9 OXSR1 LSS KIAA0232 SGPP2 EVC ASXL1 SNTB1 CDC34 REST ZNF618 CRY2 P4HB SPRY2 INA RGS12 B4GALT7 SMAP2 CSNK1G2 CEBPB WDR1 TCP10L ECE1 C1ORF132 PIK3CD HDAC7 THBS4 SEPT9 SPRED1 ZNF608 KYNU EPS8L2 NRCAM POLG SLC25A25 ,sars/cov/0hour
8.202194,8.720599,Cluster 0,SARS-BatSRBD 12Hour GSE47962,PRELID2 PCGF5 ZNF283 ADHFE1 OXSM GOLPH3L SRRM1 NECAP1 SLC5A8 HSBP1L1 SLPI ACOT2 RPL28 ALPK1 ZNF274 PGAP3 STXBP3 PARN MSANTD4 CISD1 GPATCH4 TPTE SLC5A5 UHMK1 UGP2 GPBP1 DHX35 CDC27 MXI1 CYP2D6 C10ORF54 PABPN1 LOC100507131 LUC7L RPLP0P2 RPL19 PTGDR KLF11 NAPSB MIRLET7BHG ABT1 ALG8 ZRANB1 TNNC1 SYNRG RASSF9 CYP4F8 ZNF14 GPR137B ZNF16 GIGYF1 RNF144B PTP4A3 ZZZ3 PIK3R1 TMEM99 SNHG12 TDP2 CWF19L2 CCDC64B SFXN4 ITPA RPS20 CHST4 PTGFR ZNF131 BAZ2B MGST1 NAGPA RBPJ SULT1A2 BLOC1S5 HIST1H3A C19ORF33 GOLGA1 ALKBH2 ZNHIT6 NFU1 EPC1 PLCG1 TNFSF10 RPL38 LIPT1 HACE1 ZNF486 BTN3A2 RMI1 TSC22D1 C1ORF27 KLHL2 NBPF11 TMEM177 KITLG NFX1 CCDC6 PIGM MKRN9P ARHGEF9 TMEM106B ZNF234 DDR2 ZNF594 WFIKKN1 ZNF518B AEBP2 POU5F1P3 MED19 FXR1 MRPL40 AUH MAGT1 MED11 ZNF107 FAM192A TIGD2 SUZ12 MAMDC4 FMO5 ETAA1 LCE2A PSMA1 WAC TCAP DLD RAD1 OAT MAGEH1 SFTA3 ANKRD13C ZNF573 CDKN1B PHF6 RPLP2 CLINT1 OVCA2 GRAMD3 ING3 FAM102B PSMB6 OPHN1 AIFM1 TMEM38B ENOPH1 SRSF10 ZNF200 ZNF562 BRPF1 GCA RPS9 KLHDC2 CYBRD1 KLHL24 SEMA4G LIFR TMEM251 NEAT1 SLC9A6 ILVBL C6ORF25 TMX1 DMTF1 STEAP2 MPHOSPH8 ZNF552 ZNF671 ZNF550 ANKRD36 UBE2D3 SLC1A3 UBE3A CWC25 ARID4B FAM214A ZNF8 GGA2 PCNP CAPN8 PTAR1 GPC2 NTF4 SLC16A7 ANKRD36BP2 ZNF548 PMPCB RBBP7 DCLRE1A MAP2K4 IDH1 RAB4B FANCL SMAD1 TMEM120A UROS ARID5B KRT32 TMEM230 RNF169 ARHGAP12 ZNF92 GCLC RFXAP TRAF6 GNAQ ZNF418 MATN4 VIL1 ANKRD17 PYROXD2 FBXO28 PMS2L2 ZFP62 PDS5A PPP1R9A UQCRH PHYHD1 EBP FNTA FAM162A FPGT NARS CEP350 ZKSCAN5 PLS1 RBM17 GPX1 MKKS RBM18 EGFL7 GLYATL2 KCNIP2 HSPA5 HMGCS1 MUM1L1 PPP2R5C NAV1 DTNBP1 NUP133 ATP5F1 SEPT6 DNAJC4 CUL4A SP3 NDUFS7 MFAP1 RPL37A SCGB3A1 ACO1 LOC257396 HP1BP3 ATP5S TTC27 MCTP2 RTN2 NUFIP2 NDUFB8 AASDH WHAMM ASH1L-AS1 DDX46 CLCNKB DBI RPF1 DUSP12 MGC16025 SPAST C14ORF28 ZNF502 MDN1 TNPO3 KDM6A NDUFA8 MUT ATP2B3 FNDC3A KCTD6 PFKM RAB15 DAAM2 ALDH1A1 EIF3K ANAPC4 EIF3H LNX1 RERG USP16 MCM8 C2ORF69 C1ORF132 ETFB RPL10A NR3C2 ACRC NR3C1 CCDC28B NT5DC1 GK5 AP1G1 ALDH2 TAS1R1 HNRNPA3 ,sars/cov/0hour
7.415959,9.331021,Cluster 0,SARS-BatSRBD 24Hour GSE47960,SS18L1 HEXIM1 IFRD1 ARL16 PCGF3 BSDC1 SCRIB MFSD10 SMARCA5 NISCH NEURL4 TEF LOC100507140 ENTHD2 HNRNPD UPRT ZNF710 LINC00087 TBC1D9B EHF ZNF274 HERC2P2 PPP1R35 AKAP8 LRP5 RNF114 PRPSAP1 ANTXR1 ZNF707 C7ORF34 MSANTD2 ALOX5 STAT6 APBB3 DENR HES1 CCNL2 MTA3 LOC100508226 CCNL1 FZD2 VPS9D1 DTNB SLC6A14 NR1D1 TERF1 FOSL2 GIGYF1 BANK1 SNHG12 ZFAT PTGES NMT1 ZNF133 FAM89B PKI55 DCUN1D2 PGBD2 NDUFB2-AS1 ZBED1 TMEM8B IER3 AKIRIN2 MYBPC3 SEC13 GABBR1 LEPRE1 SNORA70 NCOA7 H3F3A TMEM198B GPBAR1 C9ORF89 CARD6 INF2 DKFZP434F142 ABCC10 PDIK1L BHLHE40 UBAP1 CCDC6 FXYD6 DEPDC5 EXOC3 COL18A1 ARF1 ACY3 ZC3HAV1 CLTA AEBP2 ECHS1 METTL21B MTDH BBC3 DUOX2 PPP3CB ZMYM2 RHPN1 EBLN2 GPRASP2 PACSIN1 COL23A1 ANO9 ANO7 SLC39A13 LDOC1 HSFX1 LCE2C PDP1 HNRNPH1 IGLL1 JMJD7-PLA2G4B ZNF217 CACTIN PTPRCAP SLC29A2 SRFBP1 ENGASE NPDC1 SLC29A3 VMP1 ATP6V0CP3 ROBO3 ROBO4 DEFB129 C17ORF59 FAIM2 XPO1 ALS2CL ZFYVE27 MTG1 XPO6 SLC17A9 ARIH2 CHML ZSWIM5 GABRE ZSWIM6 ANKRD13B CD55 SEMA4B HS3ST1 RNF44 ATHL1 UBE2I CTNNBIP1 CRYBB2 CPSF4 ALG12 MUC3A LOC389906 PUS7 TICAM1 NEAT1 CDC25B HIC2 MADD OLFM2 DOK3 PLOD1 ATG16L2 DMTF1 SPNS2 SLC25A32 NPTXR SRSF6 PVRL2 ST7-AS1 ZNF550 NOL3 CCDC149 MPV17L2 ZFP36L1 FAM129A UBE3A ARID4B PRKY SLC1A7 RCHY1 FAM214B CAAP1 CXCL16 KIAA0513 PURB ITPRIPL2 LAMP2 CAPN8 RAB24 C1RL HSF4 IGFLR1 MAP3K7 SLC16A3 EMC8 IGF2R TMEM132A SMAD1 ARID5A TTC32 KCNAB2 MED26 HGS SYNJ1 CDC42EP4 MAP7D1 LCN2 TAB2 TSNARE1 RAD9A ZNF532 PXK SLC38A10 LIN7B MAEA HID1 NPEPPS CHAF1A CNN2 DEAF1 BAG3 COL4A3BP EIF4EBP2 TMEM109 PIM1 EVI5L AP5S1 ZNF646 PIM3 BMF COX14 TRIM66 CMTM8 TRIM62 EGFL7 ARAP3 EIF2AK3 PPP2R5B ETV3 CDC42BPB NPEPL1 NUP50 CLCN6 JMY RCN1 BCL3 ATG4B PLCH2 ITGA7 TNFRSF25 QRICH1 LAT HP1BP3 GPSM3 NLGN2 NUFIP2 STOML1 FBLIM1 AGAP3 HUS1B ITPR3 CXCL2 FOXK1 ADAMTS13 DUSP16 FBXO42 TTC28 RRP7B METTL13 DUSP12 SYNGR2 HEBP1 KDSR UQCRFS1 D2HGDH IP6K3 TCFL5 CPT1B EYA2 SYT17 LYSMD1 POMGNT1 PNKD DDIT4 LOC100506031 TRIB2 ZNF610 HCN3 CBLL1 SNAP47 TSEN34 LOC284837 LINC00342 ACADVL KIAA0895L C1ORF132 CLN8 SEC61A2 TRA2B C8ORF60 ILKAP ,sars/cov/0hour
7.645783,10.941783,Cluster 0,icSARS-Cov Day4 GSE50000,UNC13C CACNA2D4 SOX14 TSPEAR MYO7B SFRP5 THEG SST C10ORF62 SCN10A SUB1 ASB7 ENTHD1 TRIM15 OR6C6 FSIP2 ALDH8A1 CPVL STX1B OR5AK2 PANK3 AHCYL2 JRK TTLL10 HOXB1 CRABP2 AQP8 EXOSC7 C16ORF90 ZDBF2 FSD1 IGLON5 MUSK NKX2-6 ATP6V1E2 BSN GPR156 CALN1 RNF112 NTSR2 MS4A10 TMEM184A ANKDD1B XRCC5 TNFSF15 SLC6A18 GML OR5P2 C9ORF64 FERMT1 OMP GJB1 BCAM CLPS STRC TAGLN2 OR2A14 ACTL7A TSKS CRHR1 NPFFR1 SLC22A7 OXTR SLC22A6 TTYH1 ACSM1 LYPD4 SLC6A1 ABCA13 DMBX1 T MICAL2 GALR2 GJA10 TNFSF10 PRIMA1 HOXC8 CCDC96 FOXD2 FCRL6 MAGEE2 GABRA5 PKDREJ LHFPL5 MRPS2 CSHL1 SORCS1 TYR TMCO2 PHOX2B KBTBD4 RNF148 CLDN16 MPPED1 CCDC7 TFF3 OR4C6 GPR123 SERPINA12 TENM1 PCSK2 KPRP RET GABRB2 TMED10 C5ORF47 SLC44A5 OR8K3 SLC35F4 IGSF3 KLK6 WNT8B HNF4G IQGAP1 KLK9 C20ORF85 GJC3 CAMKV ATP6V1G1 NANOS3 PSD TPTE2 EN1 OR1L8 ACOT12 OR10G4 HSBP1 OR5T2 ANO2 SLC22A25 AGBL4 CYP21A2 OR4A5 DSCAML1 NEUROG2 TMEM229A IL17B MYT1L MEI4 TCF20 QRFP ABCC12 EFCAB9 HOXD10 PTGS2 FADS3 TAF7L SPTLC2 DMBT1 SRP54 CTNNA2 CSMD2 UVRAG TFAP2B KIRREL2 CD164 SEPT12 CRYBB2 LRRC63 TJAP1 CDKAL1 POU4F3 ERN2 OR13C8 MSH4 LRFN2 CHRNA2 OR6K6 OR5AR1 SLC1A2 IHH GPR62 NALCN SLC1A7 HOXA13 NPAS3 CEP128 C1ORF234 CDH7 CLEC3A PROKR2 C1ORF105 BCL2L10 NLRP5 SLC39A7 BANF2 ZNF426 ADORA1 TECTA FGF22 C8ORF46 SLC30A3 NONO GFAP TDRD6 DDX51 FBXO34 DUPD1 SCRT1 LOC730159 LHX3 FGF19 CLRN1 MUC20 GPR101 SPRN REG1A DPP10 VCP KRTAP24-1 FBXO28 MAGEB16 REG1B CACNA1E LRIT1 TRHDE MMP21 CPLX4 TMEM222 RIMS4 C6ORF222 TNFRSF8 THEM5 TRIM66 ZKSCAN2 VWC2L HSP90AA1 CACFD1 APOA5 DHCR24 UTF1 VSTM2L APOA1 NDUFS6 SP7 ATG4D QRICH2 SERPINI2 PAPPA2 ALPI KCNK4 FAM60A L3MBTL4 OR4K5 OR1E2 ONECUT1 HSPB9 UBA5 C4ORF36 CYP3A5 DUSP15 MFSD9 UNC80 SLCO1B3 ADAMTS18 LBP OR12D2 WNT1 TAS2R1 TAC3 IMPG1 FGA DRD5 CEACAM18 ATF7IP IRX6 UGT1A1 OR5L2 ZIC5 KCTD4 NPHS1 ASPG SLFNL1 ASXL3 TAF7 ZP1 FOLR2 USP27X RTP2 PKD1L2 FHL5 PIK3C2B INS TTR FAM154A AP4M1 ZIC3 OR1S1 GRM7 OGDHL SIX3 TAS1R1 PGM3 EPS8L3 PDE6C UPP2 BCO2 POLR2L RBM6 MSMB ,sars/cov/0hour
7.6655555,9.474311,Cluster 0,SARS-BatSRBD 60Hour GSE47962,SLC35A4 CKMT1B BSDC1 MRPS18A C9ORF40 C20ORF24 DDX39A SCO2 SPINT1 RPL28 PREB TRIM11 CGGBP1 KDELR1 WBP2 CPNE5 SP100 SLC46A1 PDXDC1 LRP6 LMF1 TRMT2A TOB1 TSEN54 UHMK1 RNF114 FAM120C LOC100128288 RPL15 TCEB3 STAT6 FAM63A HES1 EXOSC2 N4BP1 APOL3 BRICD5 NGFR INSR VPS9D1 C5ORF38 FZD5 SURF6 EAF2 ALG3 RASSF9 VPS13A TMEM198 HLA-E ARFGAP3 FA2H SLC6A6 MSRA RNF207 TTLL12 SFXN2 RPS23 FARSA RAB40AL RPS2P32 RPS25 NMT1 SLC35D2 ANP32A GDE1 LGALSL MTMR9LP DCUN1D1 TMEM186 ALKBH4 IQCH-AS1 SNRNP70 MYO18A LGALS9 KIAA0319L STAT5A AGFG2 BTN3A2 CHKB NBPF9 BTN3A1 OFD1 AKR1A1 UBE2G2 AP3B1 C9ORF85 C6ORF62 CTTNBP2NL GOLGA2P5 TOMM40L LOC100287525 RCCD1 EXOC3 CSRNP1 ARF1 MRPS15 MAGEF1 NOXO1 MRPS11 MRPL35 PQBP1 TOR1AIP1 AACS AUH ZMYM5 RRAS2 NDNL2 GSE1 SAFB2 PCK1 CIC ZNF587 PARP6 CBR1 AKR1C3 MRPL46 FAM213A RSL1D1 PER2 DHRS7 SLC29A2 SF3A1 SIPA1 ARF6 NPDC1 FOXA3 TRUB2 DHRS13 PRICKLE3 SRA1 DERL1 ZDHHC3 OVCA2 ASGR2 SERP1 ZSCAN30 SPTLC2 MTG1 SULT1E1 PPP1R8 RAB8A MGAT3 LDLRAP1 IKBKG FBXW5 TLE3 PRM3 UBE2I GPT2 SARS DNAJB14 TJAP1 LMO7 TYROBP CHERP GRHL2 TMEM251 SNRPA PCP2 FAM185A S100A6 UBE2K MPHOSPH8 UBE2M ZNF433 ZNF552 SUPT6H ATF6B CCDC149 UBE3A UBE2D2 RFNG RBMXL1 LOC100272216 CLEC3B SH3TC1 LAPTM4B RAB24 CASKIN2 SLC16A7 GPBP1L1 ACSS2 TXNL4A SWAP70 SREBF2 NACA2 MED28 PGD PYGO2 TFDP1 NAT9 TMEM115 NACA MLXIPL REEP3 ESAM MALAT1 CHMP7 ZNF655 CHMP6 PFKFB2 RAB3D CALCOCO2 ZNF512B C15ORF61 NR4A1 CDC14C GYLTL1B RAB43 COBLL1 CHMP1B ZKSCAN4 CDH24 CAMTA2 PIM3 MLKL TRIM68 PTPN18 PPP2R5C OSGIN1 CCZ1 MARCH9 IRF2BP1 PJA1 TTC19 ACVR2A RABEP1 SP1 SP3 HOOK2 ATG4D NDUFS2 ZNF513 ACO1 MTRF1L H6PD NLGN2 GMPS FBXO46 DTX4 ARHGEF10L LRRC16A FBXO42 MLLT6 NT5C2 RAI1 SYNGR2 LOC100506123 CCDC85C C17ORF100 IP6K2 TRIM44 TNFRSF14 ATF7IP CEACAM19 KRT71 TRIM41 DDX17 MMAB NDUFA6 RNASET2 ARNT ZNF181 HAUS4 DDX11 ZNF300P1 MUT HAUS7 MYO19 KLF5 BCS1L SUOX KLF3 RAB12 WRAP73 IMPDH2 TRIM38 SNRNP48 LOC100287704 SLC25A12 HCN3 GCOM1 ZMYND8 CEBPB LINC00342 RNF13 MCM8 PRR4 ATP5G3 USE1 FOXRED2 GPHN GK5 ALDH2 POLR2D POLR2F TRIM28 CSK FBXO9 IDH3B ,sars/cov/0hour
7.652542,10.971055,Cluster 0,SARS-BatSRBD Day4 GSE50000,TUB OR8H1 CACNA2D4 ARMC8 OR2L2 PLEKHA8 MAPK8IP2 ZFYVE16 RFX7 ZSCAN20 ASPHD2 SERBP1 ENTHD1 OR4C16 ZNF830 STX1B OR5AK2 PGAP1 SPRR3 AHCYL2 ZNF274 GLS OR52L1 DHX33 SV2C PIP4K2B ANKS1B NKX2-4 N4BP2 RNF112 LMAN1L SLC6A18 GML ST6GAL1 GINM1 EDEM2 VPS13B NMBR OR4N2 GJB1 PHF20L1 OR7C2 CES3 CELA3B SLC22A7 NPFFR2 PDE1C DQX1 SLC22A2 NR2E1 DAZ2 ABCA13 TMEM186 IPO11 GSPT1 CYP27B1 RASSF4 GJA10 RPL39 PUSL1 OR8D2 CCR10 GABRA1 USP9Y MYOG TMEM43 SORCS1 IGFN1 KLK11 OR1N2 PHOX2B ITPKC LETM1 PRPF18 RAPGEF6 OR4C6 MIXL1 SGK1 OR4C3 KPRP CCDC101 TMED10 FASTKD1 SLC44A5 ZCCHC11 OR8K3 SDCCAG3 IQGAP1 UMOD CTCF SERPINA5 MRPL34 CAMKV DNAJC5G RPS27A PSD NANOS1 MGMT IFNGR1 OR10G2 GPR1 EN1 C1GALT1 MRPS21 SYVN1 OR51M1 LDOC1 KIR3DL3 RANBP6 C6ORF163 OR5T2 ANO2 SLC22A25 C10ORF82 HNRNPH2 GHRH DSCAML1 NEUROG2 TMEM229A RP1L1 OR7G3 OR9K2 MYT1L OGG1 MEI4 ASIP GPR45 OR11H4 TCF20 OR2M3 ABCC12 FSTL5 TAF7L PLAGL2 EFCAB3 PCGF1 GPR139 UVRAG KLHDC3 RAB2A CHRNB4 OR2D2 ARHGEF37 PCDH8 HSD3B2 BTN1A1 B3GAT1 TJAP1 GRIN1 THNSL1 MTNR1B MSH4 MSH5 CNTN2 DENND4A PHIP DSC1 OR13C3 CHRNA2 OR6K6 SERTM1 CRTC2 OR5AR1 IHH CLU SLC1A7 JAKMIP2 C1ORF234 CDH7 SCUBE3 GOLGA7B TMEM247 LOC102724657 BCL2L10 NLRP5 SLC39A2 FGF22 SLC30A8 SREBF2 BIVM ACBD5 NONO TRAPPC8 HPS3 INHBE GFAP MAFA SCRT1 TRAF5 APPBP2 SPRN PNLIP SYAP1 REG1A FAM49A PXK PCDH11X POGK KLHL18 MAGEB16 CACNA1E ARHGAP17 GPR82 TRHDE RASGRP4 FGF6 RPTN CCNB3 KCNV2 SLC15A4 ATP6V1F ZC3H14 PLS3 VWC2L ZFHX2 TTC13 SVOP CADPS DNMT3B EIF2AK3 APOA5 SLC4A10 APOA4 USP29 IL2 CATSPERB IRAK1BP1 CPS1 PIP AKNAD1 QRICH2 SERPINI2 MAN2B1 SLC26A5 OR10A5 R3HDM1 B4GALT3 L3MBTL4 OR52H1 OR1E2 DTX2 GTDC1 SAV1 MFSD9 AFF1 UBE2Q2 MFSD1 C17ORF100 DRD1 OTX2 MAN1A1 TAS2R1 MCL1 DRD5 CEACAM18 MBTPS2 DCC SLC13A5 CHUK APOC4 KCTD4 SGCZ LEMD3 TIAM1 MYO1E KLF8 NPHS1 VAPA SLFNL1 ASXL3 DCX PTX4 INA KCTD16 CSNK1G3 MYO1H CNTNAP5 RBM27 ZNF175 RTP2 CXORF23 TM2D1 OR5K1 PKD1L3 UROC1 SLC5A11 INS ADD2 FAM154A ARL13A MTPAP GRM7 OR13D1 PGM3 EPS8L3 MAPK1 CHCHD2 ILKAP UBQLN4 NCK1 ,sars/cov/0hour
9.206609,8.937647,Cluster 0,A-Vietnam-1203 CIP048 RG3-2004(H5N1)mutPB2-627E 3Hour GSE43203,RBFOX1 PRELID1 SP110 TAS2R10 NPFF RUNX1 LAMB2P1 PNMA3 SMARCA2 DCLK1 SMARCA5 MALL POM121L4P CYP2C9 AMZ2P1 LOC100507140 RFX5 LEP UBAP1L FAM76B ERVW-1 CDO1 RAN EPHA3 TES MTPN CNTF ZNF274 FRMPD4 SERPINE3 EI24 ZNF271 AKAP9 AVIL LOC646626 UQCR11 ADARB2 SZRD1 CD2AP HES1 CALN1 ZNF268 LINC00672 PHC2 PLA2G4F XRCC3 HSPA12B OVOL1 ANK2 IFFO1 FOSL2 CTAGE1 EIF5 CTAGE5 SNHG11 GJB7 TAGLN3 VGLL3 OR6A2 TXK CREBRF WFDC1 JMJD1C NEDD4L ZNF23 IKZF2 GCC2 IFIT2 SLC30A10 IFIT1 RBPJ CD1A FAM120AOS SOX2 ZC3H12A TSPAN5 MAGEC2 AMZ2 GARNL3 BARD1 GSTM2 JUN MAGEE2 RMI1 ITPK1 KRT13 LYRM2 LYRM7 SLU7 MKRN9P TMEM106A CLIC6 TPH2 FASTKD1 TMPRSS9 TMPRSS6 SUV39H1 HBD ZCCHC17 SHB KRT20 METTL21C FXR1 MIS18BP1 ST8SIA5 CTLA4 RPS15A TINAG ZNF585A EGLN1 CGREF1 MBNL2 MAP4K1 SLC35G5 C1GALT1 IGIP TCAIM PROX2 NFIA LOC157562 PARP8 MAP1A MKLN1 RYBP ADAM18 KIAA1715 STK17B A4GNT NFIC TMEM229A ERRFI1 MAGEH1 MRPS35 FMN2 PODNL1 C16ORF72 IFIH1 SMCHD1 LOC100129397 CTNNA2 IFNB1 LOC100506548 GC ARIH2 BRD9 GPR135 SRSF10 REV3L KLRAP1 PHLDA1 MAP3K1 GCA TPM3 EIF1AX RPS7 BTN1A1 BTNL2 MID1 RAB30 TANC1 CXCL10 OLFM3 BFSP2 LGSN CNOT4 PHIP ZNF678 FIGF KCNG4 RNMT PPP1R15A ASB14 UBE3A UCP1 UBE3B TBRG4 RUVBL1 BAHCC1 C18ORF49 PDPN RBBP6 HAS1 SLC16A7 SLC16A9 ZNF547 USP47 SLC38A2 CASR MUC19 UNQ6494 NBEA PDCD6IP IBTK FANCE DNAJC19 RNF168 ZNF92 MXD1 CDY2A CDH13 PIN1 UTP23 ANKRD12 RIF1 LOC220077 ARL2 CACNA1D FGF2 CCDC144A TGM2 NIPBL FNTA PI3 UGT3A2 CCDC11 ZNF525 ZNF644 PDZD9 MAP2K6 RBM17 CRYGS GLYATL2 DIS3 MYOCD PYCR2 GPX8 OLIG2 SGOL1 SPTB MYH1 BCL6 AKT1S1 LCP2 BMPR2 L3MBTL4 FECH NUFIP2 CNTNAP1 ZC3H6 DNAH8 LEAP2 MTIF2 CXCL1 CYP3A4 CHD2 TROVE2 RPF1 SAV1 IDI2-AS1 ERBB4 NRIP2 ZNF506 CEP290 OR51E2 NLGN4Y ADRM1 KCTD1 MND1 KLF3 THAP2 CHIT1 EHBP1 PPM1B PNKD KLF6 VAPA C1D ZNF738 CLDN8 ZNF616 TAF7 ASPA CTXN3 GCOM1 BLZF1 CCDC168 SEMA3A HDAC4 SYCP2 CCDC169 PTEN PPM1K ECE2 ACRC PPM1G OASL SCRN1 LEPROTL1 VSIG1 CCL5 TRA2B MAN1C1 VAT1L DCAF10 ADAMTS9 UPP1 C2ORF61 KLRG2 ADAMTS8 SCYL2 ,sars/cov/0hour
8.585633,10.111587,Cluster 0,SARS-CoV MA15 Day1-PFU-10^2 GSE33266,RPL21 NUP214 ACTN1 WDR76 DCLK3 LOC284561 NECAP1 CCS ZSCAN21 CIRH1A ZSCAN20 HIP1R FLJ44896 GUF1 CYP1A1 MT1H RNF220 OR4C16 CDA ITIH5 NUP205 RRN3 PGAP2 RALA CALML4 IL27RA OC90 NIPAL2 VPREB1 DHX36 LOC100507494 ST3GAL5 TCEB2 PKNOX2 NXNL2 JAG2 COG7 STAC TERF1 TMEM196 PRRC2A FAM136A VPS37A ARFGAP2 HCFC1 SLC16A14 FA2H PARP11 GIGYF2 SLC6A9 PRKAR1A TCN1 PRKCQ C5ORF30 NOX1 EZH1 LY9 HSP90AB6P EPS8 LOC100507033 GPR174 ZXDB PKHD1 PGBD5 C7 CYP2R1 MICAL1 ALKBH1 TSPAN5 ATP6V0A4 HIST1H3H KCNN2 MNX1 PCDHA9 FAM19A5 LRRC27 STRADB KLK14 KRT14 PTCH1 DNTT ASH1L AP3B1 SCNM1 ITPKC FUBP1 P4HA3 MMP19 KRT16 SLTM TTLL1 PAFAH1B1 UBAP2 RAPGEF6 RNF145 SPRR2G COX7C MEFV BTG1 MRPL39 GRIK3 TNFRSF11B MED17 EVPL CATX-1 EMB HAO1 BBS7 RAB6B UTP14A ASIC3 LYAR CTSC MPP2 ZYG11A THOC2 STXBP5L TMEM64 RPA1 GPR4 KIAA0195 DDB1 SRRD LARS2 SLMAP PLCB2 ZNF577 LAD1 RPLP0 SLC20A2 FAF2 AP4E1 KIAA1033 NUDT1 GDPD5 HOXD10 RPAIN PRSS22 GLRA2 GUK1 EPB41L4B STBD1 OS9 ENPP1 KIF13B ADRBK1 NUDT19 IKBKG ZSWIM6 NUDT14 ZNF444 CSGALNACT1 FBXW4 DENND4C FBXW8 RPS9 SRD5A2 CCDC158 OSR1 SPINK1 TMEM131 LRCH1 GSTA5 FAS TGFBI STAM2 SNRPE B9D1 OTUD3 GRINA SRSF9 ZNF672 ALDH1L1 PRUNE TUSC5 CHPF CEP19 KLHL34 KLHL32 CDH8 SLC9A3R2 DSCR4 TMEM245 NLRP9 RBBP6 CLASP1 DSCAM ZNF665 NDUFV1 ZNF543 KCNH2 SREBF1 SMAD2 TRPC4 TTC33 RBPMS NFKB2 MAFF DMXL1 TFDP1 DNAJC10 CDH16 ZNF414 ZNF775 LRRC59 GRIA3 CNP CSH2 SLC38A10 CHRD STK19 CHAF1B TCEANC LEPR PAIP2B TRIM66 IL13RA1 PTPN18 HHATL ZNF761 RFC4 IQCB1 MMP1 IQCC NAA35 TXNL1 CFLAR LAMB2 DDX19A IL5 PPP5C NSMCE4A NPC2 DPPA4 BCL6B ATP13A5 FBP1 TSGA10 MCM2 RBMS3 CCDC40 CBLN3 NSRP1 LCN9 DDX49 USP38 RASGRF1 TNFAIP8 VPS4B CHD8 MOSPD2 BICD2 GRK1 CYP26B1 DENND3 MFSD1 PDE4C ZNF626 PLA2G12A MARCKSL1 MAGI1 PPP1R14C SRCIN1 SLC36A3 RPH3AL TAF11 RWDD1 LSS KLF5 TM6SF1 WEE1 GALC MYO1F EVI2A LMX1B POLR1B ZNF618 SARDH ZNF616 INSM1 TRIM37 ACIN1 TRIB2 CCDC63 B4GALT6 TSEN34 MDGA1 ABCD4 HDAC1 USP11 CCDC47 WIPF3 SLC4A1 TENC1 SGOL2 DCAF10 LRRC8B DIP2C CTNNAL1 SLC25A25 ,sars/cov/0hour
8.454082,10.096019,Cluster 0,SARS-CoV MA15 Day1-PFU-10^3 GSE33266,CDK19 ACSL3 ACTN4 C9ORF131 AHNAK2 PCDH20 TRIP4 DCLK3 ACSL6 UPF3B HFE2 PEX13 XPNPEP3 APLF PPP1R3F PSMC3 POLR3G SUCLG1 CCDC89 RIN2 DUS3L ROPN1 ASF1B CDK16 ASTN2 USP6NL PKD2L1 PPP1R3B STATH RNF5 ASAH1 PEX26 SNX30 LSM11 ACTB FBXL20 NIPAL2 MICALL2 SLAMF6 CHAC2 CEP97 HES3 SAMD14 SLC12A9 N4BP1 TIGD4 GABARAPL2 SLC35C1 TMA7 TERF1 ZNF14 MOV10 ACE2 MYL12A ACER1 KLHDC8A GJB5 BTK CHST5 INTS9 PRR15 NOX3 LPGAT1 RPL31 HPN ANP32B SLC22A1 MRPL16 RXFP2 ZBTB4 RPL8 C7 ZNF280A STMN1 TESPA1 TNRC18 ATP6V0A4 HOXC4 TNS3 GPR18 COLCA2 TIMM23 GNL1 ZNF34 TMEM174 C9ORF85 ENAH IL1B TMEM33 ID3 PAFAH1B1 ACRV1 CLPTM1L CENPQ GPR19 AVPI1 COX7C NR1I3 PRDM11 OAZ2 SOCS3 SCAI ASIC5 SHH MLX RPL37P3 NQO1 MBD5 CD53 FAM71E1 PPARA PACRG MRPS23 KIR3DL1 FMO4 GTF2H4 MLH3 WDR11 IL17A DPY19L1 ADAM19 SPCS2 OR10X1 CCNE1 USO1 PNPLA7 ZNF215 RYR2 SETD6 CBX3P2 DERL2 SRA1 DERL1 PHF7 RPL18A LOC100507630 CXCR3 XPO6 GPAT2 PCGF1 CARNS1 ARIH1 XDH ZNF205 RAB8B ANKRD13B SEC24B UBE2C TRPV4 ZFC3H1 ZNF77 PRSS58 CNOT10 MSH2 TMEM130 LOC644189 CXCL12 STIM1 C1ORF116 NUPR1 FANCD2 MSH5 SCN8A ANKS6 XIST CNTN4 CLEC4G ALLC GALNT12 EMX2OS RNASEH2B ZBTB26 CD82 NRL CTNND2 KLHL34 ZC3HAV1L ATP1A2 NDRG3 PRSS45 FOXO3 AMOT ATOH8 RASD1 PPME1 NTF3 EP400 S1PR5 NDUFV1 CCDC18 TMEM132D CARD11 MAP2K5 EIF2B5 HBG2 SLC30A5 KRT32 IBTK GNAL KIF18A NAT8 MED26 NACA CDHR1 LHX8 CHMP2A GCLM ZNF532 CD151 WWC2 RIF1 FAM107A DUX1 TTF2 LTBP1 CORO1C TMEM102 CNN1 ATP5L2 LOC100506100 ALDH1L1-AS2 ALOX12P2 TCEANC UTP20 ODF1 RGS9 SH2D5 DNM1L TTI1 PLA2G2A EDF1 OLIG2 NDUFC1 GULP1 CLCN7 C7ORF61 IRAK1BP1 C6ORF211 JMY RTN4RL2 PDE3B LCP2 SWSAP1 GSK3A DDX3Y ZNF197 HSPB7 TNFAIP8 CHD9 PLD6 MOSPD2 AFF3 WNT11 DNAJB7 PIP5KL1 NUP43 SNAPC4 CCDC85A ZNF506 LOC728637 TRDMT1 CASP3 PHACTR1 TNPO2 ZNF501 PDLIM7 NTRK2 LGI1 SPEN SPAG6 RRM1 PCDHGC5 MAGI3 SGTB KCTD2 THAP3 CECR1 P2RX6 CLDN4 LMX1A POLR1E PKHD1L1 CTXN2 RBM47 ZMYND8 HEMGN ABCD3 AMBRA1 TSPAN13 ADAMTS5 GRM4 GK5 SPRED2 CNNM1 ARHGDIB DHX58 PRB4 IGF2BP1 ZNF721 IFT57 ,sars/cov/0hour
8.667394,9.848513,Cluster 0,SARS-CoV MA15 Day1-PFU-10^4 GSE33266,SLC35A3 LUM LOC441052 CKMT1B CRADD AFAP1 DEK ARMC8 GTPBP2 CHFR DHX40 NECAP1 RHEBL1 TBPL1 PCDHB6 ORAI1 SIK2 ZNF711 ASF1B SF3B5 ATF3 NUP205 RRN3 TTLL11 RPL10 MYCBP2 ADARB1 CLDN1 ASNA1 UXT NUAK2 SERPINF1 HOXA3 A1BG-AS1 NOTO ARL14EP FZD4 GABARAPL2 CELA2B CNTD2 COG7 ZNF383 FZD5 SLC6A17 EDEM3 KLF10 NR2F2 GPN3 ACE2 TBL2 TCN2 VN2R1P GORASP1 TDP1 NDUFAF6 FAT2 SPDYA CHST5 RPS23 C5ORF30 CFTR DHH NPY6R MS4A5 SCOC TMTC4 LDLRAD3 SLC6A4 ALKBH3 LIPF LOC646778 PRKAR2B LDLRAD1 MLST8 KIAA1468 ATP6V0A4 GSG1L C2ORF27A AGFG2 CDR2 C17ORF67 NPCDR1 STRADB TCF15 PTCH2 RAB3IL1 PRPF40B TMC7 IGFN1 LRRC23 RGMA PAWR IL1A DAZL KRT17 PQLC1 PAFAH1B1 PABPC4 HRC ID4 ZNF780B RAPGEF6 CC2D1A GAS8 CRLF3 LIMS2 ZCCHC14 ELL C11ORF1 PHF23 MRPL39 TGFA GRIK2 TNFRSF11B C12ORF42 POU5F1P3 APOLD1 PTPRH BOLL HAO1 FAM192A UBXN6 FOXB1 LOC100190986 EMR1 KIR3DL1 GFRA2 CIT GTF2H4 FAM92A1 RABIF MLH3 TMEM156 MRPL54 LARS2 COL4A4 NEDD4 SLMAP SDHAF2 USO1 PLCB2 CDK5R1 CD44 CBX3P2 MRPS35 GUCA1C LOC202181 RARS QRFP FCGBP SMG7 PRSS22 NDST2 NANS MTG1 SCN11A CXCR3 CARNS1 MYEOV2 NUDT14 HMGB3P1 SEMA4A GDF11 ZNF683 NKX6-3 PRRX2 CPSF2 FBXW8 CCDC158 ANKRD24 UBE2A ARHGAP28 ALG10 TRPC4AP GNPDA1 DOK6 FAS SCN8A RNF183 MPHOSPH8 CLEC4G OTUD3 KCNG1 MAD2L2 GALNT12 ZNF791 GPR68 KLHL34 PYGO1 ATOH8 SLC9A3R2 TATDN3 CLCC1 CDH2 STX2 RPP14 ZNF665 AZI2 GGT6 SMAD2 SYT4 GGT7 PCYT2 TTC34 CCDC138 DDX50 KRT32 TDRD6 ARHGAP12 CAPRIN1 NACA ZNF414 GCLM ZNF532 HOMEZ NOTCH1 CALCB USP54 CLSTN2 METTL2A CACNA1C SLC38A10 DUX1 CABP1 LRRC56 TMEM100 DTWD2 ATP5L2 FAM162A FBRSL1 CCDC12 SLIT2-IT1 TXNRD2 SLC4A11 KCNJ16 PARD3B ZNF75D EPN1 ZZEF1 CLCN7 ACTA1 LOC345576 JMY CHPT1 ARMC10 ERBB2IP SPACA4 OGT TNRC6C NRXN2 TRH MOSPD2 NRXN3 C15ORF43 PDLIM1 FUT9 IRAK2 BOC ZNF507 ZNF626 CPXM2 ZNF503 OR6C68 HIST1H1A AMICA1 CAMK1D RBM38 SGTB LGI3 PDX1 NGB HDGFRP3 ENOX1 TBX15 EVI2A ERCC2 P2RX1 DENND6A RUNDC1 PDE5A TRIB3 PLEKHG1 TAF3 BLZF1 EPHB6 LDB2 CLEC12A CEBPG PRR4 PRELP HSD17B10 RPS6KA5 ADD1 ACOXL DHX58 SFR1 PGM3 HMG20A FYN DIP2C ,sars/cov/0hour
9.108329,9.426318,Cluster 0,A-Vietnam-1203 CIP048 RG3-2004(H5N1)mutPB2-627E 0Hour GSE43203,SSB KRTAP17-1 ZNF282 MGA COL24A1 PRSS30P LAMB2P1 OTOP2 GDAP1 EML1 MARCKS TNFSF4 TTTY13 ANP32E MXRA8 ANKLE1 ADAMDEC1 ZAK SATB1 CCNF HS6ST1 NTN1 TPRXL TOB2 WWC2-AS2 TSEN54 CRKL FRAT2 SRP72 AKT3 PIP4K2A SERPINF1 FAM63A CEP97 LOC100508226 RAB11FIP4 CREBBP SAP30BP ST6GAL1 SLC34A2 SLC11A2 PLK2 NR2F2 OVOL1 ERVH-6 COQ10A C9ORF64 ST3GAL6-AS1 GIGYF1 RPS26 GPR183 HECW2 SASS6 NET1 PADI4 HOXB3 MEP1A NDUFAF2 PLA1A RBAK HOXB6 RSPH10B DCAF4L2 DCUN1D5 IKZF2 FAM135A C12ORF65 PPFIBP1 GATA2 PCDH19 EDA2R ZBTB4 SLC6A4 TRPM3 KIAA1107 PPP3R2 RNF214 GPR171 PLAC1 RPL39 ZNF248 ZBTB7B NKAIN1 SOX5 LRRC27 TCF12 TMC6 C1ORF21 RAB33B GJD4 NMU MAPT ITPKB KBTBD3 ZNF114 DEPDC4 SIGLEC7 EXD2 REG3A CLIC5 HBB PHF23 OTUD7B IQGAP2 MEOX2 ZNF48 SLC7A4 GNGT1 TRIM4 ST8SIA5 KIF1C RRS1 ZNF346 C10ORF90 LOC253842 ATP6V1G2 ATP6V1G3 OFCC1 PPARA GFRA2 SLC39A14 VASH2 LBX2 ANO6 C6ORF165 DPY19L2 SEMG1 ZNF219 ANGPTL6 DLD TSSK4 TIMELESS B3GNT1 ENG CDK5R1 MTMR11 LRRC19 GCNT1 C17ORF59 MIA3 PYGM PHF8 FAM115A SMG6 PDC CHRNE HEY1 ADAMTSL3 CTNNA2 ZNF568 FAM182B SRSF10 C21ORF33 PRRX2 FKBPL CRTAM HCG4 PCDH9 TAP2 VRK2 KLHL24 DCDC5 HCG9 HIC2 SUPT7L UBE2W ADAM2 COL5A1 YEATS2 IGKV1-5 ZNF438 TBC1D24 SLC28A2 LOC100131510 TFAP2A ZCCHC8 SPESP1 AGAP10 GPR68 TTTY1 KLHL30 FGD4 TMEM246 EFNB1 LINC00599 WHSC1L1 KRTAP12-1 NSF C11ORF85 TRAF3 RCAN3 DMXL2 MKRN3 UBE2Q2P1 CDHR5 ESAM LSM14B ZCCHC4 MDM1 FGF12 MYF6 EID2B CALCRL DYRK3 NCF4 KIAA1751 HIGD1B TMEM101 KCNV1 KIAA0895 G3BP2 PAIP2B ZNF385B SLC14A1 LOC389705 POU2F1 ATP13A1 ITGA4 SPATS1 SECISBP2L PYHIN1 LIMK2 SLC52A1 SGOL1 BMP5 CDK9 ELF4 BCL6 ZNF519 CCDC74B NDUFS6 ITGA9 NF2 TRPC5OS ARPP21 NAT8L FAM60A SHC3 SMG1P1 POMT1 NRXN1 CHD7 ERICH1 PLD2 LRRC16B ARHGEF10L EFCAB11 PHTF2 SIRPB1 DSE CCDC85C MARVELD2 DVL2 CASP2 CNGA4 B4GALNT2 ERV9-1 IMPG2 RUSC1-AS1 COA6 NTRK3 TIMM8B TCF7L2 UNC5B ZNF184 IRX5 KIAA1683 MND1 ZIC5 LOC100128239 HAUS3 THAP2 SLC4A9 IGDCC4 ZNF616 P4HB NAGS CCDC66 RP9 ZP4 FOLR3 C2ORF66 PKD1 RBM27 PLAG1 SEMA3D PLA2G1B PNMAL2 WIPF2 CX3CR1 PPM1K AMBRA1 GRM2 EFS TRA2B POLR2H ERC2 ZNF600 TCEB3C POLH ,sars/cov/0hour
9.127426,9.36891,Cluster 0,A-Vietnam-1203 CIP048 RG3-2004(H5N1)mutPB1-F2del 3Hour GSE43203,TRHR MIR143HG SSTR5-AS1 HCG27 CNBP C5ORF17 GOLPH3L ACSL6 SYTL3 SFRP5 CD2 PSG9 POM121L4P LOC100507387 MAPK10 MYL1 HCG23 DCHS1 ERVW-1 FSIP1 ITIH3 ADH1A NOD2 AKAP6 KIAA1211 HS6ST1 SNX31 BACH1 SZRD1 EXOSC8 MUC1 ELMSAN1 DPYSL4 APBB1 IGLON5 C3ORF14 SAMD11 MAGEA5 PHC2 TNFSF15 FLJ22763 PLK3 PLA2G4C FLJ34503 ANK1 KIAA0391 IFFO2 ATP4B GJB6 CHST1 PRR16 LOC100505784 SSR4P1 OR6A2 HOXD1 TMTC2 GATA4 TEX29 CD1A EPB41L1 REG4 GARNL3 ZNF367 AGFG2 PIFO IGHV5-78 KRT12 TTC9B ITPKC INF2 ITPKB CLCF1 RAPGEF2 RARB KLKB1 ZNRF3-AS1 SERPINA12 CLIC6 KLK2 PRDM16 HBD C8A PPCS TMEM31 SHB PCSK6 LRRC31 HOXC10 STK33 PGS1 LOC100129973 CSRP2 CASP10 STK39 KRT26 C14ORF183 LOC100996579 CTLA4 FAM192A DFNB31 CD34 NPSR1 CCR3 MEF2D CD52 MBNL2 ZNF341 ZNF581 GPR3 VWA3A SNX20 HCK ZDHHC15 SERPINB7 MAP1A ADAM18 C18ORF15 MCF2L-AS1 FLJ25715 ESYT3 TSSK4 FOXA2 LRRC15 IGHM POPDC2 SERPINC1 FOLH1B LOC727916 GPR45 LPCAT1 FCGBP PSMA8 PODNL1 PIN1P1 SERTAD4 OLFML3 CXCR1 NEFL SPIN1 DEPTOR ANKMY1 MLIP TGFB3 CORO2A TFAP2E CRTAM SPNS3 YIF1B OTOGL TLE6 STIM1 ADAM6 UBXN10 KLRD1 LOC100287728 ZNF678 CLEC4M LY6H PRDM8 GDA LOC100507419 RNF39 LINC00482 RFNG SLC1A6 FOXO4 ACAP1 FGD3 CLEC3B LOC647323 BAHCC1 C6ORF123 C1ORF226 PDPN CYSLTR1 NTF4 SLC25A42 ADORA3 PAK4 S1PR5 TECTB PDIA2 ARID5B TRPT1 KMO IGSF10 FAM90A1 HIST2H2BE GLTSCR2 MAF KIAA1755 SELL CDHR3 CLRN1 FSCN2 SLC25A52 MAFK ST6GALNAC5 FGF11 PFKFB3 BRSK1 PFKFB4 ARHGAP9 C17ORF99 UPK2 FAM107A SLC2A4 AK8 TMEM100 RGS3 RAB43 LOC645166 C1QTNF9 PDZD2 COL4A3BP CPAMD8 LOC100130691 SRGAP2 MFAP3L MGC4859 TIPARP LAMB3 PLCH1 MRGPRX3 CADPS CYP4A11 PYHIN1 WIPI1 NRG2 KY KBTBD12 HIGD2A IRF1 SCAMPER VSTM2L DNLZ SLC26A9 TRPC5OS SPACA5 NAA38 TRIM54 MS4A3 SLC26A4 LOC100132004 KDM5D L3MBTL4 DAGLA CNTNAP1 FBLIM1 DNAH8 NCAM1 CBY3 DUSP16 PLD1 NLRC3 DPP6 KLC4 ERBB4 LLPH CA4 LOC643201 SLC26A4-AS1 DACT3 FAM83A CNGA4 EIF4H TAS2R4 DRD5 IMPG2 CAMK1D NLGN4Y NDUFA6 GZMB KCTD4 THAP1 RAD50 CHIT1 NELL2 NELL1 PNKD ZNF738 TSPAN18 PI16 SSBP1 CTXN3 MYO1H MVK RTP4 LAMA1 TULP2 FAM179A GRM1 IL1RL2 PHKG1 LOC100131508 VSIG1 NOS1 CACNG2 BNIP1 CTHRC1 ,sars/cov/0hour
