x,y,cluster,term,genes,cluster_label
8.096386,9.143068,Cluster 0,icSARS CoV 12Hour GSE37827,RBFOX2 BBIP1 RC3H2 SOX15 CACNA2D3 WDR73 SLC51A DKK2 C14ORF159 SMARCA5 DES CCT6A FRAS1 LOC100128176 KIAA0247 LGALS14 RUFY3 MXRA7 MYL9 CDK14 ALDH8A1 AHCYL1 SLC23A3 EHF ATF1 LRP2 C14ORF79 HM13 AVIL TPGS2 ASCL1 LSM11 FAM120A UBAP2L SYNDIG1 HOXA6 GTSE1 EPSTI1 NFE2 PLK4 DNAH11 PLK1 DNAH17 C7ORF49 VPS13C TAS2R38 LOC284344 PTK2 PARP14 PHF20L1 AGPAT4-IT1 ATG2A TLCD2 GRB2 SIM2 ACTRT1 PAEP TNFRSF6B MEAF6 CASZ1 RPL35 CEP85L JMJD1C ANKRD20A2 CIAO1 RRP9 LARP1 RPS15 CCDC91 LOC100505650 LOC100131826 GOLGA1 KCNMB2 GOLGA2 ANKRD20A5P SEC31A AMZ1 APOD UPF2 LOC100133050 LOC284648 LILRB1 MRPS2 SIRT2 NCOR1 PAX9 ITPKB CENPL KBTBD3 PIGA KRT15 VWA1 FAM193B TLR5 RCCD1 RAPGEF4 HOXD8 CENPT ZCCHC14 UBXN1 GRAMD1A KIF11 TAS2R46 KIAA0040 DUOX1 FXR1 GABRR2 BCLAF1 MIS18BP1 LARS MAP2 TIMP2 SNX9 CD34 MBNL1 ELMOD3 MRPS21 SYP KIAA1045 ZDHHC11 DSPP MIB1 MIPOL1 RNF125 FABP3 APITD1 ADAM17 PDXDC2P LOC100132661 RPL23AP53 RPL34-AS1 SETD5 PIH2 SLC9C2 HSFY2 GRAMD2 SH3RF2 NDST1 CAMK2N1 MGC39545 FLJ21369 P4HTM MAP4K4 HS3ST1 SNRPN TLE1 MRE11A BTNL2 SDHAP2 PPAPDC3 HUWE1 FBXO11 FLJ13744 LOC643406 SLFN13 C1ORF61 ZNF317 COX20 LOC401320 CCDC150 ZNF432 GOLGA8A TYMP HFE ERV3-2 KLHL36 CELSR2 GALNT10 LOC221814 TCTEX1D1 TTTY7 DENND5B ZNF546 PLGLB1 LINC00597 FGF23 OSBPL8 SLC38A2 SEMA6A EIF2B3 C8ORF17 CCDC137 OSBPL3 TIRAP CYBB C11ORF80 SMAD7 LOC399491 COASY SCRT1 DIAPH3 GNB1 CAPRIN2 SLCO1A2 RAD9A DOCK7 MINOS1P1 CALCOCO1 TACSTD2 LRRC37A4P NPEPPS PHYHD1 PRND SCN9A NEK1 MFSD6L EFHD2 PMAIP1 GUSBP4 CD99 TAPT1 HSP90AA1 C1ORF162 LOC100131150 XCL1 RBM19 SMC1B CLK4 SAFB PEX6 NAF1 CEBPZ DSG3 SPACA7 SLC26A7 RBMS3 RBM22 LAT L3MBTL1 GGT8P GSK3B YWHAE LOC100130071 LOC100130193 CHD9 UBR5 CHD6 CMAHP MTR HSPB1 NT5C2 ADAL GTSF1L MGAT5B LOC645984 SND1-IT1 IP6K2 HIST1H1A CEP170 KDM2A CPT1B RCVRN RALGAPA1 DAPK1 PPBPP2 ATRX SPAG5 SPDYE5 KCNK16 YWHAZ KLF4 EPOR TBC1D1 EEPD1 JSRP1 PPP2R2D DAD1 COL8A1 ZNF615 SPRY3 CSNK1G1 SLC25A5 BDP1 CCDC174 HIST1H2BD CCDC172 MIR155HG HIST1H2BM PKD1L2 SLC5A10 CXXC5 CACNG7 RBM4 ADD1 AP1G1 LOC646976 SCRN1 ZIC4 SLITRK2 SLITRK4 TRA2B CEP152 OK LURAP1 OIT3 CCDC50 SLC25A23 C3ORF36 EIF2A VSTM4 ,sars/cov/0hour
8.827672,9.3123045,Cluster 0,icSARS CoV 24Hour GSE37827,SDR42E1 UNC13A LUM SLC12A6 KRTDAP LRRN4 FAM76A BTBD18 ACTN2 DKK2 HTR5A DKK4 EML6 TTTY15 ULK4 UHRF1BP1 MYL9 CCDC83 ATF2 CNTFR ATF3 PANK3 TMEM74 HSF2BP HS6ST1 PHYHIP TMEM71 CH25H SAMD15 RNF115 PPP4R2 SNX29 IFI16 PREX1 C2ORF80 KDR PTGFRN CYP1B1 HOXA1 RPRML ANKS1B RABGAP1L EGR2 APOBEC3G ZNF263 SH2D1B IGF1 NR0B1 HSPA12B STGC3 ZNF847P LOC100130285 ACTRT1 CEP85L NAPEPLD ZBTB6 GPR174 CRTAC1 ARSI ANKRD20A5P IL12A APOD GARNL3 APOB CCR1 EDN3 SIGLEC10 OTUD6B GP5 GAB3 ADAM30 C9ORF85 LOC286272 SIGLEC1 FAM193A RPUSD3 VSNL1 MOCS1 RAB7B ZCCHC13 SLC35F4 HRCT1 ZNF44 CD3D LRRC31 TMEM26 GNGT1 PENK C6ORF58 SNTG2 CNTRL ST8SIA5 RNF152 TNFAIP8L3 C16ORF54 CD34 SMYD1 TPTE2 CD52 PNPLA8 NOXRED1 PROX1 ADAM11 RNF157-AS1 PCDHB12 PTH2R HCK APITD1 TXLNB FAM200A RILPL2 MARS ANGPTL3 RPL34-AS1 LGR5 LINC00622 LRRC15 AMIGO1 LINC00189 MYT1L AFM LOC100132790 CRYBA2 PRICKLE1 PHF7 CST7 FSTL5 ROBO2 ESM1 NDST1 ZSCAN30 HEY2 LOC100509814 ANKRD55 GCNT4 RSPO1 FADS2 BTNL9 PRLR KLRC3 DIO3 SLC31A1 LIFR KERA MYT1 XG ARHGAP24 C1ORF61 WT1 EMCN CLEC4D TTTY9A LRCH2 ARHGAP30 FAP UBE2U YPEL2 WDFY2 RIMBP3 SPINK13 ZNF555 LOC100131510 CHRM3 ZCCHC7 CD84 CHRNA3 UBE3D MRFAP1 KLHL34 TTTY1 AURKC FOXO1 PYGO1 KRT6A CDH6 LOC100507530 DACH2 ZNF549 GAS2L2 MB21D2 SYT6 AICDA KCND1 NFXL1 KRT36 LOXHD1 CES4A FAM90A1 MIR100HG FAM175A ANKFN1 ABCA11P FAM151A FAM163A CLRN1 ZNF658 XAGE5 GPR101 CDH19 LHX9 LOC100652770 MINOS1P1 BEAN1 PCDH11X STK19 KLHL13 COX7A1 GPR83 WISP1 DDX60 B3GNTL1 CNN1 PDZD3 UBB FHAD1 KL PLA2G2F USP21 KCNJ9 PCDHGA5 HSPA6 PCDHGA3 CCDC38 GFPT2 OR1F1 OPRM1 SLCO1B7 SLC4A10 NAV3 C1ORF168 DKFZP434C153 OGN VSTM2L APOA1 GCSAML IRF8 CCDC42 OR7A5 PYDC1 PDE3A CXORF58 C8ORF76 LINC00324 LOC645195 SLC25A2 RHOXF1 HAPLN1 LINC00320 DLX4 CATSPER3 CNRIP1 DNAH8 NCAM1 NPR3 TNFAIP3 SPATA4 NPAT KRT33B LRRTM4 LOC643201 VPS54 ZNF507 P2RY2 SND1-IT1 TPPP CYTIP SLC13A3 LIM2 NEGR1 BOLA2 ZNF300P1 SGCZ QRSL1 ADCYAP1 TBX15 SNRK ASXL3 LOC100506031 LNX1 DCX SCLY RP9 CCDC174 MCMDC2 GOSR1 CSN1S2AP DDX24 SRF ZBTB46 NR3C1 CKMT2 LOC100130417 LOC100131508 LOC100506700 ZNF844 TAS1R2 ADSS C2ORF61 POLR2M LOC100131864 ,sars/cov/0hour
7.928707,9.566622,Cluster 0,icSARS CoV 3Hour GSE33267,SLC12A3 SRRM4 RFX3 SOX13 MED13L PISD GTPBP2 DCLK1 ATG12 CCAR1 HIST3H3 HIST1H4B CCS NEURL2 RFX6 MT1H MYL9 CPEB4 OR4C16 PARG STXBP1 ZNF276 JRK FGL1 PPP1R35 SMA4 UQCR11 ABRACL RNF6 PDCD10 CHST10 ABI3BP APBB1 SERPINF1 NKX2-1 TBL1X UBASH3A PART1 HOXA7 TBC1D8B DAXX ZNF382 XRCC3 PRRC2A ANK2 GBAS PARP11 SNW1 UCK1 SLCO5A1 PRKD1 ATG2B INTS6 SFXN5 NOL10 SPRTN SSR4P1 MATN1-AS1 ITM2B PTGES LCORL IPO13 RWDD2A HHLA2 CTBP1 SOGA1 ANAPC10 IPO11 IFIT1 ISM1 MRPL12 FAM110B GOLGA3 PELO ALX4 DPF3 MCMBP ATP6V0A4 PCDHA4 PPAPDC1B SOX8 CYB5R1 BANP ZNF365 IKBIP OTOR FOXD3 ZNF484 GNB2L1 GAB3 TMEM37 TLR2 GIPC2 TMEM35 CCDC90B PAM CAMK1 RARA TMEM106B ZNF597 SBNO1 IGSF23 LDHC SLC22A15 MRPL41 HLTF PCF11 LOC100507053 SMYD5 GPR115 ZNF223 RANBP2 LMLN ZNF584 PALD1 FAM46A TMOD3 MCCC2 SNX25 ZFX PPHLN1 RPA1 MYO9A KIN TOMM34 DHRS9 GPR143 COL4A3 NFIC TPST1 AGBL3 ANKRA2 C11ORF53 C11ORF52 SERPINC1 HEXA WRB PRKAG3 AOAH ADAM20 CST7 HERPUD1 ESM1 DNER CHN1 SRSF10 SH3GLB2 USP8 TGFB3 PTCD3 ZNF681 CPSF1 PUS1 GTF2F2 GRHL2 BTBD9 AKR7A2 ARHGAP24 ERN2 SLFN13 SLC25A38 CNIH2 NAAA PTPN7 SLC28A3 PVRL3 RHCG ALLC ALDH1L2 PHLDB1 CELSR1 TAMM41 SLC1A2 ARID4A CHRNA9 ATP1A3 HOXA13 ZNF81 CASKIN1 NT5C ZNF428 MYH15 YKT6 ZNF668 WHSC1L1 SYT6 CARD10 ODF3 NONO MUC19 INHBA CYP4F11 FANCG LSM3 MAF AMACR GGCX REEP5 KIFC1 MKRN3 KCNA10 FTL FGF12 MATN3 WHSC1 CTTNBP2 INSIG2 CSF2RB KRBA1 LTBP2 GSTM2P1 MMP21 C1QTNF4 PPIP5K2 RBMX2 ZMAT4 ZNF408 NEK2 CDH26 EIF3CL ZNF645 SLC15A5 LOC389705 POU2F2 GPX4 SLC52A3 MACC1 SEPT2 ABHD14B NEMF C1QTNF9B NAP1L5 CLK2 DDX19A MYH2 NFKBIA RBL1 RTN4RL1 DNAJC5 HLA-DRA ITGB1BP2 BUD13 SOS2 C8ORF76 OR10A4 ZNF750 C14ORF105 GTF3C6 PLD6 OXT ELAVL1 ATP5O HAPLN3 PELP1 APH1A CYP26B1 TMEM204 OTX1 CCDC182 DNAJB8 CD300LF NADK CTNNBL1 KCNH3 MARCKSL1 DAPK1 CCDC59 LGI3 ZNF180 S100B DCN ASPM ATRN TAF1 PTHLH RAB12 MYO1D OCIAD1 RUNDC1 USP15 LOC284837 KRT80 RTP4 PKD1L3 ACTC1 ATP5G1 FYB CECR3 SEPT7 UFL1 STK32A SLITRK3 ALDH1B1 TNNI2 POLR2G CDC37L1 HMG20A PSTK ZNF721 POLH ,sars/cov/0hour
8.085039,9.771274,Cluster 0,icSARS CoV 7Hour GSE33267,B3GALNT2 C2ORF76 SMARCA1 GLYCTK OXSM MGA RPL23 ENTPD8 HFE2 UBAC2 OR6T1 HIST1H4A ST5 SEPT7P2 PSMC4 NINJ1 CD6 KATNAL1 SUCLG2 TRIM10 C2ORF70 EPB41 ITIH3 STXBP2 MTMR9 ATP5A1 AKAP7 KIAA0485 HPSE2 AKAP5 TPGS2 RS1 C9ORF129 RGPD5 MAGOH TMEM67 TMEM68 NR2C2AP SLAMF7 GNAT1 CHAC2 NHEJ1 ZNF148 S100A12 PRKCH NTNG1 ST8SIA1 TPSG1 FKSG29 SLC35C2 OR4N5 PRG2 NR0B2 ALG2 NARFL TLCD1 KCNMA1 ASTL PPT2 PADI6 NANOG TLCD2 HBP1 HOXB9 NODAL ATF7 PLA1A CRYAA PRR14 CDS2 CERKL TDRKH TTYH1 ECI2 MRPL17 COPS7B ACSM5 ARPP19 WDR46 MBD3L1 AAAS C5 KLRK1 SOX18 PTPMT1 GPR173 TIMM17A TP53BP2 ERMAP RPS11 RHBDL3 LGALS8 GPR18 CCL23 ZNF483 IL13 IL19 CGN EMP3 SIRT1 TUBB2A TRMT1 MRPS6 WDR34 ZEB1 BCORP1 KBTBD6 KRT17 PAFAH1B1 CENPO ZCCHC13 CLIC4 ZBTB8OS RASAL3 CLYBL CTSS PANX2 MRPL42 PSMC3IP SOCS4 ORMDL3 SMYD2 ST8SIA6 TIMP1 EMD DLGAP4 SLC18A2 NEUROD1 IGHA1 YTHDF2 DEFB118 SLC2A10 DYNLL2 LRG1 SERPINB6 SCAF4 ABCB11 STK17B LAMTOR1 PNPLA5 TACC2 OR4A5 RYR2 KDM8 SPEF1 TGFB1I1 C20ORF181 LYZL1 OR2M4 RNF135 SNCAIP PCGF1 MYOZ2 ZSWIM5 LCMT2 SLC17A4 NKX6-3 G6PD LIG1 PLCL2 PPP1R16B MITF SDHD SHISA3 VRK3 UBE2B FBXO10 FOXP2 MTNR1B ZNF70 MAPKAPK5 MSH5 AIPL1 SREK1 ZSCAN1 ROR1 UTRN NOL3 PUS10 C11ORF73 LOXL4 PRSS46 APEH C1ORF229 BAHCC1 CDH3 CFL1 ROMO1 BANF1 ATOH1 CCDC18 SMAD2 GGT7 MUC19 DDX53 SMAD6 MESDC1 NFKB2 NAALADL2 C20ORF96 ISG20 SPTY2D1-AS1 CACNB4 SCCPDH KIAA1875 MAP7D1 MDM4 BIRC2 OSBPL1A SLC26A1 LY6K C3ORF70 FBXO28 KLHL17 WWC3 LY75 FBXO24 SLC2A6 CCDC144B SLCO2B1 KLRC1 FUK MUC16 MOAP1 PABPC4L CCDC39 POU2F1 ABCC2 SUN1 CBX5 MMP2 BOD1 NAP1L4 CBX1 NDUFC1 MARCH8 TNFRSF1B MYH2 RCN2 MGC16275 CPD CDK3 CDK1 PAPPA2 SLC26A6 TNRC6C NUP210P1 MIPEP TTC24 PSMD13 NFAT5 KHDRBS3 ZNF195 CHD9 LMBR1L NDUFB4 HAPLN4 C1ORF158 EFCAB11 LOC646708 PHTF2 RIC8B DSEL LRRTM2 CNGA3 DGCR8 CCDC180 OVGP1 KDM2A TRIQK CCDC176 HIST1H2AJ SLC13A1 ZBTB38 GLRX2 KRT75 C19ORF60 RSPH3 RPS6KB1 DCT MAN1B1 KCTD14 PABPC1L RBM46 ANAPC2 OTUB2 RBM27 ZBTB48 TYRP1 CXORF23 SLC24A1 WDR86 ECE2 USP18 SLC4A5 HTN1 CBS CNNM2 PGM3 SCYL3 ,sars/cov/0hour
7.9802475,9.246652,Cluster 0,icSARS CoV 7Hour GSE37827,DYNC2H1 PLEKHA2 ARL15 AHNAK2 RFX3 SOX15 KIAA1462 GTPBP8 ISL1 COL1A1 RBP5 KIAA1456 NEURL2 GUF1 FAR1 NHLRC3 MGC27382 MTPN PRKAA2 PRCC STXBP4 STXBP5 LRP1 CBLB ZFYVE1 TPGS2 PTPDC1 FAM169A TOB2 AQP4 BAIAP2L1 PRPSAP1 TMEM67 ZNF704 TBL1Y BSN ZNF148 ARL14EP KLF13 XBP1 DNAH11 ZRANB1 XRCC6 DNAH17 EAF2 RASSF8 PARP14 ERVH-4 GIGYF2 MLLT10 CDCP1 SETX SLC6A9 PIK3R1 TSHZ1 TEX13A SIM2 PDE1C TTYH2 NGLY1 PLA2G7 TMEM89 SI ZNF280B KCNMB2 INPP5F MICAL1 ANKH INPP5K ARGLU1 ANKIB1 ZRSR2 EDN1 AKIRIN1 TET2 TMEM42 SUMF1 WDR36 DCBLD2 ENAH VAV3 TOX4 RHOQ TTLL5 MTF1 KIAA1257 EXOC4 UMPS ARHGEF6 VWA8 TMEM185B AHCTF1 PRDM14 BRCA2 WNT8A CTAGE11P CX3CL1 TOR1AIP1 CHRAC1 GSE1 CNTRL PCK2 CLIC2 LIN54 STRA8 PAG1 ZNF585B LOC100653247 EGLN1 ATAD1 PACS1 OR1L4 FMO4 NFIA MPP7 GTF2H5 ZADH2 NMNAT1 MSRB3 LPPR3 TAOK1 ZNF354A KIAA1958 HSD17B7P2 CDKL2 CRB1 FAM21A TRAF3IP1 MIA2 OLA1 TUBD1 SH3RF1 FOXQ1 ASH2L NKAPP1 TBC1D22A JAK1 CD55 RALBP1 PTPN2 ZNF683 ANKRD26 CRBN YLPM1 GOLM1 LIFR ATP11B FBXO11 KLHL20 SKI TMX4 ADAM6 TMX1 KAT6B KLRD1 CHMP4B BRWD1 SCG2 SLC28A3 ZNF790 CCNT1 SLC1A1 HFE PROS1 NEXN LOXL4 KNDC1 NAPG HIRA CEP128 RAB21 SLN UBN2 CAPN3 LOC100505478 DENND5B CHP1 SPOP RXRG PURG DTD2 STOX2 AP3M1 CPA1 KCND3 ARPC5 MTL5 EIF2S3 MOB1A MIR100HG MESDC2 FAM175A MMS22L DMXL2 CHMP3 MAP3K11 ZNF658 ZNF776 MFGE8 MDM2 GRIA2 ZNF770 ANKRD17 SLC26A2 LPL RTKN2 METTL2B ARL1 IPO5 VCPIP1 CALCR TMEM225 RGS1 PMEPA1 THEM4 PAPOLG NEK2 PLXNA2 LEPR HADH SLC37A1 RPL13A C10ORF12 FOXL2 PARD3B SSTR4 ETV6 HAX1 RCN2 SP1 PIP NF2 PDE3A BUD13 ZMYND11 PIK3C3 ABCB4 DTHD1 ABCB7 CHD9 CELF4 PTPN21 MTR HK1 TREM1 CPZ EFCAB11 SAV1 SPATA8 AFF1 KLC4 ADAL PHACTR4 APOPT1 WASF2 C2ORF40 BCAS3 PLA2G12A SMARCC1 PDE4DIP MAGI3 RWDD1 PDE4D RPL35A SNX29P2 FAM168A EPOR CDC40 SNTB1 LMBRD2 IL2RA SCGB2A2 LNX2 CCDC171 EIF3F TRIB3 USP15 NCKAP5 PPP1R13B ARHGAP11A ITGB5 AKAP8L CDNF ZBTB43 PRR5L CXXC5 GRM1 THBS4 MTRF1 MAPK9 FAM178A PRB2 FIP1L1 CEP152 SLITRK6 NOS1 PLEKHH2 ZNF841 RPL7A EIF2A ,sars/cov/0hour
9.097776,8.985826,Cluster 0,A-CA-04-2009(H1N1) 0Hour GSE40844,TTC39A LACRT TEX33 PCDH20 C5ORF17 SOX14 GOLPH3L RFX1 LOC100507022 FNDC5 MGP SOAT2 TOLLIP IDNK TEK GTF2IRD1 CYB5RL FILIP1 ERVW-1 ALDH8A1 STXBP1 ADAMDEC1 AHCYL2 HECW1 PRAMEF10 TRANK1 TSEN54 NUAK2 HERC3 MOV10L1 LOC100507131 LONP2 ZNF823 E2F4 HOXA1 MAGEA1 SPDYE7P ARRDC5 ZNF143 NFE4 TBC1D8B ABCA6 DNAH17 FIBCD1 CEL GDF3 FLJ34503 OVOL1 VASN AIF1L COMMD6 BPIFB1 LOC154761 KLHDC8A PRR13 LINC00421 LDHAL6B PPP1R18 SLC45A1 MEPCE FAM65A ENO2 ZBTB4 RNF215 LOC100507277 NUDCD2 SPATA5L1 FAM41C APOF CCDC93 ZBTB7C MNX1 TMC2 GSTM2 LYRM9 CP C1ORF21 PNMA6A NME2 CEACAM1 PAX9 CFHR4 CLDN18 RBMY1E GPR125 HRK DET1 ARF1 MFI2 WDR25 GRIK1 METTL21C ACAT2 SOCS3 SULT1C4 PPP3CB ASIC5 LDHA AUH SNTG2 CATX-1 STK39 TNFAIP8L3 NOXRED1 TMOD4 VWC2 PRO1804 PRSS35 FAM104B POU5F2 MAS1 MS4A6A ANGPTL7 LINC00623 TSSK2 SETD5 OR7G3 DIRAS1 SLC43A2 ZDHHC7 ABCC12 GLI1 GUCA1A GYS2 UBL3 CHN2 DMBT1 MRC2 MGAT3 PRAME RSPO2 FAM182B CA13 SNRPN KRTAP13-3 KRTAP4-9 FKBPL CD160 HSD3B1 TMPRSS12 PNRC1 HIC1 COLQ DCDC1 TMEM133 CLEC4C RBMXL2 OLFM4 LGSN UBE2U SLC9A9 GSTA2 GSTA1 DPEP2 CSPG4P5 C6ORF10 CREBL2 PRDM2 RBFA DEFB1 AMOT SKINTL UG0898H09 TUBB3 TBX21 CASKIN2 RGS22 ADORA3 GPC5 PLGLB1 CCDC142 MYH11 CD96 GCKR CPA1 TRPC7 CASR SYT2 GOT2 CISH HBG2 C3ORF62 UNQ6494 HELZ C2ORF16 POU3F2 EFNA1 FLJ44715 KIAA1755 SELL MAFG RAD54L2 TDRD12 ESAM COL6A6 XAF1 SELV AKNA KCNE2 CPB2 PMCH SIRPG FBXO24 RORB PLAT CACNA1D LRRC55 LOC286382 KCNV2 RAB43 SALL2 RGS1 KIF3C FNTA APMAP B3GALT2 FHAD1 SESN3 TXNDC2 MSC MAP2K6 LRRC4C SLC14A1 ANGPT1 KIAA1661 NRG2 USH2A UBE2QL1 CATSPERB RASA1 TMEM213 CATSPERD ESRP2 MFAP4 LINC00326 ATG4B MYH8 SNAP25 POM121L10P ZC3H6 DLX5 NDUFB4 HSPB2 ARHGEF10L TREM2 AFF2 PHTF1 SPATA9 DRAM1 C21ORF90 RDH12 RDH11 CA5A ADAMTS18 LBP TMEM208 DDI1 OTX2 CEP170 TAC1 FAM71B C8ORF58 DKFZP434L192 C8ORF59 EYA2 GRID1 EYA4 SLC13A1 RPL23A MUT P2RX4 CTDSP2 SCGB2A1 CRY2 PI15 TLL2 SPRY1 AGXT CD101 UGT2B7 KRT82 CST9L RTP3 TYRP1 C4ORF19 HCG18 C15ORF26 CAND2 CNNM2 PRB1 SLITRK5 SPDYE3 SPDYE2 MAN1C1 BEND5 ZNF844 LRIG3 STK32B SCYL3 LOC100130654 ,sars/cov/0hour
8.191727,9.01666,Cluster 0,A-CA-04-2009(H1N1) 0Hour GSE37571,SLC35A3 DYNC2H1 ZNF287 C2ORF74 CIDEA DYNC1LI1 C19ORF40 SPATA16 FAM133A POLR3C FEZ2 LACTB2 SOAT1 TMEM126B ZG16 HNRNPF SIK2 BCOR NAIP WFDC13 SPRR4 STAU1 SAMD9 RALA WBP5 AKAP6 BACH1 ADCY7 NUDT16P1 CYP2A7P1 SRP72 VPREB1 IFT74 FAM120C E2F4 LINC00515 CER1 AQR ABCA1 DNAH11 HLA-J SPHKAP FKSG29 RASSF9 TERF1 HNF1B PUM1 AIF1L PRRC2B HLA-F EIF5 CCKBR CTAGE5 TREML4 GORASP1 LOC100131938 HOXB2 STRN MMS19 LCORL TSPYL6 COL13A1 HPR ATXN7L3B FAM135A ADCYAP1R1 IKZF5 LOC100289094 FAM122A GJA1 GPR171 NUDCD1 GLUL DUSP6 NCOA6 ANXA3 SIGLEC11 KLHL2 SORCS3 ANLN CENPF KCNJ2-AS1 KAT2A CHIAP2 P4HA3 KBTBD2 CCNG2 PAFAH1B1 CENPQ RAPGEF4 PHF20 GPR26 INTU LOC344887 BRCA1 MYNN PPP3CA ZMYM2 ERMP1 SH3BGRL2 ZNF347 SNX9 UBXN4 CEP55 UBXN7 CAMP ICOS TRGV5 PPARA MTX2 NFYB PGAM2 PARP1 WNT7B TCAIM ANO5 ZDHHC15 TJP2 LOC100130920 RFWD3 XPOT TAOK3 CANX WAC AIDA PLA2R1 NUPL2 ZNF577 RAB3GAP2 IL22 PHF3 SETD3 TPSD1 PYGL CLINT1 ZNF69 GNAI3 PODNL1 GLRA3 PCM1 KIAA1147 MC4R ENPP3 LOC100509814 C16ORF78 CORIN PTPN2 CD164 AGTPBP1 DIMT1 CDX2 LMO3 DEFA6 KLHL23 PPAPDC3 CHERP ST7L ACAP2 C6ORF25 ABI1 PKP4 PHIP CSPG4 RAI14 OSBP2 PRDM9 RBPJL PUS10 AKR1D1 SRRT PRDM7 TSPAN31 HSD17B4 ARID4B WWTR1-AS1 NPAS3 BEST1 DAOA DOCK10 ODF2L TEKT1 POTEE GPC6 SIAE ESRRB SMAD2 BIVM C11ORF87 CCDC14 NUP153 DDX52 TBCA ESR2 PICALM SELP C6ORF118 CDH11 CNGB3 CDH17 KIAA1191 ANKRD17 PMCH AK2 SLC2A3 LTN1 CACNA1D CAMSAP1 GLIS1 PPP1R9A DAPP1 CCDC144A CALCR FAM150B ZNF407 ANKRD11 ZNF646 USP53 SBF2 SLC38A4 LOC399815 KL USP21 ECD NRG3 TTC17 C4ORF46 MARCH1 RCN3 CPS1 CRYGA ARMC10 ERBB2IP LOC100132363 MYH6 NFE2L2 IDI1 EIF4B NUFIP1 CATSPER3 USP33 BNC2 HSPB6 PSIP1 LMOD1 GTDC1 UBR2 RPAP3 AGAP1 MLLT6 SPATA8 RHOT1 LOC100506122 SP140 PGK1 ECT2 WASF1 LOC729603 SLC13A4 PLEKHG3 UNC5B CYP51A1 KCNK12 IMMT KCTD1 KCTD4 KRT77 CTDSPL SGPP1 ASXL2 FMNL3 DNAJA3 SCGB2A1 INSM1 VDAC1 MATR3 GAFA2 MYO1G ABCE1 SNED1 SEC11A HDAC4 SYCP2 USP13 PRELP MSMO1 HSD17B12 NR3C1 FAM154B NT5DC1 GRM3 BSN-AS2 RMND5A SGOL2 POLR2B OXCT1 TAGAP KYNU LRRC8B TRAT1 VPS35 ,sars/cov/0hour
7.475785,8.881604,Cluster 0,A-CA-04-2009(H1N1) 0Hour GSE47962,GAMT SLC12A2 BSDC1 ASRGL1 UPF3B LARP7 NECAP1 PSMC6 XPNPEP1 MTHFD2 POLR3D EIF1B ANKLE2 HNRNPU SPG7 RGPD2 MTMR8 LSM10 ANTXR1 STK38L SERPINF1 FAM63B VPS18 PRPF38B TNFSF15 ATP6AP2 RAB3IP SLC11A2 SECISBP2 CMC2 ARFGAP3 EHD1 FAM220A MC1R NDUFAF7 TRMT13 PTGES SUGP2 ANP32A-IT1 RPL3 ZNF250 FUT11 NAPEPLD GCC1 JMJD1C ICAM3 TWIST1 ALKBH8 DEDD2 RBPJ SULT1A1 RASSF1 PCBP4 SPATA5L1 ZC3H12C ALKBH2 PRKAR2B NKX3-1 ARSJ IER3 SULT1A4 STAT5A LYN DUSP6 NCOA7 TSC22D1 NIPA2 MAD2L1BP GNL2 PAWR VEGFA ITPKC C12ORF29 NHP2L1 REL RHOV ARHGEF2 GPR125 BTG3 CD40 OPRD1 TMEM161B ZCCHC10 HILPDA SDC4 LRRC1 PQBP1 POU5F1P4 SPTY2D1 CX3CL1 MRPL33 PRDM10 PTPRG MED13 HINT3 C6ORF58 ZMYM5 NEU1 SH3BGRL2 STAP2 EBLN2 RIPK2 NFIL3 CTSC EGLN2 SUZ12 SERPINB1 FAM46A GTF2H1 NOC3L KIN GPR143 FAM200A RAB9A LAMTOR3 GOPC NUPL1 ROBO3 DHRS13 IL20 CDKN1B C11ORF54 SMG1 FAM57A OR2A20P PMS2P5 TUBD1 ING5 BTAF1 SCML1 CXORF40B ZFYVE27 ACADM RSRC2 RABGEF1 FGFR1OP2 UBTD2 ANXA9 BID ZNF202 ZNF322 SEC24A PHYH SCARA3 GCA SEMA4C STX8 ZBTB10 ZFC3H1 KLHL25 LIG3 PNRC1 MOB3C ARHGAP32 UBE2Z PDCD5 PMS2P4 SNRNP27 TBC1D24 ERP29 ADAM8 IL6ST SLC25A37 LRP12 ZCCHC8 CD82 SLFN5 UBE2D1 TSPAN31 CWC25 ARID4B SLC1A5 RCHY1 TANK TMEM128 CWC22 RAB24 SLC16A7 LEO1 ZUFSP SH2B3 ESRRA SLC25A51 ARID5B FBXO38 INADL TRAF3 FBXO33 MAFF NR4A2 TMEM2 KIF2A CDC42EP2 MXD3 CCDC130 BIRC2 BLVRB BIRC3 FCN3 RTKN ANKRD12 PLAU ARL1 ETS1 CYP2C19 RASGRP1 ALOX12P2 TRIM69 SLC15A4 CYC1 ZC3H15 ZKSCAN1 ZNF641 MKKS CBX6 GFPT2 ITGA2 CFLAR AHSA2 PPP2R5B NPC1 ARAP2 ETV6 CLK4 CLK3 CLK2 IRF1 NFKBIA IRF3 NDUFS3 CEBPZ ZMYND11 PPP1R12C ACO1 RBM25 NFKBIE NFKBID SFT2D1 NFE2L3 KCNK5 NFAT5 DIABLO WHAMM RASGRF1 NDUFB6 BCL2A1 C2ORF47 LEAP2 MTIF2 CXCL2 UAP1 CXCL1 SAV1 PPWD1 RPF2 DPP7 ZNRD1 PMVK MFSD3 NAA25 RALGDS S100PBP IGBP1 EED CCDC57 TRAPPC2P1 GLRX2 KANSL1-AS1 CDC40 SGPP2 UFM1 TRAPPC6A C1D LTB PABPC1L SNRPA1 MTFP1 CLEC2D B4GALT5 RBM28 MAK16 EIF4A3 NCKAP5 ALAS1 PNMAL2 DDX21 ACRC ATP5G1 WDR89 SENP5 PHKG2 CHCHD7 KCTD20 VHL POLK AAMP ARL5B KCNJ2 NCK1 HNRNPA0 ,sars/cov/0hour
7.0700006,10.261545,Cluster 0,A-CA-04-2009(H1N1) 0Hour GSE47961,HEXIM2 SND1 SLC35A2 LINC00094 GOLPH3L CTNS SLC51A ARMC9 C20ORF195 PEX14 DYNC1LI2 NIF3L1 TMCC1 ZNF718 AMZ2P1 KATNAL1 CYP20A1 FAR2 RNF220 DCP1B ASB3 NGEF NAIP PFN4 AHCYL1 ZNF398 ZNF397 ZNF396 STAU1 WBP1 IFITM3 AKIP1 XYLT2 SMA5 RNF5 DPCD UBE2L3 C4B SRPX2 CREB3L4 C10ORF107 C19ORF52 PIP4K2B RABAC1 HES1 A1BG-AS1 VPS18 APOL3 ZNF18 TRMT1L FZD4 PAQR8 C5ORF38 EDEM3 SYNRG C12ORF54 PARP16 OCEL1 LOC100233156 RIIAD1 RAET1E LPHN1 CTAGE5 PSME4 INTS9 CHST6 FUT11 ACSM1 LRRC37BP1 LMAN2L LYPD5 IFIT1 C14ORF93 DNALI1 ADH4 HSPH1 WBSCR27 FASTK NUP62 CSTF2 PLCG1 TP53BP1 TNFSF10 PROM2 PPAPDC1B PDK3 CCDC96 PSENEN WDR37 STRADA ATPIF1 TMEM42 BRAF CARD6 C9ORF85 LOC286272 UBE2G1 NME7 FXYD3 C4ORF3 RAPGEF2 GLCCI1 GRAMD1C SERPINA1 CITED2 HILPDA ADM CLTA RILPL1 RTDR1 LRRC6 MRPL43 SYCE3 CASP10 SH3BGRL3 QSOX1 TIMP1 SMYD4 FAM192A C19ORF18 ZNF586 CDKL3 CGREF1 DYNLL1 PRMT8 EGLN3 PPARA SORT1 DMRT3 SLC2A11 SLC39A11 KAZALD1 SLC39A13 AGMAT FAM213B FAM213A PDP2 TPST2 MORN2 ZNF33A KIAA1715 RILPL2 NMNAT1 TPST1 GDPD1 LAMTOR2 C22ORF15 FKBP11 CDKN1B GDI1 DPYS HDC HSCB ZDHHC24 ATL1 EFCAB7 ICA1 ING2 GYS1 SPAG16 GUK1 ING4 NCS1 FAM182B FADS2 TLE4 BRPF1 ZNF682 ACYP1 YIPF3 ARHGEF37 ARID3A FBXO16 LRRC61 SAP30 ALDH4A1 LRFN3 MORF4L2 STIM1 LYG1 GPANK1 TTC30B YEATS2 PPIB BRWD3 B9D1 OTUD5 NBAS ZNF792 UBE3D SEPW1 ANKRD37 PBLD PHRF1 HSP90B1 TMEM121 FAM214A FAM117B EFNB2 CDH1 LAMP3 RGS22 BPTF ATP8B3 C2ORF15 HARBI1 TRPT1 RFXANK FBXO38 FBXO36 TDRD7 FANCC FANCF AZIN1 PIAS2 SCCPDH SH3BP5L TMEM11 DNAL1 IFNAR2 PFKFB3 N6AMT2 RAB3D HOMEZ RAB3A NOTCH2 CCDC125 ARL3 CLEC16A LIN7B DPY30 KRBA1 TMEM102 GOLGA6L9 FAM174B TMEM107 MFSD6L ZNF646 ZKSCAN5 NEK4 MARK4 LOC100507557 PCDHGA8 GALNT6 KDM4D SPATS1 KCNJ15 LRWD1 HSPA2 NRG2 SORD IFT43 RBKS DNASE1 NDUFS8 PEX7 EFHC2 C21ORF128 OSCP1 GPSM2 SWSAP1 DICER1-AS1 ST6GALNAC1 ST6GALNAC2 GSK3B YWHAB TNKS TRADD BRK1 UBR2 ALAD CYP26B1 ERICH2 USP31 CEP290 HN1L GFER ARID1A MRVI1-AS1 DNAJA1 DAD1 EIF3I THAP7-AS1 TRIM32 CSNK1G1 SEC22C B4GALT5 SLC25A14 LINC00589 SMARCD1 WIPF2 SIX1 KIAA0100 BARX2 NAGLU IQUB DHX58 PDE6B ABCD1 UGGT1 ,sars/cov/0hour
7.0219426,9.845891,Cluster 0,A-CA-04-2009(H1N1) 0Hour GSE47960,CDK18 GAMT WSB1 CIZ1 PRELID1 PCGF6 WDR83OS UBE2MP1 RC3H2 MRPS18B SLC50A1 MAPK14 PTRHD1 MTAP MYL7 RRAGC ORAI3 CCDC86 UQCRC1 MT1H RHNO1 TRIM11 PFN1 DCP1A CDK16 KDELR2 AP5Z1 HM13 CBLC SMA5 LOC284454 ARNTL SEPN1 FRAT2 ZNF709 FZR1 CHST12 PPP4R4 PSMD3 OGFOD3 AKT1 PRSS8 ZNF823 ARFIP2 FIS1 COX8A PHC2 DTNB CMC2 NR1D1 SLC6A8 C12ORF49 STAG3 EIF6 WBSCR16 GORASP2 FARSA LYPLAL1 NMT1 PPP1R18 TEX264 ZNF490 C9ORF78 TAPBPL TMEM186 WDR45 FAM122A C7ORF50 LOC100505771 RPL23AP82 FASTK GOLGA2 RASSF7 TIMM17B ARL6IP4 ZBTB7B TMEM8A AKIRIN2 AKIRIN1 SEC13 FGFBP3 SLC35E3 JUP SPHK2 TESC C9ORF89 AKR1A1 RHOF TIMM23 CRIPT MRPL23 SUMF2 LOC100506098 INF2 IMMP1L FAM222B TADA2B ABCC10 C4ORF3 PI4KB ARHGEF5 CLPTM1L MDFI GPI ERGIC1 ARF3 ELL ABHD4 SDC4 PHF23 PCSK7 LRSAM1 PTPRH BBC3 C12ORF36 THTPA MRPL40 LOC285074 PRX RRAS TMEM25 ST8SIA5 ORAOV1 ELOVL1 EGLN3 CSNK2A1 KIAA2013 ZDHHC12 ZNF57 COX6B2 MRPL53 GCFC2 TMEM159 ADAM17 SDHAF1 LY6G5C C16ORF86 LLGL2 ZNF212 CRB3 CD63 AMIGO3 FAM69B FAM57A PELI3 TOR4A ZDHHC24 ZDHHC7 SNX12 HSPA13 C17ORF50 SDF4 ZSWIM7 HRAS BRD9 ZNF567 MGAT1 SEMA4B C21ORF33 CORO2A YIPF2 SLC16A2 TPM4 ARHGEF37 CRYBB2 OSR2 SHPK KLHL25 MOB3A BYSL SLC25A38 CTDNEP1 SLFN11 POLE3 FKBP9 CD68 LRP10 ZNF555 PVRL2 SNRPB UBE2M ALDH16A1 ST7-AS1 ITPRIP NRL KLHL36 FAM214B NDRG1 ZNF8 POTEM EIF1AD CAPN5 RAB25 C1RL C16ORF13 NCDN PITX1 CAPN1 ZNF425 ZNF787 HLA-DOB ZC3H10 CCDC134 TRAPPC1 ARHGAP5-AS1 TMEM120A AIP B3GALT4 TRAF2 MFHAS1 PIAS2 RCL1 KIFC3 UBE2R2 BCL2L1 ERF MAP3K11 ZNF414 BCAT2 IFNAR1 RNF181 ARL2 VCX CORO1B STK10 STK11 ABHD11 BAG5 LOC100506100 ABHD12 CHMP1A NDEL1 ZNF526 CDH26 ZNF646 ZNF766 SLC6A10P TMED10P1 RHBDD2 IRF6 ACO2 NFKBIE H6PD IREB2 GTF3C4 YWHAE USP35 C15ORF40 DTX2 SLC3A2 FOXK2 FUT3 FUT5 ATP5D EMG1 ATP5B SYNGR3 MKNK2 GMPPB PHACTR4 GGACT RREB1 VCX3A MBOAT7 SPAG7 NDUFA3 ZBTB34 QRSL1 SGPP2 LYSMD1 LEMD2 LOC100288911 KPNB1 NFASC GALE TRAPPC6A VAPB DDIT4 RBM42 EIF3I CRK RP9 TELO2 ZNF850 TMEM41A LOC284837 WDR1 MGRN1 ZNF174 AQP10 DCTN1 DDT CLN3 SENP5 RPL36AP40 SCYL1 GET4 MAPK7 EIF2D SLC25A26 ,sars/cov/0hour
7.9400616,9.507976,Cluster 0,icSARA deltaORF6 3Hour GSE33267,CTNS WDR74 PEX13 PEX16 FNDC4 CD4 PPP1R3E MXRA7 SPIN2B RABL3 ENPEP ATF1 WBP2 C1ORF194 PLEKHB1 TESK1 C3AR1 CRKL SEPHS1 ZNF707 LINC00517 SV2A TMEM69 NKX2-2 SNCG ZNF701 HOXA6 AQR PRPF38A ST8SIA1 MAGEC1 FZD8 RAB3IP RAB39B ALG3 PRG2 WBSCR16 WNK3 PADI4 FARSB GLIPR1L2 FARSA RGL3 HOXB8 LCORL SLC22A7 FAM89A PCBP1 PHAX SAMSN1 RCBTB1 SMC5 CRHR2 APOO SOX4 C5 SPIB ZNHIT2 LYPD1 CDK5RAP1 KIAA0319L ARHGEF3-AS1 RHOA OTOR CSNK1A1 FCRL1 CCL23 GREB1 SLC10A4 ANXA6 ASAP1-IT1 RHOG RHOD GNG13 TRMT1 NR5A2 TOX3 TUBB2B POC5 RARA PIGM ARHGEF3 MGC32805 UMPS C17ORF78 PTPRS SLC7A13 NEDD9 SLC7A3 CTSS PPP3CA PANX2 SOCS4 ATIC MEOX1 TRIM8 PP7080 MAP2 LOC100507053 LOC727944 ST8SIA6 RNF152 ORAOV1 TK2 CCR7 ICOS MBD5 PALD1 LEFTY2 SERPINB3 DMRT3 FAM92A1 ARCN1 POU5F2 RNASE1 TUBB4A TXLNB COL4A3 DLC1 LPCAT4 SNX16 MSRB3 PGAM5 OR4A5 KIAA1958 HSD17B7P2 PHF3 PGLYRP4 RPLP2 HEATR1 AMIGO2 NUBP1 DEFB125 SLC20A1 SNX11 EFCAB6 SCML4 C10ORF76 HLA-DPA1 NUDT19 NKX1-2 APPL2 B3GAT3 FBXO18 KLHDC2 BTBD6 OSM C1ORF64 DOK1 OR51T1 CLEC4D LRCH2 COL5A2 ZNF74 TTC30B SSU72 CLEC4A XIST YPEL2 PTPN7 PLXNB1 SRSF6 SLC28A3 CCDC151 OTUD4 CELSR1 CCNT1 FIGN NALCN MORC2-AS1 PRSS46 HSP90B1 CDH7 CDH3 CASKIN1 NSD1 FTMT NLRP8 NACC2 NT5C RNF19A SH3BP5 NXPH1 OSTF1 PAK6 WHSC1L1 SLC39A4 ZNF782 OSBPL8 GLMN F2R SLC25A51 KREMEN1 B3GALT4 FANCC C17ORF80 CYP4F11 SLC9A3R1 CACNB2 QDPR NACA UBA2 MYF6 SMEK1 KLHL17 CACNA1A FAM13B SLC2A2 C1ORF210 HVCN1 ZFP62 AK7 PPP1R9A TMEM104 CDH20 ZMAT4 NPPA STYX CDH26 ZNF645 GYG2 SRGAP1 CBLN1 POU2F2 PLCH1 IQCC CACFD1 GGH GALNT2 NAP1L4 ELAC1 KRTAP19-3 MANBAL GON4L JMY PIK3CA SFPQ DMRTA1 EFHC2 HAGH CDK1 MAN2B1 SERINC4 ZNF512 LUC7L3 FAM60A C2ORF44 ZNF750 SHC1 FBLIM1 GTF3C6 OR1E2 OPRL1 KLC1 CPZ RPAP3 LMNB2 LBH DPP7 FAM83F SERAC1 AMICA1 TSTD1 SSRP1 SYT15 C4ORF27 GABRG3 USF1 SLC4A9 ZAP70 FMNL2 THAP7 LMX1A MYO15B KIAA0907 EVL SEC22B B4GALT6 TSSC4 DMGDH PPM1M SRI IGHV3-48 SLC5A11 LOC283861 AMBRA1 FAM154B SPRED2 ACOXL TRIM29 PSD2 DHX58 POLR2E FAM73B UGT1A6 VPS36 PGM5 MDH1B ZNF721 SCYL3 ,sars/cov/0hour
7.3163285,8.974526,Cluster 0,SARS-dORF6 0Hour GSE47962,MGC10814 LRRC37A3 ACOT9 FLJ22184 BSDC1 RUNX1 C20ORF194 SCRIB ISL1 PRKAB2 SCAMP4 SMARCA5 HNRNPM ABCA10 GPR161 ORAI1 MXRA7 OBSL1 TARS2 ALPK1 CKLF ZNF398 ZNF273 SP100 TTLL11 KEAP1 SMA4 FNBP1L TOB2 TSEN54 GPR153 NUAK2 ZNF708 FAM156A MICALL2 TGOLN2 PABPN1 LUC7L ZNF703 CYP1B1 MUC4 VPS18 TMEM86B MIRLET7BHG TNFSF15 NR2F2 LOC155060 C10ORF35 KIAA1244 IFFO2 XKR8 VAMP8 CRYZL1 TRMT13 C5ORF30 OGDH ZNF135 SUGP2 POP7 ANP32A-IT1 ITSN1 MUS81 MTMR9LP PHAX IKZF4 KIAA0141 ABR CYB5R3 PCBP4 TMEM89 INPP5E GOLGA2 ZBED1 PUSL1 PATZ1 ZNF486 NSUN2 WDR37 NCOA6 SLC35E2 NBPF11 RENBP IGFN1 ITFG2 PAWR NCOR1 ANKRD65 ZNF117 CD24 EXOC3 C11ORF31 DDR1 TRAM2 USPL1 KCNC3 WFIKKN1 SDC3 PRKRIP1 CCDC108 CLTA PPCS ZNF48 MRPL33 GLG1 METTL21A ZMYM5 GSE1 MED10 EBLN2 PLEKHN1 CTSC YTHDF2 LOC100190986 BCAP31 APC2 CDPF1 KIDINS220 VASH1 LBX1 FARP1 PDXDC2P PACS2 B3GNT7 PTRH1 LINC00623 GOPC EPPK1 STAG3L2 STAG3L1 ZNF692 SMG1 HTT PIGQ ZDHHC24 NOC2L CAMKK2 PIN1P1 IKBKB ZFYVE27 RSRC2 MYEOV2 DLAT ARIH2 FAM21C ANKRD50 ZSWIM6 SRSF11 C11ORF48 FBXW5 MGEA5 KLRAP1 GOLGA8T IL4R AOC3 ANKRD23 PRAF2 ARID3B HUWE1 UBE2B BTBD7 ZNF79 LOC389906 FAM215B ATXN2L GOLGA8F UBOX5 UBE2Z TMX3 ATG16L1 SIDT2 ARL8A PKP2 ADTRP ZNF799 TBC1D24 LZTR1 LOC401320 SLC25A37 GOLGA8A COL16A1 RNASEH2B ZNF670 ATF6B CCDC149 SLFN5 FAM129B UBE3A PRKX PBLD EFNA5 FGD4 GGA2 ITPRIPL2 GNPTAB LAPTM4A HSF1 CASKIN1 ZNF429 YKT6 ARHGEF40 LINC00599 C21ORF58 ESRRA ZC3H13 ARHGEF18 BTN2A1 VEZF1 TRAF3 FBXO31 DEXI ZNF92 TMEM2 GNB1 DLG5 TRAF6 ILDR1 LOC729737 MXD3 DIDO1 LRRC59 SRP19 LINC00265 PXN FMR1 SPPL2B LTBP3 C17ORF96 GATAD1 GOLGA6L9 WASH1 ANKRD11 ZNF526 FUK ZKSCAN1 TRIM68 RBM17 CBX6 EIF2AK2 ITGA2 AHSA2 SENP3 ACVR2B GON4L SYF2 DNLZ NF2 DSG2 RBM25 KDM5A BCAR1 YWHAG LOC390705 AARS2 YWHAB SMG1P1 BCL2A1 CHD7 NDUFB2 PIK3R3 FLJ31306 PELP1 AFG3L1P C15ORF39 ADAMTS14 SGPL1 MARVELD3 MARVELD2 ZNF625 PDE4A DGCR8 RDH14 TRIM44 TNFRSF14 RHBDF2 IGBP1 PLEKHG2 GIP LOC100506031 OCIAD2 MST1P2 PABPC1L TAF6 RP9 EVL LOC441666 CSNK1G2 SNAP47 TSEN34 PKD1 ABCD4 HCG18 ZBTB43 NR3C1 MAPK8 SAP30L VHL WDR6 EPS8L2 BEND5 MLXIP ,sars/cov/0hour
