x,y,cluster,term,genes,cluster_label
6.7188344,5.6389494,Cluster 3,A-CA-04-2009(H1N1) 18Hour GSE47960,SDR42E1 STARD5 NIPSNAP3A SP110 MX1 PCGF5 ENTPD6 ANKFY1 ZNF281 MRPS18C PLEKHA7 ZFYVE26 KIAA1217 MT1A XPNPEP1 POLR3C SLPI YME1L1 MT1G MT1H FAM76B ALPK1 GALT IFITM2 SAMD8 STAU1 IFITM3 SP100 STX17 IFITM1 MYCBP2 AKIP1 TRANK1 NOD2 ABAT UBE2L3 UHMK1 RNF114 HERC6 GTPBP1 GPBP1 FAM120C APOL2 APOL1 APOL4 GBP4 BATF2 RABGAP1L APOBEC3G HLA-J APOOL COG5 HLA-G HLA-E PARP14 MOV10 SLC6A6 ACE2 PARP12 MSL3P1 SPATS2L PSME2 PRKD2 VAMP5 APOBEC3C IFI27L1 HPN ZNF250 CSTF3 IFI35 CCT6P1 IFIT5 MT1X TMTC1 IFIT2 TMEM187 IFIT3 FAM122C NUB1 PLAC8 RNF217 KIAA1467 MIER1 TNFSF10 LGALS9 C5ORF56 PNPT1 WARS BTN3A2 PHF11 H3F3C IFITM4P TMEM40 CARD6 LMBR1 CTTNBP2NL KAT2B CEACAM1 PTPRA ID1 KCNS3 PIGL TLR3 INTS12 CSRNP1 C9ORF91 SLC18B1 TNFRSF11A PTPRR SEL1L PRKRIP1 ZC3HAV1 ZNF137P THTPA TMEM27 SYCE3 MRPL40 MAGT1 EPS15 ZNF107 NFIL3 CD34 SNX6 SNX7 LOC100653247 CBR3 STAT1 STAT2 CCNYL1 C1GALT1 TMEM62 LIMA1 FKBP1B SPSB1 XIAP LINC00623 MAPRE2 ZNRF2P1 STON2 MTRNR2L6 KIAA1033 TMEM140 CAPG GRAMD3 ERVK13-1 IFIH1 ADAM28 ADRBK2 C16ORF70 FLJ32255 RICTOR LOC100506544 ZNF200 ZBP1 ATHL1 CD164 CCDC109B RARRES3 HCG4 SEMA4D DNAJB14 SHISA5 VRK2 ATP1B1 MID2 ATAD3B LGALS9C SLC7A6OS ZNFX1 UBE2Z NUPR1 TMX1 ELMO2 SIDT1 ZNF557 FAM8A1 OTUD4 CSF1 UBE2D3 SLFN5 NAPA IFI6 SAMD9L DSCR3 RNU12 BCL2L14 PURB LAPTM4A RNF19B GTPBP10 LAMP3 NCDN MORC3 MICA ZNF544 MICB PPFIA3 CCDC134 TTC38 SPATA6L TIA1 SLC15A3 DDX58 ADPRHL2 HARBI1 LSM2 FANCA VEZF1 HIST2H2BC DDX52 ISG15 ISG20 EFNA1 MYD88 STK24 CDC42EP4 DRAP1 USP41 USP42 XAF1 HOMEZ CALCOCO2 CUL5 FMR1 CNP AK2 TTF2 RASGRP3 PHYHD1 HCAR3 HCAR2 NRD1 ESD PDZD2 LARGE AP5S1 GYG1 MBP MLKL RBM18 DTX3L CFLAR ETV6 ETV7 IRF1 SP1 UBQLNL ZNF516 NF1 IRF9 LPIN2 ZNF750 SMG1P1 ASH1L-AS1 TARS NLRC5 ADAR MLLT6 DUSP12 DNPEP KDSR CASP7 PHACTR4 SP140 C21ORF91 TRIM44 MCL1 NDUFA9 RBM38 TSTD2 FMNL2 HSH2D C19ORF66 PFDN2 RBM43 CXORF38 TRIM38 SCARB2 RTP4 ADPGK UGT2B28 DDX60L THSD1 AMBRA1 USP18 SOBP SLC25A28 ZNRF2 AP1G1 EFR3A PRRG1 DHX58 BNIP2 FBXO7 TRIM21 ABCD1 SEC11C ZNF600 TRIM22 SCYL3 ,sars/gse47961
6.725405,5.638794,Cluster 3,A-CA-04-2009(H1N1) 18hour GSE47962,STARD5 SP110 MX1 PCGF5 ENTPD5 MX2 TRIP4 C12ORF74 LNPEP MFSD12 PEX14 PML COL1A1 CPEB2 LAP3 LPAR6 XRN1 RFX5 ARMC5 SUB1 ASB7 MT1E OPTN RALB PGAP1 ITIH4 ANKLE2 PDXK SAMD9 CPNE5 MYCBP2 NOD1 TRANK1 UBE2L6 SLED1 RNF114 HERC6 GTPBP1 GPBP1 FAM120C GBP1 CPNE4 B2M GBP3 HES4 APOL2 GBP4 EPSTI1 APOL3 BATF2 APOBEC3D EGR2 SAP30BP APOBEC3G EPT1 HLA-E PARP14 HLA-F MOV10 ACE2 GJB3 PLSCR1 LGMN PSME2 PSME1 APOBEC3A NMT1 PPP1R18 ZNF250 CSTF3 IFI35 IFIT5 KLHDC7B TMTC1 IFIT2 IFIT1 LIPA ELK4 IFIT3 FAM120AOS NUB1 RASSF2 PLAC8 HIST1H3B NUDCD1 ZC3H12C HIVEP2 IER2 HESX1 TNFSF10 JUNB PPAPDC1B ZRSR2 AKIRIN2 WARS JUN TPI1 PHF11 RIPK3 BTN3A1 IFITM4P BTN3A3 C6ORF62 USP30-AS1 C17ORF62 PDZK1IP1 BST2 RNF149 THEMIS2 PTPRA ID1 TAL2 C4ORF3 RAPGEF3 IL18R1 TLR3 PTPRR ZC3HAV1 HIST2H2AB ENDOD1 CTSS THTPA DUOX2 SOCS1 PCF11 RASSF10 PLEKHN1 RIPK1 NFIL3 ZNF224 MEF2C STAT1 STAT2 FAM46A ELOVL7 GTF2H3 KIN PARP8 FKBP1B HIST2H3A TJP1 PSMA2 KIF26B SLMAP AIDA PKN2 RNF122 PHLPP2 TGFB1I1 TMEM140 PHF8 IFIH1 ADRBK2 PLAGL1 ZNF207 LMO2 PLCL1 HS3ST1 TLE4 TOR1B PRRX2 S100A3 CCDC109B HRASLS2 SKIDA1 TAP1 MID2 TICAM1 SDCBP2 C6ORF141 LGALS9C ZNFX1 C1ORF116 NUPR1 RAB35 SLC9A9 LIFR-AS1 GPD2 SLC25A37 DCLRE1C UBE2D3 SLC1A3 IFI6 SAMD9L CXCL16 BCL2L14 ITPRIPL2 RAB21 RBBP6 DUOXA2 RNF19B RAB24 LAMP3 NLRP1 DENND5A MICB MB21D1 AZI2 HIST1H2AC TTC38 TIA1 DDX58 BTN2A2 HIST2H2BC DDX52 TDRD7 ISG15 RCAN1 ISG20 MXD1 PSPC1 LOX CDC42EP4 DRAP1 USP41 XAF1 TCF4 SP140L SLC27A3 ZNF532 ZCCHC2 MDM2 CALCOCO2 PFKFB4 AK2 ACTG1 ETS2 DDX60 HCAR3 RAB43 HELB PIM3 MLKL DTX3L EIF2AK2 CFLAR ARAP2 LAMB1 OAS1 ETV7 SP1 OAS2 OAS3 UBQLNL IRF9 PAOX VIMP C2ORF42 MCTP2 HSPB9 GMPR ASH1L-AS1 NLRC5 TNFAIP2 C2ORF49 AFF1 DRAM1 SCIN HRH1 RASGEF1B BCL7B MKNK1 MARVELD2 ERBB3 MCL1 IL15RA ZBTB33 USF1 HSH2D UFM1 C19ORF66 AIM1 CXORF38 BLZF1 SCARB2 CEBPB CCDC71L C1R CEBPD RTP4 ADPGK SIX1 DBF4B PPM1J DDX60L PPP2R2A USP18 DDO SLC25A28 AP1G1 DHX58 SPATA25 TLK2 UBQLN1 FBXO7 DIP2B ABCD1 SEC11C TRIM22 SLC25A25 ,sars/gse47961
6.7869473,5.483184,Cluster 3,A-CA-04-2009(H1N1) 24Hour GSE47960,MGC10814 STARD5 SP110 MX1 PCGF5 MX2 PPA1 ZFYVE20 LNPEP SMARCA5 LAP3 XRN1 MT1G MT1H FAM76B ZNF710 ALPK1 PI4K2B PGAP1 IFITM2 IFITM3 C1ORF192 NOD1 TRANK1 MST1R GLRX UBE2L6 ABAT ARNTL RNF114 HERC6 HERC5 MILR1 GTPBP1 GPBP1 TFG LACTB GBP1 PIP4K2C HES1 GBP3 APOL2 CCNL1 APOL1 N4BP1 ZNF267 APOBEC3G FZD5 ST14 SLC6A16 HLA-G PRRC2A OVOL1 IFI44 PRRC2C HLA-E HLA-F ACE2 IL22RA1 SETX PLSCR1 LOC100288798 GORASP1 ZFAT CFH MT1L IFI35 IFIT5 GPR180 TMTC1 WDR44 ELK4 IFIT3 FAM122C NUB1 NUDCD1 ARL6IP6 CEP72 TNRC18 IER2 HESX1 TNFSF10 PROM2 LGALS9 IER3 PNPT1 BTN3A2 RMI1 PHF11 NCOA7 IFITM4P OFD1 NMI CARD8 GAB3 CARD6 C6ORF62 USP30-AS1 IL1A RNF149 FXYD3 TLR3 SLC18B1 ZC3HAV1 ENDOD1 LITAF CTSS DUOX2 PPP3CC SOCS1 LDHA SNX6 BRD2 STAT1 GCH1 FAM46A METTL4 ELOVL7 TMEM60 PARP8 PARP9 NEDD1 ADAM17 PSMA2 ANGPTL4 ZNF217 CACTIN SRFBP1 FYTTD1 PHLPP2 SMG1 CAB39 TMEM140 PTGS2 IFIH1 SPTLC1 SPTLC2 XPO5 SMCHD1 EP300 XPO6 ADAMTSL3 IFNB1 MGAT1 BRD7 ZSWIM6 TBC1D22B CD55 DEDD JAK2 SEC24A SEMA4B ATHL1 CD164 TOR1B LAG3 DIMT1 CCDC109B OSR2 SHISA5 TAP1 PNRC1 LGALS9C CXCL10 OSCAR ZNFX1 SLFN12 NUPR1 TMX1 FAS DMTF1 ELMO2 WDFY1 FAM8A1 XPR1 OTUD4 NOL3 CCDC149 SLFN5 ARID4B FBLN1 SAMD9L HSP90B1 RNF31 TMEM123 PURB ITPRIPL2 RBBP6 RNF19B EMC2 MFN2 NBN SAP18 IGFLR1 NCDN AZI2 PDIA4 TTC38 TIA1 DDX58 IFNA16 IGFBP4 SMAD1 DDX52 CKAP4 ISG20 PSPC1 SYNJ1 METTL22 CDC42EP4 SMS XAF1 CARD17 BIRC2 BIRC3 RAD9A PXK COL17A1 SMEK2 OR52B2 FMR1 CNP DOCK9 RORB ARHGAP17 DAPP1 DDX60 MMP25 BAG1 ANKRD10 PLXNA2 MLKL PDZD7 USP25 ABCC3 ITGA3 EIF2AK2 NPC1 SSTR2 LAMB1 EPN1 OAS2 IRF4 IRF2 RBMS2 NF1 ATG4B IRF6 LOC728743 BMPR1A KCNK5 GPSM3 DDX3X CHD8 CXCL2 NLRC5 CDC73 ADAR CXCL3 SIRPB1 C15ORF48 SCIN CYP26B1 NRIP1 CASP7 CASP4 PHACTR4 ZNF747 CASP1 CTNNBL1 MARCKSL1 NDUFA9 TRIM41 ERAP2 ANKRD20A11P SCLT1 PAPD5 CLDN7 DNAJA1 AIM2 HSH2D PAPD7 TXNIP RBM43 CXORF38 TRIM38 DYNLT1 CEBPD RTP4 DCTN4 DDX60L THSD1 PPP2R2A SQRDL SLC25A28 SART3 PUF60 FBXO7 INSL4 SPDL1 ,sars/gse47961
6.8053727,5.6663995,Cluster 3,A-CA-04-2009(H1N1) 24Hour GSE47962,NIPSNAP3A ACOT9 SP110 MX1 PCGF5 PLEKHA7 PLEKHA4 PPA1 ZFYVE26 NYX PML LPAR6 SCO2 POLR3D XRN1 SUB1 DCP1A HCP5 OPTN CCNK SAMD9 POMP SP100 STX17 AP5Z1 PPP1R3B MST1R DCAF5 ABAT MYL12B RNF114 HERC6 HERC5 GPBP1 DHX36 PSMD3 CHEK2 GBP3 HES4 APOL2 GBP4 APOL3 BATF2 APOBEC3D RABGAP1L PHC2 HLA-J IQSEC2 HLA-E UCHL5 EXT1 MOV10 VANGL1 PARP12 MYL12A PARP10 SETX VNN3 GJB6 SERPING1 PSME2 PRR13 ATF5 PLEK2 MT1L RRP1 IFI35 IFIT5 FAM135A IFIT2 IFIT1 LIPA IFIT3 FAM122C RNF213 NUB1 NUDCD1 CYP4V2 MICAL1 IER2 HESX1 TNFSF10 ZRSR2 PNPT1 WARS GSDMC BTN3A2 PHF11 DUSP1 EXOC8 BTN3A1 SSR3 IFITM4P TMC8 BTN3A3 OSMR WDR36 C6ORF62 USP30-AS1 C17ORF62 TLR2 ITPKC BST2 RNF149 CCDC9 KBTBD2 PIGB ID4 STK40 PIGG TLR3 CSRNP1 HIST2H2AA4 CCDC101 CSRNP2 DAZAP1 SLC18B1 PTPRR PRKRIP1 ZC3HAV1 SECTM1 HIST2H2AB ADM ENDOD1 TOR1AIP1 GJC2 DUOX2 HINT3 PANX1 SOCS2 PCF11 CASP10 GAR1 FAM180A RIPK1 MPZL2 SNX6 CLIC1 STAT1 SUSD1 CDKN2B SERPINB1 C1GALT1 FAM46A MOCOS GSTO1 FAM213A PARP8 PSMA6 SPCS3 PSMA2 CTTN CYP21A2 AIDA SAA1 TTPAL IFNA4 FKBP14 KIAA1033 TMEM140 DERL1 PRAM1 IFIH1 RNF135 SMCHD1 RAB8A PAIP1 LMO2 RNF43 RAB2B HS3ST1 TOR1B GCA SLC31A2 HCG4 PUS1 UBE2F ATAD3A TAP1 ARHGAP27 MID2 LGALS9C IFI44L ZNFX1 SLFN12 C1ORF116 TMX1 ZNF557 DEGS1 TYMP SLFN5 ASAP2 IL1RAP GTF2E1 SAMD9L FGD2 FRZB PDPN TMEM128 RNF19B RNF19A LAMP3 KIF5B MYH14 PPFIA1 RBBP8 SLC16A4 MICA RGS20 MICB MB21D1 MFN1 AZI2 SLC15A3 DDX58 BTN2A2 VEZF1 MR1 DYRK1A TDRD7 ISG15 NFKB2 MESDC2 ISG20 MYD88 LOX GNB4 LOC729737 USP41 XAF1 ZNF655 MDM2 CALCOCO2 CD274 PXK FMR1 LGALS3BP TTF2 DDX60 CCDC144A NDEL1 NEK3 ACAA1 HSPA5 DTX3L EIF2AK2 RHBDD1 TNIP1 ETV3 ARAP2 SSTR2 ETV7 SP1 OAS2 OAS3 IRF6 IRF7 PAOX SFT2D2 VIMP BCAR1 BMPR2 ASH1L-AS1 HAPLN3 RABGGTA LLPH IRAK1 CASP1 MCL1 KDM2A TRIM41 STYK1 TINF2 KCTD1 FNDC3A AIM2 RP2 HSH2D TRIB2 SCARB2 PRPS2 CCDC71L NXT2 RTP4 USP11 SLC24A1 ZBTB43 DDX60L PPP2R2A USP18 DDO SLC25A28 AP1G1 DHX58 PSD4 TRIM25 TRMT44 MMAA SEC11C TRIM22 ,sars/gse47961
6.947517,5.89849,Cluster 3,A-CA-04-2009(H1N1) 24Hour GSE47961,STARD5 ACOT9 SP110 MX1 PCGF5 SLC35A1 PLEKHA4 PPA1 LNPEP PEX14 LARP7 TTC39B PSMB9 LOC100133091 SMARCA5 XPNPEP1 MT1B XRN1 IFI27 FEZ2 TNFSF9 DCP1A OPTN IFITM2 IFITM3 SAMD9 POMP IFITM1 NOD1 TRANK1 GLRX SMA5 UBE2L6 ABAT RNF114 HERC6 IFI16 EXOSC9 FAM63B GBP1 GBP3 HES4 APOL1 ST3GAL3 GBP4 APOL3 YES1 BATF2 TMEM86B SAP30BP APOBEC3G HLA-J HLA-B IFI44 PARP14 HLA-F FA2H MOV10 ACE2 STAG3 SETX PSME2 APOBEC3B IL1RN CFI CFH MT1L BCL10 IFI35 IFIT5 KLHDC7B RAPH1 TMTC1 FAM135A IFIT2 IFIT1 TSKU WDR45 IFIT3 FAM120AOS BRIP1 MT2A NUDCD1 MIER1 HIVEP2 IER2 FAM65B C5ORF56 PNPT1 WARS BTN3A2 PHF11 H3F3C BTN3A1 IFITM4P NMI C9ORF89 BTN3A3 C9ORF85 ZHX2 C6ORF62 USP30-AS1 TLR1 BST2 RNF149 KAT2B CEACAM1 MTF2 FATE1 TLR3 CRLF3 CCDC101 BTG3 SLC18B1 ZC3HAV1 ENDOD1 WDR25 THTPA SOCS1 MIS18BP1 RASSF10 MED10 LOC100996579 RIPK2 RIPK1 TMED7 LOC727820 HSD11B1 CTSC BRD2 PARP3 STAT2 SERPINB1 CCNYL1 ZNF674-AS1 ELOVL7 PARP8 RYBP PSMA4 GPR143 PSMA2 KIF26B TAOK3 LINC00623 PKN2 CD47 ARF6 RNF122 PHLPP2 TRAF3IP2 HSCB TMEM140 DERL1 ERO1L SCML1 IFIH1 ADAMTSL3 LOC100506544 HS3ST1 PTPN2 SLC16A1 CD164 TOR1B LAG3 GCA CCDC109B TPM3 HRASLS2 TAP1 CHERP MID2 TICAM1 MOB3C LGALS9C IFI44L UBE2Z SLFN12 TMX1 LIFR-AS1 YEATS2 ELMO2 ZNF438 NCF1 ADAM8 AMOTL2 SLC28A3 CD68 ST7-AS1 PPP1R15B ZCCHC8 PRDM4 UBXN2A GIMAP2 FAM129A METRNL IFI6 SAMD9L NAPG FUOM RELB BCL2L14 SLC9A3R2 SH3BP2 LAMP3 KIF5B HAS3 MICB AZI2 DDX58 SMAD1 TTC32 DESI1 VEZF1 TDRD7 FOXN2 TMEM110 MOB1A ISG20 MYD88 MXD1 PSPC1 CDC42EP2 LOC729737 CDC42EP1 USP41 XAF1 RAB5A ZCCHC2 ACTG1 TMEM220 STK10 IL18RAP RAB43 CYP2J2 TIPARP EIF2AK2 SETD1B CFLAR IRAK4 OAS1 MARCH5 ETV7 NFKBIA LOC100507460 PAOX NFKBIE VIMP TRIM56 SFT2D1 NFE2L3 ZMYND15 AVEN CXCL9 PSMD12 UBA6 ASH1L-AS1 NLRC5 CDC73 C4ORF32 RRP7B BCL7B CASP4 SP140 MCL1 ZNF620 CLCA3P TMEM30A IL15RA HIAT1 FEM1B ERAP1 SCLT1 SOD2 PPM1B HSH2D KIAA0226 CXORF38 TRIM38 TAF7 TRIM34 BLZF1 SCARB2 CEBPB RTP4 ADPGK PPM1J DDX60L SQRDL USP18 TNFSF13B RND2 SLC25A28 MAT2B DHX58 FBXO7 ITGB8 TRMT44 ARL5B TRIM22 C3ORF38 ,sars/gse47961
7.1045375,7.1847034,Cluster 3,SARS-BatSRBD 72Hour GSE47961,IL1R1 ACSL3 PCGF5 ZNF284 PCGF6 CNBP KIAA1586 PLEKHA5 CPEB2 PC CAPN10 POLR3C LPAR6 IFI27 ZC3H11A RUFY3 TRIM14 RPL26 CDK12 NHLRC3 RIN2 SIK1 NAIP ATF3 TMEM87B CGGBP1 SAMD8 MYCBP2 CCNC SZRD1 TOB1 PRPSAP1 LSM12 LACTB C7ORF31 PIP4K2A STAT6 CYP1B1 HES1 CCNL1 EGR1 EGR2 PROSER1 ARRDC2 COG5 MTHFR VPS37C TRERF1 HLA-F PARP11 EIF5 TBL2 INTS6 PPT2 SNAI1 RPS23 FBXL5 PRR12 PTP4A1 TCERG1 TRIO ZNF251 ZNF250 ITSN1 CTDSPL2 CCT6P1 FAM135A IKZF5 TMPO RNF213 ZC3H12A RNF217 INPP5E KIAA1468 IER2 JUNB IER3 STAT5A DUSP5 AKIRIN2 PHF11 DUSP1 DUSP2 PTGES3 CARD9 TUBE1 FAM102A C1ORF21 VEGFA CYLD KAT2B ID1 ID2 PIGL EXOC7 SGK1 BTG2 FASTKD2 SLC44A3 ZC3HAV1 KRT24 AEBP2 TMEM165 ZMYM2 HLCS MAGT1 RASSF10 MPZL1 LOC100131564 CLIC1 MPP3 CDKL5 ZNF461 MOCOS FOS MYO9A NEDD1 HNRNPH1 FOSB TAOK3 LINC00623 GZF1 HBEGF CACUL1 SRFBP1 VMP1 ATL2 MIS12 ZDHHC7 XPO1 SCML1 SERP1 ZFYVE28 RICTOR SETD2 CD55 LMO2 GOLGA8T HS3ST1 TLE4 RAB2A DENND4C TRAPPC10 LOC153811 ATP1B1 FBXW2 SUPT7L ABI1 DMTF1 YEATS2 PDCD4 SBDS BRWD1 UBE2K SRSF7 CHTOP ST7-AS1 ZNF552 ZNF551 ZNF550 ZBTB26 ANKRD36 UBE2D3 LOC100294145 RNF39 DNAJC24 EFNA5 FAM214A ZFP36L2 BCL2L11 TMEM246 ZFP36 ASAP1 LDOC1L CFL2 RAB28 TBC1D12 RBBP8 MAP3K7 PHLDA2 MORC3 MAP3K5 SH2B3 ATP9B MICB PMS1 HMGN2 SMAD3 SLC38A2 SEMA6A TIA1 SMAD4 ARID5B FRMD4B C11ORF80 DYRK1A LOC399491 MAFF NR4A2 CREB1 RFXAP OSTC REEP3 USP42 XAF1 RAB5A ZNF655 LRRC59 CHODL COL17A1 IRS1 UVSSA FBXO24 CCDC144A RAB43 NIPBL EME2 OIP5-AS1 MARK1 PI3 PIM3 ARID2 SYBU USP25 TTC13 SUN1 APAF1 GALNT2 SLC52A3 NFKBIZ PTPN13 TPCN1 GPCPD1 MARCH5 IMPACT UBQLNL IRF9 ITGA6 EAPP R3HDM1 LUC7L3 ZNF750 ENY2 BMPR2 SEH1L MCTP2 UFD1L CXCL2 MLLT3 CXCL1 ADAR C4ORF32 CHD1 TMEM204 CASP7 LOC100507217 SP140 RPS6KC1 NAE1 C17ORF100 MCL1 KDM6A GCN1L1 TBP CYP51A1 ANKRD20A11P GLRX2 GLRX3 HAUS3 ZFP91 ASXL2 PPM1B HSH2D KLF6 ALDH1A3 CLDN8 DENND6A SPRY2 B4GALT5 BLZF1 ZMYND8 CEBPD SOWAHC RPL32P3 KIAA1551 FAM208A HDAC7 RBM4 GK5 RBM3 BNIP2 FBXO5 TLK2 PDSS2 TRMT44 TRIM22 DIS3L2 SLC25A25 RBM7 C3ORF38 ,sars/gse47961
7.668492,8.221752,Cluster 3,SARS-BatSRBD 48Hour GSE47961,ATE1 SP110 IMP3 MX1 ZNF284 MX2 ATG10 AP1AR C12ORF73 PEX13 PEX14 C9ORF40 LOC100049716 IFI27 TTTY15 ANP32E HNRNPD CPEB4 ATF3 TMEM87B STX16 ZAK IFITM3 ATF1 KDELR2 PEX11A IFITM1 AKIP1 NOD2 TOB1 RNF114 EXOSC7 KRTCAP3 RP9P C16ORF95 ZMIZ1 HES1 CCNL2 SH3BGR EGR1 PROSER1 TMEM184C GADD45B SLC11A2 RAB27A CMC1 TERF1 IFI44 EIF1 DHFR TMEM199 PARP11 MSRA PLEKHS1 TBL2 NET1 IDH1-AS1 ITM2C NECAB3 FUT11 CEP85L TSHZ3 DCUN1D5 BCL10 GATA6 IFIT5 MRPL16 LOC100289098 IFIT2 IFIT1 TMEM187 PCDH17 IFIT3 C14ORF169 FAM122C IMMP2L RPS19 MIER1 HMOX1 CEP72 IER2 TNFSF12 GLUL PPAPDC1B IER3 CLHC1 DUSP5 PHF11 DUSP1 H3F3C NSUN6 H3F3A ITPK1 ZNF480 NMI KIAA1143 FAM102A KRT10 LMBR1 C6ORF62 RHOQ BST1 FAM210A ID1 FXYD3 COPG2 RCCD1 WIBG GGNBP2 COX7C BTG2 DAZAP1 ABHD3 AKAP17A MTDH C12ORF45 METTL21A TMEM27 HINT1 MAGT1 RASSF10 RRS1 FLVCR1 UBXN7 GABPA MBNL2 CBR1 STAT1 ELOVL5 PNPLA8 SCD5 FOS RNASE6 UTP11L ADAM10 ZFX KIN MRPL53 CLIP4 ABCB10 FOSB TAOK3 GDPD1 WAC ZNF217 C21ORF2 VMP1 C11ORF52 C17ORF58 HSCB SRA1 TXLNG ING1 HLA-DMB USP46-AS1 ANKRD30BP2 RNF139 EFCAB2 METTL5 ZNF329 LOC100506544 CD55 ANKRD13A ZNF200 TFAP2C FBXW7 TOR1B DIMT1 CTNNBIP1 MID2 IFI44L FOLH1 RELL1 SNRPF PPIL4 C11ORF57 MPHOSPH6 ST7-AS1 FKBP2 SLC1A1 PDCD6 RNF39 TSPAN31 CWC27 RBFA LOC650293 NAPG HIRA BCL2L14 PURB YY1 ZFP36 CFL2 LAMP3 EMC4 SLIT1 OSTF1 TBC1D13 SLC26A11 MAP3K5 TRAPPC4 DDX58 AUTS2 BTN2A2 TTC32 LSM6 ISG20 METTL23 CARD16 XAF1 RAB5A FAM49B MYOM2 PXK SMEK2 FMR1 C15ORF61 HNMT DDX60 C1ORF52 HCAR3 DTWD2 COL4A3BP WAPAL PIM3 MLKL ZNF764 CYB5B LOC389705 COA4 PPP1R12A EIF2AK2 IRF2BP2 ELAC1 C15ORF52 RAD23B PTPN12 OAS1 LINGO1 MARCH5 C1ORF168 ETV7 C7ORF60 OAS2 ITGAE SLC25A51P1 OAS3 ARL2BP NAA38 MANSC1 R3HDM1 ATP5S SMIM3 PSMD12 ASH1L-AS1 CXCL2 FBXO46 ERICH1 ELAVL1 ARHGEF10L C4ORF32 FLJ31306 PPP6C RAD21 LLPH ERBB2 SNAPC5 CASP5 LOC100507217 ME3 IRX2 IRX3 FEM1B CCDC59 LOC100131053 HAUS6 LYSMD1 LOC100288911 UFM1 PPM1D GNB1L CHURC1 CCDC174 NXT1 ABCD3 CEBPD RTP4 CXORF23 TULP4 DDX60L ARRB2 USP18 HDAC7 OASL CECR5 DHX58 ZNF606 BEND3 CNNM4 TRIM22 ,sars/gse47961
7.176322,6.0504937,Cluster 3,A-CA-04-2009(H1N1) 36Hour GSE47960,ACSL3 SP110 TYW5 MX2 SLC51A C20ORF24 PSMB9 LOC100133091 PML MALL NECAP1 LOC100507022 POLR3C LAP3 LPAR6 ASB7 MT1H SIK3 HCP5 OPTN PGAP1 IFITM2 IFITM1 AKAP8 UBE2L6 ABAT ARIH2OS WWC2-AS2 PSMB10 ACTB MTHFSD CDC27 DNTTIP1 FAM63B PPP1R32 HES4 N4BP1 APOBEC3G STAC TNFSF13 SLC11A2 SLC6A14 HLA-C CSNK1E HLA-B HLA-H PBX2 HLA-E EHD1 HLA-F PTP4A2 ACE2 IL22RA1 FOSL1 EHD4 GJB2 SPATS2L PSME2 C2CD2L ATF4 APOBEC3B DOPEY1 CFB PLEK2 RRP1 MRPL17 IFIT5 TMTC1 FAM135A IFIT2 LIPA FAM122C TCL1A ZC3H12A RNF217 CCRN4L CEP72 HESX1 FAM65B AGFG1 ZRSR2 C17ORF67 NUDC PNPT1 WARS GSDMB NCOA7 IFITM4P H3F3B TMEM173 USP30-AS1 GPRC5A CEACAM1 ID1 FXYD3 CLCF1 KBTBD8 STK40 ACVRL1 GMEB2 BTG3 FAM43A PRKRIP1 ZC3HAV1 PEA15 ADM ZNF44 RILPL1 ADRB2 CX3CL1 THTPA ZMYM1 TMEM27 HINT3 PPP2R4 TRIM5 NKIRAS2 RASSF10 RIPK2 RRS1 SNX9 TMED7 SPRR2C SNX6 CLIC1 ZNF101 SERPINB4 MEF2A STAT1 SERPINB1 SUSD3 GSTO1 FRMD8P1 SERPINB8 SNX19 PSMA2 RILPL2 NOV PSMA1 HDGF HBEGF IL17C FKBP11 CSTB XXYLT1 MIS12 TMEM140 DERL1 ERO1L ADAM28 POFUT2 RNF139 SMCHD1 PLAGL1 ADAMTSL3 IFNB1 ZNF324 JAK2 PTPN2 TLE4 IL4R TOR1B GDF15 PRRX2 BRF2 GCA RARRES3 HCG4 GPT2 SKIDA1 TAP2 ARID3B TAP1 LRRC61 TARBP1 MOB3C CXCL10 CXCL11 UBE2Z NUPR1 CLEC4A ADAM8 DEGS1 FAM8A1 ST7-AS1 ITPRIP UBXN2A SFSWAP PPP1R15A ASAP2 RRBP1 ATP10A NUP160 SAMD9L SLC9A1 ATOH8 BCL2L14 TBRG1 GTPBP10 CFL2 LAMP3 KIF5B SAP18 ZNF548 EMC8 PHLDA2 NDUFV2 MICB SLC15A3 DDX58 BTN2A1 RBPMS TDRD7 NASP NFKB2 MAFF ISG20 NR4A2 CREB1 DUSP22 NCL DRAP1 MOB4 MAP3K11 CDC42EP2 USP42 YRDC BIRC3 DIDO1 UBIAD1 UVSSA PSEN2 CACNA1I DDX60 MMP28 SIRPA ANKRD10 SLC37A1 KDM4D RHBDD1 NFKBIZ OAS1 BAIAP2 TCTE1 CATSPERB NFKBIA IRF9 KCNK1 PAOX VIMP CABIN1 NOP2 ASH1L-AS1 PTPN21 CXCL2 TNFAIP2 CXCL3 DUSP12 MDK PSTPIP2 RRP7A MARVELD3 CASP7 CASP5 MCL1 KDM6A BCAS3 RBM11 EED LRRC8A POLQ MID1IP1 MYO10 LYSMD2 GLRX2 PLA2G16 FAM131A KPNB1 C19ORF66 ZNF619 RQCD1 DDIT3 CXORF38 TRIM38 TRIM39 CLEC2D TRIB2 CSNK1G2 SCARB2 CEBPD RTP4 DDX60L PPP2R2A SQRDL SLC25A28 KYNU CCL5 SIX4 FBXO6 MMAA ,sars/gse47961
7.6603456,7.57888,Cluster 3,SARS-dORF6 96Hour GSE47960,SP110 MX1 ANKFY1 MX2 SCRIB TPRX1 BTBD11 SCAMP4 SRRM2 NISCH SCD HNRNPL IFI27 HIP1R ZSCAN22 TRIM14 MT1G ULK3 CCDC87 GTF2IRD1 HNRNPD BCORL1 TRIM11 TECPR1 IFITM2 IFITM3 CCNK KDELR1 IFITM1 KEAP1 NPRL3 TRANK1 LRP5 DCAF5 TOB2 CRKL HERC6 RBM15B ZNF707 CSNK1D C19ORF52 PIP4K2A FAM63B HES1 ATXN7L3 NCSTN RAB11FIP5 EGR1 CREBBP INTS3 EPT1 MTHFR IFI44 PBX2 PARP14 PRRC2B FCHSD2 SLC6A6 EHD2 PARP12 PLSCR1 GJB2 TBL2 PSME2 RNPS1 PRR12 PRR15 SUGP2 MEPCE NEDD4L PCBP1 DCUN1D3 IFIT5 IFIT1 ZBTB3 IFIT3 ZXDA LARP1 RNF213 MT2A ZXDC NUP62 RCC2 PUSL1 TMEM8B ZBED4 FUCA1 EXOC8 PHF13 CGN PALB2 ITFG3 FAM210A KRT19 BHLHE40 PAFAH1B1 PLEKHM3 EXOC7 CLPTM1L PLEKHM1 ZNF234 ADIPOR2 PP7080 GSE1 SMYD5 KIF1B RIPK1 BRD4 ZCCHC24 STAT1 SYK ANO9 FOS AP3D1 MYO9B PARP9 RNF126 HNRNPUL2 PACS2 SNX15 UBE2V1 HDGF SF3A1 ZNF212 ZNF333 MEGF6 GRN SRPR PHF8 CAMKK2 GYS1 IKBKB RPTOR SIPA1L1 SPTLC2 PLAGL2 ADRBK2 NUDT19 MGAT1 BRD7 FADS2 RNF44 PPIL2 SZT2 TRAPPC10 SHISA5 TJAP1 HUWE1 ALG12 CHERP WBP11 ILF3 CDKAL1 NRBP2 IFI44L C1ORF116 FKBP9 RNF187 LRP10 PVRL1 AGRN SUPT6H ZFAND5 SRRT CD81 SLFN5 GEMIN4 GIMAP2 ASAP2 CELSR2 SAMD9L EGFR RNF31 BCL2L11 BAHCC1 C1ORF226 HSF1 TMEM248 NSD1 SH3BP1 LDOC1L TBC1D13 ABCF1 NEK9 SREBF2 TTC38 LRRC47 DDX58 ARHGEF17 OSBPL2 DDX54 TRAF3 LOC399491 ABHD15 PYGO2 DIAPH1 STK24 DLG5 TRAF7 RAD54L2 USP40 XAF1 TCF3 CEP104 HOMEZ ANKRD17 SLC38A10 TACSTD2 CLEC16A ARHGAP1 C1ORF56 DDX60 POGZ TRIM69 PLXNA2 PLXNA1 A4GALT QSER1 ZNF764 GALNT7 DTX3L EIF2AK2 IRF2BP2 WIPI2 HSPA4 NPC1 TNFRSF1A SAFB CDK9 OAS2 JMY OAS3 HOOK2 SP2 UBQLNL IRF9 RBM22 AHDC1 KHDRBS1 IDI1 NLGN2 AARS2 YWHAB ZC3H4 ASH1L-AS1 CHD7 UBR4 NLRC5 ADAR AGAP1 RAI1 AFG3L1P AFF1 FBXO41 CCDC85C MARVELD2 ZNF629 MKNK2 TMEM209 WASF2 TRIM44 GCN1L1 TCF7L2 SPEN EYA2 FBXL18 ARID1A KCTD5 BCS1L LEMD2 ASXL2 PPM1D TSPAN14 ZNF619 PAPD7 KRAS B4GALT5 CSNK1G2 DHTKD1 PRPS2 HDAC4 RERE POLDIP2 RTP4 ADPGK HCG18 WIZ DDX60L SAMHD1 CLN3 RBM3 HECTD4 DHX58 RPS6KA2 UBQLN2 UBTF TRIM28 NEO1 TRIM22 SMNDC1 ,sars/gse47961
7.579198,8.119328,Cluster 3,SARS-CoV 48Hour GSE47961,FLJ25694 SP110 FNBP1 MX1 ZNF284 RPL21 MX2 PEX13 FAM133B CPEB2 PPP1R3D XRN1 PPP1R3F SLPI OPTN ZNF277 RNF2 ATF3 TMEM87B STX16 USP6NL SP100 KDELR2 PPP1R3B NOD2 ARNTL TOB1 RNF114 KRTCAP3 RP9P GNG7 RPL17 HES1 KLF11 EGR1 TMEM86B PROSER1 ST13 GADD45B ZRANB1 ARRDC2 SLC11A2 NR1D1 RASSF9 TERF1 IFI44 PTP4A2 PARP12 RPS29 ANKRD18CP CYP2A6 SNHG12 BIN1 ZNF702P NDUFAF5 ITM2C PAEP PTP4A1 RPL31 SLC45A3 SLC35D2 ANP32A CEP85L TSHZ3 DCUN1D5 BCL10 IFI35 CCT6P1 IFIT5 RPL9 IFIT2 RPL7 IFIT3 C14ORF169 GOLGA3 RPS18 ZC3H12A RASSF4 C7ORF55 RPL23AP82 ZC3H12C INPP5F RCC2 IER2 TNFSF10 SLC19A2 IER3 DUSP5 JUN DUSP4 PHF11 DUSP1 H3F3C NIPA2 TMUB1 UBE2G2 TACR2 IL18 GNL3 C6ORF62 MRPL22 RHOQ BST1 TOX3 ID1 NFX1 FXYD3 BHLHE41 PIGL JDP2 RCCD1 GGNBP2 BTG2 DAZAP1 ZNF230 ABHD3 ZC3HAV1 AKAP17A IGHMBP2 TGFA AEBP2 C12ORF45 THTPA HINT1 NDNL2 TIGD1 NQO1 YTHDF1 CBR1 STAT1 C1GALT1 FOS UTP11L F2 DHRS4 TJP1 NUDT9 HNRNPH1 STK17B KCNQ1 FOSB TAOK3 ZNF217 ENGASE ARF6 NUPL1 VMP1 PIGR FAF2 TXLNG ANKRD30BP2 RNF139 SMCHD1 ZNF329 THSD7A HDX RPS7P5 CD55 ZNF200 TFAP2C ZNF562 TOR1B PTCD3 DIMT1 FKBPL TAP1 HNRNPAB SHISA9 AP5B1 FOXP1 TMX3 BAMBI PDCD5 SNRPF PKP4 UBE2K FRK CD83 ZFAND5 UBE2D3 SRSF1 PPP1R15A TOMM20 HIRA RELB BCL2L13 BCL2L14 YY1 SH3TC1 ZFP36 CFL2 LAMP3 RAB9BP1 ZNF787 MAP3K8 MICB LINC00116 TGIF2 UTP15 TTC32 NUP153 TNFRSF10A FBXO34 ACSF2 MOB1B MXD1 PSPC1 GGCX MAFG MALAT1 CDC42EP2 SPIRE1 USP41 MAP3K14 RAB5A FGF13 YRDC SRP19 PXK C15ORF61 TACO1 HNMT HCAR3 COL4A3BP PMAIP1 AP5S1 PIM3 IL6R EIF2AK2 CFLAR IRF2BP2 MARCH8 OAS1 MARCH5 ZNF75A NFKBIA C7ORF60 OAS2 SLC25A51P1 OAS3 BCL6 NAA38 KCNK1 ARL4A SMIM3 KHDRBS3 DDX3Y PSMD12 WHAMM ZC3H4 CBWD5 SLC3A2 CXCL2 ARHGEF10L C4ORF32 PPP6C RAD21 LOC100507217 SP140 NAE1 USP31 MCL1 KLHDC10 LONRF1 TAS2R5 COA6 HIST1H2AM GLRX2 OXSR1 CBR3-AS1 KLF4 LOC283177 LOC100288911 HSH2D UFM1 RPL21P44 SPRY2 RP9 FOLR3 ZNF610 TPT1 RPL29P2 CEBPB PRPS2 NXT1 CEBPD RTP4 DDX60L RPL10A OASL SPRED1 CECR5 DHX58 TRA2B TLK2 TLK1 POLR2H C3ORF33 LRIG3 SLC25A25 ,sars/gse47961
7.0313063,6.0282617,Cluster 3,A-CA-04-2009(H1N1) 36Hour GSE47961,SP110 MX1 PCGF5 IMP4 MX2 PLEKHA7 PPA1 ZFYVE26 LARP4 POLR3C LAP3 LACTB2 ASB7 USP6NL AHCYL2 POMP NOLC1 TRANK1 NOD2 MST1R ABAT RNF114 HERC6 HERC5 GTPBP1 IFI16 DHX36 EXOSC9 LOC389641 GBP1 GBP3 E2F6 GBP4 APOL3 BATF2 SAP30BP APOBEC3G HLA-G MASTL GPN2 SRPK1 ACE2 IL22RA1 PARP12 SNHG15 SETX PLSCR1 CWF19L2 INTS7 PSME1 APOBEC3A APOBEC3C LTV1 ZBTB2 IFIT5 KLHDC7B FAM135A IFIT2 IFI30 IFIT1 LPAR1 IFIT3 FAM86FP IL4I1 FAM122C NUB1 SYNCRIP GRPEL2 ALKBH1 CEP72 IER2 HIVEP1 HESX1 JUNB STAT5A C5ORF56 DUSP5 PNPT1 WARS BTN3A2 PHF11 H3F3C BTN3A1 IFITM4P NMI BTN3A3 ZNF35 GNL2 USP30-AS1 SCNM1 RNF149 SLC7A7 SIKE1 PTPRA MTF2 FXYD3 VMA21 UMPS CCL28 IL18R1 TLR3 GRAMD1B BTG3 DHX8 PRKRIP1 ZC3HAV1 MRPS10 ENDOD1 THTPA ATIC HINT3 GPR110 CASP10 MED10 L3HYPDH RRS1 TMED7 HLA-DQA1 CDV3 SUSD3 GTF2H3 AGMAT TMEM60 PSMA6 CLIP4 FKBP1A SLCO3A1 PSMA1 LINC00623 B3GNT3 UBE2V1 HBEGF SRFBP1 HIST2H3D TRAF3IP2 ATL3 HSCB SMG8 PDCD2L CLDN23 IFIH1 XPO5 PSMB2 BID LOC100506544 CD55 DEDD LMO2 ZBP1 PTPN2 BIK DIMT1 GCA HRASLS2 VRK2 TAP1 LMO7 MID2 PDGFRL LGALS9C CXCL10 IFI44L UBE2Z SLFN12 C1ORF116 TMX1 FAS YEATS2 ADAM8 FKBP4 ITPRIP CD82 UBE2D3 SLFN5 PRDM1 RRBP1 IFI6 STRN3 SAMD9L NAPG HSP90B1 BCL2L14 RAB21 GTPBP10 LAMP3 SAP18 SLC39A8 MICB MB21D1 DENND2D NSF SPECC1 SLC15A3 DDX58 DENND2C FBXO39 TTC32 LAYN TDRD7 ISG15 DIAPH1 ISG20 NKAPL RCL1 TMEM11 NCL DRAP1 RAD54L2 CARD16 XAF1 RAB5A BIRC3 ZCCHC2 MDM2 ZNF410 CALCOCO2 MAX ANKRD12 SPPL2A TTF1 LIN7C HCAR3 UBD IL36RN MUC15 MLKL SLC38A9 EIF2AK2 RHBDD1 CFLAR FAM86B2 ETV7 DDX19A NFKBIA SP1 OAS3 IRF2 FGFR1OP NF1 ZMYND15 ASH1L-AS1 C3ORF52 PLD6 CXCL2 TARS FUT3 ADAR CXCL3 C4ORF32 RPF2 ZNRD1 MARVELD3 BDKRB1 SNAPC5 CASP5 PHACTR4 SP140 RPS6KC1 COA6 RHBDF2 S100PBP HIST1H2AM IL15RA CCDC59 TINF2 KHNYN ERAP2 VPS33A LYSMD2 SPG20 AIM2 RAB10 ALS2 DNAJA3 TRIM38 BLZF1 NOP56 MAK16 CEBPB USP15 TMEM41A C1R RTP4 HIST1H2BK C4ORF19 WDR5 DDX60L USP18 TNFSF13B OASL SLC25A28 SENP5 DHX58 UBQLN1 ZNF845 ITGB8 ARL5B CCDC50 TRIM22 ZNF720 ,sars/gse47961
6.9123354,6.032023,Cluster 3,A-CA-04-2009(H1N1) 36Hour GSE47962,UNC13D MX1 ZNF284 TYW5 GPKOW HOMER1 PPA1 ACSL5 MFSD12 PEX14 MED6 PSMB9 FEZ2 ARMC5 TRIM14 ASB7 NHLRC3 HCP5 SLC35B4 IFITM2 IFITM3 CCNK SAMD9 HM13 EWSR1 GLRX MT1JP GABPB1 UBE2L6 CLDN1 GTPBP1 DHX36 OGFOD3 C10ORF2 B2M VPS18 GBP5 GBP4 BATF2 PROSER1 SAP30BP APOBEC3G SURF4 TMEM50A FZD8 SNHG7 BAZ1A HLA-G UCHL3 HLA-E HLA-F PTP4A2 PLSCR1 BIN1 LGMN INTS7 APOBEC3B POP7 VEZT ZNF250 ITSN1 ITSN2 STMN3 IFI35 IFIT5 RAPH1 IFIT1 LOC100287590 IFIT3 FAM120AOS PLAC8 RNF217 IER2 HESX1 TP53BP2 RHBDL2 C2ORF27A STAT5A ATP6V0A2 C19ORF38 ANKIB1 TMEM150A DUSP5 PNPT1 ZNF121 EXOC8 NCOA7 RIPK3 BTN3A1 IFITM4P H3F3B KRT14 C6ORF62 USP30-AS1 SCNM1 BST2 RNF149 CEACAM1 ID1 PHF14 TLR3 CRLF3 ZNF234 CSRNP1 CCDC101 CD40 SLC18B1 ZC3HAV1 IGHMBP2 C2CD4C CX3CL1 TMEM165 DUOX2 CASP10 MED10 SNX9 CLIC1 MBD5 CDV3 STAT1 PARP3 STAT2 ELMOD3 MOCOS GSTO1 ELP3 PARP8 PSMA6 PSMA5 RGP1 ADAM17 PSMA1 SLMAP PKN2 RLIM CD47 HBEGF PHLPP2 SMG1 ATL3 MIS12 TXLNG CAPG ERO1L SPTLC1 RNF138 BRD7 IKBKE RAB8B JAK2 RNF43 HS3ST1 CD164 TOR1B CCDC109B GPT2 SHISA5 PDGFRL C6ORF141 LGALS9C IFI44L ST7L UBE2Z LIFR-AS1 DMTF1 RELL1 ADAM8 AMOTL2 CD68 DCLRE1C VKORC1L1 ZNF551 SLFN5 TSPAN31 GPR62 METRNL IFI6 SAMD9L EFTUD1 RELB CXCL16 BCL2L13 GGA2 BCL2L14 TMEM128 RBBP6 DUOXA2 RNF19A NBN ZNF426 SLC39A8 PHLDA2 HIST1H2AC GGT6 ZNF783 CCDC134 TTC38 LRRC47 SLC15A3 DDX58 USP44 TTC32 DESI1 DDX54 HIST2H2BC DDX52 TNFRSF10A ISG15 CDYL NFKB2 RNF169 ISG20 MYD88 NAT8 MXD1 ABCA11P DRAP1 MAP3K11 USP41 USP42 XAF1 ZCCHC2 CHMP6 PYROXD1 CBFB RASGRP3 TMEM220 DDX60 OSBPL11 RAB43 ZNF766 CYP2J2 RHBDD3 DTX3L EIF2AK2 CFLAR NFKBIZ IRAK4 ARAP2 URB2 CUL4B FAM189B OAS3 RBMS2 PAOX B4GALT3 KHDRBS1 PSMD11 GPSM3 STOML1 UBA6 SLC3A2 NLRC5 AFF4 ADAR HK2 AFG3L1P HRH1 BCL7B CASP4 CASP5 RPS6KC1 LONRF3 MCL1 KDM6A IL15RA MAPK1IP1L SOD2 SPG20 RAB12 HSH2D GNB1L KIAA0907 CXORF38 CLEC2D TRIB2 HIST1H2BC HIST1H2BD USP14 EIF4A1 TMEM41A RERE HIST1H2BK HIST1H2BJ ZBTB43 DDX60L PPP2R2A AMBRA1 SQRDL USP18 HDAC7 SLC25A28 DHX58 PSD4 UBQLN1 DIP2B TRMT44 TRIM21 ZNF721 ARL5B ,sars/gse47961
