x,y,cluster,term,genes,cluster_label
5.995454,12.205285,Cluster 1,A CA 04 2009 4dayMOI-10^4 GSE37569,TRHR DEK PASK C20ORF24 DCLK1 SPATA16 NIF3L1 DEPDC1B XPNPEP1 IL23A RBP3 PSMC5 TRIM16 C19ORF45 POLR3K ASF1B ASCL4 IFITM3 SLC35B1 NCAPG NCAPH CCNC FAM132B MAGOH NPVF GMDS RAD54L SNRPD1 E2F1 EXOSC9 SPOCK1 TIPIN OR2A25 SNCB ST18 NAA50 SLC6A18 ALG8 IGFL3 MYO5A XRCC2 HLA-A OR51I1 UCHL5 TPX2 VNN1 MEP1B PDE12 PPP1R1C NDUFAF6 HYOU1 CD302 MCPH1 SIM1 PRR22 CDCA3 PPP1R17 CFI CDCA5 MRPL19 CDCA8 EDDM3B C14ORF166 MRPL1 MRPL13 GLDN CHTF18 IFIT3 C10ORF128 CYP2R1 NUP62 FIGNL1 LIPN MYBL1 MNX1 RTTN ATG5 ZNF367 CCR1 TCF19 IZUMO3 CENPW IL10 FOXD2 TUBB UBL4A TACR3 NFATC3 TUBE1 CD200R1 ANLN CENPF KCNS1 CENPH LSG1 CENPJ NME8 CENPM GART PHF19 MOCS2 TRAM1 ZFAND2A CLTC MRPS10 C8A PPCS BRCA2 IQGAP3 MRPL42 PSMC3IP SYCE2 GPR111 LDHA TRIM6 OR2AG2 CTSK TK1 CTLA4 CEP55 CTSD STK31 DLGAP5 ATAD2 ATP6V1G3 TMEM176A ARG1 OR10G3 C17ORF49 PGAM1 RANBP1 RPA2 UTP11L VAX2 ARCN1 ANO4 SPC24 GATM TAOK3 NCAPD2 CKS2 UBE2V1 DLD AUNIP FAM69A LOC101929327 LRRC19 MYT1L PRIM1 UNG LMAN1 GPR133 ADAM29 TUBA1C MTG1 PNMA2 XPO5 ASH2L NUF2 NUSAP1 C5ORF63 HBE1 SYCE1L TPM3 UBE2F CRLS1 CDC25C MRTO4 MTNR1A UBE2T ABI1 POLE4 CLEC4A PDCD5 SCG2 C11ORF57 FKBP6 CHRNA1 DCLRE1B ALDH1L2 FKBP2 AURKA NTPCR CWC27 OTP TYMS SDR9C7 CNDP1 AURKC TUBA3E CCND1 TCTEX1D2 S1PR2 ADORA3 NXPH2 MSX2 AP3M1 DENND2D FANCI UTP18 LOC102288414 TBCD NASP MTL5 LSM5 CKAP5 SDK1 REEP2 KIF18B DIAPH3 TROAP PIN1 VIL1 LHX9 SAE1 MRO ARHGAP19 FBXO24 FOXM1 WISP2 PLB1 KCNV1 CHAF1A CLSPN TCEANC CLCA2 TXNDC9 EIF2B2 RAG1 FIGLA RNASE10 PYCR1 CDC5L OLIG1 HTR1A IQCJ SGOL1 DNAJC3 MCM4 DSG1 TRIM59 IRF9 ITGA7 MCM7 SLC26A4 MS4A2 MCM3 NSRP1 PSMD12 FAM114A1 HMMR PROZ MCM10 LECT1 LAMC2 UFSP2 TREM2 TMEM207 ORC3 ECT2 QRFPR TAC1 NDUFA9 HN1L RWDD4 H2AFZ CYP51A1 NAA10 DDX10 NSMCE1 PPP2R3C ZIC5 SHCBP1 GABRG2 ASPM GZMK TBC1D7 POLR1C DTL SNRPA1 OR8A1 CCDC63 SCARB2 SEC11A C1R ERCC6L TRIM31 MCM8 UHRF1 C1ORF131 SPRED3 POLE MDP1 EXO1 ADAMTS2 TRAT1 BNIP1 VSTM5 SCYL3 POC1A ,10/1203
5.9504433,13.012637,Cluster 1,A-CA-04-2009(H1N1)MA Day3 GSE36328,GBP7 UNC13A SFMBT1 OXSM RSAD2 HOMER1 KRT8 PASK TTC39B MFSD10 PML DDX39A XRN2 GLA IDO1 FGL2 NOD2 NTN1 ARNTL CH25H RNF114 PNP CD2AP HERC6 NUAK2 CHEK1 IFI16 SLAMF7 GBP2 GBP5 GBP4 MSR1 BATF2 DAXX SURF4 FZD5 SLC11A1 EDEM1 TNFSF14 PLA2G4A GADD45G IGF1 HLA-A HLA-G IFI44 HLA-E RNF144B CCDC88B FOSL1 SPATS2L SERPING1 PSME2 RPS20 H2AFY2 NOL12 GTSF1 CFB HOXD3 IFIT2 IFIT1 ART3 GPR171 CCRN4L FFAR2 INPP5J ANKIB1 APOBEC1 APOBEC4 IL10 DUSP2 RIPK3 NFAM1 TMEM171 UBE2G2 TTC9C TMEM173 CYP7B1 LILRB3 WNT9B LYVE1 LILRB4 GNL3 TMC3 PAX2 TMEM37 TLR2 CENPE LAT2 AFTPH MMP14 SLCO4A1 SIGLEC1 KBTBD2 PIGN GARS SIGLEC9 UMPS CDKN3 TMEM106A IL18BP CSRNP1 SKA1 TINAGL1 SUV39H2 CTSZ FPR2 ADM LITAF IQGAP2 KLK3 SLC7A1 CCR9 TIMP1 CCR5 TRIM6-TRIM34 STRA8 PRMT6 GPR35 STAT1 ODAM STAT2 ARG2 GP1BA LRG1 PARP8 PARP9 PSMA7 GPR141 MS4A6A RNF126 PSMA5 NMNAT1 CPSF4L TPST1 SAA1 TIMELESS RNF121 SLC29A3 C1QC DFNA5 ROBO3 CSTB HDC AOAH AIF1 SNX10 VMO1 IFIH1 NAMPT SCML4 FAM3B IFNB1 RIOK3 LAIR1 IL4R CD300A FKBPL YIPF5 RARRES2 MPEG1 SHISA5 LRRC61 ATP1B3 GTF2F1 VCAM1 MOB3A CXCL10 SLFN13 C1ORF116 COL5A2 TRAFD1 LY6E WDFY1 ADAM8 CNTN5 CD69 CD86 CSF1 SLA ATP1A3 MPO EFTUD1 EIF1AD TUBB6 RNF19B CAPN6 YKT6 ASCC3 KPNA3 BCL2L15 TBC1D17 SLC15A3 DDX58 BORA FAM26F INHBA INHBB ISG15 CTPS1 PGF MYD88 C12ORF5 CACNB4 SELP NT5C3A TRAF4 CD8A BCL2L1 TAF4B LCN2 TROAP UPK3BL BMP2K XAF1 ST6GALNAC5 BIRC3 PIN1 IL7R FAM49B C17ORF98 COX18 SLC2A3 CABP4 IL18RAP MMP25 ESD C6ORF106 CLEC5A EFHD2 PIM1 MLKL COA5 ACTR3 MMP8 DIS3 APAF1 MRGPRX3 CRYGN ITGA3 EIF2AK2 EIF2AK1 ASNS ADAMTS20 MYRIP DDHD1 TICRR DDX19A IRF1 VCAN IL6 OAS3 TNIP3 IFNG SPEM1 SLC26A4 CHD9 ADAR C4ORF32 CXCL6 C15ORF39 SGPL1 CAPZB EMILIN2 SLFN12L AMICA1 SLC36A3 RNASET2 FNDC3A PLAUR MBOAT1 SOD2 CHIT1 PDE10A HSH2D PPP2R2D C19ORF66 MGAT4A IL2RA GLRB OR2V1 PAPD7 PI15 PIK3AP1 EIF3C SEC23B ARHGAP11A PLEK GOSR2 FYB IRG1 ADAMTS4 FCGR1A ADAMTS1 CLMP CCL5 TRIM25 CCL4 CCL2 SLC25A24 TRIM21 ,10/1203
7.651071,12.258559,Cluster 1,A-Vietnam-1203 CIP048 RG4-2004(H5N1)PB2-627E 4day-MOI-10^4 GSE43301,LINS IQCF5 ANKFY1 ISLR2 MED13L BTBD10 DKK2 BTBD11 C14ORF80 CAPN11 RBP2 RFX6 ACOT1 CPVL OR4C16 OR8G5 OR5AK2 SLC46A2 IFITM3 KHDC3L WDR64 HECW1 GPATCH2 OR2K2 LOC285423 SNX31 OR52L1 RNF114 NWD1 CAPNS2 GPR150 SPOCK1 CPNE4 B2M PKNOX2 ANKS1B GBP4 NTNG2 TMEM184B ANKDD1B TMEM86B TMED9 FIBCD1 BHMT2 IGFL3 C12ORF50 NMBR HLA-A NR0B1 TAS2R39 HDHD1 HLA-E SLC16A14 PARP12 FAM135B MEP1B PDE12 PPP1R1C PSME2 RNPS1 VSX1 NOX1 VSX2 ATF4 SIM1 TMEM183A CDCA4 TXNDC11 DMP1 PCDH15 ABO ICAM1 IFIT3 RNF213 SPATA5L1 MLST8 TRPM8 FEZF1 FAM19A4 IZUMO3 GABRA1 INSRR IZUMO1 AP3B2 PAX6 PAX3 CTTNBP2NL KLK12 NME2 TH CDC20B MTF1 P4HA3 CCDC6 PRPH2 PMP2 GARS WIBG CCL28 MIXL1 CENPT OR4C3 OR3A1 REG3A SLC35F1 NEU4 RNF157 NEUROD4 NEUROD6 WBP2NL KRT26 OR5AN1 HAO1 OXGR1 HBZ UTP14C STAT1 FAM46D STAT2 WDR19 TTC1 FAM71E2 ARCN1 PPP2CA IL17A PSMA7 NLRP14 RNF126 MYBBP1A KCNQ2 APEX2 GPR149 PKN3 UBE2V1 TRIML1 CD47 TTPAL OR7G2 SERPINB13 LOC101929327 CTDP1 SMG1 FAF2 FAM69C TMEM145 ADAM29 GLRA4 XPO5 THSD7B ANKRD53 SLC17A3 CSMD1 SLC17A4 TFAP2C FBXW7 KIRREL2 CHRNB4 SYCE1L SPINK8 MOG CD70 TRAPPC10 SHISA5 CDC25A TJAP1 TAP1 LRP1B CDC25C CXCL10 ZNFX1 LIN28B MSH4 LRIT2 TRPV5 LRFN2 LY6E CNTN3 AIPL1 CLEC4F OTC TOR2A CHRNA1 DCLRE1B HSD17B7 BCL2L13 EIF1AD C1ORF105 TNR PTTG1 FGF21 EP400 MSX2 FGF23 NKTR OR4F6 IGFBP1 ANKRD34B SREBF2 SYT2 HELT USP44 TMEM132B TDRD7 ESPNL TMPRSS11D GNAL FRMD7 LOC100129520 DNAJC11 RLN3 XAF1 ACBD3 OR13A1 MYF5 SYS1 PCDH11X C20ORF141 MAEA MMP20 EDC3 NPPC CCNB3 TPO ABL2 WAPAL MUC13 CLCA2 SATL1 OR52B4 RAG1 LINGO3 STPG2 EIF5A SVOP AVPR2 PA2G4 KCNJ16 APOA2 OAS1 DAO RASA2 IRF9 SP8 OR10A2 MS4A3 CBLN4 MS4A2 SLC26A7 CNTNAP4 C14ORF105 LCN8 UBA7 SHMT1 TRH HTR2A ADAR KNG1 UNC80 MGAT5B ORC1 OR8B4 DRD1 B4GALNT4 QRFPR B4GALNT3 WNT3 RBM14 FAM83C PATL1 CYP51A1 GABRG1 NSMCE1 ZNF804A LMX1A PLA2G10 IFIT1B ASXL3 PMFBP1 RGS13 ZP2 RBM41 TAF2 KRT82 RBM26 DMGDH RTP4 SH2D4B TEX101 CRMP1 DDX21 OR5K1 PKD1L2 PLG RABEPK GRM3 ARHGDIA GRM7 SEC61A1 SLITRK4 UGGT1 ,10/1203
7.8965225,12.400783,Cluster 1,A-Vietnam-1203 CIP048 RG4-2004(H5N1)PB2-627E 1day-MOI-10^4 GSE43301,UNC13A PCGF5 SS18L2 COL24A1 WDR75 MTUS2 ZNF705A OTOP1 LNPEP MED13L CRISPLD1 POLR3H PLCD4 VIP ATF2 OR9I1 PDXK PEX11A LOC285423 SLAIN2 FAM169A MAGOH IFI16 CYP1B1 ASPDH FSD2 SAMD3 PRR11 DTNA TPSG1 TEX12 RAB27A TEX14 PHKA2 NR0B1 CBFA2T2 AIMP1 GJB4 STRN ATF6 KIAA0825 FBXL5 APOBEC3B GLDC PPP1R17 DOC2B ZNF251 PCDH10 NEDD4L RXFP2 HTATSF1 APOO OBP2B LIPK TDO2 GJA3 C10ORF32 FAM19A2 GLUL RPS12 RTTN FEZF1 HOXC8 PPAPDC1A SS18 IZUMO3 FOXD3 RPS6KL1 STRADA CCDC116 GREB1 GNB2L1 TRMT5 ADAM32 TMC7 GJD2 AFTPH NMU TAL2 GKAP1 PIGA GALNTL6 ANKS4B VWA8 TENM1 GRAMD1B SLC44A4 SUV39H2 LRRC39 GPR20 RTF1 CD99L2 TMEM163 ADIPOR2 CTSV KALRN HSD11B2 OR4S2 GNGT1 TMEM169 C16ORF52 NPC1L1 TIMP4 HAVCR2 SUZ12 CDKN2D GPR34 GPR3 ADAM10 MYBPH ZDHHC15 PARP9 DPY19L2 A4GNT TMEM57 DLD TMEM229A DYNC1H1 ROBO3 GCNT2 IL25 ATL3 AP4E1 CLINT1 SNX10 ABCC12 AKAP13 IFIH1 C16ORF74 GPR132 BGLAP KIF13B ANKRD55 IFNB1 MDH1 CTNNA3 IKBKG KIRREL2 RAB2A CORO2A CA10 TLE1 HSD3B1 SLC31A1 GTF2F2 C1ORF116 CHMP4C DPEP2 PRR15L SBDS STAM2 GPHB5 MPHOSPH8 LZTR1 ABCG5 ABCG2 FRA10AC1 CHRNA3 ACSS3 DGKD RNF38 PRUNE2 OR9Q2 ACCSL PROKR1 TMEM127 CAPN7 KIAA1841 ASB11 NBN SLC16A7 HSF5 FGF20 NPTX1 ADORA1 ZNF546 SLC25A46 CCDC141 FGF22 MAP3K6 USP47 CCDC18 PPEF1 C11ORF87 F2R BORA TRAPPC8 LRRIQ1 MTL5 POU3F2 NAALADL2 ZFP42 FRMD4A STT3B TAF4B ZNF658 COL6A6 BCAT1 C21ORF62 GRIA3 DOCK5 C17ORF99 KLHL15 AMY2B INSIG2 LPL FAM107A OSBPL10 PLB1 RGS5 PAPOLB TNK1 CEP350 SRD5A1 UTP20 ATP6V1H CNTLN GRIA4 MARK3 ARID2 CCDC39 KCNJ11 ABCC8 HMGA1 BAIAP2 MERTK KBTBD12 UBE2QL1 POLA1 IFNE RPGRIP1 IL7 MYH4 SYNPO2L EFHC2 CEBPZ DSG2 SPOPL CBLN4 GTF2A1 DLX2 TSEN15 IPPK CHD9 DDX43 MLLT3 AGPAT2 MLLT4 RAP1GAP PHTF1 FBXO40 FAM83G TMEM202 ATP5H CPT2 MCF2L P2RY4 RASGEF1C CA5B CCDC85A IMPG1 DNAI2 FAM83C FGA OPCML OVGP1 ERAP1 ANXA13 DDX10 KRT78 LYSMD4 RAB13 RP9 CCDC175 SVOPL SPG21 USP15 ABCD3 COLEC11 SLC24A4 CLEC12A PKD1L1 PKD1L3 SAA2-SAA4 ACVR1C CLCN1 PTPLB OGFRL1 CECR2 FAM154A BAHD1 SCRN1 DHX57 ZNF606 VSIG4 MAPK1 UPP2 STK32B GET4 BEND6 ,10/1203
7.604032,12.308405,Cluster 1,A-Vietnam-1203 CIP048 RG4-2004(H5N1)PB2-627E 2day-MOI-10^4 GSE43301,TRHR OR8H2 C2ORF74 SLC12A1 MED9 MMD2 HPCAL1 DLEC1 DKK2 SYTL5 ABCA12 XRN1 CD209 TNFSF4 CCDC87 OR2AT4 CCDC83 OR4C16 LOC100505767 AHCYL2 KHDC3L TESK1 GPATCH3 RAX SPG7 OR2K2 RS1 PHYHIP PSMD7 SV2A MOV10L1 ZDBF2 SPOCK1 GPR157 APOL2 ARSB GTF2A1L AAR2 DTNA PLA2G4E TEX12 NMBR EIF5 WBSCR17 PPP1R1C SERPING1 OR4D11 NOX1 EZR SIM1 ZBTB8B GLDC ACSM4 PCDH10 NR2E1 TXNDC11 PCDH15 OR4M1 DAZ2 ACTR3B RXFP3 TRPM1 SPZ1 INSC IL20RA FAM19A3 LIPN AGMO TRPM8 SOX8 SOX5 SLC19A3 UBL4B CCDC110 GABRA6 GAB2 TMC7 PAX1 ADAM30 TTC9B MYBPC1 CTTNBP2NL TMCO2 GJD4 TAL2 GNPTG PRPH2 ALDOB EXOC1 TINAGL1 LRRC39 ATF7IP2 GRIK2 SLC35F1 WNT8A SPTY2D1 IGSF21 HOXC10 SLC22A13 PRKCDBP KRT26 CCR8 OR5AN1 CAMP WWOX SERPINB4 MCF2 ANKRD45 WDR19 DMRT1 GPR31 RRP1B PTH2R SGSM2 SPSB1 FAM189A1 APEX2 FABP9 TRIP11 AHRR CD47 RHAG ANGPTL1 IL22 OR7G2 AHCY SERPINB13 TRMU PGLYRP3 SMG1 FSTL1 HOXD11 ASGR2 LYZL6 ADAMTSL1 NDST2 CXCR1 SLC17A6 COL11A1 THSD7B ZNF567 GDF11 TFAP2C DENND4C SYCE1L SEMA4C LMO4 CRYBB1 HS3ST5 HS3ST2 OLFM4 DOK7 TRPV5 FAS ELMO2 TNIK DSC1 OR13C3 FKBP6 DCLRE1B ALDH1L2 SERTM1 CHRM2 ERVFRD-1 AKR1D1 SLA NRK LOXL4 ASB15 CIB3 ACCSL JAKMIP2 NPAS2 FOXO3 EGFR FAM105A CDH8 RASD1 FRZB FAM184A PAK7 MSX2 OR51B4 SLC16A5 CCDC18 IGFBP1 SYT1 TRAPPC8 FAM26D TMEM132B CASK FOXN4 DUSP27 POU3F3 FGF17 TDRD1 DLG2 KIF2B CDHR1 LOX CDC42EP4 TLX1 BCL2L1 MATN1 CDH19 MYF5 DGKI SLC27A5 FBN2 DOCK5 NOTCH2 CABP7 AMY2B COPB1 REG1B CUL1 CUZD1 MMP20 CES5A WISP3 CACNA1H ZCWPW2 B3GALT1 IBSP PLXNA2 MUC15 FLOT1 CPA6 RAG2 KCNJ5 REXO1 KCNJ11 SVOP KCNIP2 SPATS1 ETV2 SLC4A10 URB1 MERTK TNFRSF21 C19ORF81 RFT1 C14ORF39 SP8 OR56A5 TRIM56 ALK NVL CNTNAP2 GAL3ST2 SHC4 DLX4 UBR4 FAM109B FOXK1 KNG1 TTC23L FYCO1 UNC80 LRRTM4 PIP5KL1 ZNF628 PLCZ1 NCAM2 DRD1 OR12D3 FAM83C FAM83B OVGP1 POU1F1 EIF3A TRIM42 FEM1C UGT2B17 OPRK1 GZMH C1ORF146 GABRG2 SMUG1 LMX1A HAND2 FOLR4 RTP4 LUZP2 NPY2R RNF17 DNHD1 PKD1L2 PPM1K TTK PRR9 TNFSF13B GRM1 CECR2 GRM3 SLITRK3 PTPRZ1 PDSS2 C2ORF61 CLVS2 ,10/1203
7.6707225,12.491719,Cluster 1,A-Vietnam-1203 CIP048 RG4-2004(H5N1)PB2-627E 7day-MOI-10^4 GSE43301,EPHA6 GBP7 TCP11X2 ZFP1 ZPBP C12ORF71 OTOP3 PSMB9 DKK4 TTC39C OR6C6 PREB ZNF710 OR4C16 GRID2IP STX1B OR6C1 SAMD7 STX16 IFITM3 SLC35B1 PKD2L1 PSMB11 PSMB10 NHLH1 NKX2-2 FSD1 MS4A13 ANKS1B GBP2 GBP4 SNCB BATF2 LMAN1L FAM78B ACTL6B IGFL3 HLA-A OR51I1 HLA-E PTP4A2 FOSL2 FAM135B DMRTC2 CCKBR MEP1B PSME2 SFXN5 TEX13A GLIPR1L2 VGLL2 MAGEB5 PLA1A UNC119B NPFFR1 OXTR ANAPC16 PDE1A IL20RB GLDN TRPM1 GRIN2A T OR10S1 OR56B1 TRPM8 LIPM FAM65B GPR179 FEZF2 ZNF367 FOXD4 OTOR GABRA1 WARS PABPC5 PAX6 SORCS1 SORCS3 PAX3 OR1N1 PHOX2A TH KCNS2 PIGA CCDC6 CENPO PRPH2 PMP2 RHOU ITK IL18BP OR3A1 RET DENND1C GIPR GABRB2 C5ORF46 SLC35F4 ZFAND2A TMPRSS7 ARPC1B PRL SLC35F1 SLC22A15 HINT3 GPR110 NEUROD6 OPN1LW RRAS2 EMD OR8J3 STAT1 SLC32A1 DMRT1 OR10G4 STXBP5L VASH2 LDOC1 CABS1 NLRP14 ADAM19 CPSF4L TRIP11 TRIML1 OR7G2 MYT1L TRAF3IP2 FAM69C IL25 OR52N1 TMEM140 SLC8A1 ADAM29 TAF7L OR5D18 CXCR2 GSC CTNNA2 RSPO3 ARIH1 CSMD2 CSMD1 KIRREL2 OR2D2 SRD5A2 TPM3 OR5J2 YIPF6 TJAP1 TMPRSS12 POU4F3 CXCL10 WT1 XK OLFM4 LYG1 ABI1 SCN8A RNF183 LY6E OR52E8 UTS2 TNIK UBE2K DSC3 FKBP6 OCA2 HSD17B6 NALCN SDR9C7 CDH9 FAM105A CDH7 CLGN SCUBE3 PROKR2 OR2S2 DACH2 ANKAR HSD17B2 NLRP4 KPNA4 FGF23 NKTR C1QL1 DESI2 PSPN SLC30A1 NUP155 CTPS1 DUSP27 TMPRSS11F RNF169 ERICH6B IL1RAPL2 STT3B FBN1 LHX9 CD274 NTM KLHL18 AK5 LIN7A PDZD3 SCN9A MUC15 OR52B4 OR5AP2 RAG2 CLCA4 STPG2 SVOP ITGA4 AVPR2 RNASE10 MRGPRX1 OR13G1 OR4L1 USH2A SMC1B IFNE CLCN5 TMBIM4 NT5C1B RASA3 NF2 ATP13A5 SP9 EIF4E3 KHDRBS2 CATSPER1 OR51F2 LCN9 CNTNAP2 DDX3Y NID1 RETNLB BMP10 OR13F1 OR4K2 ACSM2A OR5M3 PLD5 OR10AG1 PDE11A C1ORF158 HAPLN2 KNG1 SPN ADAMTS16 CALB1 TNPO1 MARVELD3 HRH4 PLCZ1 TMEM207 OR8B4 DRD1 USP31 PDILT TAS2R1 QRFPR IMPG1 IP6K3 TKTL2 POU1F1 LHCGR PATL1 PTCRA KCNH7 OVCH2 GRID2 ERAP1 OPRK1 KCNK16 ATP2B3 AIM2 HAND1 MAB21L1 MAB21L2 C3ORF20 SPRY3 CCDC175 CLOCK POM121L2 FAM50B CNTNAP5 C3ORF30 KHDC1L PKD1L1 FOXI2 ITGAL SAMHD1 SLC4A7 OR5H14 SLITRK2 BAK1 PDE6C ITGB7 ,10/1203
8.393524,7.065797,Cluster 2,icSARS CoV 60Hour GSE37827,SP110 MX1 PCGF5 LOC100506737 COL24A1 LNPEP SYTL3 ASB7 LINC00525 EPHA4 ATF3 ZNF275 SAMD9 SGMS2 TRANK1 CDKN2AIP TM9SF4 GPR153 RRN3P1 HERC5 NUAK2 DPYSL5 GPBP1 PPP4R4 E2F4 N4BP3 NTSR2 N4BP1 EGR1 ZNF143 HLA-J MCAM ARRDC2 NR1D1 C8ORF4 HLA-G OVOL1 PUM1 SLC16A14 PTK2 PARP14 FOSL2 AR CNKSR3 NPLOC4 ABTB2 PARP12 OCLN FOSL1 NCEH1 PLSCR1 INTS6 PSME2 SNAI1 HLA-DRB1 NPFFR2 OXTR FAM89A IL20RB GCC2 IKZF3 IFIT2 IFIT3 ZC3H12D SOX4 MT2A ZNHIT6 PIP5K1A CCRN4L EPC1 PIEZO2 ZNF800 TNFSF10 IL12A JUNB ATP6V1C2 CCR1 CTC1 WARS JUN AKIRIN1 BTN3A2 PHF11 DUSP1 ERCC6L2 NCOA7 CCL20 IFITM4P NMI VEGFC KLHL5 BTN3A3 TUBB2A TOMM40L PHOX2A MMP12 CEACAM1 RARB ID4 GLCCI1 SDE2 RRAD ARF1 INTU ZC3HAV1 RASAL2 ADRB2 CX3CL1 SOCS3 BBC3 TMEM27 PPP3CC C6ORF58 UIMC1 WBP2NL RASSF10 TCP11L2 NFIL3 SUZ12 IL32 SUSD3 G0S2 ZFY SCAF4 PSMA4 RFWD3 PER1 SAA2 TRIML2 FAM133CP MAPRE1 ZNF574 PHLPP1 CDKN1B ORM1 SMG1 NOTCH2NL TXLNG SLC8A2 PTGS2 IFIH1 ING3 AKAP12 ADAM28 SERTAD2 ZNF207 IFNB1 HIST3H2BB BRD9 NEFH KRTAP2-3 ZBP1 HRASLS2 VWDE ZNF77 FAM91A1 CXCL10 ZNFX1 ARHGAP32 LRCH3 UBE2Z GPD2 TBC1D23 CD69 BRWD3 OTUD4 FRK PPP1R15B COL16A1 PHLDB2 SAA4 TNC CWC25 TNF COX6A2 DNAJC27 SAMD9L RELB FOXO1 TBX21 LAMP3 EMC8 MAP3K8 LINC00114 SH2B3 MB21D2 MAP2K4 SEMA6D DDX58 TMEM132C ATP8B1 SLC25A51 IGFBP3 LOC399491 NFKB2 FAM90A1 FGF18 ISG20 CACNB4 MXD1 PRPF4 TRAF6 DRAP1 XAF1 BIRC3 ZCCHC2 MAP3K13 CD274 BAGE SH3KBP1 LINC00261 RIF1 HTRA3 GPR85 RASGRP3 ETS2 DAPP1 CORO1C NPEPPS UBB ABL2 PIM3 ZNF644 MARK3 EGFL6 ANGPT2 CFLAR AIM1L MUC5AC MARCH7 NFKBIA IL6 ELF4 OAS3 RBMS2 NF1 CEBPZ TRIM56 NFE2L3 KDM5B ZNF195 TGFBRAP1 C3ORF52 CHD7 TNFAIP3 PLD6 PTPN21 UBR4 DUSP16 CSAG1 CXCL3 CSAG2 HRH1 DENND3 ZNF507 LONRF3 SULT4A1 EP400NL MUC5B STYK1 FEM1B WEE1 HSH2D VGF CRY2 LTB CXORF38 TRIM38 ERCC6 PTX3 BDP1 SEMA3A CEBPD THRB C4ORF19 C1S LAMA2 TUFT1 SYNE1 DNHD1 ZBTB43 THBS1 HDAC9 NR3C1 SAMHD1 RND2 MAPK8 ZNF608 DHX58 KYNU TDG CCL5 SIX4 TLK2 UBQLN1 DIP2B TRMT44 TRIM22 C3ORF36 C2ORF61 ,1203/2004
9.632988,8.129782,Cluster 2,A-Vietnam-1203-2004(H5N1) 7Hour GSE43204,RPL22 TAS2R10 RPL21 NPFF PLEKHA1 MX2 MTUS2 PRSS30P RC3H2 TMEM80 WDR78 SMARCA5 PDCL3 AMZ2P1 LOC100507140 ASB9 KIAA0368 GTF2IRD2 MXRA7 CDO1 LINC00643 CALM1 RALA AQP9 SYNPO2 AVIL ARPC4-TTLL3 AQP3 SNX31 STX10 UBE2L3 FUNDC2P2 C4B DHX34 RPL15 LOC100506844 GBP3 OR7D2 YES1 IL17RA BATF2 CNTD2 CEL PBX3 COMMD7 VCX2 RPL39L PTP4A2 LOC100507165 DPCR1 LALBA FERMT3 ZNF135 BEX5 POM121 LPGAT1 TMEM181 ICAM4 ACSM5 LOC100289098 CFP MRPL11 MED12L MRPL20 SULT1A1 PRDX3 SCGB1D1 ARL6IP5 RPS10 ANKRD20A5P PPAPDC1B SKP1 FOXD4 FGFBP2 GSTM1 IL15 PTGES3 NXPE1 CARD9 GPR12 LOC100507191 GNL1 KLHL5 GP6 OTOL1 TMCO2 MAGOHB PTMA AKR7A2P1 TAL2 CLDN15 NRN1L VMA21 CCDC90B C5ORF52 ARHGEF6 RAB7B MZB1 ARPC1A GUCY2F YTHDC1 C11ORF1 HEPACAM2 IER3IP1 POU5F1P3 SKA2 ZMYM4 RIPK2 STRA8 MPP4 MBNL3 TMOD4 WWP1 UBE2E3 LOC100289045 FAM104B SVIP AGBL5 BDH2 SLCO3A1 HCLS1 HNRNPH3 TCAP ANKRD42 IFNA6 DFNA5 SETD5 IFNA2 PAPLN COL11A2 MRPS33 CST8 ZDHHC2 GRAMD2 SPAG16 TP53TG1 GUK1 SERP1 SCN11A LOC730098 ADRBK2 AGR3 RIOK3 TMEM38B CCT5 CA12 UBE2I PPAN-P2RY11 ACYP1 TPM3 CRTAM AMY1C UBE2B CXCL10 MORF4L2 SLFN12 C6ORF25 MFNG FAP UBLCP1 RNF183 S100A7 PDCD2 UBE2N FAM71F1 FIGF C11ORF70 UBE2D3 PSORS1C1 FRZB FAM172A SLIT1 CHP2 BANF2 RPS2 ZNF547 ZNF425 HMGN3 FLJ42627 ARHGAP5-AS1 KRT36 KRT34 ISG15 ESPNL STON1-GTF2A1L KRT31 ESR2 LOXHD1 FGF18 MYD88 CDH17 TSPY26P IFT27 DGKI HOMEZ KCNE1 CBFB LOC283788 ARL3 SLC38A11 MGC70870 AGER HOXB13 TM7SF3 PHYHD1 FGF7 TGM1 ARHGAP21 ACN9 LOC100506100 MAN2A2 FAM162A GOLGA6L6 EIF4EBP2 KRTAP4-4 RAB4A PRRT2 SLC37A1 LINGO2 CRYGS C1ORF162 BOD1 SEPT2 DDHD2 LOC145837 IFT43 FAM153A FES ACTA1 OAS2 ALB PEX6 FAM153B LINC00326 ITGB1BP2 SERINC4 TPT1-AS1 LAT DEFB4A EIF4B DLX4 NPR1 LEAP2 DNAH6 HSPB8 ATP5L PTPN22 CELF6 NRXN3 NREP MOBP ELAVL1 WDFY3-AS2 EFCAB11 HEBP2 AP5M1 KRT33B UBE2Q1 BCL7C TAC3 AMICA1 C21ORF119 DDX18 OVGP1 SRCIN1 CPT1B MBOAT2 KIAA1683 YWHAZ CPT1C POMGNT1 THAP2 LOC100129449 ASXL3 CTRB1 C3ORF20 UBA52 ZNF610 MYO1G SCARB2 ISY1 SH2D4B C2ORF68 CX3CR1 PTEN GK2 TNFSF13B ENDOU ZNRF1 CHCHD3 DHX58 SCRN3 PRADC1 CCDC53 NOS2 POLR2J OIT3 EIF2D KLRG1 INSL5 ,1203/2004
9.3842535,6.9229074,Cluster 2,A-Netherlands-602-2009(H1N1) 30Hour GSE40844,MED1 SP110 BTBD18 RSAD2 MX2 PRSS30P LOC283352 LOC100133091 FNDC7 NUP210L KIAA0368 CYP20A1 TRIM14 RPL26 ITGBL1 MT1H DAND5 CDO1 VPS29 IDO1 HCP5 MT1E HIST1H4G ATF3 SAMD9 ITLN2 TRANK1 AVIL LOC646626 SNX31 RNF6 SNX32 CH25H APOL6 CNST IFI16 UBAP2L GBP1 ZNF267 APOL3 BATF2 GPLD1 DNAH12 PHC2 TNFSF14 FLJ34503 OVOL1 IFI44 BTC IL22RA1 PLSCR2 SNHG12 GJB7 WNK4 F13B NOL12 HOXB9 LDHAL6A LDHAL6B FERMT3 ZNF253 ZNF131 RSPH10B MT1M ZBTB2 IFIT5 MT1X KLHDC7B CD1E IFIT2 IFIT1 CD1C IFIT3 ZC3H12D C9 PIEZO2 ZNF800 IL12A CCR1 PNPT1 SLC10A1 LOC440040 NXPE2 GNL2 IL1A LAT2 TF CEACAM3 CEACAM1 KLHL6 MTF1 LHFPL3-AS1 PRPH2 MZB1 DDR2 COX7C RRAD ZC3HAV1 SECTM1 CX3CL1 GNGT1 SOCS1 PANX1 KRT27 RASSF10 GPR116 ANKRD1 RIPK2 CCR7 GPR115 TMED5 ADIPOQ RSPH4A LMLN ATP6V1G3 SLC35G5 SUSD3 GPR1 FAM46A ZNF674-AS1 RANBP6 TMEM155 DLC1 SEMG2 HCLS1 TSSK4 MGARP FYTTD1 IFNA6 CDKN1A PTAFR IFNA4 TMEM140 PODNL1 IFIH1 HYAL4 IFNB1 NEFH KRTAP2-3 LOC100506544 ZBP1 LAG3 KLRC4 BTN1A1 SHISA5 SLC31A1 GCG ATAD3B IFI44L LOC100287049 FAP MSH4 LIX1 YEATS2 IL6ST CD69 SRSF7 ZNF556 ALLC DCLRE1C ZNF430 CSF2 SLFN5 OR5I1 ASB14 LOC646903 TNF ATP10A BEST3 SAMD9L CASC2 PROSC NT5E LOC100505474 PES1 LAMP3 LOC100505592 ZNF669 MICALCL MYH11 ZNF544 POTEB AZI2 SLC16A6 TMPRSS11B SLC15A3 ISG15 ADAP2 NAALADL1 GABPB1-AS1 FGF18 ISG20 GOLGA6A CNEP1R1 SPATA1 SYCN FGF19 CARD16 USP41 XAF1 RLN2 SP140L SELV CD274 C17ORF98 CABP7 UTP23 LGALS3BP RASGRP3 AGER PHYHD1 FGF7 PDZD3 RGS1 GOLGA6L6 ZNF525 MLKL C1ORF162 RFPL1 HSPA5 ABCC9 EIF2AK2 LOC644656 MAGEA2B IL4 ACTA1 CRYGC OAS2 OAS3 POM121L8P ITGB1BP2 IRF7 CMTM3 NFE2L3 IDI2 HSPB7 SMG1P1 LEAP2 HSPB9 TNFAIP6 TNFAIP3 ACSM2A MBL1P CXCL1 CGB2 CSAG2 IDI2-AS1 KRT33B RRP7A CCIN TAC3 FAM83E PRPH RBM14 ZNF620 LOC401098 PTGIS PPBPP2 ZBTB33 LYSMD2 DNAJA1 PFDN2 SAG TAF7 RP9 PIK3AP1 BDP1 MYO1G BLZF1 MAK16 MIR155HG USP10 DDX25 SYCP3 SH2D4B SIX1 TTN USP18 RND1 LOC93622 SAMHD1 USH1C SOBP SLC25A28 ADAMTS6 SPDYE1 IQUB TAGAP TDG CCL5 TRIM25 TRAT1 TRMT44 ADAMTS9 BUB3 ARL5B TRIM22 TCEB3B ILKAP POLR2M ,1203/2004
8.492767,7.127216,Cluster 2,icSARS CoV 72Hour GSE37827,ACOT9 SP110 PCGF5 ACTN2 MX2 PLEKHA7 TAAR6 REV1 PISD BTBD10 MAPK8IP1 OSTM1 ZSCAN20 XRN1 TRIP6 TRIM14 IFITM2 SAMD9 SP100 NOLC1 GPATCH2 TRANK1 AKAP8 CDKN2AIP HERC6 LOC100128840 HERC5 PPP4R4 CREBBP EGR3 WNT10A HLA-J FZD5 HLA-C HLA-G SLC16A14 PARP14 HLA-F FA2H FOSL2 AR CNKSR3 FOSL1 CDCP1 RAET1K PSME2 MRVI1 ACSBG1 SIM2 MCPH1 PTP4A1 CFB IL1RN NPFFR2 ZNF131 FAM89A CEP85L IFI35 DCUN1D3 IFIT2 EPS8 MRPL12 IFIT3 RASSF5 CCRN4L EPC1 APOH PIEZO2 TNS3 C5ORF56 IL11 BRAP PNPT1 BTN3A2 ANXA3 PHF11 NCOA7 IFITM4P EMP1 VEGFC OSMR OTOL1 GPRC5A IL1A MMP13 ZEB1 TADA2A THEMIS2 PIGL KBTBD8 KCNC1 ZCCHC10 SERPINA10 PAK1IP1 ZC3HAV1 NMD3 ADRB2 LIMD2 CX3CL1 KIAA0040 CTSS TMEM26 UGCG SOCS1 C6ORF58 RIPK2 DISC1 RIPK1 LOC100130476 HLA-DQA1 KRTAP1-1 MPP5 FAM46C SUSD1 MBD1 SERPINB1 WNT7B ZFX F3 RSG1 ANO3 DAB2IP SCAF4 TJP1 RYBP PSMA4 TMEM158 LOC100130924 SAA2 WAC TSR1 TRIML2 CDKL1 RYR2 NRP2 PHLPP1 LOC93463 PTGS1 IFIH1 SMPD3 GLRA4 ANKRD30BP2 SERTAD2 LOC100289058 HLA-DPA1 LINC00612 IFNB1 HDX GC RICTOR NEFH ZBP1 TOR1B FBXW11 SLC31A2 WNT5A OSR2 SHISA5 TAP1 KAZN ZNF79 RAB30 TICAM1 BATF CXCL10 ZNFX1 FAP KAT6A KIAA0408 OTUD4 PHLDB2 ODC1 PRDM1 GPR65 TNF ATAD2B ZBTB20 FOXO1 ZNF8 RBBP5 GBX2 TBX21 NPTX1 KPNA4 RGS20 REPS1 HLA-DOA MB21D2 MAP2K1 SLC25A51 ARID5B INHBB PPTC7 NR4A3 ISG20 MYD88 MAP3K19 PRPF4 FGF19 OR2A7 SP140L VCX ETS1 RASGRP3 WISP1 ETS2 DAPP1 SEPSECS KCNV1 ABL2 MUC13 PMAIP1 NEK4 SLC15A4 USP25 SVOP ANGPT2 HSPA6 NRG1 SSTR2 MARCH7 MSL2 ETV7 BMP2 ELF4 OAS2 SFPQ IRF9 CEBPZ KCNK1 TRIM56 RBMS3 DLX2 GTF3C4 SHC4 HSPB9 HSPB8 RASGRF2 CHD8 C3ORF52 SPATA2 TNFAIP3 PTPN21 NRF1 NLRC5 CSAG1 ADAR FUT2 METTL13 PDLIM2 PTBP2 HRH1 IRAK2 LOC643201 ZNF507 DNAJB4 PDE4B DRD4 C2ORF54 RBM38 RALGAPA1 KCTD4 KANSL2 MYO1B GFOD1 ALDH1A3 KIAA0226 CRY2 CXORF38 TRIM38 TAF7 ANAPC7 CSNK1G2 TRIB1 RBM27 GOSR1 C1S WDR5 DDX24 ZNF292 THBS1 TTL HDAC9 NR3C1 OASL SAMHD1 POMZP3 PRB1 TDG GNA13 POLK IGF2BP2 H2BFXP VHLL FBXO7 DIP2B TRMT44 TRIM22 C2ORF61 NCK1 ,1203/2004
8.884854,6.938401,Cluster 2,A-Netherlands-602-2009(H1N1) 36Hour GSE40844,MED1 ARL11 LINS DUT SP110 PCGF5 ACTN2 RSAD2 MX2 ZNF281 LNPEP LRP2BP EREG PSMB9 PML SCO2 TRIM14 FAR1 BCOR PI4K2B VPS29 PI4K2A IFITM2 RRN3 SAMD9 IFITM1 DPH3P1 SLC35B1 TRANK1 AVIL MAGOH RRN3P1 HERC5 MTA2 IFI16 FLT3LG MYC OGFOD3 GBP1 B2M GBP3 APOL2 GBP4 EPSTI1 APOL3 XBP1 APOBEC3G DNTTIP2 LOC100131929 PARP14 LATS2 PARP12 PLSCR1 SNHG11 SFXN4 RBAK POM121 ITSN2 TXN IFIT5 GATA3 IFIT2 IFIT3 LIPG C6 MICAL2 ZNF280C TNFSF10 IL12A LGALS9 C5ORF56 FOXD4 PHF11 DUSP2 SNORA70 NCOA7 BTN3A1 IFITM4P NMI TMEM173 DCBLD1 WDR33 MAGOHB BST2 TADA2A ZEB2 THEMIS2 MTF1 PTPRB KRT16 UBAP2 ZNF239 CRLF3 LINC00165 MRPS11 PCSK6 IER3IP1 SOCS3 MED13 TMEM27 IGSF22 SOCS1 C10ORF95 DPH2 NDNL2 PRKCDBP RIPK2 UTP14A LOC727820 LYAR AEN ZNF674-AS1 SERPINB9 POU5F1 PARP9 ADAM19 DLC1 SRRD RPA4 HCLS1 TMEM39A HBEGF IFNA5 CDKN1A PAPLN PTGER4 KIAA1033 FAIM3 TMEM140 PTS PRSS22 SCML1 AKAP14 PSMB2 HYAL4 HDX GPR135 ZNF324 KLRAP1 ZBP1 GINS1 KLHL29 TAP2 TAP1 TMEM251 PUS7 LGALS9C IFI44L WT1 LYG2 LIX1 CD300E PLAA RHCG DCLRE1C VKORC1L1 TYMP CD86 RNF34 OR2C1 SAA4 HP BCCIP JAKMIP2 GIMAP8 CNDP1 PSORS1C1 RELB POTEM KHSRP C18ORF49 TBX5-AS1 C6ORF15 LAMP3 TPM1 POTEE ZNF547 MSX2 EMC7 LDLR MICB AZI2 MB21D2 PDIA3 TTC38 MAP2K3 SLC15A3 FAM103A1 PAM16 TNFRSF10A NFKB2 NR4A3 FGF18 PROCR CAPRIN2 GNB4 GEMIN7 XAF1 SNORD22 SP140L ZCCHC2 INO80C CBFB ETS1 CACNA1G RASGRP3 TGM2 TMEM223 FPGS BAG3 PDZD2 G3BP2 IBSP MLKL TXNDC9 RFPL1 HSPA5 DTX3L RBM19 EIF2AK2 LOC644656 SORD SENP3 TAPBP ETV7 NFKBIA OAS2 IRF4 OAS3 POM121L8P IRF9 IRF7 TRMT61A TRIM56 BCAR3 DDX3X SEH1L AGPAT9 DDX3Y PSMD12 UBA7 C2ORF47 HSPB9 ZC3H3 MCM10 HK2 FYCO1 DPP9 FUNDC2 PHACTR4 MAN2C1 SP140 RBM39 CYP51A1 ERAP2 LYSMD2 OXSR1 DNAJA1 TSPAN16 HSH2D TSPAN14 C19ORF66 SPRY4 KIAA0907 TRIM38 MYO1G PRO2852 SEMA3A SEC23A RTP4 RTP1 AKAP8L PRR4 DDX21 DBF4B DDX60L THBS1 DMKN USP18 HDAC9 TNFSF13B SAMHD1 SLC25A28 CHCHD4 TRA2A DHX58 SPDYE3 CCL5 LINC00216 TLK2 TRIM26 LRRC8B PDSS1 PGM5 ADAMTS9 POLR2K TRIM22 C2ORF61 RBM6 SLC25A25 ,1203/2004
9.400828,8.491272,Cluster 2,A-Vietnam-1203-2004(H5N1) 12Hour GSE28166,POLR2J4 HEXIM1 IMP4 TYW3 DKK3 PTRHD1 ASS1 RRAGC IDNK MT1H ASB3 SKAP1 HRASLS OPTN WBP1 PGAP2 SATB1 KDELR2 RPL10 ZNF271 CRABP2 UQCR10 AVIL C6ORF99 LOC646626 RNF5 TOB1 UBE2L3 NUAK2 PPP4R1 SEPHS1 EXOSC5 CLP1 PABPN1 VTI1B RPL15 LOC728715 EGR1 TMA7 GBAS COPZ2 SNHG16 ZFPM1 C12ORF49 RPS28 RPL27A GJB7 OR7E156P SNAI1 NDUFAF2 PRR13 PKIG PTP4A1 PPP1R18 C5ORF24 TMEM183B DANCR MT1L RPL34 GDE1 MRPL11 LOH12CR2 CYB5R2 HIST1H3A CYB5R4 RASSF3 NDUFB2-AS1 RPL23AP82 RNF219 FTH1 JUNB AMZ2 SRP9 BTF3 NMB TPI1 FAM32A SNORA70 UBE2G2 GNG12 RAB33A ALS2CR11 MRAS LYRM4 TMSB15B ID3 FXYD3 C4ORF3 KRT15 ID2 CENPN TMEM106C HCST KXD1 ZNF780B SGK1 GUCY2C MYCBP ABHD5 KGFLP1 MRPS11 RPS27L KLK8 SKA2 DDA1 CHRAC1 C16ORF52 OR7E47P RPS15A C11ORF24 PARP6 ATP6V1G1 NANOS3 ODAM FAM46A TTC3P1 PET100 MRPS21 FOS SLC39A11 AES FARP1 MRPL53 FKBP1B RSL1D1 GAL MORN2 RYBP FAM200B FOSB C9ORF3 OR7E14P HBEGF BSCL2 LPPR2 NDUFA12 RNASEK PIGP PMS2P5 MRPS33 PYGM FAM127B PPP1R2 SCML1 ATP6AP1L TP53TG1 GUK1 UBL5 CAMK2N1 UBL3 FGFR1OP2 RNF130 ZNF688 PUS3 DTX2P1-UPK3BP1-PMS2P11 RYK SEPT12 LAG3 USP4 FBXO18 TJAP1 SPINK1 TUG1 TATDN1 ARHGAP25 EEF1A1 IFI44L SYPL1 LY6E LOC730183 SLC25A33 PMS2P1 PF4 CD69 SNRNP25 CNIH4 OR2A9P CD83 PVT1 UBE2D4 ZFAND1 UCP2 NEXN TCEAL1 TNF TOMM20 DEFB1 TBRG4 TOMM22 TNN TMEM128 LOC100505592 HIST1H2AE BANF1 SLC16A9 RPS2 ZNF425 PDE8B MAP3K8 LOC729887 DCLRE1A SERF1A SERF1B TTC32 TBCC DUSP23 FGF18 NR4A2 MED26 MXD1 ABCA11P GNB1 RHEB TMEM116 TADA3 SPATA1 CDH16 ZNF654 YRDC CCDC122 CD274 NCF2 COX17 CBFB COX16 SH3KBP1 AK2 LOC283788 FAM107B ARL3 AGER IGLV1-44 LOC100506100 FGF9 MPC1 FGD5-AS1 CHMP1B C6ORF226 PAPOLA KLRC1 LOC441455 CMTM8 HSPA6 WIPI2 RPS3A HMGA1 IFT43 ACTA1 IL6 ITGB1BP1 CCDC74B SYF2 UBQLNL ARMC10 SMIM4 GPSM3 GAL3ST1 AVEN NDUFB8 LOC338620 LOC389831 ATP5L ATP5I HEBP2 IDI2-AS1 PSTPIP1 ERICH2 MARVELD2 UBE2Q1 BCL7C RPL36A ZNF503 TRIM43 UGT2B11 TIMM8B REC8 TSTD3 MBOAT2 KANSL1-AS1 PGM5-AS1 LOC100288911 APOC1 RPS6KB2 LEPROT HIST1H2BB LINC00467 BECN1 C1R RBM27 DCTN3 PPM1N KRT86 SYNE4 OASL SUMO2 SIN3B CECR7 CHCHD7 POLR2J EIF2D ,1203/2004
