x,y,Name,Genes
29.941448,-24.261692,overview of telomerase protein component gene htert transcriptional regulation,WT1 MAX SP1 MXD1 MZF1 HDAC1 TERT MYC ESR1 TP53 
29.875168,-24.44672,overview of telomerase rna component gene hterc transcriptional regulation,RB1 SP1 SP3 NFYB NFYC TERC NFYA 
31.758411,-26.572844,oxidative stress induced gene expression via nrf2,JUN KEAP1 FOS PRKCB PRKCA AKR7A2 CRYZ MAFF CREB1 POR FXYD2 GSTA2 MAFG HMOX1 UGT1A6 HMOX2 MAFK NFE2L2 
31.518246,-25.96831,p38 mapk signaling pathway,MAP2K4 MEF2A MEF2D MAP3K1 MEF2C STAT1 H3F3A H3F3B CDC42 MAPK14 CREB1 MAPKAPK5 MAPKAPK2 DDIT3 ATF2 MAX PLA2G1B ELK1 MEF2BNB-MEF2B NR2C2 HSPB1 RPS6KA5 MKNK1 MYC RAC1 MAP3K9 HRAS MAP3K5 MAP2K6 HMGN1 
31.249529,-25.890556,p53 signaling pathway,APAF1 TSC2 CDK6 TP53I3 RRM2B CDK4 FAS CCNG2 CDK2 CCNG1 BCL2 BAX ATM CYCS STEAP3 ATR TP53 PCNA RB1 EI24 CD82 SERPINE1 RCHY1 BBC3 CASP8 CCND3 CASP9 CCND2 CHEK1 CCND1 E2F1 CHEK2 PERP TIMP3 BAI1 CASP3 RPRM GTSE1 SIAH1 SERPINB5 RRM2 CDKN2A GADD45B GADD45A IGFBP3 GADD45G IGF1 TNFRSF10B DDB2 TP73 PPM1D RFWD2 CCNE2 CCNE1 MDM4 MDM2 CDKN1A PTEN THBS1 CCNB3 SESN1 CCNB2 CCNB1 ZMAT3 SESN2 SESN3 PMAIP1 SFN BID 
30.957047,-23.836954,pdgf signaling pathway,MAP2K4 PDGFRA MAP3K1 JUN STAT1 CSNK2A1 MAP2K1 STAT3 FOS PRKCB PRKCA RASA1 PIK3R1 PIK3CA GRB2 RAF1 SOS1 SHC1 SRF PDGFA ELK1 MAPK8 MAPK3 PLCG1 HRAS JAK1 
32.408245,-26.575607,pelp1 modulation of estrogen receptor activity,PELP1 CREBBP SRC EP300 ESR1 
31.831081,-25.62781,pertussis toxin-insensitive ccr5 signaling in macrophage,CXCL12 JUN CXCR4 GNAQ CCL4 FOS PLCG1 CCL2 CCR5 
32.045406,-26.064398,phosphoinositides and their downstream targets,LYN GSK3B GSK3A ARF1 BAD PDPK1 PRKCE GTF3A VAV2 EEA1 PRKCZ PFKM PFKL RPS6KB1 AKT1 BTK PLCG1 RAC1 GRASP RAB5A PFKP 
31.087217,-26.161436,phospholipase c signaling pathway,PIK3R1 PIK3CA PDPK1 PLCG1 PLCB1 
32.36293,-25.968073,phospholipase c-epsilon pathway,PRKACG RAP2B PTGER1 PRKAR1B PRKAR1A PRKAR2B PRKAR2A PLCE1 GNAS RAPGEF3 ADRB2 PRKACB 
32.12828,-25.404373,phospholipids as signalling intermediaries,PDGFRA MAP2K2 SPHKAP MAP2K1 PDPK1 SPHK1 PRKCB PRKCA PTK2 GNB1 PIK3R1 PIK3CA GRB2 RAF1 SOS1 SRC SHC1 ADCY1 ITGB3 PDGFA PIK3C2G GNAI1 ASAH1 GNGT1 SMPD2 SMPD1 AKT1 MAPK3 S1PR1 RAC1 MAPK1 HRAS ITGAV 
29.80913,-13.514876,phosphorylation of mek1 by cdk5/p35 down regulates the map kinase pathway,NGFR EGR1 MAP2K2 SHC1 MAP2K1 NGF CDK5 MAPK3 MAPK1 HRAS GRB2 CDK5R1 RAF1 SOS1 
31.651812,-25.65342,pkc-catalyzed phosphorylation of inhibitory phosphoprotein of myosin phosphatase,PPP1R14A PPP1R12B ROCK1 TRIO ARHGEF1 CACNA1A CAMK2B PRKCB PRKCA VAV1 MYLK ARHGAP5 GNGT1 GNB1 MYL2 GNA12 GNA13 GNAQ PKN1 ARHGEF5 PLCB1 
29.387737,-18.72351,platelet amyloid precursor protein pathway,APP F11 SERPINE1 PLAU F2 PLAT PLG COL4A1 F9 COL4A3 COL4A2 COL4A5 COL4A4 COL4A6 
31.34945,-26.110424,polyadenylation of mrna,CPSF2 CPSF1 CPSF4 CSTF3 CPSF3 PABPN1 CSTF2 CSTF1 PAPOLA 
30.21019,-25.532606,prion pathway,LAMA3 LAMB3 HSPA5 LAMA2 LAMA5 PRNP LAMA4 LAMC1 LAMC3 LAMB2 LAMA1 LAMC2 LAMB1 GFAP RPSA DNAJB1P1 DNAJB6 BCL2 
31.310783,-19.562449,proteasome complex,PSMD11 PSMD12 PSMD14 RPN1 RPN2 UBE3A UBE2A PSMB7 PSMA6 PSMA7 PSMA4 PSMB5 PSMA5 PSMB6 PSMB3 PSMA2 PSMB4 PSMA3 PSMB1 PSMD3 PSMD4 PSMB2 PSMA1 UBA1 
32.54802,-25.4259,protein kinase a at the centrosome,RHOA PRKACG PRKAR2B PRKAR2A PRKCE AKAP9 PKN1 CDK1 PRKAG1 PPP2R5D PRKACB PPP1CA 
28.696575,-21.424654,proteolysis and signaling pathway of notch,NOTCH1 ADAM17 FURIN PSEN1 DLL1 RBPJ 
32.411278,-24.931581,pten dependent cell cycle arrest and apoptosis,ITGB1 CDKN1B SHC1 ILK PTEN FASLG FOXO3 PTK2 PIK3R1 PIK3CA AKT1 GRB2 BCAR1 PDK2 SOS1 
31.595478,4.383803,rac1 cell motility signaling pathway,RALBP1 PDGFRA MAP3K1 PPP1R12B LIMK1 CADM1 ARAP1 ARAP2 VAV1 ARFGAP3 ARFGAP1 PIK3R1 RPS6KB1 PIK3CA MYL2 CDK5 ARHGEF5 CDK5R1 NCF2 TRIO ARHGEF1 CACNA1A ASAP2 ARHGAP1 ARHGAP6 PLD1 ARHGAP4 MYLK ARHGAP5 PAK1 ASAP1 CHN1 CFL1 RAC1 ARFIP2 WASF1 
32.582695,-26.30935,ras signaling pathway,RHOA RALBP1 RALA CHUK BAD PDPK1 FOXO4 PLD1 VAV1 CDC42 CASP9 PIK3R1 PIK3CA BCL2L1 AKT1 RAC1 HRAS RALGDS RAF1 SOS1 
31.36905,-25.926985,ras-independent pathway in nk cell-mediated cytotoxicity,KLRC3 SYK MAP2K1 KLRC4 HLA-A IL18 VAV1 CD2 FCGR3A FCGR3B PAK1 PIK3R1 PIK3CA MAPK3 CD28 KLRD1 RAC1 KLRC1 KLRC2 B2M PTPN6 LAT 
30.202526,-23.818521,rb tumor suppressor/checkpoint signaling in response to dna damage,RB1 RASGRF1 CDKN1A MYT1 WEE1 CHEK1 CDK4 E2F1 CDK2 ATM CDK1 YWHAH TP53 
31.822508,-26.13519,regulation of bad phosphorylation,ADCY1 BAD PDPK1 IGF1 CSF2RB IGF1R IL3 PRKACG KITLG KIT PIK3R1 PIK3CA PRKAR1B PRKAR1A PRKAR2B IL3RA PRKAR2A BCL2L1 AKT1 BCL2 BAX PRKACB YWHAH 
30.178257,-20.686665,regulation of cell cycle progression by plk3,RASGRF1 APAF1 PLK3 CASP9 CCNB1 CASP6 CHEK1 CASP7 CHEK2 BAX CASP3 ATM TREX1 CDK1 CYCS YWHAH ATR TP53 
32.409855,-25.789415,regulation of ck1/cdk5 by type 1 glutamate receptors,ADCY1 CAMK2B PPP2R5D PPP1CA GRM1 PPP3CA GNGT1 PRKACG GNB1 PPP1R1B PRKAR1B CDK5 CSNK1D NCS1 PRKAR1A PRKAR2B PRKAR2A ADRBK1 GNAS DRD1 DRD2 PRKACB CDK5R1 PLCB1 
31.845457,-26.67536,regulation of eif-4e and p70s6 kinase,EIF4A1 IRS1 PDPK1 EIF4EBP1 PTEN PRKCB PRKCA MTOR GH1 PPP2CA MAPK14 GHR PSMC4 PIK3R1 RPS6KB1 PIK3CA MKNK1 AKT1 MAPK3 EIF4G1 PABPC1 MAPK1 EIF4E PDK2 
32.08728,-26.532423,regulation of eif2,EIF2B5 EIF5 GSK3B NPY4R EIF2AK2 EIF2AK1 EIF2AK4 EIF2AK3 EIF2S3 EIF2S2 EIF2S1 
31.825893,-25.021425,regulation of map kinase pathways through dual specificity phosphatases,DUSP6 DUSP4 MAPK8 DUSP1 DUSP2 MAPK3 DUSP9 DUSP8 MAPK14 
30.802456,-23.18883,regulation of p27 phosphorylation during cell cycle progression,RB1 CDKN1B CKS1B CUL1 NEDD8 RBX1 TFDP1 CCNE1 E2F1 CDK2 UBE2M SKP1 SKP2 
33.19617,-25.641306,regulation of pgc-1a,HDAC5 CAMK2D MEF2A ESRRA MEF2D MEF2C PPARA CAMK2A SLC2A14 CAMK2B MEF2BNB-MEF2B CAMKK1 CAMKK2 PPP3CA PPP3CB PPP3CC CAMK4 PPARGC1A CAMK2G YWHAH 
32.851387,-25.98785,regulation of spermatogenesis by crem,XPO1 GNGT1 GNB1 ADCY1 FSHB FSHR GNAS CREM FHL5 KIF17 
32.82932,-25.657719,regulation of splicing through sam68,KHDRBS1 RASA1 SRC MAP2K2 MAP2K1 MAPK3 CDK1 MAPK1 HRAS RAF1 
31.296888,-25.479212,regulation of transcriptional activity by pml,CREBBP RB1 UBE2I DAXX SP100 SUMO1 SIRT1 PAX3 TP53 PRAM1 PML 
31.713501,-25.318338,regulators of bone mineralization,COL4A1 COL4A3 COL4A2 COL4A5 ENPP1 COL4A4 IBSP ANKH ALPL COL4A6 SPP1 
31.75198,-26.387669,repression of pain sensation by the transcriptional regulator dream,JUN KCNIP3 OPRK1 FOS CREM PRKACG CREB1 POLR2A PRKAR1B RPS6KA3 PRKAR1A PRKAR2B PRKAR2A MAPK3 PRKACB 
32.497128,-25.005653,reversal of insulin resistance by leptin,PRKAA2 CPT1A LEP PRKAG2 LEPR PRKAG1 PRKAB1 PRKAB2 PRKAA1 ACACA 
32.490227,-25.505228,rho cell motility signaling pathway,GSN RHOA RALBP1 PPP1R12B LIMK1 ARAP1 ARAP2 VAV1 ARFGAP3 DIAPH1 ARFGAP1 MYL2 ARHGEF5 TLN1 PFN1 VCL ROCK1 NCF2 TRIO ARHGEF1 CACNA1A ASAP2 ARHGAP1 ARHGAP6 ARHGAP4 MYLK ARHGAP5 ASAP1 CHN1 PIP5K1A CFL1 PIP5K1B 
32.711906,-26.217209,rho-selective guanine exchange factor akap13 mediates stress fiber formation,AKAP13 RHOA PRKACG GNA12 PRKAR2B PRKAR2A LPAR2 LPAR3 PRKAG1 PRKACB LPAR1 
31.246216,-25.043827,rna polymerase iii transcription,SSB GTF3C3 GTF3C4 GTF3C5 BRF1 NR3C1 BDP1 GTF3C1 
31.476887,-26.150293,role of brca1 brca2 and atr in cancer susceptibility,HUS1 MRE11A FANCA BRCA1 BRCA2 FANCC FANCF RAD50 FANCE FANCG RAD51 CHEK1 FANCD2 CHEK2 NBN RAD17 ATM TREX1 RAD1 ATR TP53 RAD9A 
31.707666,-26.377747,role of egf receptor transactivation by gpcrs in cardiac hypertrophy,RHOA EDN1 EGF MAP2K2 JUN MAP2K1 CHUK ADAM12 FOS PRKCB PRKCA AGT NFKBIA GNB1 AGTR2 GRB2 RAF1 SOS1 RELA SHC1 EGFR GNGT1 EDNRA IKBKB EDNRB RPS6KA1 GNA11 MYC MAPK3 PLCG1 MAPK1 HRAS IKBKG 
31.366909,4.3219557,role of erbb2 in signal transduction and oncology,MAP2K2 MAP2K1 PDPK1 STAT3 ESR1 LRPPRC IL6 PIK3R1 PIK3CA CARM1 GRB2 RAF1 SOS1 SHC1 EGFR GRIP1 ERBB4 ERBB2 EP300 ERBB3 AKT1 MAPK3 MAPK1 HRAS JAK3 IL6R JAK1 JAK2 
29.453556,-24.901987,role of erk5 in neuronal survival pathway,MEF2A MAP2K5 MEF2D MAP2K2 NTRK1 MEF2C MAP2K1 PDPK1 BDNF NGF CREB1 PIK3R1 PIK3CA GRB2 RAF1 SOS1 SHC1 MEF2BNB-MEF2B RPS6KA1 NTF3 AKT1 MAPK3 PLCG1 MAPK1 HRAS MAPK7 
31.7531,-25.518751,role of mal in rho-mediated activation of srf,MAP4K2 RHOA MAP2K2 MAP3K1 ROCK1 LIMK1 MAP2K1 SRF CDC42 DIAPH1 ACTA1 MAPK8 HNF1A MAL MAPK3 RAC1 MAPK1 HRAS RAF1 
31.466434,-23.558857,role of mef2d in t-cell apoptosis,MEF2D PRKCB NFATC1 PRKCA ZAP70 PTPRC LCK CD4 HLA-DRA CD247 LAT HLA-DRB1 CABIN1 TRB TRA HDAC1 HDAC2 CAMK2B CD3G CD3E NR4A1 CD3D PPP3CA PPP3CB PPP3CC EP300 CAPNS1 PLCG1 CAPN2 FYN 
30.320068,-21.016117,role of mitochondria in apoptotic signaling,BIK DIABLO APAF1 CASP9 AIFM1 BCL2L1 BCL2 BAX CYCS BAK1 BID BIRC2 BIRC3 
32.175804,-26.352564,role of nicotinic acetylcholine receptors in the regulation of apoptosis,SRC BAD PDPK1 FASLG FOXO3 PTK2 PIK3R1 PIK3CA TERT CHRNG AKT1 PTK2B RAPSN MUSK YWHAH CHRNB1 AGRN 
32.385525,-26.67667,role of parkin in ubiquitin-proteasomal pathway,PARK2 GPR37 SUMO1 UBE2E2 UBE2G2 UBE2L6 UBE2G1 UBE2L3 
31.46672,4.2855253,role of pi3k subunit p85 in regulation of actin organization and cell migration,ARPC1A ACTR3 RHOA PDGFRA ACTR2 ARPC1B PDGFA WASL CDC42 PAK1 ARPC3 PIK3R1 PIK3CA ARPC4 ARPC2 RAC1 
32.03503,-25.697224,role of ppar-gamma coactivators in obesity and thermogenesis,NCOA2 MED1 CREBBP RXRA NCOA1 LPL EP300 PPARG PPARGC1A 
31.51948,-26.307262,role of ran in mitotic spindle regulation,RANBP2 KPNB1 TPX2 RANBP1 NUMA1 AURKA RCC1 KIF15 RAN KPNA2 RANGAP1 
33.23362,-11.378021,role of ﬂ-arrestins in the activation and targeting of map kinases,EDN1 MAP2K2 MAP2K1 F2 DNM1 AGT CXCL12 GNB1 AGTR2 GNAS RAF1 CHRM1 PTGER1 CCL11 HTR2C FPR1 ADRB2 ADRA1B GNGT1 EDNRA EDNRB ARRB1 CXCR4 P2RY2 ADRBK1 MAPK3 CCL4 MAPK1 CCR5 CCR3 
33.239445,-11.3702135,roles of ﬂ arrestin dependent recruitment of src kinases in gpcr signaling,EDN1 MAP2K2 MAP2K1 F2 DNM1 AGT HCK FGR CXCL12 GNB1 AGTR2 GNAS RAF1 SRC CHRM1 PTGER1 CCL11 HTR2C FPR1 ADRB2 ADRA1B GNGT1 EDNRA EDNRB ARRB1 CXCR4 P2RY2 ADRBK1 MAPK3 CCL4 MAPK1 HRAS CCR5 CCR3 
28.907917,-22.054918,segmentation clock,FZD1 HES7 NOTCH1 GSK3B CSNK2A1 CTNNB1 LRP6 KREMEN2 AXIN1 PSEN1 DLL1 DKK1 DKK2 NKD1 NKD2 RBPJ PROC LFNG ADAM17 HEY2 WIF1 DVL1 WNT1 HES1 
32.27924,-25.775444,signal dependent regulation of myogenesis by corepressor mitr,MEF2A MEF2D MEF2C CAMK2B MYOD1 HDAC9 MEF2BNB-MEF2B YWHAH 
31.83286,-24.813953,signal transduction through il1r,TGFB1 TGFB3 MAP3K1 MAP2K3 TGFB2 JUN IL1R1 CHUK FOS MAPK14 IL1A IL1B MYD88 NFKBIA IL6 ECSIT TOLLIP TRAF6 TAB2 TAB1 IL1RN RELA IFNA1 PEBP1 IL1RAP TNF IKBKB MAPK8 IRAK2 IRAK3 IRAK1 IFNB1 MAP3K7 IKBKG MAP4K4 MAP2K6 
30.756937,-24.113548,signaling pathway from g-protein families,MAP2K1 PRKCB NFATC1 PRKCA CREB1 GNB1 PRKAR1B PRKAR1A GNAQ GNAS RAF1 CAMK2B ELK1 GNAI1 PPP3CA GNGT1 PPP3CB PRKACG PPP3CC RPS6KA3 PRKAR2B PRKAR2A MAPK3 PLCG1 HRAS PRKACB 
32.175793,-26.422165,skeletal muscle hypertrophy is regulated via akt-mtor pathway,EIF2B5 PDPK1 RPS6 IGF1 PPP2R5D EIF2S3 EIF2S2 MTOR EIF2S1 PSMC4 PIK3R1 RPS6KB1 PIK3CA EIF4G1 PABPC1 EIF4A1 GSK3B EIF4EBP1 PTEN INPPL1 IGF1R MKNK1 AKT1 EIF4E PDK2 
29.685518,-23.329601,sodd/tnfr1 signaling pathway,MADD BAG4 CRADD TRADD TNF TRAF2 RIPK1 TNFRSF1A BIRC3 
31.997267,-26.012589,sonic hedgehog receptor ptc1 regulates cell cycle,XPO1 SHH CDK7 CCNB1 RASGRF1 CCNH CDK1 PTCH1 MNAT1 
31.871286,-26.950693,spliceosomal assembly,SNRPA SNRNP70 SRSF2 U2AF2 SNRPB2 SNRPA1 U2AF1 SNRPC 
29.127441,-24.01011,sprouty regulation of tyrosine kinase signals,SRC EGF MAP2K2 SHC1 MAP2K1 SH3KBP1 CBL EGFR RASA1 PTPRB MAPK3 SPRY4 SPRY3 SPRY2 MAPK1 HRAS SPRY1 GRB2 RAF1 SOS1 
31.835371,-26.246162,srebp control of lipid synthesis,MBTPS1 SREBF1 MBTPS2 SREBF2 HMGCS1 SCAP LDLR 
31.029966,-25.339228,stat3 signaling pathway,STAT3 MAPK3 MAPK1 JAK3 TYK2 MTOR JAK1 JAK2 
31.613218,-25.554344,stathmin and breast cancer resistance to antimicrotubule agents,CAMK2D CAMK2A CAMK2B TUBB1 TUBA1A TUBA3C MAPK13 TUBA4B TUBA4A TUBA8 CD2 PRKACG TUBA1C CCNB1 PRKAR1B STMN1 PRKAR1A PRKAR2B PRKAR2A CDK1 CAMK4 CD247 PRKACB CAMK2G 
31.599466,-25.692806,stress induction of hsp regulation,DAXX APAF1 TNF FASLG HSPB1 IL1A ACTA1 CASP9 MAPKAPK2 FAS MAPKAPK3 BCL2 CASP3 CYCS 
31.388374,-19.642942,sumoylation as a mechanism to modulate ctbp-dependent gene responses,ZEB1 SUMO1 CTBP1 CDH1 UBE3A NOS1 UBE2A UBA1 
32.03964,-25.511717,sumoylation by ranbp2 regulates transcriptional repression,HDAC6 RANBP2 HDAC4 HDAC1 NUP214 NUP153 NUP210 PIAS1 HDAC9 PIAS2 SUMO1 NUP62 RAN MDM2 
31.981186,-24.931068,t cell receptor signaling pathway,RALBP1 MAP3K1 TEC CD4 PTPN7 PDCD1 PTPN6 RAF1 RELA CSF2 CBLC ASAP2 TNF CBLB NRAS PAK2 PAK1 ASAP1 AKT3 AKT1 PAK7 AKT2 GRAP2 PAK4 PAK3 MAP3K8 PAK6 MAP2K4 CARD11 MAP2K1 PRKCB PRKCA NFKB1 NFKB2 ARFGAP3 ARFGAP1 PIK3R1 CD8B CD8A PRKCQ GRB2 MAP3K14 HLA-DRB1 NCF2 BCL10 ARHGAP1 ARHGAP6 ELK1 ARHGAP4 ARHGAP5 PPP3R1 RASGRP1 PPP3R2 PLCG1 PDK1 RHOA IL10 JUN NFATC4 NFATC3 NFATC2 ARAP1 NFATC1 ARAP2 VAV1 VAV2 VAV3 IL2 NFKBIB IL5 IL4 NFKBIA PTPRC PIK3CB PIK3CA CDK4 IFNG HLA-DRA CD28 LCP2 CD247 SOS2 NFKBIE ITK LAT SOS1 NFAT5 TRB TRA SHC1 PIK3R5 PIK3R3 PIK3R2 CD3G CD3E CD3D PPP3CA PPP3CB PPP3CC CTLA4 ICOS CHUK FOS CDC42 ZAP70 LCK KRAS CD40LG CAMK2B PIK3CD CBL PIK3CG MALT1 IKBKB MAPK8 CHN1 MAPK3 RAC1 HRAS FYN IKBKG NCK1 NCK2 
32.194714,-25.660353,telomeres telomerase cellular aging and immortality,RB1 XRCC5 XRCC6 TNKS TERF1 PRKCA PPP2R5D POLR2A TERT TEP1 MYC AKT1 BCL2 KRAS TP53 
31.691536,-25.888617,tgf beta signaling pathway,TGFB1 ACVR1 TGFB3 TGFB2 PPP2R1A RBX1 ZFYVE16 ROCK1 ZFYVE9 ROCK2 TNF COMP CDH1 MYC E2F4 E2F5 MAP3K7 PITX2 SMAD3 CREBBP SMAD2 SMAD5 SMAD4 MAP2K1 SMAD1 FST INHBA GDF5 INHBC INHBB INHBE GDF7 SMAD7 GDF6 SMAD6 SMAD9 PROC TFDP1 TAB1 NODAL AMHR2 CUL1 CHRD LTBP1 SKP1 RHOA SMURF2 SMURF1 BMP8B BMP8A TGFBR1 BMP7 TGFBR2 ACVR2B ACVR2A BMP6 BMP5 BMP4 RBL1 SP1 BMP2 RBL2 ID1 ID3 IFNG ID2 ID4 BMPR1A BMPR1B ACVRL1 BMPR2 SAR1A NR2C2 AMH SKIL LEFTY2 LEFTY1 NOG CDKN2B PPP2CA DCN RPS6KB2 RPS6KB1 PPP2R2C THBS1 PPP2R2B PPP2R2A ACVR1C THBS3 ACVR1B THBS2 THBS4 PPP2CB PPP2R1B EP300 MAPK3 MAPK1 
30.18096,-24.950617,the 41bb-dependent immune response,ATF2 RELA MAP2K3 JUN TRAF2 IL2 MAPK14 IL4 IFNG TNFRSF9 TNFSF9 MAP3K5 MAP2K6 
30.577812,-26.053902,the co-stimulatory signal during t-cell activation,CD86 TRB TRA CD80 PTPN11 CD3G CD3E CD3D LCK PIK3R1 PIK3CA HLA-DRA CD28 CTLA4 GRB2 CD247 ITK ICOS ICOSLG HLA-DRB1 
32.129627,-26.466824,the igf-1 receptor and longevity,IRS1 SHC1 PDPK1 IGF1 SOD3 FOXO3 IGF1R SOD1 SOD2 CAT PIK3R1 PIK3CA AKT1 HRAS GRB2 SOS1 
31.455574,4.459105,the information processing pathway at the ifn beta enhancer,CREBBP SMARCC1 SMARCC2 JUN SMARCE1 GTF3A ARID1A GTF2F1 SMARCA4 IRF1 KAT2B IRF4 IRF5 IRF2 IRF3 IRF6 IRF7 ATF2 GTF2A1 SMARCD1 RELA SMARCB1 GTF2B HMGB1 GTF2E1 NR3C1 ACTB POLR2A IFNB1 
32.448883,-25.665638,the prc2 complex sets long-term gene silencing through modification of histone tails,PHC1 SUZ12 EED HDAC1 CBX4 HDAC2 RING1 H3F3A H3F3B BMI1 YY1 RBBP4 RBBP7 EZH2 
31.553541,3.8507679,thrombin signaling and protease-activated receptors,ARFGEF2 RHOA PPP1R12B ARFGEF1 F2R GBF1 PRKCB F2 PRKCA GNB1 PIK3R1 PIK3CA GNAQ F2RL3 PLCB1 ROCK1 ADCY1 GNAI1 CYTH4 CYTH3 GNGT1 GNA12 GNA13 PTK2B MAP3K7 CYTH2 CYTH1 
29.868107,-24.863241,tnf/stress related signaling,MAP2K4 MAP4K2 MAP3K1 MAP2K3 JUN ATF1 CHUK CRADD TRADD TNF TRAF2 TNFRSF1A TANK MAPK14 IKBKB MAPK8 BAG4 CASP2 RIPK1 IKBKG MAP4K4 MAP2K6 MAP2K7 
29.667444,-23.33259,tnfr1 signaling pathway,MAP2K4 CRADD TRADD LMNB1 TNF TRAF2 TNFRSF1A LMNB2 MADD LMNA CASP8 BAG4 CASP2 CASP3 FADD RIPK1 BIRC3 
32.147675,-26.204351,tnfr2 signaling pathway,NFKBIA RELA MAP3K1 TRAF1 TNFAIP3 LTA TRAF3 TRAF2 RIPK1 MAP3K14 TANK TNFRSF1B 
31.765774,-24.587044,toll-like receptor pathway,MAP2K4 MAP3K1 MAP2K3 JUN PPARA CHUK EIF2AK2 FOS TIRAP MAPK14 TLR2 MYD88 NFKBIA ECSIT TOLLIP TRAF6 TLR9 TLR7 TAB2 TLR6 MAP3K14 TAB1 TLR4 TLR3 RELA LY96 ELK1 IKBKB MAPK8 IRAK1 CD14 MAP3K7 IKBKG PGLYRP1 MAP2K6 
30.962833,-23.847618,tpo signaling pathway,STAT5B JUN STAT1 SHC1 CSNK2A1 MAP2K1 STAT3 FOS MPL PRKCB PRKCA ELK1 RASA1 PIK3R1 PIK3CA THPO MAPK3 PLCG1 HRAS GRB2 STAT5A RAF1 SOS1 JAK2 
31.125423,-24.127115,transcription factor creb and its extracellular signals,PDPK1 PRKCB PRKCA MAPK14 CREB1 PIK3R1 PIK3CA PRKAR1B PRKAR1A GNAS GRB2 SOS1 CAMK2D SHC1 CAMK2A CAMK2B RPS6KA5 PRKACG RPS6KA1 PRKAR2B PRKAR2A AKT1 MAPK3 MAPK1 HRAS PRKACB CAMK2G 
31.05394,-25.675812,transcription regulation by methyltransferase of carm1,CREBBP NCOA3 PRKACG RXRA CREB1 PRKAR1B PRKAR1A PRKAR2B EP300 PRKAR2A BCL2 CARM1 RARA PRKACB 
32.486374,-26.088331,trefoil factors initiate mucosal healing,RHOA MAP2K2 MAP2K1 APAF1 CHUK BAD PDPK1 GH1 NFKBIA PIK3R1 PIK3CA TFF3 CYCS TFF2 TFF1 GRB2 RAF1 SOS1 RELA SHC1 CTNNB1 EGFR IKBKB GHR MUC2 CASP9 RPS6KA1 CASP6 CASP7 ERBB2 AKT1 MAPK3 CASP3 MAPK1 HRAS IKBKG 
31.848293,-25.996202,trka receptor signaling pathway,NTRK1 SHC1 PDPK1 PRKCB PRKCA NGF PIK3R1 PIK3CA AKT1 PLCG1 HRAS GRB2 SOS1 
32.45483,-26.753086,tsp-1 induced apoptosis in microvascular endothelial cell,JUN GZMA FOS CASP3 FYN CD36 MAPK14 
31.469948,-25.05788,tumor suppressor arf inhibits ribosomal biogenesis,TBX2 RB1 HSP90AA1 CDKN2A UBE2A TWIST1 NFKBIB DNAJB1P1 POLR1A PIK3R1 POLR1B PIK3CA POLR1C E2F1 POLR1D MYC AKT1 HSPA1A ATM RAC1 ABL1 TP53 MDM2 
32.185646,-25.889297,ucalpain and friends in cell spread,ITGA1 ITGB1 RHOA SRC PXN ACTN4 ACTN3 ACTN2 ACTN1 PTK2 ACTA1 CAPNS1 RAC1 CAPN1 SPTAN1 TLN1 EZR 
31.624481,3.831188,vegf hypoxia and angiogenesis,HSP90AA1 NOS3 PDPK1 CAV1 ARNT PRKCB PRKCA VEGFA PTK2 ACTA1 PIK3R1 PIK3CA GRB2 BCAR1 SOS1 SRC FLT1 SHC1 PXN FLT4 CAMK2B HIF1A KNG1 AKT1 VHL KDR BDKRB2 PLCG1 HRAS CSK 
31.76886,-25.853254,visceral fat deposits and the metabolic syndrome,ADIPOQ RXRA LPL PPARG RETN TNF NR3C1 HSD11B1 
31.915659,-25.800726,visual signal transduction,RCVRN PDE6G GUCA1A GNGT2 GRK1 SLC25A18 GNB1 ARRB1 RHO SLC25A22 GNAT1 PDE6B PDE6A 
30.159218,-20.645939,west nile virus,TIAL1 EEF1A1 CASP9 TIA1 CASP6 APAF1 CASP7 CASP3 CYCS 
28.890997,-22.109833,wnt lrp6 signalling,FZD1 LRP6 KREMEN2 WNT8B WNT8A DKK1 DKK2 
29.185514,-22.306513,wnt signaling pathway,TLE1 FBXW11 CTNNBIP1 WNT5A WNT5B PPP2R1A DKK1 DKK2 RBX1 DKK4 SFRP4 SFRP5 TBL1XR1 SFRP2 MAPK10 APC TP53 LEF1 ROCK1 ROCK2 LRP6 LRP5 FZD10 PRKY PRKX NKD1 SFRP1 NKD2 RUVBL1 FRAT1 FRAT2 CCND3 CCND2 WIF1 CCND1 MYC TBL1X TBL1Y MAP3K7 BTRC CER1 SMAD3 FZD2 SIAH1 CREBBP FZD1 SMAD2 PRKCG FZD4 WNT10B WNT10A FZD3 SMAD4 WNT3A FZD6 FZD5 FZD8 FZD7 KREMEN2 FZD9 CSNK1E PRKCA VANGL2 PROC VANGL1 FOSL1 HNF1A CSNK2B TCF7 TAB1 WNT2B CTBP2 CTBP1 CUL1 PSEN1 NLK PORCN PPP3R1 PRKACG PPP3R2 SOX17 PRKACB SKP1 PRKACA RHOA MMP7 CSNK1A1 JUN NFATC4 AXIN2 NFATC3 AXIN1 WNT9A NFATC2 NFATC1 WNT9B PPP2R5D WNT16 SENP2 NFAT5 GSK3B CHD8 WNT8B WNT8A WNT6 PPP3CA PPP3CB WNT11 PPP3CC DVL1 DVL2 DVL3 WNT1 WNT2 WNT3 WNT4 TCF7L2 TCF7L1 APC2 CSNK2A2 CSNK2A1 WNT7A WNT7B CACYBP PPP2CA CSNK1A1L PLCB4 DAAM2 PPP2R2C DAAM1 PLCB2 PLCB3 PPARD PLCB1 CAMK2D HDAC1 CTNNB1 CAMK2A CAMK2B CXXC4 PRICKLE1 PPP2R2B PRICKLE2 PPP2R2A PPP2CB MAPK9 MAPK8 PPP2R1B EP300 RAC3 RAC1 RAC2 CAMK2G 
32.221813,-25.262913,y branching of actin filaments,ARPC1A ACTR3 ACTR2 NCKAP1 ARPC1B WASL CDC42 PSMA7 ARPC3 ARPC4 ARPC2 ABL2 PIR RAC1 WASF2 NCK1 
32.118465,-26.410076,yaci and bcma stimulation of b cell immune responses,TRAF5 TNFRSF13B TNFSF13 TRAF6 TNFRSF17 TRAF3 TRAF2 TNFSF13B 
33.218193,-11.392201,ﬂ-arrestins in gpcr desensitization,EDN1 PPARA F2 DNM1 AGT CXCL12 GNB1 AGTR2 GNAS CHRM1 PTGER1 CCL11 HTR2C FPR1 ADRB2 AP2A1 ADRA1B GNGT1 EDNRA EDNRB ARRB1 CXCR4 P2RY2 ADRBK1 CCL4 CCR5 CCR3 AP2M1 
